"","Catalog.Id","Item.Barcode","Item.Call.Number","Item.Library.Code","Catalog.Title","Catalog.Author","Catalog.Pub.Year","Item.Created.Date","Item.Last.Checkout.Date","NumInhouseUses","NumCheckouts","NumRenewals","Duplicates","Bib.Marc.Subfield.Data","MultiVolume","modelC","MODEL","LiaisonRecommendation"
"1181",2119044,"X002301791","HA37 .E93 G69 1992","ALDERMAN","The handbook of national population censuses.","Goyer, Doreen S.,",1992,"6/30/96","1/1/00",0,0,0,1,"2",TRUE,1373,"0",0
"1182",2109214,"X002315355","HA39 .C6 C48 1992","ALDERMAN","Zhongguo ba shi nian dai tong ji gai ge yu fa zhan /","",1992,"6/30/96","1/1/00",0,0,0,1,"2",TRUE,1373,"0",0
"1183",2114455,"X002309993","HA4551 .Y34 1992","ALDERMAN","Yazhou fa zhan zhong guo jia he di qu jing ji he she hui tong ji zi liao hui bian, 1992 /","",1992,"6/30/96","1/1/00",0,0,0,1,"2",FALSE,1373,"0",0
"1184",2239684,"X002404436","HA19 .D47 1993","ALDERMAN","La politique des grands nombres : histoire de la raison statistique /","DesrosiËres, Alain.",1993,"7/1/96","5/20/98",0,2,0,1,"2",FALSE,1374,"0",0
"1185",987511,"X000470293","HA31 .B7 1914","ALDERMAN","Graphic methods for presenting facts,","Brinton, Willard Cope,",1914,"6/29/96","1/5/05",2,1,0,1,"2",FALSE,1375,"0",0
"1186",986989,"X002241047","HA1633 .P86","ALDERMAN","Nacionalni aspekt popisa stanovni?tva u 1971. godini.","Purivatra, Atif.",1971,"6/29/96","1/1/00",0,2,0,1,"2",FALSE,1376,"0",0
"1187",536288,"X000180275","HA29 .S417","ALDERMAN","Analyzing social data; a statistical orientation","Schuessler, Karl F.",1971,"6/29/96","1/1/00",0,2,0,1,"2",FALSE,1376,"0",0
"1188",123802,"X000499546","HA37 .G7 H333 1982","ALDERMAN","Secondary analysis in social research : a guide to data sources and methods with examples /","Hakim, Catherine.",1982,"6/28/96","12/7/99",0,1,0,1,"2",FALSE,1377,"0",0
"1189",160790,"X000355003","HA29 .F575","ALDERMAN","Public program analysis : a new categorical data approach /","Forthofer, Ron N.,",1981,"6/28/96","1/1/00",0,1,0,1,"2",FALSE,1379,"0",0
"1190",2286532,"X002311811","HA4686 .A4 1986d v.8","ALDERMAN","al-Ta?d?d al-?amm, 1986 : kha???i? al-munsha??t.","",1991,"7/1/96","1/1/00",0,0,0,1,"2",TRUE,1380,"0",0
"1191",2104460,"X002250122","HA4590.6 .A4 1991","ALDERMAN","Preliminary report, population census, 1991 = Pr?thamika ripor?a, ?dama?um?r?, 1991.","",1991,"6/30/96","1/1/00",0,0,0,1,"2",FALSE,1381,"0",0
"1192",533567,"X000468483","HA33 .M67","ALDERMAN","The significance test controversy; a reader,","Morrison, Denton E.",1970,"6/29/96","1/1/00",0,2,0,1,"2 5",FALSE,1384,"0",0
"1193",642362,"X000867194","HA1201.5 1980 .K363 1980","ALDERMAN","Population census 1980 detailed data based on a 2 % representative sample /","",1980,"6/29/96","1/1/00",0,1,0,1,"2",FALSE,1385,"0",0
"1194",120047,"X000481721","HA1448 .G37 N33 1980","ALDERMAN","Narodnoe khozi?a?stvo Gruzinsko? SSR za 60 let : i?ubile?ny? statisticheski? ezhegodnik /","",1980,"6/28/96","1/1/00",1,1,0,1,"2",FALSE,1386,"0",0
"1195",304334,"X000153117","HA29 .E54","ALDERMAN","Management handbook of decision-oriented statistics /","Enrick, Norbert Lloyd,",1980,"6/28/96","1/1/00",0,1,0,1,"2",FALSE,1386,"0",0
"1196",192262,"X000357867","HA31 .H83 1980","ALDERMAN","Regression and econometric methods /","Huang, David S.,",1980,"6/28/96","1/1/00",1,1,0,1,"2",FALSE,1386,"0",0
"1197",140589,"X001912127","HA4570.9 .K36","ALDERMAN","Population projections for Nepal, 1970-2000 /","Kansakar, Vidya Bir Singh.",1980,"6/28/96","1/1/00",0,1,0,1,"2",FALSE,1386,"0",0
"1198",2223382,"X002331006","HA1374 .S67 1990","ALDERMAN","Sommario storico di statistiche sulla popolazione, anni 1951-87 /","",1990,"7/1/96","1/1/00",0,0,0,1,"2",FALSE,1387,"0",0
"1199",2268898,"X002334667","HA1730.5 .A37 1990","ALDERMAN","Proceedings of Pre-1991 Population & Housing Censuses Workshop : 19-20 July, 1990 /","Pre-1991 Population & Housing Censuses Workshop",1990,"7/1/96","1/1/00",0,0,0,1,"2",FALSE,1387,"0",0
"1200",2262682,"X002441403","HA4684 .A4 1986b v.1","ALDERMAN","al-Ta?d?d al-??mm, 1986 : al-?a?r al-sh?mil, kha???i? al-sukk?n.","",1990,"7/1/96","1/1/00",0,0,0,3,"2",TRUE,1387,"0",0
"1201",2410062,"X032019139","HA4686 .A4 1986a v.1","ALDERMAN","al-Ta?d?d al-??mm, 1986.","",1990,"7/1/96","1/1/00",7,0,0,27,"2",TRUE,1387,"0",0
"1202",2411389,"X032019105","HA4686 .A4 1986b v.1","ALDERMAN","al-Ta?d?d al-??mm, 1986 : al-?a?r al-sh?mil, kha???i? al-sukk?n.","",1990,"7/1/96","1/1/00",0,0,0,25,"2",TRUE,1387,"0",0
"1203",1842192,"X001982094","HA155 .E26 1990","ALDERMAN","The Economist book of vital world statistics /","",1990,"6/30/96","1/1/00",2,0,0,1,"2",FALSE,1389,"0",0
"1204",1997212,"X002161454","HA29.5 .C5 C578 1990","ALDERMAN","Zhongguo tong ji zhi neng di li lun yu shi jian /","",1990,"6/30/96","1/1/00",2,0,0,1,"2",TRUE,1389,"0",0
"1205",1648163,"X001730162","HA37 .G7 M665 1990","ALDERMAN","Sources of unofficial UK statistics /","Mort, David.",1990,"6/30/96","1/1/00",0,0,0,1,"2",FALSE,1389,"0",0
"1206",1805798,"X001902016","HA37 .L92 A47 1990","ALDERMAN","Statistique et Ètudes Èconomiques au Luxembourg : histoire et problËmes /","Als, Georges.",1990,"6/30/96","1/1/00",1,0,0,1,"2",FALSE,1389,"0",0
"1207",2095437,"X002285564","HA4590.6 .R34 1990","ALDERMAN","Bangladesh pourashava (municipal) statistics /","Rahman, Mohammad Shafiqur.",1990,"6/30/96","1/1/00",0,0,0,1,"2",FALSE,1389,"0",0
"1208",2152386,"X002301651","HA757 .H35 1993","ALDERMAN","Handbuch der Wahldaten Lateinamerikas und der Karibik /","",1993,"7/1/96","6/9/97",0,3,0,1,"2",FALSE,1390,"0",0
"1209",303319,"X000042453","HA217 .J8","ALDERMAN","The book of American rankings /","Judge, Clark S.,",1979,"6/28/96","1/1/00",0,1,0,1,"2",FALSE,1391,"0",0
"1210",2225512,"X002256507","HA4684 .A4 1986d v.2","ALDERMAN","al-Ta?d?d al-??mm, 1986.","",1989,"7/1/96","1/1/00",6,0,0,6,"2",TRUE,1392,"0",0
"1211",1768259,"X001841035","HA1224 .E57 1989","ALDERMAN","Les Entreprises ‡ l'Èpreuve des annÈes 80 : Ètude du systËme productif franÁais.","",1989,"6/30/96","1/1/00",1,0,0,1,"2",FALSE,1393,"0",0
"1212",1774076,"X001651500","HA17 .S7 1989","ALDERMAN","Statisticheski? slovar? /","",1989,"6/30/96","1/1/00",1,0,0,1,"2",FALSE,1393,"0",0
"1213",1661761,"X001736526","HA37 .G7 G68 1989b","ALDERMAN","Government economic statistics : a scrutiny report /","",1989,"6/30/96","1/1/00",1,0,0,1,"2",TRUE,1393,"0",0
"1214",1895755,"X002006281","HA39 .I4 I47 1989","ALDERMAN","Handbook on civil registration.","India. Office of the Registrar General.",1989,"6/30/96","1/1/00",0,0,0,1,"2",FALSE,1393,"0",0
"1215",1674001,"X001775523","HA4587 .R62 G64 1989","ALDERMAN","Population geography of a backward region of Rohilkhand /","Goel, Navratna Prakash.",1989,"6/30/96","1/1/00",0,0,0,1,"2",TRUE,1393,"0",0
"1216",1671158,"X001775465","HA4590.5 .R85 1989","ALDERMAN","The state of population in Pakistan, 1987 /","Rukanuddin, Abdul Razzaque.",1989,"6/30/96","1/1/00",0,0,0,1,"2",FALSE,1393,"0",0
"1217",1830094,"X001904428","HA4620.5 .C46 1989","ALDERMAN","Zhongguo Taiwan sheng, Xianggang di qu he Xinjiapo, Nan Chaoxian, Taiguo jing ji he she hui tong ji zi liao hui bian, 1988 /","",1989,"6/30/96","1/1/00",0,0,0,1,"2",FALSE,1393,"0",0
"1218",563349,"X000305506","HA29 .K3185 1968","ALDERMAN","Economic statistics and econometrics; an introduction to quantitative economics","Kane, Edward J.",1968,"6/29/96","1/1/00",0,2,0,1,"2 3",FALSE,1394,"0",0
"1219",1747324,"X032010154","HA1405 .D45 1988","ALDERMAN","DÈmographie : la Belgique en 43 arrondissements /","",1988,"6/30/96","1/1/00",1,0,0,1,"2",FALSE,1396,"0",0
"1220",1375241,"X001614264","HA1444 .I59 1988","ALDERMAN","My i planeta : t?sifry i fakty /","Ioffe, I?Akov Abramovich.",1988,"6/30/96","1/1/00",0,0,0,1,"2",FALSE,1396,"0",0
"1221",1255860,"X001360844","HA32 .S68 1988","ALDERMAN","Statistical data bank systems : socio-economic database and model building in Japan /","",1988,"6/30/96","1/1/00",1,0,0,1,"2",FALSE,1396,"0",0
"1222",1371919,"X001615197","HA37 .G7 C66 1988","ALDERMAN","Ethnic record keeping and monitoring in service delivery /","Connelly, Naomi.",1988,"6/30/96","1/1/00",0,0,0,1,"2",TRUE,1396,"0",0
"1223",1255323,"X001360953","HA37 .G7 G55 1988","ALDERMAN","Local government /","Gillespie, J. M.,",1988,"6/30/96","1/1/00",0,0,0,1,"2",TRUE,1396,"0",0
"1224",1342304,"X001562287","HA4585 .M34 1988","ALDERMAN","Concepts and procedures in Indian census : a reappraisal /","Mahatme, Anand,",1988,"6/30/96","1/1/00",0,0,0,1,"2",FALSE,1396,"0",0
"1225",2104322,"X002250569","HA4587 .O74 D57 1988","ALDERMAN","District level population projections of Orissa, West Bengal, and Goa, Daman & Diu, 1981-2001 /","",1988,"6/30/96","1/1/00",1,0,0,1,"2",TRUE,1396,"0",0
"1226",1343338,"X001105120","HA4590.6 .H68 1988","ALDERMAN","Household and housing structure in Bangladesh : evidences from demographic sample survey, 1982.","",1988,"6/30/96","1/1/00",0,0,0,1,"2",FALSE,1396,"0",0
"1227",1670201,"X001958144","HA1366 .C6 1989","ALDERMAN","La ""Conta delle anime"" : popolazioni e registri parrocchiali : questioni di metodi ed esperienze /","",1989,"6/30/96","3/1/99",2,1,0,1,"2",FALSE,1397,"0",0
"1228",1323441,"X001455732","HA4638 .W84 T83 1987","ALDERMAN","Wuxi City and Wuxi County : an analysis of a pilot census /","Tuan, Chi-Hsien.",1987,"6/30/96","4/14/99",0,1,0,1,"2",TRUE,1398,"0",0
"1229",986922,"X001199889","HA29 .K353","ALDERMAN","Statistical analysis for business and economics","Kazmier, Leonard J.",1967,"6/29/96","1/1/00",1,2,0,1,"2",FALSE,1399,"0",0
"1230",311535,"X000150579","HA37 .I687 M33","ALDERMAN","Social statistics in Ireland : a guide to their sources and uses /","McGilvray, James.",1977,"6/28/96","1/1/00",1,1,0,1,"2",FALSE,1400,"0",0
"1231",1304782,"X001488412","HA1378 .N3 N27 1987","ALDERMAN","Napoli dati : statistiche sociali, documentazione e fonti /","",1987,"6/30/96","1/1/00",0,0,0,1,"2",FALSE,1402,"0",0
"1232",1827595,"X001843522","HA1451.5 .P6 1986","ALDERMAN","Sytuacja bytowa rodzin wielodzietnych i niepe?nych z dzie?mi.","Poland. G?Ûwny Urz?d Statystyczny.",1987,"6/30/96","1/1/00",1,0,0,1,"2",FALSE,1402,"0",0
"1233",1248855,"X001339225","HA195 .H35 1987","ALDERMAN","Researcher's guide to United States census availability, 1790-1910 /","Hamilton, Ann B.",1987,"6/30/96","1/1/00",0,0,0,1,"2",FALSE,1402,"0",0
"1234",1682546,"X001776356","HA29.5 .P58 K67 1987","ALDERMAN","Dok?adno?? danych w badaniach spoecznych = Tochnost? dannykh v sot?sial?nykh issledovanii?akh = Data accuracy in social surveys /","Kordos, Jan.",1987,"6/30/96","1/1/00",1,0,0,1,"2",FALSE,1402,"0",0
"1235",1350874,"X001602553","HA35.3 .B36 Q33 1987","ALDERMAN","Social science research in Bangladesh /","Qadir, S. A.",1987,"6/30/96","1/1/00",0,0,0,1,"2",FALSE,1402,"0",0
"1236",1944717,"X031923766","HA4587 .O74 A35 1987 v.1","ALDERMAN","Adivasi atlas of Orissa /","",1987,"6/30/96","1/1/00",0,0,0,1,"2",TRUE,1402,"0",0
"1237",1787708,"X001878748","HA4590.5 .A435 1981 v.1","ALDERMAN","Handbook of population census data.","",1987,"6/30/96","1/1/00",1,0,0,4,"2",TRUE,1402,"0",0
"1238",1370506,"X001614880","HA4717 1975 .R43 1987","ALDERMAN","Recensement gÈnÈral de la population, 1975 : analyse abregÈe /","",1987,"6/30/96","1/1/00",0,0,0,1,"2",FALSE,1402,"0",0
"1239",715044,"X001226923","HA4587 .U8 U87 1987","ALDERMAN","Uttar Pradesh in statistics /","",1987,"6/29/96","1/1/00",0,0,0,1,"2",FALSE,1403,"0",0
"1240",322608,"X000682281","HA37 .G7 G56","ALDERMAN","Population and emigration /","Glass, D. V. (David Victor),",1976,"6/28/96","1/1/00",0,1,0,1,"2",TRUE,1404,"0",0
"1241",1317347,"X001502029","HA1201.5 .D3 1986","ALDERMAN","Data of the 1984 Hungarian microcensus /","",1986,"6/30/96","1/1/00",0,0,0,1,"2",FALSE,1405,"0",0
"1242",1375815,"X001615420","HA1374 .A19 1986","ALDERMAN","A met‡ decennio : riflessioni e dati sull'Italia dall'80 all'85.","",1986,"6/30/96","1/1/00",0,0,0,1,"2",FALSE,1405,"0",0
"1243",1292661,"X001462295","HA4728 .A4 1985","ALDERMAN","Recensement gÈnÈral de la population du 10 au 20 dÈcembre 1985 : rÈsultats provisoires /","",1986,"6/30/96","1/1/00",0,0,0,1,"2",FALSE,1405,"0",0
"1244",783229,"X001247129","HA4553 .S78 1986","ALDERMAN","Student research abstracts in population studies /","",1986,"6/29/96","1/1/00",0,0,0,1,"2",FALSE,1406,"0",0
"1245",709400,"X001228928","HA4570.8 .A4 1963","ALDERMAN","Sri Lanka census of population, 1963 : [all island tables].","",1986,"6/29/96","1/1/00",0,0,0,1,"2",FALSE,1406,"0",0
"1246",710052,"X001243915","HA4570.8 .R47 1986","ALDERMAN","Report of the Registrar General on vital statistics, 1981, Sri Lanka.","",1986,"6/29/96","1/1/00",0,0,0,1,"2",FALSE,1406,"0",0
"1247",787527,"X001256114","HA4581.5 1981e","ALDERMAN","Urban growth in India, 1951-81 : a statistical analysis.","Sinha, Sunil Kumar.",1986,"6/29/96","1/1/00",0,0,0,1,"2",FALSE,1406,"0",0
"1248",104500,"X001084938","HA36 .S5 1986b","ALDERMAN","Official statistics /","Slattery, Martin.",1986,"6/28/96","1/1/00",0,0,0,1,"2",FALSE,1407,"0",0
"1249",541780,"X000558024","HA29 .C6","ALDERMAN","Statistical reasoning and procedures","Clarke, Robert B.",1965,"6/29/96","1/1/00",0,2,0,1,"2",FALSE,1410,"0",0
"1250",4463599,"X001109114","HA4635 .C47 1985","ALDERMAN","Zhongguo she hui tong ji zi liao /","",1985,"7/1/96","1/1/00",0,0,0,1,"2",FALSE,1411,"0",0
"1251",1236303,"X001336910","HA1195 .H57 1985","ALDERMAN","Historick· statistick· ro?enka ?SSR /","",1985,"6/30/96","1/1/00",0,0,0,1,"2",FALSE,1412,"0",0
"1252",1237336,"X001319216","HA29 .F345 1985","ALDERMAN","Statisticheskie algoritmy v sot?siologicheskikh issledovanii?akh /","Felinger, A. F. (Arno Filippovich)",1985,"6/30/96","1/1/00",0,0,0,1,"2",FALSE,1412,"0",0
"1253",1317767,"X032403901","HA4590.6 .A4 1981c v.1","ALDERMAN","Bangladesh population census, 1981.","",1985,"6/30/96","1/1/00",0,0,0,1,"2",TRUE,1412,"0",0
"1254",1298675,"X001490736","HA4724 .A4 1977 v.1","ALDERMAN","Recensement gÈnÈral de la population 1977 : rÈsultats dÈfinitifs.","",1985,"6/30/96","1/1/00",0,0,0,2,"2",TRUE,1412,"0",0
"1255",1286994,"X001461916","HA767 .C65 E77 1985","ALDERMAN","EstadÌsticas del territorio de Colima /","",1985,"6/30/96","1/1/00",0,0,0,1,"2",FALSE,1412,"0",0
"1256",765408,"X001284086","HA1 .A38 A15 t.49","ALDERMAN","Statistika, veroi?atnost?, ?konomika /","",1985,"6/29/96","1/1/00",0,0,0,1,"2",TRUE,1413,"0",0
"1257",777574,"X001255941","HA1166 .W54 1985 v.1","ALDERMAN","Digest of Welsh historical statistics /","Williams, L. J.,",1985,"6/29/96","1/1/00",0,0,0,2,"2",TRUE,1413,"0",0
"1258",688320,"X001162060","HA1226 .C67 1985","ALDERMAN","La population franÁaise : Èvolution passÈe perspectives ‡ moyen terme /","Costes, J. M.",1985,"6/29/96","1/1/00",0,0,0,1,"2",FALSE,1413,"0",0
"1259",769773,"X001149264","HA37 .G7 M665 1985","ALDERMAN","Sources of unofficial UK statistics /","Mort, David.",1985,"6/29/96","1/1/00",0,0,0,1,"2",FALSE,1413,"0",0
"1260",698344,"X001205269","HA988 .P35 C68 1985","ALDERMAN","Paran·, mapas de habitantes, 1798-1830 /","Costa, Iraci del Nero da.",1985,"6/29/96","1/1/00",0,0,0,1,"2",TRUE,1413,"0",0
"1261",72315,"X001025144","HA1214 1982-K v.1","ALDERMAN","Recensement gÈnÈral de la population de 1982 : rÈsultats du sondage au 1/4 : population, emploi, mÈnages, familles, logements : [fascicules dÈpartementaux].","",1985,"6/28/96","1/1/00",3,0,0,1,"2",TRUE,1414,"0",0
"1262",98160,"X001107235","HA1455 .S65 1985 cz.1","ALDERMAN","Spis ludno?ci i mieszka? metod? reprezentacyjn? z dnia 6 XII 1984 r. /","",1985,"6/28/96","1/1/00",0,0,0,2,"2",TRUE,1414,"0",0
"1263",93440,"X001033715","HA155 .V83 1985","ALDERMAN","World population projections, 1985 : short-and long-term estimates by age and sex : with related demographic statistics /","Vu, My T.,",1985,"6/28/96","1/1/00",0,0,0,1,"2",FALSE,1414,"0",0
"1264",104598,"X001076256","HA29 .I55 1985","ALDERMAN","My i planeta : t?sifry i fakty /","Ioffe, I?Akov Abramovich.",1985,"6/28/96","1/1/00",0,0,0,1,"2",FALSE,1414,"0",0
"1265",108075,"X001076285","HA29.5 .R9 M57 1985","ALDERMAN","Gruppirovki v sot?sial?no-?konomicheskikh issledovanii?akh : metody postroenii?a i analiza /","Mirkin, B. G. (Boris Grigor?evich)",1985,"6/28/96","1/1/00",0,0,0,1,"2",FALSE,1414,"0",0
"1266",11817,"X000921156","HA32 .J46 1985","ALDERMAN","Through the maze : statistics with computer applications /","Jendrek, Margaret Platt.",1985,"6/28/96","1/1/00",2,0,0,1,"2",FALSE,1414,"0",0
"1267",98458,"X001034697","HA4632 .C5 1985","ALDERMAN","China : a statistics survey in 1985 /","",1985,"6/28/96","1/1/00",2,0,0,1,"2",FALSE,1414,"0",0
"1268",100121,"X000993974","HA4701 .Z9 N384 1985","ALDERMAN","The population of Natal/Kwazulu, 1904-2010 /","Grobbelaar, J. A. (James Arthur)",1985,"6/28/96","1/1/00",0,0,0,1,"2",FALSE,1414,"0",0
"1269",91498,"X000952866","HA984 .L83 1985","ALDERMAN","Brazil : a handbook of historical statistics /","Ludwig, Armin K.",1985,"6/28/96","1/1/00",2,0,0,1,"2",FALSE,1414,"0",0
"1270",542075,"X000145535","HA29 .F5 1958","ALDERMAN","Statistical methods for research workers.","Fisher, Ronald Aylmer,",1958,"6/29/96","6/29/00",0,2,0,1,"2 5 16",FALSE,1415,"0",0
"1271",2513972,"X002705909","HA155 .A7 1956","ALDERMAN","Statistical methods /","Arkin, Herbert,",1964,"7/1/96","1/1/00",1,2,0,1,"2",FALSE,1416,"0",0
"1272",2524874,"X001361458","HA4631.5 .I5712 1984","ALDERMAN","Shi yi ren kou de pu cha : Zhongguo 1982 nian ren kou pu cha Beijing guo ji tao lun hui lun wen ji /","International Seminar on China's 1982 Population Census",1984,"7/1/96","1/1/00",0,0,0,1,"2",FALSE,1417,"0",0
"1273",2072219,"X004213763","HA4587 .W47 C462 1984","ALDERMAN","Primary census abstract of scheduled castes and scheduled tribes, Series 23, West Bengal : paper of 1 of 1983 /","",1984,"6/30/96","1/1/00",0,0,0,1,"2",TRUE,1418,"0",0
"1274",670440,"670440-1002","HA3184 .B55 1984","ALDERMAN","New Zealand, a handbook of historical statistics /","Bloomfield, G. T. (Gerald Taylor)",1984,"6/29/96","1/1/00",0,0,0,1,"2",FALSE,1419,"0",0
"1275",648688,"X000737051","HA32 .K58 1984","ALDERMAN","Computer usage for social scientists /","Klieger, Douglas M.",1984,"6/29/96","1/1/00",0,0,0,1,"2",FALSE,1419,"0",0
"1276",61096,"X000948037","HA1151.5 1981","ALDERMAN","Key statistics for urban areas, Scotland : localities.","",1984,"6/28/96","1/1/00",1,0,0,1,"2",FALSE,1420,"0",0
"1277",79870,"X000993940","HA1214 1982m","ALDERMAN","Recensement gÈnÈral de la population de 1982 : structure de la population totale /","Dinh, Quang Chi.",1984,"6/28/96","1/1/00",2,0,0,1,"2",FALSE,1420,"0",0
"1278",70907,"X001057328","HA1374 .B47 1984","ALDERMAN","Il volto statistico dell'Italia /","Bergonzini, Luciano.",1984,"6/28/96","1/1/00",0,0,0,1,"2",FALSE,1420,"0",0
"1279",64496,"X032013070","HA29 .J23 1984","ALDERMAN","Using published data : errors and remedies /","Jacob, Herbert,",1984,"6/28/96","1/1/00",0,0,0,1,"2 19",FALSE,1420,"0",0
"1280",52921,"X001062987","HA4702 .A4 1982","ALDERMAN","1982 population census : a preliminary assessment.","",1984,"6/28/96","1/1/00",1,0,0,1,"2",FALSE,1420,"0",0
"1281",987555,"X000207797","HA33 .M83 1969","ALDERMAN","Multiple regression approach; research design in the behavioral sciences","",1969,"6/29/96","10/20/98",0,3,0,1,"2 14",FALSE,1421,"0",0
"1282",86721,"X031224340","HA4693 .A4 1979 V.1","ALDERMAN","Kenya population census, 1979.","",1981,"6/28/96","6/4/99",0,1,0,1,"2",TRUE,1422,"0",0
"1283",605126,"X000201241","HA29 .L388","ALDERMAN","Elementary statistics in social research.","Levin, Jack,",1973,"6/29/96","1/1/00",0,1,0,1,"2",FALSE,1423,"0",0
"1284",1312339,"X001491662","HA1234 1983","ALDERMAN","Die Volksz‰hlung /","",1983,"6/30/96","1/1/00",0,0,0,1,"2",FALSE,1424,"0",0
"1285",1610767,"X001662668","HA4590.5 .M35 1983","ALDERMAN","Main findings of 1981 population census.","",1983,"6/30/96","1/1/00",0,0,0,1,"2",FALSE,1424,"0",0
"1286",647221,"X000688406","HA202 .A686 1983 v.1","ALDERMAN","Population abstract of the United States /","Andriot, John L.",1983,"6/29/96","1/1/00",0,0,0,2,"2",TRUE,1425,"0",0
"1287",657933,"X000764494","HA29 .O79 1983","ALDERMAN","Test item bias /","Osterlind, Steven J.",1983,"6/29/96","1/1/00",0,0,0,1,"2 3 19",FALSE,1425,"0",0
"1288",779524,"X031996053","HA4731 .O4 1983","ALDERMAN","Nigeria's demographic delusion : a critical examination of the census controversy : an inaugural lecture delivered at the University of Lagos on Friday, 10 October, 1980 /","Olusanya, P. Olufemi.",1983,"6/29/96","1/1/00",0,0,0,1,"2",FALSE,1425,"0",0
"1289",43982,"X031995908","HA1214 1982","ALDERMAN","Recensement gÈnÈral de la population de 1982 : population de la France (mÈtropole et dÈpartements d'outre-mer) : rÈgions, dÈpartements, arrondissements, cantons, communes.","",1983,"6/28/96","1/1/00",0,0,0,1,"2",FALSE,1426,"0",0
"1290",38335,"X000914636","HA1214 1982e","ALDERMAN","Recensement gÈnÈral de la population de 1982 : mÈtropole : tableaux statistiques de population lÈgale : population lÈgale des communes de plus de 2000 habitants /","",1983,"6/28/96","1/1/00",0,0,0,1,"2",FALSE,1426,"0",0
"1291",3869,"X000626333","HA1444 .N37 1983","ALDERMAN","Naselenie SSSR : spravochnik /","",1983,"6/28/96","1/1/00",0,0,0,1,"2",FALSE,1426,"0",0
"1292",47307,"X000952180","HA29.5 .G4 B47 1983","ALDERMAN","Die Entstehung der empirischen Sozialforschung : zum Apriori und zur Sozialgeschichte der quantifizierenden Sozialanalyse /","Berner, Hermann.",1983,"6/28/96","1/1/00",0,0,0,1,"2",FALSE,1426,"0",0
"1293",10429,"X000861928","HA3006 .H336 1983","ALDERMAN","A guide to Australian economic and social statistics /","Hagger, A. J.",1983,"6/28/96","1/1/00",1,0,0,1,"2",FALSE,1426,"0",0
"1294",59018,"X000978472","HA37 .E852 O69 1983","ALDERMAN","Opyt provedenii?a perepise? naselenii?a i zhilogo fonda v stranakh-chlenakh S?V v 1975-1981 gg. /","",1983,"6/28/96","1/1/00",0,0,0,1,"2",FALSE,1426,"0",0
"1295",6773,"X000950103","HA37 .G3 Z8713 1983","ALDERMAN","Statistical information system of the federation /","",1983,"6/28/96","1/1/00",0,0,0,1,"2",FALSE,1426,"0",0
"1296",11499,"X000963999","HA37 .G32 B3415 1983","ALDERMAN","150 Jahre amtliche Statistik in Bayern von 1833 bis 1983 : zum 150j‰hrigen Amtsjubil‰um /","",1983,"6/28/96","1/1/00",0,0,0,1,"2",FALSE,1426,"0",0
"1297",66652,"X001063088","HA37 .N63 P76 1983","ALDERMAN","Productions and uses of statistics in Nigeria /","",1983,"6/28/96","1/1/00",1,0,0,1,"2",FALSE,1426,"0",0
"1298",61832,"X000867614","HA37 .S722 A84 1983","ALDERMAN","ASGS, teorii?a i praktika /","",1983,"6/28/96","1/1/00",0,0,0,1,"2",FALSE,1426,"0",0
"1299",30881,"X000320272","HA4635 .D47 1983","ALDERMAN","The coterminal characteristics of political units and economic regions in China /","Dernberger, Robert F.",1983,"6/28/96","1/1/00",1,0,0,1,"2",FALSE,1426,"0",0
"1300",28915,"X032019044","HA4636 .D87 1983","ALDERMAN","Provinzstatistik der Volksrepublik China = Provincial statistics of the People's Republic of China /","D¸rr, Heiner.",1983,"6/28/96","1/1/00",0,0,0,1,"2",FALSE,1426,"0",0
"1301",39992,"X001066968","HA918.9 .A4 1982","ALDERMAN","RÈsultats du recensement de la population des dÈpartements d'outre-mer, 9 mars 1982 : Martinique /","",1983,"6/28/96","1/1/00",0,0,0,1,"2",FALSE,1426,"0",0
"1302",986494,"X000495065","HA29 .G9 1973","ALDERMAN","Fundamental statistics in psychology and education","Guilford, J. P. (Joy Paul),",1973,"6/29/96","6/17/98",0,3,0,1,"2",FALSE,1427,"0",0
"1303",690261,"X001239922","HA4723 .A52 1984","ALDERMAN","""Analyse rÈgionale du recensement de 1970"" /","",1984,"6/29/96","2/26/99",0,1,0,1,"2",FALSE,1428,"0",0
"1304",562840,"X000304950","HA37 .R95 T74","ALDERMAN","Soviet economic statistics.","Treml, Vladimir G.",1972,"7/1/96","1/1/00",0,1,0,1,"2",TRUE,1430,"0",0
"1305",1821545,"X001196439","HA4587 .R34 P66 1972","ALDERMAN","Population statistics, Rajasthan.","",1972,"6/30/96","1/1/00",0,1,0,1,"2",FALSE,1431,"0",0
"1306",757696,"X001244971","HA37 .I4 N38 v.1","ALDERMAN","Indian census through a hundred years","Natarajan, Dandapani,",1972,"6/29/96","1/1/00",1,2,0,2,"2",TRUE,1432,"0",0
"1307",1368810,"X001304958","HA1214 1982n","ALDERMAN","Recensement gÈnÈral de la population de 1982 : villes et agglomÈrations urbaines : dÈlimitation 1982 : Èvolutions dÈmographiques 1975-1982 et 1968-1975.","Institut national de la statistique et des Ètudes Èconomiques (France)",1982,"6/30/96","1/1/00",1,0,0,1,"2",FALSE,1433,"0",0
"1308",1312207,"X001505731","HA1559 .S65 P47 1982","ALDERMAN","Estudio sobre la sociedad soriana en el siglo XVIII : los censos y distribuciÛn de la poblaciÛn /","PÈrez de Guinea, MarÌa del Carmen.",1982,"6/30/96","1/1/00",0,0,0,1,"2",FALSE,1433,"0",0
"1309",1305531,"X001489693","HA29.5 .G4 T45 1982","ALDERMAN","Numerische Datenverarbeitung f¸r Historiker : eine praxisorientierte Einf¸hrung in die Quantitative Arbeitsmethode und in SPSS (Statistical Package for the Social Sciences) /","Thaller, Manfred,",1982,"6/30/96","1/1/00",0,0,0,1,"2",TRUE,1433,"0",0
"1310",1279098,"X001339609","HA4587 .G84 F56 1982","ALDERMAN","Final population totals, series 5, Gujarat : paper 2 of 1981 /","",1982,"6/30/96","1/1/00",0,0,0,1,"2",TRUE,1433,"0",0
"1311",648411,"X000737028","HA1184 .B74 1982","ALDERMAN","Die Umgangssprachen in Altˆsterreich zwischen Agitation und Assimilation : die Sprachenstatistik in den zisleithanischen Volksz‰hlungen, 1880 bis 1910 /","Brix, Emil.",1982,"6/29/96","1/1/00",0,0,0,1,"2",FALSE,1434,"0",0
"1312",656979,"X032008897","HA29.5 .R9 V64 1982","ALDERMAN","Statistika rasskazyvaet /","Volodarski?, L. M. (Lev Markovich)",1982,"6/29/96","1/1/00",0,0,0,1,"2",TRUE,1434,"0",0
"1313",762943,"X001291582","HA4587 .M33 P74 1982","ALDERMAN","Primary census abstract of scheduled castes and scheduled tribes, series 12, Maharashtra : paper 2 of 1982 /","",1982,"6/29/96","1/1/00",0,0,0,1,"2",FALSE,1434,"0",0
"1314",27665,"X000916429","HA29 .M9 1982","ALDERMAN","My i planeta : t?sifry i fakty /","",1982,"6/28/96","1/1/00",0,0,0,1,"2",FALSE,1435,"0",0
"1315",12834,"X001106526","HA4587 .M365 T74 1982","ALDERMAN","Tribal benchm[a]rk survey : Manipur East District.","",1982,"6/28/96","1/1/00",0,0,0,1,"2",TRUE,1435,"0",0
