"","Catalog.Id","Item.Barcode","Item.Call.Number","Item.Library.Code","Catalog.Title","Catalog.Author","Catalog.Pub.Year","Item.Created.Date","Item.Last.Checkout.Date","NumInhouseUses","NumCheckouts","NumRenewals","Duplicates","Bib.Marc.Subfield.Data","MultiVolume","modelC","MODEL","LiaisonRecommendation"
"1",1260303,"X001359382","HA29 .C66 1988","ALDERMAN","Statistical power analysis for the behavioral sciences /","Cohen, Jacob,",1988,"6/30/96","5/12/18",10,143,4,2,"2 14 18 19",FALSE,1,"1",0
"2",1934146,"X002102340","HA29 .S823 1990","ALDERMAN","Basics of qualitative research : grounded theory procedures and techniques /","Strauss, Anselm L.",1990,"6/30/96","9/16/18",10,89,12,1,"2",FALSE,2,"1",0
"3",4016910,"X004767044","HA29 .H64 2002","ALDERMAN","Hierarchical linear models : applications and data analysis methods /","Raudenbush, Stephen W.",2002,"3/19/04","5/7/18",12,114,33,2,"2",FALSE,3,"1",0
"4",2225708,"X001994746","HA155 .S55 1990","ALDERMAN","Annotated bibliography of papers using the General social surveys /","Smith, Tom W. (Tom William),",1990,"7/1/96","1/1/00",19,102,0,1,"2",FALSE,4,"1",0
"5",2915099,"X004323310","HA31.3 .P4 1997","ALDERMAN","Multiple regression in behavioral research : explanation and prediction /","Pedhazur, Elazar J.",1997,"5/25/99","8/26/15",10,130,1,2,"2",FALSE,5,"1",0
"6",2865885,"X004235757","HA29 .P639 1998","ALDERMAN","A History of the modern fact : problems of knowledge in the sciences of wealth and society /","Poovey, Mary.",1998,"12/28/98","1/4/18",7,90,13,2,"2",FALSE,6,"1",0
"7",113660,"X001837620","HA31.3 .P4 1982","ALDERMAN","Multiple regression in behavioral research : explanation and prediction /","Pedhazur, Elazar J.",1982,"6/28/96","3/1/06",9,125,0,2,"2",FALSE,7,"1",0
"8",1278659,"X000506014","HA31 .T83 1983","ALDERMAN","The visual display of quantitative information /","Tufte, Edward R.,",1983,"6/30/96","5/12/17",14,136,11,2,"2 3 4 5 9 14 19",FALSE,8,"1",0
"9",2477311,"X004126162","HA30.3 .H37 1993","ALDERMAN","Time series models /","Harvey, A. C. (Andrew C.)",1993,"8/6/97","4/4/13",2,72,0,1,"2",FALSE,9,"1",0
"10",620604,"X001648447","HA29 .H799","ALDERMAN","Reading statistics and research","Huck, Schuyler W.",1974,"6/29/96","5/16/11",1,80,0,2,"2",FALSE,10,"1",0
"11",1934655,"X002088338","HA29 .W33574 1990","ALDERMAN","Statistics for the social sciences : with computer applications /","Walsh, A. (Anthony)",1990,"6/30/96","6/1/16",4,66,0,1,"2",FALSE,12,"1",0
"12",1229161,"X001361770","HA37 .U55 A53 1988","ALDERMAN","The American census : a social history /","Anderson, Margo J.,",1988,"6/30/96","11/26/18",7,82,2,2,"2 3",FALSE,13,"1",0
"13",3881474,"X004622194","HA29 .H82 1993","CLEMONS","How to lie with statistics /","Huff, Darrell.",1993,"8/23/02","5/14/17",0,51,25,1,"3",FALSE,15,"1",0
"14",3549644,"X004469875","HA4635 .X46 1999","ALDERMAN","Xin Zhongguo wu shi nian tong ji zi liao hui bian /","",1999,"7/13/00","9/11/12",6,56,0,1,"2",FALSE,17,"1",0
"15",1638314,"X001824631","HA29 .W622 1990","CLEMONS","Introductory statistics for business and economics /","Wonnacott, Thomas H.,",1990,"6/30/96","9/14/18",6,51,0,1,"3 5",FALSE,18,"1",0
"16",1236368,"X001604920","HA37 .U55 P65 1987","ALDERMAN","The Politics of numbers /","",1987,"6/30/96","5/16/16",2,61,14,2,"2 3",FALSE,19,"1",0
"17",179288,"X000358944","HA29 .K44 1982","ALDERMAN","Design and analysis : a researcher's handbook /","Keppel, Geoffrey.",1982,"6/28/96","4/7/08",13,104,0,2,"2 18",FALSE,20,"1",0
"18",1233766,"X001364832","HA29 .P645 1986","ALDERMAN","Statistics : applications for the behavioral sciences /","Porter, Joseph H.,",1986,"6/30/96","11/1/13",3,57,0,1,"2",FALSE,21,"1",0
"19",3620595,"X000976945","HA31.3 .B47","ALDERMAN","Multiple regression in practice /","Berry, William Dale.",1985,"6/28/96","1/23/17",6,51,1,1,"2 19",FALSE,22,"1",0
"20",4628459,"X030330727","HA29 .A88 2007","CLEMONS","Super crunchers : why thinking-by-numbers is the new way to be smart /","Ayres, Ian.",2007,"9/14/07","2/1/16",2,63,13,2,"2 3 17",FALSE,23,"1",0
"21",2229882,"X002255271","HA31.2 .M66 1993","ALDERMAN","Bootstrapping : a nonparametric approach to statstical inference /","Mooney, Christopher Z.",1993,"7/1/96","9/10/15",0,51,1,1,"2",FALSE,24,"1",0
"22",2870151,"X004290290","HA31.2 .L64 1999","ALDERMAN","Sampling : design and analysis /","Lohr, Sharon L.,",1999,"2/2/99","5/12/18",5,44,3,1,"2",FALSE,25,"1",0
"23",4224910,"X004824863","HA29 .S823 1998","ALDERMAN","Basics of qualitative research : techniques and procedures for developing grounded theory /","Strauss, Anselm L.",1998,"2/8/05","9/23/18",6,37,15,1,"2",FALSE,26,"1",0
"24",767911,"X030281876","HA31.2 .C66 1987","ALDERMAN","Survey research in the United States : roots and emergence 1890-1960 /","Converse, Jean M.,",1987,"6/29/96","5/12/18",4,46,3,1,"2",FALSE,27,"1",0
"25",4298957,"X004844992","HA29 .H783 2002","ALDERMAN","Multilevel analysis : techniques and applications /","Hox, J. J.",2002,"8/19/05","7/12/18",3,35,15,1,"2",FALSE,28,"1",0
"26",2531874,"X002736358","HA31.3 .P4 1982b","ALDERMAN","Multiple regression in behavioral research : explanation and prediction /","Pedhazur, Elazar J.",1982,"7/1/96","5/13/11",8,55,0,1,"2 5",FALSE,29,"1",0
"27",1283875,"X001520435","HA29 .H352 1988","ALDERMAN","Statistics /","Hays, William L. (William Lee),",1988,"6/30/96","1/23/07",2,59,0,1,"2 5 18",FALSE,30,"1",0
"28",380017,"X000065505","HA37 .U5 1966","ALDERMAN","The history and growth of the United States census,","United States. Bureau of Labor.",1966,"6/28/96","7/15/15",9,50,13,1,"2",FALSE,31,"1",0
"29",4463768,"X030152347","HA31.3 .G45 2007","ALDERMAN","Data analysis using regression and multilevel/hierarchical models /","Gelman, Andrew.",2007,"2/1/07","8/6/18",14,54,19,2,"2 17",FALSE,32,"1",0
"30",215046,"X000482556","HA31.4 .K56","ALDERMAN","Discriminant analysis /","Klecka, William R.",1980,"6/28/96","4/17/18",3,44,3,1,"2 13 14 19",FALSE,33,"1",0
"31",3656697,"X004474594","HA31.3 .P36 2000","ALDERMAN","Logistic regression : a primer /","Pampel, Fred C.",2000,"4/24/01","5/14/18",3,36,9,1,"2 19",FALSE,35,"1",0
"32",986735,"X000617681","HA205 .A33 1968","ALDERMAN","Negro population in the United States, 1790-1915.","United States. Bureau of the Census.",1968,"6/29/96","2/16/08",1,56,0,1,"2",FALSE,36,"1",0
"33",3773033,"X004501650","HA32 .G737 2000","ALDERMAN","Using SPSS for Windows : analyzing and understanding data /","Green, Samuel B.,",2000,"9/4/01","6/2/16",1,36,0,1,"2",FALSE,37,"1",0
"34",4220696,"X004824700","HA31.3 .F69 1997","CLEMONS","Applied regression analysis, linear models, and related methods /","Fox, John,",1997,"1/17/05","5/20/15",4,34,5,1,"3",FALSE,38,"1",0
"35",2838142,"X004159181","HA29 .S658 1997","ALDERMAN","Basic statistical analysis /","Sprinthall, Richard C.,",1997,"10/5/98","6/1/16",6,37,0,1,"2",FALSE,39,"1",0
"36",3769724,"X004414525","HA32 .P355 2001","ALDERMAN","SPSS survival manual : a step-by-step guide to data analysis using SPSS for Windows (Version 10) /","Pallant, Julie.",2001,"8/14/01","8/31/16",1,33,0,1,"2",FALSE,40,"1",0
"37",813114,"X000169789","HA17 .K6","ALDERMAN","Russian-English dictionary of statistical terms and expressions, and Russian reader in statistics.","Kotz, Samuel.",1964,"6/29/96","12/13/06",0,54,0,1,"2",FALSE,41,"1",0
"38",3622447,"X001053351","HA31.4 .W64 1986","ALDERMAN","Meta-analysis : quantitative methods for research synthesis /","Wolf, Fredric Marc.",1986,"6/28/96","4/30/13",3,43,0,1,"2 19",FALSE,43,"1",0
"39",2121496,"X002151188","HA32 .D488 1993","ALDERMAN","Qualitative data analysis : a user-friendly guide for social scientists /","Dey, Ian.",1993,"6/30/96","5/13/10",1,46,0,1,"2",FALSE,44,"1",0
"40",213084,"X000528332","HA31.3 .L48","ALDERMAN","Applied regression : an introduction /","Lewis-Beck, Michael S.",1980,"6/28/96","4/6/16",6,60,8,2,"2 3 19",FALSE,46,"1",0
"41",148005,"X000778653","HA31.3 .A33 1982","ALDERMAN","Interpreting and using regression /","Achen, Christopher H.",1982,"6/28/96","8/22/16",3,70,3,2,"2 3 14 19",FALSE,47,"1",0
"42",4627851,"X030261602","HA32 .L444 2008","ALDERMAN","SPSS for intermediate statistics : use and interpretation /","Leech, Nancy L.",2008,"9/11/07","5/8/18",3,21,7,1,"2",FALSE,48,"1",0
"43",2382119,"X002600545","HA29 .M2465 1995","ALDERMAN","Identification problems in the social sciences /","Manski, Charles F.",1995,"7/1/96","9/26/14",7,38,0,1,"2 5",FALSE,49,"1",0
"44",541802,"X000114925","HA1135 .M5 1962","ALDERMAN","Abstract of British historical statistics.","Mitchell, B. R. (Brian R.)",1962,"6/29/96","11/29/10",15,57,6,3,"2",FALSE,50,"1",0
"45",3559903,"X004438420","HA29 .H734 1996","ALDERMAN","Basic statistics for the behavioral sciences /","Hopkins, Kenneth D.",1996,"10/12/00","5/11/09",6,40,0,1,"2",FALSE,51,"1",0
"46",2938801,"X004253683","HA29 .D4 1999","ALDERMAN","Grounding grounded theory : guidelines for qualitative inquiry /","Dey, Ian.",1999,"8/18/99","9/23/18",1,28,12,1,"2",FALSE,52,"1",0
"47",550238,"X000430575","HA29 .H82 1954","ALDERMAN","How to lie with statistics.","Huff, Darrell.",1954,"6/29/96","1/5/16",4,39,18,1,"2 5",FALSE,53,"1",0
"48",4633728,"X030261892","HA32 .S78 2008","ALDERMAN","A visual approach to SPPS [sic] for Windows : a guide to SPSS 15.0 /","Stern, Leonard (Leonard D.)",2008,"9/26/07","8/31/16",0,20,2,1,"2",FALSE,54,"1",0
"49",803097,"X006143459","HA29 .T783","CLEMONS","Exploratory data analysis /","Tukey, John W. (John Wilder),",1977,"6/29/96","4/10/17",0,33,6,1,"3 5 14",FALSE,56,"1",0
"50",5187314,"X030241124","HA31.3 .F69 2008","ALDERMAN","Applied regression analysis and generalized linear models /","Fox, John,",2008,"7/28/10","9/21/17",3,15,8,1,"2",FALSE,57,"1",0
"51",2739873,"X004140284","HA29 .C38 1997","ALDERMAN","Causality in crisis? : statistical methods and the search for causal knowledge in the social sciences /","",1997,"12/2/97","5/11/14",4,33,1,1,"2",FALSE,58,"1",0
"52",6942608,"X031767910","HA30.3 .B69 2014","ALDERMAN","Time series analysis for the social sciences /","Box-Steffensmeier, Janet M.,",2014,"1/24/17","9/4/18",1,6,0,1,"2",FALSE,59,"1",0
"53",3825841,"X006126685","HA32 .K47 2002","ALDERMAN","Doing statistics with SPSS /","Kerr, Alistair W.",2002,"3/29/02","4/10/10",6,33,0,1,"2",FALSE,60,"1",0
"54",3772059,"X004525846","HA214 .F74 2001","ALDERMAN","America by the numbers : a field guide to the U.S. population /","Frey, William H.",2001,"8/28/01","10/11/11",7,31,0,1,"2",FALSE,61,"1",0
"55",686460,"X001207734","HA31.2 .J65 1986","CLEMONS","Survey design and analysis /","Jolliffe, F. R. (Flavia R.),",1986,"6/29/96","3/8/05",4,46,0,1,"3",FALSE,63,"1",0
"56",815656,"X000271499","HA37 .G7 W75","ALDERMAN","Nineteenth-century society; essays in the use of quantitative methods for the study of social data.","Wrigley, E. A. (Edward Anthony),",1972,"6/29/96","4/11/18",3,40,6,3,"2 3",FALSE,64,"1",0
"57",2404537,"X002647360","HA29 .G7735 1993","ALDERMAN","Statistical applications for the behavioral sciences /","Grimm, Laurence G.",1993,"7/1/96","9/6/11",4,36,0,1,"2",FALSE,66,"1",0
"58",7049680,"X031789106","HA32 .B39 2016","ALDERMAN","An introduction to Stata programming /","Baum, Christopher F.,",2016,"8/3/17","8/22/18",0,3,3,1,"2 17",FALSE,67,"1",0
"59",5843503,"X030879978","HA32 .S676 2011","ALDERMAN","Stata user's guide.","",2009,"12/7/12","5/17/17",1,10,2,1,"2",FALSE,68,"1",0
"60",625765,"X000185635","HA29 .H2417","CLEMONS","Basic statistics: a modern approach.","Hamburg, Morris,",1974,"6/29/96","10/28/08",0,41,0,1,"2 3",FALSE,69,"1",0
"61",4321824,"X004972086","HA39 .V43 S26 2004","ALDERMAN","San Jacinto de El Morro /","Guillen Marquina, Luis Alberto.",2004,"10/19/05","5/12/18",0,16,10,1,"2",FALSE,70,"1",0
"62",7071579,"X031821544","HA32 .F54 2013","ALDERMAN","Discovering statistics using IBM SPSS statistics : and sex and drugs and rock 'n' roll /","Field, Andy P.",2013,"5/22/17","8/28/18",0,3,3,1,"2",FALSE,71,"1",0
"63",1270627,"X000558025","HA29 .C66 1977","ALDERMAN","Statistical power analysis for the behavioral sciences /","Cohen, Jacob,",1977,"6/30/96","6/15/15",3,31,6,1,"2 14",FALSE,72,"1",0
"64",66243,"X000915066","HA29 .A49 1984","ALDERMAN","Cluster analysis /","Aldenderfer, Mark S.",1984,"6/28/96","7/24/09",4,38,0,1,"2 19",FALSE,73,"1",0
"65",2229884,"X002255273","HA31.7 .E45 1993","ALDERMAN","Maximum likelihood estimation : logic and practice /","Eliason, Scott R.",1993,"7/1/96","9/10/15",1,29,1,1,"2 14 19",FALSE,74,"1",0
"66",6389259,"X031658697","HA29 .G136 2014","ALDERMAN","Statistical modeling and inference for social science /","Gailmard, Sean.",2014,"9/17/14","12/6/18",1,4,1,1,"2",FALSE,75,"1",0
"67",7348672,"X031842148","HA29 .H35 2018","ALDERMAN","The philosophy of quantitative methods /","Haig, Brian D.,",2018,"1/29/18","4/17/18",0,1,1,1,"2",FALSE,76,"1",0
"68",231832,"X000077652","HA33 .K55","ALDERMAN","Introduction to factor analysis : what it is and how to do it /","Kim, Jae-on.",1978,"6/28/96","9/10/15",4,56,3,2,"2 3 14 19",FALSE,77,"1",0
"69",7389687,"X032068909","HA37 .U55 A53 2015","ALDERMAN","The American census : a social history /","Anderson, Margo J.,",2015,"3/16/18","3/29/18",0,1,0,1,"2",FALSE,78,"1",0
"70",7516168,"X031822044","HA29 .C7724 2015","ALDERMAN","Basics of qualitative research : techniques and procedures for developing grounded theory /","Corbin, Juliet M.,",2015,"5/1/18","5/8/18",3,0,0,1,"2",FALSE,80,"1",0
"71",5131513,"X030720795","HA29 .E497 2010","ALDERMAN","Applied missing data analysis /","Enders, Craig K.",2010,"4/22/10","7/16/18",2,8,2,1,"2",FALSE,81,"1",0
"72",7645083,"X031827099","HA4587 .C54 C46 2005 v.1","ALDERMAN","Census of India, 2001. Bh?rata k? janaga?an?, 2001. ?r??khal? 23, Chatt?saga?ha.","",2005,"7/18/18","8/1/18",0,0,0,1,"2",TRUE,82,"1",0
"73",4650257,"X030263118","HA29 .G527 2008","ALDERMAN","Agent-based models /","Gilbert, G. Nigel.",2008,"12/4/07","9/4/12",0,18,0,1,"2",FALSE,83,"1",0
"74",7307733,"X032086513","HA1107.5 .E89 2017","ALDERMAN","European statistics for European policies : a wealth of data to underpin the Commission's priorities /","",2017,"11/30/17","12/4/17",0,0,0,1,"2",FALSE,84,"1",0
"75",4695766,"X030498889","HA175 .M55 2007","ALDERMAN","International historical statistics.","Mitchell, B. R. (Brian R.)",2007,"3/7/08","12/11/16",1,12,10,1,"2",FALSE,85,"1",0
"76",6176873,"X031847078","HA4587 .H54 C46 2012 pt.1 v.4","ALDERMAN","Census of India, 2011.","",2012,"12/19/17","2/6/18",0,0,0,4,"2",TRUE,86,"1",0
"77",1351958,"X002646810","HA33 .D83 1989","ALDERMAN","Principal components analysis /","Dunteman, George H. (George Henry),",1989,"6/30/96","8/24/15",2,27,7,1,"2 14",FALSE,87,"1",0
"78",6617585,"X031737869","HA29 .M236 2013","ALDERMAN","The data game : controversies in social science statistics /","Maier, Mark H.,",2013,"8/31/15","10/10/18",0,1,20,1,"2",FALSE,88,"1",0
"79",2859401,"X004265790","HA29 .M2463 1994","ALDERMAN","Statistics for business and economics : methods and applications /","Mansfield, Edwin.",1994,"12/2/98","1/2/14",5,26,1,1,"2",FALSE,89,"1",0
"80",6995417,"X031763360","HA37 .G72 H88 2017","ALDERMAN","The butcher, the baker, the candlestick-maker : the story of Britain through its census, since 1801 /","Hutchinson, Roger,",2017,"3/1/17","3/30/17",1,1,1,1,"2",FALSE,90,"1",0
"81",3914675,"X031827109","HA4587 .K47 C46 1991 pt.12 no.13","ALDERMAN","Census of India, 1991. Bh?rata k? janaga?an?, 1991, ?r??khal? 12, Kerala.","",1995,"7/19/18","8/1/18",2,0,0,10,"2",TRUE,91,"1",0
"82",6439025,"X031647365","HA31.3 .K45 2015","ALDERMAN","Multiple regression and beyond /","Keith, Timothy,",2015,"12/10/14","3/7/18",0,2,16,1,"2",FALSE,92,"1",0
"83",231834,"X000077647","HA33 .K53","ALDERMAN","Factor analysis : statistical methods and practical issues /","Kim, Jae-on.",1978,"6/28/96","4/23/14",1,47,3,2,"2 3 14 19",FALSE,94,"1",0
"84",541796,"X000097755","HA37 .U55 S44","ALDERMAN","Census, U.S.A.: fact finding for the American people, 1790-1970.","Scott, Ann Herbert.",1968,"6/29/96","7/1/03",1,44,0,1,"2",FALSE,95,"1",0
"85",10822,"X001065760","HA29 .H425 1985","CLEMONS","Statistical methods for meta-analysis /","Hedges, Larry V.",1985,"6/28/96","1/14/09",1,35,0,1,"3 5 14",FALSE,96,"1",0
"86",6190023,"X031624019","HA31 .H28 2014","ALDERMAN","An introduction to exponential random graph modeling /","Harris, Jenine K.",2014,"1/30/14","5/13/18",0,2,4,1,"2",FALSE,97,"1",0
"87",5581967,"X031218273","HA31.2 .S873 2004","ALDERMAN","Survey methodology /","",2004,"3/28/12","12/13/18",4,4,12,1,"2",FALSE,98,"1",0
"88",6428172,"X031720628","HA30.3 .P53 2015","ALDERMAN","Introduction to time series analysis /","Pickup, Mark",2014,"11/18/14","5/30/18",0,1,7,1,"2",FALSE,99,"1",0
"89",5695620,"X031199141","HA29 .H145 2012","ALDERMAN","Integrative statistics for the social & behavioral sciences /","Ha, Renee R.",2012,"5/29/12","10/3/18",0,3,1,1,"2",FALSE,100,"1",0
"90",4524433,"X030219760","HA32 .S6755 2005","ALDERMAN","Stata programming : reference manual : release 9.","",2005,"5/8/07","12/3/12",3,16,0,1,"2",FALSE,101,"1",0
"91",2819095,"X004188784","HA29 .R85 1996","ALDERMAN","Fundamentals of behavioral statistics.","",1996,"8/5/98","8/27/09",0,30,0,1,"2",FALSE,102,"1",0
"92",6564342,"X031729809","HA32 .S65 2013","ALDERMAN","Pik teit'? puns?k pangb?mnon : kujo pangj?ngsik mohy?ng kwa tach'?ng mohy?ng ?l chungsim ?ro /","Song, T'ae-min",2013,"6/3/15","7/6/17",0,1,0,1,"2",FALSE,103,"1",0
"93",6623098,"X031755851","HA31.3 .L48 2016","ALDERMAN","Applied regression : an introduction.","Lewis-Beck, Michael S.,",2016,"9/22/15","1/4/17",0,1,0,1,"2",FALSE,104,"1",0
"94",2531469,"X002778894","HA31.2 .C93 1996","ALDERMAN","Designing surveys : a guide to decisions and procedures /","Czaja, Ronald.",1996,"7/1/96","1/23/08",0,34,0,1,"2 14",FALSE,105,"1",0
"95",2892583,"X004289681","HA30.3 .F7 1998","ALDERMAN","Time series models for business and economic forecasting /","Franses, Philip Hans,",1998,"3/29/99","5/16/16",0,20,33,1,"2 14",FALSE,106,"1",0
"96",6148865,"X031800764","HA4587 .M32 C473 2011a pt.1:v.5","ALDERMAN","Census of India, 2011.","",2012,"11/28/16","12/15/16",0,0,0,10,"2",TRUE,107,"1",0
"97",6108995,"X031726852","HA4581.5 2011b pt.1 v.5","ALDERMAN","Census of India, 2011.","",2012,"5/4/15","2/22/18",0,0,0,7,"2",TRUE,108,"1",0
"98",6819349,"X031658895","HA4587 .A5 I53 2015 Pt.2","ALDERMAN","Census of India, 2011.","India. Directorate of Census Operations, Andaman & Nicobar Islands.",2015,"10/4/16","10/24/16",0,0,0,2,"2",TRUE,109,"1",0
"99",6148850,"X031786248","HA4587 .K377 C46 2012 pt.1:v.5 AA","ALDERMAN","Census of India, 2011.","",2012,"11/15/16","11/22/16",0,0,0,33,"2",TRUE,110,"1",0
"100",131797,"X000508202","HA214 .M38 1982","ALDERMAN","Demographic dimensions of the New Republic : American interregional migration, vital statistics, and manumissions, 1800-1860 /","McClelland, Peter D.",1982,"6/28/96","10/28/08",2,54,0,2,"2 3",FALSE,111,"1",0
"101",4813360,"X030508353","HA801 .F443 2007","ALDERMAN","All the rules : time tested secrets for capturing the heart of Mr. Right /","Fein, Ellen.",2007,"1/16/09","10/17/11",2,15,0,1,"2",FALSE,112,"1",0
"102",6309809,"X031658892","HA4587 .C43 C46 2011 pt.2","ALDERMAN","Census of India, 2011.","",2012,"10/4/16","10/24/16",0,0,0,2,"2",TRUE,113,"1",0
"103",6148957,"X031658894","HA4587 .M58 C46 2012 pt.2","ALDERMAN","Census of India, 2011. Bh?rata k? janaga?an?, 2011. ?r?nkhal? 16, Mizorama.","",2012,"10/4/16","10/24/16",0,0,0,2,"2",TRUE,113,"1",0
"104",6386288,"X031658891","HA4587 .U78 C46 2012 pt.1 v.4","ALDERMAN","Census of India, 2011.","",2012,"10/4/16","10/24/16",0,0,0,4,"2",TRUE,113,"1",0
"105",7369251,"X032023807","HA37 .Y8 A37 no.101","ALDERMAN","Me?usobni odnosi privrednih delatnosti SFR Jugoslavije u 1976. godini = Inter-industry relations of the economy of the SFRY in 1976 /","Savezni zavod za statistiku (Yugoslavia)",1979,"2/28/18","3/1/18",0,0,0,1,"2",TRUE,114,"1",0
"106",6176889,"X031658893","HA4587 .A782 C46 2011 v.2 pt.2","ALDERMAN","Census of India, 2011.","",2011,"10/4/16","10/24/16",0,0,0,3,"2",TRUE,115,"1",0
"107",3830714,"X004586285","HA29 .A5824 2002","ALDERMAN","The analysis and interpretation of multivariate data for social scientists /","",2002,"5/2/02","5/6/16",3,16,9,1,"2",FALSE,116,"1",0
"108",388673,"X031995907","HA1215 .L4","ALDERMAN","La Statistique gÈnÈrale de la France de 1833 ‡ 1870 /","Le MÈe, RenÈ.",1975,"2/27/18","2/28/18",0,0,0,1,"2",FALSE,117,"1",0
"109",258738,"X000170225","HA30.3 .M32","ALDERMAN","Applied time series analysis for the social sciences /","McCleary, Richard.",1980,"6/28/96","7/31/14",1,26,29,1,"2",FALSE,118,"1",0
"110",6174944,"X031712280","HA4587 .A52 C46 2012 pt.1:v.5","ALDERMAN","Census of India, 2011.","",2012,"7/26/16","8/2/16",0,0,0,6,"2",TRUE,119,"1",0
"111",2817038,"X006070993","HA29 .G726 1995","ALDERMAN","Essentials of statistics for the behavioral sciences /","Gravetter, Frederick J.",1995,"7/29/98","9/6/11",3,26,0,1,"2 5",FALSE,121,"1",0
"112",4227224,"X004862088","HA37 .U55 P48 2004","ALDERMAN","Unlocking the Census with GIS /","Peters, Alan H.",2004,"2/18/05","8/16/16",3,12,5,1,"2",FALSE,122,"1",0
"113",6722047,"X031712286","HA4587 .M43 C46 2012 Pt.2","ALDERMAN","Census of India, 2011.","",2012,"4/21/16","8/2/16",0,0,0,1,"2",TRUE,123,"1",0
"114",5170276,"X032097518","HA1728 .T75 I65 1975 pt.2-C.1 & pt.5-A","ALDERMAN","Census of India, 1971, series 20, Tripura.","India. Office of the Registrar General.",1970,"3/8/18","3/9/18",0,0,0,7,"2",TRUE,125,"1",0
"115",3634778,"X031602616","HA1 .S3 v.49 1990","ALDERMAN","Basic content analysis /","Weber, Robert Philip.",1990,"1/29/13","4/17/18",0,3,2,1,"2 19",TRUE,126,"1",0
"116",6263580,"X031627391","HA29 .B754 2014","CLEMONS","Bourdieu and data analysis : methodological principles and practice /","",2014,"6/4/14","3/14/16",0,2,1,1,"3",FALSE,127,"1",0
"117",6174945,"X031582268","HA4587 .M58 C46 2011 v.1 pt.2","ALDERMAN","Census of India, 2011.","",2011,"12/20/13","2/21/18",0,0,0,3,"2",TRUE,128,"1",0
"118",6692231,"X031781799","HA4587 .K47 C46 2015","ALDERMAN","Census of India 2011. Bh?rata k? janaga?an? 2011. ?r??khal? - 33, Kerala. Pr?thamika janaga?an? s?ra.","",2015,"2/22/16","3/2/16",0,0,0,1,"2",TRUE,129,"1",0
"119",6692240,"X031781800","HA4587 .R35 C46 2015","ALDERMAN","Census of India 2011. Bh?rata k? janaga?an? 2011. ?r??khal? - 9, R?jasth?na. Pr?thamika janaga?an? s?ra.","",2015,"2/22/16","3/2/16",0,0,0,1,"2",TRUE,129,"1",0
"120",648345,"X000907808","HA31.3 .L67 1983","ALDERMAN","Cluster analysis for social scientists /","Lorr, Maurice,",1983,"6/29/96","4/8/09",3,32,0,1,"2",FALSE,130,"1",0
"121",1829253,"X002087724","HA31.35 .L48 1991","ALDERMAN","A guide to SPSS for analysis of variance /","Levine, Gustav.",1991,"6/30/96","5/16/06",5,35,0,1,"2 14",FALSE,132,"1",0
"122",5132222,"X030707384","HA1728 .K47 I55 1970 pt.2C.2","ALDERMAN","Census of India, 1971 :","",1970,"4/27/10","4/22/13",0,56,52,11,"2",TRUE,133,"1",0
"123",6692237,"X031781807","HA4587 .K37 I53 2014","ALDERMAN","Pr?thamika janaga?an? s?ra : kula janasa?khy? : s?ra?? ka - 5, anus?cita j?tiyo? k? janasa?khy? : s?ra?? ka - 8, anus?cita janaj?tiyo? k? janasa?khy? : s?ra?? ka - 9 /","India. Director of Census Operations, Karnataka,",2014,"2/22/16","3/2/16",0,0,0,1,"2",FALSE,135,"1",0
"124",2645381,"X006040105","HA29 .W74 1997","ALDERMAN","Understanding statistics : an introduction for the social sciences /","Wright, Daniel B.",1997,"1/27/97","5/9/11",0,27,0,1,"2 5",FALSE,137,"1",0
"125",4881359,"X030567229","HA31.3 .A44 2009","ALDERMAN","Fixed effects regression models /","Allison, Paul David.",2009,"6/29/09","5/14/18",0,4,9,1,"2",FALSE,138,"1",0
"126",2701089,"X004105501","HA31.2 .R43 1997","ALDERMAN","Designing and conducting survey research : a comprehensive guide /","Rea, Louis M.",1997,"8/18/97","1/15/10",4,28,0,1,"2 14",FALSE,139,"1",0
"127",675803,"X000840602","HA29 .L8374 1983","ALDERMAN","Covariance structure models : an introduction to LISREL /","Long, J. Scott.",1983,"6/29/96","9/18/15",0,31,0,2,"2 3 19",FALSE,140,"1",0
"128",986774,"X032097571","HA1021 .A432","ALDERMAN","Primer censo de poblaciÛn del Ecuador, 1950; resumen de caracterÌsticas.","Ecuador. DivisiÛn de EstadÌstica y Censos.",1960,"3/8/18","3/9/18",0,0,0,1,"2",FALSE,141,"1",0
"129",4620695,"X030254947","HA29 .G726 2008","ALDERMAN","Essentials of statistics for the behavioral sciences /","Gravetter, Frederick J.",2008,"8/28/07","6/15/15",3,9,10,1,"2",FALSE,143,"1",0
"130",2332603,"X002526260","HA29 .S5763 1995","ALDERMAN","Statistics for the social sciences /","Sirkin, R. Mark.",1995,"7/1/96","4/25/14",2,23,4,1,"2",FALSE,144,"1",0
"131",3938158,"X004632137","HA31.3 .J33 2003","ALDERMAN","Interaction effects in multiple regression /","Jaccard, James.",2003,"5/8/03","10/23/12",2,17,0,1,"2",FALSE,145,"1",0
"132",4757972,"X030361437","HA29 .H6525 2003","ALDERMAN","Applied statistics for the behavioral sciences /","Hinkle, Dennis E.",2003,"9/2/08","8/22/17",3,5,0,1,"2",FALSE,146,"1",0
"133",3825801,"X004587140","HA179 .C46 2002","ALDERMAN","Census and identity : the politics of race, ethnicity, and language in national censuses /","",2002,"3/28/02","12/10/08",1,23,0,1,"2",FALSE,147,"1",0
"134",987561,"X000367983","HA33 .R85","ALDERMAN","Applied factor analysis","Rummel, R. J. (Rudolph J.),",1970,"6/29/96","9/10/15",2,23,1,1,"2",FALSE,148,"1",0
"135",4028857,"X004773740","HA29 .H245 2004","ALDERMAN","Handbook of data analysis /","",2004,"7/8/04","5/9/15",6,12,2,1,"2",FALSE,149,"1",0
"136",2824679,"X006071179","HA29 .G727 1995","ALDERMAN","Instructor's manual to accompany essentials of statistics for the behavioral sciences /","Gravetter, Frederick J.",1995,"8/27/98","3/11/11",1,24,0,1,"2",FALSE,150,"1",0
"137",2854197,"X004260910","HA19 .D4713 1998","ALDERMAN","The politics of large numbers : a history of statistical reasoning /","DesrosiËres, Alain.",1998,"11/16/98","9/23/16",1,16,8,1,"2",FALSE,151,"1",0
"138",986734,"X000413766","HA202 .A385 1965","ALDERMAN","The statistical history of the United States from colonial times to the present.","United States. Bureau of the Census.",1965,"6/29/96","5/1/13",13,26,0,1,"2",FALSE,152,"1",0
