"","Item.Library.Code","Item.Shelving.Id","Item.Barcode","Catalog.Title","Catalog.Author","Catalog.Pub.Year","MultiVolume"
"1065","ALDERMAN","DG 000298 .D75  2007","X030457281","The Alamanni and Rome 213-496 (Caracalla to Clovis) /","Drinkwater, J. F.",2007,FALSE
"1066","ALDERMAN","DG 000298 .Z613  2009","X030278205","The History of Zonaras : from Alexander Severus to the death of Theodosius the Great /","Zonaras, Joannes,",2009,FALSE
"1067","ALDERMAN","DG 000298.7 .J85  L48  2007","X004832806","Julia Domna, Syrian Empress /","Levick, Barbara.",2007,TRUE
"1068","ALDERMAN","DG 000300 .L87  2014","X031715497","Creating severan Rome : the architecture and self-image of L. Septimius Severus (A.D. 193-211) /","Lusnia, Susann Sowers",2014,FALSE
"1069","ALDERMAN","DG 000300 .R82  1980","X000681567","Civil-war propaganda and historiography /","Rubin, Z.",1980,FALSE
"1070","ALDERMAN","DG 000300 .S36  2014","X031637784","Der römische Kaiserhof in severischer Zeit (193-235 n. Chr.) /","Schöpe, Björn.",2014,FALSE
"1071","ALDERMAN","DG 000300 .S48  2007","X030457284","Severan culture /","",2007,FALSE
"1072","ALDERMAN","DG 000303 .A77  2010","X030781047","The Emperor Elagabalus : fact or fiction? /","Arrizabalaga y Prado, Leonardo de,",2010,FALSE
"1073","ALDERMAN","DG 000303 .S273  Z56  2014","X031721509","Kommentar zur Vita Heliogabali der Historia Augusta /","Zinsli, Samuel",2014,FALSE
"1074","ALDERMAN","DG 000305 .G73  1999","X004335048","The collapse and recovery of the Roman Empire /","Grant, Michael,",1999,FALSE
"1075","ALDERMAN","DG 000306 .M3","X000090748","Roman government's response to crisis, A.D. 235-337 /","MacMullen, Ramsay,",1976,FALSE
"1076","ALDERMAN","DG 000308 .W37  1999","X004335441","Aurelian and the third century /","Watson, Alaric,",1999,FALSE
"1077","ALDERMAN","DG 000309 .A585  2014","X031634238","Die Herrschaft des Carus, Carinus und Numerianus als Vorläufer der Tetrarchie /","Altmayer, Klaus",2014,FALSE
"1078","ALDERMAN","DG 000311 .A7  1936","X030126499","The transition from the ancient to the medieval world,","Arragon, Reginald Francis.",1936,FALSE
"1079","ALDERMAN","DG 000311 .A77  2004","X004743428","Approaching late antiquity : the transformation from early to late empire /","",2004,FALSE
"1080","ALDERMAN","DG 000311 .B76  1992","X002190844","Power and persuasion in late antiquity : towards a Christian empire /","Brown, Peter,",1992,FALSE
"1081","ALDERMAN","DG 000311 .B98  1923  V.000001","X030040014","History of the later Roman empire from the death of Theodosius I. to the death of Justinian (A. D. 395 to A. D. 565)","Bury, J. B. (John Bagnell),",1923,TRUE
"1082","ALDERMAN","DG 000311 .C36  1993","X006028570","The later Roman empire /","Cameron, Averil.",1993,FALSE
"1083","ALDERMAN","DG 000311 .C74  2006","X030196637","La ""crise"" de l'Empire romain de Marc Aurèle à Constantin : mutations, continuités, ruptures /","",2006,FALSE
"1084","ALDERMAN","DG 000311 .D52  2018","X032576771","Empire and political cultures in the Roman world /","Dench, Emma",2018,FALSE
"1085","ALDERMAN","DG 000311 .E48  2018","X032560770","The Roman Empire in late antiquity : a political and military history /","Elton, Hugh,",2018,FALSE
"1086","ALDERMAN","DG 000311 .E76  2013","X031646026","The Roman West, AD 200-500 : an archaeological study /","Esmonde Cleary, A. S. (A. Simon)",2013,FALSE
"1087","CLEMONS","DG 000311 .G423  1932  V.000001","X006027929","The decline and fall of the Roman empire,","Gibbon, Edward,",1932,TRUE
"1088","ALDERMAN","DG 000311 .G5  1974  V.000001","X001059942","The history of the decline and fall of the Roman Empire.","Gibbon, Edward,",1974,TRUE
"1089","CLEMONS","DG 000311 .G5  1995  V.000001","X002718396","The decline and fall of the Roman Empire /","Gibbon, Edward,",1995,TRUE
"1090","ALDERMAN","DG 000311 .G5  1995B V.000001","X006041907","The history of the decline and fall of the Roman Empire /","Gibbon, Edward,",1995,TRUE
"1091","ALDERMAN","DG 000311 .G565  1983  V.000002","X001010791","The history of the decline and fall of the Roman Empire /","Gibbon, Edward,",1983,TRUE
"1092","ALDERMAN","DG 000311 .G6  J67","X000090750","Gibbon and his Roman Empire","Jordan, David P.,",1971,FALSE
"1093","ALDERMAN","DG 000311 .G6  L63  2012","X030846325","The rhetoric of numbers in Gibbon's History /","Lock, F. P.",2012,TRUE
"1094","ALDERMAN","DG 000311 .G6  P63  1999  V.000003","X004719013","Barbarism and religion /","Pocock, J. G. A. (John Greville Agard),",1999,TRUE
"1095","CLEMONS","DG 000311 .G65  2009","X030517048","How Rome fell : death of a superpower /","Goldsworthy, Adrian Keith.",2009,FALSE
"1096","ALDERMAN","DG 000311 .G67  2009","X030278314","The fall of the west : the slow death of the Roman superpower /","Goldsworthy, Adrian Keith.",2009,FALSE
"1097","ALDERMAN","DG 000311 .H35  2007","X030278682","Barbarian migrations and the Roman West, 376-568 /","Halsall, Guy.",2007,FALSE
"1098","ALDERMAN","DG 000311 .H357  2017","X031818141","The fate of Rome : climate, disease, and the end of an empire /","Harper, Kyle,",2017,FALSE
"1099","ALDERMAN","DG 000311 .H368  2012","X031213810","Imperial Rome AD 284-363 : the new empire /","Harries, Jill.",2012,FALSE
"1100","ALDERMAN","DG 000311 .H37  1962","X030121227","The myth of Rome's fall.","Haywood, Richard Mansfield,",1962,FALSE
"1101","ALDERMAN","DG 000311 .H43  2005","X004833512","The fall of the Roman Empire /","Heather, P. J. (Peter J.)",2005,FALSE
"1102","ALDERMAN","DG 000311 .J6  1964  V.000001","X000207772","The later Roman Empire, 284-602; a social, economic and administrative survey","Jones, A. H. M. (Arnold Hugh Martin),",1964,TRUE
"1103","ALDERMAN","DG 000311 .J6  1986  V.000001","X001064288","The later Roman Empire, 284-602 : a social, economic and administrative survey /","Jones, A. H. M. (Arnold Hugh Martin),",1986,TRUE
"1104","CLEMONS","DG 000311 .J62  1975","X000129890","The decline of the ancient world /","Jones, A. H. M. (Arnold Hugh Martin),",1966,FALSE
"1105","ALDERMAN","DG 000311 .L358  2000","X006101444","Rome in late antiquity : everyday life and urban change, AD 312-609 /","Lançon, Bertrand,",2000,FALSE
"1106","ALDERMAN","DG 000311 .L44  2013","X031612505","From Rome to Byzantium AD 363 to 565 : the transformation of ancient Rome /","Lee, A. D.",2013,FALSE
"1107","ALDERMAN","DG 000311 .M66  2007","X004834052","A history of the later Roman Empire, AD 284-641 : the transformation of the ancient world /","Mitchell, Stephen,",2007,FALSE
"1108","ALDERMAN","DG 000311 .M66  2015","X031651425","A history of the later Roman empire, AD 284-641 /","Mitchell, Stephen,",2015,FALSE
"1109","ALDERMAN","DG 000311 .M68  2001","X006126361","The Roman Empire divided, 400-700 /","Moorhead, John,",2001,FALSE
"1110","ALDERMAN","DG 000311 .O45  2018","X031824242","Emperors and Usurpers in the later Roman Empire : civil war, panegyric, and the construction of legitimacy /","Omissi, Adrastos,",2018,FALSE
"1111","ALDERMAN","DG 000311 .O49  2008","X030465991","The ruin of the Roman Empire /","O'Donnell, James Joseph,",2008,FALSE
"1112","ALDERMAN","DG 000311 .P68  2006","X004895514","A companion to the Roman Empire /","",2006,FALSE
"1113","ALDERMAN","DG 000311 .R64  2014","X031650559","Edward Gibbon and the shape of history /","Roberts, Charlotte.",2014,FALSE
"1114","ALDERMAN","DG 000311 .R66  2003","X004844153","Rome AD 300-800 : power and symbol, image and reality.","",2003,FALSE
"1115","CLEMONS","DG 000311 .S35  2000","X004402628","The end of the past : ancient Rome and the modern West /","Schiavone, Aldo.",2000,FALSE
"1116","ALDERMAN","DG 000311 .S55  2018","X032582666","Daily life in late antiquity /","Sessa, Kristina,",2018,FALSE
"1117","ALDERMAN","DG 000311 .W33  2005","X004910498","The fall of Rome : and the end of civilization /","Ward-Perkins, Bryan.",2005,FALSE
"1118","ALDERMAN","DG 000311 .W45  2003","X004707398","Rome at war, AD 293-696 /","Whitby, Michael.",2003,FALSE
"1119","ALDERMAN","DG 000311 .W55  2007","X030333897","Wolf Liebeschuetz reflected : essays presented by colleagues, friends, & pupils /","",2007,FALSE
"1120","ALDERMAN","DG 000312 .B76","X000066248","The making of late antiquity /","Brown, Peter,",1978,FALSE
"1121","ALDERMAN","DG 000312 .C57  2015","X031704980","Contested monarchy : integrating the Roman Empire in the fourth century AD /","",2015,FALSE
"1122","ALDERMAN","DG 000312 .F47  1986","X001058701","The fall of the Roman Empire : the military explanation /","Ferrill, Arther.",1986,FALSE
"1123","ALDERMAN","DG 000312 .G73  2006","X030116238","News and frontier consciousness in the late Roman Empire /","Graham, Mark W.,",2006,FALSE
"1124","ALDERMAN","DG 000312 .H43  2017","X031821755","The emperor and the army in the later Roman empire, AD 235-395 /","Hebblewhite, Mark,",2017,FALSE
"1125","ALDERMAN","DG 000312 .J365  2009","X030277052","Europe's barbarians, AD 200-600 /","James, Edward,",2009,FALSE
"1126","CLEMONS","DG 000312 .K3","X000197446","Decline and fall of the Roman Empire: why did it collapse?","Kagan, Donald",1962,FALSE
"1127","ALDERMAN","DG 000312 .K56  1997","X004105762","Kingdoms of the Empire : the integration of barbarians in late Antiquity /","",1997,FALSE
"1128","ALDERMAN","DG 000312 .K85  2007","X030114459","Rome's Gothic Wars : from the third century to Alaric /","Kulikowski, Michael,",2007,FALSE
"1129","ALDERMAN","DG 000312 .S6  2006","X004899941","The governor and his subjects in the later Roman empire /","Slootjes, Daniëlle.",2006,FALSE
"1130","ALDERMAN","DG 000312 .T73  1997","X004094162","The transformation of the Roman world AD 400-900 /","",1997,FALSE
"1131","ALDERMAN","DG 000312 .V56  2006","X030033907","Violence in late antiquity : perceptions and practices /","",2006,FALSE
"1132","ALDERMAN","DG 000312 .W6613  1997","X004145086","The Roman Empire and its Germanic peoples /","Wolfram, Herwig.",1997,FALSE
"1133","ALDERMAN","DG 000312.5 .S5  H37  1994","X002601778","Sidonius Apollinaris and the fall of Rome, AD 407-485 /","Harries, Jill.",1994,FALSE
"1134","ALDERMAN","DG 000313 .W54  1985","X000930548","Diocletian and the Roman recovery /","Williams, Stephen,",1985,FALSE
"1135","ALDERMAN","DG 000313 .W54  1985B","X000970647","Diocletian and the Roman recovery /","Williams, Stephen,",1985,FALSE
"1136","ALDERMAN","DG 000314 .C67  1996","X004017095","The empire of the Tetrarchs : imperial pronouncements and government, AD 284-324 /","Corcoran, Simon.",1996,FALSE
"1137","ALDERMAN","DG 000315 .B3  1967","X000472021","Constantine the Great and the Christian revolution,","Baker, G. P. (George Philip),",1967,FALSE
"1138","ALDERMAN","DG 000315 .B334  2012","X031189012","Constantine, divine emperor of the Christian golden age /","Bardill, Jonathan.",2012,FALSE
"1139","ALDERMAN","DG 000315 .B35","X000324634","Constantine and Eusebius /","Barnes, Timothy David.",1981,FALSE
"1140","ALDERMAN","DG 000315 .B68","X000214869","The age of Constantine and Julian /","Bowder, Diana.",1978,FALSE
"1141","ALDERMAN","DG 000315 .C36  2006","X004900826","The Cambridge companion to the Age of Constantine /","",2006,FALSE
"1142","ALDERMAN","DG 000315 .C36  2012","X030974520","The Cambridge companion to the Age of Constantine /","",2012,FALSE
"1143","ALDERMAN","DG 000315 .C46  2014","X031653917","Rethinking Constantine : history, theology and legacy /","",2014,FALSE
"1144","ALDERMAN","DG 000315 .C65  1998","X004187221","Constantine : history, historiography, and legend /","",1998,FALSE
"1145","ALDERMAN","DG 000315 .D72  2000","X004401365","Constantine and the bishops : the politics of intolerance /","Drake, H. A. (Harold Allen),",2000,FALSE
"1146","ALDERMAN","DG 000315 .D73","X000090937","In praise of Constantine : a historical study and new translation of Eusebius' Tricennial orations /","Drake, H. A. (Harold Allen),",1976,FALSE
"1147","ALDERMAN","DG 000315 .E8913  1999","X006029426","Life of Constantine /","Eusebius,",1999,FALSE
"1148","ALDERMAN","DG 000315 .E8914  2013","X031574234","Vie de Constantin /","Eusebius,",2013,FALSE
"1149","ALDERMAN","DG 000315 .K46","X000494263","Constantine, a great Christian monarch and apostle /","Keresztes, Paul.",1981,FALSE
"1150","ALDERMAN","DG 000315 .K66  1997","X004224334","The life and times of Constantine the Great : the first Christian Emperor /","Kousoulas, D. George (Dimitrios George),",1997,FALSE
"1151","ALDERMAN","DG 000315 .L46  2016","X031794509","Constantine and the cities : imperial authority and civic politics /","Lenski, Noel Emmanuel,",2016,FALSE
"1152","ALDERMAN","DG 000315 .M3","X000111639","Constantine.","MacMullen, Ramsay,",1969,FALSE
"1153","ALDERMAN","DG 000315 .O33  2004","X004771469","Constantine and the Christian empire /","Odahl, Charles Matson,",2004,FALSE
"1154","ALDERMAN","DG 000315 .O33  2010","X030744840","Constantine and the Christian empire /","Odahl, Charles Matson,",2010,FALSE
"1155","ALDERMAN","DG 000315 .P65  2004","X004771707","The Emperor Constantine /","Pohlsander, Hans A.,",2004,FALSE
"1156","ALDERMAN","DG 000315 .P68  2013","X030846701","Constantine the Emperor /","Potter, D. S. (David Stone),",2013,FALSE
"1157","ALDERMAN","DG 000315 .V36  2011","X030947208","Remembering Constantine at the Milvian Bridge /","Van Dam, Raymond.",2011,FALSE
"1158","ALDERMAN","DG 000315 .W54  2012","X031609985","Der Kaiser als Sieger : Metamorphosen triumphaler Herrschaft unter Constantin I. /","Wienand, Johannes",2012,FALSE
"1159","ALDERMAN","DG 000316 .B37  1998","X004159434","Ammianus Marcellinus and the representation of historical reality /","Barnes, Timothy David.",1998,FALSE
"1160","ALDERMAN","DG 000316.3 M68  2018","X032583245","Emperor and senators in the reign of Constantius II : maintaining imperial rule between Rome and Constantinople in the fourth century AD /","Moser, Muriel,",2018,FALSE
"1161","ALDERMAN","DG 000316.7 .M38  1989B","X001611933","The Roman empire of Ammianus /","Matthews, John,",1989,FALSE
"1162","ALDERMAN","DG 000317 .B68  1978","X030112767","Julian the Apostate /","Bowersock, G. W. (Glen Warren),",1978,FALSE
"1163","ALDERMAN","DG 000317 .B76  1976","X000280267","The emperor Julian /","Browning, Robert,",1976,FALSE
"1164","ALDERMAN","DG 000317 .F56  2018","X032582903","The specter of the Jews : Emperor Julian and the rhetoric of ethnicity in Syrian Antioch /","Finkelstein, Ari,",2018,FALSE
"1165","ALDERMAN","DG 000317 .M87  2003","X004741904","The last pagan : Julian the Apostate and the death of the ancient world /","Murdoch, Adrian.",2003,FALSE
"1166","ALDERMAN","DG 000317 .S65  1995","X002712866","Julian's gods : religion and philosophy in the thought and action of Julian the Apostate /","Smith, Rowland B. E. (Rowland Blaylock Elton),",1995,FALSE
"1167","ALDERMAN","DG 000317 .S93  2013","X031738661","Themistius, Julian and Greek political theory under Rome : texts, translations and studies of four key works /","Swain, Simon,",2013,FALSE
"1168","ALDERMAN","DG 000319 .E77  2006","X030104872","Roman imperial policy from Julian to Theodosius /","Errington, R. M. (Robert Malcolm)",2006,FALSE
"1169","ALDERMAN","DG 000319 .G63","X006114120","Barbarians and Romans, A.D. 418-584 : the techniques of accommodation /","Goffart, Walter A.",1980,FALSE
"1170","ALDERMAN","DG 000319 .M37","X000103253","Western aristocracies and imperial court, A.D. 364-425 /","Matthews, John (John Frederick)",1975,FALSE
"1171","ALDERMAN","DG 000319 .M41  2013","X031618639","Child emperor rule in the late Roman West, AD 367-455 /","McEvoy, Meaghan,",2013,FALSE
"1172","ALDERMAN","DG 000322 .H64  1982","X032050337","Theodosian empresses : women and imperial dominion in late antiquity /","Holum, Kenneth G.",1982,FALSE
"1173","CLEMONS","DG 000326 .B3713  2007","X030200254","The Day of the barbarians : the battle that led to the fall of the Roman Empire /","Barbero, Alessandro.",2007,FALSE
"1174","ALDERMAN","DG 000329 .A55","X000693328","Sancti Ambrosii Liber de consolatione Valentiniani; a text with a translation, introduction and commentary,","Ambrose,",1940,FALSE
"1175","ALDERMAN","DG 000330 .L46  2003","X004757499","Theodosius der Grosse /","Leppin, Hartmut.",2003,FALSE
"1176","ALDERMAN","DG 000332 .C67  2007","X004832707","The lost gold of Rome : the hunt for Alaric's treasure /","Costa, Daniel.",2007,FALSE
"1177","ALDERMAN","DG 000338 .S35  2015","X031706601","Rome's Christian empress : Galla Placidia rules at the twilight of the empire /","Salisbury, Joyce E.,",2015,FALSE
"1178","ALDERMAN","DG 000338 .S58  2011","X030975829","Galla Placidia : the last Roman empress /","Sivan, Hagith,",2011,FALSE
"1179","ALDERMAN","DG 000338 .T7313  2009","X030567461","428 AD : an ordinary year at the end of the Roman Empire /","Traina, Giusto,",2009,FALSE
"1180","ALDERMAN","DG 000365 .M88  2006","X004832487","The last Roman : Romulus Augustulus and the decline of the west /","Murdoch, Adrian.",2006,FALSE
"1181","ALDERMAN","DG 000401 .I7235  V.11","X030036722","Revisions and revisionism : histories and debates on modernity in Italy /","",2005,TRUE
"1182","ALDERMAN","DG 000403 .R6  NO.000021","X031593573","Le chroniche di Giovanni Sercambi, Lucchese,","Sercambi, Giovanni,",1892,TRUE
"1183","ALDERMAN","DG 000403 .R6  NO.000059","X000837726","Chronicon vulturnense del monaco Giovanni,","Joannes,",1925,TRUE
"1184","ALDERMAN","DG 000403 .R6  NO.000101 PT.000002","X001005455","Catalogus Baronum.","",1972,TRUE
"1185","ALDERMAN","DG 000403 .R6  NO.000106 PT.000003","X000844471","Acta S. [i.e. Sancti] Officii Bononie : ab anno 1291 usque ad annum 1310 /","",1982,TRUE
"1186","ALDERMAN","DG 000403 .R6  NO.000109 PT.000001","X001042336","Gli statuti del comune di Treviso, sec. XIII-XIV  /","Treviso (Italy)",1984,TRUE
"1187","ALDERMAN","DG 000403 .R6  NO.95  1957","X032050403","Adversus Iudeos : di Gioacchino da Fiore /","Gioacchino",1957,TRUE
"1188","ALDERMAN","DG 000403 .T68  2000","X006118827","The Towns of Italy in the later Middle Ages /","",2000,FALSE
"1189","ALDERMAN","DG 000404 .R55  2009","X030265101","Ritratti : la dimensione individuale nella storia (secoli XV-XX) : studi in onore di Anne Jacobson Schutte /","",2009,FALSE
"1190","ALDERMAN","DG 000408 .R4  T.000015 PT.000002 FASC.000002","X004782586","Cronache malatestiane dei secoli XIV e XV (aa. 1295-1385 e 1416-1452) /","",1966,TRUE
"1191","ALDERMAN","DG 000416 .C742  R6  1993","X002213875","Roma /","Touring club italiano.",1993,TRUE
"1192","ALDERMAN","DG 000416 .C742  V4  1992","X002528648","Veneto (esclusa Venezia).","",1992,TRUE
"1193","ALDERMAN","DG 000417 .R68  2015","X031730217","The Routledge handbook of contemporary Italy : history, politics, society /","",2015,FALSE
"1194","ALDERMAN","DG 000417 .W28","X006136510","The Italian city-republics","Waley, Daniel Philip.",1969,FALSE
"1195","ALDERMAN","DG 000420.5 .S48  2010","X030716199","Paesaggio Costituzione cemento : la battaglia per l'ambiente contro il degrado civile /","Settis, Salvatore.",2010,FALSE
"1196","ALDERMAN","DG 000422 .B56  2005  V.000002","X031783465","Italy illuminated /","Biondo Flavio,",2005,TRUE
"1197","ALDERMAN","DG 000423 .P48  2004","X004844156","L'officina del geografo : la ""Descrittione di tutta Italia"" di Leandro Alberti e gli studi geografico-antiquari tra Quattro e Cinquecento : con un saggio di edizione (Lombardia-Toscana) /","Petrella, Giancarlo,",2004,FALSE
"1198","ALDERMAN","DG 000424 .B63  2003","X004734042","Italy and the grand tour /","Black, Jeremy,",2003,FALSE
"1199","ALDERMAN","DG 000424 .G37  2006","X032396153","Cartas críticas sobre la Italia /","García de la Huerta, José,",2006,FALSE
"1200","ALDERMAN","DG 000424 .L353  C44  1985","X001184852","The grand tour and the Great Rebellion : Richard Lassels and ""The Voyage of Italy"" in the seventeenth century /","Chaney, Edward.",1985,TRUE
"1201","ALDERMAN","DG 000425 .F7  2001","X004477434","Remarks on antiquities, arts, and letters during an excursion in Italy, in the years 1802 and 1803 /","Forsyth, Joseph,",2001,FALSE
"1202","ALDERMAN","DG 000425 .S94  2012","X030847496","Cities and the grand tour : the British in Italy, c.1690-1820 /","Sweet, Rosemary.",2012,FALSE
"1203","ALDERMAN","DG 000426 .B26  1964","X000171320","The fortunate pilgrims; Americans in Italy, 1800-1860.","Baker, Paul R.",1964,FALSE
"1204","ALDERMAN","DG 000426 .S74  2010","X032209412","Rome, Naples et Florence /","Stendhal,",2010,FALSE
"1205","ALDERMAN","DG 000427 .J35  1977","X000083554","Italian hours /","James, Henry,",1977,FALSE
"1206","ALDERMAN","DG 000427 .J35  1992","X002038354","Italian hours /","James, Henry,",1992,FALSE
"1207","ALDERMAN","DG 000428 .A6413  2009","X030477036","Flowers of Italy = Hanatsumi Nikki /","Anesaki, Masaharu,",2009,FALSE
"1208","ALDERMAN","DG 000428 .M9  2008  T. 000002","X030505898","Obrazy Italii : polnoe izdanie v trekh tomakh /","Muratov, P. P. (Pavel Pavlovich),",2008,TRUE
"1209","ALDERMAN","DG 000429 .G63  2016","X031849466","El hermafrodita dormido /","González, Fernando,",2016,FALSE
"1210","ALDERMAN","DG 000429 .S5  1932","X032050435","Discursions on travel, art, and life,","Sitwell, Osbert,",1931,FALSE
"1211","ALDERMAN","DG 000430.2 .B75  1987  PLATES","X031882627","Il viaggio in Italia : storia di una grande tradizione culturale dal XVI al XIX secolo /","Brilli, Attilio.",1987,FALSE
"1212","ALDERMAN","DG 000430.2 .C87  2008","X030567425","The Last Supper : a summer in Italy /","Cusk, Rachel,",2009,FALSE
"1213","ALDERMAN","DG 000430.2 .J66  2003","X004668764","The dark heart of Italy /","Jones, Tobias.",2003,FALSE
"1214","ALDERMAN","DG 000430.2 .J66  2004","X004773461","The dark heart of Italy /","Jones, Tobias.",2004,FALSE
"1215","CLEMONS","DG 000430.2 .P37  2002","X004605826","A season with Verona : travels around Italy in search of illusion, national character and - goals! /","Parks, Tim.",2002,FALSE
"1216","ALDERMAN","DG 000430.2 .P37  2013","X031230005","Italian ways : on and off the rails from Milan to Palermo /","Parks, Tim.",2013,FALSE
"1217","ALDERMAN","DG 000431 .W4","X000208763","The Renaissance discovery of classical antiquity.","Weiss, Roberto.",1969,FALSE
"1218","ALDERMAN","DG 000441 .A52  1987","X032050442","Ambienti, mentalità e nuovi spazi umani tra medioevo e età moderna /","",1987,FALSE
"1219","ALDERMAN","DG 000441 .F67  1990","X001804081","Italian culture in the industrial era, 1880-1980 : cultural industries, politics, and the public /","Forgacs, David.",1990,FALSE
"1220","ALDERMAN","DG 000441 .F73  2012","X030879196","Fratelli d'Italia : 150 anni di cultura, lavoro, emigrazione /","",2012,FALSE
"1221","ALDERMAN","DG 000441 .V65  1999","X004502463","Volare : l'icona italiana nella cultura globale /","",1999,FALSE
"1222","ALDERMAN","DG 000442 .P327  2010","X030625515","Italian vices : nation and character from the Risorgimento to the republic /","Patriarca, Silvana.",2010,FALSE
"1223","ALDERMAN","DG 000442 .S74  2007","X030249970","The Pinocchio effect : on making Italians (1860-1920) /","Stewart-Steinberg, Suzanne.",2007,FALSE
"1224","ALDERMAN","DG 000442 .W48  2000","X006111483","Italy : the enduring culture /","White, Jonathan,",2000,FALSE
"1225","ALDERMAN","DG 000442 .W658  2006","X030109204","Race and the nation in liberal Italy, 1861-1911 : meridionalism, empire, and diaspora /","Wong, Aliza S.",2006,FALSE
"1226","ALDERMAN","DG 000442 .W66  1991","X002033841","From Castiglione to Chesterfield : the decline in the courtier's manual : an inaugural lecture delivered before the University of Oxford on 25 October 1990 in the presence of His Excellency the President of Italy /","Woodhouse, John Robert.",1991,FALSE
"1227","ALDERMAN","DG 000443 .C48","X032050434","Signori, contadini, borghesi : ricerche sulla società italiana del basso Medioevo /","Cherubini, Giovanni.",1974,FALSE
"1228","ALDERMAN","DG 000443 .C58  1990","X001857972","City and countryside in late medieval and Renaissance Italy : essays presented to Philip Jones /","",1990,FALSE
"1229","ALDERMAN","DG 000443 .C748  1990","X002141503","Crise et transformation des sociétés archaïques de l'Italie antique au Ve siècle av. J.-C. : actes de la table ronde /","",1990,FALSE
"1230","ALDERMAN","DG 000443 .C83  1988  V.000002","X001105088","Cultura e società nell'Italia medievale : studi per Paolo Brezzi.","",1988,TRUE
"1231","ALDERMAN","DG 000443 .U55  1986","X001361767","Uomini, terre e città nel Medioevo.","",1986,FALSE
"1232","ALDERMAN","DG 000445 .B56  2002","X004470479","Doctors, ambassadors, secretaries : humanism and professions in Renaissance Italy /","Biow, Douglas.",2002,FALSE
"1233","ALDERMAN","DG 000445 .B83  1972","X000306645","Culture and society in Renaissance Italy, 1420-1540.","Burke, Peter,",1972,FALSE
"1234","CLEMONS","DG 000445 .B83  1972B","X006025828","Culture and society in Renaissance Italy, 1420-1540.","Burke, Peter,",1972,FALSE
"1235","ALDERMAN","DG 000445 .B84  1987","X001355599","The historical anthropology of early modern Italy : essays on perception and communication /","Burke, Peter,",1987,FALSE
"1236","ALDERMAN","DG 000445 .B85  1987","X001284875","The Italian Renaissance : culture and society in Italy /","Burke, Peter,",1987,FALSE
"1237","ALDERMAN","DG 000445 .C38  2004","X004772114","The lost Italian Renaissance : humanists, historians, and Latin's legacy /","Celenza, Christopher S.,",2004,FALSE
"1238","ALDERMAN","DG 000445 .C48  2001","X004557448","Daily life in Renaissance Italy /","Cohen, Elizabeth Storr,",2001,FALSE
"1239","ALDERMAN","DG 000445 .C64  2004","X004807142","Love & death in Renaissance Italy /","Cohen, Thomas V. (Thomas Vance),",2004,FALSE
"1240","ALDERMAN","DG 000445 .C66","X006136309","A Concise encyclopaedia of the Italian Renaissance /","",1981,FALSE
"1241","ALDERMAN","DG 000445 .C87","X006095636","Cultural aspects of the Italian Renaissance : essays in honour of Paul Oskar Kristeller /","",1975,FALSE
"1242","ALDERMAN","DG 000445 .C93  2007","X030102959","The Egyptian renaissance : the afterlife of ancient Egypt in early modern Italy /","Curran, Brian A. (Brian Anthony),",2007,FALSE
