"","Item.Library.Code","Item.Shelving.Id","Item.Barcode","Catalog.Title","Catalog.Author","Catalog.Pub.Year","MultiVolume"
"1","ALDERMAN","DG 000012 .A52  V.21","X002313262","Janus and the bridge.","Holland, Louise Adams.",1961,TRUE
"2","ALDERMAN","DG 000012 .A52  V.25","X000288665","Dancing in chains : the stylistic unity of the comoedia palliata /","Wright, John,",1974,TRUE
"3","ALDERMAN","DG 000012 .A52  V.28","X000221412","Pompeii : the electoral programmata, campaigns and politics, A.D. 71-79 /","Franklin, James L.",1980,TRUE
"4","ALDERMAN","DG 000012.5 .P37  1985  V.000003","X001020130","Papers in Italian archaeology IV : the Cambridge Conference /","",1985,TRUE
"5","ALDERMAN","DG 000012.5 .P65  2005","X030006031","Politica e cultura in Roma antica : atti dell'incontro di studio in ricordo di Italo Lana, Torino, 16-17 ottobre 2003 /","",2005,FALSE
"6","ALDERMAN","DG 000013 .F73  2013  V.000001","X031656515","The fragments of the Roman historians /","",2013,TRUE
"7","ALDERMAN","DG 000013 .L4  1966  V.000002","X030152736","Roman civilization; [sourcebooks]","Lewis, Naphtali",1966,TRUE
"8","ALDERMAN","DG 000013 .L4  1990  V.000002","X001859889","Roman civilization : selected readings /","",1990,TRUE
"9","ALDERMAN","DG 000014 .E87","X000051834","Essays on Roman culture : the Todd memorial lectures /","",1976,FALSE
"10","ALDERMAN","DG 000014 .H66  2002  V.000001","X004680690","Hommages à Carl Deroux /","",2002,TRUE
"11","ALDERMAN","DG 000014 .I83  1988","X001520274","Italia : omnium terrarum alumna : la civiltà dei Veneti, Reti, Liguri, Celti, Piceni, Umbri, Latini, Campani e Iapigi /","",1988,FALSE
"12","ALDERMAN","DG 000014 .M37  2017","X031809895","Materialising Roman histories /","",2017,FALSE
"13","ALDERMAN","DG 000015 .L54  1995","X004020293","Roman questions : selected papers /","Linderski, Jerzy.",1995,FALSE
"14","ALDERMAN","DG 000016 .P685  1929","X000692960","A topographical dictionary of ancient Rome,","Platner, Samuel Ball,",1929,FALSE
"15","ALDERMAN","DG 000016 .P685  2002","X004617633","A topographical dictionary of ancient Rome /","Platner, Samuel Ball,",2002,FALSE
"16","ALDERMAN","DG 000028 .C4613  1989B","X031713021","Roman roads /","Chevallier, Raymond,",1989,FALSE
"17","ALDERMAN","DG 000028 .L45  2016","X031783521","Imperial transportation and communication from the third to the late fourth century : the Golden Age of the cursus publicus /","Lemcke, Lukas",2016,FALSE
"18","ALDERMAN","DG 000028.5 .C676  2000","X006101632","Le strutture di servizio del cursus publicus in Italia : ricerche topografiche ed evidenze archeologiche /","Corsi, Cristina.",2000,FALSE
"19","ALDERMAN","DG 000028.5 .L38  1999","X004356281","The roads of Roman Italy : mobility and cultural change /","Laurence, Ray,",1999,FALSE
"20","ALDERMAN","DG 000029 .A6  V5313  2004","X004790912","The Appian way : [from its foundation to the Middle Ages] /","",2004,TRUE
"21","ALDERMAN","DG 000029 .S2  Z56  2004","X004915606","Sacra Via : twenty years after /","Zió?kowski, Adam",2004,FALSE
"22","ALDERMAN","DG 000030 .T73  2001","X030950515","Travel and geography in the Roman Empire /","",2001,FALSE
"23","ALDERMAN","DG 000052 .V47  2017","X032057788","From the mountains to the sea : the Roman colonisation and urbanisation of central Adriatic Italy /","Vermeulen, Frank,",2017,FALSE
"24","ALDERMAN","DG 000055 .A65  I83  2014","X031646800","The Italic people of ancient Apulia : new evidence from pottery for workshops, markets, and customs /","",2014,FALSE
"25","ALDERMAN","DG 000055 .C28  D44  2005","X031704258","Ville dell'Agro romano /","De Franceschini, Marina.",2005,TRUE
"26","ALDERMAN","DG 000055 .C3  A77  1991","X002108185","Romans in northern Campania : settlement and land-use around the Massico and the Garigliano Basin /","Arthur, Paul,",1991,FALSE
"27","ALDERMAN","DG 000055 .C3  M32  V.000002","X001732350","Ancient Campania","McKay, Alexander G.,",1972,TRUE
"28","ALDERMAN","DG 000055 .C3  T736  1986","X001228471","Tremblements de terre, éruptions volcaniques et vie des hommes dans la Campanie antique /","",1986,TRUE
"29","ALDERMAN","DG 000055 .I82  R5313  1992","X002232422","The first Western Greeks /","Ridgway, David.",1992,TRUE
"30","ALDERMAN","DG 000055 .M3  A84  2007","X030088388","Atene e l'Occidente: i grandi temi : le premesse, i protagonisti, le forme della comunicazione e dell'interazione, i modi dell'intervento ateniese in Occidente : atti del convegno internazionale, Atene, 25- 27 maggio 2006 /","",2007,FALSE
"31","ALDERMAN","DG 000055 .M3  B47  1992","X002179727","Revolution and society in Greek Sicily and southern Italy /","Berger, Shlomo.",1992,FALSE
"32","ALDERMAN","DG 000055 .M3  B73  2008","X030264427","La Magna Grecia /","Braccesi, Lorenzo.",2008,FALSE
"33","ALDERMAN","DG 000055 .M3  C65  1981","X001258273","Megale Hellas nome e immagine : atti del ventunesimo convegno di studi sulla Magna Grecia, Taranto, 2-5 Ottobre 1981.","Convegno di studi sulla Magna Grecia",1982,TRUE
"34","ALDERMAN","DG 000055 .M3  D8  1948","X000528568","The western Greeks, the history of Sicily and South Italy from the foundation of the Greek colonies to 480 B.C.","Dunbabin, T. J. (Thomas James)",1948,TRUE
"35","CLEMONS","DG 000055 .M3  D8  1979","X000903360","The western Greeks; the history of Sicily and South Italy from the foundation of the Greek colonies to 480 B.C. /","Dunbabin, T. J. (Thomas James)",1979,TRUE
"36","ALDERMAN","DG 000055 .M3  L46  2000","X004585633","La Grande Grèce : aspects et problèmes d'une ""colonisation"" ancienne : Quatre conférences au Collège de France /","Lepore, Ettore.",2000,TRUE
"37","ALDERMAN","DG 000055 .M3  L66  1993","X002405265","Rome and the Western Greeks, 350 BC -AD 200 : conquest and acculturation in Southern Italy /","Lomas, Kathryn,",1993,TRUE
"38","ALDERMAN","DG 000055 .M3  L88  1994","X002758346","Tirannidi arcaiche in Sicilia e Magna Grecia : da Panezio di Leontini alla caduta dei Dinomenidi /","Luraghi, Nino.",1994,TRUE
"39","ALDERMAN","DG 000055 .M3  M34  1999","X004412979","Magna Grecia e Sicilia : stato degli studi e prospettive di ricerca : atti dell'incontro di studi, Messina, 2-4 dicembre 1996 /","",1999,FALSE
"40","ALDERMAN","DG 000055 .M3  M45  2007","X030087921","Magna Grecia : colonie achee e pitagorismo /","Mele, Alfonso.",2007,FALSE
"41","ALDERMAN","DG 000055 .M3  P32  1987","X001730036","The Greek historians of the West : Timaeus and his predecessors /","Pearson, Lionel",1987,FALSE
"42","ALDERMAN","DG 000055 .M3  P85  2005","X004995363","Un'altra Grecia : le colonie d'Occidente tra mito, arte e memoria /","Puliga, Donatella.",2005,FALSE
"43","ALDERMAN","DG 000055 .S2  M53  2008","X031672727","Paesaggi pastorali : studio entoarcheologico sul pastoralismo in Sardegna /","Mientjes, Antoon Cornelis,",2008,FALSE
"44","ALDERMAN","DG 000055 .S2  S27  1992","X031610690","Sardinia in the Mediterranean : a footprint in the sea : studies in Sardinian Archaelogy presented to Miriam S. Balmuth /","",1992,FALSE
"45","ALDERMAN","DG 000055 .S2  V36  1998","X031744568","On colonial grounds : a comparative study of colonialism and rural settlement in first millennium BC west central Sardinia /","Dommelen, Peter Alexander René van,",1998,TRUE
"46","ALDERMAN","DG 000055 .S2  W43  2001  V.000001","X006120476","Duos Nuraghes : a Bronze Age settlement in Sardinia /","Webster, Gary S.",2001,TRUE
"47","ALDERMAN","DG 000055 .S5  C87  2003","X004683833","I frammenti di Antioco di Siracusa : introduzione, traduzione e commento /","Cuscunà, Cristina,",2003,TRUE
"48","ALDERMAN","DG 000055 .S5  D42  2003","X004699828","Megara Hyblaia and Selinous : the development of two Greek city-states in archaic Sicily /","De Angelis, Franco.",2003,TRUE
"49","ALDERMAN","DG 000055 .S5  F353  2014","X031742252","De rebus circa Regni Siciliae curiam gestis /","Falcando, Ugo,",2014,TRUE
"50","ALDERMAN","DG 000055 .S5  J36  2004","X004825581","The Greeks in Sicily /","Jannelli, Lorena,",2004,FALSE
"51","ALDERMAN","DG 000055 .S5  L45  1999","X006028992","Sicily before history : an archaeological survey from the palaeolithic to the Iron Age /","Leighton, Robert.",1999,TRUE
"52","ALDERMAN","DG 000055 .S5  S26  2007","X030264087","L'utopia di Pirro : una monarchia ellenistica in Occidente /","Santangelo, Ignazio Augusto.",2007,FALSE
"53","ALDERMAN","DG 000055 .S5  S524  2000","X006112839","Sicily from Aeneas to Augustus : new approaches in archaeology and history /","",2000,FALSE
"54","ALDERMAN","DG 000055 .S5  S55","X000693140","Sicily and the Greeks; studies in the interrelationship between the indigenous populations and the Greek colonists.","Sjöqvist, Erik,",1973,FALSE
"55","ALDERMAN","DG 000055 .S5  W54  1990","X001963710","Sicily under the Roman Empire : the archaeology of a Roman province, 36BC-AD535 /","Wilson, Roger John Anthony,",1990,FALSE
"56","ALDERMAN","DG 000055 .S5  Z25  2008","X030574655","Tradition and innovation : Sicily between Hellenism and Rome /","Zambon, Efrem.",2008,FALSE
"57","ALDERMAN","DG 000055 .S9  C38  1990","X001704143","Dionysius I, war-lord of Sicily /","Caven, Brian,",1990,TRUE
"58","ALDERMAN","DG 000055 .S9  C66  1996","X004228461","Siracusa e la Sicilia greca : tra età arcaica ed alto ellenismo /","Consolo Langher, Sebastiana Nerina.",1996,TRUE
"59","ALDERMAN","DG 000059 .A2  A64  2000","X004420478","Imperial ideology and provincial loyalty in the Roman Empire /","Ando, Clifford,",2000,FALSE
"60","ALDERMAN","DG 000059 .A2  C6  1949","X030214308","The Congress of Roman Frontier Studies, 1949.","Congress of Roman Frontier Studies",1952,TRUE
"61","ALDERMAN","DG 000059 .A2  D97  1985","X000928414","The creation of the Roman frontier /","Dyson, Stephen L.",1985,TRUE
"62","ALDERMAN","DG 000059 .A2  E35  2014","X031650887","The edges of the Roman world /","",2014,FALSE
"63","ALDERMAN","DG 000059 .A2  F75  2013","X031705681","Frontiers of the Roman Empire = Grenzen des Römischen Reiches = Frontières de l'Empire Romain /","",2013,TRUE
"64","ALDERMAN","DG 000059 .A2  H34  1997","X004435951","Capita provinciarum : Statthaltersitze und Provinzialverwaltung in der römischen Kaiserzeit /","Haensch, Rudolf.",1997,FALSE
"65","ALDERMAN","DG 000059 .A2  I57  1989","X002035359","Roman frontier studies 1989 : proceedings of the XVth International Congress of Roman Frontier Studies /","International Congress of Roman Frontier Studies",1991,FALSE
"66","ALDERMAN","DG 000059 .A2  I57  1995","X006136400","Roman frontier studies 1995 : proceedings of the XVIth International Congress of Roman Frontier Studies /","International Congress of Roman Frontier Studies",1997,FALSE
"67","ALDERMAN","DG 000059 .A2  W557  2004","X004743406","Rome and its frontiers : the dynamics of empire /","Whittaker, C. R.",2004,FALSE
"68","ALDERMAN","DG 000059 .A2  W58  1996","X004029546","The reach of Rome : a history of the Roman imperial frontier, 1st-5th centuries /","Williams, Derek,",1996,FALSE
"69","ALDERMAN","DG 000059 .A34  V55  2013","X031737456","Villae rusticae : Family and market-oriented farms in Greece under Roman rule : Proceedings of an international congress held at Patrai, 23-24 April 2010 /","",2013,TRUE
"70","ALDERMAN","DG 000059 .D3  O47  2007","X030275701","Dacia : landscape, colonisation and romanisation /","Oltean, Ioana A. (Ioana Adina)",2007,FALSE
"71","ALDERMAN","DG 000059 .D3  R68","X000090744","Trajan's column and the Dacian wars.","Rossi, Lino.",1971,TRUE
"72","ALDERMAN","DG 000059 .E8  W45  1999","X004279717","The barbarians speak : how the conquered peoples shaped Roman Europe /","Wells, Peter S.",1999,FALSE
"73","ALDERMAN","DG 000059 .G2  E24","X001731626","Transalpine Gaul : the emergence of a Roman province /","Ebel, Charles,",1976,FALSE
"74","ALDERMAN","DG 000059 .M26  K35  1995","X002719996","Hegemony to empire : the development of the Roman Imperium in the East from 148 to 62 B.C. /","Morstein-Marx, Robert.",1995,FALSE
"75","ALDERMAN","DG 000059 .M26  S25  MEROS A","X031882112","[R?maioi archontes t?s eparchias Makedonias /","Sarikak?s, Theod?ros Ch.",1971,FALSE
"76","ALDERMAN","DG 000059 .M44  I55  2018","X031823951","Insularity and identity in the Roman Mediterranean /","",2018,FALSE
"77","ALDERMAN","DG 000059 .M7  B4615","X000843279","Auxilia Romana in Moesia atque in Dacia : zu den Fragen des römischen Verteidigungssystems im Unteren Donauraum und in den angrenzenden Gebieten /","Ben?s, Jan,",1978,FALSE
"78","ALDERMAN","DG 000059 .S9  B78  2011","X031197073","Le pouvoir impérial dans les provinces syriennes : représentations et célébrations d'Auguste à Constantin (31 av. J.-C.-337 ap. J.-C.) /","Bru, Hadrien.",2011,FALSE
"79","ALDERMAN","DG 000059 .S9  V583  2013","X031577241","Koinon Syrias : Priester, Gymnasiarchen und Metropoleis der Eparchien im kaiserzeitlichen Syrien /","Vitale, Marco",2013,TRUE
"80","ALDERMAN","DG 000062.5 .L23  Z673  2008","X030395763","The virtual tourist in Renaissance Rome : printing and collecting the Speculum romanae magnificentiae /","Zorach, Rebecca,",2008,FALSE
"81","ALDERMAN","DG 000063 .A57  2000","X004545308","Ancient Rome : the archaeology of the eternal city /","",2000,FALSE
"82","ALDERMAN","DG 000063 .A8513  2017  V.000001","X031846996","The atlas of Ancient Rome : biography and portraits of the city /","",2017,TRUE
"83","ALDERMAN","DG 000063 .C284  2013","X031604320","The Cambridge companion to ancient Rome /","",2013,FALSE
"84","ALDERMAN","DG 000063 .G28  1991","X001941502","The Roman household : a sourcebook /","Gardner, Jane F.",1991,FALSE
"85","ALDERMAN","DG 000063 .J33  1993","X002424502","The antiquarian and the myth of antiquity : the origins of Rome in Renaissance thought /","Jacks, Philip Joshua,",1993,FALSE
"86","ALDERMAN","DG 000063 .K37  2000","X004585455","Topographie de Rome : les sources littéraires latines /","Kardos, Marie-José.",2000,FALSE
"87","ALDERMAN","DG 000063 .N5  1973  V.000002","X031882105","Analisi storico-topografico-antiquaria della carta de' dintorni di Roma /","Nibby, A. (Antonio),",1973,TRUE
"88","ALDERMAN","DG 000063 .R65  2003","X004690280","Rome the cosmopolis /","",2003,FALSE
"89","ALDERMAN","DG 000063 .S63  2002","X004680688","Neronia VI : Rome à l'époque néronienne : institutions et vie politique, économie et société, vie intellectuelle, artistique et spirituelle : actes du VIe Colloque international de la SIEN (Rome, 19-23 mai 1999) /","Société internationale d'études néroniennes. Colloque",2002,FALSE
"90","ALDERMAN","DG 000063 .T86  2012","X031215108","Two Romes : Rome and Constantinople in late antiquity /","",2012,FALSE
"91","ALDERMAN","DG 000065 .B56  2016  V.000001","X031783469","Rome in triumph /","Biondo Flavio,",2016,TRUE
"92","ALDERMAN","DG 000066 .J33  2014","X031705211","Campus Martius : the Field of Mars in the life of ancient Rome /","Jacobs, Paul W.,",2014,FALSE
"93","ALDERMAN","DG 000066 .M54  2016","X031790647","The Republican Aventine and Rome's social order /","Mignone, Lisa,",2016,FALSE
"94","ALDERMAN","DG 000066 .P46  1999","X006003695","The Urban economy during the early dominate : pottery evidence from the Palatine Hill /","Peña, J. Theodore.",1999,FALSE
"95","ALDERMAN","DG 000066 .R44  2006","X030115934","Imperium and cosmos : Augustus and the northern Campus Martius /","Rehak, Paul.",2006,FALSE
"96","ALDERMAN","DG 000066.5 .A5  1984","X000844383","The historical topography of the Imperial fora /","Anderson, James C.,",1984,FALSE
"97","ALDERMAN","DG 000066.5 .G67  2015","X031761998","The Roman Forum : a reconstruction and architectural guide /","Gorski, Gilbert,",2015,FALSE
"98","ALDERMAN","DG 000066.5 .K35  2015","X031707141","The restoration of the Roman Forum in late antiquity : transforming public space /","Kalas, Gregor,",2015,FALSE
"99","ALDERMAN","DG 000067 .B56","X000421814","Roman construction in Italy from Tiberius through the Flavians.","Blake, Marion Elizabeth,",1959,FALSE
"100","ALDERMAN","DG 000067 .D49  2011","X031603156","The Aurelian wall and the refashioning of Imperial Rome, A.D. 271-855 /","Dey, Hendrik W.,",2011,FALSE
"101","ALDERMAN","DG 000068 .D83  1967","X000393594","Urbs Roma: a source book of classical texts on the city & its monuments,","Dudley, Donald R. (Donald Reynolds)",1967,FALSE
"102","ALDERMAN","DG 000068 .R5  1992","X004268414","A new topographical dictionary of ancient Rome /","Richardson, Lawrence,",1992,FALSE
"103","ALDERMAN","DG 000069 .A43  2007","X030114529","Floods of the Tiber in ancient Rome /","Aldrete, Gregory S.",2007,FALSE
"104","ALDERMAN","DG 000069 .A86","X000985531","Aspects of Graeco-Roman urbanism : essays on the classical city /","",1983,FALSE
"105","CLEMONS","DG 000069 .F38  1996","X004092155","The urban image of Augustan Rome /","Favro, Diane G.",1996,FALSE
"106","ALDERMAN","DG 000069 .H37  2014","X031671915","The Horologium of Augustus : debate and context /","Haselberger, Lothar,",2014,FALSE
"107","ALDERMAN","DG 000069 .M39  2013  PT.000001","X031595445","Le decorazioni dipinte e marmoree della domus aurea di Nerone a Roma /","Meyboom, P. G. P.,",2013,TRUE
"108","ALDERMAN","DG 000069 .N33  2015","X031721528","Legendary rivals : collegiality and ambition in the tales of early Rome /","Neel, Jaclyn,",2015,FALSE
"109","ALDERMAN","DG 000069 .P34  1990","X001803164","Studies of the northern Campus Martius in ancient Rome /","Palmer, Robert E. A.",1990,FALSE
"110","ALDERMAN","DG 000069 .R5  1982","X000319923","Trajan's army on Trajan's Column /","Richmond, I. A. (Ian Archibald),",1982,FALSE
"111","ALDERMAN","DG 000069 .R64  2011","X031194701","Rom und Mailand in der Spätantike : Repräsentationen städtischer Räume in Literatur, Architektur und Kunst /","",2011,FALSE
"112","ALDERMAN","DG 000070 .A1  L38  2011","X031188094","The city in the Roman West, c. 250 BC-c. AD 250 /","Laurence, Ray,",2011,TRUE
"113","CLEMONS","DG 000070 .A1  L65  1996","X004005400","Roman Italy, 338 BC-AD 200 : a sourcebook /","Lomas, Kathryn,",1996,TRUE
"114","ALDERMAN","DG 000070 .A1  P37  2006","X004834356","Landscapes and cities : rural settlement and civic transformation in early imperial Italy /","Patterson, John R.",2006,FALSE
"115","ALDERMAN","DG 000070 .A3  A375  1992","X002228107","Agrigento e la Sicilia greca : atti della settimana di studio, Agrigento, 2-8 maggio 1988 /","",1992,FALSE
"116","ALDERMAN","DG 000070 .A587  B76  1980","X000081875","Cosa, the making of a Roman town /","Brown, Frank Edward,",1980,FALSE
"117","ALDERMAN","DG 000070 .A6  S68  2005","X030008385","Identité civique et christianisme : Aquilée du IIIe au VIe siècle /","Sotinel, Claire.",2005,FALSE
"118","ALDERMAN","DG 000070 .C6  N68","X031916091","Urbanismo italico a Cortona nel suo impianto umbro, etrusco, romano.","Novelli, Novello.",1973,FALSE
"119","ALDERMAN","DG 000070 .C63  G76  2017","X031821909","The Hellenistic, Roman, and medieval glass from Cosa /","Grose, David F.,",2017,TRUE
"120","ALDERMAN","DG 000070 .E5  T73  2012","X031622453","Tra storia e letteratura : il parlamento di Empoli del 1260 : atti della giornata di studio in occasione del 750° anniversario /","",2012,TRUE
"121","ALDERMAN","DG 000070 .L6  B45  2012","X031609291","Il Canto delle vergini locresi : la musica a Locri Epizefrii nelle fonti scritte e nelle documentazione archeologica (secoli VI-II a.C. /","Bella, Angela.",2012,FALSE
"122","ALDERMAN","DG 000070 .M52  L358  2014","X031652285","The chora of Metaponto 5 : a Greek farmhouse at Ponte Fabrizio /","Lanza Catti, Elisa,",2014,TRUE
"123","ALDERMAN","DG 000070 .O8  B65  2013","X031642182","Ostia in late antiquity /","Boin, Douglas,",2013,FALSE
"124","ALDERMAN","DG 000070 .O8  C45  1986","X001225615","Ostie antique : ville et port /","Chevallier, Raymond,",1986,TRUE
"125","ALDERMAN","DG 000070 .O8  H47","X000370787","Ostia : aspects of Roman city life /","Hermansen, Gustav,",1981,FALSE
"126","ALDERMAN","DG 000070 .O8  M4  1973","X000188435","Roman Ostia /","Meiggs, Russell.",1973,FALSE
"127","ALDERMAN","DG 000070 .O8  O77  2002","X004714982","Ostia e Portus nelle loro relazioni con Roma : atti del convegno all'Institutum Romanum Finlandiae, 3 e 4 dicembre 1999 /","",2002,FALSE
"128","ALDERMAN","DG 000070 .O8  P4  1986","X001291593","La vita quotidiana a Ostia /","Pavolini, Carlo.",1986,FALSE
"129","ALDERMAN","DG 000070 .P7  A66","X000288671","Les affaires de Monsieur Jucundus /","Andreau, Jean.",1974,FALSE
"130","ALDERMAN","DG 000070 .P7  B43  2008","X030469518","The fires of Vesuvius : Pompeii lost and found /","Beard, Mary,",2008,FALSE
"131","ALDERMAN","DG 000070 .P7  B44  2008","X030571036","Pompeii : the life of a Roman town /","Beard, Mary,",2008,FALSE
"132","ALDERMAN","DG 000070 .P7  B468  2007","X030263419","The complete Pompeii /","Berry, Joanne,",2007,FALSE
"133","ALDERMAN","DG 000070 .P7  B93  2006","X030108733","Pompeii : the living city /","Butterworth, Alex.",2006,FALSE
"134","ALDERMAN","DG 000070 .P7  C23613  2003","X004757466","A Day in Pompeii : daily life, culture and society /","Cantarella, Eva.",2003,TRUE
"135","ALDERMAN","DG 000070 .P7  C26  2015","X032068669","The tombs of Pompeii : organization, space, and society /","Campbell, Virginia L.",2015,TRUE
"136","ALDERMAN","DG 000070 .P7  C3","X000480846","Ordo populusque Pompeianus : polity and society in Roman Pompeii /","Castrén, Paavo,",1975,TRUE
"137","ALDERMAN","DG 000070 .P7  C628  2004","X004743774","Pompeii : a sourcebook /","Cooley, Alison.",2004,TRUE
"138","ALDERMAN","DG 000070 .P7  C628  2014","X032576638","Pompeii and Herculaneum : a sourcebook /","Cooley, Alison,",2014,TRUE
"139","ALDERMAN","DG 000070 .P7  C68213  1951","X031070775","The destruction and resurrection of Pompeii and Herculaneum.","Corti, Egon Caesar,",1951,TRUE
"140","ALDERMAN","DG 000070 .P7  D3743  2003","X004683835","Vesuvius, A.D. 79 : the destruction of Pompeii and Herculaneum /","De Carolis, Ernesto.",2003,TRUE
"141","ALDERMAN","DG 000070 .P7  F57  2004","X004773642","Reisen in das befremdliche Pompeji : antiklassizistische Antikenwahrnehmung deutscher Italienreisender 1750-1870 /","Fitzon, Thorsten.",2004,TRUE
"142","ALDERMAN","DG 000070 .P7  F69  1978","X000069519","The buried cities : Pompeii & Herculaneum /","De Franciscis, Alfonso.",1978,TRUE
"143","ALDERMAN","DG 000070 .P7  F75  2001","X004526179","Pompeis difficile est : studies in the political life of imperial Pompeii /","Franklin, James L.",2001,TRUE
"144","ALDERMAN","DG 000070 .P7  G27  1986","X001317659","Die Kaufläden in Pompeii /","Gassner, Verena.",1986,TRUE
"145","ALDERMAN","DG 000070 .P7  H37  2007","X030262748","Pompeii awakened : a story of rediscovery /","Harris, Judith (Judith Owen)",2007,FALSE
"146","ALDERMAN","DG 000070 .P7  J6  1988","X001460705","The economy and society of Pompeii /","Jongman, Willem M.",1988,FALSE
"147","ALDERMAN","DG 000070 .P7  L413  1968","X000418783","Pompeii in fact and fiction.","Leppmann, Wolfgang.",1968,TRUE
"148","ALDERMAN","DG 000070 .P7  L56  2005","X004909219","Pompeii : history, life & afterlife /","Ling, Roger.",2005,TRUE
"149","ALDERMAN","DG 000070 .P7  M4413  1982","X001926978","Pompeii, its life and art /","Mau, August,",1982,FALSE
"150","ALDERMAN","DG 000070 .P7  P765  1992","X002251510","Pompeii : the vanished city /","",1992,FALSE
"151","ALDERMAN","DG 000070 .P7  R78  2014","X031601198","From Pompeii : the afterlife of a Roman town /","Rowland, Ingrid D. (Ingrid Drake)",2014,TRUE
"152","ALDERMAN","DG 000070 .P7  S43  2006","X030612342","Metrology and meaning in Pompeii : the urban arrangement of Regio VI /","Schoonhoven, Astrid V.",2006,FALSE
"153","ALDERMAN","DG 000070 .P7  T3","X030152686","The common people of Pompeii : a study of the graffiti /","Tanzer, Helen H. (Helen Henrietta),",1939,TRUE
"154","ALDERMAN","DG 000070 .P7  V29  2009","X004681777","Quotidien des dieux et des hommes : la vie religieuse dans les cités du Vésuve à l'époque romaine /","Van Andringa, William.",2009,TRUE
"155","ALDERMAN","DG 000070 .P7  W33  1994","X002532327","Houses and society in Pompeii and Herculaneum /","Wallace-Hadrill, Andrew.",1994,FALSE
"156","ALDERMAN","DG 000070 .P7  Z3613  1998","X004265123","Pompeii : public and private life /","Zanker, Paul.",1998,FALSE
"157","ALDERMAN","DG 000070 .S77  E92  2016","X031789402","Exacavation and study of the garden of the great peristyle of the Villa Arianna, Stabiae, 2007-2012.","",2016,FALSE
"158","ALDERMAN","DG 000070 .S86  C35  2008","X031607649","Il cibo nel mondo fenicio e punico d'Occidente : un'indagine sulle abitudini alimentari attraverso l'analisi di un deposito urbano di Sulky in Sardegna /","Campanella, Lorenza.",2008,TRUE
"159","ALDERMAN","DG 000075 .A35  2004","X004769238","Handbook to life in ancient Rome /","Adkins, Lesley.",2004,FALSE
"160","ALDERMAN","DG 000076 .B5  I68  2017","X031811641","The invention of Rome : Biondo Flavio's Roma triumphans and its worlds /","",2017,FALSE
"161","CLEMONS","DG 000076 .O94  1988","X004003836","The Roman world /","",1988,FALSE
"162","ALDERMAN","DG 000077 .A585  2014","X031601166","Ancient Rome : an anthology of sources /","",2014,FALSE
"163","ALDERMAN","DG 000077 .B3  1962","X030158491","The legacy of Rome : essays /","Bailey, Cyril,",1962,FALSE
"164","ALDERMAN","DG 000077 .B317  2001","X006101247","Rome in the east : the transformation of an empire /","Ball, Warwick.",2001,FALSE
"165","ALDERMAN","DG 000077 .B335  2013","X031619357","Polybius and Roman imperialism /","Baronowski, Donald Walter,",2013,FALSE
"166","ALDERMAN","DG 000077 .B73  1980","X000273241","The world of late antiquity : AD 150-750 /","Brown, Peter,",1980,FALSE
"167","ALDERMAN","DG 000077 .C4813  1984","X000690891","The Romans : an introduction to their history and civilisation /","Christ, Karl,",1984,FALSE
"168","ALDERMAN","DG 000077 .C55  2002","X004624315","Classics in progress : essays on ancient Greece and Rome /","",2002,FALSE
"169","ALDERMAN","DG 000077 .C577  1999","X004412514","Between geography and history : Hellenistic constructions of the Roman world /","Clarke, Katherine.",1999,FALSE
