"","Item.Library.Code","Item.Shelving.Id","Item.Barcode","Catalog.Title","Catalog.Author","Catalog.Pub.Year","MultiVolume"
"514","ALDERMAN","DG 000210 .S35  1847A","X031876073","A history of Rome, from the earliest times to the death of Commodus, A.D. l92.","Schmitz, Leonhard,",1867,FALSE
"515","ALDERMAN","DG 000210.5 .R5  1987","X001787990","History of Rome : a documented analysis /","Ridley, Ronald T.,",1987,FALSE
"516","CLEMONS","DG 000211 .B56  2006","X006196360","Rome, inc. : the rise and fall of the first multinational corporation /","Bing, Stanley.",2006,FALSE
"517","ALDERMAN","DG 000211 .C28  2012","X031195448","Rivers and the power of ancient Rome /","Campbell, J. B.",2012,FALSE
"518","ALDERMAN","DG 000211 .C85  2015","X031734595","Cultural memories in the Roman Empire /","",2015,FALSE
"519","ALDERMAN","DG 000211 .F56  2006","X030115564","The art of forgetting : disgrace & oblivion in Roman political culture /","Flower, Harriet I.",2006,FALSE
"520","ALDERMAN","DG 000211 .I594  2001","X004688301","L'invention des grands hommes de la Rome antique = Die Konstruktion der grossen Männer Altroms : actes du colloque du Collegium Beatus Rhenanus, Augst 16-18 septembre 1999 /","",2001,FALSE
"521","ALDERMAN","DG 000211 .L5  1968","X000111758","Violence in republican Rome,","Lintott, A. W. (Andrew William)",1968,FALSE
"522","ALDERMAN","DG 000211 .M46  2014","X031640375","Memoria Romana : memory in Rome and Rome in memory /","",2014,FALSE
"523","ALDERMAN","DG 000211 .P343  2012","X031617968","Conspiracy theory in Latin literature /","Pagan, Victoria Emma,",2012,FALSE
"524","ALDERMAN","DG 000213 .C66  2003","X004749732","Consuetudinis amor : fragments d'histoire romaine (IIe-VIe siècles) offerts à Jean-Pierre Callu /","",2003,FALSE
"525","ALDERMAN","DG 000213 .L18  1873  V.000002","X031876059","The heroes of the seven hills","Laing, C. H. B.",1973,TRUE
"526","ALDERMAN","DG 000214.5 .A45  2006","X004904433","Hostages and hostage-taking in the Roman Empire /","Allen, Joel,",2006,FALSE
"527","ALDERMAN","DG 000214.5 .B87  2011","X031613127","Friendship and empire : Roman diplomacy and imperialism in the middle republic (353-146 BC) /","Burton, Paul J.,",2011,FALSE
"528","ALDERMAN","DG 000214.5 .D56  2009","X030468751","Diplomats and diplomacy in the Roman world /","",2009,FALSE
"529","ALDERMAN","DG 000214.5 .R66  2005","X004995175","Roms auswärtige Freunde in der späten Republik und im frühen Prinzipat /","",2005,FALSE
"530","ALDERMAN","DG 000215 .C37  P35  1997","X006076038","Rome and Carthage at peace /","Palmer, Robert E. A.",1997,FALSE
"531","ALDERMAN","DG 000215 .M53  S56  2017","X031805811","Sinews of empire : networks in the Roman Near East and beyond /","",2017,FALSE
"532","ALDERMAN","DG 000215 .N33  A9  1999","X004545456","Der Vertrag zwischen Rom und Kallatis : ein Beitrag zum römischen Völkerrecht /","Avram, Alexandru.",1999,FALSE
"533","ALDERMAN","DG 000215 .N33  S53  1984","X000667326","Roman foreign policy in the East, 168 B.C. to A.D. 1 /","Sherwin-White, A. N. (Adrian Nicholas)",1984,FALSE
"534","ALDERMAN","DG 000221 .A53  2007","X030278813","Ancient Italy : regions without boundaries /","",2007,FALSE
"535","ALDERMAN","DG 000221 .B5513  1960","X031876068","The origins of Rome.","Bloch, Raymond,",1960,FALSE
"536","ALDERMAN","DG 000221 .P342  V.000002","X032050381","Saggi di antichità /","Pallottino, Massimo.",1979,TRUE
"537","ALDERMAN","DG 000221 .P34513  1991","X001904619","A history of earliest Italy /","Pallottino, Massimo.",1991,FALSE
"538","ALDERMAN","DG 000221.5 .B68  2012","X031609890","Les peuples de l'Italie préromaine : identités, territoires et relations inter-ethniques en Italie centrale et Septentrionale (VIIIe-Ier s. av. J.-C.) /","Bourdin, Stéphane,",2012,FALSE
"539","ALDERMAN","DG 000221.5 .D46  1995","X002685412","From barbarians to new men : Greek, Roman, and modern perceptions of peoples of the central Apennines /","Dench, Emma.",1995,FALSE
"540","ALDERMAN","DG 000221.5 .F85  2014","X031627988","The urbanization of Rome and Latium Vetus : from the Bronze Age to the Archaic Era /","Fulminante, Francesca,",2014,FALSE
"541","ALDERMAN","DG 000221.5 .L66  2018","X031841298","The rise of Rome : from the Iron Age to the Punic Wars /","Lomas, Kathryn,",2018,FALSE
"542","ALDERMAN","DG 000223 .B345  1998","X004083486","The Etruscans /","Barker, Graeme.",1998,FALSE
"543","ALDERMAN","DG 000223 .C17  2000","X004545543","Gli etruschi : storia e civiltà /","Camporeale, Giovannangelo.",2000,FALSE
"544","ALDERMAN","DG 000223 .C643  2016","X031798235","A companion to the Etruscans /","",2016,FALSE
"545","ALDERMAN","DG 000223 .D41  1907  V.000001","X030498028","The cities and cemeteries of Etruria,","Dennis, George,",1907,TRUE
"546","ALDERMAN","DG 000223 .E75  1986B","X006132224","Etruscan life and afterlife : a handbook of Etruscan studies /","",1986,FALSE
"547","ALDERMAN","DG 000223 .E87  2017  V.000001","X032576767","Etruscology /","",2017,TRUE
"548","ALDERMAN","DG 000223 .G76  1980","X000160488","The Etruscans /","Grant, Michael,",1980,FALSE
"549","ALDERMAN","DG 000223 .H352  001968","X000090791","Tarquinia and Etruscan origins","Hencken, Hugh,",1968,FALSE
"550","ALDERMAN","DG 000223 .H413  1964","X000188446","Daily life of the Etruscans.","Heurgon, Jacques.",1964,FALSE
"551","ALDERMAN","DG 000223 .N48  2009","X030567385","New perspectives on Etruria and early Rome /","",2009,FALSE
"552","ALDERMAN","DG 000223 .P43  1999","X006003691","Etruscan settlement, society and material culture in central coastal Etruria /","Perkins, Philip,",1999,FALSE
"553","ALDERMAN","DG 000223 .S52  2017","X031824910","The Etruscans /","Shipley, Lucy,",2017,FALSE
"554","ALDERMAN","DG 000223 .S58  2014","X031629331","The Etruscans : a very short introduction /","Smith, Christopher John,",2014,FALSE
"555","ALDERMAN","DG 000223 .W44  1990","X002106931","Die Welt der Etrusker : internationales Kolloquium, 24.-26. Oktober 1988 in Berlin /","",1990,FALSE
"556","ALDERMAN","DG 000223.3 .E88  1996","X004047554","Etruscan Italy : Etruscan influences on the civilizations of Italy from antiquity to the modern era /","",1996,FALSE
"557","ALDERMAN","DG 000223.3 .E883  2013","X031798122","The Etruscan world /","",2013,FALSE
"558","ALDERMAN","DG 000223.3 .H39  2000B","X004500230","Etruscan civilization : a cultural history /","Haynes, Sybille.",2000,FALSE
"559","ALDERMAN","DG 000223.3 .L38  2009","X030566446","Roman passions : a history of pleasure in Imperial Rome /","Laurence, Ray,",2009,FALSE
"560","ALDERMAN","DG 000223.3 .M3","X000693271","Everyday life of the Etruscans;","Macnamara, Ellen.",1973,FALSE
"561","ALDERMAN","DG 000223.7 .S76  C48  2002","X004667868","Acque Sorgive Salutari e Sacre in Etruria (Italiae Regio VII) : ricerche archeologiche e di topografia antica /","Chellini, Riccardo.",2002,TRUE
"562","ALDERMAN","DG 000225 .A73  Q34  2009","X031610025","al-Kan??n?y?n wa-al-?r?m?y?n al-?Arab f? al-Imbir???r?yah al-R?m?n?yah min al-qarn,1 q.m. wa-?attá al-qarn, 3 M?l?d? wa-al-ab??irah alladh?na ?akam? R?m? /","Qubays?, Mu?ammad Bahjat.",2009,FALSE
"563","ALDERMAN","DG 000225 .G38  W55  2001","X004559485","Beyond the Rubicon : Romans and Gauls in Republican Italy /","Williams, J. H. C.",2001,FALSE
"564","ALDERMAN","DG 000225 .S2  C66  1982","X002060062","Convegno di studio: Preistoria, storia e civiltà dei sabini, Rieti, ottobre 1982 /","Convegno di studio: Preistoria, storia e civiltà dei sabini",1985,TRUE
"565","ALDERMAN","DG 000225 .S26  S42  2015","X031732971","Ancient Samnium : settlement, culture, and identity between history and archaeology /","Scopacasa, Rafael,",2015,FALSE
"566","ALDERMAN","DG 000225 .V37  D86  2010","X030810968","Les Vestins à l'époque tardo-républicaine : du nord-osque au latin /","Dupraz, Emmanuel.",2010,TRUE
"567","ALDERMAN","DG 000231 .A73  2015","X031731920","Sacred founders : women, men, and gods in the Roman and early Byzantine discourse of imperial founding /","Angelova, Diliana,",2015,FALSE
"568","ALDERMAN","DG 000231 .B43  2015","X031734213","SPQR : a history of ancient Rome /","Beard, Mary,",2015,FALSE
"569","ALDERMAN","DG 000231 .B7913  2007","X004832072","A history of the Roman republic /","Bringmann, Klaus.",2007,FALSE
"570","ALDERMAN","DG 000231 .C65  2015","X031647025","The life of Roman republicanism /","Connolly, Joy,",2015,FALSE
"571","ALDERMAN","DG 000231 .D95  1992","X002066904","Community and society in Roman Italy /","Dyson, Stephen L.",1992,FALSE
"572","ALDERMAN","DG 000231 .F567  2010","X030562679","Roman republics /","Flower, Harriet I.",2010,FALSE
"573","ALDERMAN","DG 000231 .G89  2012","X031619554","The Roman Republic : a very short introduction /","Gwynn, David M. (David Morton),",2012,FALSE
"574","ALDERMAN","DG 000231 .K23  1995","X002706198","The Romans : an introduction /","Kamm, Antony.",1995,FALSE
"575","ALDERMAN","DG 000231 .K23  2008","X030471937","The Romans : an introduction /","Kamm, Antony.",2008,FALSE
"576","ALDERMAN","DG 000231 .M23  2008","X030464022","Empires of trust : how Rome built--and America is building--a new world /","Madden, Thomas F.",2008,FALSE
"577","ALDERMAN","DG 000231 .M33  2004","X004810693","Ancient Rome : a military and political history /","Mackay, Christopher S.,",2004,FALSE
"578","ALDERMAN","DG 000231 .M985  2003","X004690202","Myth, history and culture in republican Rome : studies in honour of T.P. Wiseman /","",2003,FALSE
"579","ALDERMAN","DG 000231 .O75  2018","X031839346","Rome and the making of a world state, 150 BCE-20 CE /","Osgood, Josiah,",2018,FALSE
"580","ALDERMAN","DG 000231 .S35  2003","X004657093","A history of the Roman world : 753 to 146 BC /","Scullard, H. H. (Howard Hayes),",2003,FALSE
"581","ALDERMAN","DG 000231 .S35  2013","X031618433","A history of the Roman world : 753 to 146 BC /","Scullard, H. H. (Howard Hayes),",2013,FALSE
"582","ALDERMAN","DG 000231.3 .A76  2016","X031795400","War and society in early Rome : from warlords to generals /","Armstrong, Jeremy",2016,FALSE
"583","ALDERMAN","DG 000231.3 .B36  1997","X004115323","The brothers of Romulus : fraternal Pietas in Roman law, literature, and society /","Bannon, Cynthia Jordan.",1997,FALSE
"584","ALDERMAN","DG 000231.3 .D76  2015","X031706813","Commanders & command in the Roman Republic and Early Empire /","Drogula, Fred K.,",2015,FALSE
"585","ALDERMAN","DG 000231.3 .H3","X000036980","War and imperialism in Republican Rome, 327-70 B.C. /","Harris, William V. (William Vernon)",1979,FALSE
"586","ALDERMAN","DG 000231.3 .H3  1989","X031788906","War and imperialism in Republican Rome, 327-70 B.C. /","Harris, William V. (William Vernon)",1989,FALSE
"587","ALDERMAN","DG 000231.3 .L56  2014","X031718697","Liqian wen hua yu si chou zhi lu yan jiu /","",2014,FALSE
"588","ALDERMAN","DG 000231.3 .M67  2000","X006115634","Mos maiorum : Untersuchungen zu den Formen der Identitätsstiftung und Stabilisierung in der Römischen Republik /","",2000,FALSE
"589","ALDERMAN","DG 000231.3 .R534  2012","X031232179","The Fabii and the Gauls : studies in historical thought and historiography in Republican Rome /","Richardson, James H.",2012,FALSE
"590","ALDERMAN","DG 000231.3 .R66  2005","X004910160","Roman crossings : theory and practice in the Roman Republic /","",2005,FALSE
"591","ALDERMAN","DG 000231.3 .R67  2017","X031818903","Public opinion and politics in the late Roman republic /","Rosillo López, Cristina",2017,FALSE
"592","ALDERMAN","DG 000231.7 .A77","X001123469","Politics and policies in the Roman republic: an inaugural lecture delivered before The Queen's University of Belfast on 1 May 1968","Astin, A. E.",1968,FALSE
"593","ALDERMAN","DG 000233 .C67  1995","X002698203","The beginnings of Rome /","Cornell, Tim.",1995,FALSE
"594","ALDERMAN","DG 000233 .G33  1991","X002035064","Dionysius and The history of archaic Rome /","Gabba, Emilio.",1991,FALSE
"595","ALDERMAN","DG 000233 .L44  2006  V.000001","X030087260","La leggenda di Roma /","",2006,TRUE
"596","ALDERMAN","DG 000233 .O44  1976","X000090928","Early Rome and the Etruscans /","Ogilvie, R. M. (Robert Maxwell),",1976,FALSE
"597","ALDERMAN","DG 000233 .O7515  2004","X004781322","Origo Gentis Romanae = Die Ursprünge des römischen Volkes /","",2004,FALSE
"598","ALDERMAN","DG 000233 .P68  2000","X004640346","Les rois de Rome : tradition et histoire /","Poucet, Jacques,",2000,FALSE
"599","ALDERMAN","DG 000233.2 .C37  2003  V.000002","X004718471","La nascita di Roma : dèi, lari, eroi e uomini all'alba di una civiltà /","Carandini, Andrea.",2003,TRUE
"600","ALDERMAN","DG 000233.2 .M48  2000","X004651385","L'idée de gémellité dans la légende des origines de Rome /","Meurant, Alain.",2000,FALSE
"601","ALDERMAN","DG 000233.2 .S4713  1991","X002035342","Rome : the book of foundations /","Serres, Michel.",1991,FALSE
"602","CLEMONS","DG 000233.2 .S63  1996","X002755741","Early Rome and Latium : economy and society, c. 1000 to 500 BC /","Smith, Christopher John,",1996,FALSE
"603","ALDERMAN","DG 000233.3 .C37513  2011","X030947476","Rome : day one /","Carandini, Andrea.",2011,FALSE
"604","ALDERMAN","DG 000233.3 .F7313  2005","X004835241","The foundation of Rome /","Fraschetti, Augusto.",2005,FALSE
"605","ALDERMAN","DG 000233.8 .T47  1980","X000222355","King Servius Tullius : a historical synthesis /","Thomsen, Rudi,",1980,FALSE
"606","ALDERMAN","DG 000233.9 .A34  2013","X031849376","The age of Tarquinius Superbus : central Italy in the late 6th century BC : proceedings of the conference The age of Tarquinius Superbus : a paradigm shift?, Rome, 7-9 November, 2013 /","Age of Tarquinius Superbus, a Paradigm Shift?",2017,FALSE
"607","ALDERMAN","DG 000235 .C36  2004","X004746226","The Cambridge Companion to the Roman Republic /","",2004,FALSE
"608","ALDERMAN","DG 000235 .C36  2014","X031654695","The Cambridge companion to the Roman Republic /","",2014,FALSE
"609","CLEMONS","DG 000235 .C65  2006","X031190540","A companion to the Roman Republic /","",2006,FALSE
"610","ALDERMAN","DG 000235 .C7  1978","X000090916","The Roman Republic /","Crawford, Michael H. (Michael Hewson),",1978,FALSE
"611","ALDERMAN","DG 000235 .C7  1993","X002759323","The Roman republic /","Crawford, Michael H. (Michael Hewson),",1993,FALSE
"612","ALDERMAN","DG 000235 .G56  2004","X004855706","Epigrafia e storia di Roma /","Giorcelli Bersani, Silvia.",2004,FALSE
"613","ALDERMAN","DG 000235 .L58  1994","X002588048","Ab urbe condita.","Livy.",1994,FALSE
"614","ALDERMAN","DG 000235 .V47  2014","X031638412","The high command in the Roman republic : the principle of the summum imperium auspiciumque from 509 to 19 BCE /","Vervaet, Frederik",2014,FALSE
"615","ALDERMAN","DG 000235.2 .H47  2006","X030196736","Herrschaft ohne Integration? : Rom und Italien in Republikanischer Zeit /","",2006,FALSE
"616","ALDERMAN","DG 000235.2 .S72  1990","X001804068","Staat und Staatlichkeit in der frühen römischen Republik : Akten eines Symposiums, 12.-15. Juli 1988, Freie Universität Berlin /","",1990,FALSE
"617","ALDERMAN","DG 000237 .E27  2006","X030111667","Mediterranean anarchy, interstate war, and the rise of Rome /","Eckstein, Arthur M.",2006,FALSE
"618","ALDERMAN","DG 000237.2 .H37","X000693279","Rome in Etruria and Umbria,","Harris, William V. (William Vernon)",1971,FALSE
"619","ALDERMAN","DG 000238 .S83  W37  1994","X002563220","Suetonius' Life of Caligula : a commentary /","Wardle, D.",1994,FALSE
"620","ALDERMAN","DG 000239.2 .B375  2005","X004953550","Images and insults : ancient historiography and the outbreak of the Tarentine War /","Barnes, Christopher.",2005,FALSE
"621","ALDERMAN","DG 000241 .B78  2000","X006111281","The Roman middle republic : politics, religion, and historiography : c. 400-133 B. C. : papers from a conference at the Institutum Romanum Finlandiae, September 11-12, 1998 /","",2000,FALSE
"622","ALDERMAN","DG 000241 .C66  2011","X030880409","A companion to the Punic Wars /","",2011,FALSE
"623","ALDERMAN","DG 000241 .D26  2002","X004587420","Caesar's legion : the epic saga of Julius Caeser's elite tenth legion and the armies of Rome /","Dando-Collins, Stephen.",2002,FALSE
"624","ALDERMAN","DG 000241 .E77  1972","X000188450","The dawn of empire: Rome's rise to world power,","Errington, R. M. (Robert Malcolm)",1972,FALSE
"625","ALDERMAN","DG 000241 .G65  2013","X031614081","Crisis management during the Roman Republic : the role of political institutions in emergencies /","Golden, Gregory K.,",2013,FALSE
"626","CLEMONS","DG 000241 .J34  1997","X004107367","Livy's written Rome /","Jaeger, Mary,",1997,FALSE
"627","ALDERMAN","DG 000241 .L56  1993","X002251682","Imperium Romanum : politics and administration /","Lintott, A. W. (Andrew William)",1993,FALSE
"628","ALDERMAN","DG 000241 .P64213","X000161289","The rise of the Roman Empire /","Polybius.",1979,FALSE
"629","ALDERMAN","DG 000241 .R67  2012","X030946442","Rome and the Mediterranean 290 to 146 BC : the imperial republic /","Rosenstein, Nathan Stewart.",2012,FALSE
"630","ALDERMAN","DG 000241.2 .E34  1986","X001547272","Senate and general : individual decision-making and Roman foreign relations, 264-194 B.C. /","Eckstein, Arthur M.",1986,FALSE
"631","ALDERMAN","DG 000241.2 .F45  1996","X004054303","State, society, and popular leaders in mid-Republican Rome, 241-167 B.C. /","Feig Vishnia, Rachel,",1996,FALSE
"632","ALDERMAN","DG 000241.2 .F47  1988","X001824679","Philhellénisme et impérialisme : aspects idéologiques de la conquête romaine du monde hellénistique, de la seconde guerre de Macédoine a la guerre contre Mithridate /","Ferrary, Jean-Louis.",1988,FALSE
"633","ALDERMAN","DG 000241.2 .G78  1984  V.000002","X000789304","The Hellenistic world and the coming of Rome /","Gruen, Erich S.",1984,TRUE
"634","ALDERMAN","DG 000241.2 .H6515  2010","X030619919","Reconstructing the Roman republic : an ancient political culture and modern research /","Hölkeskamp, Karl-Joachim.",2010,FALSE
"635","ALDERMAN","DG 000241.2 .L43  1995","X002563262","Leaders and masses in the Roman world : studies in honor of Zvi Yavetz /","",1995,FALSE
"636","ALDERMAN","DG 000241.2 .M6313  2015","X031735001","The birth of critical thinking in Republican Rome /","Moatti, Claude,",2015,FALSE
"637","ALDERMAN","DG 000241.2 .M68  2001","X004551540","Plebs and politics in the late Roman Republic /","Mouritsen, Henrik.",2001,FALSE
"638","ALDERMAN","DG 000241.2 .P58  2008","X030470383","Contested triumphs : politics, pageantry, and performance in Livy's Republican Rome /","Pittenger, Miriam R. Pelikan (Miriam Ruth Pelikan),",2008,FALSE
"639","ALDERMAN","DG 000241.2 .R38  1985B","X000931518","Intellectual life in the late Roman Republic /","Rawson, Elizabeth.",1985,FALSE
"640","ALDERMAN","DG 000241.2 .R5","X000090917","Declaring war in the Roman Republic in the period of transmarine expansion /","Rich, J. W.",1976,FALSE
"641","ALDERMAN","DG 000242 .B34  1990","X001856916","The Punic Wars /","Bagnall, Nigel,",1990,FALSE
"642","ALDERMAN","DG 000242 .B34  2003","X004707128","The Punic Wars, 264-146 BC /","Bagnall, Nigel,",2003,FALSE
"643","ALDERMAN","DG 000242 .C38  1980","X000155257","The Punic Wars /","Caven, Brian,",1980,FALSE
"644","ALDERMAN","DG 000242 .F538  2010","X030816329","Carthaginian warrior, 264-146 BC /","Fields, Nic.",2010,FALSE
"645","ALDERMAN","DG 000242 .G65  2000","X004435943","The Punic wars /","Goldsworthy, Adrian Keith.",2000,FALSE
"646","ALDERMAN","DG 000242 .H69  2015","X031709099","Mastering the West : Rome and Carthage at war /","Hoyos, B. D. (B. Dexter),",2015,FALSE
"647","ALDERMAN","DG 000243 .L39  1996","X002745271","The First Punic War : a military history /","Lazenby, J. F. (John Francis)",1996,FALSE
"648","ALDERMAN","DG 000243.2 .H69  1998","X004188570","Unplanned wars : the origins of the First and Second Punic Wars /","Hoyos, B. D. (B. Dexter),",1998,FALSE
"649","ALDERMAN","DG 000246 .W37  2014","X031601115","Taken at the Flood : the Roman Conquest of Greece /","Waterfield, Robin,",2014,FALSE
"650","ALDERMAN","DG 000247 .L39","X000014923","Hannibal's war : a military history of the Second Punic War /","Lazenby, J. F. (John Francis)",1978,FALSE
"651","ALDERMAN","DG 000247 .L532  2006","X004908508","Hannibal's war : books twenty-one to thirty /","Livy.",2006,FALSE
"652","CLEMONS","DG 000247 .L533  1972","X030521530","The war with Hannibal : books XXI-XXX of The history of Rome from its foundation /","Livy.",1972,FALSE
"653","ALDERMAN","DG 000247 .L533  L48  2010","X030773864","Livy on the Hannibalic War /","Levene, D. S.",2010,TRUE
"654","ALDERMAN","DG 000247 .L5513  2000","X006090756","The dawn of the Roman empire : books thirty-one to forty/","Livy.",2000,FALSE
"655","ALDERMAN","DG 000247 .P6613","X000159067","Polybius on Roman imperialism : the histories of Polybius /","Polybius.",1980,FALSE
"656","ALDERMAN","DG 000247 .S43  1996","X006053259","The Second Punic War : a reappraisal /","",1996,FALSE
"657","ALDERMAN","DG 000247.3 .D35  2002","X004446851","Cannae : the experience of battle in the Second Punic War /","Daly, Gregory,",2002,FALSE
"658","ALDERMAN","DG 000247.3 .O25  2010","X030763070","The ghosts of Cannae : Hannibal and the darkest hour of the Roman republic /","O'Connell, Robert L.",2010,FALSE
"659","ALDERMAN","DG 000247.33 .F76  2010","X030773554","Between Rome and Carthage : Southern Italy during the Second Punic War /","Fronda, Michael P.,",2010,FALSE
"660","ALDERMAN","DG 000248 .F55  P44  2005","X004925731","Titus Quinctius Flamininus : Untersuchungen zur römischen Griechenlandpolitik /","Pfeilschifter, Rene.",2005,FALSE
"661","ALDERMAN","DG 000249 .H688  2008","X030279258","Hannibal : Rome's greatest enemy /","Hoyos, B. D. (B. Dexter),",2008,FALSE
"662","ALDERMAN","DG 000249 .H69  2003","X004690271","Hannibal's dynasty : power and politics in the western Mediterranean, 247-183 BC /","Hoyos, B. D. (B. Dexter),",2003,FALSE
"663","ALDERMAN","DG 000249 .H86  2017","X031806226","Hannibal /","Hunt, Patrick",2017,FALSE
"664","ALDERMAN","DG 000249 .K58  2011","X031191002","Hannibal and me /","Kluth, Andreas.",2011,FALSE
"665","ALDERMAN","DG 000249 .L3513  1998","X004218410","Hannibal /","Lancel, Serge.",1998,FALSE
"666","ALDERMAN","DG 000249 .M33  2015","X031705448","Hannibal : a Hellenistic life /","MacDonald, Eve,",2015,FALSE
"667","ALDERMAN","DG 000249 .P74  2017","X031816350","Hannibal's oath : the life and wars of Rome's greatest enemy /","Prevas, John,",2017,FALSE
"668","ALDERMAN","DG 000249.3 .B37","X000326050","Hannibal's campaigns /","Bath, Tony.",1981,FALSE
"669","ALDERMAN","DG 000250 .G73  2013","X031650732","Rome, Parthia, India : the violent emergence of a New World Order 150-140 BC /","Grainger, John D.,",2013,FALSE
"670","ALDERMAN","DG 000250 .S3  1981","X000403224","Roman politics, 220-150 B.C. /","Scullard, H. H. (Howard Hayes),",1981,FALSE
"671","ALDERMAN","DG 000250 .W57  2009","X030276721","Remembering the Roman people : essays on late-Republican politics and literature /","Wiseman, T. P. (Timothy Peter)",2009,FALSE
"672","ALDERMAN","DG 000250.5 .D3813  1996","X006038746","The Roman conquest of Italy /","David, Jean-Michel.",1997,FALSE
"673","ALDERMAN","DG 000250.5 .K42  1987B","X001215937","Rome and the unification of Italy /","Keaveney, Arthur.",1987,FALSE
"674","ALDERMAN","DG 000250.5 .L5  1996","X006040833","Book xl = Liber xl /","Livy.",1996,FALSE
"675","ALDERMAN","DG 000250.5 .P76  2012","X030876650","Process of integration and identity formation in the Roman Republic /","",2012,FALSE
"676","ALDERMAN","DG 000250.5 .R633  2010","X030779942","Beyond Populares and Optimates : political language in the late Republic /","Robb, M. A.",2010,FALSE
"677","ALDERMAN","DG 000251.3 .G73  2002","X004662591","The Roman war of Antiochos the Great /","Grainger, John D.,",2002,FALSE
"678","ALDERMAN","DG 000251.6 .B87  2017","X031818394","Rome and the Third Macedonian War /","Burton, Paul J.,",2017,FALSE
"679","ALDERMAN","DG 000253 .C3  A87","X000062074","Cato the censor /","Astin, A. E.",1978,FALSE
"680","ALDERMAN","DG 000253 .C3  F67","X000090790","Cato the censor /","Forde, Nels W.",1975,TRUE
"681","ALDERMAN","DG 000253 .S4  A8  1967","X000128045","Scipio Aemilianus,","Astin, A. E.",1967,FALSE
"682","CLEMONS","DG 000253.5 .S62  2001","X031740807","Spartacus and the slave wars : a brief history with documents /","",2001,FALSE
"683","ALDERMAN","DG 000254 .A47  2015","X031707108","Rome's revolution : death of the republic and birth of the empire /","Alston, Richard,",2015,FALSE
"684","ALDERMAN","DG 000254 .A6713  1996","X006015807","The civil wars /","Appianus,",1996,FALSE
"685","ALDERMAN","DG 000254 .B37  1985","X000954626","Rome in the late Republic /","Beard, Mary,",1985,FALSE
"686","ALDERMAN","DG 000254 .B56  2017","X031800279","Verhandeln und entscheiden : politische Kultur im Senat der frühen Kaiserzeit /","Blochmann, Simone,",2017,FALSE
"687","ALDERMAN","DG 000254 .B78  1988","X001507285","The fall of the Roman Republic and related essays /","Brunt, P. A.",1988,FALSE
"688","ALDERMAN","DG 000254 .D47  1992","X002125859","Perdita iuventus : zwischen den Generationen von Caesar und Augustus /","Dettenhofer, Maria H.",1992,FALSE
"689","ALDERMAN","DG 000254 .D47  2015","X031732844","Rome, Polybius and the East /","Derow, Peter",2015,FALSE
"690","ALDERMAN","DG 000254 .D86  2017","X031818235","The storm before the storm : the beginning of the end of the Roman Republic /","Duncan, Mike",2017,FALSE
"691","ALDERMAN","DG 000254 .E77  2010","X030781552","Roman imperialism /","Erskine, Andrew.",2010,FALSE
"692","ALDERMAN","DG 000254 .G66  2012","X030945820","The Roman world, 44 BC-AD 180 /","Goodman, Martin,",2012,FALSE
"693","ALDERMAN","DG 000254 .G69  2005","X004907496","Empire and memory : the representation of the Roman Republic in imperial culture /","Gowing, Alain M.,",2005,FALSE
"694","ALDERMAN","DG 000254 .H56  2011","X030848020","Rome, la dernière république : recueil d'articles de François Hinard /","Hinard, François,",2011,FALSE
