"","Item.Library.Code","Item.Shelving.Id","Item.Barcode","Catalog.Title","Catalog.Author","Catalog.Pub.Year","MultiVolume"
"1","ALDERMAN","HA 000001 .S3  V.49  1990","X031602616","Basic content analysis /","Weber, Robert Philip.",1990,TRUE
"2","ALDERMAN","HA 000017 .K6","X000169789","Russian-English dictionary of statistical terms and expressions, and Russian reader in statistics.","Kotz, Samuel.",1964,FALSE
"3","ALDERMAN","HA 000019 .D4713  1998","X004260910","The politics of large numbers : a history of statistical reasoning /","Desrosières, Alain.",1998,FALSE
"4","ALDERMAN","HA 000019 .P37  1996","X004068123","Numbers and nationhood : writing statistics in nineteenth-century Italy /","Patriarca, Silvana.",1996,FALSE
"5","ALDERMAN","HA 000029 .A32  1986","X001220073","The statistical analysis of quasi-experiments /","Achen, Christopher H.",1986,FALSE
"6","ALDERMAN","HA 000029 .A4  2001","X004609400","The age of economic measurement /","",2001,FALSE
"7","ALDERMAN","HA 000029 .A49  1984","X000915066","Cluster analysis /","Aldenderfer, Mark S.",1984,FALSE
"8","ALDERMAN","HA 000029 .A5824  2002","X004586285","The analysis and interpretation of multivariate data for social scientists /","",2002,FALSE
"9","ALDERMAN","HA 000029 .A5828  1994","X002437487","Analyzing qualitative data /","",1994,FALSE
"10","ALDERMAN","HA 000029 .A665  2002","X004589140","Theory-based data analysis for the social sciences /","Aneshensel, Carol S.",2002,FALSE
"11","CLEMONS","HA 000029 .A88  2007","X030330727","Super crunchers : why thinking-by-numbers is the new way to be smart /","Ayres, Ian.",2007,FALSE
"12","ALDERMAN","HA 000029 .B5  1998","X006073156","Longitudinal data analysis : designs, models and methods /","Bijleveld, Catrien C. J. H.",1998,FALSE
"13","CLEMONS","HA 000029 .B754  2014","X031627391","Bourdieu and data analysis : methodological principles and practice /","",2014,FALSE
"14","ALDERMAN","HA 000029 .B835  1997","X004153911","Computational handbook of statistics /","Bruning, James L.",1997,FALSE
"15","ALDERMAN","HA 000029 .B92  1980","X000169180","Elements of statistics : an introduction to probability and statistical inference /","Byrkit, Donald R.",1980,FALSE
"16","ALDERMAN","HA 000029 .C38  1997","X004140284","Causality in crisis? : statistical methods and the search for causal knowledge in the social sciences /","",1997,FALSE
"17","ALDERMAN","HA 000029 .C65  2004","X004702253","Essentials of statistics for the social and behavioral sciences /","Cohen, Barry H.,",2004,FALSE
"18","ALDERMAN","HA 000029 .C66  1977","X000558025","Statistical power analysis for the behavioral sciences /","Cohen, Jacob,",1977,FALSE
"19","ALDERMAN","HA 000029 .C66  1988","X001359382","Statistical power analysis for the behavioral sciences /","Cohen, Jacob,",1988,FALSE
"20","ALDERMAN","HA 000029 .C7724  2015","X031822044","Basics of qualitative research : techniques and procedures for developing grounded theory /","Corbin, Juliet M.,",2015,FALSE
"21","ALDERMAN","HA 000029 .D39  2002","X006135314","Analyzing social science data /","De Vaus, D. A.",2002,FALSE
"22","ALDERMAN","HA 000029 .D4  1999","X004253683","Grounding grounded theory : guidelines for qualitative inquiry /","Dey, Ian.",1999,FALSE
"23","ALDERMAN","HA 000029 .E27  2004","X004808864","Ecological inference : new methodological strategies /","",2004,FALSE
"24","ALDERMAN","HA 000029 .E28  2011","X030879718","Guide to economic indicators : making sense of economics.","",2011,FALSE
"25","ALDERMAN","HA 000029 .E497  2010","X030720795","Applied missing data analysis /","Enders, Craig K.",2010,FALSE
"26","CLEMONS","HA 000029 .F4  1976","X000185634","Statistical analysis in psychology & education /","Ferguson, George Andrew.",1976,FALSE
"27","ALDERMAN","HA 000029 .G136  2014","X031658697","Statistical modeling and inference for social science /","Gailmard, Sean.",2014,FALSE
"28","ALDERMAN","HA 000029 .G527  2008","X030263118","Agent-based models /","Gilbert, G. Nigel.",2008,FALSE
"29","ALDERMAN","HA 000029 .G567  1992","X001775692","ANOVA : repeated measures /","Girden, Ellen R.",1992,FALSE
"30","ALDERMAN","HA 000029 .G57  2008","X030261618","Learning from data : an introduction to statistical reasoning /","Glenberg, Arthur M.",2008,FALSE
"31","ALDERMAN","HA 000029 .G726  1995","X006070993","Essentials of statistics for the behavioral sciences /","Gravetter, Frederick J.",1995,FALSE
"32","ALDERMAN","HA 000029 .G726  2008","X030254947","Essentials of statistics for the behavioral sciences /","Gravetter, Frederick J.",2008,FALSE
"33","ALDERMAN","HA 000029 .G727  1995","X006071179","Instructor's manual to accompany essentials of statistics for the behavioral sciences /","Gravetter, Frederick J.",1995,FALSE
"34","ALDERMAN","HA 000029 .G7735  1993","X002647360","Statistical applications for the behavioral sciences /","Grimm, Laurence G.",1993,FALSE
"35","ALDERMAN","HA 000029 .H145  2012","X031199141","Integrative statistics for the social & behavioral sciences /","Ha, Renee R.",2012,FALSE
"36","CLEMONS","HA 000029 .H2417","X000185635","Basic statistics: a modern approach.","Hamburg, Morris,",1974,FALSE
"37","ALDERMAN","HA 000029 .H245  2004","X004773740","Handbook of data analysis /","",2004,FALSE
"38","ALDERMAN","HA 000029 .H2487  1995","X002626331","Handbook of statistical modeling for the social and behavioral sciences /","",1995,FALSE
"39","ALDERMAN","HA 000029 .H35  2018","X031842148","The philosophy of quantitative methods /","Haig, Brian D.,",2018,FALSE
"40","ALDERMAN","HA 000029 .H352  1988","X001520435","Statistics /","Hays, William L. (William Lee),",1988,FALSE
"41","CLEMONS","HA 000029 .H425  1985","X001065760","Statistical methods for meta-analysis /","Hedges, Larry V.",1985,FALSE
"42","ALDERMAN","HA 000029 .H64  2002","X004767044","Hierarchical linear models : applications and data analysis methods /","Raudenbush, Stephen W.",2002,FALSE
"43","ALDERMAN","HA 000029 .H6525  2003","X030361437","Applied statistics for the behavioral sciences /","Hinkle, Dennis E.",2003,FALSE
"44","ALDERMAN","HA 000029 .H734","X000558036","Basic statistics for the behavioral sciences /","Hopkins, Kenneth D.",1978,FALSE
"45","ALDERMAN","HA 000029 .H734  1996","X004438420","Basic statistics for the behavioral sciences /","Hopkins, Kenneth D.",1996,FALSE
"46","ALDERMAN","HA 000029 .H783  2002","X004844992","Multilevel analysis : techniques and applications /","Hox, J. J.",2002,FALSE
"47","ALDERMAN","HA 000029 .H799","X001648447","Reading statistics and research","Huck, Schuyler W.",1974,FALSE
"48","ALDERMAN","HA 000029 .H82  1954","X000430575","How to lie with statistics.","Huff, Darrell.",1954,FALSE
"49","CLEMONS","HA 000029 .H82  1993","X004622194","How to lie with statistics /","Huff, Darrell.",1993,FALSE
"50","CLEMONS","HA 000029 .K318  1983","X001443962","Introduction to survey sampling /","Kalton, Graham.",1983,FALSE
"51","ALDERMAN","HA 000029 .K4295  1987","X002186678","Statistics for the social and behavioral sciences /","Kenny, David A.,",1987,FALSE
"52","ALDERMAN","HA 000029 .K44  1982","X000358944","Design and analysis : a researcher's handbook /","Keppel, Geoffrey.",1982,FALSE
"53","CLEMONS","HA 000029 .K73  1991","X001982258","Basic social statistics /","Knoke, David.",1991,FALSE
"54","ALDERMAN","HA 000029 .L49  1995","X002596850","Data analysis : an introduction /","Lewis-Beck, Michael S.",1995,FALSE
"55","ALDERMAN","HA 000029 .L75  2008","X030567434","Basic statistics for business & economics /","Lind, Douglas A.",2008,FALSE
"56","ALDERMAN","HA 000029 .L8374  1983","X000840602","Covariance structure models : an introduction to LISREL /","Long, J. Scott.",1983,FALSE
"57","ALDERMAN","HA 000029 .L96  1983","X001652316","Understanding social statistics /","Lutz, Gene M.",1983,FALSE
"58","ALDERMAN","HA 000029 .M165  1979","X006136631","Statistics for business and economics /","McClave, James T.",1979,FALSE
"59","ALDERMAN","HA 000029 .M236  2013","X031737869","The data game : controversies in social science statistics /","Maier, Mark H.,",2013,FALSE
"60","ALDERMAN","HA 000029 .M2463  1994","X004265790","Statistics for business and economics : methods and applications /","Mansfield, Edwin.",1994,FALSE
"61","ALDERMAN","HA 000029 .M2465  1995","X002600545","Identification problems in the social sciences /","Manski, Charles F.",1995,FALSE
"62","ALDERMAN","HA 000029 .P517  1982","X000403414","Statistical thinking : a structural approach /","Phillips, John L.,",1982,FALSE
"63","ALDERMAN","HA 000029 .P622  1990","X002241932","Data analysis for the helping professions : a practical guide /","Pilcher, Donald M.",1990,FALSE
"64","ALDERMAN","HA 000029 .P639  1998","X004235757","A History of the modern fact : problems of knowledge in the sciences of wealth and society /","Poovey, Mary.",1998,FALSE
"65","ALDERMAN","HA 000029 .P645  1986","X001364832","Statistics : applications for the behavioral sciences /","Porter, Joseph H.,",1986,FALSE
"66","ALDERMAN","HA 000029 .R85  1996","X004188784","Fundamentals of behavioral statistics.","",1996,FALSE
"67","ALDERMAN","HA 000029 .S5763  1995","X002526260","Statistics for the social sciences /","Sirkin, R. Mark.",1995,FALSE
"68","ALDERMAN","HA 000029 .S658  1997","X004159181","Basic statistical analysis /","Sprinthall, Richard C.,",1997,FALSE
"69","ALDERMAN","HA 000029 .S774  1988","X002074378","Understanding & conducting qualitative research /","Stainback, Susan Bray.",1988,FALSE
"70","ALDERMAN","HA 000029 .S797","X000023570","Readings in statistics for the behavioral scientist.","Steger, Joseph A.,",1971,FALSE
"71","ALDERMAN","HA 000029 .S823  1990","X002102340","Basics of qualitative research : grounded theory procedures and techniques /","Strauss, Anselm L.",1990,FALSE
"72","ALDERMAN","HA 000029 .S823  1998","X004824863","Basics of qualitative research : techniques and procedures for developing grounded theory /","Strauss, Anselm L.",1998,FALSE
"73","ALDERMAN","HA 000029 .S843  1997","X004103427","Survey measurement and process quality /","",1997,FALSE
"74","CLEMONS","HA 000029 .T783","X006143459","Exploratory data analysis /","Tukey, John W. (John Wilder),",1977,FALSE
"75","CLEMONS","HA 000029 .W3354  1956","X000005494","Statistics, a new approach,","Wallis, W. Allen (Wilson Allen),",1956,FALSE
"76","ALDERMAN","HA 000029 .W33574  1990","X002088338","Statistics for the social sciences : with computer applications /","Walsh, A. (Anthony)",1990,FALSE
"77","CLEMONS","HA 000029 .W622  1984","X001079553","Introductory statistics for business and economics /","Wonnacott, Thomas H.,",1984,FALSE
"78","CLEMONS","HA 000029 .W622  1990","X001824631","Introductory statistics for business and economics /","Wonnacott, Thomas H.,",1990,FALSE
"79","ALDERMAN","HA 000029 .W74  1997","X006040105","Understanding statistics : an introduction for the social sciences /","Wright, Daniel B.",1997,FALSE
"80","ALDERMAN","HA 000030.3 .B69  2014","X031767910","Time series analysis for the social sciences /","Box-Steffensmeier, Janet M.,",2014,FALSE
"81","ALDERMAN","HA 000030.3 .F7  1998","X004289681","Time series models for business and economic forecasting /","Franses, Philip Hans,",1998,FALSE
"82","ALDERMAN","HA 000030.3 .H37  1993","X004126162","Time series models /","Harvey, A. C. (Andrew C.)",1993,FALSE
"83","ALDERMAN","HA 000030.3 .M32","X000170225","Applied time series analysis for the social sciences /","McCleary, Richard.",1980,FALSE
"84","ALDERMAN","HA 000030.3 .O88  1990","X004296518","Time series analysis : regression techniques /","Ostrom, Charles W.",1990,FALSE
"85","ALDERMAN","HA 000030.3 .P53  2015","X031720628","Introduction to time series analysis /","Pickup, Mark",2014,FALSE
"86","ALDERMAN","HA 000030.3 .T55  1996","X004101761","Time series models : in econometrics, finance and other fields /","",1996,FALSE
"87","ALDERMAN","HA 000030.6 .W37  2008","X030257641","Spatial regression models /","Ward, Michael Don,",2008,FALSE
"88","ALDERMAN","HA 000030.6 .W37  2019","X032212122","Spatial regression models /","Ward, Michael Don,",2019,FALSE
"89","ALDERMAN","HA 000031 .H28  2014","X031624019","An introduction to exponential random graph modeling /","Harris, Jenine K.",2014,FALSE
"90","ALDERMAN","HA 000031 .T83  1983","X000506014","The visual display of quantitative information /","Tufte, Edward R.,",1983,FALSE
"91","ALDERMAN","HA 000031.2 .C66  1987","X030281876","Survey research in the United States : roots and emergence 1890-1960 /","Converse, Jean M.,",1987,FALSE
"92","ALDERMAN","HA 000031.2 .C93  1996","X002778894","Designing surveys : a guide to decisions and procedures /","Czaja, Ronald.",1996,FALSE
"93","ALDERMAN","HA 000031.2 .F7  1971","X000706007","Inference from survey samples; an empirical investigation","Frankel, Martin R.",1971,FALSE
"94","CLEMONS","HA 000031.2 .J65  1986","X001207734","Survey design and analysis /","Jolliffe, F. R. (Flavia R.),",1986,FALSE
"95","ALDERMAN","HA 000031.2 .L64  1999","X004290290","Sampling : design and analysis /","Lohr, Sharon L.,",1999,FALSE
"96","ALDERMAN","HA 000031.2 .M66  1993","X002255271","Bootstrapping : a nonparametric approach to statstical inference /","Mooney, Christopher Z.",1993,FALSE
"97","ALDERMAN","HA 000031.2 .R43  1997","X004105501","Designing and conducting survey research : a comprehensive guide /","Rea, Louis M.",1997,FALSE
"98","ALDERMAN","HA 000031.2 .R82  2006","X030108524","Matched sampling for causal effects /","Rubin, Donald B.",2006,FALSE
"99","ALDERMAN","HA 000031.2 .S873  2004","X031218273","Survey methodology /","",2004,FALSE
"100","ALDERMAN","HA 000031.3 .A33  1982","X000778653","Interpreting and using regression /","Achen, Christopher H.",1982,FALSE
"101","ALDERMAN","HA 000031.3 .A44  2009","X030567229","Fixed effects regression models /","Allison, Paul David.",2009,FALSE
"102","ALDERMAN","HA 000031.3 .A63  2008","X030256097","Modern methods for robust regression /","Andersen, Robert,",2008,FALSE
"103","ALDERMAN","HA 000031.3 .B47","X000976945","Multiple regression in practice /","Berry, William Dale.",1985,FALSE
"104","ALDERMAN","HA 000031.3 .D86  2006","X004905765","An introduction to generalized linear models /","Dunteman, George H. (George Henry),",2006,FALSE
"105","CLEMONS","HA 000031.3 .F69  1997","X004824700","Applied regression analysis, linear models, and related methods /","Fox, John,",1997,FALSE
"106","ALDERMAN","HA 000031.3 .F69  2008","X030241124","Applied regression analysis and generalized linear models /","Fox, John,",2008,FALSE
"107","ALDERMAN","HA 000031.3 .G45  2007","X030152347","Data analysis using regression and multilevel/hierarchical models /","Gelman, Andrew.",2007,FALSE
"108","ALDERMAN","HA 000031.3 .H36  2007","X030102973","Quantile regression /","Hao, Lingxin.",2007,FALSE
"109","ALDERMAN","HA 000031.3 .J328  2001","X004474679","Interaction effects in logistic regression /","Jaccard, James.",2001,FALSE
"110","ALDERMAN","HA 000031.3 .J33  2003","X004632137","Interaction effects in multiple regression /","Jaccard, James.",2003,FALSE
"111","ALDERMAN","HA 000031.3 .K38  2013","X031574428","Heteroskedasticity in regression : detection and correction /","Kaufman, Robert L.,",2013,FALSE
"112","ALDERMAN","HA 000031.3 .K45  2015","X031647365","Multiple regression and beyond /","Keith, Timothy,",2015,FALSE
"113","ALDERMAN","HA 000031.3 .L48","X000528332","Applied regression : an introduction /","Lewis-Beck, Michael S.",1980,FALSE
"114","ALDERMAN","HA 000031.3 .L48  2016","X031755851","Applied regression : an introduction.","Lewis-Beck, Michael S.,",2016,FALSE
"115","ALDERMAN","HA 000031.3 .L67  1983","X000907808","Cluster analysis for social scientists /","Lorr, Maurice,",1983,FALSE
"116","ALDERMAN","HA 000031.3 .O27  2006","X004900820","Logistic regression models for ordinal response variables /","O'Connell, Ann A.",2006,FALSE
"117","ALDERMAN","HA 000031.3 .P36  2000","X004474594","Logistic regression : a primer /","Pampel, Fred C.",2000,FALSE
"118","ALDERMAN","HA 000031.3 .P4  1982","X001837620","Multiple regression in behavioral research : explanation and prediction /","Pedhazur, Elazar J.",1982,FALSE
"119","ALDERMAN","HA 000031.3 .P4  1982B","X002736358","Multiple regression in behavioral research : explanation and prediction /","Pedhazur, Elazar J.",1982,FALSE
"120","ALDERMAN","HA 000031.3 .P4  1997","X004323310","Multiple regression in behavioral research : explanation and prediction /","Pedhazur, Elazar J.",1997,FALSE
"121","ALDERMAN","HA 000031.3 .S37  1986","X001053403","Understanding regression analysis : an introductory guide /","Schroeder, Larry D.",1986,FALSE
"122","ALDERMAN","HA 000031.3 .S37  2017","X031799785","Understanding regression analysis : an introductory guide /","Schroeder, Larry D.,",2017,FALSE
"123","ALDERMAN","HA 000031.35 .H33  2011","X030878840","Multivariate general linear models /","Haase, Richard F.",2011,FALSE
"124","ALDERMAN","HA 000031.35 .L48  1991","X002087724","A guide to SPSS for analysis of variance /","Levine, Gustav.",1991,FALSE
"125","ALDERMAN","HA 000031.4 .K56","X000482556","Discriminant analysis /","Klecka, William R.",1980,FALSE
"126","ALDERMAN","HA 000031.4 .W64  1986","X001053351","Meta-analysis : quantitative methods for research synthesis /","Wolf, Fredric Marc.",1986,FALSE
"127","ALDERMAN","HA 000031.5 .N48  2017","X032561063","Robustness tests for quantitative research /","Neumayer, Eric,",2017,FALSE
"128","ALDERMAN","HA 000031.7 .B67  2002","X004631830","Logit and probit : ordered and multinomial models /","Borooah, Vani K.",2002,FALSE
"129","ALDERMAN","HA 000031.7 .E45  1993","X002255273","Maximum likelihood estimation : logic and practice /","Eliason, Scott R.",1993,FALSE
"130","ALDERMAN","HA 000032 .B39  2016","X031789106","An introduction to Stata programming /","Baum, Christopher F.,",2016,FALSE
"131","ALDERMAN","HA 000032 .B794  1997","X006034691","Quantitative data analysis with SPSS for Windows : a guide for social scientists /","Bryman, Alan.",1997,FALSE
"132","ALDERMAN","HA 000032 .B799  2009","X030470767","Quantitative data analysis with SPSS 14, 15 and 16 : a guide for social scientists /","Bryman, Alan.",2009,FALSE
"133","ALDERMAN","HA 000032 .C68  1998","X006044790","Fundamental statistics for social research : step-by-step calculations and computer techniques using SPSS for Windows /","Cramer, Duncan,",1998,FALSE
"134","ALDERMAN","HA 000032 .D488  1993","X002151188","Qualitative data analysis : a user-friendly guide for social scientists /","Dey, Ian.",1993,FALSE
"135","ALDERMAN","HA 000032 .F54  2013","X031821544","Discovering statistics using IBM SPSS statistics : and sex and drugs and rock 'n' roll /","Field, Andy P.",2013,FALSE
"136","ALDERMAN","HA 000032 .G737  1997","X004095219","Using SPSS for Windows : analyzing and understanding data /","Green, Samuel B.,",1997,FALSE
"137","ALDERMAN","HA 000032 .G737  2000","X004501650","Using SPSS for Windows : analyzing and understanding data /","Green, Samuel B.,",2000,FALSE
"138","ALDERMAN","HA 000032 .K47  2002","X006126685","Doing statistics with SPSS /","Kerr, Alistair W.",2002,FALSE
"139","ALDERMAN","HA 000032 .L444  2008","X030261602","SPSS for intermediate statistics : use and interpretation /","Leech, Nancy L.",2008,FALSE
"140","ALDERMAN","HA 000032 .P355  2001","X004414525","SPSS survival manual : a step-by-step guide to data analysis using SPSS for Windows (Version 10) /","Pallant, Julie.",2001,FALSE
"141","ALDERMAN","HA 000032 .S5453  1996","X004049977","SPSS base 7.0 applications guide /","",1996,FALSE
"142","ALDERMAN","HA 000032 .S65  2013","X031729809","Pik teit'? puns?k pangb?mnon : kujo pangj?ngsik mohy?ng kwa tach'?ng mohy?ng ?l chungsim ?ro /","Song, T'ae-min",2013,FALSE
"143","ALDERMAN","HA 000032 .S6755  2005","X030219760","Stata programming : reference manual : release 9.","",2005,FALSE
"144","ALDERMAN","HA 000032 .S676  2011","X030879978","Stata user's guide.","",2009,FALSE
"145","ALDERMAN","HA 000032 .S78  2008","X030261892","A visual approach to SPPS [sic] for Windows : a guide to SPSS 15.0 /","Stern, Leonard (Leonard D.)",2008,FALSE
"146","ALDERMAN","HA 000033 .D83  1989","X002646810","Principal components analysis /","Dunteman, George H. (George Henry),",1989,FALSE
"147","ALDERMAN","HA 000033 .K53","X000077647","Factor analysis : statistical methods and practical issues /","Kim, Jae-on.",1978,FALSE
"148","ALDERMAN","HA 000033 .K55","X000077652","Introduction to factor analysis : what it is and how to do it /","Kim, Jae-on.",1978,FALSE
"149","ALDERMAN","HA 000033 .R85","X000367983","Applied factor analysis","Rummel, R. J. (Rudolph J.),",1970,FALSE
"150","ALDERMAN","HA 000033 .W46","X000077639","Analysis of covariance /","Wildt, Albert R.",1978,FALSE
"151","ALDERMAN","HA 000037 .F8  B75  1994","X002512936","La mesure de l'Etat : administrateurs et géomètres au XVIIIe siècle /","Brian, Eric",1994,FALSE
"152","ALDERMAN","HA 000037 .G7  W75","X000271499","Nineteenth-century society; essays in the use of quantitative methods for the study of social data.","Wrigley, E. A. (Edward Anthony),",1972,FALSE
"153","ALDERMAN","HA 000037 .G72  H88  2017","X031763360","The butcher, the baker, the candlestick-maker : the story of Britain through its census, since 1801 /","Hutchinson, Roger,",2017,FALSE
"154","ALDERMAN","HA 000037 .U5  1966","X000065505","The history and growth of the United States census,","United States. Bureau of Labor.",1966,FALSE
"155","ALDERMAN","HA 000037 .U55  A53  1988","X001361770","The American census : a social history /","Anderson, Margo J.,",1988,FALSE
"156","ALDERMAN","HA 000037 .U55  A53  2015","X032068909","The American census : a social history /","Anderson, Margo J.,",2015,FALSE
"157","ALDERMAN","HA 000037 .U55  C35","X000199372","Demography in early America; beginnings of the statistical mind, 1600-1800","Cassedy, James H.",1969,TRUE
"158","ALDERMAN","HA 000037 .U55  P48  2004","X004862088","Unlocking the Census with GIS /","Peters, Alan H.",2004,FALSE
"159","ALDERMAN","HA 000037 .U55  P65  1987","X001604920","The Politics of numbers /","",1987,FALSE
"160","ALDERMAN","HA 000037 .U55  S44","X000097755","Census, U.S.A.: fact finding for the American people, 1790-1970.","Scott, Ann Herbert.",1968,FALSE
"161","ALDERMAN","HA 000037 .U55  U85  2007","X030263115","Using the American community survey : benefits and challenges /","",2007,FALSE
"162","ALDERMAN","HA 000037 .U6  H556  2002","X030115947","Your guide to the federal census for genealogists, researchers, and family historians /","Hinckley, Kathleen W.,",2002,FALSE
"163","ALDERMAN","HA 000037 .Y8  A37  NO.101","X032023807","Me?usobni odnosi privrednih delatnosti SFR Jugoslavije u 1976. godini = Inter-industry relations of the economy of the SFRY in 1976 /","Savezni zavod za statistiku (Yugoslavia)",1979,TRUE
"164","ALDERMAN","HA 000039 .G6  G54  1978","X000106111","Numbering the people : the eighteenth-century population controversy and the development of census and vital statistics in Britain /","Glass, D. V. (David Victor),",1978,TRUE
"165","ALDERMAN","HA 000039 .V43  S26  2004","X004972086","San Jacinto de El Morro /","Guillen Marquina, Luis Alberto.",2004,FALSE
"166","ALDERMAN","HA 000040 .E3  1963","X031591391","Statistics: an introduction to quantitative economic research.","Suits, Daniel B.,",1963,FALSE
"167","ALDERMAN","HA 000155 .S55  1990","X001994746","Annotated bibliography of papers using the General social surveys /","Smith, Tom W. (Tom William),",1990,FALSE
"168","ALDERMAN","HA 000175 .M55  2007","X030498889","International historical statistics.","Mitchell, B. R. (Brian R.)",2007,FALSE
"169","ALDERMAN","HA 000179 .A53  1999","X004253375","Who counts? : the politics of census-taking in contemporary America /","Anderson, Margo J.,",1999,FALSE
"170","ALDERMAN","HA 000179 .C46  2002","X004587140","Census and identity : the politics of race, ethnicity, and language in national censuses /","",2002,FALSE
"171","ALDERMAN","HA 000202 .A385  1965","X000413766","The statistical history of the United States from colonial times to the present.","United States. Bureau of the Census.",1965,FALSE
"172","ALDERMAN","HA 000205 .A33  1968","X000617681","Negro population in the United States, 1790-1915.","United States. Bureau of the Census.",1968,FALSE
"173","ALDERMAN","HA 000214 .F74  2001","X004525846","America by the numbers : a field guide to the U.S. population /","Frey, William H.",2001,FALSE
"174","ALDERMAN","HA 000214 .M38  1982","X000508202","Demographic dimensions of the New Republic : American interregional migration, vital statistics, and manumissions, 1800-1860 /","McClelland, Peter D.",1982,FALSE
"175","ALDERMAN","HA 000801 .F443  2007","X030508353","All the rules : time tested secrets for capturing the heart of Mr. Right /","Fein, Ellen.",2007,FALSE
"176","ALDERMAN","HA 001016 .U76","X000841212","Compendio de estadísticas históricas de Colombia.","Urrutia, Miguel.",1970,FALSE
"177","ALDERMAN","HA 001021 .A432","X032097571","Primer censo de población del Ecuador, 1950; resumen de características.","Ecuador. División de Estadística y Censos.",1960,FALSE
"178","ALDERMAN","HA 001107.5 .E89  2017","X032086513","European statistics for European policies : a wealth of data to underpin the Commission's priorities /","",2017,FALSE
"179","ALDERMAN","HA 001135 .M5  1962","X000114925","Abstract of British historical statistics.","Mitchell, B. R. (Brian R.)",1962,FALSE
"180","ALDERMAN","HA 001215 .L4","X031995907","La Statistique générale de la France de 1833 à 1870 /","Le Mée, René.",1975,FALSE
"181","ALDERMAN","HA 001231 .A2  1928  NO.000005","X030697980","Die wirtschaft des auslandes 1900-1927[-1928]","Germany. Statistiches reichsamt.",1928,TRUE
"182","ALDERMAN","HA 001728 .B42  I55  1973  V.000006 PT.A/B","X030767170","District census handbook : series 22, West Bengal.","India. Director of Census Operations, West Bengal.",1973,TRUE
"183","ALDERMAN","HA 001728 .K34  K376  1976  V.000013-000016","X031616285","Talukawise plan statistics.","Karnataka (India). Planning Department. District and Regional Planning Unit",1976,TRUE
