"","Item.Library.Code","Item.Shelving.Id","Item.Barcode","Catalog.Title","Catalog.Author","Catalog.Pub.Year","MultiVolume"
"1620","ALDERMAN","HB 000172.5 .H35  1986","X001146754","Macroeconomics : theory, performance, and policy /","Hall, Robert E. (Robert Ernest),",1986,FALSE
"1621","ALDERMAN","HB 000172.5 .H358  2014","X031629822","The undercover economist strikes back : how to run--or ruin--an economy /","Harford, Tim,",2014,FALSE
"1622","ALDERMAN","HB 000172.5 .H36  1999  V.000001A","X004419146","Handbook of macroeconomics /","",1999,TRUE
"1623","ALDERMAN","HB 000172.5 .H48  2009","X030562348","Heterodox macroeconomics : Keynes, Marx and globalization /","",2009,FALSE
"1624","ALDERMAN","HB 000172.5 .H6554  2017","X031817929","A study in monetary macroeconomics /","Homburg, Stefan,",2017,FALSE
"1625","ALDERMAN","HB 000172.5 .H659  2001","X004592042","The methodology of empirical macroeconomics /","Hoover, Kevin D.,",2001,FALSE
"1626","ALDERMAN","HB 000172.5 .I54  001987 BK.000002","X031993330","The Imperiled economy /","",1987,TRUE
"1627","ALDERMAN","HB 000172.5 .I82  2007","X004832528","Is there a new consensus in macroeconomics? /","",2007,FALSE
"1628","ALDERMAN","HB 000172.5 .K56  2012","X031617551","The microfoundations delusion : metaphor and dogma in the history of macroeconomics /","King, J. E. (John Edward)",2012,FALSE
"1629","ALDERMAN","HB 000172.5 .K63  2008","X030279140","Modern financial macroeconomics : panics, crashes, and crises /","Knoop, Todd A.",2008,FALSE
"1630","CLEMONS","HB 000172.5 .L59  2000","X004595030","Recursive macroeconomic theory /","Ljungqvist, Lars.",2000,FALSE
"1631","CLEMONS","HB 000172.5 .L59  2012","X031594982","Recursive macroeconomic theory /","Ljungqvist, Lars.",2012,FALSE
"1632","ALDERMAN","HB 000172.5 .L65  2010","X030746333","Lonergan's early economic research : texts and commentary /","Lonergan, Bernard J. F.",2010,FALSE
"1633","ALDERMAN","HB 000172.5 .M33556  2010","X030620217","Macroeconomics, finance and money : essays in honour of Philip Arestis /","",2010,FALSE
"1634","ALDERMAN","HB 000172.5 .M336  1983","X000480241","Macroeconomics, prices, and quantities : essays in memory of Arthur M. Okun /","",1983,FALSE
"1635","CLEMONS","HB 000172.5 .M357  2000","X004501920","Macroeconomics /","Mankiw, N. Gregory.",2000,FALSE
"1636","CLEMONS","HB 000172.5 .M48  1986","X001174173","Macroeconomics : a neoclassical introduction /","Miller, Merton H.",1986,FALSE
"1637","ALDERMAN","HB 000172.5 .M53  2012","X031189015","The economics of macro issues /","Miller, Roger LeRoy.",2012,FALSE
"1638","ALDERMAN","HB 000172.5 .M63  2012","X031618373","Modern monetary macroeconomics : a new paradigm for economic policy /","",2012,FALSE
"1639","ALDERMAN","HB 000172.5 .M68  2014","X031654864","A concise guide to macroeconomics : what managers, executives, and students need to know /","Moss, David A.,",2014,FALSE
"1640","ALDERMAN","HB 000172.5 .N33  2011","X030817971","Rethinking macroeconomics for sustainability /","Nadal Egea, Alejandro.",2011,FALSE
"1641","ALDERMAN","HB 000172.5 .N493  2010","X030782364","Macroeconomic institutions and development /","Neyapti, Bilin.",2010,FALSE
"1642","ALDERMAN","HB 000172.5 .P443  2000","X006118741","Macroeconomics  : an open economy approach /","Pentecost, Eric J.",2000,FALSE
"1643","ALDERMAN","HB 000172.5 .P445  1988","X001290436","The limits to rational expectations /","Pesaran, M. Hashem,",1988,FALSE
"1644","CLEMONS","HB 000172.5 .P455  1986","X001055623","Principles of economics : macro /","Peterson, Willis L.",1986,FALSE
"1645","CLEMONS","HB 000172.5 .P455  1989","X001477102","Principles of economics. Macro /","Peterson, Willis L.",1989,FALSE
"1646","ALDERMAN","HB 000172.5 .R4  1996","X004020074","Readings in macroeconomics /","",1996,FALSE
"1647","ALDERMAN","HB 000172.5 .R48  2013","X031618265","Rethinking expectations : the way forward for macroeconomics /","",2013,FALSE
"1648","CLEMONS","HB 000172.5 .R66  2012","X031595422","Advanced macroeconomics /","Romer, David.",2012,FALSE
"1649","ALDERMAN","HB 000172.5 .S23  1993B","X002149512","Macroeconomics in global economies /","Sachs, Jeffrey.",1993,FALSE
"1650","ALDERMAN","HB 000172.5 .S523  1983","X000744861","Rational expectations /","Sheffrin, Steven M.",1983,FALSE
"1651","ALDERMAN","HB 000172.5 .S528  2010","X030782215","Lonergan's discovery of the science of economics /","Shute, Michael,",2010,FALSE
"1652","ALDERMAN","HB 000172.5 .S535  2011","X031577063","Principles of macroeconomics /","Sikdar, Soumyen.",2011,FALSE
"1653","ALDERMAN","HB 000172.5 .S54  1980","X032009193","Sootnoshenie mezhdu oveshchestvlennym i zhivym trudom i ego ispol?zovanie v issledovanii ?konomicheskikh prot?sessov /","Silin, A. N. (Artur Nikolaevich)",1980,FALSE
"1654","ALDERMAN","HB 000172.5 .S725  2006","X004834153","Stability with growth macroeconomics, liberalization and development /","",2006,FALSE
"1655","ALDERMAN","HB 000172.5 .T69  2014","X031627088","Towards human development : new approaches to macroeconomics and inequality /","",2014,FALSE
"1656","ALDERMAN","HB 000172.5 .T78  1987","X002126434","Macro-economics /","Truu, M. L.",1987,FALSE
"1657","ALDERMAN","HB 000172.5 .T783  2015","X031705160","Macroeconomics : integrating theory, policy and practice for a new era /","Tuerck, David G.",2015,FALSE
"1658","ALDERMAN","HB 000172.5 .T84  2010","X030773666","Overlapping generations economies /","Tvede, Mich,",2010,FALSE
"1659","ALDERMAN","HB 000172.5 .V45  2011","X030976328","Information choice in macroeconomics and finance /","Veldkamp, Laura.",2011,FALSE
"1660","ALDERMAN","HB 000172.5 .V76  2016","X031790792","A history of macroeconomics from Keynes to Lucas and beyond /","Vroey, Michel de,",2016,FALSE
"1661","ALDERMAN","HB 000172.5 .W43  2012","X030611012","What's right with macroeconomics? /","",2012,FALSE
"1662","ALDERMAN","HB 000172.5 .W45  2013","X031606025","Macroeconometric models /","Welfe, W?adys?aw.",2013,FALSE
"1663","ALDERMAN","HB 000172.5 .W53  2008","X030811030","Macroeconomic theory : a dynamic general equilibrium approach /","Wickens, Mike.",2008,FALSE
"1664","CLEMONS","HB 000172.5 .W55  2011","X030805466","Macroeconomics /","Williamson, Stephen D.",2011,FALSE
"1665","CLEMONS","HB 000172.5 .W55  2014","X031642167","Macroeconomics /","Williamson, Stephen D.",2014,FALSE
"1666","ALDERMAN","HB 000173 .A37  1953  V.000005","X031993280","Traité d'économie pure.","Allais, Maurice.",1953,TRUE
"1667","ALDERMAN","HB 000173 .B355  2011","X031640081","La part maudite ; précédé de La notion de dépense /","Bataille, Georges,",2011,FALSE
"1668","ALDERMAN","HB 000173 .B35513  1988  V.000001","X001362405","The accursed share : an essay on general economy /","Bataille, Georges,",1988,TRUE
"1669","ALDERMAN","HB 000173 .C6313  2014","X031627217","Homo economicus : the (lost) prophet of modern times /","Cohen, Daniel,",2014,FALSE
"1670","ALDERMAN","HB 000173 .R5313  2011","X030959698","The delusions of economics : the misguided certainties of a hazardous science /","Rist, Gilbert,",2011,FALSE
"1671","ALDERMAN","HB 000173 .W2213  2014","X031653425","Léon Walras' Elements of theoretical economics : or the theory of social wealth /","Walras, Léon,",2014,FALSE
"1672","ALDERMAN","HB 000175 .H85  2000","X004474509","Human action : a 50-year tribute /","",2000,FALSE
"1673","ALDERMAN","HB 000175 .M254  1970","X000596473","A contribution to the critique of political economy.","Marx, Karl,",1970,FALSE
"1674","ALDERMAN","HB 000175 .M4812  1981","X000222820","Principles of economics /","Menger, Carl,",1981,FALSE
"1675","ALDERMAN","HB 000175 .N498  2004","X004811840","Economic writings : selections, 1904-1945 /","Neurath, Otto,",2004,FALSE
"1676","ALDERMAN","HB 000175 .R562  1963","X031993241","Economics of the free society.","Röpke, Wilhelm,",1963,FALSE
"1677","ALDERMAN","HB 000175 .S353  1985  T.000001","X031993239","Kleine Schriften zur Wirtschaftsgeschichte, Wirtschaftstheorie und Wirtschaftspolitik /","Schmoller, Gustav von,",1985,TRUE
"1678","ALDERMAN","HB 000175 .S4613  1934","X000211313","The theory of economic development; an inquiry into profits, capital, credit, interest, and the business cycle,","Schumpeter, Joseph A.,",1934,FALSE
"1679","CLEMONS","HB 000175 .S4613  1962","X000232789","The theory of economic development; an inquiry into profits, capital, credit, interest, and the business cycle,","Schumpeter, Joseph A.,",1962,FALSE
"1680","ALDERMAN","HB 000175 .V65  1959","X004046897","Human action : a treatise on economics /","Von Mises, Ludwig,",1949,FALSE
"1681","ALDERMAN","HB 000175 .V65  1966","X000110022","Human action; a treatise on economics.","Von Mises, Ludwig,",1966,FALSE
"1682","ALDERMAN","HB 000175 .W364  1947","X000241188","The theory of social and economic organization,","Weber, Max,",1947,FALSE
"1683","CLEMONS","HB 000175 .W364  1964","X001174457","The theory of social and economic organization,","Weber, Max,",1964,FALSE
"1684","ALDERMAN","HB 000175 .W364  1997","X004113083","The theory of social and economic organization /","Weber, Max,",1997,FALSE
"1685","ALDERMAN","HB 000177 .E43  2006","X004835949","Luigi Einaudi : selected economic essays /","Einaudi, Luigi,",2006,FALSE
"1686","ALDERMAN","HB 000177 .P313  2014","X031628833","Manual of political economy : a critical and variorum edition /","Pareto, Vilfredo,",2014,FALSE
"1687","ALDERMAN","HB 000178 .I47  1986","X001279028","What is political economy? /","Il?in, Serge? Sergeevich.",1986,FALSE
"1688","ALDERMAN","HB 000178 .V58  2002  T.000001 KN.000001","X004793668","Sobranie sochineni? i dokumental?nykh materialov : v pi?ati tomakh /","Vitte, S. I?U. (Serge? I?Ul?evich),",2002,TRUE
"1689","ALDERMAN","HB 000178.5 .P33  1985","X032078873","Economia política : ensayos /","Pacheco, Lucas.",1985,FALSE
"1690","ALDERMAN","HB 000178.5 .T67  2016","X031847236","Economía para no dejarse engañar por los economistas : 50 preguntas y sus respuestas sobre los problemas económicos actuales /","Torres López, Juan,",2016,FALSE
"1691","ALDERMAN","HB 000179 .K37  2016","X031803922","?konomika Stalina /","Katasonov, V. I?U. (Valentin I?Ur?evich),",2016,FALSE
"1692","ALDERMAN","HB 000179 .P48  V.000003","X032078868","Razvitak privrednog sistema FNRJ, posmatran kroz pravne propise.","Petrovi?, Vojislav J.",1954,TRUE
"1693","ALDERMAN","HB 000179 .P7  L33  V.000001","X032078869","Political economy.","Lange, Oskar,",1963,TRUE
"1694","ALDERMAN","HB 000179 .P796","7511822-1001","Problemy politichesko? ?konomii sot?sializma : sbornik state?.","",1959,FALSE
"1695","ALDERMAN","HB 000179 .P796  001959","X032314244","Problemy Politicheskoi Ekonomii Sotsializma","Kronrod, Ia. A.",1959,FALSE
"1696","ALDERMAN","HB 000179 .S4  M56  SV.000002 001979","X032078777","Izbrani ekonomski radovi /","Mirkovi?, Mijo,",1979,TRUE
"1697","ALDERMAN","HB 000179 .S4  P44  1966  D.000001","X031985234","Politi?ka ekonomija, po programu za vi?e ekonomsko-komercijalne ?kole.","Petrovi?, Bo?idar,",1966,TRUE
"1698","ALDERMAN","HB 000180 .C5  C67  V.000001","X032189470","Zhongguo shehui kexueyuan jinji yanjiu suo jikan","Zhongguo Shehui Kexueyuan Jingji Yanjiu Suo Xueshu Weiyuanhui Bian",1979,TRUE
"1699","ALDERMAN","HB 000180 .J3  U52  1973  V.000001","X030701154","Keizai genron,","Uno, K?z?,",1973,TRUE
"1700","ALDERMAN","HB 000180 .K6  Y8  2002","X031594895","Yu Si-min ?i ky?ngjehak k'ap'e : ky?ngjehak ?l t'onghae sesang ?l ihae han?n kot /","Yu, Si-min,",2002,FALSE
"1701","ALDERMAN","HB 000195 .A95  2012","X031618061","Foreign powers and intervention in armed conflicts /","Aydin, Aysegul,",2012,FALSE
"1702","ALDERMAN","HB 000195 .B69  2008","X030258701","Castles, battles, & bombs : how economics explains military history /","Brauer, Jurgen,",2008,FALSE
"1703","ALDERMAN","HB 000195 .B8","X002526011","War is a racket,","Butler, Smedley D. (Smedley Darlington),",1935,FALSE
"1704","ALDERMAN","HB 000195 .C693  2015","X031654034","Economic interdependence and war /","Copeland, Dale C.,",2015,FALSE
"1705","ALDERMAN","HB 000195 .C694  2004","X004796164","Cost of conflict between India and Pakistan /","",2004,FALSE
"1706","ALDERMAN","HB 000195 .C697  2008","X030256329","After war : the political economy of exporting democracy /","Coyne, Christopher J.",2008,FALSE
"1707","ALDERMAN","HB 000195 .E3524  2014","X031630282","The economics of conflict : theory and empirical evidence /","",2014,FALSE
"1708","ALDERMAN","HB 000195 .E3533  2005","X004906083","Rethinking the economics of war : the intersection of need, creed, and greed /","",2005,FALSE
"1709","ALDERMAN","HB 000195 .E354  2000","X030007623","Economie antique : la guerre dans les économies antiques /","",2000,FALSE
"1710","ALDERMAN","HB 000195 .E44  1997","X004028135","Economics of conflict and peace /","",1997,FALSE
"1711","ALDERMAN","HB 000195 .G72  2000","X004415527","Greed & grievance : economic agendas in civil wars /","",2000,FALSE
"1712","ALDERMAN","HB 000195 .G86  2009","X030566435","Guns and butter : the economic causes and consequences of conflict /","",2009,FALSE
"1713","ALDERMAN","HB 000195 .H26  1995","X002701605","Handbook of defense economics /","",1995,FALSE
"1714","ALDERMAN","HB 000195 .K56  2007","X030262953","Appeasing bankers : financial caution on the road to war /","Kirshner, Jonathan.",2007,FALSE
"1715","ALDERMAN","HB 000195 .L37  2012","X030844549","Wars of plunder : conflicts, profits and the politics of resources /","Le Billon, Philippe.",2012,FALSE
"1716","ALDERMAN","HB 000195 .M195  2009","X030278383","Conflict and development /","Mac Ginty, Roger,",2009,FALSE
"1717","ALDERMAN","HB 000195 .M225  1988","X001363799","States, war, and capitalism : studies in political sociology /","Mann, Michael,",1988,FALSE
"1718","ALDERMAN","HB 000195 .M34  2009","X030468066","The invisible hand of peace : capitalism, the war machine, and international relations theory /","McDonald, Patrick J.,",2009,FALSE
"1719","ALDERMAN","HB 000195 .P634  2003","X004659038","The political economy of armed conflict : beyond greed and grievance /","",2003,FALSE
"1720","ALDERMAN","HB 000195 .P765  2005","X004896354","Profiting from peace : managing the resource dimensions of civil war /","",2005,FALSE
"1721","ALDERMAN","HB 000195 .S53  2003","X004661751","Shadow globalization, ethnic conflicts and new wars : a political economy of intra-state war /","",2003,FALSE
"1722","ALDERMAN","HB 000195 .T84","X000085166","The social dilemma : the economics of war and revolution /","Tullock, Gordon.",1974,FALSE
"1723","ALDERMAN","HB 000199 .C6352  2002","X004591430","On the edge of scarcity : environment, resources, population, sustainability, and conflict /","",2002,FALSE
"1724","ALDERMAN","HB 000199 .G74  1997","X004107793","Savage money : the anthropology and politics of commodity exchange /","Gregory, C. A. (Chris A.)",1997,FALSE
"1725","CLEMONS","HB 000199 .H39  1974","X000185661","Economic theory of natural resources","Herfindahl, Orris C. (Orris Clemens),",1974,FALSE
"1726","ALDERMAN","HB 000199 .H49  1982","X000353678","Shifting involvements : private interest and public action /","Hirschman, Albert O.",1982,FALSE
"1727","ALDERMAN","HB 000199 .J64  1976","X031993256","The value of life : an economic analysis /","Jones-Lee, M. W.",1976,FALSE
"1728","ALDERMAN","HB 000199 .K75  1996","X002745713","The self-organizing economy /","Krugman, Paul R.",1996,FALSE
"1729","ALDERMAN","HB 000199 .M385  1990","X001843668","If you're so smart : the narrative of economic expertise /","McCloskey, Deirdre N.",1990,FALSE
"1730","ALDERMAN","HB 000199 .P6213  1983","X000909417","History of spatial economic theory /","Ponsard, Claude.",1983,FALSE
"1731","ALDERMAN","HB 000199 .R65  1953","X000764201","The process of economic growth.","Rostow, W. W. (Walt Whitman),",1953,FALSE
"1732","ALDERMAN","HB 000199 .R66","X000412890","The stages of economic growth, a non-Communist manifesto.","Rostow, W. W. (Walt Whitman),",1960,FALSE
"1733","ALDERMAN","HB 000199 .R66  1971","X000242839","The stages of economic growth; a non-communist manifesto","Rostow, W. W. (Walt Whitman),",1971,FALSE
"1734","ALDERMAN","HB 000199 .R66  1990","X001196536","The stages of economic growth : a non-communist manifesto /","Rostow, W. W. (Walt Whitman),",1990,FALSE
"1735","ALDERMAN","HB 000199 .T47  1992","X030951165","The winner's curse : paradoxes and anomalies of economic life /","Thaler, Richard H.,",1992,FALSE
"1736","ALDERMAN","HB 000199 .T47  1992B","X030596281","The winner's curse : paradoxes and anomalies of economic life /","Thaler, Richard H.,",1992,FALSE
"1737","ALDERMAN","HB 000199 .T48  1976","X000379032","Theory and measurement of economic externalities /","",1976,FALSE
"1738","ALDERMAN","HB 000199 .V5  1929","X031993335","Cost curves and supply curves /","Viner, Jacob,",1929,FALSE
"1739","ALDERMAN","HB 000199 .X46  1989","X001639317","Scarcity and modernity /","Xenos, Nicholas,",1989,FALSE
"1740","ALDERMAN","HB 000201 .B18  2011","X030975567","General equilibrium theory of value /","Balasko, Yves.",2011,FALSE
"1741","ALDERMAN","HB 000201 .C5498  1994","X002492294","Utility and production functions : theory and applications /","Chung, Jae Wan.",1994,FALSE
"1742","ALDERMAN","HB 000201 .C823  2010","X030744403","Exchange and development /","Cornelisse, Peter A.",2010,FALSE
"1743","ALDERMAN","HB 000201 .F6  1958","X031993333","Econometric analysis for public policy.","Fox, Karl A.,",1958,FALSE
"1744","ALDERMAN","HB 000201 .G56  2014","X031654875","The nature of value : how to invest in the adaptive economy /","Gogerty, Nick,",2014,FALSE
"1745","ALDERMAN","HB 000201 .M343  2018","X032582364","99 theses on the revaluation of value : a postcapitalist manifesto /","Massumi, Brian,",2018,FALSE
"1746","ALDERMAN","HB 000201 .M3485  2018B","X032582740","The value of everything : making and taking in the global economy /","Mazzucato, Mariana,",2018,FALSE
"1747","ALDERMAN","HB 000201 .M35  2015","X031735416","Making things valuable /","",2015,FALSE
"1748","ALDERMAN","HB 000201 .O6713  2014","X031654603","The empire of value : a new foundation for economics /","Orléan, André,",2014,FALSE
"1749","ALDERMAN","HB 000201 .S563  2014","X031628123","The performativity of value : on the citability of cultural commodities /","Sherlock, Steve,",2014,FALSE
"1750","ALDERMAN","HB 000201 .S834  2016","X031793258","A question of worth : economy, society and the quantification of human value /","Steed, Chris",2016,FALSE
"1751","ALDERMAN","HB 000201 .S945  2015","X031734487","Quality standards, value chains, and international development : an economic and political theory /","Swinnen, Johan F. M.,",2015,FALSE
"1752","ALDERMAN","HB 000201 .T332  2006","X004836906","Human psychology and economic fluctuation : a new basic theory of human economics /","Tamura, Hideaki,",2006,FALSE
"1753","ALDERMAN","HB 000201 .W662  2006","X030113969","What gives work its value? : the human worth of a physical product (a modern reinterpretation of the theory of Karl Marx) /","Wilson, David.",2006,FALSE
"1754","ALDERMAN","HB 000206 .A45  2013","X031628326","Three essays on Marx's value theory /","Amin, Samir",2013,FALSE
"1755","ALDERMAN","HB 000206 .D43  1994","X002692985","Debates in value theory /","",1994,FALSE
"1756","ALDERMAN","HB 000206 .E43  2017","X031818684","Heteromation, and other stories of computing and capitalism /","Ekbia, H. R. (Hamid Reza),",2017,FALSE
"1757","ALDERMAN","HB 000206 .H29  2005","X030701295","Marx's labor theory of value : a defense /","Hayashi, Hiroyoshi,",2005,FALSE
"1758","ALDERMAN","HB 000206 .L39  1990","X001845178","Competitive advantage on the shop floor /","Lazonick, William.",1990,FALSE
"1759","ALDERMAN","HB 000206 .P65  2013","X031600426","Class, surplus, and the division of labour : a post-Marxian exploration /","Polak, Michal.",2013,FALSE
"1760","ALDERMAN","HB 000206 .S65  1994","X002559588","Invisible Leviathan : the Marxist critique of market despotism beyond postmodernism /","Smith, Murray E. G., (Murray Edward George),",1994,FALSE
"1761","ALDERMAN","HB 000221 .A76  1998","X004120097","Asking about prices : a new approach to understanding price stickiness /","",1998,FALSE
"1762","CLEMONS","HB 000221 .D38  1959B","X000141866","Theory of value : an axiomatic analysis of economic equilibrium /","Debreu, Gerard.",1979,FALSE
"1763","ALDERMAN","HB 000221 .E36  1997","X004287935","Économie antique : prix et formation des prix dans les économies antiques.","",1997,FALSE
"1764","ALDERMAN","HB 000221 .L45  1998","X004289667","Post Keynesian price theory /","Lee, Frederic S.,",1998,FALSE
"1765","ALDERMAN","HB 000221 .N52  2011","X031187835","Marx's theory of price and its modern rivals /","Nicholas, Howard,",2011,FALSE
"1766","ALDERMAN","HB 000221 .P47  2012","X031186946","Commodity price dynamics : a structural approach /","Pirrong, Stephen Craig,",2012,FALSE
"1767","ALDERMAN","HB 000221 .P68  2010","X030746382","Priceless : the hidden psychology of value /","Poundstone, William.",2010,FALSE
"1768","ALDERMAN","HB 000221 .S32","X000282988","Industrial pricing: theory and evidence.","Scherer, F. M. (Frederic M.)",1970,FALSE
"1769","ALDERMAN","HB 000221 .S8  1942","X030341408","The theory of competitive price,","Stigler, George J. (George Joseph),",1942,FALSE
"1770","CLEMONS","HB 000221 .S82  1966","X000162904","The theory of price","Stigler, George Joseph,",1966,FALSE
"1771","ALDERMAN","HB 000221 .T467  1992","X002118195","Prices and knowledge : a market process perspective /","Thomsen, Esteban F.,",1992,FALSE
"1772","ALDERMAN","HB 000221 .W27","X000540586","Gold and prices,","Warren, George F. (George Frederick),",1935,FALSE
"1773","ALDERMAN","HB 000221 .W67  2011","X030976200","The worth of goods : valuation and pricing in the economy /","",2011,FALSE
"1774","ALDERMAN","HB 000225 .A375  2014","X031626521","The index number problem : construction theorems /","Afriat, S. N.,",2014,FALSE
"1775","ALDERMAN","HB 000225 .A39  2014","X031651588","A practical guide to price index and hedonic techniques /","Aizcorbe, Ana.",2014,FALSE
"1776","ALDERMAN","HB 000225 .B354  2008","X030472158","Price and quantity index numbers : models for measuring aggregate change and difference /","Balk, B. M.",2008,FALSE
"1777","ALDERMAN","HB 000225 .W35","X032078862","Measuring price changes: a study of the price indexes,","Wallace, William H. (William Hall),",1970,FALSE
"1778","ALDERMAN","HB 000231 .F48  1996","X004044554","The Great Wave : price revolutions an the rhythm of history.","Fischer, David Hackett,",1996,FALSE
"1779","ALDERMAN","HB 000235 .C6  N3  1958","X030330988","Nan kai zhi shu zi liao hui bian /","",1970,FALSE
"1780","ALDERMAN","HB 000235 .D44  C66  2012","X030851992","Commodity price volatility and inclusive growth in low-income countries /","",2012,TRUE
"1781","ALDERMAN","HB 000235 .E18  C66  2011","X030946688","Commodity prices and markets /","",2011,TRUE
"1782","ALDERMAN","HB 000235 .G3  P74  2001","X004611722","Preise im vor- und frühindustriellen Deutschland : Nahrungsmittel, Getränke, Gewürze, Rohstoffe und Gewerbeprodukte /","",2001,FALSE
"1783","ALDERMAN","HB 000235 .G7  B75  1992","X002213464","Britain in the international economy /","",1992,FALSE
"1784","ALDERMAN","HB 000235 .I4  C49  V.000001","X032078743","Wholesale price statistics, India, 1947-1978 /","Chandhok, H. L.,",1978,TRUE
"1785","ALDERMAN","HB 000235 .I4  N36","X032078882","Price policy and economic growth.","National Council of Applied Economic Research.",1965,FALSE
"1786","ALDERMAN","HB 000235 .I78  M27  PORTFOLIO","X032078883","Prezzi e mercedi a Milano dal 1701 al 1860 /","De Maddalena, Aldo.",1974,FALSE
"1787","ALDERMAN","HB 000235 .R9  A7  V.000002 PT.000001 001963","X032060582","Obshchestvenno neobkhodimye zatraty truda, sebestoimost' i rentabel'nost'; materialy Pervo? Rasshirenno? Sessii Nauchnogo Soveta, 30-okti?abri?a-2 noi?ambri?a 1962 g.","Nauchny? sovet po problemam t?senoobrazovanii?a (Akademii?a nauk SSSR)",1963,TRUE
"1788","ALDERMAN","HB 000235 .S4  G53  1995","X002631179","Prices, food, and wages in Scotland, 1550-1780 /","Gibson, A. J. S. (Alex J. S.)",1995,TRUE
"1789","ALDERMAN","HB 000235 .S75  H3","X032078902","American treasure and the price revolution in Spain, 1501-1650,","Hamilton, Earl J. (Earl Jefferson),",1934,FALSE
"1790","CLEMONS","HB 000235 .S75  H3  1965","X000115094","American treasure and the price revolution in Spain, 1501-1650.","Hamilton, Earl J. (Earl Jefferson),",1965,FALSE
"1791","ALDERMAN","HB 000235 .U6  B35  2012","X031231193","The cost disease : why computers get cheaper and health care doesn't /","Baumol, William J.",2012,FALSE
"1792","ALDERMAN","HB 000235 .U6  C56  001938","X000534870","Wholesale commodity prices in the United States, 1700-1861,","Cole, Arthur Harrison,",1938,TRUE
"1793","CLEMONS","HB 000235 .U6  M35  1992","X002422883","How much is that in real money? : a historical price index for use as a deflator of money values in the economy of the United States /","McCusker, John J.",1992,FALSE
"1794","ALDERMAN","HB 000235 .U6  M39  2001","X004592075","How much is that in real money? : a historical commodity price index for use as a deflator of money values in the economy of the United States /","McCusker, John J.",2001,FALSE
"1795","ALDERMAN","HB 000236 .R9  T78","X032314195","T?Senoobrazovanie - teorii?a i metodologii?a : materialy konferent?sii /","",1974,TRUE
"1796","ALDERMAN","HB 000238 .A278  2017","X031814725","Acquérir, prélever, contrôler : les ressources en compétition (400-1100) /","",2017,FALSE
"1797","ALDERMAN","HB 000238 .B37  2008","X030252884","The red queen among organizations : how competitiveness evolves /","Barnett, William P.",2008,FALSE
"1798","ALDERMAN","HB 000238 .C73  2013","X030611286","Creating competitiveness : entrepreneurship and innovation policies for growth /","",2013,FALSE
"1799","ALDERMAN","HB 000238 .D36  2019","X032212324","Eris vs. Aemulatio : valuing competition in classical antiquity /","",2019,FALSE
