"","Item.Library.Code","Item.Shelving.Id","Item.Barcode","Catalog.Title","Catalog.Author","Catalog.Pub.Year","MultiVolume"
"1","ALDERMAN","HB 000001 .C57  001954","X032019042","Annual Report","Committee for Economic Development",1954,FALSE
"2","ALDERMAN","HB 000001 .D57  NO.000130","X001850496","The anatomy of financial crises /","Eichengreen, Barry J.",1986,TRUE
"3","ALDERMAN","HB 000001 .D57  NO.000249","X002063889","Counting the cost of voluntary export restrictions in the European  car market /","Digby, Caroline.",1988,TRUE
"4","ALDERMAN","HB 000001 .D57  NO.000634","X002086245","The Marshall Plan : history's most successful structural adjustment program /","De Long, J. Bradford.",1992,TRUE
"5","ALDERMAN","HB 000001 .D57  NO.000638","X002194522","The Marshall Plan : economic effects and implications for Eastern Europe and the former USSR /","Eichengreen, Barry J.",1992,TRUE
"6","ALDERMAN","HB 000001 .D57  NO.001408","X032019033","Women's employment transitions around childbearing /","Dex, Shirley.",1996,TRUE
"7","ALDERMAN","HB 000001 .D57  NO.002161","X006003480","From value at risk to stress testing : the extreme value approach /","Longin, François M.",1999,TRUE
"8","ALDERMAN","HB 000001 .D57  NO.004221","X004795971","Riding the South Sea Bubble /","Temin, Peter.",2004,TRUE
"9","ALDERMAN","HB 000001 .D57  NO.004429","X004846229","Spurious growth in German output data, 1913-1938 /","Ritschl, Albrecht.",2004,TRUE
"10","ALDERMAN","HB 000001 .D57  NO.004965","X004944535","Trade and growth with heterogeneous firms /","Baldwin, Richard E.",2005,TRUE
"11","CLEMONS","HB 000001 .N37  NO.4890","X002609997","Market timing ability and volatility implied in investment newsletters' asset allocation recommendations /","Graham, John R.,",1994,TRUE
"12","ALDERMAN","HB 000001 .R36  V.000009 002002","X004696472","Experiments investigating market power /","",2002,TRUE
"13","ALDERMAN","HB 000001 .R36  V.10  2005","X004748445","Field experiments in economics /","",2005,TRUE
"14","ALDERMAN","HB 000001 .R36  V.14  2011","X030942390","Experiments on energy, the environment, and sustainability /","",2011,TRUE
"15","ALDERMAN","HB 000001 .R36  V.15  2012","X030890554","New advances in experimental research on corruption /","",2012,TRUE
"16","ALDERMAN","HB 000001 .R36  V.16  2013","X031623903","Experiments in financial economics /","",2013,TRUE
"17","ALDERMAN","HB 000001 .R36  V.17","X031721783","Experiments in macroeconomics /","",2014,TRUE
"18","ALDERMAN","HB 000001 .R36  V.18","X031713953","Replication in experimental economics /","",2015,TRUE
"19","ALDERMAN","HB 000001 .R36  V.19","X031800244","Experiments in organizational economics /","",2017,TRUE
"20","ALDERMAN","HB 000001 .R36  V.20","X032212398","Experimental economics and culture /","",2018,TRUE
"21","ALDERMAN","HB 000001 .S43  2014","X031626614","Secrets of economics editors /","",2014,FALSE
"22","ALDERMAN","HB 000006 .B33  2003","X004772489","The Penguin dictionary of economics /","Bannock, Graham.",2003,FALSE
"23","ALDERMAN","HB 000009 .B693  R.7  1969","X032024383","Oeconomica","[Zbornik Filozofickej Fakulty Univerzity Komenskeho]",1970,TRUE
"24","ALDERMAN","HB 000009 .E9  000112.JARHG 001964","X032010802","De economist","",1964,FALSE
"25","ALDERMAN","HB 000021 .E23  1990  V.000002","X002228521","Advances in economic theory : Sixth World Congress /","Econometric Society. World Congress",1992,TRUE
"26","ALDERMAN","HB 000021 .E69","X032104575","Equilibrium and disequilibrium in economic theory : proceedings of a conference organized by the Institute for Advanced Studies, Vienna, Austria, July 3-5, 1974 /","",1978,FALSE
"27","ALDERMAN","HB 000021 .M48  1977","X032014848","The Microeconomic foundations of macroeconomics : proceedings of a conference held by the International Economic Association, at S'Agaro, Spain /","",1977,FALSE
"28","ALDERMAN","HB 000021 .T48  1999","X006094588","The theory of markets : proceedings of the Colloquium ""Theory of Markets and their Functioning"", Amsterdam, 1-3 July 1998 /","Colloquium ""Theory of Markets and their Functioning""",1999,FALSE
"29","ALDERMAN","HB 000031 .P4  NO.000014 001899","X000445134","The Philadelphia negro; a social study,","Du Bois, W. E. B. (William Edward Burghardt),",1899,TRUE
"30","ALDERMAN","HB 000031 .R45  V.17  1999","X004052635","Economic theory of capitalism and its crises /","",1999,TRUE
"31","ALDERMAN","HB 000031 .R45  V.21","X004817536","Neoliberalism in crisis, accumulation, and Rosa Luxemburg's legacy /","",2004,TRUE
"32","ALDERMAN","HB 000031 .R45  V.23","X030138912","The hidden history of 9-11-2001 /","",2006,TRUE
"33","ALDERMAN","HB 000031 .R45  V.25","X030621941","Why capitalism survives crises : the shock absorbers /","",2009,TRUE
"34","ALDERMAN","HB 000031 .R45  V.26","X030957768","The national question and the question of crisis /","",2010,TRUE
"35","ALDERMAN","HB 000031 .R45  V.27","X031056797","Revitalizing Marxist theory for today's capitalism /","",2011,TRUE
"36","ALDERMAN","HB 000031 .R45  V.28","X031574025","Contradictions : finance, greed, and labor unequally paid /","",2013,TRUE
"37","ALDERMAN","HB 000031 .R45  V.29","X031725996","Sraffa and Althusser reconsidered : neoliberalism advancing in South Africa, England, and Greece /","",2014,TRUE
"38","ALDERMAN","HB 000031 .R45  V.30A","X031714187","Theoretical engagements in geopolitical economy /","",2015,TRUE
"39","ALDERMAN","HB 000031 .R45  V.31","X031799757","Risking capitalism /","",2016,TRUE
"40","ALDERMAN","HB 000031 .R45  V.32","X031812153","Return of Marxian macro-dynamics in East Asia /","",2017,TRUE
"41","ALDERMAN","HB 000033 .F7  1953","X000240623","Essays in positive economics.","Friedman, Milton,",1953,FALSE
"42","ALDERMAN","HB 000033 .R58  1952","X031996220","Utility and all that, and other essays.","Robertson, Dennis Holme,",1952,FALSE
"43","ALDERMAN","HB 000034 .C54  1994","X002437314","Essays on economics and economists /","Coase, R. H. (Ronald Harry)",1994,FALSE
"44","ALDERMAN","HB 000034 .E255","X032019254","Economic theory and planning : essays in honour of A. K. Das Gupta /","",1974,FALSE
"45","ALDERMAN","HB 000034 .E2729  1993B","X002305546","Economics as worldly philosophy : essays in political and historical economics in honour of Robert L. Heilbroner /","",1993,FALSE
"46","ALDERMAN","HB 000034 .H24  1963","X032104528","Selected readings in economics.","Harriss, C. Lowell (Clement Lowell),",1962,FALSE
"47","ALDERMAN","HB 000034 .H32  1983","X000918904","Knowledge, evolution and society /","Hayek, Friedrich A. von (Friedrich August),",1983,FALSE
"48","ALDERMAN","HB 000034 .H35  1948","X000240581","Individualism and economic order. [Essays].","Hayek, Friedrich A. von (Friedrich August),",1948,FALSE
"49","ALDERMAN","HB 000034 .N3  NO.1","X031577977","The economic background /","Moulton, Harold Glenn,",1932,TRUE
"50","ALDERMAN","HB 000034 .N3  NO.11","X031623557","Gold, international trade balances, and prosperity /","Rogers, James Harvey,",1932,TRUE
"51","ALDERMAN","HB 000034 .N3  NO.12","X031623560","The tariff in relation to prosperity /","Patterson, Ernest Minor,",1932,TRUE
"52","ALDERMAN","HB 000034 .N3  NO.13","X031623558","What the consumer should do /","Taussig, F. W. (Frank William),",1932,TRUE
"53","ALDERMAN","HB 000034 .N3  NO.14","X031623565","Responsibility and economic distress /","Tugwell, Rexford G. (Rexford Guy),",1932,TRUE
"54","ALDERMAN","HB 000034 .N3  NO.15","X031623567","The idea of planning /","Soule, George.",1932,TRUE
"55","ALDERMAN","HB 000034 .N3  NO.16","X031623564","Planning in western Europe /","Lorwin, Lewis L. (Lewis Levitzki),",1932,TRUE
"56","ALDERMAN","HB 000034 .N3  NO.17","X031623570","Planning in Russia /","Warne, Colston E. (Colston Estey),",1932,TRUE
"57","ALDERMAN","HB 000034 .N3  NO.18","X031623569","Business planning /","Epstein, Ralph Cecil.",1932,TRUE
"58","ALDERMAN","HB 000034 .N3  NO.19","X031623568","Federal planning /","May, Stacy.",1932,TRUE
"59","ALDERMAN","HB 000034 .N3  NO.2","X031577976","What about war debts? /","Moulton, Harold Glenn,",1932,TRUE
"60","ALDERMAN","HB 000034 .N3  NO.20","X031623566","The limitations of planning /","Slichter, Sumner H. (Sumner Huber),",1932,TRUE
"61","ALDERMAN","HB 000034 .N3  NO.21","X031623559","Our social responsibilities /","Hamilton, Walton Hale,",1932,TRUE
"62","ALDERMAN","HB 000034 .N3  NO.22","X031578005","American standards /","Perkins, Frances,",1932,TRUE
"63","ALDERMAN","HB 000034 .N3  NO.25","X031623562","Land utilization /","Wilson, M. L. (Milburn Lincoln),",1932,TRUE
"64","ALDERMAN","HB 000034 .N3  NO.27","X031623561","Technology and big business /","Person, Harlow S. (Harlow Stafford),",1932,TRUE
"65","ALDERMAN","HB 000034 .N3  NO.28","X031623563","Trends toward concentration /","Laidler, Harry W. (Harry Wellington),",1932,TRUE
"66","ALDERMAN","HB 000034 .N3  NO.29","X031578003","Credit as a social instrument /","Reed, Harold L. (Harold Lyle),",1932,TRUE
"67","ALDERMAN","HB 000034 .N3  NO.3","X031623556","The role of Congress in our political system /","Willoughby, William F. (William Franklin),",1932,TRUE
"68","ALDERMAN","HB 000034 .N3  NO.30","X031578004","The depression and the world-community /","Morley, Felix M. (Felix Muskett),",1932,TRUE
"69","ALDERMAN","HB 000034 .N3  NO.4","X031577978","What Congress has to face /","Lubin, Isador,",1932,TRUE
"70","ALDERMAN","HB 000034 .N3  NO.6","X031577974","The budget problem /","Seidemann, Henry Peter,",1932,TRUE
"71","ALDERMAN","HB 000034 .N32  NO.10","X031578012","Don't break the farmer's back /","Nourse, Edwin G. (Edwin Griswold),",1933,TRUE
"72","ALDERMAN","HB 000034 .N32  NO.11","X031578013","The Far Eastern crisis /","Morley, Felix M. (Felix Muskett),",1933,TRUE
"73","ALDERMAN","HB 000034 .N32  NO.12","X031578014","Financial reconstruction /","Hardy, Charles O. (Charles Oscar),",1933,TRUE
"74","ALDERMAN","HB 000034 .N32  NO.13","X031578015","Can public works stop depression? /","Mallery, Otto Tod,",1933,TRUE
"75","ALDERMAN","HB 000034 .N32  NO.14","X031578016","Governmental reorganization /","Meriam, Lewis,",1933,TRUE
"76","ALDERMAN","HB 000034 .N32  NO.15","X031578017","Problems of the next four years /","Lorwin, Lewis L. (Lewis Levitzki),",1933,TRUE
"77","ALDERMAN","HB 000034 .N32  NO.16","X031578018","An industrial policy for America /","Lorwin, Lewis L. (Lewis Levitzki),",1933,TRUE
"78","ALDERMAN","HB 000034 .N32  NO.17","X031578008","Can we afford to be sick? /","Barker, Lewellys F. (Lewellys Franklin),",1933,TRUE
"79","ALDERMAN","HB 000034 .N32  NO.19","X031578007","What shall we do about the anti-trust laws? /","Lyon, Leverett S. (Leverett Samuel),",1933,TRUE
"80","ALDERMAN","HB 000034 .N32  NO.20","X031578020","The problem of consumer credit /","Filene, E. A. (Edward Albert),",1933,TRUE
"81","ALDERMAN","HB 000034 .N32  NO.21","X031578019","Adjusting government to our modern economic life /","Hall, Arnold Bennett,",1933,TRUE
"82","ALDERMAN","HB 000034 .N32  NO.22","X031578021","The international gold standard /","Hardy, Charles O. (Charles Oscar),",1933,TRUE
"83","ALDERMAN","HB 000034 .N32  NO.24","X031578006","The World Economic Conference /","Morley, Felix M. (Felix Muskett),",1933,TRUE
"84","ALDERMAN","HB 000034 .N32  NO.7","X031578009","How shall we buy in 1933? /","Lyon, Leverett S. (Leverett Samuel),",1933,TRUE
"85","ALDERMAN","HB 000034 .N32  NO.8","X031578010","Your tax bills /","Whitaker, Benjamin P.",1933,TRUE
"86","ALDERMAN","HB 000034 .N32  NO.9","X031578011","The farmer never quits /","Nourse, Edwin G. (Edwin Griswold),",1933,TRUE
"87","ALDERMAN","HB 000038 .P7  1982  V.000008 PT.000001","X032104576","?uvres complètes /","Proudhon, P.-J. (Pierre-Joseph),",1982,TRUE
"88","ALDERMAN","HB 000041 .F66  1985","X032314019","Kritika Burzhuaznykh Kontseptsii Narodonaselenia","Fomin, S. S.",1985,FALSE
"89","ALDERMAN","HB 000061 .A56  1993","X002437160","Anglo-russki? slovar? po ?konomike i finansam = English-Russian dictionary of economics and finance : okolo 75000 slov i vyrazheni? /","Anikin, A. V. (Andre? Vladimirovich),",1993,FALSE
"90","ALDERMAN","HB 000061 .B33  1977B","X000134105","The Penguin dictionary of economics/","Bannock, Graham.",1972,FALSE
"91","ALDERMAN","HB 000061 .B554  1997","X006007645","A dictionary of economics /","Black, John,",1997,FALSE
"92","ALDERMAN","HB 000061 .B554  2009","X030467782","A dictionary of economics.","Black, John,",2009,FALSE
"93","ALDERMAN","HB 000061 .C53  1986","X032009394","Chastotny? anglo-russki? slovar? : pod?i?azyk ?konomiki /","",1986,FALSE
"94","ALDERMAN","HB 000061 .K46  2003","X004721294","Islamic economics and finance : a glossary /","Khan, Muhammad Akram,",2003,FALSE
"95","ALDERMAN","HB 000061 .K57  1991","X002186542","A lexicon of economics /","Knopf, Kenyon A.",1991,FALSE
"96","ALDERMAN","HB 000061 .L66  2006","X004836694","The anti-capitalist dictionary : movements, histories & motivations /","Lowes, David E.,",2006,FALSE
"97","ALDERMAN","HB 000061 .M16","X032014909","The McGraw-Hill dictionary of modern economics : a handbook of terms and organizations /","",1965,FALSE
"98","ALDERMAN","HB 000061 .S574  2016","X032404346","A-Z of economics : encyclopedic dictionary of economics /","S?masundara, Day?nanda,",2016,FALSE
"99","ALDERMAN","HB 000061 .U42  1992","X032019065","al-Maws??ah al-iqti??d?yah /","?Umar, ?usayn.",1992,FALSE
"100","ALDERMAN","HB 000061 .Y85  1986","X004390033","Y?hikaku keizai jiten /","",1986,FALSE
"101","ALDERMAN","HB 000062 .A1  C84  V.000032","X031721806","Mediations of social life in the 21st century /","",2014,TRUE
"102","ALDERMAN","HB 000062 .B57  2009","X030565616","Essential economics : an A-Z guide /","Bishop, Matthew,",2009,FALSE
"103","ALDERMAN","HB 000062 .K57  2000","X004378309","Time-bound words : semantic and social economies from Chaucer's England to Shakespeare's /","Knapp, Peggy A.,",2000,FALSE
"104","ALDERMAN","HB 000062 .L36  2014","X030824461","How to speak money : what the money people say-- and what it really means /","Lanchester, John,",2014,FALSE
"105","ALDERMAN","HB 000065 .U4  1965","X032207243","Maus??at al-mustala??t al-iqtis?d?ya","Umar, Husain",1975,FALSE
"106","ALDERMAN","HB 000071 .A342  2005","X004833048","Explorations in pragmatic economics : selected papers of George A. Akerlof (and co-authors)/","Akerlof, George A.,",2005,FALSE
"107","ALDERMAN","HB 000071 .B3137  1989","X001607247","Economics and power : an inquiry into human relations and markets /","Bartlett, Randall,",1989,FALSE
"108","ALDERMAN","HB 000071 .B37  2011","X030744484","Beyond the invisible hand : groundwork for a new economics /","Basu, Kaushik.",2011,FALSE
"109","CLEMONS","HB 000071 .B43","X000185637","The economic approach to human behavior /","Becker, Gary S. (Gary Stanley),",1976,FALSE
"110","ALDERMAN","HB 000071 .B5  2004","X004768792","Essential economics /","Bishop, Matthew,",2004,FALSE
"111","ALDERMAN","HB 000071 .B7786  2009","X030278078","The romantic economist : imagination in economics /","Bronk, Richard.",2009,FALSE
"112","ALDERMAN","HB 000071 .C57  1957","X000843153","Economic institutions and human welfare.","Clark, John Maurice,",1957,FALSE
"113","ALDERMAN","HB 000071 .C65  1988","X001520849","The Consequences of economic rhetoric /","",1988,FALSE
"114","ALDERMAN","HB 000071 .C68  1981","X000357808","The Crisis in economic theory /","",1981,FALSE
"115","ALDERMAN","HB 000071 .D55  2007","X030102220","Do economists make markets? : on the performativity of economics /","",2007,FALSE
"116","ALDERMAN","HB 000071 .E2675  1994","X002596059","Economics and religion : are they distinct? /","",1994,FALSE
"117","CLEMONS","HB 000071 .F6955  1985","X000971596","Choosing the right pond : human behavior and the quest for status /","Frank, Robert H.",1985,FALSE
"118","CLEMONS","HB 000071 .F6957  2007","X030152417","The economic naturalist : in search of explanations for everyday enigmas /","Frank, Robert H.",2007,FALSE
"119","ALDERMAN","HB 000071 .F6958  2009","X030567243","The economic naturalist's field guide : common sense principles for troubled times /","Frank, Robert H.",2009,FALSE
"120","ALDERMAN","HB 000071 .F69584  2016","X031782997","Success and luck : good fortune and the myth of meritocracy /","Frank, Robert H.,",2016,FALSE
"121","ALDERMAN","HB 000071 .H395  2012","X030846722","Economists and the powerful : convenient theories, distorted facts, ample rewards /","Häring, Norbert.",2012,FALSE
"122","ALDERMAN","HB 000071 .H4  1992","X002111205","The inexact and separate science of economics /","Hausman, Daniel M.,",1992,FALSE
"123","ALDERMAN","HB 000071 .H617","X000072691","Causality in economics /","Hicks, John,",1979,FALSE
"124","ALDERMAN","HB 000071 .I547  2017","X031805827","Interdisciplinary studies of the market order : new applications of market process theory /","",2017,FALSE
"125","ALDERMAN","HB 000071 .K34  2011","X031189094","Debunking economics : the naked emperor dethroned? /","Keen, Steve.",2011,FALSE
"126","ALDERMAN","HB 000071 .K53  2007","X004832299","Speaking of economics : how to get in the conversation /","Klamer, Arjo.",2007,FALSE
"127","ALDERMAN","HB 000071 .K57  2008","X030458441","Reciprocity : an economics of social relations /","Kolm, Serge-Christophe.",2008,FALSE
"128","ALDERMAN","HB 000071 .L263  1990","X001978920","The language of economics : the analysis of economics discourse /","",1990,FALSE
"129","ALDERMAN","HB 000071 .L544  2017","X031763273","Escape from democracy : the role of experts and the public in economic policy /","Levy, David M.,",2017,FALSE
"130","ALDERMAN","HB 000071 .L546  2001","X004552256","How the dismal science got its name : classical economics and the ur-text of racial politics /","Levy, David M.,",2001,FALSE
"131","ALDERMAN","HB 000071 .M378  1994","X002444252","Knowledge and persuasion in economics /","McCloskey, Deirdre N.",1994,FALSE
"132","ALDERMAN","HB 000071 .M3783  2001","X004539723","Measurement and meaning in economics : the essential Deirdre McCloskey /","McCloskey, Deirdre N.",2001,FALSE
"133","ALDERMAN","HB 000071 .M38  1986B","X001105637","The rhetoric of economics /","McCloskey, Deirdre N.",1986,FALSE
"134","ALDERMAN","HB 000071 .M38  1998","X004210152","The rhetoric of economics /","McCloskey, Deirdre N.",1998,FALSE
"135","ALDERMAN","HB 000071 .M39  2002","X004633141","The secret sins of economics /","McCloskey, Deirdre N.",2002,FALSE
"136","ALDERMAN","HB 000071 .M6  1954","X032104571","Contributions of survey methods to economics [by] George Katona [and others]  Edited with an introd. by Lawrence R. Klein.","University of Michigan. Survey Research Center.",1954,FALSE
"137","ALDERMAN","HB 000071 .M636  2002","X030694958","Machine dreams : economics becomes a cyborg science /","Mirowski, Philip,",2002,FALSE
"138","ALDERMAN","HB 000071 .M83  1995","X002698237","Social limits to economic theory /","Mulberg, Jon,",1995,FALSE
"139","CLEMONS","HB 000071 .N44  1982","X000504305","An evolutionary theory of economic change /","Nelson, Richard R.",1982,FALSE
"140","ALDERMAN","HB 000071 .P467  2003","X004707810","The perverse economy : the impact of markets on people and the environment /","Perelman, Michael.",2003,FALSE
"141","ALDERMAN","HB 000071 .P53  1994","X004375950","The Philosophy of economics : an anthology /","",1994,FALSE
"142","ALDERMAN","HB 000071 .P53  2008","X030251963","The philosophy of economics : an anthology /","",2008,FALSE
"143","ALDERMAN","HB 000071 .P654  2000","X004415553","Political economy and contemporary capitalism : radical perspectives on economic theory and policy /","",2000,FALSE
"144","ALDERMAN","HB 000071 .R67  2005","X004863240","Economic theory and cognitive science : microexplanation /","Ross, Don,",2005,FALSE
"145","ALDERMAN","HB 000071 .S25  2007","X004834656","Rationality, bounded rationality and microfoundations : foundations of theoretical economics /","Salehnejad, Reza.",2007,FALSE
"146","ALDERMAN","HB 000071 .S735  2015","X031738190","Behind the model : a constructive critique of economic modeling /","Spiegler, Peter,",2015,FALSE
"147","ALDERMAN","HB 000071 .S775  1959","X000206129","Mathematical methods in the social sciences, 1959; proceedings.","Stanford Symposium on Mathematical Methods in the Social Sciences",1960,FALSE
"148","ALDERMAN","HB 000071 .S83  1982","X000505262","The economist as preacher /","Stigler, George J. (George Joseph),",1982,FALSE
"149","ALDERMAN","HB 000071 .W467  1999","X004308922","What do economists contribute? /","",1999,FALSE
"150","ALDERMAN","HB 000071 .W468  1999","X006029432","What do economists know? : new economics of knowledge /","",1999,FALSE
"151","ALDERMAN","HB 000072 .A53  1998","X004107982","Ancient and medieval economic ideas and concepts of social justice /","",1998,FALSE
"152","ALDERMAN","HB 000072 .A7677  2016","X031841412","On ethics and economics : conversations with Kenneth J. Arrow /","Arrow, Kenneth J. (Kenneth Joseph),",2017,FALSE
"153","ALDERMAN","HB 000072 .A768  2013","X031618792","The ethical economy : rebuilding value after the crisis /","Arvidsson, Adam.",2013,FALSE
"154","ALDERMAN","HB 000072 .B355  1996","X004068656","Karl Polanyi on ethics and economics /","Baum, Gregory,",1996,FALSE
"155","ALDERMAN","HB 000072 .B53  2015","X032114761","Virtue and economy : essays on morality and markets /","Bielskis, Andrius,",2015,FALSE
"156","ALDERMAN","HB 000072 .B7143  2016","X031792701","Faithonomics : religion and the free market /","Brekke, Torkel,",2016,FALSE
"157","ALDERMAN","HB 000072 .B72  2000","X004487196","Exhausting modernity : grounds for a new economy /","Brennan, Teresa,",2000,FALSE
"158","ALDERMAN","HB 000072 .B74  1995","X002717421","Market capitalism and moral values : proceedings of Section F (Economics) of the British Association for the Advancement of Science, Keele, 1993 /","British Association for the Advancement of Science. Section F (Economics). Meeting",1995,FALSE
"159","ALDERMAN","HB 000072 .B75  2006","X004910437","Sufficient reason : volitional pragmatism and the meaning of economic institutions /","Bromley, Daniel W.,",2006,FALSE
"160","ALDERMAN","HB 000072 .B758  1999","X004319723","Ethics out of economics /","Broome, John.",1999,FALSE
"161","ALDERMAN","HB 000072 .B76  1991","X002049847","Weighing goods : equality, uncertainty, and time /","Broome, John.",1991,FALSE
"162","ALDERMAN","HB 000072 .B83  1985B","X000970300","Ethics, efficiency and the market /","Buchanan, Allen E.,",1985,FALSE
"163","ALDERMAN","HB 000072 .B833  1994","X002444824","Ethics and economic progress /","Buchanan, James M.",1994,FALSE
"164","ALDERMAN","HB 000072 .C74  2001","X004526657","Crossing the mainstream : ethical and methodological issues in economics /","",2001,FALSE
"165","ALDERMAN","HB 000072 .D232  2002","X004593563","The economic person : acting and analyzing /","Danner, Peter L.",2002,FALSE
"166","ALDERMAN","HB 000072 .D36  2011","X030946636","The economist's oath : on the need for and content of professional economic ethics /","DeMartino, George.",2011,FALSE
"167","ALDERMAN","HB 000072 .D735  2014","X031653112","Ambivalence of scarcity and other essays /","Dumouchel, Paul,",2014,FALSE
"168","ALDERMAN","HB 000072 .D74  2011","X031188996","The making of the economy : a phenomenology of economic science /","Düppe, Till,",2011,FALSE
"169","ALDERMAN","HB 000072 .D88  2010","X030621074","Economics and ethics : an introduction /","Dutt, Amitava Krishna.",2010,FALSE
"170","ALDERMAN","HB 000072 .E23  2011","X031709320","Value & values : economics & justice in an age of global interdependence /","East-West Philosophers' Conference",2015,FALSE
"171","ALDERMAN","HB 000072 .E267  1996","X004045303","Economics and ethics? /","",1996,FALSE
"172","ALDERMAN","HB 000072 .E2727  2016","X031730955","Economics and the virtues : building a new moral foundation /","",2016,FALSE
"173","ALDERMAN","HB 000072 .E273  1998","X004120394","Economics, ethics, and public policy /","",1998,FALSE
"174","ALDERMAN","HB 000072 .E2735  2014","X031706728","Economics : from the dismal science to the moral science : the moral economics of Kendall P. Cochran /","",2015,FALSE
"175","ALDERMAN","HB 000072 .E78  1985","X000975769","Ethics and economics /","",1985,FALSE
"176","ALDERMAN","HB 000072 .E786  1996","X002776957","Ethics, rationality, and economic behaviour /","",1996,FALSE
"177","ALDERMAN","HB 000072 .E8  1988","X001362330","The moral dimension : toward a new economics /","Etzioni, Amitai.",1988,FALSE
"178","ALDERMAN","HB 000072 .E84  2010","X031767536","Ethics and economics : new perspectives /","",2010,FALSE
"179","ALDERMAN","HB 000072 .F497  2017","X031848859","The death of homo economicus : work, debt and the myth of endless accumulation /","Fleming, P. (Peter),",2017,FALSE
"180","ALDERMAN","HB 000072 .F635  2009","X030720090","Greed, lust & gender : a history of economic ideas /","Folbre, Nancy.",2009,FALSE
"181","ALDERMAN","HB 000072 .F637  2001","X004475761","The invisible heart : economics and family values /","Folbre, Nancy.",2001,FALSE
"182","ALDERMAN","HB 000072 .F639  2006","X030108208","Adam's fallacy : a guide to economic theology /","Foley, Duncan K.",2006,FALSE
"183","ALDERMAN","HB 000072 .F6775  2016","X031768348","Four futures : visions of the world after capitalism /","Frase, Peter,",2016,FALSE
"184","ALDERMAN","HB 000072 .F75  2008","X030466114","Morals and markets : an evolutionary account of the modern world /","Friedman, Daniel,",2008,FALSE
"185","ALDERMAN","HB 000072 .F75  2013","X030610528","Morals and markets : the dangerous balance /","Friedman, Daniel,",2013,FALSE
"186","ALDERMAN","HB 000072 .F85  1995","X002736209","Trust : the social virtues and the creation of prosperity /","Fukuyama, Francis.",1995,FALSE
"187","ALDERMAN","HB 000072 .F85  1995B","X004020110","Trust : the social virtues and the creation of prosperity /","Fukuyama, Francis.",1995,FALSE
"188","ALDERMAN","HB 000072 .G56  1983","X000627138","Global economics and religion /","",1983,FALSE
"189","ALDERMAN","HB 000072 .G67  1989","X001586988","The economic problem in biblical and patristic thought /","Gordon, Barry J.",1989,FALSE
