"","Item.Library.Code","Item.Shelving.Id","Item.Barcode","Catalog.Title","Catalog.Author","Catalog.Pub.Year","MultiVolume"
"1","ALDERMAN","HG 000063 .A34  2002","X004635088","Ageing, financial markets and monetary policy /","",2002,FALSE
"2","CLEMONS","HG 000063 .F46  1988","X006088107","Financial market volatility : a symposium sponsored by the Federal Reserve Bank of Kansas City, Jackson Hole, Wyoming, August 17-19, 1988.","",1988,FALSE
"3","ALDERMAN","HG 000101 .A36  2007","X031641990","Performing capital : toward a cultural economy of popular and global finance /","Aitken, Rob.",2007,FALSE
"4","ALDERMAN","HG 000101 .B68  2000","X004438840","Theory of financial risk : from statistical physics to risk management /","Bouchaud, Jean-Philippe,",2000,FALSE
"5","ALDERMAN","HG 000101 .C62  2012","X030843176","The hour between dog and wolf : risk-taking, gut feelings and the biology of boom and bust /","Coates, John.",2012,FALSE
"6","ALDERMAN","HG 000101 .D47  2017","X031829583","The wisdom of finance : discovering humanity in the world of risk and return /","Desai, Mihir A. (Mihir Arvind),",2017,FALSE
"7","ALDERMAN","HG 000101 .F4413  2018","X032582479","Rated agency : investee politics in a speculative age /","Feher, Michel,",2018,FALSE
"8","ALDERMAN","HG 000101 .K46  2016","X031792529","Capital and the common good : how innovative finance is tackling the world's most urgent problems /","Keohane, Georgia Levenson,",2016,FALSE
"9","ALDERMAN","HG 000101 .P59  2012","X030843977","Emotions in finance : booms, busts and uncertainty /","Pixley, Jocelyn,",2012,FALSE
"10","ALDERMAN","HG 000101 .P74  2009","X031657042","Framing finance : the boundaries of markets and modern capitalism /","Preda, Alex,",2009,FALSE
"11","ALDERMAN","HG 000101 .T55  2009","X030508238","Financial Darwinism : create value or self-destruct in a world of risk /","Tilman, Leo M.,",2009,FALSE
"12","ALDERMAN","HG 000103 .H46  2013","X031627668","Ethics and finance : an introduction /","Hendry, John,",2013,FALSE
"13","ALDERMAN","HG 000103 .L49  2019","X032583595","Religion and finance : comparing the approaches of Judaism, Christianity and Islam /","Lewis, Mervyn,",2019,FALSE
"14","ALDERMAN","HG 000103 .M37  1999","X004375121","Financial ethics /","McCosh, Andrew M.",1999,FALSE
"15","ALDERMAN","HG 000106 .B75  2010","X030780567","Credit models and the crisis : a journey into CDOs, Copulas, correlations and dynamic models /","Brigo, Damiano,",2010,FALSE
"16","ALDERMAN","HG 000106 .B87  2010","X030241301","Financial market theory /","Burton, Edwin T.",2010,FALSE
"17","ALDERMAN","HG 000106 .C86  2004","X004913621","Introduction to the economics and mathematics of financial markets /","Cvitani?, Jak?a.",2004,FALSE
"18","ALDERMAN","HG 000106 .C86  2013","X032220754","Contract theory in continuous-time models /","Cvitani?, Jak?a.",2013,FALSE
"19","ALDERMAN","HG 000106 .D54  2015","X031706312","Financial and macroeconomic connectedness : a network approach to measurement and monitoring /","Diebold, Francis X.,",2015,FALSE
"20","ALDERMAN","HG 000106 .G34  2014","X031652967","Granularity theory with applications to finance and insurance /","Gagliardini, Patrick,",2014,FALSE
"21","ALDERMAN","HG 000106 .G84  2016","X031818527","The financial mathematics of market liquidity : from optimal execution to market making /","Guéant, Olivier,",2016,FALSE
"22","ALDERMAN","HG 000106 .L67  2001","X030455732","Computational finance : a scientific perspective /","Los, Cornelis Albertus,",2001,FALSE
"23","ALDERMAN","HG 000106 .M33  2016","X031763003","Applied conic finance /","Madan, Dilip B.,",2016,FALSE
"24","ALDERMAN","HG 000106 .P45  2014","X031655035","Fundamental models in financial theory /","Peleg, Doron,",2014,FALSE
"25","ALDERMAN","HG 000106 .S56  2005  V.000001","X030282639","Stochastic calculus for finance /","Shreve, Steven E.",2005,TRUE
"26","ALDERMAN","HG 000106 .T4  2002","X030595696","Quantitative methods for finance and investments /","Teall, John L.,",2002,FALSE
"27","ALDERMAN","HG 000106 .X45  2010","X030780512","ARCH models for financial applications /","Xekalaki, Evdokia.",2010,FALSE
"28","CLEMONS","HG 000136 .B87  2006","X030006705","Financial market theory : notes /","Burton, Edwin T.",2006,FALSE
"29","ALDERMAN","HG 000136 .N45  NO.000087/000088-000098/000099 001973-001974","X000213216","U. S. bank expansion via foreign branching : monetary policy implications /","Mastrapasqua, Frank.",1973,TRUE
"30","ALDERMAN","HG 000136 .P69  NO.000046","X000193443","Balance-of-payments deficits and the international market for liquidity.","Kindleberger, Charles P.,",1965,TRUE
"31","ALDERMAN","HG 000136 .P69  NO.000060","X031938338","Gold: barbarous relic or useful instrument?","Kriz, Miroslav Anthony,",1967,TRUE
"32","ALDERMAN","HG 000136 .P69  NO.000070","X031938331","The gold-dollar system; conditions of equilibrium and the price of gold.","Gilbert, Milton,",1968,TRUE
"33","ALDERMAN","HG 000136 .P69  NO.000166","X001209766","IMF conditionality : ineffectual, inefficient, mistargeted /","Spraos, John.",1986,TRUE
"34","ALDERMAN","HG 000136 .P69  NO.000174","X001593068","New approaches to the Latin American debt crisis /","Sachs, Jeffrey.",1989,TRUE
"35","ALDERMAN","HG 000136 .P69  NO.000177","X001777092","The ""triangular trade"" and the Atlantic economy of the eighteenth century : a simple general-equilibrium model /","Findlay, Ronald.",1990,TRUE
"36","ALDERMAN","HG 000136 .P69  NO.000203","X006039074","The theory and practice of financial stability /","Crockett, Andrew.",1997,TRUE
"37","ALDERMAN","HG 000136 .P69  NO.000207","X006070871","Should the IMF pursue capital-account convertibility? /","",1998,TRUE
"38","ALDERMAN","HG 000136 .P69  NO.000211","X006004399","A survey of financial liberalization /","Williamson, John,",1998,TRUE
"39","ALDERMAN","HG 000136 .P69  NO.000213","X006094020","Transition strategies and nominal anchors on the road to greater exchange-rate flexibility /","",1999,TRUE
"40","ALDERMAN","HG 000136 .P69  NO.000215","X006115472","No single currency regime is right for all countries or at all times /","Frankel, Jeffrey A.",1999,TRUE
"41","ALDERMAN","HG 000136 .P69  NO.000221","X006113293","Life at the top : international currencies in the twenty-first century /","Cohen, Benjamin J.",2000,TRUE
"42","ALDERMAN","HG 000151 .E32  2004","X004917223","Ei-Wa Wa-Ei kin?y?, sh?ken, hoken y?go jiten = The dictionary of securities insurance & financial terms : English-Japanese Japanese-English /","",2004,FALSE
"43","ALDERMAN","HG 000151 .P63  2010","X030818861","The pocket dictionary of finance.","",2010,FALSE
"44","ALDERMAN","HG 000151.5 .M47  2015","X031666329","Understanding financial charts : a Mergent handbook /","Mergent, Inc.",2015,FALSE
"45","ALDERMAN","HG 000152 .N49  2009","X030781597","New business and finance research developments /","",2009,FALSE
"46","ALDERMAN","HG 000153 .W4  1938","X031947809","Money, credit and banking,","Westerfield, Ray Bert,",1938,FALSE
"47","CLEMONS","HG 000171 .F47  2008","X030269483","The ascent of money : a financial history of the world /","Ferguson, Niall.",2008,FALSE
"48","ALDERMAN","HG 000171 .F47  2008B","X030276656","The ascent of money : a financial history of the world /","Ferguson, Niall.",2008,FALSE
"49","ALDERMAN","HG 000171 .O44  2011","X031193235","Les routes de l'argent : réseaux et flux financiers de Paris à Hambourg (1789-1815) /","Oliveira, Matthieu de.",2011,FALSE
"50","ALDERMAN","HG 000171 .S52  2012","X030841767","Finance and the good society /","Shiller, Robert J.",2012,FALSE
"51","CLEMONS","HG 000172 .A2  A43  2009","X030516662","Lords of finance : the bankers who broke the world /","Ahamed, Liaquat.",2009,FALSE
"52","CLEMONS","HG 000172 .A2  F72  2008","X030384629","Wall Street : America's dream palace /","Fraser, Steve,",2008,TRUE
"53","ALDERMAN","HG 000172 .A2  J67","X000424942","The money lords; the great finance capitalists, 1925-1950.","Josephson, Matthew,",1972,FALSE
"54","ALDERMAN","HG 000172 .A2  O26  2014","X031715776","K?ndae Han'guk ?i chabon'gad?l : Min Y?ng-hwi es? An H?i-je kkaji, Pusan es? P'y?ngyang kkaji = The capitalists in modern Korea : from Min Yeong-hwi to Ahn Hee-je, from Busan to Pyongyang /","O, Mi-il,",2014,FALSE
"55","CLEMONS","HG 000172 .A2  T7  1980","X000070589","The money masters /","Train, John.",1980,TRUE
"56","CLEMONS","HG 000172 .A2  T73  1994","X006087962","The new money masters : winning investment strategies of Soros, Lynch, Steinhardt, Rogers, Neff, Wanger, Michaelis, Carret /","Train, John.",1994,TRUE
"57","CLEMONS","HG 000172 .A2  T73  1994B","X004345108","The money masters /","Train, John.",1994,TRUE
"58","ALDERMAN","HG 000172 .A2  W75  2006","X004899450","Financial founding fathers : the men who made America rich /","Wright, Robert E. (Robert Eric),",2006,FALSE
"59","CLEMONS","HG 000172 .B56  A3  1997","X004351616","Bloomberg by Bloomberg /","Bloomberg, Michael.",1997,FALSE
"60","ALDERMAN","HG 000172 .B56  F33  2012","X030879557","Mike! : Wall Street's mayor /","Fabricant, Neil,",2012,TRUE
"61","ALDERMAN","HG 000172 .B77  A3  2015","X031650206","Red notice : a true story of high finance, murder, and one man's fight for justice /","Browder, Bill,",2015,FALSE
"62","CLEMONS","HG 000172 .B84  L69  1996","X004345097","Buffett : the making of an American capitalist /","Lowenstein, Roger.",1996,TRUE
"63","ALDERMAN","HG 000172 .B84  L8  2016","X031791019","Inside the investments of Warren Buffett : twenty cases /","Lu, Yefei,",2016,TRUE
"64","CLEMONS","HG 000172 .B84  S37  2008","X030505501","The snowball : Warren Buffett and the business of life /","Schroeder, Alice.",2008,FALSE
"65","ALDERMAN","HG 000172 .B84  T37  2013","X031641810","Tap dancing to work : Warren Buffett on practically everything, 1966-2013 : a Fortune magazine book /","",2013,TRUE
"66","CLEMONS","HG 000172 .B84  T72  1987","X002426736","The midas touch : the strategies that have made Warren Buffett America's pre-eminent investor /","Train, John.",1987,TRUE
"67","ALDERMAN","HG 000172 .D4  2001","X004479001","Villard : the life and times of an American titan /","De Borchgrave, Alexandra Villard.",2001,FALSE
"68","CLEMONS","HG 000172 .D495  M33  2009","X030517449","Last man standing : the ascent of Jamie Dimon and JPMorgan Chase /","McDonald, Duff.",2009,FALSE
"69","ALDERMAN","HG 000172 .D74  B76  1986","X000994601","The money game in old New York : Daniel Drew and his times /","Browder, Clifford,",1986,FALSE
"70","ALDERMAN","HG 000172 .E88  H46  2000","X004397759","The white sharks of Wall Street : Thomas Mellon Evans and the original corporate raiders /","Henriques, Diana B.",2000,FALSE
"71","ALDERMAN","HG 000172 .F57  M33  1981","X000219224","The life and times of Col. James Fisk, Jr. /","McAlpine, R. W. (Robert W.),",1981,FALSE
"72","ALDERMAN","HG 000172 .H36  W45  2015","X031230440","Prince of darkness : the untold story of Jeremiah G. Hamilton, Wall Street's first black millionaire /","White, Shane,",2015,FALSE
"73","CLEMONS","HG 000172 .K38  A3  2000","X004493480","On money and markets : a Wall Street memoir /","Kaufman, Henry.",2000,FALSE
"74","CLEMONS","HG 000172 .L3  G54  1999","X004402422","Millionaire : the philanderer, gambler, and duelist who invented modern finance /","Gleeson, Janet.",1999,TRUE
"75","ALDERMAN","HG 000172 .L3  M87  1997","X004054947","John Law : economic theorist and policy-maker /","Murphy, Antoin E.",1997,FALSE
"76","ALDERMAN","HG 000172 .L3  M87  2018","X031813852","John Law : economic theorist and policy-maker /","Murphy, Antoin E.,",2018,FALSE
"77","ALDERMAN","HG 000172 .S63  A5  1995","X002673077","Soros on Soros : staying ahead of the curve /","Soros, George.",1995,FALSE
"78","CLEMONS","HG 000172 .S63  K38  2002","X004608032","Soros : the life and times of a Messianic billionaire /","Kaufman, Michael T.",2002,FALSE
"79","ALDERMAN","HG 000173 .A38  2010","X030746094","After the crash : the future of finance /","",2010,FALSE
"80","ALDERMAN","HG 000173 .A433  2000","X004401861","Comparing financial systems /","Allen, Franklin,",2000,FALSE
"81","ALDERMAN","HG 000173 .A4334  2010","X030619843","Financing the future : market-based innovations for growth /","Allen, Franklin,",2010,FALSE
"82","ALDERMAN","HG 000173 .A793  2011","X030744257","Financial ethics : a positivist analysis /","Aragon, George A.",2011,FALSE
"83","ALDERMAN","HG 000173 .B3363  2011","X030744375","Finance : the basics /","Banks, Erik.",2011,FALSE
"84","ALDERMAN","HG 000173 .B47  1992","X002105950","Capital ideas : the improbable origins of modern Wall Street /","Bernstein, Peter L.",1992,FALSE
"85","ALDERMAN","HG 000173 .C42  2012","X030841904","The unfair trade : how our broken global financial system destroys the middle class /","Casey, Michael,",2012,FALSE
"86","ALDERMAN","HG 000173 .C574  2013","X030611145","Banking across boundaries : placing finance in capitalism /","Christophers, Brett,",2013,FALSE
"87","ALDERMAN","HG 000173 .D425  2018","X032450098","The Global Findex database 2017 : measuring financial inclusion and the Fintech revolution /","Demirgüç-Kunt, Asl?,",2018,FALSE
"88","ALDERMAN","HG 000173 .E45  1997","X006036096","Financial economics /","Eichberger, Jürgen,",1997,FALSE
"89","ALDERMAN","HG 000173 .E5  1971  V. 000001","X031952725","Parallel money markets.","Einzig, Paul,",1971,TRUE
"90","ALDERMAN","HG 000173 .F29  2010","X031711740","Foundations of financial markets and institutions /","Fabozzi, Frank J.",2010,FALSE
"91","ALDERMAN","HG 000173 .F34","X000499507","The theory of finance","Fama, Eugene F.,",1972,FALSE
"92","ALDERMAN","HG 000173 .F4875  2010","X030744835","Finance and banking developments /","",2010,FALSE
"93","ALDERMAN","HG 000173 .F495  2010","X030816567","Financial institutions and markets : the financial crisis-- an early retrospective /","",2010,FALSE
"94","ALDERMAN","HG 000173 .F514  2001","X004552257","Financial liberalization : how far, how fast? /","",2001,FALSE
"95","ALDERMAN","HG 000173 .F51445  2010","X030745954","Financial markets and organizational technologies : system architectures, practices and risks in the era of deregulation /","",2010,FALSE
"96","ALDERMAN","HG 000173 .F51465  2013","X031627919","Financial restructuring to sustain recovery /","",2013,FALSE
"97","ALDERMAN","HG 000173 .F5195  2005","X030823756","Financialization and the world economy /","",2005,FALSE
"98","ALDERMAN","HG 000173 .F67  2000","X004422104","Stochastic volatility in financial markets : crossing the bridge to continuous time /","Fornari, Fabio.",2000,FALSE
"99","ALDERMAN","HG 000173 .F69  1996","X004020081","Toward finance with meaning : the methodology of finance : what it is and what it can be /","Frankfurter, George M.",1996,FALSE
"100","ALDERMAN","HG 000173 .F88  2010","X030819284","The future of finance : the LSE report /","",2010,FALSE
"101","ALDERMAN","HG 000173 .G65  2017","X031806111","Banking's final exam : stress testing and bank-capital reform /","Goldstein, Morris,",2017,FALSE
"102","ALDERMAN","HG 000173 .G785  2014","X031721771","A Guide to IMF stress testing : methods and models /","",2014,FALSE
"103","ALDERMAN","HG 000173 .H345  2003  V.000001B","X004751654","Handbook of the economics of finance /","",2003,TRUE
"104","ALDERMAN","HG 000173 .H85  1954","X000315576","Case problems in finance,","Hunt, Pearson.",1953,FALSE
"105","CLEMONS","HG 000173 .I54  1987","X006179470","Theory of financial decision making /","Ingersoll, Jonathan E.",1987,FALSE
"106","ALDERMAN","HG 000173 .I87  1999","X006073547","Political economy of money and finance /","It?, Makoto,",1998,FALSE
"107","ALDERMAN","HG 000173 .K595  2016","X031762585","How noise matters to finance /","Knouf, Nicholas A.,",2016,FALSE
"108","ALDERMAN","HG 000173 .L39  2010","X030732813","The doom loop in the financial sector : and other black holes of risk /","Leiss, William,",2010,FALSE
"109","ALDERMAN","HG 000173 .M28","X000415857","Quantitative analysis of financial decisions","Mao, James C. T.,",1969,FALSE
"110","ALDERMAN","HG 000173 .M44  1990","X001783980","Continuous-time finance /","Merton, Robert C.",1990,FALSE
"111","CLEMONS","HG 000173 .M632  1997","X004340579","The economics of money, banking, and financial markets /","Mishkin, Frederic S.",1998,FALSE
"112","ALDERMAN","HG 000173 .M632  2007B","X030151895","The economics of money, banking, and financial markets /","Mishkin, Frederic S.",2007,FALSE
"113","ALDERMAN","HG 000173 .P47  2000","X004415806","Performance of financial institutions : efficiency, innovation, regulation /","",2000,FALSE
"114","ALDERMAN","HG 000173 .P65  2003","X004708752","The political economy of monetary institutions /","",2003,FALSE
"115","CLEMONS","HG 000173 .P655  2008","X004087523","Political institutions and financial development /","",2008,FALSE
"116","ALDERMAN","HG 000173 .P74  2017","X031823518","Preparing for the next financial crisis : policies, tools and models /","",2017,FALSE
"117","ALDERMAN","HG 000173 .R656  2011","X030816990","Market players : a guide to the institutions in today's financial markets /","Rolland, Gail.",2011,FALSE
"118","ALDERMAN","HG 000173 .S297  1996","X002742169","Financing change : the financial community, eco-efficiency, and sustainable development /","Schmidheiny, Stephan,",1996,FALSE
"119","ALDERMAN","HG 000173 .V38  2011","X030817911","Stochastic finance : a numeraire approach /","Ve?e?, Jan.",2011,FALSE
"120","CLEMONS","HG 000173 .V537  2001","X004473694","A vision for the future : in conversation with financial strategists /","",2001,FALSE
"121","ALDERMAN","HG 000173 .V538  2013","X030611024","The risk in risk management : financial organizations & the problem of conformity /","Vit, Gregory B.",2013,FALSE
"122","ALDERMAN","HG 000173 .V658  2002","X004683278","Vault guide to advanced finance and quantitative interviews /","Voitle, Jennifer.",2002,FALSE
"123","ALDERMAN","HG 000173 .W493  2007","X030247399","Paul Wilmott introduces quantitative finance.","Wilmott, Paul.",2007,FALSE
"124","ALDERMAN","HG 000173 .Z56  2008","X030240679","A practical guide to quantitative finance interviews /","Zhou, Xinfeng.",2008,FALSE
"125","ALDERMAN","HG 000174 .C59","X031923840","The demand for money by firms /","Coates, C. Robert.",1976,FALSE
"126","ALDERMAN","HG 000174 .C64  2000","X004400618","Computational finance 1999 /","",2000,FALSE
"127","ALDERMAN","HG 000174 .D68  1990","X001703391","Prices in financial markets /","Dothan, Michael U.",1990,FALSE
"128","ALDERMAN","HG 000174 .E6  VYP.000004","X031923839","?konomiko-matematicheskie metody i vychislitel?nai?a tekhnika v upravlenii finansami.","",1971,TRUE
"129","ALDERMAN","HG 000174 .G35  1985","X032023444","Karl Marx ob istorizme denezhnykh otnoshenii : (Metodologicheskii aspekt)","Galchinsky, A. S.",1985,FALSE
"130","ALDERMAN","HG 000174 .M55  1993","X002444637","The econometric modelling of financial time series /","Mills, Terence C.",1993,FALSE
"131","ALDERMAN","HG 000174 .Z54  1975","X000129490","Stochastic optimization models in finance /","Ziemba, W. T.",1975,FALSE
"132","ALDERMAN","HG 000176.5 .M36  1997","X004414344","Fractals and scaling in finance : discontinuity, concentration, risk : selecta volume E /","Mandelbrot, Benoit B.",1997,FALSE
"133","ALDERMAN","HG 000176.5 .N34  1997","X031730432","Financial networks : statics and dynamics /","Nagurney, Anna.",1997,FALSE
"134","ALDERMAN","HG 000176.5 .P76  2010","X030746426","Probability and statistics for finance /","",2010,FALSE
"135","ALDERMAN","HG 000176.5 .V64  2005","X030465388","The statistical mechanics of financial markets /","Voit, Johannes,",2005,FALSE
"136","ALDERMAN","HG 000176.5 .W45  1996","X002709461","The Kalman filter in finance /","Wells, Curt,",1996,FALSE
"137","ALDERMAN","HG 000176.7 .A44  1994","X002442894","Financial innovation and risk sharing /","Allen, Franklin,",1994,FALSE
"138","ALDERMAN","HG 000176.7 .F47  1994","X002555970","The effective grant office : streamlining grants development and management /","Ferguson, Jacqueline.",1994,FALSE
"139","ALDERMAN","HG 000176.7 .F56  2013","X031618323","Financial innovation : too much or too little? /","",2013,FALSE
"140","CLEMONS","HG 000176.7 .L47  2011","X032220755","Codes of finance : engineering derivatives in a global bank /","Lépinay, Vincent Antonin.",2011,FALSE
"141","ALDERMAN","HG 000177 .B377  2001","X004477882","How to evaluate and improve your grants effort /","Bauer, David G.",2001,FALSE
"142","ALDERMAN","HG 000177 .B38  1995","X002642592","The ""how to"" grants manual : successful grantseeking techniques for obtaining public and private grants /","Bauer, David G.",1995,FALSE
"143","ALDERMAN","HG 000177 .B38  1999","X004295134","The ""how to"" grants manual : successful grantseeking techniques for obtaining public and private grants /","Bauer, David G.",1999,FALSE
"144","ALDERMAN","HG 000177 .B38  2003","X004780424","The ""How to"" grants manual : successful grantseeking techniques for obtaining public and private grants /","Bauer, David G.",2003,FALSE
"145","ALDERMAN","HG 000177 .B76","X000072333","Fund raising : the guide to raising money from private sources /","Broce, Thomas E.,",1979,FALSE
"146","ALDERMAN","HG 000177 .B76  1986","X001172609","Fund raising : the guide to raising money from private sources /","Broce, Thomas E.,",1986,FALSE
"147","ALDERMAN","HG 000177 .C86  2010","X030817925","Strategies for foundations : when, why and how to use venture philanthropy /","Cummings, Ashley Metz.",2010,FALSE
"148","ALDERMAN","HG 000177 .F74  1993","X002603158","The grants development kit /","Ferguson, Jacqueline.",1993,FALSE
"149","ALDERMAN","HG 000177 .F742  1993","X002576904","The grants management kit /","Ferguson, Jacqueline.",1993,FALSE
"150","ALDERMAN","HG 000177 .G39  1991","X004378100","How to write for development : better communication brings bigger dollar results /","Gayley, Henry T.",1991,FALSE
"151","ALDERMAN","HG 000177 .G47  1993","X002556452","Effective evaluation : a systematic approach for grantseekers and project managers /","Gershowitz, Michael V.",1993,FALSE
"152","ALDERMAN","HG 000177 .G69  1983","X000630128","Grant proposals that succeeded /","",1983,FALSE
"153","ALDERMAN","HG 000177 .G86  1985","X001591352","Confessions of a fund raiser : lessons of an instructive career /","Gurin, Maurice G.",1985,FALSE
"154","ALDERMAN","HG 000177 .K18  2009","X031581819","A proposal for GNH value education in schools /","Karma Ura,",2009,FALSE
"155","ALDERMAN","HG 000177 .K73  1988","X001299485","How to prepare a research proposal : guidelines for funding and dissertations in the social and behavioral sciences /","Krathwohl, David R.",1988,FALSE
"156","ALDERMAN","HG 000177 .L56  1992","X002328701","Strategic planning for fund raising : how to bring in more money using strategic resource allocation /","Lindahl, Wesley E.,",1992,FALSE
"157","ALDERMAN","HG 000177 .M36  2010","X030763232","Getting your share of the pie : the complete guide to finding grants /","Mann, Valerie J.",2010,FALSE
"158","ALDERMAN","HG 000177 .N39  2003","X004807787","How to write a grant proposal /","New, Cheryl Carter.",2003,FALSE
"159","ALDERMAN","HG 000177 .O75  2013","X031614818","Developing a winning grant proposal /","Orlich, Donald C.",2013,FALSE
"160","ALDERMAN","HG 000177 .P76  2004","X004786626","Preparing a successful grant proposal /","Protheroe, Nancy.",2004,FALSE
"161","ALDERMAN","HG 000177 .R67  1991","X002328674","Achieving excellence in fund raising : a comprehensive guide to principles, strategies, and methods /","Rosso, Henry A.,",1991,FALSE
"162","ALDERMAN","HG 000177 .R67  2011","X030818624","Achieving excellence in fundraising /","",2011,FALSE
"163","ALDERMAN","HG 000177.5 .U6  D68  2000","X004708846","Conducting a successful capital campaign /","Dove, Kent E.,",2000,TRUE
"164","ALDERMAN","HG 000177.5 .U6  G44  1993","X002332195","The Foundation Center's guide to proposal writing /","Geever, Jane C.",1993,TRUE
"165","ALDERMAN","HG 000177.5 .U6  G44  1997","X004083670","The Foundation Center's guide to proposal writing /","Geever, Jane C.",1997,TRUE
"166","ALDERMAN","HG 000177.5 .U6  G44  2012","X031650063","The Foundation Center's guide to proposal writing /","Geever, Jane C.",2012,TRUE
"167","ALDERMAN","HG 000178 .F64  2013","X031618496","Market liquidity : theory, evidence, and policy /","Foucault, Thierry.",2013,FALSE
"168","ALDERMAN","HG 000178 .N68  2011","X031187108","Money, payments, and liquidity /","Nosal, Ed.",2011,FALSE
"169","ALDERMAN","HG 000178.3 .A76  2005","X030202953","The economics of microfinance /","Armendáriz, Beatriz",2005,FALSE
"170","ALDERMAN","HG 000178.3 .A768  2016","X031761243","Microfinance : battling a wicked problem /","Ashta, Arvind,",2016,FALSE
"171","ALDERMAN","HG 000178.3 .C75  2015","X031733888","The crises of microcredit /","",2015,FALSE
"172","ALDERMAN","HG 000178.3 .M5343  2006","X004913955","Microfinance : perils and prospects /","",2006,FALSE
"173","ALDERMAN","HG 000178.3 .M537  2015","X031734526","Microfinance, rights and global justice /","",2015,FALSE
"174","ALDERMAN","HG 000178.3 .N48  2013","X030852173","The new microfinance handbook : a financial market system perspective /","",2013,FALSE
"175","ALDERMAN","HG 000178.3 .S39  2015","X031655427","New media and international development : representation and affect in microfinance /","Schwittay, Anke Fleur,",2015,FALSE
"176","ALDERMAN","HG 000178.3 .W74  2000","X006118855","Micro-finance systems : designing quality financial services for the poor /","Wright, Graham,",2000,FALSE
"177","ALDERMAN","HG 000178.33 .B3  F37  2011","X030957781","Microcredit and women's empowerment : a case study of Bangladesh /","Faraizi, Aminul Haque.",2011,TRUE
"178","ALDERMAN","HG 000178.33 .B3  K43  2016","X031800907","Beyond ending poverty : the dynamics of microfinance in Bangladesh /","Khandker, Shahidur R.,",2016,FALSE
"179","ALDERMAN","HG 000178.33 .B3  K49  1998","X004307046","Fighting poverty with microcredit : experience in Bangladesh /","Khandker, Shahidur R.",1998,FALSE
