"","Item.Library.Code","Item.Shelving.Id","Item.Barcode","Catalog.Title","Catalog.Author","Catalog.Pub.Year","MultiVolume"
"1693","ALDERMAN","HG 003883 .U7  P55  1966","X031886743","The U. S. balance of payments and international monetary reserves,","Piquet, Howard S. (Howard Samuel),",1966,FALSE
"1694","ALDERMAN","HG 003883 .U7  W5  1964","X000117520","American growth and the balance of payments, 1820-1913; a study of the long swing.","Williamson, Jeffrey G.,",1964,FALSE
"1695","ALDERMAN","HG 003890 .F55","X031886899","Foreign exchange and skilled labour constraints in economic development.","Fløystad, Gunnar,",1967,FALSE
"1696","ALDERMAN","HG 003891 .B354  2015","X031733185","Migrating into financial markets : how remittances became a development tool /","Bakker, Matt,",2015,FALSE
"1697","ALDERMAN","HG 003891 .C367  1987","X001293010","Capital flight : the problem and policy responses /","Lessard, Donald R.",1987,FALSE
"1698","ALDERMAN","HG 003891 .C375  2013","X030852232","Capital for the future : saving and investment in an interdependent world.","",2013,FALSE
"1699","ALDERMAN","HG 003891 .C64  2010","X030762523","Capital rising : how capital flows are changing business systems all over the world /","Cohan, Peter S.,",2010,FALSE
"1700","ALDERMAN","HG 003891 .C75  2018","X031840262","Critical junctures in mobile capital /","",2018,FALSE
"1701","ALDERMAN","HG 003891 .D373  2001","X004550143","Capital flows without crisis? : reconciling capital mobility and economic stability /","Das Gupta, Dipak.",2001,FALSE
"1702","ALDERMAN","HG 003891 .E33  2004","X030408589","Capital flows and crises /","Eichengreen, Barry J.",2004,FALSE
"1703","CLEMONS","HG 003891 .G37  2001","X004532471","Money makes the world go around /","Garson, Barbara.",2001,FALSE
"1704","ALDERMAN","HG 003891 .I558  1999","X004279466","International capital flows /","",1999,FALSE
"1705","ALDERMAN","HG 003891 .J43  2012","X031216271","Who needs to open the capital account? /","Jeanne, Olivier.",2012,FALSE
"1706","ALDERMAN","HG 003891 .L32","X031886744","Private short-term capital flows /","Laffer, Arthur B.",1975,FALSE
"1707","ALDERMAN","HG 003891 .M34  1996","X004017600","Mobile capital and Latin American development /","Mahon, James E.,",1996,FALSE
"1708","ALDERMAN","HG 003891 .M367  2014","X031637161","Managing economic volatility in Latin America /","",2014,FALSE
"1709","ALDERMAN","HG 003891 .M39  1990","X001844650","Governing capital : international finance and Mexican politics /","Maxfield, Sylvia.",1990,FALSE
"1710","ALDERMAN","HG 003891 .R447  2001","X004555899","Regional and global capital flows : macroeconomic causes and consequences /","",2001,FALSE
"1711","ALDERMAN","HG 003891 .S38  2000","X004422337","The political economy of capital controls /","Schulze, Günther G.",2000,FALSE
"1712","ALDERMAN","HG 003891 .S56  2013","X031664767","Capital flows and exchange rate management /","Sikdar, Soumyen.",2013,FALSE
"1713","ALDERMAN","HG 003891.5 .B57  2002","X004470535","Delivering on debt relief : from IMF gold to a new aid architecture /","Birdsall, Nancy.",2002,FALSE
"1714","ALDERMAN","HG 003891.5 .C37  1993","X002243146","Capital markets and financial intermediation /","",1993,FALSE
"1715","ALDERMAN","HG 003891.5 .E975  2014","X031658219","External Debt Statistics: Guide for Compilers and Users 2014.","",2014,FALSE
"1716","ALDERMAN","HG 003891.5 .M334  2000","X004473011","Managing financial and corporate distress : lessons from Asia /","",2000,FALSE
"1717","ALDERMAN","HG 003891.5 .R68  2004","X004807180","Bailouts or bail-ins? : responding to financial crises in emerging economies /","Roubini, Nouriel.",2004,FALSE
"1718","ALDERMAN","HG 003891.5 .S87  1992","X002163117","Debt cycles in the world-economy : foreign loans, financial crises, and debt settlements, 1820-1990 /","Suter, Christian,",1992,FALSE
"1719","ALDERMAN","HG 003891.5 .T66  2007","X030268897","Reputation and international cooperation : sovereign debt across three centuries /","Tomz, Michael.",2007,FALSE
"1720","ALDERMAN","HG 003891.5 .W67  1986","X000972692","World debt crisis : international lending on trial /","",1986,FALSE
"1721","ALDERMAN","HG 003894 .K46  2008","X030252334","Regional monetary integration /","Kenen, Peter B.,",2008,FALSE
"1722","ALDERMAN","HG 003894 .P654  2001","X004595667","The politics of Europe : monetary union and class /","",2001,FALSE
"1723","ALDERMAN","HG 003894 .P76  2005","X004903599","Prospects for monetary unions after the euro /","",2005,FALSE
"1724","ALDERMAN","HG 003894 .S28  2005","X004839756","Making the EMU : the politics of budgetary surveillance and the enforcement of Maastricht /","Savage, James D.,",2005,FALSE
"1725","ALDERMAN","HG 003895 .B42","X031886799","The Asian dollar market : international offshore financing /","Bhattacharya, Anindya K.",1977,FALSE
"1726","ALDERMAN","HG 003903 .B47  2017","X031818983","Currency conflict and trade policy : a new strategy for the United States /","Bergsten, C. Fred,",2017,FALSE
"1727","ALDERMAN","HG 003903 .G68  1983","X000690126","Closing the gold window : domestic politics and the end of Bretton Woods /","Gowa, Joanne S.",1983,FALSE
"1728","ALDERMAN","HG 003903 .H458  2008","X030463989","Accountability and oversight of US exchange rate policy /","Henning, C. Randall.",2008,FALSE
"1729","ALDERMAN","HG 003903 .J35  1987","X001208736","Japan and the United States today : exchange rates, macroeconomic policies, and financial market innovations /","",1986,FALSE
"1730","ALDERMAN","HG 003903 .S54  2007","X030145371","When Washington shut down Wall Street : the great financial crisis of 1914 and the origins of America's monetary supremacy /","Silber, William L.",2007,FALSE
"1731","ALDERMAN","HG 003903 .U8  2010","X030819215","The US-Sino currency dispute : new insights from economics, politics and law /","",2010,FALSE
"1732","ALDERMAN","HG 003915.5 .S46  2002","X004635360","Sending money home : Hispanic remittances and community development /","",2002,FALSE
"1733","ALDERMAN","HG 003916 .L674  2015","X031705020","The remittance landscape : spaces of migration in rural Mexico and urban USA /","Lopez, Sarah Lynn,",2015,FALSE
"1734","ALDERMAN","HG 003939 .P34  2014","X031705476","Return to sender : the moral economy of Peru's migrant remittances /","Paerregaard, Karsten.",2014,FALSE
"1735","ALDERMAN","HG 003942 .B76  2010","X030774148","Euro crash : the implications of monetary failure in Europe /","Brown, Brendan,",2010,FALSE
"1736","ALDERMAN","HG 003942 .E964  2002","X004586690","The euro : European integration theory and economic and monetary union /","",2002,FALSE
"1737","ALDERMAN","HG 003942 .J64  2016","X031795981","From convergence to crisis : labor markets and the instability of the euro /","Johnston, Alison,",2016,FALSE
"1738","ALDERMAN","HG 003942 .M665  2005","X004810986","Monetary union in crisis : the European Union as a neo-liberal construction /","",2005,FALSE
"1739","ALDERMAN","HG 003942 .S78  2010","X030763046","Fixed ideas of money : small states and exchange rate regimes in twentieth-century Europe /","Straumann, Tobias.",2010,FALSE
"1740","ALDERMAN","HG 003942.8 .E45  1997","X004151024","European monetary unification : theory, practice, and analysis /","Eichengreen, Barry J.",1997,FALSE
"1741","ALDERMAN","HG 003942.8 .E93  1992","X002047974","Exchange rate targets and currency bands /","",1992,FALSE
"1742","ALDERMAN","HG 003943 .W34  2000","X004345981","European monetary integration & domestic politics : Britain, France, and Italy /","Walsh, James I.",2000,FALSE
"1743","ALDERMAN","HG 003949 .W66  1982","X031886834","U.S. intervention in the exchange market for DM, 1977-80 /","Wonnacott, Paul.",1982,FALSE
"1744","ALDERMAN","HG 003963 .B57  2016","X031741462","Lucifer's banker : the untold story of how I destroyed Swiss bank secrecy /","Birkenfeld, Bradley C.",2016,FALSE
"1745","ALDERMAN","HG 003968 .D83  2012","X031610057","Exchange rate policy and modelling in India /","Dua, Pami.",2012,FALSE
"1746","ALDERMAN","HG 003968 .S345  2006","X030285205","Exchange rates, shocks and inter-dependency in East Asia : lessons from a multinational model /","Saglio, Sophie.",2005,FALSE
"1747","ALDERMAN","HG 003968.85 .Q28  2011","X031222934","The Qatar-Nepal remittance corridor : enhancing the impact and integrity of remittance flows through reducing inefficiencies in the migration process.","",2011,FALSE
"1748","ALDERMAN","HG 003969.3 .M54  2011","X030851498","Migration, remittances, and development in South Asia /","",2011,FALSE
"1749","ALDERMAN","HG 003969.3 .M54  2014","X031708270","Migrant remittances in South Asia : social, economic and political implications /","",2014,FALSE
"1750","ALDERMAN","HG 003971 .A47  2012","X031227571","The remittance market in India : opportunities, challenges, and policy options /","Afram, Gabi G. (Gabi George)",2012,FALSE
"1751","ALDERMAN","HG 003971 .K64  2005","X030086345","Liberalizing capital flows : India's experience and policy issues /","Kohli, Renu.",2005,FALSE
"1752","ALDERMAN","HG 003971 .R4  001948/000049-001955/000056","X031886892","India's balance of payments, 1948-49-1955-56.","Reserve Bank of India. Balance of Payments Division.",1957,FALSE
"1753","ALDERMAN","HG 003971 .R4  001948/000049-001961/000062","X031886893","India's balance of payments, 1948-49 to 1961-62.","Reserve Bank of India.",1963,FALSE
"1754","ALDERMAN","HG 003976.5 .K36  2003","X004717657","The effects of capital outflows from neighboring countries on a home country's terms of trade and real exchange rate : the case of East Asia /","Kang, Sam-mo.",2003,FALSE
"1755","ALDERMAN","HG 003976.5 .K363  2003","X004731742","Fear of inflation : exchange rate pass-through in East Asia /","Kang, Sam-mo.",2003,FALSE
"1756","ALDERMAN","HG 003976.5 .K56  2002","X004692437","Exchange rate regimes and monetary independence in East Asia /","Kim, Chang-Jin.",2002,FALSE
"1757","ALDERMAN","HG 003976.5 .K566  2004","X030122736","Regional vs. global risk sharing in East Asia /","Kim, Soyoung.",2004,FALSE
"1758","ALDERMAN","HG 003976.5 .M35  2005","X031190654","Exchange rates under the East Asian dollar standard : living with conflicted virtue /","McKinnon, Ronald I.",2005,FALSE
"1759","ALDERMAN","HG 003976.5 .P37  2000","X006113043","Reform of the international financial system and institutions in light of the Asian financial crisis /","Pak, Y?ng-ch??l,",2000,FALSE
"1760","ALDERMAN","HG 003976.5 .W36  2008","X030475793","Flexible BBC exchange rate system and exchange rate cooperation in East Asia /","Wang, Y?n-gyun,",2008,FALSE
"1761","ALDERMAN","HG 003977 .I94  1995B","X002701886","Japan in the international financial system /","Iwami, T?ru.",1995,FALSE
"1762","ALDERMAN","HG 003978 .B46  2018","X032582504","Dear China : emigrant letters and remittances, 1820-1980 /","Benton, Gregor",2018,FALSE
"1763","ALDERMAN","HG 003978 .C427  2004","X030088892","Chao Shan di qu qiao pi ye zi liao /","",2004,FALSE
"1764","ALDERMAN","HG 003978 .D43  2008","X030259735","Debating China's exchange rate policy /","",2008,FALSE
"1765","ALDERMAN","HG 003978 .G65  2009","X030559040","The future of China's exchange rate policy /","Goldstein, Morris,",2009,FALSE
"1766","ALDERMAN","HG 003978 .S83  2017","X031793341","The people's money : how China is building a global currency /","Subacchi, Paola,",2017,FALSE
"1767","ALDERMAN","HG 003983.4 .Q47  2014","X031722095","The quest for regional integration in the East African community /","",2014,FALSE
"1768","ALDERMAN","HG 003986.5 .B84  2016","X031755430","Building integrated economies in West Africa : lessons in managing growth, inclusiveness, and volatility /","",2016,FALSE
"1769","ALDERMAN","HG 004011 .B53  2010","X030744017","Financial management for business : cracking the hidden code /","Bittlestone, Robert,",2010,FALSE
"1770","CLEMONS","HG 004011 .C833  1983","X000543786","Financial theory and corporate policy /","Copeland, Thomas E.,",1983,FALSE
"1771","ALDERMAN","HG 004011 .M568","X031953269","Theory of financial markets.","Mossin, Jan.",1972,FALSE
"1772","CLEMONS","HG 004012.5 .N48  1993","X002311112","Neural networks in finance and investing : using artificial intelligence to improve real-world performance /","",1993,FALSE
"1773","CLEMONS","HG 004012.5 .N48  1996","X004190022","Neural networks in finance and investing : using artificial intelligence to improve real-world performance /","",1996,FALSE
"1774","ALDERMAN","HG 004017 .B37  1997","X004093975","A history of corporate finance /","Baskin, Jonathan.",1997,FALSE
"1775","CLEMONS","HG 004026 .B667  1984","X000819390","Principles of corporate finance /","Brealey, Richard A.",1984,FALSE
"1776","ALDERMAN","HG 004026 .B667  2003","X004663946","Principles of corporate finance /","Brealey, Richard A.",2003,FALSE
"1777","ALDERMAN","HG 004026 .D38  1984","X000864071","Finance and the firm /","Davis, Edward W.",1984,FALSE
"1778","ALDERMAN","HG 004026 .F3298  2016","X031762613","Entrepreneurial finance and accounting for high-tech companies /","Fabozzi, Frank J.,",2016,FALSE
"1779","ALDERMAN","HG 004026 .F517  2011","X030817495","Financial Times briefing on critical financial issues /","Finch, Brian.",2011,FALSE
"1780","CLEMONS","HG 004026 .F524  1986","X001034577","Corporate financial analysis : a comprehensive guide to real-world approaches for financial managers /","Finnerty, John D.",1986,FALSE
"1781","ALDERMAN","HG 004026 .H274  2015","X031704646","Fundamentals of enterprise risk management : how top companies assess risk, manage exposure, and seize opportunity /","Hampton, John J.,",2015,FALSE
"1782","CLEMONS","HG 004026 .H496  2001","X004378826","Analysis for financial management /","Higgins, Robert C.",2001,FALSE
"1783","ALDERMAN","HG 004026 .L219  2016","X032208758","Romancing the balance sheet /","Lamba, Anil,",2016,FALSE
"1784","ALDERMAN","HG 004026 .M39  2013","X030608933","Firm commitment : why the corporation is failing us and how to restore trust in it /","Mayer, C. P. (Colin P.)",2013,FALSE
"1785","CLEMONS","HG 004026 .M68","X001444943","Contemporary financial management /","Moyer, R. Charles,",1981,FALSE
"1786","ALDERMAN","HG 004026 .O76  2005","X004833135","Why most things fail : evolution, extinction and economics /","Ormerod, Paul.",2005,FALSE
"1787","ALDERMAN","HG 004027.35 .B73  2011","X030733200","The new CFO financial leadership manual /","Bragg, Steven M.",2011,FALSE
"1788","ALDERMAN","HG 004027.6 .E58  2018","X032582898","Entrepreneurial finance : the art and science of growing ventures /","",2018,FALSE
"1789","ALDERMAN","HG 004027.65 .M363  2010","X030781107","Not-for-profit accounting, tax, and reporting requirements /","McMillan, Edward J.,",2010,FALSE
"1790","ALDERMAN","HG 004027.65 .M364  2010","X030781108","Not-for-profit budgeting for nonprofit organizations /","McMillan, Edward J.,",2010,FALSE
"1791","ALDERMAN","HG 004027.65 .V65  2010","X030744202","Voluntary regulation of NGOs and nonprofits : an accountability club framework /","",2010,FALSE
"1792","ALDERMAN","HG 004027.7 .S6437  1996  V.000001","X004104971","Small firms and economic growth /","",1996,TRUE
"1793","ALDERMAN","HG 004028 .A84  H35  2016","X031790909","Back from the brink : lessons from the Canadian asset-backed commercial paper crisis /","Halpern, Paul J.,",2016,FALSE
"1794","ALDERMAN","HG 004028 .B2  B422  2013","X030608764","Financial intelligence : a manager's guide to knowing what the numbers really mean /","Berman, Karen,",2013,FALSE
"1795","ALDERMAN","HG 004028 .B8  S428  2010","X030620332","Brilliant budgets and forecasts : your practical guide to preparing and presenting financial information /","Secrett, Malcolm.",2010,FALSE
"1796","CLEMONS","HG 004028 .C4  D58  1993","X002422066","Investment under uncertainty /","Dixit, Avinash K.",1993,TRUE
"1797","ALDERMAN","HG 004028 .C4  E35  1969","X031887054","Effects of federal income taxes on capital budgeting,","Edwards, James W.",1969,FALSE
"1798","ALDERMAN","HG 004028 .C4  E39","X031886913","Eficien?a  economic? a investi?iilor ?i a tehnicii noi. : Studii privind perfec?ionarea metodologiei de calcul.","",1972,FALSE
"1799","ALDERMAN","HG 004028 .C4  H6","X031886911","On investment decisions in Finnish industry. An empirical pilot study of the administration of the capital investment planning and control process and the moment of and motives for investments in some industries in Finland.","Honko, Jaakko.",1966,FALSE
"1800","ALDERMAN","HG 004028 .C4  I54  1965","X031886906","Leasing of machinery : another method of financing foreign exchange for a developing country.","Investment Advisory Centre of Pakistan.",1965,FALSE
"1801","ALDERMAN","HG 004028 .C4  M47  2004","X030240540","Induced investment and business cycles /","Minsky, Hyman P.",2004,FALSE
"1802","ALDERMAN","HG 004028 .C4  P625  2011","X030946811","The cost of capital /","Porras, Eva R.",2011,FALSE
"1803","CLEMONS","HG 004028 .C4  P72  1998","X004340573","Cost of capital : estimation and applications /","Pratt, Shannon P.",1998,FALSE
"1804","ALDERMAN","HG 004028 .C45  O76","X031886921","Cash management and the demand for money.","Orr, Daniel,",1971,FALSE
"1805","ALDERMAN","HG 004028 .C6  Y58  2010","X030744959","Americanizing Japanese firms : the institutionalization of corporate philanthropy and volunteerism in American communities /","Yotsumoto, Yukio,",2010,FALSE
"1806","ALDERMAN","HG 004028 .D3  D84  2011","X030975815","Measuring corporate default risk /","Duffie, Darrell.",2011,TRUE
"1807","ALDERMAN","HG 004028 .M4  B335  1998","X004159099","The new financial capitalists : Kohlberg Kravis Roberts and the creation of corporate value /","Baker, George P. (George Pierce)",1998,FALSE
"1808","ALDERMAN","HG 004028 .M4  D43  1993","X002230927","The Deal decade : what takeovers and leveraged buyouts mean for corporate governance /","",1993,TRUE
"1809","ALDERMAN","HG 004028 .M4  I588  2007","X030101992","International mergers and acquisitions activity since 1990 : recent research and quantitative analysis /","Gregoriou, Greg N.,",2007,FALSE
"1810","ALDERMAN","HG 004028 .M4  N4","X000199673","Merger movements in American industry, 1895-1956.","Nelson, Ralph L. (Ralph Lowell),",1959,FALSE
"1811","ALDERMAN","HG 004028 .M4  V35  2010","X030744998","Value in due diligence : contemporary strategies for merger and acquisition success /","",2010,TRUE
"1812","ALDERMAN","HG 004028 .S7  J46  1996","X004072029","Going public : the theory and evidence on how companies raise equity finance /","Jenkinson, Tim,",1996,FALSE
"1813","ALDERMAN","HG 004028 .V3  A56  2012","X031600019","The economics of business valuation : towards a value functional approach /","Anderson, Patrick L.,",2012,FALSE
"1814","ALDERMAN","HG 004028 .V3  A94  2012","X030959924","Valuing an entrepreneurial enterprise /","Audretsch, David B.",2012,FALSE
"1815","ALDERMAN","HG 004028 .V3  B28  2010","X030619596","Valuing early stage and venture-backed companies /","Beaton, Neil J.",2010,FALSE
"1816","CLEMONS","HG 004028 .V3  C67  1995","X004358433","Valuation : measuring and managing the value of companies /","Copeland, Thomas E.,",1995,TRUE
"1817","ALDERMAN","HG 004028 .V3  C67  2010","X031641771","Valuation : measuring and managing the value of companies /","Koller, Tim.",2010,TRUE
"1818","CLEMONS","HG 004028 .V3  D35  1994","X004341818","Damodaran on valuation : security analysis for investment and corporate finance /","Damodaran, Aswath.",1994,TRUE
"1819","ALDERMAN","HG 004028 .V3  D3537  2017","X031760652","Narrative and numbers : the value of stories in business /","Damodaran, Aswath,",2017,TRUE
"1820","ALDERMAN","HG 004028 .V3  E93  2010","X030780710","Valuation for M&A : building value in private companies /","Mellen, Chris M.",2010,FALSE
"1821","ALDERMAN","HG 004028 .V3  G78","X031886920","Stock valuation in Federal taxation,","Grunewald, Alan E.,",1961,TRUE
"1822","ALDERMAN","HG 004028 .V3  N64  2011","X030817909","Nonlinear financial econometrics : Markov switching models, persistence and nonlinear cointegration /","",2011,FALSE
"1823","ALDERMAN","HG 004057 .A1565  1983","X031886904","The corporate finance sourcebook 1983","Zehring, Karen",1983,FALSE
"1824","ALDERMAN","HG 004061 .C638  2016","X031795754","The next wave : financing women's growth-oriented firms /","Coleman, Susan,",2016,FALSE
"1825","ALDERMAN","HG 004061 .R58  1994","X002521547","Strong managers, weak owners : the political roots of American corporate finance /","Roe, Mark J.,",1994,FALSE
"1826","ALDERMAN","HG 004078 .D3  L53  1988","X001559090","Lien de vie, noeud mortel : les représentations de la dette en Chine, au Japon et dans le monde indien /","",1988,TRUE
"1827","ALDERMAN","HG 004101 .G73  1982","X000915394","Los grupos financieros, agroalimentarios e industriales en Argentina /","Green, Raúl H.",1982,FALSE
"1828","ALDERMAN","HG 004126 .I46  2013","X030852147","Impact evaluation of business licence simplification in peru : an independent assessment of an International Finance Corporation-supported project.","",2013,FALSE
"1829","ALDERMAN","HG 004133.7 .C66  2018","X032212061","Contemporary issues in business and financial management in Eastern Europe /","",2018,FALSE
"1830","ALDERMAN","HG 004135 .C67","X000070119","Industrial finance 1830-1914 : the finance and organization of English manufacturing industry /","Cottrell, P. L.",1980,FALSE
"1831","ALDERMAN","HG 004135 .T37  2006","X030167405","Creating capitalism : joint-stock enterprise in British politics and culture, 1800-1870 /","Taylor, James,",2006,FALSE
"1832","ALDERMAN","HG 004241 .A5  1964","X031961877","West Bengal : estimates of state income and its regional differentials","[State Statistical Bureau, Government Of West Bengal]",1965,FALSE
"1833","ALDERMAN","HG 004242 .D57  1981  V.000005","X031961779","Directory of foreign collaborations in India.","",1981,TRUE
"1834","ALDERMAN","HG 004244.3 .C44  2004","X004991361","Money and microenterprises in Bhutan : the land of zorig chug sum = thirteen arts and crafts /","Chetri, Saamdu.",2004,FALSE
"1835","ALDERMAN","HG 004244.9 .B87  2006","X004904080","Business groups in east Asia : financial crisis, restructuring, and new growth /","",2006,FALSE
"1836","ALDERMAN","HG 004247 .A735  2003","X004781674","Corporate restructuring in Korea : empirical evaluation /","An, Ch'ung-y?ng",2003,FALSE
"1837","ALDERMAN","HG 004247 .C47  2003","X030165002","Financial crisis and transformation of Korean business groups : the rise and fall of chaebols /","Chang, Se-jin,",2003,FALSE
"1838","ALDERMAN","HG 004247 .C4716  2003","X004853852","Oehwan wigi wa Han?guk ki?p chiptan ?i py?nhwa : chaeb?l ?i h?ngmang /","Chang, Se-jin.",2003,FALSE
"1839","ALDERMAN","HG 004259 .C47  1996","X004469375","A comparative evolution of business partnerships : the Islamic world and Europe, with specific reference to the Ottoman Archives /","Çizakça, Murat.",1996,FALSE
"1840","ALDERMAN","HG 004342 .A4  1969  V.000001","X031967950","Commercial banks and their trust activities: emerging influence on the American economy; staff report.","United States. Congress. House. Committee on Banking and Currency. Subcommittee on Domestic Finance.",1968,TRUE
"1841","ALDERMAN","HG 004360 .T67  H44","X031865082","National Trust Company, limited; : a 75th anniversary address, 1898-1973 /","Heeney, E. H. (Edwin H.),",1974,FALSE
"1842","ALDERMAN","HG 004513 .S37  1997","X004139532","Wall Street words : an essential A to Z guide for today's investor /","Scott, David Logan,",1997,FALSE
"1843","ALDERMAN","HG 004513 .S54  1983","X030778682","Sh?ken y?go jiten /","",1983,FALSE
"1844","ALDERMAN","HG 004515 .B69  1988","X001452280","Investment confidence and business cycles /","Boyd, Ian,",1988,FALSE
"1845","CLEMONS","HG 004515 .H34  2000","X031737936","Latticework : the new investing /","Hagstrom, Robert G.,",2000,FALSE
"1846","ALDERMAN","HG 004515 .S54  2000","X006118233","Inefficient markets : an introduction to behavioral finance /","Shleifer, Andrei.",2000,FALSE
"1847","CLEMONS","HG 004515 .S67  1994","X004913605","The alchemy of finance : reading the mind of the market /","Soros, George.",1994,FALSE
"1848","ALDERMAN","HG 004515.13 .F86  2010","X030620759","Socially responsible investment in a global environment /","Fung, Hung-gay.",2010,FALSE
"1849","ALDERMAN","HG 004515.15 .A38  1993","X002314493","Advances in behavioral finance /","",1993,FALSE
"1850","ALDERMAN","HG 004515.15 .A89  2013","X030845958","Moods and markets : a new way to invest in good times and in bad /","Atwater, Peter,",2013,FALSE
"1851","ALDERMAN","HG 004515.15 .B39  2014","X031704604","Uncertainty, expectations, and financial instability : reviving Allais's lost theory of psychological time /","Barthalon, Eric,",2014,FALSE
"1852","ALDERMAN","HG 004515.15 .B4384  2010","X030743923","Behavioral finance : investors, corporations, and markets /","",2010,FALSE
"1853","CLEMONS","HG 004515.15 .C64  2001","X004557307","Fear, greed and panic : the psychology of the stock market /","Cohen, David,",2001,FALSE
"1854","CLEMONS","HG 004515.15 .C67  1987","X004345926","The psychological basis underlying common stock movements : a treatise examining subjective value in the stock market /","Corotto, Loren V.",1987,FALSE
"1855","CLEMONS","HG 004515.15 .L64  2011","X030794435","Warren Buffett invests like a girl : and why you should too /","Lofton, LouAnn.",2011,FALSE
"1856","CLEMONS","HG 004515.15 .P38  2003","X004699600","A mathematician plays the stock market /","Paulos, John Allen.",2003,FALSE
"1857","ALDERMAN","HG 004515.15 .W37  2001","X004552334","The psychology of money : an investment manager's guide to beating the market /","Ware, Jim,",2001,FALSE
"1858","ALDERMAN","HG 004515.2 .B384  2001","X004557541","Econometric modelling of stock market intraday activity /","Bauwens, Luc,",2001,FALSE
"1859","ALDERMAN","HG 004515.2 .L84  2014","X031759427","Investment science /","Luenberger, David G.,",2014,FALSE
"1860","ALDERMAN","HG 004515.2 .O38  1995","X002626845","Market microstructure theory /","O'Hara, Maureen.",1995,FALSE
