"","Item.Library.Code","Item.Shelving.Id","Item.Barcode","Catalog.Title","Catalog.Author","Catalog.Pub.Year","MultiVolume"
"698","ALDERMAN","HG 000937 .L735  1991  V.000001","X001925954","Locke on money /","Locke, John,",1991,TRUE
"699","ALDERMAN","HG 000937 .O9  1982","X000617892","Inflation in Tudor and early Stuart England;","Outhwaite, R. B.",1982,FALSE
"700","ALDERMAN","HG 000939 .A3  1887  V.000001-000002","X031865154","Report of the Royal Commission appointed to inquire into the recent changes in the relative values of the precious metals; with minutes of evidence and appendices. /","Great Britain. Royal Commission on Gold and Silver.",1887,TRUE
"701","ALDERMAN","HG 000939 .A44  1960  V.000001","X031864689","Principal memoranda of evidence.","Great Britain. Committee on the Working of the Monetary System.",1960,TRUE
"702","ALDERMAN","HG 000939 .C29  1985  V.000001","X000908102","A monetary history of the United Kingdom, 1870-1982 /","Capie, Forrest.",1985,TRUE
"703","ALDERMAN","HG 000939 .K85  1987","X001364523","The battle for Britain's gold standard in 1931 /","Kunz, Diane B.,",1987,FALSE
"704","ALDERMAN","HG 000939.5 .B87  1992","X002117254","Good-bye, Great Britain : the 1976 IMF crisis /","Burk, Kathleen.",1992,FALSE
"705","ALDERMAN","HG 000939.5 .D68  1988","X001358541","A critique of monetary policy : theory and British experience /","Dow, J. C. R. (J. Christopher R.)",1988,FALSE
"706","ALDERMAN","HG 000939.5 .H257  1997B","X004083189","The British labour government and the 1976 IMF crisis /","Harmon, Mark D.",1997,FALSE
"707","ALDERMAN","HG 000939.5 .H65","X000291362","Domestic monetary management in Britain, 1919-38 /","Howson, Susan,",1975,FALSE
"708","ALDERMAN","HG 000939.5 .S343  2010","X030780886","The decline of sterling : managing the retreat of an international currency, 1945-1992 /","Schenk, Catherine R. (Catherine Ruth),",2010,FALSE
"709","ALDERMAN","HG 000939.5 .W37  2008","X030279015","Decline to fall : the making of British macro-economic policy and the 1976 IMF crisis /","Wass, Douglas,",2008,FALSE
"710","ALDERMAN","HG 000950 .E54  V35  2006","X031804085","The social life of money in the English past /","Valenze, Deborah M.,",2006,TRUE
"711","ALDERMAN","HG 000976 .M66  2007","X030357669","Monnaie, fiscalité et finances au temps de Philippe Le Bel : journée d'études du 14 mai 2004 /","",2007,FALSE
"712","ALDERMAN","HG 000976 .P37  2015","X031704864","Making money in sixteenth-century France : currency, culture, and the state /","Parsons, Jotham,",2014,FALSE
"713","ALDERMAN","HG 000978 .S65  2015","X031707942","Stuff and money in the time of the French Revolution /","Spang, Rebecca L.,",2015,FALSE
"714","ALDERMAN","HG 000979.5 .L67  1991","X002102409","France after hegemony : international change and financial reform /","Loriaux, Michael Maurice.",1991,FALSE
"715","ALDERMAN","HG 000995 .A54  1990","X031961878","Les allemands et l'argent","Merlio, Gilbert",1990,FALSE
"716","ALDERMAN","HG 000997 .P33  2012","X030843648","The Kipper und Wipper inflation, 1619-23 : an economic history with contemporary German broadsheets /","Paas, Martha White.",2012,FALSE
"717","ALDERMAN","HG 000999 .F45  1993","X002404793","The great disorder : politics, economics, and society in the German inflation, 1914-1924 /","Feldman, Gerald D.",1993,FALSE
"718","CLEMONS","HG 000999 .F45  1997","X004526825","The great disorder : politics, economics, and society in the German inflation, 1914-1924 /","Feldman, Gerald D.",1997,FALSE
"719","ALDERMAN","HG 000999 .F47  1975","X000291364","When money dies : the nightmare of the Weimar collapse /","Fergusson, Adam,",1975,FALSE
"720","ALDERMAN","HG 000999 .G38  2010","X031199497","German hyperinflation 1922/23 : a law and economics approach /","",2010,FALSE
"721","ALDERMAN","HG 000999 .G39  1982","X000670453","The German inflation reconsidered : a preliminary balance /","",1982,FALSE
"722","ALDERMAN","HG 000999 .H7313  1986","X001064596","The German inflation, 1914-1923 : causes and effects in international perspective /","Holtfrerich, Carl-Ludwig.",1986,FALSE
"723","ALDERMAN","HG 000999 .H7314  2008","X030456400","L'inflation en Allemagne, 1914-1923 : causes et conséquences au regard du contexte international /","Holtfrerich, Carl-Ludwig.",2008,FALSE
"724","ALDERMAN","HG 000999 .N32  1985","X001011450","Die Nachwirkungen der Inflation auf die deutsche Geschichte, 1924-1933 /","",1985,FALSE
"725","ALDERMAN","HG 000999 .P37","X000418000","Dying of money; lessons of the great German and American inflations","Parsson, Jens O.",1974,FALSE
"726","ALDERMAN","HG 000999 .W418  2001","X004474499","Culture and inflation in Weimar Germany /","Widdig, Bernd.",2001,FALSE
"727","ALDERMAN","HG 000999 .W425  1989","X001640372","Hyperinflation and stabilization in Weimar Germany /","Webb, Steven Benjamin,",1989,FALSE
"728","ALDERMAN","HG 000999.5 .K35  1998","X004222435","Germany and the politics of Europe's money /","Kaltenthaler, Karl,",1998,FALSE
"729","ALDERMAN","HG 001010 .C6  H38  1984","X031961740","Der Kölner Pfennig im 12. und 13. Jahrhundert : Periode der territorialen Pfennigmünze /","Hävernick, Walter,",1984,FALSE
"730","ALDERMAN","HG 001010.5 .Z38  2007","X030112648","The currency of socialism : money and political culture in East Germany /","Zatlin, Jonathan R.,",2007,FALSE
"731","ALDERMAN","HG 001026 .C7  1985B","X000953806","Coinage and money under the Roman Republic.","Crawford, Michael H. (Michael Hewson),",1985,FALSE
"732","ALDERMAN","HG 001040 .V46  L36  1985  V.000001","X000929105","Money and banking in medieval and Renaissance Venice /","Lane, Frederic Chapin,",1985,TRUE
"733","ALDERMAN","HG 001040 .V46  M84  1997","X004105215","The Venetian money market : banks, panics, and the public debt, 1200-1500 /","Mueller, Reinhold C.",1997,FALSE
"734","ALDERMAN","HG 001075 .D45  1965","X031826764","Denezhnoe obrashchenie i kredit SSSR. Dopushcheno v kachestve ucheb. posobi?a dli?a zaochnykh finansovo-?kon. vuzov i fakul?tetov.","",1965,FALSE
"735","ALDERMAN","HG 001080 .A96  S44  KN.000001","X031961667","Monetnoe delo i denezhnoe obrashchenie v Azerba?dzhane XII-XV vv. /","Se?feddini, M. A.",1978,TRUE
"736","ALDERMAN","HG 001080.2 .W66  1999","X004313643","Money unmade : barter and the fate of Russian capitalism /","Woodruff, David,",1999,FALSE
"737","ALDERMAN","HG 001133 .P85  2017","X031848638","Más que negocios : Simón Ruiz, un banquero español del siglo XVI entre las penínsulas ibérica e italiana /","Pulido Serrano, Juan Ignacio,",2017,FALSE
"738","ALDERMAN","HG 001152 .B253  2017","X031818105","Swiss monetary history since the early 19th century /","Baltensperger, Ernst,",2017,FALSE
"739","ALDERMAN","HG 001206 .R63  2011","X031222932","Financial access and stability : a road map for the Middle East and North Africa /","Rocha, Roberto Rezende.",2011,FALSE
"740","ALDERMAN","HG 001211 .N32  2005","X030243834","al-Azmah al-M?l?ah al-Muzdawajah /","al-N?buls?, Mu?ammad Sa??d.",2005,FALSE
"741","ALDERMAN","HG 001220.22 .B76  2010","X030620253","The currency of power : the IMF and monetary reform in Central Asia /","Broome, André,",2010,FALSE
"742","ALDERMAN","HG 001220.8 .T44  2010","X031234042","Money, inflation, and output /","Thenuwara, H. N.",2010,FALSE
"743","ALDERMAN","HG 001222 .P4  1965","X031951529","Chung-kuo huo pi shih /","Peng, Xinwei.",1965,FALSE
"744","ALDERMAN","HG 001232 .S68  2015","X031758635","In search of stability : economics of money, history of the rupee /","Sivramkrishna, Sashi,",2015,FALSE
"745","ALDERMAN","HG 001233 .G37  2013","X031664707","The sikka and the Raj : a history of currency legislations of the East India Company, 1772-1835 /","Garg, Sanjay",2013,FALSE
"746","ALDERMAN","HG 001233 .I46  1987","X001593645","The Imperial monetary system of Mughal India /","",1987,FALSE
"747","ALDERMAN","HG 001233 .M348  2001","X004846586","Money & credit in Indian history : from early medieval times /","Indian History Congress",2002,FALSE
"748","ALDERMAN","HG 001235 .B62  2012","X031611856","Financial access in post-reform India /","Bhavani, T. A.",2012,FALSE
"749","ALDERMAN","HG 001235 .R32  2009  V.000002","X030622381","Money and finance in the Indian economy /","Rakshit, Mihir.",2009,TRUE
"750","ALDERMAN","HG 001235 .R39  2013","X031664769","Monetary policy /","",2013,FALSE
"751","ALDERMAN","HG 001235 .R44  2003","X004704256","Reforming India's external, financial, and fiscal policies /","",2003,FALSE
"752","ALDERMAN","HG 001235 .T36  2016","X031814642","Taming Indian inflation /","",2016,FALSE
"753","ALDERMAN","HG 001240.5 .K37  2015","X031847125","Banknotes and coins of Pakistan 1947 to 2015 /","Kasbati, Rafiq,",2015,FALSE
"754","ALDERMAN","HG 001270.5 .C435  2005","X030285258","The illusive quest for an Asian common currency : economic mirage or realpolitik? /","Chan-Lee, James H.",2005,FALSE
"755","ALDERMAN","HG 001270.5 .C87  2002","X004696008","Currency union in East Asia /","",2002,FALSE
"756","ALDERMAN","HG 001270.5 .F56  2003","X004781670","Financial development and integration in East Asia /","",2003,FALSE
"757","ALDERMAN","HG 001270.5 .K558  2004","X004793424","Monetary union and real convergence compared : Europe and East Asia /","Kim, H?ng-jong,",2004,FALSE
"758","ALDERMAN","HG 001270.5 .K56  2003","X004781859","Financial integration and consumption risk sharing in East Asia /","Kim, Soyoung.",2003,FALSE
"759","ALDERMAN","HG 001270.5 .P37  2006","X030209879","Prospects for regional financial and monetary integration in East Asia /","Pak, Y?ng-ch??l,",2006,FALSE
"760","ALDERMAN","HG 001270.5 .R34  2002","X004620552","The East Asian currency crisis /","Rakshit, Mihir.",2002,FALSE
"761","ALDERMAN","HG 001270.5 .V65  2010","X030782016","Prospects for monetary cooperation and integration in East Asia /","Volz, Ulrich,",2010,FALSE
"762","ALDERMAN","HG 001272 .B79  2010","X030816797","The gold standard at the turn of the twentieth century : rising powers, global money, and the age of Empire /","Bryan, Steven.",2010,FALSE
"763","ALDERMAN","HG 001273 .Y37  2016","X031803719","Nihon kinsei kaheishi no kenky? /","Yasukuni, Ry?ichi",2016,FALSE
"764","ALDERMAN","HG 001274 .K63  2015","X031595168","Meiji ishinki no kahei keizai /","Kobayashi, Noburu,",2015,FALSE
"765","ALDERMAN","HG 001274 .S55  2009","X030596184","Sekai ky?k? to keizai seisaku : ""kaih? sh?koku"" Nihon no keiken to gendai /","Shizume, Masato,",2009,FALSE
"766","ALDERMAN","HG 001275 .C37  1997","X004139494","The political economy of Japanese monetary policy /","Cargill, Thomas F.",1997,FALSE
"767","ALDERMAN","HG 001275 .H385  2002","X031622756","Defure no shink? o d? yomu ka : miotosareta rijun asshuku mekanizumu /","Hashimoto, Jur?,",2002,FALSE
"768","ALDERMAN","HG 001275 .J385  2000","X004421317","Japan's financial crisis and its parallels to U.S. experience /","",2000,FALSE
"769","ALDERMAN","HG 001275 .R59  2002","X004657915","Informality and monetary policy in Japan : the political economy of bank performance /","Rixtel, Adrian A. R. J. M. van.",2002,FALSE
"770","ALDERMAN","HG 001280.5 .C473  2013","X031632877","Chos?n hugi hwap'ye yut'ong kwa ky?ngje saenghwal = The coin currency and changes in economic life in late Joseon period /","Ch?ng, Su-hwan.",2013,FALSE
"771","ALDERMAN","HG 001280.5 .K88  2011","X031609135","Chos?n sidae hwap'ye yut'ong kwa sahoe ky?ngje /","Kw?n, In-hy?k.",2011,FALSE
"772","ALDERMAN","HG 001282 .H76  2014","X031625504","Chinese money in global context : historic junctures between 600 BCE and 2012 /","Horesh, Niv",2014,FALSE
"773","ALDERMAN","HG 001282 .V64  2013","X031607559","Marco Polo was in China : new evidence from currencies, salts and revenues /","Vogel, Hans Ulrich.",2013,FALSE
"774","ALDERMAN","HG 001282 .Z45  2013","X031635903","Zhongguo huo bi shi yan jiu er zhong /","Zhang, Zongyuan",2013,FALSE
"775","ALDERMAN","HG 001283 .C47  1996","X031755528","Chu guo de huo bi /","Zhao, Dexin,",1996,FALSE
"776","ALDERMAN","HG 001283 .I573  2008","X030558462","Metals, monies, and markets in early modern societies : East Asian and global perspectives /","International Workshop ""Monies, Markets and Finance in China and East Asia""",2008,FALSE
"777","ALDERMAN","HG 001283 .W36  V.000002","X031973899","Zhongguo gu dai huo bi tong kao /","Wang, Xiantang,",1979,TRUE
"778","ALDERMAN","HG 001285 .G74  2014","X031653205","The Great Wall of money : power and politics in China's international monetary relations /","",2014,FALSE
"779","ALDERMAN","HG 001285 .H83  1996","X004038708","Inflation and investment controls in China : the political economy of central-local relations during the reform era /","Huang, Yasheng.",1996,FALSE
"780","ALDERMAN","HG 001285 .S55  2004","X004824883","Jinmingen to Ch?goku keizai /","Shirai, Sayuri.",2004,FALSE
"781","ALDERMAN","HG 001285 .S567  2008","X030250245","Factions and finance in China : elite conflict and inflation /","Shih, Victor C.",2008,FALSE
"782","ALDERMAN","HG 001290 .N67  S52  2010","X031195863","Si chou zhi lu huo bi yan jiu /","",2010,FALSE
"783","ALDERMAN","HG 001290 .S62  D66  1999","X030007766","Xinjiang jin er bai nian de huo bi yu jin rong /","Dong, Qingxuan.",1999,TRUE
"784","ALDERMAN","HG 001333 .B35  1993","X002673421","Inflation et mal-developpement en Algérie /","Bali, Hamid.",1993,FALSE
"785","ALDERMAN","HG 001336 .B34  1985","X001067388","Currency and inflation in fourth century Egypt /","Bagnall, Roger S.",1985,FALSE
"786","ALDERMAN","HG 001336 .M84  2016","X032214507","Ma?la?at al-?arbkh?nah al-Mi?r?yah bi-al-Q?hirah : dir?sah arsh?f?yah dibl?m?t?yah t?r?kh?yah, min 1844 ilá 1913 M /","Mu?ammad, Sa?ar Mu?ammad Ibr?h?m,",2016,FALSE
"787","ALDERMAN","HG 001336 .R43  2007","X030278629","Money in Ptolemaic Egypt : from the Macedonian Conquest to the end of the third century BC /","Reden, Sitta von.",2007,FALSE
"788","ALDERMAN","HG 001370 .G89  2004","X004824935","Marginal gains : monetary transactions in Atlantic Africa /","Guyer, Jane I.",2004,FALSE
"789","ALDERMAN","HG 001370 .M66  1995","X002677384","Money matters : instability, values, and social payments in the modern history of West African communities /","",1995,FALSE
"790","ALDERMAN","HG 001464 .D45  2001","X004588001","Straining at the anchor : the Argentine Currency Board and the search for macroeconomic stability, 1880-1935 /","Della Paolera, Gerardo,",2001,FALSE
"791","ALDERMAN","HG 001480.5 .T94  2010","X030745131","Twenty years of inflation targeting : lessons learned and future prospects /","",2010,FALSE
"792","ALDERMAN","HG 001480.9 .M66  1999","X004296201","Money and modernity : state and local currencies in Melanesia /","",1999,FALSE
"793","ALDERMAN","HG 001496 .D43  2013","X031576900","Dealing with the challenges of macro financial linkages in emerging markets /","",2013,FALSE
"794","ALDERMAN","HG 001503 .W66  V.000055TH 001965","X031972744","World banking survey.","",1965,TRUE
"795","ALDERMAN","HG 001511 .P59  2018","X032560769","Central banks, democratic states and financial power /","Pixley, Jocelyn,",2018,FALSE
"796","ALDERMAN","HG 001551 .B296  1997","X004114745","Banking, trade, and industry : Europe, America, and Asia from the thirteenth to the twentieth centuries /","",1997,FALSE
"797","ALDERMAN","HG 001551 .D57  2008","X030264580","Building on borrowed bricks : Italian banks and interational finance during the inter-war period /","Di Quirico, Roberto.",2008,FALSE
"798","ALDERMAN","HG 001551 .G67  2015","X031706263","Maze of banking : history, theory, crisis /","Gorton, Gary B.",2015,FALSE
"799","ALDERMAN","HG 001551 .G76  2010","X030782240","Unsettled account : the evolution of banking in the industrialized world since 1800 /","Grossman, Richard S.",2010,FALSE
"800","CLEMONS","HG 001552 .A1  F46  1998  V.000001","X004268064","The house of Rothschild /","Ferguson, Niall.",1998,TRUE
"801","ALDERMAN","HG 001552 .A1  L42  1994","X002588373","MM. Le Couteulx et Cie, banquiers à Paris Un clan familial dans la crise du XVIIIe siècle.","Daridan, Geneviève.",1994,TRUE
"802","ALDERMAN","HG 001552 .A1  L68  1995","X002626663","The French Rothschilds : the great banking dynasty through two turbulent centuries /","Lottman, Herbert R.",1995,TRUE
"803","ALDERMAN","HG 001552 .A1  Z94  2001","X004550273","Capitalisme et catholicisme dans la France moderne : la dynastie Le Couteulx /","Zylberberg, Michel.",2001,FALSE
"804","ALDERMAN","HG 001552 .A32  G25  2006","X030007452","Der Bankier Hermann Josef Abs : eine Biographie /","Gall, Lothar.",2006,TRUE
"805","ALDERMAN","HG 001552 .C45  Y36  1984","X031951530","Chen Guangfu di yi sheng /","Yao, Songling,",1984,FALSE
"806","ALDERMAN","HG 001552 .C5  A3  2001","X004748932","The correspondence of Agostino Chigi (1466-1520) in Cod. Chigi R.V.c : an annotated edition /","Chigi, Agostino,",2001,FALSE
"807","CLEMONS","HG 001552 .E64  D49  2010","X030770398","The hare with amber eyes : a family's century of art and loss /","De Waal, Edmund.",2010,TRUE
"808","ALDERMAN","HG 001552 .E84  A35  2007","X030924447","Trabajo, fortuna y poder : Manuel Espinosa Yglesias : un empresario mexicano del siglo XX /","Águila M., Marcos Tonatiuh.",2007,FALSE
"809","ALDERMAN","HG 001552 .E84  C3713  2007","X030924452","Manuel Espinosa Yglesias : an essay on his intellectual life history /","Cárdenas, Enrique.",2007,TRUE
"810","ALDERMAN","HG 001552 .G54  R44  2015","X031658931","No regrets /","Ghosh, Dhruba Narayan,",2015,TRUE
"811","ALDERMAN","HG 001552 .K43  A3  2015","X031798699","Sawdust castles : a memoir /","Khan, Omar,",2015,FALSE
"812","ALDERMAN","HG 001552 .L35  B37  2015","X032403710","Sir Lallubhai Samaldas : a portrait /","Basu, Aparna,",2015,FALSE
"813","ALDERMAN","HG 001552 .L447  A37  1996","X002719642","Rogue trader : how I brought down Barings Bank and shook the financial world /","Leeson, Nick,",1996,FALSE
"814","ALDERMAN","HG 001552 .M37  A3  1989","X001861340","Ricordanze dal 1433 al 1483 /","Martelli, Ugolino di Niccolò,",1989,FALSE
"815","ALDERMAN","HG 001552 .R6  F47  1998","X004262605","The world's banker : the history of the house of Rothschild /","Ferguson, Niall.",1998,TRUE
"816","ALDERMAN","HG 001552 .R8  D38  1983","X000666697","The English Rothschilds /","Davis, Richard W.",1983,TRUE
"817","ALDERMAN","HG 001552 .R8  D38  1983B","X000628798","The English Rothschilds /","Davis, Richard W.",1983,TRUE
"818","ALDERMAN","HG 001552 .R8  R67  2003","X004659288","Elusive Rothschild : the life of Victor, third baron /","Rose, Kenneth,",2003,TRUE
"819","ALDERMAN","HG 001552 .R8  W56  1988B","X001461106","Rothschild : a story of wealth and power /","Wilson, Derek,",1988,FALSE
"820","ALDERMAN","HG 001552 .R82  E46  1996","X004005930","Founder : a portrait of the first Rothschild and his time /","Elon, Amos.",1996,FALSE
"821","ALDERMAN","HG 001552 .R83  K37  2006","X004901575","Nathan Mayer Rothschild and the creation of a dynasty : the critical years 1806-1816 /","Kaplan, Herbert H.",2006,FALSE
"822","ALDERMAN","HG 001552 .S33  K66  2010","X030880313","Hjalmar Schacht : Aufstieg und Fall von Hitlers mächtigstem Bankier /","Kopper, Christopher.",2010,FALSE
"823","ALDERMAN","HG 001552 .S83  A3  2016","X031847072","Who moved my interest rate? : leading the Reserve Bank of India through five turbulent years /","Subbarao, Duvvuri,",2016,FALSE
"824","ALDERMAN","HG 001552 .T32  C47  2014","X031787368","A chronology of men, matters, and events /","Taneja, Dharam Vir,",2014,TRUE
"825","ALDERMAN","HG 001552 .T43  A3  2016","X031841652","The banker's life /","Thaura, B?. Aisa.,",2016,FALSE
"826","ALDERMAN","HG 001552 .W369  H64  2009","X031194851","Max M. Warburg /","Hoffmann, Gabriele.",2009,FALSE
"827","CLEMONS","HG 001552 .W37  F47  2010","X030691075","High financier : the lives and time of Siegmund Warburg /","Ferguson, Niall.",2010,TRUE
"828","ALDERMAN","HG 001555 .P485  2002","X004672106","Profili giuridici delle attività e dell'organizzazione delle banche romane /","Petrucci, Aldo,",2002,FALSE
"829","ALDERMAN","HG 001555 .P577  2008","X030408936","Pistoi dia tèn technèn : bankers, loans, and archives in the ancient world : studies in honour of Raymond Bogaert /","",2008,FALSE
"830","ALDERMAN","HG 001561 .C35  2014","X031635733","Fragile by design : the political origins of banking crises and scarce credit /","Calomiris, Charles W.",2014,FALSE
"831","ALDERMAN","HG 001561 .D38","X000001534","The Dawn of modern banking /","",1979,FALSE
"832","ALDERMAN","HG 001572 .R65  1991","X001962596","The Role of banks in the interwar economy /","",1991,FALSE
"833","ALDERMAN","HG 001573 .C44  2010","X030733048","The future of finance : a new model for banking and investment /","Choudhry, Moorad.",2010,FALSE
"834","ALDERMAN","HG 001573 .D49  2010","X030620757","Balancing the banks : global lessons from the financial crisis /","Dewatripont, M. (Mathias)",2010,FALSE
"835","ALDERMAN","HG 001573 .D84  2011","X030732670","How big banks fail and what to do about it /","Duffie, Darrell.",2011,FALSE
"836","ALDERMAN","HG 001573 .H55  2015","X031733932","Better bankers, better banks : promoting good business through contractual commitment /","Hill, Claire A.,",2015,FALSE
"837","ALDERMAN","HG 001573 .R48  2012","X031214394","The problem with banks /","Rethel, Lena.",2012,FALSE
"838","ALDERMAN","HG 001601 .C47  2016","X031768053","The Fintech book /","Chishti, Susanne,",2016,FALSE
"839","ALDERMAN","HG 001601 .C65  2015","X031651067","The lunacy of modern finance theory and regulation /","Coleman, Les,",2015,FALSE
"840","ALDERMAN","HG 001601 .G63  2016","X031818811","Banking : a very short introduction /","Goddard, John A.,",2016,FALSE
"841","ALDERMAN","HG 001601 .N495  2010","X030732892","New issues in financial and credit markets /","",2010,FALSE
"842","ALDERMAN","HG 001601 .P65  2013","X031602914","Conservatives versus wildcats : a sociology of financial conflict /","Polillo, Simone,",2013,FALSE
"843","ALDERMAN","HG 001601 .T358  2018","X031823889","The growth of shadow banking : a comparative institutional analysis /","Thiemann, Matthias",2018,FALSE
"844","ALDERMAN","HG 001601 .W42  2016","X031794572","Sustainable banking : managing the social and environmental impact of financial institutions /","Weber, Olaf,",2016,FALSE
"845","ALDERMAN","HG 001615 .C66  2016","X031757608","Contemporary issues in bank financial management /","",2016,FALSE
"846","ALDERMAN","HG 001615 .J355  2009","X030621316","British and German banking strategies /","Janssen, Sven.",2009,FALSE
"847","ALDERMAN","HG 001615 .K625  2003","X030595795","Bank management /","Koch, Timothy W.",2003,FALSE
"848","ALDERMAN","HG 001615 .P78  2001","X004526658","Prudential supervision : what works and what doesn't /","",2001,FALSE
"849","ALDERMAN","HG 001615 .S768  2010","X030774336","Learning by example : imitation and innovation at a global bank /","Strang, David.",2010,FALSE
"850","ALDERMAN","HG 001616 .B7  C37  1980","X000400810","Branch, group, and chain banking /","Cartinhour, Gaines Thomson.",1980,TRUE
"851","ALDERMAN","HG 001616 .C34  C55  2017","X031818984","The right balance for banks : theory and evidence on optimal capital requirements /","Cline, William R.,",2017,TRUE
"852","ALDERMAN","HG 001616 .C34  G587  2004","X004938302","The New Basel Capital Accord /","Gup, Benton E.",2004,TRUE
"853","ALDERMAN","HG 001616 .C34  R57","X000324146","Risk and capital adequacy in commercial banks /","",1981,TRUE
"854","ALDERMAN","HG 001616 .C7  R67  2009","X030619668","Curbing bailouts : bank crises and democratic accountability in comparative perspective /","Rosas, Guillermo,",2009,TRUE
"855","ALDERMAN","HG 001616 .I5  B43","X000291369","Optimization of bank portfolios /","Beazer, William F.",1975,FALSE
"856","CLEMONS","HG 001616 .I5  E33  1988","X001454521","Doing deals : investment banks at work /","Eccles, Robert G.",1988,FALSE
"857","ALDERMAN","HG 001621 .H6  1991","X001978157","A history of interest rates /","Homer, Sidney,",1991,FALSE
"858","ALDERMAN","HG 001621 .H6  1996","X004068769","A history of interest rates /","Homer, Sidney,",1996,FALSE
"859","ALDERMAN","HG 001623 .G7  C63  2016","X031740890","Raving at usurers : anti-finance and the ethics of uncertainty in England, 1690-1750 /","Codr, Dwight,",2016,TRUE
"860","ALDERMAN","HG 001642 .I5  P87  2009","X030923901","Institutional credit for rural livelihoods : a study of SGSY in the regions of high poverty /","Purushotham, P.",2009,FALSE
"861","ALDERMAN","HG 001642 .S65  S44  1989","X001455985","The coming Soviet crash : Gorbachev's desperate pursuit of credit in Western financial markets /","Shelton, Judy.",1989,FALSE
"862","ALDERMAN","HG 001642 .U5  F76  1992","X002184583","From redlining to reinvestment : community responses to urban disinvestment /","",1992,TRUE
"863","ALDERMAN","HG 001656 .A3  N47  2010","X030782134","Financial alchemy in crisis : the great liquidity illusion /","Nesvetailova, Anastasia.",2010,FALSE
"864","ALDERMAN","HG 001656 .A78  O345  2005","X004906127","Official reserves and currency management in Asia : myth, reality and the future /","",2005,FALSE
"865","ALDERMAN","HG 001660 .U5  C7  1964","X031923832","Time deposits in present-day commercial banking","Crum, Lawrence L.",1964,TRUE
"866","ALDERMAN","HG 001709 .P35  2015","X031729559","Smart money : how high-stakes financial innovation is reshaping our world-for the better /","Palmer, Andrew,",2015,FALSE
"867","ALDERMAN","HG 001710 .D534  2017","X031841057","Digital revolutions in public finance /","",2017,FALSE
"868","ALDERMAN","HG 001710 .G473  2017","X031822309","Attack of the 50 foot blockchain : bitcoin, blockchain, etherium and smart contracts /","Gerard, David",2017,FALSE
"869","ALDERMAN","HG 001710 .H34  2011","X030745525","Handbook of financial cryptography and security /","",2011,FALSE
"870","ALDERMAN","HG 001710 .R56  2017","X031801484","Bringing E-money to the poor : successes and failures /","Riley, Thyra A.,",2017,FALSE
