"","Item.Library.Code","Item.Shelving.Id","Item.Barcode","Catalog.Title","Catalog.Author","Catalog.Pub.Year","MultiVolume"
"1200","ALDERMAN","HG 003314 .H87  1998","X004214220","Booty capitalism : the politics of banking in the Philippines /","Hutchcroft, Paul D. (Paul David)",1998,FALSE
"1201","ALDERMAN","HG 003320.5 .A6  P37  2003","X004751627","Finance and economic development in East Asia /","Pak, Y?ng-ch??l,",2003,FALSE
"1202","ALDERMAN","HG 003324 .K68  1984  V.000002","X031974333","K?za Nihon no kin?y? kik? /","",1984,TRUE
"1203","ALDERMAN","HG 003324 .T378  1991","X002035750","Banking and finance in Japan : an introduction to the Tokyo market /","Tatewaki, Kazuo,",1991,FALSE
"1204","ALDERMAN","HG 003324 .Z85  1994","X002693373","Zukai Nihon no kin?y? gy?sei, kanch?, kin?y? kikan /","",1994,FALSE
"1205","ALDERMAN","HG 003326 .N53  V.000002 001982","X031961910","Nihon Gink? hyakunenshi /","",1982,TRUE
"1206","ALDERMAN","HG 003326 .W476  2003","X004703518","Princes of the yen : Japan's central bankers and the transformation of the economy /","Werner, Richard,",2003,FALSE
"1207","ALDERMAN","HG 003330.5 .A6  K59  2012","X031632857","K?ndae Tong Asia wa Han'guk chabonju?i : kongsaeng kwa tokch?m, ijung chihyang ?i chabon ch'ukch?k /","Kim, Yun-h?i,",2012,FALSE
"1208","ALDERMAN","HG 003334 .B94  1983","X000600239","China's financial system : the changing role of banks /","Byrd, William A. (William Anderson)",1983,FALSE
"1209","ALDERMAN","HG 003334 .C68  2011","X031196319","Banking in China /","Cousin, Violaine,",2011,FALSE
"1210","ALDERMAN","HG 003334 .S46  1980","X031941335","Chan shih chung-kuo ti yin hang yeh","Shou, Chin-wen",1980,FALSE
"1211","ALDERMAN","HG 003336 .B45  2013","X030610513","The rise of the People's Bank of China : the politics of institutional change /","Bell, Stephen,",2013,FALSE
"1212","ALDERMAN","HG 003336 .G86  2002","X004658744","Banking reforms and monetary policy in the People's Republic of China : is the Chinese central banking system ready for joining the WTO? /","Guo, Yong,",2002,FALSE
"1213","ALDERMAN","HG 003336 .H64  1992","X002191788","The role of central banking in China's economic reforms /","Holz, Carsten.",1992,FALSE
"1214","ALDERMAN","HG 003338 .C49  C45  1991  V.000001","X032400740","Zhongguo yin hang hang shi zi liao hui bian /","",1991,TRUE
"1215","ALDERMAN","HG 003339 .B45  B45  1988","X030089342","Beijing Shi jin rong tong ji zi liao (1949-1987) /","",1988,FALSE
"1216","ALDERMAN","HG 003339 .S5  S55  2014","X031716073","Piao shang yu jin dai Zhongguo /","Shi, Ruomin,",2014,FALSE
"1217","ALDERMAN","HG 003352 .G66  2007","X032401628","Profits, politics and panics : Hong Kong's banks and the making of a miracle economy, 1935-1985 /","Goodstadt, Leo F.",2007,FALSE
"1218","ALDERMAN","HG 003361 .N42  H34","X031857450","Central banking in Nepal. Writer: Lakshman Bahadur Hamal.","Hamal, Lakshman B.",1972,FALSE
"1219","ALDERMAN","HG 003368 .A5  I58  1990","X002312306","Dal?l al-bun?k wa-al-mu?assas?t al-m?l?yah al-Isl?m?yah al-a???? bi-al-itti??d /","International Association of Islamic Banks.",1990,FALSE
"1220","ALDERMAN","HG 003368 .A6  A443  1996","X004044892","Islamic banking : theory, practice, and challenges /","Al-Omar, Fuad,",1996,FALSE
"1221","ALDERMAN","HG 003368 .A6  A55  1986","X001145595","Islamic banking and finance : the experience of Iran /","Amin, S. H. (Sayed Hassan)",1986,FALSE
"1222","ALDERMAN","HG 003368 .A6  A57  1983","X030158534","Dawr al-bun?k al-Isl?m?yah f? al-tanmiyah al-ijtim???yah /","An??r?, Ma?m?d Nu?m?n.",1983,FALSE
"1223","ALDERMAN","HG 003368 .A6  B25  1993","X002606270","Banking and finance, Islamic concept /","",1993,FALSE
"1224","ALDERMAN","HG 003368 .A6  D35  1989","X002549387","Dal?l al-fat?wá al-shar??yah f? al-a?m?l al-ma?rif?yah : ahamm m? ?adara min fat?wá ?an al-rib? wa-al-faw??id wa-al-mu??rab?t wa-al-mush?rak?t wa-al-mur?ba??t /","",1989,TRUE
"1225","ALDERMAN","HG 003368 .A6  D48  2014","X031665347","The developing role of Islamic banking and finance : from local to global perspectives /","",2014,TRUE
"1226","ALDERMAN","HG 003368 .A6  E4  1987","X001187760","The Islamic business enterprise /","El-Ashker, Ahmed Abdel-Fattah,",1987,FALSE
"1227","ALDERMAN","HG 003368 .A6  H37  1985","X030265522","al-A?m?l al-ma?rif?yah wa-al-Isl?m /","Hamshar?, Mu??afá ?Abd All?h.",1985,FALSE
"1228","ALDERMAN","HG 003368 .A6  I58  1987","X002180339","Compendium on the proceedings of the first International Seminar on Islamic Banking, held at Bangalore, on 22-23 August 1987.","International Seminar on Islamic Banking",1987,FALSE
"1229","ALDERMAN","HG 003368 .A6  I853  1990","X002441447","Islamic banking and insurance : proceedings and papers of international seminar held in Dhaka, Bangladesh on October 27, 1989 /","",1990,FALSE
"1230","ALDERMAN","HG 003368 .A6  K42  1987","X002238219","Profit and loss sharing : an Islamic experiment in finance and banking /","Khan, Shahrukh Rafi.",1987,FALSE
"1231","ALDERMAN","HG 003368 .A6  L66  2016","X031791362","Islamic banks and financial institutions : a study of their objectives and achievements /","Lone, Fayaz,",2016,TRUE
"1232","ALDERMAN","HG 003368 .A6  M378  2005","X004995329","Mutual life, limited : Islamic banking, alternative currencies, lateral reason /","Maurer, Bill,",2005,FALSE
"1233","ALDERMAN","HG 003368 .A6  N93  1995","X030209434","The concept of Rib? and Islamic banking /","Nyazee, Imran Ahsan Khan.",1995,FALSE
"1234","ALDERMAN","HG 003368 .A6  O23  2004","X030039116","Islamic financial markets : towards greater ethics & efficiency /","Obaidullah, Mohammed.",2004,FALSE
"1235","ALDERMAN","HG 003368 .A6  R43  1987A","X004550218","Readings in Islamic banking /","",1987,TRUE
"1236","ALDERMAN","HG 003368 .A6  W37  2000","X004412614","Islamic finance in the global economy /","Warde, Ibrahim.",2000,FALSE
"1237","ALDERMAN","HG 003374 .I5  1987","X001669347","The IMF, World Bank and Africa : report of a Conference on ""The impact of the IMF and World Bank policies on the People of Africa"", held at City University, London, on 7th-11th September, 1987.","",1987,FALSE
"1238","ALDERMAN","HG 003381 .A6  H46  1996","X002758482","The Mediterranean debt crescent : money and power in Algeria, Egypt, Morocco, Tunisia, and Turkey /","Henry, Clement M.,",1996,FALSE
"1239","ALDERMAN","HG 003384 .L3  1958","X000298409","Bankers and pashas; international finance and economic imperialism in Egypt.","Landes, David S.",1958,FALSE
"1240","ALDERMAN","HG 003386 .A8  B365  1983","X000504482","Challenging colonialism : Bank Mi?r and Egyptian industrialization, 1920-1941 /","Davis, Eric,",1983,FALSE
"1241","ALDERMAN","HG 003550 .F79  1996","X004054120","Central banking in developing countries : objectives, activities and independence /","Fry, Maxwell J.",1996,FALSE
"1242","ALDERMAN","HG 003550 .M39  1997","X004094273","Gatekeepers of growth : the international political economy of central banking in developing countries /","Maxfield, Sylvia.",1997,FALSE
"1243","ALDERMAN","HG 003550 .M87  1981  V.000001","X031923790","Mu?tamar Dawr al-Bun?k f? al-Tanmiyah f? Mi?r : ta?ta ri??yat Ra??s al-Jumh?r?yah, al-Q?hirah 15-18 M?rs 1981, al-Man??rah 22 M?rs 1981.","Mu?tamar Dawr al-Bun?k f? al-Tanmiyah f? Mi?r",1981,TRUE
"1244","ALDERMAN","HG 003550 .T72  2013","X030852330","Transforming central finance agencies in poor countries : a political economy approach.","",2013,FALSE
"1245","ALDERMAN","HG 003550 .T74  2008","X030472841","Building credible central banks : policy lessons for emerging economies /","Tshiani, Noël K.",2008,FALSE
"1246","ALDERMAN","HG 003701 .F55  2010","X030818967","Credit scoring, response modelling and insurance rating : a practical guide to forecasting consumer behaviour /","Finlay, Steven,",2010,FALSE
"1247","ALDERMAN","HG 003701 .G73  2011","X030824087","Debt : the first 5,000 years /","Graeber, David.",2011,FALSE
"1248","ALDERMAN","HG 003701 .K88  2013","X030612413","Debtors' prison : the politics of austerity versus possibility /","Kuttner, Robert.",2013,FALSE
"1249","ALDERMAN","HG 003701 .L48  2012","X030974675","The making of a market : credit, henequen, and notaries in Yucatán, 1850-1900 /","Levy, Juliette,",2012,FALSE
"1250","ALDERMAN","HG 003701 .M177  2001","X004554874","A history of credit & power in the western world /","MacDonald, Scott B.",2001,FALSE
"1251","ALDERMAN","HG 003701 .M48  1991","X002036365","Lending and borrowing in ancient Athens /","Millett, Paul.",1991,FALSE
"1252","ALDERMAN","HG 003701 .S5896  2016","X031791930","Legal plunder : households and debt collection in late Medieval Europe /","Smail, Daniel Lord,",2016,FALSE
"1253","ALDERMAN","HG 003701 .S595  2014","X031651379","Debtfare states and the poverty industry : money, discipline and the surplus population /","Soederberg, Susanne,",2014,FALSE
"1254","ALDERMAN","HG 003701 .S75  2002","X004470990","The rhetoric of credit : merchants in early modern writing /","Sullivan, Ceri,",2002,FALSE
"1255","ALDERMAN","HG 003701 .V348  2014","X031651266","The next economic disaster : why it's coming and how to avoid it /","Vague, Richard.",2014,FALSE
"1256","ALDERMAN","HG 003701 .W36  2014","X031720232","Song dai jie dai ye yan jiu /","Wang, Wenshu,",2014,FALSE
"1257","ALDERMAN","HG 003711 .G7  M85  1998","X004153207","The Economy of obligation : the culture of credit and social relations in early modern England /","Muldrew, Craig,",1998,FALSE
"1258","ALDERMAN","HG 003711 .U6  F55  2018","X031825273","City of debtors : a century of fringe finance /","Fleming, Anne,",2018,TRUE
"1259","ALDERMAN","HG 003729 .I42  R874  2010","X030926013","Rural financial sector : alternate models /","",2010,TRUE
"1260","ALDERMAN","HG 003729 .L28  T67  2017","X031801429","Innovative experiences in access to finance in Latin America : market-friendly roles for the visible hand? /","Torre, Augusto de la,",2017,TRUE
"1261","ALDERMAN","HG 003729 .U4  O4","X000474804","Herbert Hoover and the Reconstruction Finance Corporation, 1931-1933 /","Olson, James Stuart,",1977,FALSE
"1262","ALDERMAN","HG 003729 .U5  E45  2011","X030947660","Uncle Sam in pinstripes : evaluating U.S. federal credit programs /","Elliott, Douglas J.,",2011,FALSE
"1263","ALDERMAN","HG 003729 .U5  F57  2013","X031619400","Well worth saving : how the New Deal safeguarded home ownership /","Fishback, Price Van Meter.",2013,TRUE
"1264","ALDERMAN","HG 003729 .U5  O47  1988","X001314124","Saving capitalism : the Reconstruction Finance Corporation and the New Deal, 1933-1940 /","Olson, James Stuart,",1988,FALSE
"1265","ALDERMAN","HG 003729 .U5  Y4","X031961828","Proposals for government credit allocation /","Yeager, Leland B.",1977,FALSE
"1266","ALDERMAN","HG 003751.5 .D4  2010","X030744083","Developing, validating, and using internal ratings : methodologies and case studies /","De Laurentis, Giacomo.",2010,FALSE
"1267","ALDERMAN","HG 003751.7 .R68  1992","X002164087","Privacy for sale : how computerization has made everyone's private life an open secret /","Rothfeder, Jeffrey.",1992,FALSE
"1268","ALDERMAN","HG 003752.7 .U6  W55  1998","X004210598","Games creditors play : collecting from overextended consumers /","Williams, Winton E.",1998,FALSE
"1269","ALDERMAN","HG 003754.5 .F8  H64  2000","X004420322","Priceless markets : the political economy of credit in Paris, 1660-1870 /","Hoffman, Philip T.,",2000,FALSE
"1270","ALDERMAN","HG 003754.5 .G7  W46  2011","X031187672","Casualties of credit : the English financial revolution, 1620-1720 /","Wennerlind, Carl.",2011,FALSE
"1271","ALDERMAN","HG 003754.5 .U6  O443  2016","X031735203","The engine of enterprise : credit in America /","Olegario, Rowena.",2016,FALSE
"1272","ALDERMAN","HG 003755 .F54  2010","X030781906","The management of consumer credit : theory and practice /","Finlay, Steven,",2010,FALSE
"1273","ALDERMAN","HG 003755 .M27","X000236494","Credit card use in the United States.","Mandell, Lewis.",1972,FALSE
"1274","ALDERMAN","HG 003755 .M5  1970","X000240283","Consumer finance: a case history in American business,","Michelman, Irving S.",1970,FALSE
"1275","ALDERMAN","HG 003755 .P46  2018","X031813879","Pricing credit products /","Phillips, Robert L. (Robert Lewis),",2018,FALSE
"1276","ALDERMAN","HG 003755.7 .R66  2014","X031626827","Plastic money : constructing markets for credit cards in eight postcommunist countries /","Rona-Tas, Akos,",2014,FALSE
"1277","ALDERMAN","HG 003755.8 .U6  E87  2010","X030816680","American plastic : boob jobs, credit cards, and our quest for perfection /","Essig, Laurie.",2010,FALSE
"1278","ALDERMAN","HG 003755.8 .U6  E94  1999","X004339002","Paying with plastic : the digital revolution in buying and borrowing /","Evans, David S.",1999,FALSE
"1279","CLEMONS","HG 003755.8 .U6  M36  2000","X004532915","Credit card nation : the consequences of America's addiction to credit /","Manning, Robert D.,",2000,FALSE
"1280","ALDERMAN","HG 003756 .F8  E44  2014","X031634327","Le crédit à la consommation en France, 1947-1965 : de la stigmatisation à la réglementation /","Effosse, Sabine.",2014,FALSE
"1281","ALDERMAN","HG 003756 .G7  A94  2018","X032582147","The politics of consumer credit in the UK, 1938-1992 /","Aveyard, S. C.,",2018,FALSE
"1282","ALDERMAN","HG 003756 .G7  B468  1992","X002115247","Credit and debt : the PSI report /","Berthoud, Richard.",1992,FALSE
"1283","ALDERMAN","HG 003756 .G7  F56  2009","X030620925","Consumer credit fundamentals /","Finlay, Steven,",2009,TRUE
"1284","ALDERMAN","HG 003756 .J3  I435  2011","X031623226","Nihon ch?sei saimushi no kenky? /","Ihara, Kesao,",2011,FALSE
"1285","ALDERMAN","HG 003756 .M628  D43  2002","X004558943","Debt and economic renewal in the ancient Near East /","",2002,TRUE
"1286","ALDERMAN","HG 003756 .S6  J36  2015","X031654262","Money from nothing : indebtedness and aspiration in South Africa /","James, Deborah,",2015,FALSE
"1287","ALDERMAN","HG 003756 .U54  C35  1999","X004276297","Financing the American dream : a cultural history of consumer credit /","Calder, Lendol Glen.",1999,TRUE
"1288","CLEMONS","HG 003756 .U54  C38","X000040456","Consumers in trouble; a study of debtors in default","Caplovitz, David.",1974,TRUE
"1289","ALDERMAN","HG 003756 .U54  D865  2014","X031652044","Consumer credit and the American economy /","Durkin, Thomas A.,",2014,TRUE
"1290","ALDERMAN","HG 003756 .U54  H96  2011","X031196042","Debtor nation : the history of America in red ink /","Hyman, Louis,",2011,FALSE
"1291","ALDERMAN","HG 003756 .U54  K55  1995","X002559725","Debt, investment, slaves : credit relations in East Feliciana Parish, Louisiana, 1825-1885 /","Kilbourne, Richard Holcombe.",1995,FALSE
"1292","ALDERMAN","HG 003756 .U54  K59  1999","X004345656","It's in the cards : consumer credit and the American experience /","Klein, Lloyd,",1999,FALSE
"1293","ALDERMAN","HG 003756 .U54  L83  2011","X030746057","Protecting main street : measuring the customer experience in financial services for business and public policy /","Lubin, Paul C.",2011,TRUE
"1294","ALDERMAN","HG 003756 .U54  M25  1990","X001925350","The credit card industry : a history /","Mandell, Lewis.",1990,FALSE
"1295","CLEMONS","HG 003756 .U54  R56  1995","X004068094","Expressing America : a critique of the global credit card society /","Ritzer, George.",1995,TRUE
"1296","ALDERMAN","HG 003756 .U54  S56  1995","X002653478","The credit card catastrophe : the 20th century phenomenon that changed the world /","Simmons, Matty.",1995,FALSE
"1297","ALDERMAN","HG 003756 .U54  T78  2014","X031650856","Consumer lending in France and America : credit and welfare /","Trumbull, Gunnar,",2014,TRUE
"1298","ALDERMAN","HG 003761 .F36  2002","X004588123","Famous fables of economics : myths of market failures /","",2002,FALSE
"1299","ALDERMAN","HG 003766 .B22  2001","X004527108","Navigating failure : bankruptcy and commercial society in Antebellum America /","Balleisen, Edward J.",2001,FALSE
"1300","ALDERMAN","HG 003766 .B76  2012","X031188062","Broke : how debt bankrupts the middle class /","",2012,FALSE
"1301","ALDERMAN","HG 003766 .M29  2002","X004662386","Republic of debtors : bankruptcy in the age of American independence /","Mann, Bruce H.",2002,FALSE
"1302","ALDERMAN","HG 003766 .S75","X000538742","Bankruptcy: problem, process, reform","Stanley, David T.",1971,FALSE
"1303","ALDERMAN","HG 003766 .S79  1999","X031195384","As we forgive our debtors : bankruptcy and consumer credit in America /","Sullivan, Teresa A.,",1999,FALSE
"1304","ALDERMAN","HG 003766 .S794  2000","X004394038","The fragile middle class : Americans in debt /","Sullivan, Teresa A.,",2000,FALSE
"1305","ALDERMAN","HG 003769 .B3  W46  1997","X006057887","Who needs credit? : poverty and finance in Bangladesh /","",1997,FALSE
"1306","ALDERMAN","HG 003769 .I55  M867  2017","X031831400","Bombay's people, 1860-98 : insolvents in the city /","Siddiqi, Asiya,",2017,FALSE
"1307","ALDERMAN","HG 003769 .P75  R63  2012","X031772672","Portugal na bancarrota : cinco séculos de história dívida soberana portuguesa /","Rodrigues, Jorge Nascimento.",2012,TRUE
"1308","ALDERMAN","HG 003811 .B3","X000046125","Banque et capitalisme commercial : la lettre de change au XVIIIe siècle /","",1976,FALSE
"1309","ALDERMAN","HG 003815 .L44  2003","X004702956","Ideology and the international economy : the decline and fall of Bretton Woods /","Leeson, Robert.",2003,FALSE
"1310","ALDERMAN","HG 003815 .W34  1991  BD.000001","X002120407","Währungen der Welt /","",1991,TRUE
"1311","ALDERMAN","HG 003821 .D69  1988","X001500315","Exchange rates and inflation /","Dornbusch, Rudiger.",1988,FALSE
"1312","ALDERMAN","HG 003821 .G738  2006","X004943894","Exchange rate in a behavioral finance framework /","Grauwe, Paul de.",2006,FALSE
"1313","ALDERMAN","HG 003821 .M25","X031961762","The implications of international economic integration for monetary, fiscal, and exchange-rate policy","McKinnon, Ronald I.",1966,FALSE
"1314","ALDERMAN","HG 003821 .S26  2002","X004844998","The economics of exchange rates /","Sarno, Lucio.",2002,FALSE
"1315","ALDERMAN","HG 003821 .W54  2007","X030104258","Reference rates and the international monetary system /","Williamson, John,",2007,FALSE
"1316","ALDERMAN","HG 003823 .B34  1989","X001609610","The foreign exchange market : theory and econometric evidence /","Baillie, Richard (Richard T.)",1989,FALSE
"1317","ALDERMAN","HG 003823 .E88  1994","X002557873","Estimating equilibrium exchange rates /","",1994,FALSE
"1318","ALDERMAN","HG 003823 .G735  1993","X002335343","Exchange rate theory : chaotic models of foreign exchange markets /","Grauwe, Paul de.",1993,FALSE
"1319","ALDERMAN","HG 003823 .H34  1998","X006048321","Nonlinear time series analysis with applications to foreign exchange rate volatility /","Hafner, Christian.",1998,FALSE
"1320","ALDERMAN","HG 003823 .L96  2001","X004592455","The microstructure approach to exchange rates /","Lyons, Richard K.",2001,FALSE
"1321","ALDERMAN","HG 003823 .M335  1999","X004345378","Exchange rate modelling /","MacDonald, Ronald,",1999,FALSE
"1322","ALDERMAN","HG 003823 .R667  1996","X004005269","Currency forecasting : a guide to fundamental and technical models of exchange rate determination /","Rosenberg, Michael Roy,",1996,FALSE
"1323","ALDERMAN","HG 003823 .S465  2000","X004415108","Exchange rate volatility, trade, and capital flows under alternative exchange rate regimes /","Sercu, Piet.",2000,FALSE
"1324","ALDERMAN","HG 003826 .M54","X031961761","Substitution effects, speculation, and exchange rate stability /","Minford, Patrick.",1978,FALSE
"1325","ALDERMAN","HG 003851 .C649  1997","X004096733","The collapse of exchange rate regimes : causes, consequences, and policy responses /","",1997,FALSE
"1326","ALDERMAN","HG 003851 .C66  2002","X004470961","Too sensational : on the choice of exchange rate regimes /","Corden, W. M. (Warner Max)",2002,FALSE
"1327","ALDERMAN","HG 003851 .E894  2005","X004919156","Exchange rate economics : where do we stand? /","",2005,FALSE
"1328","ALDERMAN","HG 003851 .F68  1993","X002153798","On exchange rates /","Frankel, Jeffrey A.",1993,FALSE
"1329","ALDERMAN","HG 003851 .G334  2011","X031189367","Flexible exchange rates for a stable world economy /","Gagnon, Joseph E.",2011,FALSE
"1330","ALDERMAN","HG 003851 .I526  2016","X031790835","International monetary cooperation : lessons from the Plaza Accord after thirty years /","",2016,FALSE
"1331","ALDERMAN","HG 003851 .I543  1994","X002536694","The International monetary system : proceedings of a conference organized by the Banca d'Italia /","",1994,FALSE
"1332","ALDERMAN","HG 003851 .I8  1995","X002690258","Exchange rate economics /","Isard, Peter.",1995,FALSE
"1333","ALDERMAN","HG 003851 .L83  2000","X004415045","Trading in the global currency markets /","Luca, Cornelius.",2000,FALSE
"1334","ALDERMAN","HG 003851 .M44  2013","X030847305","The unloved dollar standard : from Bretton Woods to the rise of China /","McKinnon, Ronald I.",2013,FALSE
"1335","ALDERMAN","HG 003851 .S27  2001","X006120664","The microstructure of the foreign-exchange market : a selective survey of the literature /","Sarno, Lucio.",2001,FALSE
"1336","ALDERMAN","HG 003852 .B495  2012","X030845632","Devaluing to prosperity : misaligned currencies and their growth consequence /","Bhalla, Surjit S.",2012,FALSE
"1337","ALDERMAN","HG 003852 .C34  1983","X000687400","Sterling in decline : the devaluations of 1931, 1949, and 1967 /","Cairncross, Alec,",1983,FALSE
"1338","ALDERMAN","HG 003873 .E18  C49  2003","X004640124","The need for intraregional exchange rate stability in emerging East Asian economies /","Cho, Jonghwa,",2003,TRUE
"1339","ALDERMAN","HG 003873 .J3  S54  2003","X004751628","Exchange rate uncertainty and free trade agreement between Japan and Korea /","Sin, Kwan-ho,",2003,FALSE
"1340","ALDERMAN","HG 003877 .D47  2001","X004523724","In defense of free capital markets : the case against a new international financial architecture /","DeRosa, David F.",2001,FALSE
"1341","ALDERMAN","HG 003877 .H35  2005","X030204310","Exchange rate crises in developing countries : the political role of the banking sector /","Hall, Michael G.",2005,FALSE
"1342","ALDERMAN","HG 003877 .S47  2006","X030199585","The politics of exchange rates in developing countries : political cycles and domestic institutions /","Setzer, Ralph.",2006,FALSE
"1343","ALDERMAN","HG 003877 .Y68  1996","X002745579","Exchange rate parity for trade and development : theory, tests, and case studies /","Yotopoulos, Pan A.",1996,FALSE
"1344","ALDERMAN","HG 003879 .T46  NO.251","X002609489","Sign- and volatility-switching ARCH models ; theory and applications to international stock markets /","Fornari, Fabio.",1995,TRUE
"1345","ALDERMAN","HG 003879 .T46  NO.361","X006116083","Why do banks merge? /","Focarelli, Dario.",1999,TRUE
"1346","ALDERMAN","HG 003879 .T46  NO.404","X006128460","The effects of bank consolidation and market entry on small business lending /","Bonaccorsi di Patti, Emilia.",2001,TRUE
"1347","ALDERMAN","HG 003879 .T46  NO.425","X006133088","Assessing the effects of monetary and fiscal policy /","Neri, Stefano.",2001,TRUE
"1348","ALDERMAN","HG 003879 .T46  NO.443","X004651604","Rational ignorance and the public choice of redistribution /","Larcinese, Valentino.",2002,TRUE
"1349","ALDERMAN","HG 003879 .T46  NO.444","X004651605","On the ""conquest"" of inflation /","Gerali, Andrea.",2002,TRUE
"1350","ALDERMAN","HG 003879 .T46  NO.445","X004651606","Is money informative? : evidence from a large model used for policy analysis /","Altissimo, Filippo.",2002,TRUE
"1351","ALDERMAN","HG 003879 .T46  NO.446","X004651610","Currency crises and uncertainty about fundamentals /","Prati, Alessandro,",2002,TRUE
"1352","ALDERMAN","HG 003879 .T46  NO.447","X004651609","The size of the equity premium /","Fornari, Fabio.",2002,TRUE
"1353","ALDERMAN","HG 003879 .T46  NO.448","X004651042","Are mergers beneficial to consumers? : Evidence from the market for bank deposits /","Focarelli, Dario.",2002,TRUE
"1354","ALDERMAN","HG 003879 .T46  NO.451","X004640073","Liquidity and announcement effects in the euro area /","Angelini, P. (Paolo),",2002,TRUE
"1355","ALDERMAN","HG 003879 .T46  NO.453","X004640071","Labor market pooling : evidence from Italian industrial districts /","De Blasio, Guido.",2002,TRUE
"1356","ALDERMAN","HG 003879 .T46  NO.455","X004640074","Heterogeneity in human capital and economic growth /","Zotteri, Stefania.",2002,TRUE
"1357","ALDERMAN","HG 003879 .T46  NO.456","X004714104","Real-time GDP forecasting in the euro area/","Baffigi, A. (Alberto)",2002,TRUE
"1358","ALDERMAN","HG 003879 .T46  NO.457","X004714105","Monetary policy rules for the euro area: what role for national information? /","",2002,TRUE
"1359","ALDERMAN","HG 003879 .T46  NO.458","X004714106","The economic consequences of euro area modelling shortcuts /","Monteforte, Libero.",2002,TRUE
"1360","ALDERMAN","HG 003879 .T46  NO.459","X004714107","Cross-country differences in self-employment rates: the role of institutions /","Torrini, Roberto.",2002,TRUE
"1361","ALDERMAN","HG 003879 .T46  NO.460","X004714108","Dealing with forward-looking expectations and policy rules in quantifying the channels of transmission of monetary policy /","Altissimo, Filippo.",2002,TRUE
"1362","ALDERMAN","HG 003879 .T46  NO.461","X004714109","Macroeconomics of international price discrimination /","Corsetti, Giancarlo.",2002,TRUE
"1363","ALDERMAN","HG 003879 .T46  NO.462","X004714110","Non-response behavior in the Bank of Italy's survey of household income and wealth /","D'Alessio, G. (Giovanni)",2002,TRUE
"1364","ALDERMAN","HG 003879 .T46  NO.463","X004714111","Metodologie di stima dell'economia sommersa : un'applicazione al caso italiano /","Zizza, Roberta.",2002,TRUE
"1365","ALDERMAN","HG 003879 .T46  NO.464","X004714112","Consolidation and efficiency in the financial sector: a review of the international evidence /","",2002,TRUE
"1366","ALDERMAN","HG 003879 .T46  NO.465","X004714113","Human capital, technical change and the welfare state /","Benabou, Roland.",2002,TRUE
