"","Item.Library.Code","Item.Shelving.Id","Item.Barcode","Catalog.Title","Catalog.Author","Catalog.Pub.Year","MultiVolume"
"178","ALDERMAN","HJ 002305 .E53  2005","X004913383","The encyclopedia of taxation & tax policy /","",2005,FALSE
"179","ALDERMAN","HJ 002305 .K28  2003","X004708402","Regressive taxation and the welfare state : path dependence and policy diffusion /","Kato, Junko,",2003,FALSE
"180","ALDERMAN","HJ 002305 .K57  2007","X004832756","The economic psychology of tax behaviour /","Kirchler, Erich.",2007,FALSE
"181","ALDERMAN","HJ 002305 .N49  2009","X030558534","The new fiscal sociology : taxation in comparative and historical perspective /","",2009,FALSE
"182","ALDERMAN","HJ 002305 .R59  2008","X030277887","The political economy of international tax governance /","Rixen, Thomas,",2008,FALSE
"183","ALDERMAN","HJ 002305 .S85  1993","X002310865","Taxation and democracy : Swedish, British, and American approaches to financing the modern state /","Steinmo, Sven.",1993,FALSE
"184","ALDERMAN","HJ 002307 .S2613  2011","X031187480","The economics of taxation /","Salanié, Bernard.",2011,FALSE
"185","ALDERMAN","HJ 002322 .A3  D64  2000","X004423183","Does Atlas shrug? : the economic consequences of taxing the rich /","",2000,TRUE
"186","ALDERMAN","HJ 002322 .A3  F85  1993","X002231326","Who bears the lifetime tax burden? /","Fullerton, Don.",1993,TRUE
"187","ALDERMAN","HJ 002322 .A3  M87  2002","X004558276","The myth of ownership : taxes and justice /","Murphy, Liam B.,",2002,FALSE
"188","ALDERMAN","HJ 002322 .A3  P46","X000155428","Who pays state and local taxes? /","Phares, Donald.",1980,FALSE
"189","ALDERMAN","HJ 002322 .A3  T313  2002","X004708065","Tax justice : the ongoing debate /","",2002,TRUE
"190","ALDERMAN","HJ 002323 .C2  F35  1993","X002153713","Fairness in taxation : exploring the principles /","",1993,TRUE
"191","ALDERMAN","HJ 002327 .U5  K3  1953","X000230735","The uneasy case for progressive taxation,","Kalven, Harry,",1953,FALSE
"192","ALDERMAN","HJ 002327 .U5  W46  2012","X030844587","Take back the center : progressive taxation for a new progressive agenda /","Wenz, Peter S.",2012,FALSE
"193","ALDERMAN","HJ 002331 .U6  J46  2018","X031840265","Incentives to pander /","Jensen, Nathan M. (Nathan Michael),",2018,FALSE
"194","ALDERMAN","HJ 002336 .M87  2017","X032561344","Dirty secrets : how tax havens destroy the economy /","Murphy, Richard,",2017,FALSE
"195","ALDERMAN","HJ 002337 .C2  D4513  2018","X032582216","Legalizing theft : a short guide to tax havens /","Deneault, Alain,",2018,TRUE
"196","ALDERMAN","HJ 002351.7 .B37  2018","X031813678","Democracies in peril : taxation and redistribution in globalizing economies /","Bastiaens, Ida,",2018,FALSE
"197","ALDERMAN","HJ 002351.7 .P76  2010","X030619743","The political economy of taxation : lessons from developing countries /","Profeta, Paola,",2010,FALSE
"198","ALDERMAN","HJ 002351.7 .T39  2008","X030278720","Taxation and state-building in developing countries : capacity and consent /","",2008,FALSE
"199","ALDERMAN","HJ 002351.7 .T393  2010","X030774052","Taxation in developing countries : six case studies and policy implications /","",2010,FALSE
"200","ALDERMAN","HJ 002361 .A53  2002","X004636963","Power to destroy : the political uses of the IRS from Kennedy to Nixon /","Andrew, John A.",2002,FALSE
"201","ALDERMAN","HJ 002361 .Y36  2004","X004744116","Confessions of a tax collector : one man's tour of duty inside the I.R.S. /","Yancey, Richard.",2004,FALSE
"202","ALDERMAN","HJ 002362 .B76  1996","X004004839","Federal taxation in America : a short history /","Brownlee, W. Elliot,",1996,FALSE
"203","ALDERMAN","HJ 002362 .B76  2004","X004769473","Federal taxation in America : a short history /","Brownlee, W. Elliot,",2004,FALSE
"204","ALDERMAN","HJ 002362 .H87  2014","X031626813","American tax resisters /","Huret, Romain",2014,FALSE
"205","ALDERMAN","HJ 002362 .J64  2003","X004741290","Perfectly legal : the covert campaign to rig our tax system to benefit the super rich--and cheat everybody else /","Johnston, David C.",2003,FALSE
"206","ALDERMAN","HJ 002362 .P69  2009","X030562722","War, revenue, and state building : financing the development of the American state /","Pollack, Sheldon David.",2009,FALSE
"207","ALDERMAN","HJ 002362 .R3  1942","X000442714","American taxation, its history as a social force in democracy","Ratner, Sidney,",1942,FALSE
"208","ALDERMAN","HJ 002362 .R3  1980","X000082685","Taxation and democracy in America /","Ratner, Sidney,",1980,FALSE
"209","ALDERMAN","HJ 002368 .B4","X000154540","Revolution, reform, and the politics of American taxation, 1763-1783 /","Becker, Robert A.,",1980,FALSE
"210","ALDERMAN","HJ 002368 .B76  1993","X002229123","Redeeming the Republic : Federalists, taxation, and the origins of the Constitution /","Brown, Roger H.",1993,FALSE
"211","ALDERMAN","HJ 002368 .F67","X000185894","Taxation and political change in the Young Nation, 1781-1833 /","Forsythe, Dall W.,",1977,FALSE
"212","ALDERMAN","HJ 002368 .R33  2008","X030252886","Taxation in colonial America /","Rabushka, Alvin.",2008,FALSE
"213","ALDERMAN","HJ 002373 .M44  2013","X031619306","Making the modern American fiscal state : law, politics, and the rise of progressive taxation, 1877-1929 /","Mehrotra, Ajay K.,",2013,FALSE
"214","ALDERMAN","HJ 002381 .B55  1952","X031940759","The Federal taxing process.","Blough, Roy,",1952,FALSE
"215","ALDERMAN","HJ 002381 .B79  2013","X031229764","Taxes in America : what everyone needs to know /","Burman, Leonard.",2013,FALSE
"216","ALDERMAN","HJ 002381 .E226  1996","X004067862","Economic effects of fundamental tax reform /","",1996,FALSE
"217","ALDERMAN","HJ 002381 .E35  1961","X000923820","The ideologies of taxation.","Eisenstein, Louis,",1961,FALSE
"218","ALDERMAN","HJ 002381 .F57  2009","X030468867","The politics of taxing and spending /","Fisher, Patrick (Patrick Ivan)",2009,FALSE
"219","ALDERMAN","HJ 002381 .F853  2008","X030258678","Fundamental tax reform : issues, choices, and implications /","",2008,FALSE
"220","ALDERMAN","HJ 002381 .F86  1996","X002712506","Funding the modern American state, 1941-1995 : the rise and fall of the era of easy finance /","",1996,FALSE
"221","ALDERMAN","HJ 002381 .H27  1983","X000666877","The politics of taxation : revenue without representation /","Hansen, Susan B.",1983,FALSE
"222","CLEMONS","HJ 002381 .H684  1997","X004106351","The hidden welfare state : tax expenditures and social policy in the United States /","Howard, Christopher,",1997,FALSE
"223","ALDERMAN","HJ 002381 .K77  2001","X004526921","Fuzzy math : the essential guide to the Bush tax plan /","Krugman, Paul R.",2001,FALSE
"224","ALDERMAN","HJ 002381 .R45  2017","X031815600","A fine mess : a global quest for a simpler, fairer, and more efficient tax system /","Reid, T. R.,",2017,FALSE
"225","ALDERMAN","HJ 002381 .S5185  2013","X031604223","Tax fairness and folk justice /","Sheffrin, Steven M.",2013,FALSE
"226","ALDERMAN","HJ 002381 .S74  1992","X002050000","The tax decade : how taxes came to dominate the public agenda /","Steuerle, C. Eugene,",1992,FALSE
"227","ALDERMAN","HJ 002381 .T396  1996","X004091388","Taxing America /","",1996,FALSE
"228","ALDERMAN","HJ 002381 .W55  2017","X031761600","Read my lips : why Americans are proud to pay taxes /","Williamson, Vanessa,",2017,FALSE
"229","ALDERMAN","HJ 002381 .Z45  1998","X004265649","Taxing America : Wilbur D. Mills, Congress, and the state, 1945-1975 /","Zelizer, Julian E.",1998,FALSE
"230","ALDERMAN","HJ 002385 .G65  1996","X004069570","State tax relief for the poor /","Gold, Steven David.",1996,FALSE
"231","ALDERMAN","HJ 002385 .H65  1997","X004107604","Growth and variability in state tax revenue : an anatomy of state fiscal crises /","Holcombe, Randall G.",1997,FALSE
"232","ALDERMAN","HJ 002438 .V8  1925  NO.1","X031928040","Tax conditions in Virginia ... Presented in conformity with the first part of the program adopted by the Committee on Taxation ..","Virginia State Chamber of Commerce. Committee on Taxation.",1925,TRUE
"233","ALDERMAN","HJ 002449 .H43  2017","X031806417","Tax, order, and good government : a new political history of Canada, 1867-1917 /","Heaman, Elsbeth,",2017,FALSE
"234","ALDERMAN","HJ 002471 .S36  2012","X031216016","State-building and tax regimes in Central America /","Schneider, Aaron,",2012,FALSE
"235","ALDERMAN","HJ 002599.57 .G44  2008","X030465721","Representation through taxation : revenue, politics, and development in postcommunist states /","Gehlbach, Scott.",2008,FALSE
"236","ALDERMAN","HJ 002612 .B729  1996","X006035214","The nerves of state : taxation and the financing of the English state, 1558-1714 /","Braddick, M. J. (Michael J.),",1996,FALSE
"237","ALDERMAN","HJ 002613 .C69  2016","X031792190","Marketing sovereign promises : monopoly brokerage and the growth of the English state /","Cox, Gary W.,",2016,FALSE
"238","ALDERMAN","HJ 002619 .D38  2002","X004664897","Just taxes : the politics of taxation in Britain, 1914-1979 /","Daunton, M. J. (Martin J.)",2002,FALSE
"239","ALDERMAN","HJ 002619 .D56  2010","X030621272","Dimensions of tax design : the Mirrlees review /","",2010,FALSE
"240","ALDERMAN","HJ 002646 .K85  2000","X004397658","Privilege and the politics of taxation in eighteenth-century France : liberté, égalité, fiscalité /","Kwass, Michael.",2000,FALSE
"241","ALDERMAN","HJ 002648 .C65  1988","X001364791","Fiscal limits of absolutism : direct taxation in early seventeenth-century France /","Collins, James B.",1988,FALSE
"242","ALDERMAN","HJ 002801 .K68  2014","X031655400","States of obligation : taxes and citizenship in the Russian Empire and early Soviet Republic /","Kotsonis, Yanni,",2014,FALSE
"243","ALDERMAN","HJ 002981 .B47  2003","X004690354","Taxation without representation in contemporary rural China /","Bernstein, Thomas P.",2003,FALSE
"244","ALDERMAN","HJ 002982 .C44  2013","X031632600","Zhongguo gu dai de na shui yu ying yi /","Chen, Mingguang,",2013,FALSE
"245","ALDERMAN","HJ 002989 .K85  1961","X031595499","Han'guk chose y?n'gu /","Kwak, Sang-su.",1961,FALSE
"246","ALDERMAN","HJ 002996 .J46  2003","X004663898","Taxation and economic development in Taiwan /","Jenkins, Glenn P.",2003,FALSE
"247","ALDERMAN","HJ 003018 .C53  1992","X030237856","Taxation in Islam and modern taxes /","Chaudhry, Muhammad Sharif.",1992,FALSE
"248","ALDERMAN","HJ 003021 .G37  2012","X031579909","Taxing colonial Africa : the political economy of British Imperialism /","Gardner, Leigh.",2012,FALSE
"249","ALDERMAN","HJ 003026 .P75  2015","X031731598","Taxation, responsiveness, and accountability in sub-Saharan Africa : the dynamics of tax bargaining /","Prichard, Wilson,",2015,FALSE
"250","ALDERMAN","HJ 003069 .R64  2005","X004808828","Fiscal disobedience : an anthropology of economic regulation in Central Africa /","Roitman, Janet L. (Janet Lee)",2005,FALSE
"251","ALDERMAN","HJ 003258 .A2  R57  1992","X002119066","Reviving the American dream : the economy, the states, & the    federal government /","Rivlin, Alice M.",1992,TRUE
"252","ALDERMAN","HJ 003608 1958  .M3  1966","X031940778","District office manual,","Madras (India : State). Revenue Department",1966,FALSE
"253","ALDERMAN","HJ 003629 .Y53  2010","X030943336","Taedongp?p : Chos?n ch'oego ?i kaehy?k : paeks?ng ?n m?ngn?n k?t ?l han?l ro samn?nda /","Yi, Chong-ch'?l",2010,FALSE
"254","ALDERMAN","HJ 003801 .B35  2012","X030959905","Sovereign wealth funds : the new intersection of money and politics /","Balding, Christopher.",2012,FALSE
"255","ALDERMAN","HJ 003801 .L64  2010","X030782161","Sovereign wealth funds : states buying the world /","Loh, Lixia.",2010,FALSE
"256","ALDERMAN","HJ 003801 .O94  2017","X031841270","The Oxford handbook of sovereign wealth funds /","",2017,FALSE
"257","ALDERMAN","HJ 003801 .T78  2010","X030745264","Sovereign wealth funds : threat or salvation? /","Truman, Edwin M.",2010,FALSE
"258","ALDERMAN","HJ 003833 .S26  1996","X002777232","Debt wish : entrepreneurial cities, U.S. federalism, and economic development /","Sbragia, Alberta M.",1996,FALSE
"259","ALDERMAN","HJ 003840 .G7  L36  2016","X031822500","A sharing economy : how social wealth funds can tackle inequality and balance the books /","Lansley, Stewart,",2016,TRUE
"260","ALDERMAN","HJ 004120 .M37  2008","X030254420","The permanent tax revolt : how the property tax transformed American politics /","Martin, Isaac William.",2008,FALSE
"261","ALDERMAN","HJ 004120 .P67112  2010","X030782157","The property tax and local autonomy /","",2010,FALSE
"262","ALDERMAN","HJ 004120 .W65  2002","X004587650","Top heavy : the increasing inequality of wealth in America and what can be done about it /","Wolff, Edward N.",2002,FALSE
"263","ALDERMAN","HJ 004127 .A35  P76  2017","X031841318","Property tax in Africa : status, challenges, and prospects /","",2017,FALSE
"264","ALDERMAN","HJ 004182 .S65  1998","X004206327","Tax crusaders : and the politics of direct democracy /","Smith, Daniel A.,",1998,FALSE
"265","ALDERMAN","HJ 004191 .P76","X000369011","The property tax revolt : the case of Proposition 13 /","",1981,FALSE
"266","ALDERMAN","HJ 004191 .S4  1982","X000355585","Tax revolt : something for nothing in California /","Sears, David O.",1982,FALSE
"267","ALDERMAN","HJ 004385 .R67  2015","X031714410","Property, land, revenue, and policy : the East India Company, c. 1757-1825 /","Rorabacher, John Albert,",2015,FALSE
"268","ALDERMAN","HJ 004387 .B4  G8  1963","X000416903","A rule of property for Bengal; an essay on the idea of permanent settlement.","Guha, Ranajit.",1963,TRUE
"269","ALDERMAN","HJ 004387 .M3  R46  1950","X031648520","Report of the special officer for the investigation of land tenures, on the recommendations of the Malabar Tenancy Committee, May 1947.","Madras (India : Presidency)",1950,TRUE
"270","ALDERMAN","HJ 004393 .B45  B45  1896","X031648507","The survey and settlement manual, 1895.","Bengal (India). Revenue Department.",1896,FALSE
"271","ALDERMAN","HJ 004406 .L52  2005","X004864065","Village governance in North China, 1875-1936 /","Li, Huaiyin.",2005,FALSE
"272","ALDERMAN","HJ 004629 .S4  1921","X000193151","The income tax; a study of the history, theory, and practice of income taxation at home and abroad,","Seligman, Edwin R. A. (Edwin Robert Anderson),",1914,FALSE
"273","ALDERMAN","HJ 004629 .T86  2016","X031795282","Optimal redistributive taxation /","Tuomala, Matti.",2016,FALSE
"274","ALDERMAN","HJ 004629 .Y8","X031940788","A legal structure for effective income tax administration.","Yudkin, Leon.",1971,FALSE
"275","ALDERMAN","HJ 004639 .S73","X031886966","Tax systems and corporate financing policy /","Stapleton, Richard C.",1978,FALSE
"276","ALDERMAN","HJ 004651 .S73  1993","X002242920","Dimensions of law in the service of order : origins of the federal income tax, 1861-1913 /","Stanley, Robert,",1993,FALSE
"277","ALDERMAN","HJ 004652 .B27  2000","X004439862","The great American tax dodge : how spiraling fraud and avoidance are killing fairness, destroying the income tax, and costing you /","Barlett, Donald L.",2000,FALSE
"278","ALDERMAN","HJ 004652 .B652  2008","X030204075","FairTax, the truth : answering the critics /","Boortz, Neal.",2008,FALSE
"279","CLEMONS","HJ 004652 .B66  2005","X004956155","The FairTax book : saying goodbye to the income tax and the IRS /","Boortz, Neal.",2005,FALSE
"280","ALDERMAN","HJ 004652 .B89  1985","X000994179","The income tax and the Progressive era /","Buenker, John D.",1985,FALSE
"281","ALDERMAN","HJ 004652 .D6  1990","X001904403","Do taxes matter? : the impact of the Tax Reform Act of 1986 /","",1990,FALSE
"282","CLEMONS","HJ 004652 .F74  2005","X004919598","Flat tax revolution : using a postcard to abolish the IRS /","Forbes, Steve,",2005,FALSE
"283","ALDERMAN","HJ 004652 .G697  1997","X004096927","The decline (and fall?) of the income tax /","Graetz, Michael J.",1997,FALSE
"284","ALDERMAN","HJ 004652 .H183  1985","X000917740","The flat tax /","Hall, Robert E. (Robert Ernest),",1985,FALSE
"285","ALDERMAN","HJ 004652 .M386  2013","X031614328","Rich people's movements : grassroots campaigns to untax the one percent /","Martin, Isaac William.",2013,FALSE
"286","ALDERMAN","HJ 004652 .M68  001933-000034","X031962316","Federal income tax handbook, 1935-36,","Montgomery, Robert Hiester,",1935,FALSE
"287","ALDERMAN","HJ 004652 .S475  1938","X000946853","Personal income taxation; the definition of income as a problem of fiscal policy,","Simons, Henry Calvert,",1938,FALSE
"288","ALDERMAN","HJ 004652 .S528  2004","X004773108","Taxing ourselves : a citizen's guide to the debate over taxes /","Slemrod, Joel.",2004,FALSE
"289","ALDERMAN","HJ 004652 .S528  2008","X030252910","Taxing ourselves : a citizen's guide to the debate over taxes /","Slemrod, Joel.",2008,FALSE
"290","ALDERMAN","HJ 004652 .W556  2002","X004636158","The great tax wars : Lincoln to Wilson : the fierce battles over money and power that transformed the nation /","Weisman, Steven R.",2002,FALSE
"291","ALDERMAN","HJ 004652 .W69  1985","X000929102","The politics and development of the federal income tax /","Witte, John F.",1985,FALSE
"292","ALDERMAN","HJ 004653 .C7  M334  1991","X002012350","Shifting the burden : the struggle over growth and corporate taxation /","Martin, Cathie J.",1991,FALSE
"293","ALDERMAN","HJ 004653 .C73  M35  2001","X004587094","Making work pay : the earned income tax credit and its impact on America's families /","",2001,FALSE
"294","ALDERMAN","HJ 004653 .D4  C56  1985","X000955326","Federal tax policy and charitable giving /","Clotfelter, Charles T.",1985,TRUE
"295","ALDERMAN","HJ 004653 .R6  S34  2016","X031794676","Taxing the rich : a history of fiscal fairness in the United States and Europe /","Scheve, Kenneth F.",2016,FALSE
"296","ALDERMAN","HJ 004653 .R6  Y68  2018","X031810146","The myth of millionaire tax flight : how place still matters for the rich /","Young, Cristobal,",2018,FALSE
"297","ALDERMAN","HJ 004653 .T22  R65  2010","X030746169","Role of tax preferences in financial infrastructure /","",2010,TRUE
"298","ALDERMAN","HJ 004653 .T38  R67  2014","X031629123","Confidence games : lawyers, accountants, and the tax shelter industry /","Rostain, Tanina,",2014,TRUE
"299","ALDERMAN","HJ 004707 .D35  2001","X004590720","Trusting Leviathan : the politics of taxation in Britain, 1799-1914 /","Daunton, M. J. (Martin J.)",2001,FALSE
"300","ALDERMAN","HJ 004804 .H5  1962","X032307563","al-?ar?bah al-??mmah ?alá al-?r?d /","?ilm?, ?Abd al-Q?dir.",1962,FALSE
"301","ALDERMAN","HJ 004931 .A13  O4  1958","X000414520","The poll tax in the South.","Ogden, Frederic D.",1958,FALSE
"302","ALDERMAN","HJ 004935 .G7  M33  1995","X002590985","State policy formation and the origins of the poll tax /","McConnell, Allan,",1995,FALSE
"303","ALDERMAN","HJ 005021 .A7  1881","X000418073","After the moonshiners.","Atkinson, George Wesley,",1881,FALSE
"304","ALDERMAN","HJ 005021 .K45  1971","X001243927","Moonshine ; its history and folklore /","Kellner, Esther.",1971,FALSE
"305","ALDERMAN","HJ 005021 .K56  2008","X030473955","King of the moonshiners : Lewis R. Redmond in fact and fiction /","",2008,FALSE
"306","ALDERMAN","HJ 005021 .M55  1991","X001982856","Revenuers and moonshiners : enforcing federal liquor law in the mountain South, 1865-1900 /","Miller, Wilbur R.,",1991,FALSE
"307","CLEMONS","HJ 005021 .W38  2010","X004087799","Chasing the white dog : an amateur outlaw's adventures in moonshine /","Watman, Max.",2010,FALSE
"308","ALDERMAN","HJ 005057 .B86  W55  1985","X000929328","Moonshine : a life in pursuit of white liquor /","Wilkinson, Alec,",1985,FALSE
"309","ALDERMAN","HJ 005316 .G56  2017","X031819055","Global carbon pricing : the path to climate cooperation /","",2017,FALSE
"310","ALDERMAN","HJ 005316 .J67  2013","X031625531","Double dividend : environmental taxes and fiscal reform in the United States /","Jorgenson, Dale W. (Dale Weldeau),",2013,FALSE
"311","ALDERMAN","HJ 005316 .M85  2016","X031760700","Business in a changing climate : explaining industry support for carbon pricing /","Munroe, Kaija Belfry,",2016,FALSE
"312","ALDERMAN","HJ 005316 .R33  2018","X031839838","Can we price carbon? /","Rabe, Barry George,",2018,FALSE
"313","ALDERMAN","HJ 005321 .I47  2015","X031726344","Implementing a US carbon tax : challenges and debates /","",2015,FALSE
"314","ALDERMAN","HJ 005715 .D44  B57  2007","X030262458","The VAT in developing and transitional countries /","Bird, Richard M. (Richard Miller),",2007,FALSE
"315","ALDERMAN","HJ 005805 .G73  2005","X004861830","Death by a thousand cuts : the fight over taxing inherited wealth /","Graetz, Michael J.",2005,FALSE
"316","ALDERMAN","HJ 006619 .E47  2012","X031216239","Governing guns, preventing plunder : international cooperation against illicit trade /","Efrat, Asif.",2012,FALSE
"317","CLEMONS","HJ 006619 .P68  2011","X031195506","Outlaws Inc. : under the radar and on the black market with the world's most dangerous smugglers /","Potter, Matt.",2011,FALSE
"318","ALDERMAN","HJ 006690 .A7  2000","X004438582","Border games : policing the U.S.-Mexico divide /","Andreas, Peter,",2000,FALSE
"319","ALDERMAN","HJ 006690 .A7  2009","X030566613","Border games : policing the U.S.-Mexico divide /","Andreas, Peter,",2009,FALSE
"320","ALDERMAN","HJ 006690 .A74  2013","X031612675","Smuggler nation : how illicit trade made America /","Andreas, Peter,",2013,FALSE
"321","ALDERMAN","HJ 006690 .C56  2015","X031730406","Contraband : smuggling and the birth of the American century /","Cohen, Andrew Wender,",2015,FALSE
"322","ALDERMAN","HJ 006690 .S65  2006","X030104543","Borderland smuggling : patriots, loyalists, and illicit trade in the Northeast, 1783-1820 /","Smith, Joshua M.",2006,FALSE
"323","ALDERMAN","HJ 006864 .G7  1997","X004103426","The political economy of smuggling : regional informal economies in early Bourbon New Granada /","Grahn, Lance Raymond,",1997,FALSE
"324","ALDERMAN","HJ 006864 .L382  2014","X031729714","Contrabando, poder y color en los albores de la República : Nueva Granada, 1822-1824 /","Laurent, Muriel",2014,FALSE
"325","ALDERMAN","HJ 006911 .B58  2004","X004796320","Les directeurs généraux des douanes : l'administration et la politique douanière, 1801-1939 /","Bordas, Jean.",2004,FALSE
"326","ALDERMAN","HJ 007033.5 .Z5  M37  2016","X031791927","Margins of the market : trafficking and capitalism across the Arabian Sea /","Mathew, Johan,",2016,FALSE
"327","ALDERMAN","HJ 007049.8 .Z5  T34  2005","X004896088","Secret trades, porous borders : smuggling and states along a Southeast Asian frontier, 1865-1915 /","Tagliacozzo, Eric.",2005,TRUE
"328","ALDERMAN","HJ 007119.5 .Z5  S65  1983","X001228319","Smuggling and ""coastal piracy"" in Nigeria : proceedings on a workshop, NIIA/Nigerian Navy, February 22-23, 1983 /","",1983,FALSE
"329","ALDERMAN","HJ 007270 .C4  1940  NO.51","X000673156","The junks and sampans of the Yangtze; a study in Chinese nautical research.","Worcester, G. R. G.",1947,TRUE
"330","ALDERMAN","HJ 007315 .A5  1966  V.000005 PT.000002","X031923674","al-Ta?n?f al-?Arab? al-muwa??ad lil-sila?.","United Arab Republic. Id?rah al-Markaz?yah lil-I????.",1966,TRUE
"331","ALDERMAN","HJ 007461 .B47  2010","X030744613","Government size and implications for economic growth /","Bergh, Andreas,",2010,FALSE
"332","CLEMONS","HJ 007461 .B75  1987","X001108599","Public finance and the price system /","Browning, Edgar K.",1987,FALSE
"333","CLEMONS","HJ 007461 .B75  1994","X004020331","Public finance and the price system /","Browning, Edgar K.",1994,FALSE
"334","ALDERMAN","HJ 007537 .A75  1967","X031940752","The price of the United States Government, 1948-1967; an analytical review of two decades of Federal Government finances.","American Enterprise Institute for Public Policy Research.",1967,FALSE
"335","ALDERMAN","HJ 007537 .B23  2016","X031792220","How big should our government be? /","Bakija, Jon M.,",2016,FALSE
"336","ALDERMAN","HJ 007537 .F43  2010","X030744462","Federal spending : a riddle wrapped up in an enigma /","",2010,FALSE
"337","ALDERMAN","HJ 007537 .F76  2011","X030743883","Cheese factories on the moon : why earmarks are good for American democracy /","Frisch, Scott A.,",2011,FALSE
"338","ALDERMAN","HJ 007537 .M35  2010","X030744535","Shakedown : the continuing conspiracy against the American taxpayer /","Malanga, Steven.",2010,FALSE
"339","ALDERMAN","HJ 007537 .O43  2010","X031191240","A new American tea party : the counterrevolution against bailouts, handouts, reckless spending, and more taxes /","O'Hara, John M.,",2010,FALSE
"340","ALDERMAN","HJ 007539 .S38","X000133201","The public use of private interest /","Schultze, Charles L.",1977,FALSE
"341","ALDERMAN","HJ 007543 .A43  2008","X030458422","America's entitlement society.","",2008,FALSE
"342","ALDERMAN","HJ 007543 .C64  2017","X032057828","The high cost of good intentions : a history of U.S. federal entitlement programs /","Cogan, John F.,",2017,FALSE
"343","ALDERMAN","HJ 007543 .K64  2012","X031610491","Entitlement spending : our coming fiscal tsunami /","Koitz, David.",2012,FALSE
"344","ALDERMAN","HJ 007543 .S26  1995","X002759932","The good life and its discontents : the American dream in the age of entitlement, 1945-1955 /","Samuelson, Robert J.",1995,FALSE
"345","ALDERMAN","HJ 007766 .H4","X000171584","The private government of public money; community and policy inside British politics","Heclo, Hugh.",1974,FALSE
"346","ALDERMAN","HJ 008011 .L474  2018","X032581941","In good times prepare for crisis : from the Great Depression to the Great Recession : sovereign debt crises and their resolution /","Lieberman, Ira W.,",2018,FALSE
"347","ALDERMAN","HJ 008011 .M34  2003","X004657479","A Free nation deep in debt : the financial roots of democracy /","MacDonald, James.",2003,FALSE
"348","ALDERMAN","HJ 008015 .B59  2013","X031599753","Austerity : the history of a dangerous idea /","Blyth, Mark,",2013,FALSE
