"","Item.Library.Code","Item.Shelving.Id","Item.Barcode","Catalog.Title","Catalog.Author","Catalog.Pub.Year","MultiVolume"
"349","ALDERMAN","HJ 008015 .D48  2006","X030121957","La dette publique dans l'histoire : les journées du Centre de recherches historiques des 26, 27 et 28 novembre 2001 /","",2006,FALSE
"350","ALDERMAN","HJ 008015 .L54  2014","X031629641","Rethinking sovereign debt : politics, reputation, and legitimacy in modern finance /","Lienau, Odette,",2014,FALSE
"351","ALDERMAN","HJ 008015 .S688  2017","X031824672","Sovereign debt crises : what have we learned? /","",2017,FALSE
"352","ALDERMAN","HJ 008015 .S87  2008","X030260004","Sustainability of public debt /","",2008,FALSE
"353","ALDERMAN","HJ 008032 .A2  S55  1995","X004189537","Principle and interest : Thomas Jefferson and the problem of debt /","Sloan, Herbert E.",1995,FALSE
"354","ALDERMAN","HJ 008032 .A2  S55  2001","X004562594","Principle and interest : Thomas Jefferson and the problem of debt /","Sloan, Herbert E.",2001,FALSE
"355","ALDERMAN","HJ 008083 .P65  1986","X001059752","The Politics of international debt /","",1986,FALSE
"356","ALDERMAN","HJ 008101 .A4155  2016","X031735242","The $13 trillion question : how America manages its debt /","",2016,FALSE
"357","ALDERMAN","HJ 008101 .G67  1997","X004093536","Hamilton's blessing : the extraordinary life and times of our national debt /","Gordon, John Steele.",1997,FALSE
"358","ALDERMAN","HJ 008101 .H34  2016","X031792253","Public debt, inequality, and power : the making of a modern debt state /","Hager, Sandy Brian,",2016,FALSE
"359","ALDERMAN","HJ 008101 .W43  2011","X030818559","Inflated : how money and debt built the American dream /","Whalen, R. Christopher,",2011,FALSE
"360","ALDERMAN","HJ 008101 .W74  2008","X030258059","One nation under debt : Hamilton, Jefferson, and the history of what we owe /","Wright, Robert E. (Robert Eric),",2008,FALSE
"361","ALDERMAN","HJ 008106 .A3  1964","X000337705","The reports of Alexander Hamilton.","United States. Department of the Treasury",1964,FALSE
"362","ALDERMAN","HJ 008119 .H43  1989","X001608867","The debt and the deficit : false alarms/real possibilities /","Heilbroner, Robert L.",1989,FALSE
"363","ALDERMAN","HJ 008119 .W45  2014","X031635745","America's fiscal constitution : its triumph and collapse /","White, William H.,",2014,FALSE
"364","ALDERMAN","HJ 008223 .R36  1941","X000550809","American state debts,","Ratchford, Benjamin Ulysses,",1941,FALSE
"365","ALDERMAN","HJ 008483 .M66","X000128853","Two paths to the new South : the Virginia debt controversy, 1870-1883 /","Moore, James Tice.",1974,FALSE
"366","ALDERMAN","HJ 008483 .T37  2016","X031741159","A saga of the New South : race, law, and public debt in Virginia /","Tarter, Brent,",2016,FALSE
"367","ALDERMAN","HJ 008514.5 .D39  1990","X001825387","The first Latin American debt crisis : the city of London and the 1822-25 loan bubble /","Dawson, Frank G. (Frank Griffith),",1990,FALSE
"368","ALDERMAN","HJ 008514.5 .D437  1989","X001640411","Debt, adjustment, and recovery : Latin America's prospects for growth and development /","",1989,FALSE
"369","ALDERMAN","HJ 008514.5 .D445  1989","X001492690","Debt and democracy in Latin America /","",1989,FALSE
"370","ALDERMAN","HJ 008514.5 .D493  1988","X001365219","Development and external debt in Latin America : bases for a new consensus /","",1988,FALSE
"371","ALDERMAN","HJ 008514.5 .E98  1985","X000955610","External debt and development strategy in Latin America /","",1985,FALSE
"372","ALDERMAN","HJ 008514.5 .K83  1988","X001358395","Latin American debt /","Kuczynski Godard, Pedro-Pablo,",1988,FALSE
"373","ALDERMAN","HJ 008514.5 .L39  1987","X004561783","Latin American debt and the adjustment crisis /","",1987,FALSE
"374","ALDERMAN","HJ 008514.5 .L393  1989","X001520628","Latin American debt and adjustment : external shocks and macroeconomic policies /","",1989,FALSE
"375","ALDERMAN","HJ 008514.5 .L394  1991","X002039889","Latin American debt in the 1990s : lessons from the past and forecasts for the future /","",1991,FALSE
"376","ALDERMAN","HJ 008514.5 .L395  1987","X001261604","Latin America's debt crisis : adjusting to the past or planning for the future? /","",1987,FALSE
"377","ALDERMAN","HJ 008514.5 .L58  2006","X030115210","Living with debt : how to limit the risks of sovereign finance /","",2006,FALSE
"378","ALDERMAN","HJ 008514.5 .P65  1985","X000949711","Politics and economics of external debt crisis : the Latin American experience /","",1985,FALSE
"379","ALDERMAN","HJ 008519 .I55  1983","X001225334","International credit policy and the foreign policy of states : the Mexican debt and payments crisis /","",1983,FALSE
"380","ALDERMAN","HJ 008519 .O42  1992","X002174102","Latin American debt and the politics of international finance /","Oliveri, Ernest J.",1992,FALSE
"381","ALDERMAN","HJ 008552 .K57  1992","X002157584","Jamaica : debt and poverty /","Kirton, Claremont.",1992,FALSE
"382","ALDERMAN","HJ 008574 .J46  2001","X004595071","Debt, crisis and reform in Bolivia : biting the bullet /","Jemio M., Luis Carlos.",2001,FALSE
"383","ALDERMAN","HJ 008579 .S86  2015","X031733311","Inglorious revolution : political institutions, sovereign debt, and financial underdevelopment in imperial Brazil /","Summerhill, William R. (William Roderick),",2015,FALSE
"384","ALDERMAN","HJ 008615 .S85  2003","X004705594","Public debt and the birth of the democratic state : France and Great Britain, 1688-1789 /","Stasavage, David.",2003,FALSE
"385","ALDERMAN","HJ 008623 .D5  1967","X000271324","The financial revolution in England: a study in the development of public credit, 1688-1756","Dickson, P. G. M. (Peter George Muir)",1967,FALSE
"386","ALDERMAN","HJ 008623 .R67  1991","X002042459","The financial revolution, 1660-1760 /","Roseveare, Henry.",1991,FALSE
"387","ALDERMAN","HJ 008627 .S44  2006","X030108262","Britain, America and the war debt controversy : the economic diplomacy of an unspecial relationship, 1917-1941 /","Self, Robert C.,",2006,FALSE
"388","ALDERMAN","HJ 008654 .R663  2005","X030792557","Das Londoner Schuldenabkommen : die Regelung der deutschen Auslandsschulden nach dem Zweiten Weltkrieg /","Rombeck-Jaschinski, Ursula,",2005,FALSE
"389","ALDERMAN","HJ 008654 .S28  1988","X001464934","American ""reparations"" to Germany, 1919-33 : implications for the Third-World debt crisis /","Schuker, Stephen A.,",1988,FALSE
"390","ALDERMAN","HJ 008675 .A76  2003","X004702889","Usury and public debt in early Renaissance Florence : Lorenzo Ridolfi on the Monte Comune /","Armstrong, Lawrin D. (Lawrin David)",2003,FALSE
"391","ALDERMAN","HJ 008715 .V385  2010","X030745891","The Russian public debt and financial meltdowns /","Vavilov, Andre?,",2010,FALSE
"392","ALDERMAN","HJ 008770.7 .B57  2010","X030621190","The political economy of Ottoman public debt : insolvency and European financial control in the late nineteenth century /","Birdal, Murat.",2010,FALSE
"393","ALDERMAN","HJ 008782 .B43  2015","X031734502","Navigating austerity : currents of debt along a South Asian river /","Bear, Laura,",2015,FALSE
"394","ALDERMAN","HJ 008826 .D44  2009","X030559394","Debt relief initiatives, development assistance and service delivery in Africa /","",2009,FALSE
"395","ALDERMAN","HJ 008826 .I54  1989  V.000002","X002315497","The IMF, the World Bank, and the African debt /","",1989,TRUE
"396","ALDERMAN","HJ 008826 .N39  2011","X031189248","Africa's odious debts : how foreign loans and capital flight bled a continent /","Ndikumana, Léonce.",2011,FALSE
"397","ALDERMAN","HJ 008842.5 .D433  2003","X004658703","The debt trap in Nigeria : towards a sustainable debt strategy /","",2003,FALSE
"398","ALDERMAN","HJ 008899 .A763  2010","X030944702","Debt relief initiatives : policy design and outcomes /","Arnone, Marco.",2010,FALSE
"399","ALDERMAN","HJ 008899 .D382  2007","X030259769","Dealing fairly with developing country debt /","",2007,FALSE
"400","ALDERMAN","HJ 008899 .D45  1986","X001609623","Debt, stabilization, and development : essays in memory of Carlos Díaz-Alejandro /","",1989,FALSE
"401","ALDERMAN","HJ 008899 .D4815  1989  V.000001","X001508017","Developing country debt and economic performance /","",1989,TRUE
"402","ALDERMAN","HJ 008899 .D482  1989","X001508297","Developing country debt and the world economy /","",1989,FALSE
"403","ALDERMAN","HJ 008899 .D53  2008","X030250004","The impact of international debt relief /","Dijkstra, A. Geske.",2008,FALSE
"404","ALDERMAN","HJ 008899 .G46  1988","X001356800","A fate worse than debt /","George, Susan.",1988,FALSE
"405","ALDERMAN","HJ 008899 .G73  2013","X031604276","The Company States Keep : International economic organizations and investor perceptions /","Gray, Julia,",2013,FALSE
"406","ALDERMAN","HJ 008899 .O94  2010","X030619905","Overcoming developing country debt crises /","",2010,FALSE
"407","ALDERMAN","HJ 008899 .R337  2010","X030781390","Debt management for development : protection of the poor and the millennium development goals /","Raffer, Kunibert,",2010,FALSE
"408","ALDERMAN","HJ 008899 .S38  1989","X001606045","In the dominions of debt : historical perspectives on dependent development /","Schwartz, Herman M.,",1989,FALSE
"409","ALDERMAN","HJ 008899 .S68  2006","X004910438","Sovereign debt at the crossroads : challenges and proposals for resolving the third world debt crisis /","",2006,FALSE
"410","ALDERMAN","HJ 008899 .S83  2006","X030107191","Debt defaults and lessons from a decade of crises /","Sturzenegger, Federico.",2006,FALSE
"411","ALDERMAN","HJ 008899 .T677  2010","X030745277","Debt, the IMF, and the World Bank : sixty questions, sixty answers /","Toussaint, Eric.",2010,FALSE
"412","ALDERMAN","HJ 009105 .M3  1981","X000397932","Management policies in local government finance /","",1981,FALSE
"413","ALDERMAN","HJ 009141 .M86  2010","X030781508","Municipal revenues and land policies /","",2010,FALSE
"414","ALDERMAN","HJ 009144 .P64  1984","X000931703","The Politics of urban fiscal policy /","",1984,FALSE
"415","ALDERMAN","HJ 009145 .L32  1989","X001454939","America's ailing cities : fiscal health and the design of urban policy /","Ladd, Helen F.",1989,FALSE
"416","ALDERMAN","HJ 009145 .M66  1995","X002717335","The local state : public money and American cities /","Monkkonen, Eric H.,",1995,FALSE
"417","ALDERMAN","HJ 009205 .S28  E75  2011","X030976175","Paradise plundered : fiscal crisis and governance failures in San Diego /","Erie, Steven P.",2011,FALSE
"418","ALDERMAN","HJ 009205 .S3  M34  1986","X001157224","The parameters of urban fiscal policy : socio-economic change and political culture in San Francisco, 1860-1906.","McDonald, Terrence J.",1986,FALSE
"419","ALDERMAN","HJ 009216 .O27  1997","X004095128","The orphaned capital : adopting the right revenues for the District of Columbia /","O'Cleireacain, Carol.",1997,FALSE
"420","ALDERMAN","HJ 009253 .B2  K54  2019","X032581787","City on the line : how Baltimore transformed its budget to beat the Great Recession and deliver outcomes /","Kleine, Andrew,",2019,FALSE
"421","ALDERMAN","HJ 009289 .N4  L33  2010","X030774306","The man who saved New York : Hugh Carey and the great fiscal crisis of 1975 /","Lachman, Seymour.",2010,TRUE
"422","ALDERMAN","HJ 009289 .N46  F83  1992","X002084001","Mayors and money : fiscal policy in New York and Chicago /","Fuchs, Ester Rachel,",1992,TRUE
"423","ALDERMAN","HJ 009307 .P4  A63  1988","X001490166","The politics of capital investment : the case of Philadelphia /","Adams, Carolyn Teich.",1988,FALSE
"424","ALDERMAN","HJ 009386 .W35  2007","X030251654","Participatory budgeting in Brazil : contestation, cooperation, and accountability /","Wampler, Brian.",2007,FALSE
"425","CLEMONS","HJ 009773 .B33  1988","X001573079","Governmental accounting, auditing, and financial reporting.","Bean, David R.",1988,FALSE
"426","ALDERMAN","HJ 009925 .F8  C37  2011","X031193236","Le grand état-major financier : les inspecteurs des Finances, 1918-1946 : les hommes, le métier, les carrières /","Carré de Malberg, Nathalie.",2011,TRUE
"427","ALDERMAN","HJ 009925 .F8  D53  2012","X031602655","Dictionnaire historique des inspecteurs des finances : 1801-2009 : dictionnaire thématique et biographique /","",2012,TRUE
