"","Item.Library.Code","Item.Shelving.Id","Item.Barcode","Catalog.Title","Catalog.Author","Catalog.Pub.Year","MultiVolume"
"1","ALDERMAN","HJ 000010.3 .T39  2017","X031810162","Tax policy and the economy /","",2017,FALSE
"2","ALDERMAN","HJ 000065 .S63  1938","X031899464","Speech of the Hon'ble Babu Nirsu Narayan Sinha, finance member, Bihar and Orissa : in introducing the budget of 1936-37 /","Sihna, Nirsu Narayan.",1938,FALSE
"3","ALDERMAN","HJ 000070.7 .R83  2019","X032582321","Beyond debt : Islamic experiments in global finance /","Rudnyckyj, Daromir,",2019,FALSE
"4","ALDERMAN","HJ 000135 .B85  1972","X000243286","Theory of public choice; political applications of economics.","Buchanan, James M.",1972,FALSE
"5","ALDERMAN","HJ 000141 .A3  1908","X031961594","The science of finance : an investigation of public expenditures and public revenues.","Adams, Henry C. (Henry Carter),",1908,FALSE
"6","ALDERMAN","HJ 000141 .A58  2007","X030256255","An anthology regarding merit goods : the unfinished ethical revolution in economic theory /","",2007,FALSE
"7","CLEMONS","HJ 000141 .A74","X001639090","Lectures on public economics /","Atkinson, A. B. (Anthony Barnes),",1980,FALSE
"8","ALDERMAN","HJ 000141 .D48  2015","X031819378","The public wealth of nations : how management of public assets can boost or bust economic growth /","Detter, Dag,",2015,FALSE
"9","ALDERMAN","HJ 000141 .G78  2005","X004938236","Public finance and public policy /","Gruber, Jonathan.",2005,FALSE
"10","ALDERMAN","HJ 000141 .G78  2007","X030274361","Public finance and public policy /","Gruber, Jonathan.",2007,FALSE
"11","ALDERMAN","HJ 000141 .H36  1985  V.000002","X001299811","Handbook of public economics /","",1985,TRUE
"12","ALDERMAN","HJ 000141 .I54  2010","X030746165","Innovations in financing public services : country case studies /","",2010,FALSE
"13","ALDERMAN","HJ 000141 .I56  2008","X030471431","Institutional foundations of public finance : economic and legal perspectives /","",2008,FALSE
"14","ALDERMAN","HJ 000141 .K36  2008","X030458197","The theory of taxation and public economics /","Kaplow, Louis.",2008,FALSE
"15","ALDERMAN","HJ 000141 .M6","X002313474","Modern fiscal issues: essays in honor of Carl S. Shoup.","",1972,FALSE
"16","ALDERMAN","HJ 000141 .N48  1996","X002755566","The New world fiscal order : implications for industrialized nations /","",1996,FALSE
"17","ALDERMAN","HJ 000141 .P785  2008","X030257689","Public budgeting : policy, process, and politics /","",2008,FALSE
"18","ALDERMAN","HJ 000141 .P795  2003","X004706499","Public finance and public policy in the new century /","",2003,FALSE
"19","ALDERMAN","HJ 000141 .P83677  2016","X031792204","Public sector economics and the need for reforms /","",2016,FALSE
"20","CLEMONS","HJ 000141 .S74  1986","X001111160","Economics of the public sector /","Stiglitz, Joseph E.",1986,FALSE
"21","ALDERMAN","HJ 000141 .U43  2011","X031186581","Public finance in theory and practice /","Ulbrich, Holley H.",2011,FALSE
"22","ALDERMAN","HJ 000192 .T47  1984","X031641850","The Theory of public choice--II /","",1984,FALSE
"23","ALDERMAN","HJ 000192.5 .B83  1999","X004375802","Public finance and public choice : two contrasting visions of the State /","Buchanan, James M.",1999,FALSE
"24","ALDERMAN","HJ 000192.5 .K63  2010","X030774272","The new dynamic public finance /","Kocherlakota, Narayana Rao,",2010,FALSE
"25","ALDERMAN","HJ 000192.5 .R567  2012","X030611361","The rise of fiscal states : a global history, 1500-1914 /","",2012,FALSE
"26","ALDERMAN","HJ 000192.5 .S73  2010","X030619746","State and local fiscal policy : thinking outside the box? /","",2010,FALSE
"27","ALDERMAN","HJ 000192.5 .T39  2010","X030746002","Taxation, tax policies and income taxes /","",2010,FALSE
"28","ALDERMAN","HJ 000197 .F88  2017","X031763475","The future of federalism : intergovernmental financial regulations in an age of austerity /","",2017,FALSE
"29","ALDERMAN","HJ 000197 .G675  2013","X031620992","Governance and finance of metropolitan areas in federal systems /","",2013,FALSE
"30","ALDERMAN","HJ 000197 .R63  2006","X004906856","Hamilton's paradox : the promise and peril of fiscal federalism /","Rodden, Jonathan.",2006,FALSE
"31","ALDERMAN","HJ 000217 .M46  2012","X031195390","Die Finanzierung öffentlicher Bauten in der hellenistischen Polis /","Meier, Ludwig.",2012,FALSE
"32","ALDERMAN","HJ 000217 .S26  2000","X006111300","Empire of the owl : Athenian imperial finance /","Samons, Loren J.,",2000,FALSE
"33","ALDERMAN","HJ 000217 .Z45  2013","X031577147","Taxing freedom in Thessalian manumission inscriptions /","Zelnick-Abramovitz, Rachel,",2013,FALSE
"34","ALDERMAN","HJ 000235 .B37  2018","X031839550","In the red : the politics of public debt accumulation in developed countries /","Barta, Zsófia,",2018,FALSE
"35","ALDERMAN","HJ 000235 .H43  2013","X030609304","Paths toward the modern fiscal state : England, Japan, and China /","He, Wenkai,",2013,FALSE
"36","ALDERMAN","HJ 000241 .D4  1918","X000193293","Financial history of the United States,","Dewey, Davis Rich,",1915,FALSE
"37","ALDERMAN","HJ 000241 .M93","X000112916","A financial history of the United States,","Myers, Margaret G. (Margaret Good),",1970,FALSE
"38","ALDERMAN","HJ 000241 .P47  1994","X002421513","American public finance and financial services, 1700-1815 /","Perkins, Edwin J.",1994,FALSE
"39","ALDERMAN","HJ 000241 .Y4","X000114177","The Money machines; the breakdown and reform of governmental and party finance in the North, 1860-1920","Yearley, Clifton K.",1970,FALSE
"40","ALDERMAN","HJ 000247 .A63  1983","X000508679","The price of liberty : the public debt of the American Revolution /","Anderson, William G.,",1983,FALSE
"41","ALDERMAN","HJ 000247 .F4  1961","X000117599","The power of the purse; a history of American public finance, 1776-1790.","Ferguson, E. James (Elmer James),",1961,FALSE
"42","ALDERMAN","HJ 000247 .S73  1998","X004190118","The origins of American public finance : debates over money, debt, and taxes in the Constitutional era, 1776-1836 /","Stabile, Donald.",1998,FALSE
"43","ALDERMAN","HJ 000247 .W5513  V.000001","X000015954","American finance and Dutch investment, 1780-1805 : with an epilogue to 1840 /","Winter, P. J. van (Pieter Jan),",1977,TRUE
"44","ALDERMAN","HJ 000249 .E35  2014","X031704560","A Hercules in the cradle : war, money, and the American state, 1783-1867 /","Edling, Max M.,",2014,FALSE
"45","ALDERMAN","HJ 000249 .L44  1977","X000709045","Regional distribution of Federal receipts and expenditures in the nineteenth century : a quantitative study /","Legler, John B.",1977,FALSE
"46","CLEMONS","HJ 000251 .H35","X000113164","Sovereignty and an empty purse; banks and politics in the Civil War.","Hammond, Bray.",1970,FALSE
"47","ALDERMAN","HJ 000257 .B6  1959  V.000001","X000462690","From the Morgenthau diaries.","Blum, John Morton,",1959,TRUE
"48","CLEMONS","HJ 000257 .C72  2004","X004684712","Treasonable doubt : the Harry Dexter White spy case /","Craig, R. Bruce.",2004,FALSE
"49","ALDERMAN","HJ 000257 .G54","X000112995","American financing of World War I.","Gilbert, Charles,",1970,FALSE
"50","ALDERMAN","HJ 000257 .P59  1996","X002754407","The politics of American economic policy making /","",1996,FALSE
"51","ALDERMAN","HJ 000257 .S78  1969","X000508512","The fiscal revolution in America.","Stein, Herbert,",1969,FALSE
"52","ALDERMAN","HJ 000257 .S78  1990","X001862221","The fiscal revolution in America /","Stein, Herbert,",1990,FALSE
"53","CLEMONS","HJ 000257.2 .B78  2001","X004622271","Public finance and the American economy /","Bruce, Neil.",2001,FALSE
"54","ALDERMAN","HJ 000257.2 .K595  2015","X031715542","We are better than this : how government should spend our money /","Kleinbard, Edward D.",2015,FALSE
"55","ALDERMAN","HJ 000257.2 .P4  1987","X001263760","Federal tax policy /","Pechman, Joseph A.,",1987,FALSE
"56","CLEMONS","HJ 000257.2 .R67  2002","X004608569","Public finance /","Rosen, Harvey S.",2002,FALSE
"57","ALDERMAN","HJ 000257.3 .H83  2014","X031628855","A citizen's guide to deficits and debt : the politics of taxing, spending, and borrowing /","Hudson, William E.,",2014,FALSE
"58","ALDERMAN","HJ 000257.3 .J66  2008","X030251660","The politics of bad ideas : the great tax cut delusion and the decline of good government in America /","Jones, Bryan D.",2008,FALSE
"59","ALDERMAN","HJ 000257.3 .M43  2010","X030620519","Measuring and managing federal financial risk /","",2010,FALSE
"60","ALDERMAN","HJ 000257.3 .P75  2007","X030261574","Rules and restraint : government spending and the design of institutions /","Primo, David M.",2007,FALSE
"61","ALDERMAN","HJ 000257.3 .S53  2007","X030111300","Taxes, spending, and the U.S. government's march toward bankruptcy /","Shaviro, Daniel N.",2007,FALSE
"62","ALDERMAN","HJ 000257.3 .U55  2011","X030946584","United States deficits : a closer look /","",2011,FALSE
"63","ALDERMAN","HJ 000261 .Z37  2013","X031605129","Treasury's war : the unleashing of a new era of financial warfare /","Zarate, Juan Carlos.",2013,FALSE
"64","ALDERMAN","HJ 000268 .R78  2003","X004702143","In an uncertain world : tough choices from Wall Street to Washington /","Rubin, Robert Edward,",2003,FALSE
"65","ALDERMAN","HJ 000275 .A83  1986","X001064137","Financing state and local governments.","Aronson, J. Richard (Jay Richard),",1986,FALSE
"66","ALDERMAN","HJ 000275 .F55","X000232029","Financing the new federalism : revenue sharing, conditional grants, and taxation : papers /","",1975,FALSE
"67","ALDERMAN","HJ 000275 .F552  1995","X002627111","The Fiscal crisis of the states : lessons for the future /","",1995,FALSE
"68","ALDERMAN","HJ 000275 .F559  1988","X001731069","State and local public finance /","Fisher, Ronald C.",1988,FALSE
"69","ALDERMAN","HJ 000275 .F5593  2007","X031190917","State & local public finance /","Fisher, Ronald C.",2007,FALSE
"70","ALDERMAN","HJ 000275 .H3  1944","X031940747","State and local finance in the national economy,","Hansen, Alvin H. (Alvin Harvey),",1944,FALSE
"71","ALDERMAN","HJ 000275 .T48  1973","X031940746","Revenue sharing : a new era in federalism /","Thompson, Richard E.",1973,FALSE
"72","ALDERMAN","HJ 000275 .W25  1998","X004265106","From revenue sharing to deficit sharing : general revenue sharing and cities /","Wallin, Bruce.",1998,FALSE
"73","ALDERMAN","HJ 000384 .W34  1987","X001210392","From slave South to New South : public policy in nineteenth-century Georgia /","Wallenstein, Peter.",1987,FALSE
"74","ALDERMAN","HJ 000795 .A1  L43  2017","X031806443","Fiscal federalism and equalization policy in Canada : political and economic dimensions /","Lecours, André,",2017,TRUE
"75","ALDERMAN","HJ 000799.53 .D53  2006","X030106482","Federalism, fiscal authority, and centralization in Latin America /","Díaz Cayeros, Alberto.",2006,FALSE
"76","ALDERMAN","HJ 001000 .D56  2011","X031188596","Political transformations and public finances : Europe, 1650-1913 /","Dincecco, Mark,",2011,FALSE
"77","ALDERMAN","HJ 001000 .F55  1994","X002444797","Fiscal crises, liberty, and representative government, 1450-1789 /","",1994,FALSE
"78","ALDERMAN","HJ 001000 .F5645  2009","X030780510","Fiscal policy making in the European Union : an assessment of current practice and challenges /","",2009,FALSE
"79","ALDERMAN","HJ 001000 .H35  2004","X004802507","Domestic budgets in a United Europe : fiscal governance from the end of Bretton Woods to EMU /","Hallerberg, Mark.",2004,FALSE
"80","ALDERMAN","HJ 001000 .H352  2009","X030466525","Fiscal governance in Europe /","Hallerberg, Mark.",2009,FALSE
"81","ALDERMAN","HJ 001000 .P39  2010","X030620366","Paying for the liberal state : the rise of public finance in nineteenth-century Europe /","",2010,FALSE
"82","ALDERMAN","HJ 001000 .Q47  2013","X031607208","Questioning credible commitment : perspectives on the rise of financial capitalism /","",2013,FALSE
"83","ALDERMAN","HJ 001000 .R57  1999","X030805213","The rise of the fiscal state in Europe, c. 1200-1815 /","",1999,FALSE
"84","ALDERMAN","HJ 001000.5 .H45  2010","X030620708","Ruling Europe : the politics of the Stability and Growth Pact /","Heipertz, Martin.",2010,FALSE
"85","ALDERMAN","HJ 001005 .H37","X000270284","King, Parliament, and public finance in medieval England to 1369 /","Harriss, G. L.",1975,FALSE
"86","ALDERMAN","HJ 001012 .C87  1987","X001282412","The forced loan and English politics, 1626-1628 /","Cust, Richard.",1987,FALSE
"87","ALDERMAN","HJ 001023 .H687  2002","X004470472","Britain, France, and the financing of the First World War /","Horn, Martin,",2002,FALSE
"88","ALDERMAN","HJ 001023 .W36  2006","X030475957","Were 364 economists all wrong? /","",2006,FALSE
"89","ALDERMAN","HJ 001028 .F413  1983","X000628572","Dialogus de Scaccario = The course of the Exchequer /","Fitzneale, Richard,",1983,FALSE
"90","ALDERMAN","HJ 001028 .F414  2007","X030276372","Dialogus de Scaccario : the dialogue of the Exchequer /","Fitzneale, Richard,",2007,FALSE
"91","ALDERMAN","HJ 001030 .B3  1957","X001200617","The development of the Treasury, 1660-1702.","Baxter, Stephen Bartow,",1957,FALSE
"92","ALDERMAN","HJ 001030 .D45  1997","X006044397","The Chancellors : a history of the Chancellors of the Exchequer, 1945-90 /","Dell, Edmund.",1997,FALSE
"93","ALDERMAN","HJ 001030 .P4","X000014946","British rearmament and the Treasury, 1932-1939 /","Peden, G. C.",1979,FALSE
"94","ALDERMAN","HJ 001030 .P414  2000","X004435244","The Treasury and British public policy, 1906-1959 /","Peden, G. C.",2000,FALSE
"95","ALDERMAN","HJ 001030 .R65  1969","X001848672","The Treasury; the evolution of a British institution.","Roseveare, Henry.",1969,FALSE
"96","ALDERMAN","HJ 001030 .R65  1973","X001533093","The Treasury, 1660-1870: the foundations of control.","Roseveare, Henry.",1973,FALSE
"97","ALDERMAN","HJ 001070 .B79  2010","X030745966","The economics of centralism and local autonomy : fiscal decentralization in the Czech and Slovak Republics /","Bryson, Phillip J.",2010,FALSE
"98","ALDERMAN","HJ 001077 .H35  1994","X004568986","L'argent du roi : les finances sous François Ier /","Hamon, Philippe,",1994,FALSE
"99","ALDERMAN","HJ 001082 .B78  1986","X001293595","Gestionnaires et profiteurs de la révolution : l'administration des finances françaises de Louis XVI à Bonaparte /","Bruguière, Michel.",1986,FALSE
"100","ALDERMAN","HJ 001082 .L38","X030685463","Turgot : ou, Le mythe des réformes /","Laugier, Lucien.",1979,FALSE
"101","ALDERMAN","HJ 001188 .P3613  G84  2007","X030261614","Papal banking in Renaissance Rome : Benvenuto Olivieri and Paul III, 1534-1549 /","Guidi Bruscoli, Francesco.",2007,TRUE
"102","ALDERMAN","HJ 001208 .M36  2009","X030473411","History's greatest heist : the looting of Russia by the Bolsheviks /","McMeekin, Sean,",2009,FALSE
"103","ALDERMAN","HJ 001213 .E27  2012","X030845824","Capital, coercion, and postcommunist states /","Easter, Gerald,",2012,FALSE
"104","ALDERMAN","HJ 001242 .D74  2014","X031606988","Lending to the borrower from hell : debt, taxes, and default in the age of Philip II /","Drelichman, Mauricio.",2014,FALSE
"105","ALDERMAN","HJ 001301 .Z6  P64  1993","X002330131","The Politics of finance in developing countries /","",1993,FALSE
"106","ALDERMAN","HJ 001308 .F57  2010","X030744329","Fiscal reforms in the Middle East : VAT in the Gulf Cooperation Council /","",2010,FALSE
"107","ALDERMAN","HJ 001315 .P7  1966","X031945085","Control of public expenditure in India; a historical and analytical account of the administrative, audit and parliamentary processes.","Premchand, A.,",1966,FALSE
"108","ALDERMAN","HJ 001333 .B35  1995","X002613253","Finances in the early Raj : investments and the external sector /","Banerji, A. K. (Arun Kumar),",1995,FALSE
"109","ALDERMAN","HJ 001335 .I53  2017","X031806026","India's fiscal policy : prescriptions, pragmatics and practice /","",2017,FALSE
"110","ALDERMAN","HJ 001382 .A44  2009","X032058021","El costo del imperio asiático : la formación colonial de las islas Filipinas bajo el dominio español, 1565-1800 /","Alonso Álvarez, L.",2009,FALSE
"111","ALDERMAN","HJ 001382 .F73  1999","X031725357","Filipinas, la colonia más peculiar : la hacienda pública en la definición de la política colonial, 1762-1868 /","Fradera, Josep Maria.",1999,FALSE
"112","ALDERMAN","HJ 001391 .T32  2006","X004836794","Tackling Japan's fiscal challenges : strategies to cope with high public debt and population aging /","",2006,FALSE
"113","ALDERMAN","HJ 001394 .P67  1998","X004276800","Restoring Japan's economic growth /","Posen, Adam Simon.",1998,FALSE
"114","ALDERMAN","HJ 001400.5 .C4676  2010","X030943241","Chos?n hugi chaej?ng kwa sijang : ky?ngje ch'ejeron ?i ch?pk?n /","",2010,FALSE
"115","ALDERMAN","HJ 001402 .Z44  1984","X000870183","The magistrate's tael : rationalizing fiscal reform in eighteenth-century Ch?ing China /","Zelin, Madeleine.",1984,FALSE
"116","ALDERMAN","HJ 001403 .Z49  2000","X030792975","Wan Qing cai zheng yu she hui bian qian /","Zhou, Yumin,",2000,FALSE
"117","ALDERMAN","HJ 001404 .T39  1988  V.000002","X031974649","Dang dai Zhongguo cai zheng /","",1988,TRUE
"118","ALDERMAN","HJ 001408 .R45  2004","X004773705","Building local states : China during the republican and post-Mao eras /","Remick, Elizabeth J.,",2004,FALSE
"119","ALDERMAN","HJ 001412 .C45  V.000001","X031916641","Minguo cai zheng shi,","Jia, Shiyi,",1917,TRUE
"120","ALDERMAN","HJ 001414 .H6  1953","X031916636","Chung kung ts?ai chêng chieh p?ou.","Ho, Yu-wen.",1953,FALSE
"121","ALDERMAN","HJ 001438 .I78  2016","X031800836","Islamic finance : a catalyst for shared prosperity?","",2017,FALSE
"122","ALDERMAN","HJ 001441 .C37  2010","X030944627","Peace after civil war : the role of fiscal policy in post-conflict African economies /","Carmignani, Fabrizio.",2010,FALSE
"123","ALDERMAN","HJ 001456 .S85  2011","X030945152","The autumn of dictatorship : fiscal crisis and political change in Egypt under Mubarak /","Sulaym?n, Sam?r,",2011,FALSE
"124","ALDERMAN","HJ 001501 .I5  1998","X004187557","Oil and fiscal federalism in Nigeria : the political economy of resource allocation in a developing country /","Ikein, Augustine A.",1998,FALSE
"125","ALDERMAN","HJ 002005 .A63  001944 V.000002","X031942069","Materials on budgeting: an instrument of planning and management ...","American University (Washington, D.C.). School of Social Sciences and Public Affairs.",1944,TRUE
"126","ALDERMAN","HJ 002005 .G85  2010","X030743583","Comparative public budgeting : global perspectives on taxing and spending /","Guess, George M.",2010,FALSE
"127","ALDERMAN","HJ 002005 .L565  2004  V.000001","X004770819","Growing public : social spending and economic growth since the eighteenth century /","Lindert, Peter H.",2004,TRUE
"128","ALDERMAN","HJ 002005 .N48  1988","X001361313","New directions in budget theory /","",1988,FALSE
"129","ALDERMAN","HJ 002005 .W365  2010","X030763488","Legislatures and the budget process : the myth of fiscal control /","Wehner, Joachim,",2010,FALSE
"130","ALDERMAN","HJ 002009 .R43  2010","X030781646","The reality of budgetary reform in OECD nations : trajectories and consequences /","",2010,FALSE
"131","ALDERMAN","HJ 002050 .S28  1988","X001357497","Balanced budgets & American politics /","Savage, James D.,",1988,FALSE
"132","ALDERMAN","HJ 002051 .A5  I66  2003","X004703235","Why budgets matter : budget policy and American politics /","Ippolito, Dennis S.",2003,FALSE
"133","ALDERMAN","HJ 002051 .A777  2010","X030744853","America's long-term fiscal outlook /","",2010,FALSE
"134","ALDERMAN","HJ 002051 .B78  2004","X004768803","Restoring fiscal sanity : how to balance the budget /","",2004,FALSE
"135","ALDERMAN","HJ 002051 .C556  1994","X002480797","The budget puzzle : understanding federal spending /","Cogan, John F.",1994,FALSE
"136","ALDERMAN","HJ 002051 .F475  2005","X004810779","Congressional budgeting : a representational perspective /","Fisher, Patrick (Patrick Ivan)",2005,FALSE
"137","ALDERMAN","HJ 002051 .F483  2008","X030250211","Fiscal challenges : an interdisciplinary approach to budget policy /","",2008,FALSE
"138","ALDERMAN","HJ 002051 .G49  2016","X031730868","Democracy reinvented : participatory budgeting and civic innovation in America /","Gilman, Hollie Russon,",2016,FALSE
"139","ALDERMAN","HJ 002051 .K34  1997","X004106930","Budgeting democracy : state building and citizenship in America, 1890-1928 /","Kahn, Jonathan,",1997,FALSE
"140","ALDERMAN","HJ 002051 .K48  2003","X004769471","Deficit politics : the search for balance in American politics /","Kettl, Donald F.",2003,FALSE
"141","ALDERMAN","HJ 002051 .L45  2005","X004907297","Parties, rules, and the evolution of congressional budgeting /","LeLoup, Lance T.",2005,FALSE
"142","ALDERMAN","HJ 002051 .M46  2017","X031838586","The basics of public budgeting and financial management : a handbook for academics and practitioners /","Menifield, Charles,",2017,FALSE
"143","ALDERMAN","HJ 002051 .M49  2002","X004553039","Evolution of United States budgeting /","Meyer, Annette E.",2002,FALSE
"144","ALDERMAN","HJ 002051 .M655  1990","X001703630","Eisenhower versus 'the spenders' : the Eisenhower administration, the Democrats, and the budget, 1953-60 /","Morgan, Iwan W.",1990,FALSE
"145","ALDERMAN","HJ 002051 .M87  2009","X030457074","Understanding government budgets : a practical guide /","Musell, R. Mark.",2009,FALSE
"146","ALDERMAN","HJ 002051 .N167  1987","X002120074","Reagan and the States /","Nathan, Richard P.",1987,FALSE
"147","ALDERMAN","HJ 002051 .N46  2002","X004592106","Public budgeting /","Nice, David C.,",2002,FALSE
"148","ALDERMAN","HJ 002051 .P48  2004","X004803233","Running on empty : how the Democratic and Republican parties are bankrupting our future and what Americans can do about it /","Peterson, Peter G.",2004,FALSE
"149","ALDERMAN","HJ 002051 .S33  1990","X002039924","The capacity to budget /","Schick, Allen.",1990,FALSE
"150","ALDERMAN","HJ 002051 .S34","X000217871","Congress and money : budgeting, spending, and taxing /","Schick, Allen.",1980,FALSE
"151","ALDERMAN","HJ 002051 .S3424  1995","X002604248","The federal budget : politics, policy, process /","Schick, Allen.",1995,FALSE
"152","ALDERMAN","HJ 002051 .S3424  2000","X004415079","The federal budget : politics, policy, process /","Schick, Allen.",2000,FALSE
"153","ALDERMAN","HJ 002051 .S3424  2007","X030261874","The federal budget : politics, policy, process /","Schick, Allen.",2007,FALSE
"154","ALDERMAN","HJ 002051 .S475  1997","X004092780","Do deficits matter? /","Shaviro, Daniel N.",1997,FALSE
"155","ALDERMAN","HJ 002051 .S49  1984","X000775374","Politics and the budget : the struggle between the President and the Congress /","Shuman, Howard E.",1984,FALSE
"156","ALDERMAN","HJ 002051 .S748  2014","X031646142","Dead men ruling : how to restore fiscal freedom and rescue our future /","Steuerle, C. Eugene,",2014,FALSE
"157","ALDERMAN","HJ 002051 .W427  2012","X030848023","Red ink : inside the high-stakes politics of the federal budget /","Wessel, David.",2012,FALSE
"158","CLEMONS","HJ 002051 .W45  1989","X001824956","The deficit and the public interest : the search for responsible budgeting in the 1980s /","White, Joseph,",1989,FALSE
"159","CLEMONS","HJ 002051 .W483  1988","X001278511","The new politics of the budgetary process /","Wildavsky, Aaron B.",1988,FALSE
"160","ALDERMAN","HJ 002051 .W483  1997","X004190596","The new politics of the budgetary process /","Wildavsky, Aaron B.",1997,FALSE
"161","ALDERMAN","HJ 002052 .M368  1992","X002047998","The politics of budget control : Congress, the presidency, and the growth of the administrative state /","Marini, John A.",1992,FALSE
"162","ALDERMAN","HJ 002052 .O8  1977","X000133348","Federal budget policy /","Ott, David J.",1977,FALSE
"163","ALDERMAN","HJ 002053 .A1  B4  1999","X004253706","Creative politics: taxes and public goods in a federal system /","Beamer, Glenn,",1999,FALSE
"164","ALDERMAN","HJ 002053 .A1  B69  1996","X004698821","Balancing acts : the reality behind state balanced budget requirements /","Briffault, Richard.",1996,FALSE
"165","ALDERMAN","HJ 002053 .A1  H54  2003","X004657123","The price of progress : public services, taxation, and the American corporate state, 1877 to 1929 /","Higgens-Evenson, R. Rudy (Ronald Rudy),",2003,FALSE
"166","ALDERMAN","HJ 002053 .A1  K45  2011","X030744112","Performance budgeting for state and local government /","Kelly, Janet M.",2011,FALSE
"167","ALDERMAN","HJ 002053 .A1  T48  2001","X004554777","Policy and politics in state budgeting /","Thurmaier, Kurt M.,",2001,TRUE
"168","ALDERMAN","HJ 002056.7 .W498  2009","X031647249","Who decides the budget? : a political economy analysis of the budget process in Latin America /","",2009,FALSE
"169","ALDERMAN","HJ 002154.3 .S28  2013","X031621447","Reconstructing Iraq's budgetary institutions : coalition statebuilding after Saddam /","Savage, James D.,",2013,FALSE
"170","ALDERMAN","HJ 002169 .S87  2000","X004394906","Japan's budget politics : balancing domestic and international interests /","Suzuki, Takaaki.",2000,FALSE
"171","ALDERMAN","HJ 002250 .G56  2007","X004832527","Global debates about taxation /","",2007,FALSE
"172","ALDERMAN","HJ 002250 .L48  1988","X001364238","Of rule and revenue /","Levi, Margaret.",1988,FALSE
"173","ALDERMAN","HJ 002250 .W42  1986","X001319423","A history of taxation and expenditure in the Western world /","Webber, Carolyn.",1986,FALSE
"174","ALDERMAN","HJ 002261 .F57  2015","X031762036","Fiscal regimes and the political economy of premodern states /","",2015,FALSE
"175","ALDERMAN","HJ 002287 .E53  B7  1998","X004187073","The idea of property in seventeenth-century England : tithes and the individual /","Brace, Laura.",1998,FALSE
"176","ALDERMAN","HJ 002305 .B63  2012","X030945531","From optimal tax theory to tax policy : retrospective and prospective views /","Boadway, Robin W.,",2012,FALSE
"177","ALDERMAN","HJ 002305 .B64","X000218510","The power to tax : analytical foundations of a fiscal constitution /","Brennan, Geoffrey,",1980,FALSE
