Item Shelving Id,Item Call Number,Catalog Id,Item Library Code,Catalog Pub Year,Catalog Title,Catalog Author,Item Barcode,Item Collection,Item Status,Item Type,Item Created Date,Item Last Checkout Date,Item Lifetime Checkout,Item Lifetime Renewals,Item Lifetime Inhouse Uses,Item Legacy Total Charges,Number of Items
BJ 000010 .E8  A42  1966,BJ10 .E8 A42 1966,508888,ALDERMAN,1966,"Ethical culture fact book, 1876-1966.",American Ethical Union.,X000281223,STACKS,STACKS,BOOK,6/29/96,9/22/08,0,0,0,0,1
BJ 000010 .E8  M33  2008,BJ10 .E8 M33 2008,4786927,ALDERMAN,2008,"Reforming the moral subject : ethics and sexuality in Central Europe, 1890-1930 /","Matysik, Tracie.",X030466227,STACKS,STACKS,BOOK,10/28/08,10/27/11,0,0,0,1,1
BJ 000010 .E8  R3  1969,BJ10 .E8 R3 1969,1156475,ALDERMAN,1969,Toward common ground; the story of the ethical societies in the United States,"Radest, Howard B.,",X000620254,STACKS,STACKS,BOOK,6/29/96,5/7/11,0,0,3,12,1
BJ 000010 .M6  B8  1949,BJ10 .M6 B8 1949,1156476,ALDERMAN,1949,Remaking the world.,"Buchman, Frank,",X001993192,STACKS,STACKS,BOOK,6/29/96,4/24/00,0,0,0,4,1
BJ 000010 .M6  B8  1961,BJ10 .M6 B8 1961,810296,ALDERMAN,1961,Remaking the world; the speeches of Frank N. D. Buchman.,"Buchman, Frank,",X001818316,STACKS,STACKS,BOOK,6/29/96,4/22/05,0,0,0,5,1
BJ 000010 .M6  B834  1988,BJ10 .M6 B834 1988,1360585,ALDERMAN,1988,On the tail of a comet : the life of Frank Buchman /,"Lean, Garth.",X001604935,STACKS,STACKS,BOOK,6/30/96,11/27/17,0,0,0,2,1
BJ 000010 .M6  D7  1965,BJ10 .M6 D7 1965,1156477,ALDERMAN,1965,The mystery of Moral Re-armament; a study of Frank Buchman and his movement.,"Driberg, Tom,",X001818314,STACKS,STACKS,BOOK,6/29/96,7/22/16,1,0,1,9,1
BJ 000010 .M6  E5  1967,BJ10 .M6 E5 1967,1156478,ALDERMAN,1967,Moral re-armament; what is it?,"Entwistle, Basil.",X001993190,STACKS,STACKS,BOOK,6/29/96,4/22/05,0,0,1,5,1
BJ 000010 .M6  H63  1951,BJ10 .M6 H63 1951,624816,ALDERMAN,1951,The world rebuilt; the true story of Frank Buchman and the achievements of moral re-armament.,"Howard, Peter,",X000401035,STACKS,STACKS,BOOK,6/29/96,4/24/00,0,0,0,4,1
BJ 000010 .M6  P3  1954,BJ10 .M6 P3 1954,1156482,ALDERMAN,1954,"Remaking men,","Campbell, Paul B.",X001818312,STACKS,STACKS,BOOK,6/29/96,3/21/00,0,0,0,4,1
BJ 001005 .F67  1990,BJ1005 .F67 1990,1933897,ALDERMAN,1990,The elements of moral philosophy : in three books /,"Fordyce, David,",X002049626,STACKS,STACKS,BOOK,6/30/96,6/17/10,0,0,0,4,1
BJ 001005 .H8  1957,BJ1005 .H8 1957,571899,ALDERMAN,1957,An inquiry concerning the principles of morals; with a supplement: A dialogue.,"Hume, David,",X000742956,STACKS,STACKS,BOOK,6/29/96,6/17/10,0,0,1,18,1
BJ 001005 .H8  197,BJ1005 .H8 197,1156120,ALDERMAN,1912,An enquiry concerning the principles of morals.,"Hume, David,",1156120-1001,STACKS,STACKS,BOOK,6/29/96,1/1/00,0,0,0,0,1
BJ 001005 .H87  1973,BJ1005 .H87 1973,619480,ALDERMAN,1973,"Francis Hutcheson: an inquiry concerning beauty, order, harmony, design.","Hutcheson, Francis,",X000200676,STACKS,STACKS,BOOK,6/29/96,6/11/17,2,24,3,37,1
BJ 001005 .H876  1971,BJ1005 .H876 1971,1156121,ALDERMAN,1971,Illustrations on the moral sense,"Hutcheson, Francis,",X000431709,STACKS,STACKS,BOOK,6/29/96,10/27/04,0,0,0,6,1
BJ 001005 .K2  1976,BJ1005 .K2 1976,423035,ALDERMAN,1976,Essays on the principles or morality and natural religion : (1758) /,"Kames, Henry Home,",X000460077,STACKS,STACKS,BOOK,6/29/96,6/5/17,1,4,0,20,1
BJ 001005 .K2  1993,BJ1005 .K2 1993,2502959,ALDERMAN,1993,Essays on the principles of morality and natural religion /,"Kames, Henry Home,",X002715476,STACKS,STACKS,BOOK,7/1/96,9/3/10,0,0,2,5,1
BJ 001005 .O56  1997,BJ1005 .O56 1997,2766346,ALDERMAN,1997,On moral sentiments : contemporary responses to Adam Smith /,,X006048143,STACKS,STACKS,BOOK,2/10/98,5/11/14,1,19,3,28,1
BJ 001005 .P2  1793,BJ1005 .P2 1793,779459,ALDERMAN,1793,The principles of moral and political philosophy. /,"Paley, William,",X000460044,STACKS,STACKS,BOOK,6/29/96,1/1/00,0,0,0,2,1
BJ 001005 .P2  1799  V.000002,BJ1005 .P2 1799 v.2,762584,ALDERMAN,1799,The principles of moral and political philosophy.,"Paley, William,",X001324995,STACKS,STACKS,BOOK,6/29/96,3/17/98,0,0,0,6,1
BJ 001005 .P2  1806,BJ1005 .P2 1806,767015,ALDERMAN,1806,The principles of moral and political philosophy /,"Paley, William,",X000391616,STACKS,STACKS,BOOK,6/29/96,6/26/15,0,0,0,13,1
BJ 001005 .P2  1845,BJ1005 .P2 1845,1156124,ALDERMAN,1845,Paley's moral and political philosophy.,"Paley, William,",X000338010,STACKS,STACKS,BOOK,6/29/96,6/26/15,0,0,0,6,1
BJ 001005 .S59  1948,BJ1005 .S59 1948,1156125,ALDERMAN,1948,Adam Smith's moral and political philosophy;,"Smith, Adam,",X000214116,STACKS,STACKS,BOOK,6/29/96,11/15/17,0,1,0,18,1
BJ 001005 .S6  1853,BJ1005 .S6 1853,1156127,ALDERMAN,1853,The theory of moral sentiments;,"Smith, Adam,",X004840744,STACKS,STACKS,BOOK,6/29/96,4/21/17,2,20,2,53,1
BJ 001005 .S6  1976,BJ1005 .S6 1976,307592,CLEMONS,1976,The theory of moral sentiments /,"Smith, Adam,",X000665834,BY-REQUEST,BY-REQUEST,BOOK,6/28/96,10/9/18,5,5,9,154,1
BJ 001005 .S65  2002,BJ1005 .S65 2002,3826820,ALDERMAN,2002,The theory of moral sentiments /,"Smith, Adam,",X004590988,STACKS,CHECKEDOUT,BOOK,4/2/02,3/18/19,6,15,6,73,1
BJ 001005 .W5  1822,BJ1005 .W5 1822,819329,ALDERMAN,1822,Lectures on moral philosophy; carefully revised ... to which is added ... An address to the students of the senior class and Letters on education and marriage.,"Witherspoon, John,",X001134566,STACKS,STACKS,BOOK,6/29/96,5/23/16,1,0,0,2,1
BJ 001005 .W5  1982,BJ1005 .W5 1982,216786,ALDERMAN,1982,An annotated edition of Lectures on moral philosophy /,"Witherspoon, John,",X000402640,STACKS,STACKS,BOOK,6/28/96,5/23/16,1,0,2,15,1
BJ 001006 .B9  1855,BJ1006 .B9 1855,1220128,ALDERMAN,1855,"Bishop Butler's ethical discourses; to which are added some remains, hitherto unpublished. Prepared as a text book in moral philosophy;","Butler, Joseph,",X000918354,STACKS,STACKS,BOOK,6/30/96,6/7/05,0,0,0,1,1
BJ 001006 .C5  1847,BJ1006 .C5 1847,1156129,ALDERMAN,1852,Sketches of moral and mental philosophy: their connection with each other; and their bearings on doctrinal and practical Christianity.,"Chalmers, Thomas,",X001597456,STACKS,STACKS,BOOK,6/29/96,9/23/08,0,0,0,2,1
BJ 001006 .H6  1853,BJ1006 .H6 1853,800109,ALDERMAN,1853,A system of moral science.,"Hickok, Laurens P. (Laurens Perseus),",X000368469,STACKS,STACKS,BOOK,6/29/96,1/1/00,0,0,0,0,1
BJ 001006 .H6  1880,BJ1006 .H6 1880,5311738,ALDERMAN,1880,A system of moral science /,"Hickok, Laurens P. (Laurens Perseus),",X030925595,STACKS,STACKS,BOOK,3/18/11,1/1/00,0,0,0,0,1
BJ 001006 .W5  1845  V.000001,BJ1006 .W5 1845 v.1,1156133,ALDERMAN,1845,"The elements of morality, including polity.","Whewell, William,",X001134444,STACKS,STACKS,BOOK,6/29/96,8/24/96,0,0,0,1,1
BJ 001006 .W5  1845  V.000002,BJ1006 .W5 1845 v.2,1156133,ALDERMAN,1845,"The elements of morality, including polity.","Whewell, William,",X001134445,STACKS,STACKS,BOOK,6/29/96,1/1/00,0,0,0,1,1
BJ 001006 .W5  1852  V.000001,BJ1006 .W5 1852 v.1,798096,ALDERMAN,1852,"The elements of morality, including polity.","Whewell, William,",X002449205,STACKS,STACKS,BOOK,6/29/96,9/23/08,0,0,0,1,1
BJ 001006 .W5  1852  V.000002,BJ1006 .W5 1852 v.2,798096,ALDERMAN,1852,"The elements of morality, including polity.","Whewell, William,",X002449207,STACKS,STACKS,BOOK,6/29/96,9/23/08,0,0,0,3,1
BJ 001008 .B8  1911,BJ1008 .B8 1911,805089,ALDERMAN,1911,"Ethical studies,","Bradley, F. H. (Francis Herbert),",X001533373,STACKS,STACKS,BOOK,6/29/96,6/26/15,0,0,1,1,1
BJ 001008 .B8  1962,BJ1008 .B8 1962,801190,ALDERMAN,1962,Ethical studies /,"Bradley, F. H. (Francis Herbert),",X000306711,STACKS,STACKS,BOOK,6/29/96,9/23/08,0,0,4,10,1
BJ 001008 .D48  1976,BJ1008 .D48 1976,389532,ALDERMAN,1976,"Lectures on psychological and political ethics, 1898 /","Dewey, John,",X000314019,STACKS,STACKS,BOOK,6/28/96,5/3/01,0,0,2,4,1
BJ 001008 .G64  1884,BJ1008 .G64 1884,1157176,ALDERMAN,1884,"Prolegomena to ethics,","Green, Thomas Hill,",X000920845,STACKS,STACKS,BOOK,6/29/96,7/1/02,0,0,0,2,1
BJ 001008 .G64  1890,BJ1008 .G64 1890,803852,ALDERMAN,1890,Prolegomena to ethics /,"Green, Thomas Hill,",X001330109,STACKS,STACKS,BOOK,6/29/96,1/1/00,0,0,0,0,1
BJ 001008 .G64  1969,BJ1008 .G64 1969,607318,ALDERMAN,1969,Prolegomena to ethics.,"Green, Thomas Hill,",X000209969,STACKS,STACKS,BOOK,6/29/96,1/18/99,0,0,0,2,1
BJ 001008 .G64  2003,BJ1008 .G64 2003,4025223,ALDERMAN,2003,Prolegomena to ethics /,"Green, Thomas Hill,",X004744973,STACKS,STACKS,BOOK,4/22/04,8/25/05,0,0,1,1,1
BJ 001008 .G76  1991,BJ1008 .G76 1991,1959267,ALDERMAN,1991,Fragments on ethical subjects : being a selection from his posthumous papers /,"Grote, George,",X002110463,STACKS,STACKS,BOOK,6/30/96,9/23/08,0,0,0,0,1
BJ 001008 .H7,BJ1008 .H7,812246,ALDERMAN,1862,"Lectures on moral science : delivered before the Lowell Institute, Boston /","Hopkins, Mark,",X000298222,STACKS,STACKS,BOOK,6/29/96,6/26/15,0,0,0,4,1
BJ 001008 .M3  1879,BJ1008 .M3 1879,1157178,ALDERMAN,1879,Is life worth living?,"Mallock, W. H. (William Hurrell),",X000307734,STACKS,STACKS,BOOK,6/29/96,6/26/15,0,0,2,11,1
BJ 001008 .P8  1885,BJ1008 .P8 1885,1157180,ALDERMAN,1885,"The elements of moral science,","Porter, Noah,",X000368470,STACKS,STACKS,BOOK,6/29/96,9/23/08,0,0,0,0,1
BJ 001008 .S4  1898,BJ1008 .S4 1898,804824,ALDERMAN,1898,A study of ethical principles /,"Seth, James,",X000418594,STACKS,STACKS,BOOK,6/29/96,6/26/15,0,0,0,0,1
BJ 001008 .S5  1874,BJ1008 .S5 1874,1157182,ALDERMAN,1874,"The methods of ethics,","Sidgwick, Henry,",X001730365,STACKS,STACKS,BOOK,6/29/96,9/3/10,0,0,2,8,1
BJ 001008 .S5  1907A,BJ1008 .S5 1907a,803860,ALDERMAN,1907,The methods of ethics /,"Sidgwick, Henry,",X002495997,STACKS,STACKS,BOOK,6/29/96,7/2/15,1,5,1,64,1
BJ 001008 .S5  1981,BJ1008 .S5 1981,125873,ALDERMAN,1981,The methods of ethics /,"Sidgwick, Henry,",X001064970,STACKS,STACKS,BOOK,6/28/96,6/12/18,4,5,2,78,1
BJ 001008 .S82  1907,BJ1008 .S82 1907,804231,ALDERMAN,1907,The science of ethics;,"Stephen, Leslie,",X000413354,STACKS,STACKS,BOOK,6/29/96,1/1/00,0,0,0,0,1
BJ 001008 .S82  1991,BJ1008 .S82 1991,1964821,ALDERMAN,1991,The science of ethics /,"Stephen, Leslie,",X002117582,STACKS,STACKS,BOOK,6/30/96,10/23/13,2,3,1,5,1
BJ 001008 .W47  1912  V.000001,BJ1008 .W47 1912 v.1,575195,ALDERMAN,1912,"The origin and development of the moral ideas,","Westermarck, Edward,",X000400228,STACKS,STACKS,BOOK,6/29/96,8/24/96,0,0,0,1,1
BJ 001008 .W47  1912  V.000002,BJ1008 .W47 1912 v.2,575195,ALDERMAN,1912,"The origin and development of the moral ideas,","Westermarck, Edward,",X000140315,STACKS,STACKS,BOOK,6/29/96,10/19/97,0,0,0,1,1
BJ 000101 .F4,BJ101 .F4,1156040,ALDERMAN,1958,Moral values in the ancient world.,"Ferguson, John,",X000233834,STACKS,STACKS,BOOK,6/29/96,5/28/08,0,0,1,3,1
BJ 000101 .H35  1978,BJ101 .H35 1978,338548,ALDERMAN,1978,The sources of Western morality : from primitive society through the beginnings of Christianity /,"Harkness, Georgia Elma,",X000150762,STACKS,STACKS,BOOK,6/28/96,4/28/10,0,0,0,10,1
BJ 000101 .S44  2009,BJ101 .S44 2009,4815209,ALDERMAN,2009,From Protagoras to Aristotle : essays in ancient moral philosophy /,"Segvic, Heda,",X030474459,STACKS,STACKS,BOOK,1/27/09,6/10/09,0,0,1,2,1
BJ 000101 .S56  2007,BJ101 .S56 2007,4610705,ALDERMAN,2007,Remastering morals with Aristotle and Confucius /,"Sim, May,",X030101513,STACKS,STACKS,BOOK,7/24/07,6/5/17,1,11,1,22,1
BJ 000101 .V43  1990,BJ101 .V43 1990,1663805,ALDERMAN,1990,L'etica degli antichi /,"Vegetti, Mario.",X001783198,STACKS,STACKS,BOOK,6/30/96,9/23/08,0,0,0,0,1
BJ 001011 .A34  1924,BJ1011 .A34 1924,4380699,ALDERMAN,1924,The reconstruction of the spiritual ideal /,"Adler, Felix,",X030119605,STACKS,CHECKEDOUT,BOOK,7/17/06,10/17/18,1,3,0,4,1
BJ 001011 .A34  1979,BJ1011 .A34 1979,233866,ALDERMAN,1979,"The reconstruction of the spiritual ideal : Hibbert lectures, delivered in Manchester College, Oxford, May 1923 /","Adler, Felix,",X000139521,STACKS,STACKS,BOOK,6/28/96,9/23/08,0,0,0,2,1
BJ 001011 .A65  2005,BJ1011 .A65 2005,4292000,ALDERMAN,2005,"Human life, action and ethics : essays by G.E.M. Anscombe /","Anscombe, G. E. M. (Gertrude Elizabeth Margaret)",X004875959,STACKS,CHECKEDOUT,BOOK,7/12/05,2/6/19,3,53,0,67,1
BJ 001011 .B25  1958,BJ1011 .B25 1958,571971,ALDERMAN,1958,The moral point of view.; a rational basis of ethics.,"Baier, Kurt.",X000027047,STACKS,STACKS,BOOK,6/29/96,12/9/11,0,0,1,5,1
BJ 001011 .B3  1933,BJ1011 .B3 1933,799037,ALDERMAN,1933,"Ethics; an introduction to the philosophy of moral values,","Barrett, Clifford,",X000987283,STACKS,STACKS,BOOK,6/29/96,4/21/02,0,0,0,6,1
BJ 001011 .B7  1969,BJ1011 .B7 1969,815090,ALDERMAN,1969,Moral laws.,"Brightman, Edgar Sheffield,",X001650443,STACKS,STACKS,BOOK,6/29/96,1/1/00,0,0,0,0,1
BJ 001011 .C27  1947,BJ1011 .C27 1947,1157187,ALDERMAN,1947,Ethical and policical thinking.,"Carritt, E. F. (Edgar Frederick),",X001689898,STACKS,STACKS,BOOK,6/29/96,10/30/98,0,0,2,4,1
BJ 001011 .C3  1928,BJ1011 .C3 1928,1157188,ALDERMAN,1928,"The theory of morals; an introduction to ethical philosophy,","Carritt, E. F. (Edgar Frederick),",X000470704,STACKS,STACKS,BOOK,6/29/96,1/1/00,0,0,0,0,1
BJ 001011 .C3  1930,BJ1011 .C3 1930,764452,ALDERMAN,1930,The theory of morals : an introduction to ethical philosophy /,"Carritt, E. F. (Edgar Frederick),",X000833822,STACKS,STACKS,BOOK,6/29/96,9/23/08,0,0,0,0,1
BJ 001011 .C33  1954,BJ1011 .C33 1954,1157189,ALDERMAN,1954,An elementary ethics.,"Castell, Alburey,",X001586356,STACKS,STACKS,BOOK,6/29/96,1/1/00,0,0,0,0,1
BJ 001011 .D3  1929,BJ1011 .D3 1929,1157190,ALDERMAN,1929,"Tolstoy and Nietzsche; a problem in biographical ethics,","Davis, Helen E. (Helen Edna),",X000827716,STACKS,STACKS,BOOK,6/29/96,1/1/00,0,0,0,0,1
BJ 001011 .D48  1980,BJ1011 .D48 1980,205386,ALDERMAN,1980,Theory of the moral life /,"Dewey, John,",X000446972,STACKS,STACKS,BOOK,6/28/96,12/10/11,0,0,2,12,1
BJ 001011 .E34  1955,BJ1011 .E34 1955,572198,ALDERMAN,1955,The Logic of moral discourse.,"Edwards, Paul,",X000229802,STACKS,STACKS,BOOK,6/29/96,1/1/00,0,0,0,0,1
BJ 001011 .E8  1954,BJ1011 .E8 1954,1157193,ALDERMAN,1954,"Ideals of life; an introduction to ethics and the humanities, with readings.","Everett, Millard Spencer,",X000307029,STACKS,STACKS,BOOK,6/29/96,1/1/00,0,0,0,0,1
BJ 001011 .E84  1959,BJ1011 .E84 1959,1157194,ALDERMAN,1959,Second thoughts in moral philosophy.,"Ewing, A. C. (Alfred Cyril),",X000962913,STACKS,STACKS,BOOK,6/29/96,5/9/15,1,3,0,4,1
BJ 001011 .F5  1932,BJ1011 .F5 1932,1157195,ALDERMAN,1932,"Moral theory, an introduction to ethics,","Field, G. C. (Guy Cromwell),",X000833625,STACKS,STACKS,BOOK,6/29/96,1/1/00,0,0,0,0,1
BJ 001011 .G3  1940,BJ1011 .G3 1940,1157198,ALDERMAN,1940,"Wisdom in conduct; an introduction to ethics,","Garnett, Christopher Browne,",X000754893,STACKS,STACKS,BOOK,6/29/96,1/1/00,0,0,0,0,1
BJ 001011 .G32  1953,BJ1011 .G32 1953,1157199,ALDERMAN,1953,A modern introduction to ethics.,"Garvin, Lucius,",X000754887,STACKS,STACKS,BOOK,6/29/96,1/1/00,0,0,0,0,1
BJ 001011 .H2  1902,BJ1011 .H2 1902,1157200,ALDERMAN,1902,The moral law;,"Hamilton, Edward John,",X000755092,STACKS,STACKS,BOOK,6/29/96,1/1/00,0,0,0,0,2
BJ 001011 .H2  1902,BJ1011 .H2 1902,1157200,ALDERMAN,1902,The moral law;,"Hamilton, Edward John,",X030756366,STACKS,STACKS,BOOK,7/20/10,1/1/00,0,0,0,0,1
BJ 001011 .K5  1933,BJ1011 .K5 1933,290208,ALDERMAN,1933,"The threshold of ethics,","Kirk, Kenneth E. (Kenneth Escott),",X001109933,STACKS,STACKS,BOOK,6/28/96,9/23/08,0,0,0,14,1
BJ 001011 .L33  1935,BJ1011 .L33 1935,1157204,ALDERMAN,1935,"An enquiry into moral notions,","Laird, John,",X000962939,STACKS,CHECKEDOUT,BOOK,6/29/96,5/9/15,0,3,0,4,1
BJ 001011 .M27  1955,BJ1011 .M27 1955,1157206,ALDERMAN,1955,The phenomenology of moral experience.,"Mandelbaum, Maurice,",X002178547,STACKS,STACKS,BOOK,6/29/96,2/26/99,0,0,0,5,1
BJ 001011 .M6  1901,BJ1011 .M6 1901,1157207,ALDERMAN,1901,"Ethics, descriptive and explanatory,","Mezes, Sidney Edward,",X000385788,STACKS,STACKS,BOOK,6/29/96,1/1/00,0,0,0,0,1
BJ 001011 .M69  1959,BJ1011 .M69 1959,1157208,ALDERMAN,1959,A modern introduction to moral philosophy.,"Montefiore, Alan.",X001179216,STACKS,STACKS,BOOK,6/29/96,1/1/00,0,0,0,0,1
BJ 001011 .M7  1912,BJ1011 .M7 1912,1157209,ALDERMAN,1912,"Ethics,","Moore, G. E. (George Edward),",X000368929,STACKS,STACKS,BOOK,6/29/96,2/9/12,0,3,0,7,1
BJ 001011 .M7  1961,BJ1011 .M7 1961,803044,ALDERMAN,1961,Ethics /,"Moore, G. E. (George Edward),",X000853680,STACKS,STACKS,BOOK,6/29/96,1/1/00,0,0,0,1,1
BJ 001011 .M7  1963,BJ1011 .M7 1963,818108,ALDERMAN,1963,Ethics.,"Moore, G. E. (George Edward),",X000303840,STACKS,STACKS,BOOK,6/29/96,9/23/08,0,0,1,5,1
BJ 001011 .M7  1963,BJ1011 .M7 1963,818108,ALDERMAN,1963,Ethics.,"Moore, G. E. (George Edward),",X000774307,STACKS,STACKS,BOOK,6/29/96,8/25/96,0,0,0,4,1
BJ 001011 .M7  1965,BJ1011 .M7 1965,469164,CLEMONS,1965,Ethics.,"Moore, G. E. (George Edward),",X000005007,BY-REQUEST,BY-REQUEST,BOOK,6/29/96,6/23/08,0,0,0,8,1
BJ 001011 .M77  2002,BJ1011 .M77 2002,3882260,ALDERMAN,2002,Moral writings /,"Prichard, H. A. (Harold Arthur),",X004624640,STACKS,STACKS,BOOK,8/28/02,2/8/09,0,0,0,7,1
BJ 001011 .N68  1961,BJ1011 .N68 1961,796468,ALDERMAN,1961,Ethics.,"Nowell-Smith, P. H. (Patrick Horace),",X000027038,STACKS,STACKS,BOOK,6/29/96,6/26/18,1,0,0,3,1
BJ 001011 .O55  1948,BJ1011 .O55 1948,1157210,ALDERMAN,1948,Ethics for the atomic age.,"O'Neill, Ana María.",X001611474,STACKS,STACKS,BOOK,6/29/96,9/23/08,0,0,0,1,1
BJ 001011 .P3  1927,BJ1011 .P3 1927,1157211,ALDERMAN,1927,"The good will, a study in the coherence theory of goodness,","Paton, H. J. (Herbert James),",X000985602,STACKS,STACKS,BOOK,6/29/96,1/1/00,0,0,0,0,1
BJ 001011 .R2  1924  V.000001,BJ1011 .R2 1924 v.1,1157213,ALDERMAN,1924,"The theory of good and evil; a treatise on moral philosophy,","Rashdall, Hastings,",X000092279,STACKS,STACKS,BOOK,6/29/96,6/8/09,0,0,1,3,1
BJ 001011 .R2  1924  V.000002,BJ1011 .R2 1924 v.2,1157213,ALDERMAN,1924,"The theory of good and evil; a treatise on moral philosophy,","Rashdall, Hastings,",X000417493,STACKS,CHECKEDOUT,BOOK,6/29/96,9/16/18,1,3,0,12,1
BJ 001011 .R3  1920,BJ1011 .R3 1920,1157214,ALDERMAN,1920,Ethics and natural law;,"Raymond, George Lansing,",X002220566,STACKS,STACKS,BOOK,6/29/96,1/1/00,0,0,0,3,1
BJ 001011 .R75,BJ1011 .R75,308178,ALDERMAN,1939,"Foundations of ethics; the Gifford lectures delivered in the University of Aberdeen, 1935-6,","Ross, W. D. (William David),",X000150564,STACKS,CHECKEDOUT,BOOK,6/28/96,3/2/19,3,3,1,20,2
BJ 001011 .R75,BJ1011 .R75,308178,CLEMONS,1939,"Foundations of ethics; the Gifford lectures delivered in the University of Aberdeen, 1935-6,","Ross, W. D. (William David),",X000150565,BY-REQUEST,BY-REQUEST,BOOK,6/28/96,12/22/10,0,0,2,10,1
BJ 001011 .R87  1955,BJ1011 .R87 1955,1157215,ALDERMAN,1955,Human society in ethics and politics.,"Russell, Bertrand,",X001120700,STACKS,STACKS,BOOK,6/29/96,1/1/00,0,0,0,0,1
BJ 001011 .S35  1936,BJ1011 .S35 1936,1157216,ALDERMAN,1936,"Unconventional ethics; the ethics of tomorrow; a psychologico-ethical study of human parasitism, its effects, causes and cure; and a philosophy of human life and aspirations based thereupon,","Schwarz, Osias L.,",X000963104,STACKS,STACKS,BOOK,6/29/96,1/1/00,0,0,0,0,2
BJ 001011 .S5  1928,BJ1011 .S5 1928,1157217,ALDERMAN,1928,"Ethics,","Sharp, Frank Chapman,",X000470728,STACKS,STACKS,BOOK,6/29/96,1/1/00,0,0,0,1,1
BJ 001011 .S55  1971,BJ1011 .S55 1971,540343,ALDERMAN,1971,"Generalization in ethics; an essay in the logic of ethics, with the rudiments of a system of moral philosophy.","Singer, Marcus George,",X000043317,STACKS,STACKS,BOOK,6/29/96,9/23/08,0,0,1,3,1
BJ 001011 .S6  1948,BJ1011 .S6 1948,1157219,ALDERMAN,1948,"Constructive ethics,","Smith, Thomas Vernor,",X000963079,STACKS,STACKS,BOOK,6/29/96,1/1/00,0,0,0,0,1
BJ 001011 .S78,BJ1011 .S78,1157220,ALDERMAN,1973,Studies in ethics : essays /,,X000383433,STACKS,STACKS,BOOK,6/29/96,2/20/18,1,0,1,1,1
BJ 001011 .T18  V.000001,BJ1011 .T18 v.1,1157221,ALDERMAN,1930,The faith of a moralist;,"Taylor, A. E. (Alfred Edward),",X000501942,STACKS,STACKS,BOOK,6/29/96,1/1/00,0,0,0,1,1
BJ 001011 .T18  V.000001-000002,BJ1011 .T18 v.1-2,1157221,ALDERMAN,1930,The faith of a moralist;,"Taylor, A. E. (Alfred Edward),",X000424652,STACKS,STACKS,BOOK,5/9/01,9/3/10,0,0,0,0,1
BJ 001011 .T18  V.000002,BJ1011 .T18 v.2,1157221,ALDERMAN,1930,The faith of a moralist;,"Taylor, A. E. (Alfred Edward),",X000457976,STACKS,STACKS,BOOK,6/29/96,1/1/00,0,0,0,1,1
BJ 001011 .T75  1955,BJ1011 .T75 1955,815723,ALDERMAN,1955,Ethics.,"Tsanoff, Radoslav Andrea,",X000958954,STACKS,STACKS,BOOK,6/29/96,9/23/08,0,0,0,0,2
BJ 001011 .T762  1992,BJ1011 .T762 1992,1963696,ALDERMAN,1992,Selected writings of James Hayden Tufts /,"Tufts, James Hayden,",X002087562,STACKS,STACKS,BOOK,6/30/96,1/1/00,0,0,0,0,1
BJ 001011 .T77,BJ1011 .T77,1157224,ALDERMAN,1938,"Past and future of ethics,","Tuker, M. A. R. (Mildred Anna Rosalie)",X002220544,STACKS,STACKS,BOOK,6/29/96,1/1/00,0,0,0,1,1
BJ 001011 .V5  1950,BJ1011 .V5 1950,1157225,ALDERMAN,1950,The moral life and the ethical life.,"Vivas, Eliseo.",X000876393,STACKS,STACKS,BOOK,6/29/96,10/1/15,1,0,0,1,1
BJ 001011 .W7  1929,BJ1011 .W7 1929,1157226,ALDERMAN,1929,"General introduction to ethics,","Wright, William Kelley,",X000502990,STACKS,STACKS,BOOK,6/29/96,1/1/00,0,0,0,0,1
BJ 001012 .A29  1991,BJ1012 .A29 1991,1874841,ALDERMAN,1991,"Desires, right & wrong : the ethics of enough /","Adler, Mortimer Jerome,",X002039408,STACKS,STACKS,BOOK,6/30/96,5/14/13,1,2,1,11,1
BJ 001012 .A3,BJ1012 .A3,3482164,ALDERMAN,1970,The time of our lives; the ethics of common sense,"Adler, Mortimer Jerome,",X000885475,STACKS,STACKS,BOOK,6/29/96,11/5/12,1,0,0,4,1
BJ 001012 .A37  1978,BJ1012 .A37 1978,338424,ALDERMAN,1978,Reason and conduct : new bearings in moral philosophy /,"Aiken, Henry D. (Henry David),",X000055031,STACKS,STACKS,BOOK,6/28/96,9/23/08,0,0,0,51,1
BJ 001012 .A445  2014,BJ1012 .A445 2014,6416651,ALDERMAN,2014,Ethics as scales of forms /,"Allen, R. T.,",X031654840,STACKS,STACKS,BOOK,10/8/14,1/1/00,0,0,0,0,1
BJ 001012 .A46  1998,BJ1012 .A46 1998,2786001,ALDERMAN,1998,Exploring ethics : a traveller's tale /,"Almond, Brenda.",X006068921,STACKS,STACKS,BOOK,4/14/98,6/21/99,0,0,0,2,1
BJ 001012 .A465  1990,BJ1012 .A465 1990,1788926,ALDERMAN,1990,The realizations of the future : an inquiry into the authority of praxis /,"Allan, George,",X001857243,STACKS,STACKS,BOOK,6/30/96,5/14/97,0,0,1,2,1
BJ 001012 .A47  1987,BJ1012 .A47 1987,765838,ALDERMAN,1987,Moral concerns /,"Almond, Brenda.",X001284456,STACKS,STACKS,BOOK,6/29/96,1/1/00,0,0,1,0,1
BJ 001012 .A64  2001,BJ1012 .A64 2001,3820562,ALDERMAN,2001,"The Response of discourse ethics to the moral challenge of the human situation as such and especially today : Mercier lectures, Louvain-la-Neuve, March 1999 /","Apel, Karl-Otto.",X004587803,STACKS,STACKS,BOOK,4/11/02,1/1/00,0,0,0,0,1
BJ 001012 .A66  1988,BJ1012 .A66 1988,1302878,ALDERMAN,1988,Applied ethics and ethical theory /,,X001458635,STACKS,STACKS,BOOK,6/30/96,6/1/12,1,2,3,57,1
BJ 001012 .A68  1991,BJ1012 .A68 1991,1881409,ALDERMAN,1991,Applied philosophy : morals and metaphysics in contemporary debate /,,X002042724,STACKS,STACKS,BOOK,6/30/96,4/3/10,0,0,1,5,1
BJ 001012 .A85  1987,BJ1012 .A85 1987,782776,ALDERMAN,1987,A theory of value and obligation /,"Attfield, Robin.",X001218389,STACKS,STACKS,BOOK,6/29/96,1/1/00,0,0,1,1,1
BJ 001012 .A86  1995,BJ1012 .A86 1995,2536583,ALDERMAN,1995,"Value, obligation, and meta-ethics /","Attfield, Robin.",X004066011,STACKS,STACKS,BOOK,7/1/96,5/2/15,1,0,0,12,1
BJ 001012 .A93  1997,BJ1012 .A93 1997,2742524,ALDERMAN,1997,Moral knowledge and ethical character /,"Audi, Robert,",X004145221,STACKS,STACKS,BOOK,12/10/97,6/13/11,0,0,1,21,1
BJ 001012 .B33  2007,BJ1012 .B33 2007,4632483,ALDERMAN,2007,The ethics toolkit : a compendium of ethical concepts and methods /,"Baggini, Julian.",X030275806,STACKS,STACKS,BOOK,9/19/07,11/7/11,0,0,0,2,2
BJ 001012 .B34,BJ1012 .B34,3668422,ALDERMAN,1974,"Ethics as a behavioral science,","Bahm, Archie J.",X000425106,STACKS,STACKS,BOOK,6/29/96,1/1/00,0,0,0,2,1
BJ 001012 .B342,BJ1012 .B342,1297801,ALDERMAN,1980,Why be moral? /,"Bahm, Archie J.",X030120275,STACKS,STACKS,BOOK,7/25/06,1/1/00,0,0,1,0,1
BJ 001012 .B36  1979,BJ1012 .B36 1979,305330,ALDERMAN,1979,Moral scepticism and moral knowledge /,"Bambrough, Renford.",X000142905,STACKS,STACKS,BOOK,6/28/96,3/26/07,0,0,2,38,2
BJ 001012 .B36  1979B,BJ1012 .B36 1979b,252106,ALDERMAN,1979,Moral scepticism and moral knowledge /,"Bambrough, Renford.",X000166526,STACKS,STACKS,BOOK,6/28/96,3/27/02,0,0,1,8,1
BJ 001012 .B363,BJ1012 .B363,218365,ALDERMAN,1981,Moral norms and moral order : the philosophy of human affairs /,"Banner, William Augustus.",X000218187,STACKS,STACKS,BOOK,6/28/96,1/1/00,0,0,1,1,1
BJ 001012 .B375  2001,BJ1012 .B375 2001,3723644,ALDERMAN,2001,The bases of ethics /,,X004477560,STACKS,STACKS,BOOK,6/5/01,3/30/13,1,1,0,17,1
BJ 001012 .B38,BJ1012 .B38,220820,ALDERMAN,1981,Toward a reformulation of natural law /,"Battaglia, Anthony.",X000223356,STACKS,STACKS,BOOK,6/28/96,3/27/98,0,0,0,3,1
BJ 001012 .B422  1986,BJ1012 .B422 1986,92653,ALDERMAN,1986,Reciprocity /,"Becker, Lawrence C.",X001058813,STACKS,STACKS,BOOK,6/28/96,6/15/16,0,5,4,31,1
BJ 001012 .B424  1978,BJ1012 .B424 1978,286913,ALDERMAN,1978,Moral life /,"Beehler, Rodger,",X000000433,STACKS,STACKS,BOOK,6/28/96,12/19/97,0,0,1,11,1
BJ 001012 .B425  2007,BJ1012 .B425 2007,4720415,ALDERMAN,2007,"Thinking against the grain : essays on morality, education, and law /","Beehler, Rodger,",X030384907,STACKS,STACKS,BOOK,5/19/08,9/16/10,0,0,0,2,1
BJ 001012 .B43,BJ1012 .B43,342614,ALDERMAN,1978,"Belief and ethics : essays in ethics, the human sciences, and ministry in honor of W. Alvin Pitcher /",,X000053590,STACKS,STACKS,BOOK,6/28/96,12/15/03,0,0,1,4,1
