BJ 001251 .F53  1966,BJ1251 .F53 1966,557246,ALDERMAN,1966,"Situation ethics; the new morality,","Fletcher, Joseph F.",X000143784,STACKS,STACKS,BOOK,6/29/96,7/27/18,1,0,3,14,1
BJ 001251 .F53  1966,BJ1251 .F53 1966,557246,CLEMONS,1966,"Situation ethics; the new morality,","Fletcher, Joseph F.",X000232471,BY-REQUEST,BY-REQUEST,BOOK,6/29/96,1/1/00,0,0,1,5,1
BJ 001251 .F53  1997,BJ1251 .F53 1997,2733697,ALDERMAN,1997,Situation ethics : the new morality /,"Fletcher, Joseph F.",X004140517,STACKS,STACKS,BOOK,11/11/97,11/19/17,1,3,3,14,1
BJ 001251 .F55  C6  1968,BJ1251 .F55 C6 1968,1153158,ALDERMAN,1968,"The situation ethics debate,","Cox, Harvey,",X001122853,STACKS,STACKS,BOOK,6/29/96,5/21/01,0,0,0,20,1
BJ 001251 .F55  S7  1967,BJ1251 .F55 S7 1967,1153159,ALDERMAN,1967,Storm over ethics,,X000500077,STACKS,STACKS,BOOK,6/29/96,9/23/08,0,0,0,6,1
BJ 001251 .F57  1990,BJ1251 .F57 1990,1674489,ALDERMAN,1990,Sins of omission : a primer on moral indifference /,"Ford, Dennis,",X001775190,STACKS,CHECKEDOUT,BOOK,6/30/96,1/24/19,2,1,1,6,1
BJ 001251 .F6  1955,BJ1251 .F6 1955,1153160,ALDERMAN,1955,Ethics of decision;,"Forell, George W. (George Wolfgang),",X000428701,STACKS,STACKS,BOOK,6/29/96,11/7/12,1,1,1,2,1
BJ 001251 .F77  1963,BJ1251 .F77 1963,1153161,ALDERMAN,1963,"The immobilized Christian, a study of his pre-ethical situation.","Fry, John R.",X000844180,STACKS,STACKS,BOOK,6/29/96,1/1/00,0,0,0,0,1
BJ 001251 .G28  1960,BJ1251 .G28 1960,1153162,ALDERMAN,1960,Biblical faith and social ethics.,"Gardner, E. Clinton (Edward Clinton),",X000416546,STACKS,STACKS,BOOK,6/29/96,9/23/08,0,0,1,6,1
BJ 001251 .G47  2001,BJ1251 .G47 2001,3721860,ALDERMAN,2001,Fidelity of heart : an ethic of Christian virtue /,"Gilman, James Earl.",X004475491,STACKS,STACKS,BOOK,5/29/01,3/30/17,1,2,0,7,1
BJ 001251 .G74  2016,BJ1251 .G74 2016,7019595,ALDERMAN,2016,Agape ethics : moral realism and love for all life /,"Greenway, William,",X031813569,STACKS,CHECKEDOUT,BOOK,3/31/17,8/30/18,1,0,0,1,2
BJ 001251 .G86,BJ1251 .G86,440046,ALDERMAN,1975,Can ethics be Christian?,"Gustafson, James M.",X000026951,STACKS,STACKS,BOOK,6/29/96,10/4/05,0,0,2,29,1
BJ 001251 .G87  1968,BJ1251 .G87 1968,571926,ALDERMAN,1968,Christ and the moral life,"Gustafson, James M.",X000026950,STACKS,STACKS,BOOK,6/29/96,5/29/18,1,0,2,63,1
BJ 001251 .G87  1968,BJ1251 .G87 1968,571926,CLEMONS,1968,Christ and the moral life,"Gustafson, James M.",X000121558,BY-REQUEST,BY-REQUEST,BOOK,6/29/96,5/14/13,1,0,1,44,1
BJ 001251 .G875,BJ1251 .G875,1153164,ALDERMAN,1971,Christian ethics and the community,"Gustafson, James M.",X000314074,STACKS,STACKS,BOOK,6/29/96,7/30/04,0,0,0,26,1
BJ 001251 .G8755  2007,BJ1251 .G8755 2007,4621850,ALDERMAN,2007,Moral discernment in the Christian life : essays in theological ethics /,"Gustafson, James M.",X030250810,STACKS,STACKS,BOOK,9/4/07,5/17/16,2,11,0,14,1
BJ 001251 .G876  1981B,BJ1251 .G876 1981b,647030,ALDERMAN,1981,Theology and ethics /,"Gustafson, James M.",X000357321,STACKS,STACKS,BOOK,6/29/96,4/28/17,1,4,2,24,1
BJ 001251 .G876  V.000001,BJ1251 .G876 v.1,170262,ALDERMAN,1981,Ethics from a theocentric perspective /,"Gustafson, James M.",X000323795,STACKS,STACKS,BOOK,6/28/96,8/27/14,2,0,1,64,1
BJ 001251 .G876  V.000002,BJ1251 .G876 v.2,170262,ALDERMAN,1981,Ethics from a theocentric perspective /,"Gustafson, James M.",X000863500,STACKS,STACKS,BOOK,6/28/96,8/27/14,2,0,2,25,1
BJ 001251 .G8765  1996,BJ1251 .G8765 1996,2633264,ALDERMAN,1996,"Intersections : science, theology, and ethics /","Gustafson, James M.",X004069071,STACKS,STACKS,BOOK,12/2/96,1/18/02,0,0,1,11,1
BJ 001251 .G877,BJ1251 .G877,319024,ALDERMAN,1978,Protestant and Roman Catholic ethics : prospects for rapprochement /,"Gustafson, James M.",X000059695,STACKS,STACKS,BOOK,6/28/96,5/29/18,1,0,5,49,1
BJ 001251 .G88,BJ1251 .G88,619501,ALDERMAN,1974,Theology and Christian ethics,"Gustafson, James M.",X000026949,STACKS,STACKS,BOOK,6/29/96,12/30/03,0,0,4,18,1
BJ 001251 .G88,BJ1251 .G88,619501,CLEMONS,1974,Theology and Christian ethics,"Gustafson, James M.",X000176779,BY-REQUEST,BY-REQUEST,BOOK,6/29/96,6/10/10,0,0,0,87,1
BJ 001251 .G884  2015,BJ1251 .G884 2015,6654807,ALDERMAN,2015,Christian ethics at the boundary : feminism and theologies of public life /,"Guth, Karen V.,",X031735094,STACKS,STACKS,BOOK,12/9/15,3/7/16,0,0,1,0,1
BJ 001251 .H24  2010,BJ1251 .H24 2010,5414735,ALDERMAN,2010,Christian ethics as witness : Barth's ethics for a world at risk /,"Haddorff, David W. (David Wayne),",X030947255,STACKS,STACKS,BOOK,9/13/11,5/15/16,1,8,0,12,1
BJ 001251 .H28  1957,BJ1251 .H28 1957,1220054,ALDERMAN,1957,Christian ethics.,"Harkness, Georgia Elma,",X000462980,STACKS,STACKS,BOOK,6/30/96,1/1/00,0,0,0,0,1
BJ 001251 .H324,BJ1251 .H324,434307,ALDERMAN,1976,Christian ethics in the African context /,"Haselbarth, Hans.",X000008024,STACKS,STACKS,BOOK,6/29/96,4/7/08,0,0,0,3,1
BJ 001251 .H3248  1985,BJ1251 .H3248 1985,684497,ALDERMAN,1985,Against the nations : war and survival in a liberal society /,"Hauerwas, Stanley,",X001221451,STACKS,STACKS,BOOK,6/29/96,1/1/18,1,12,3,49,1
BJ 001251 .H325,BJ1251 .H325,221883,ALDERMAN,1981,A community of character : toward a constructive Christian social ethic /,"Hauerwas, Stanley,",X000219342,STACKS,CHECKEDOUT,BOOK,6/28/96,10/6/18,1,16,6,92,1
BJ 001251 .H325,BJ1251 .H325,221883,CLEMONS,1981,A community of character : toward a constructive Christian social ethic /,"Hauerwas, Stanley,",X000543348,BY-REQUEST,BY-REQUEST,BOOK,6/28/96,9/8/15,1,0,6,64,1
BJ 001251 .H326  2001,BJ1251 .H326 2001,3770787,ALDERMAN,2001,The Hauerwas reader /,"Hauerwas, Stanley,",X004524563,STACKS,STACKS,BOOK,8/21/01,7/19/18,8,8,12,75,2
BJ 001251 .H327  1983,BJ1251 .H327 1983,665496,ALDERMAN,1983,The peaceable kingdom : a primer in Christian ethics /,"Hauerwas, Stanley,",X000687780,STACKS,STACKS,BOOK,6/29/96,5/15/16,3,6,14,97,1
BJ 001251 .H33  1977,BJ1251 .H33 1977,3576059,ALDERMAN,1977,Truthfulness and tragedy : further investigations in Christian ethics /,"Hauerwas, Stanley,",X004478541,STACKS,STACKS,BOOK,10/26/00,5/15/16,3,20,1,44,1
BJ 001251 .H35  1981,BJ1251 .H35 1981,137911,ALDERMAN,1981,The adequacy of Christian ethics /,"Hebblethwaite, Brian.",X000835569,STACKS,STACKS,BOOK,6/28/96,9/23/08,0,0,1,4,2
BJ 001251 .H36  1957,BJ1251 .H36 1957,1153165,ALDERMAN,1957,Christian personal ethics.,"Henry, Carl F. H. (Carl Ferdinand Howard),",X000026948,STACKS,STACKS,BOOK,6/29/96,7/11/14,0,0,0,77,1
BJ 001251 .H36  1957,BJ1251 .H36 1957,1153165,ALDERMAN,1957,Christian personal ethics.,"Henry, Carl F. H. (Carl Ferdinand Howard),",X030143092,STACKS,STACKS,BOOK,9/25/06,1/1/00,0,0,0,0,1
BJ 001251 .H36  1981,BJ1251 .H36 1981,176639,ALDERMAN,1981,Christian ethics in the modern age /,"Hebblethwaite, Brian.",X000463570,STACKS,STACKS,BOOK,6/28/96,1/1/00,0,0,0,0,1
BJ 001251 .H36  1981,BJ1251 .H36 1981,176639,ALDERMAN,1981,Christian ethics in the modern age /,"Hebblethwaite, Brian.",X000492643,STACKS,STACKS,BOOK,6/28/96,12/30/03,0,0,0,4,4
BJ 001251 .I54,BJ1251 .I54,608959,ALDERMAN,1930,Christian ethics and modern problems.,"Inge, William Ralph,",X000055908,STACKS,STACKS,BOOK,6/29/96,6/26/18,1,0,0,7,1
BJ 001251 .J35  1988,BJ1251 .J35 1988,1314377,ALDERMAN,1988,James M. Gustafson's theocentric ethics : interpretations and assessments /,,X001509193,STACKS,STACKS,BOOK,6/30/96,8/27/13,1,0,1,21,1
BJ 001251 .J374  2015,BJ1251 .J374 2015,6552940,ALDERMAN,2015,Knowing the natural law : from precepts and inclinations to deriving oughts /,"Jensen, Steven J.,",X031706286,STACKS,STACKS,BOOK,5/13/15,1/1/00,0,0,0,0,2
BJ 001251 .J376  2000,BJ1251 .J376 2000,3493498,ALDERMAN,2000,Spirit ethics : scripture and the moral life /,"Jersild, Paul T.,",X004417492,STACKS,STACKS,BOOK,2/1/00,4/19/07,0,0,1,4,1
BJ 001251 .J63,BJ1251 .J63,629429,ALDERMAN,1974,Christian ethics for Black theology,"Jones, Major J.,",X000431175,STACKS,STACKS,BOOK,6/29/96,4/18/03,0,0,2,3,1
BJ 001251 .K245  2001,BJ1251 .K245 2001,3798468,ALDERMAN,2001,Ethics as grammar : changing the postmodern subject /,"Kallenberg, Brad J.",X004557270,STACKS,STACKS,BOOK,12/11/01,5/23/16,1,0,5,35,1
BJ 001251 .K247  1988B,BJ1251 .K247 1988b,1332205,ALDERMAN,1988,Ethics and liberation : an introduction /,"Kammer, Charles L.",X001559664,STACKS,STACKS,BOOK,6/30/96,9/23/08,0,0,1,1,1
BJ 001251 .K25  1981,BJ1251 .K25 1981,170339,ALDERMAN,1981,The kingdom revisited : an essay on Christian social ethics /,"Kammer, Charles L.",X000358725,STACKS,STACKS,BOOK,6/28/96,9/23/08,0,0,1,1,1
BJ 001251 .K27  1961,BJ1251 .K27 1961,1153167,ALDERMAN,1961,The context of decision; a theological analysis.,"Kaufman, Gordon D.",X000683732,STACKS,STACKS,BOOK,6/29/96,12/3/96,0,0,0,2,1
BJ 001251 .K27  1961,BJ1251 .K27 1961,1153167,ALDERMAN,1961,The context of decision; a theological analysis.,"Kaufman, Gordon D.",X030454279,STACKS,STACKS,BOOK,9/29/08,1/1/00,0,0,0,0,1
BJ 001251 .K52  2001,BJ1251 .K52 2001,3727697,CLEMONS,2001,The ethics of community /,"Kirkpatrick, Frank G.",X004527544,BY-REQUEST,BY-REQUEST,BOOK,6/19/01,2/13/17,1,0,0,12,1
BJ 001251 .K53  1943,BJ1251 .K53 1943,1153168,ALDERMAN,1943,The principles of Christian ethics,"Knudson, Albert C. (Albert Cornelius),",X000462968,STACKS,STACKS,BOOK,6/29/96,11/21/05,0,0,1,4,1
BJ 001251 .K76  1995,BJ1251 .K76 1995,2404634,ALDERMAN,1995,Christian ethics and political economy in North America : a critical analysis /,"Kroeker, P. Travis (Peter Travis),",X002604341,STACKS,STACKS,BOOK,7/1/96,5/13/10,0,0,1,5,1
BJ 001251 .L36  1985,BJ1251 .L36 1985,90129,ALDERMAN,1985,The good and the true : an introduction to a rational system of Christian ethics /,"Langford, Michael,",X000985811,STACKS,STACKS,BOOK,6/28/96,9/23/08,0,0,0,1,1
BJ 001251 .L363  1962,BJ1251 .L363 1962,1153169,ALDERMAN,1962,Christ and the modern conscience.,"Leclercq, Jacques,",X002241446,STACKS,STACKS,BOOK,6/29/96,9/11/13,1,0,1,2,1
BJ 001251 .L4  1944,BJ1251 .L4 1944,808614,ALDERMAN,1944,"Christian behaviour,","Lewis, C. S. (Clive Staples),",X000413926,STACKS,STACKS,BOOK,6/29/96,9/7/10,0,0,1,10,1
BJ 001251 .L4  1948,BJ1251 .L4 1948,1765070,ALDERMAN,1948,Christian behaviour : a further series of broadcast talks.,"Lewis, C. S. (Clive Staples),",X000241305,STACKS,STACKS,BOOK,6/30/96,9/23/08,0,0,3,13,1
BJ 001251 .L5,BJ1251 .L5,38593,ALDERMAN,1985,Liberation and ethics : essays in religious social ethics in honor of Gibson Winter /,,X000907530,STACKS,STACKS,BOOK,6/28/96,1/1/00,0,0,3,1,1
BJ 001251 .L66  2001,BJ1251 .L66 2001,3809465,ALDERMAN,2001,"The goodness of God : theology, church, and the social order /","Long, D. Stephen,",X004592829,STACKS,STACKS,BOOK,2/21/02,4/11/08,0,0,3,21,1
BJ 001251 .L68,BJ1251 .L68,455743,ALDERMAN,1974,Love and society : essays in the ethics of Paul Ramsey /,,X000221789,STACKS,STACKS,BOOK,6/29/96,5/19/14,1,0,4,17,1
BJ 001251 .M25  1947,BJ1251 .M25 1947,1153171,ALDERMAN,1947,"Ethics with special application to the nursing profession,","McAllister, Joseph B. (Joseph Bernard),",X001329974,STACKS,STACKS,BOOK,6/29/96,9/23/08,0,0,1,3,1
BJ 001251 .M265  2003,BJ1251 .M265 2003,4220532,ALDERMAN,2003,Transformation ethics : developing the Christian moral imagination /,"McFaul, Thomas R.",X004804054,STACKS,STACKS,BOOK,1/13/05,11/16/16,1,2,1,3,1
BJ 001251 .M28  1970,BJ1251 .M28 1970,1153172,ALDERMAN,1970,3 issues in ethics.,"Macquarrie, John.",X001137510,STACKS,STACKS,BOOK,6/29/96,3/16/03,0,0,0,4,1
BJ 001251 .M43  1995,BJ1251 .M43 1995,2829171,ALDERMAN,1995,Reconstructing Christian ethics : selected writings /,"Maurice, Frederick Denison,",X004254011,STACKS,STACKS,BOOK,11/16/98,5/16/16,1,4,2,12,1
BJ 001251 .M45  2004,BJ1251 .M45 2004,4245630,ALDERMAN,2004,An intelligent person's guide to Christian ethics /,"McCoy, Alban.",X004864844,STACKS,STACKS,BOOK,5/12/05,9/12/16,0,60,0,90,1
BJ 001251 .M487  1991,BJ1251 .M487 1991,1862085,ALDERMAN,1991,Faith and faithfulness : basic themes in Christian ethics /,"Meilaender, Gilbert,",X001978333,STACKS,STACKS,BOOK,6/30/96,4/28/17,1,7,0,16,1
BJ 001251 .M49  1987,BJ1251 .M49 1987,1289784,ALDERMAN,1987,The limits of love : some theological explorations /,"Meilaender, Gilbert,",X001294602,STACKS,STACKS,BOOK,6/30/96,1/10/06,0,0,3,52,1
BJ 001251 .M53  1983,BJ1251 .M53 1983,642076,ALDERMAN,1983,Toward a Christian political ethics /,"Míguez Bonino, José.",X000545513,STACKS,STACKS,BOOK,6/29/96,4/5/09,0,0,0,6,1
BJ 001251 .M535  2007,BJ1251 .M535 2007,4685414,ALDERMAN,2007,Media violence and Christian ethics /,"Mitchell, Jolyon P.",X030251818,STACKS,STACKS,BOOK,2/5/08,9/11/13,2,0,0,4,1
BJ 001251 .M63  1965,BJ1251 .M63 1965,1153173,ALDERMAN,1965,Moral problems and Christian personalism. [Editor: Franz Böckle],,X000827562,STACKS,STACKS,BOOK,6/29/96,1/1/00,0,0,1,1,1
BJ 001251 .M6315  2004,BJ1251 .M6315 2004,4213025,ALDERMAN,2004,Moral theology : new directions and fundamental issues : festschrift for James P. Hanigan /,,X004807767,STACKS,STACKS,BOOK,11/30/04,11/28/05,0,0,0,3,2
BJ 001251 .M632  1991,BJ1251 .M632 1991,2072557,ALDERMAN,1991,Moral theology today : trends and issues /,,X002192003,STACKS,STACKS,BOOK,6/30/96,7/27/16,0,0,0,1,1
BJ 001251 .M66  2011,BJ1251 .M66 2011,5311662,ALDERMAN,2011,Biblical ethics and social change /,"Mott, Stephen Charles.",X030816304,STACKS,STACKS,BOOK,3/18/11,8/1/18,1,0,0,1,3
BJ 001251 .M67  1990,BJ1251 .M67 1990,1682587,ALDERMAN,1990,The God who commands /,"Mouw, Richard J.",X001784348,STACKS,STACKS,BOOK,6/30/96,1/15/07,0,0,1,64,1
BJ 001251 .M68  1994,BJ1251 .M68 1994,2396960,ALDERMAN,1994,Moral truth and moral tradition : essays in honour of Peter Geach and Elizabeth Anscombe /,,X002601090,STACKS,STACKS,BOOK,7/1/96,4/19/11,0,0,4,18,1
BJ 001251 .M8  1966,BJ1251 .M8 1966,1254696,ALDERMAN,1966,Moral law in Christian social ethics /,"Muelder, Walter George,",X001334630,STACKS,STACKS,BOOK,6/30/96,6/14/11,0,0,2,5,1
BJ 001251 .N52  1963,BJ1251 .N52 1963,563290,ALDERMAN,1963,The responsible self; an essay in Christian moral philosophy.,"Niebuhr, H. Richard (Helmut Richard),",X000119742,STACKS,STACKS,BOOK,6/29/96,5/12/18,6,9,3,65,1
BJ 001251 .N523  T75  1993,BJ1251 .N523 T75 1993,2225124,ALDERMAN,1993,Voices of the silenced : the responsible self in a marginalized community /,"Trimiew, Darryl M.,",X002328806,STACKS,STACKS,BOOK,7/1/96,1/22/09,0,0,2,14,1
BJ 001251 .O36  1984,BJ1251 .O36 1984,23442,ALDERMAN,1984,Principles in the public realm : the dilemma of Christian moral witness /,"O'Donovan, Oliver.",X000748338,STACKS,STACKS,BOOK,6/28/96,5/11/15,2,3,3,24,1
BJ 001251 .O36  2002,BJ1251 .O36 2002,3899076,ALDERMAN,2002,Common objects of love : moral reflection and the shaping of community : 2001 Stob lectures /,"O'Donovan, Oliver.",X004637177,STACKS,STACKS,BOOK,12/3/02,1/25/18,4,4,2,45,1
BJ 001251 .O364  1986,BJ1251 .O364 1986,771626,CLEMONS,1986,Resurrection and moral order : an outline for evangelical ethics /,"O'Donovan, Oliver.",X001263707,BY-REQUEST,BY-REQUEST,BOOK,6/29/96,11/10/16,4,23,4,85,1
BJ 001251 .O365  2013  V.000001,BJ1251 .O365 2013 v.1,6125134,ALDERMAN,2013,"Self, world, and time : an induction /","O'Donovan, Oliver.",X031579769,STACKS,CHECKEDOUT,BOOK,8/30/13,12/18/18,5,2,0,7,1
BJ 001251 .O6  1974,BJ1251 .O6 1974,464780,ALDERMAN,1974,The character of Christian morality /,"Oppenheimer, Helen,",X000616579,STACKS,STACKS,BOOK,6/29/96,1/1/00,0,0,2,2,1
BJ 001251 .O8  1968,BJ1251 .O8 1968,1153174,ALDERMAN,1968,"Norm and context in Christian ethics,","Outka, Gene H.",X000242769,STACKS,STACKS,BOOK,6/29/96,6/26/13,0,6,1,54,1
BJ 001251 .P38  1990,BJ1251 .P38 1990,1646933,ALDERMAN,1990,Millennial dreams and moral dilemmas : Seventh-Day Adventist responses to some contemporary ethical issues /,"Pearson, Michael,",X001707400,STACKS,STACKS,BOOK,6/30/96,4/5/00,0,0,0,7,1
BJ 001251 .P4  1900  1902  ED.,BJ1251 .P4 1900 1902 ed.,1213839,ALDERMAN,1902,The golden rule.,"Boardman, George Dana,",X001980651,STACKS,STACKS,BOOK,6/30/96,1/1/00,0,0,0,1,1
BJ 001251 .P4  1922,BJ1251 .P4 1922,1153177,ALDERMAN,1922,"Jesus on love to God, Jesus on love to man;","Moffatt, James,",X000417485,STACKS,STACKS,BOOK,6/29/96,1/1/00,0,0,0,0,1
BJ 001251 .P5  1955,BJ1251 .P5 1955,1153183,ALDERMAN,1955,Doing the truth;,"Pike, James A. (James Albert),",X001870041,STACKS,STACKS,BOOK,6/29/96,11/12/12,0,0,1,12,1
BJ 001251 .P55  2002,BJ1251 .P55 2002,3860537,ALDERMAN,2002,Theology and action : after theory in Christian ethics /,"Pinches, Charles Robert.",X004470090,STACKS,STACKS,BOOK,7/2/02,8/21/15,1,0,2,23,1
BJ 001251 .P56,BJ1251 .P56,1153185,ALDERMAN,1970,Christian ethics,"Piper, Otto A.,",X000426817,STACKS,STACKS,BOOK,6/29/96,1/1/00,0,0,0,1,1
BJ 001251 .P73  1987B,BJ1251 .P73 1987b,698390,ALDERMAN,1987,The future of Christian ethics /,"Preston, Ronald H. (Ronald Haydn),",X001184823,STACKS,STACKS,BOOK,6/29/96,1/1/00,0,0,0,2,1
BJ 001251 .P76  1998,BJ1251 .P76 1998,2836098,ALDERMAN,1998,The promise of Lutheran ethics /,,X004200104,STACKS,STACKS,BOOK,9/28/98,6/18/02,0,0,1,4,2
BJ 001251 .R27  1966,BJ1251 .R27 1966,1153186,ALDERMAN,1966,"Christian ethics and contemporary philosophy,","Ramsey, Ian T.",X000092757,STACKS,STACKS,BOOK,6/29/96,3/5/10,0,0,1,38,1
BJ 001251 .R28  1967,BJ1251 .R28 1967,1153187,ALDERMAN,1967,Deeds and rules in Christian ethics.,"Ramsey, Paul.",X000026946,STACKS,STACKS,BOOK,6/29/96,9/23/08,0,0,3,17,1
BJ 001251 .R284  1994,BJ1251 .R284 1994,2323625,ALDERMAN,1994,The essential Paul Ramsey : a collection /,"Ramsey, Paul.",X002520447,STACKS,STACKS,BOOK,7/1/96,8/27/18,7,6,0,31,1
BJ 001251 .R29  1985,BJ1251 .R29 1985,26397,ALDERMAN,1985,The truth of value : a defense of moral and literary judgment /,"Ramsey, Paul.",X001010568,STACKS,STACKS,BOOK,6/28/96,6/5/07,0,0,2,5,2
BJ 001251 .R3  1956,BJ1251 .R3 1956,571928,ALDERMAN,1956,Christian social ethics; exerting Christian influence.,"Rasmussen, Albert Terrill,",X030131893,STACKS,STACKS,BOOK,10/19/06,3/11/15,1,0,1,1,1
BJ 001251 .R42  1939,BJ1251 .R42 1939,4407362,ALDERMAN,1939,Why be good /,"Reid, James,",X030152721,STACKS,STACKS,BOOK,10/12/06,9/3/10,0,0,0,0,2
BJ 001251 .R62  1970,BJ1251 .R62 1970,532929,ALDERMAN,1970,Christian freedom in a permissive society,"Robinson, John A. T. (John Arthur Thomas),",X000449896,STACKS,STACKS,BOOK,6/29/96,1/1/00,0,0,0,1,1
BJ 001251 .R64  1972,BJ1251 .R64 1972,589210,ALDERMAN,1972,The Groundwork of Christian ethics,"Robinson, N. H. G. (Norman Hamilton Galloway),",X000124467,STACKS,STACKS,BOOK,6/29/96,9/23/08,0,0,1,7,1
BJ 001251 .R65  1969,BJ1251 .R65 1969,579752,ALDERMAN,1969,In response to God; how Christians make ethical decisions.,"Rogers, Isabel Wood.",X000491813,STACKS,STACKS,BOOK,6/29/96,10/9/17,0,0,0,0,1
BJ 001251 .R67  2010,BJ1251 .R67 2010,5266064,ALDERMAN,2010,"Ethics with Barth : God, metaphysics, and morals /","Rose, Matthew.",X030744185,STACKS,STACKS,BOOK,12/21/10,4/20/17,1,9,0,14,1
BJ 001251 .S295  1998,BJ1251 .S295 1998,2973992,ALDERMAN,1998,"Power, value, and conviction : theological ethics in the postmodern age /","Schweiker, William.",X004401556,STACKS,STACKS,BOOK,12/8/99,7/25/18,1,0,0,4,1
BJ 001251 .S38  1966,BJ1251 .S38 1966,1153190,ALDERMAN,1966,Theological ethics,"Sellers, James,",X000893250,STACKS,STACKS,BOOK,6/29/96,1/1/00,0,0,1,0,1
BJ 001251 .S4  1842,BJ1251 .S4 1842,1153191,ALDERMAN,1842,Christian morals ...,"Sewell, William,",X002403991,STACKS,STACKS,BOOK,6/29/96,9/23/08,0,0,0,1,1
BJ 001251 .S43  1958,BJ1251 .S43 1958,1153192,ALDERMAN,1958,The structure of Christian ethics.,"Sittler, Joseph.",X000426785,STACKS,STACKS,BOOK,6/29/96,1/1/00,0,0,0,0,1
BJ 001251 .S55  1892,BJ1251 .S55 1892,1158087,ALDERMAN,1892,"Christian ethics,","Smyth, Newman,",X000430822,STACKS,STACKS,BOOK,6/29/96,6/29/15,0,0,0,0,1
BJ 001251 .S65  1843,BJ1251 .S65 1843,769187,ALDERMAN,1843,The philosophy of Christian morals.,"Spalding, Samuel.",X000209469,STACKS,STACKS,BOOK,6/29/96,1/1/00,0,0,0,1,1
BJ 001251 .S7  1948,BJ1251 .S7 1948,1158089,ALDERMAN,1948,Power for action : an introduction to Christian ethics /,"Spurrier, William Atwell.",X001324934,STACKS,STACKS,BOOK,6/29/96,4/22/02,0,0,0,1,1
BJ 001251 .S86,BJ1251 .S86,331022,ALDERMAN,1978,Ethical reflections : essays on moral themes /,"Stob, Henry,",X000085947,STACKS,STACKS,BOOK,6/28/96,9/23/08,0,0,0,0,1
BJ 001251 .T45  1955,BJ1251 .T45 1955,1158090,ALDERMAN,1955,Christian ethics and moral philosophy.,"Thomas, George F. (George Finger),",X030143093,STACKS,STACKS,BOOK,9/25/06,1/1/00,0,0,0,0,1
BJ 001251 .T47  1966,BJ1251 .T47 1966,571982,ALDERMAN,1966,Morality and beyond.,"Tillich, Paul,",X000121569,STACKS,STACKS,BOOK,6/29/96,5/3/07,0,0,0,22,1
BJ 001251 .T89  2008,BJ1251 .T89 2008,4698631,ALDERMAN,2008,Twentieth-century shapers of Baptist social ethics /,,X030248713,STACKS,STACKS,BOOK,3/18/08,3/25/17,2,0,2,4,1
BJ 001251 .V47  2002,BJ1251 .V47 2002,3823823,ALDERMAN,2002,"Remembering Jesus : Christian community, Scripture, and the moral life /","Verhey, Allen.",X004590620,STACKS,STACKS,BOOK,3/26/02,9/3/04,0,0,0,8,1
BJ 001251 .W238,BJ1251 .W238,403555,ALDERMAN,1976,The divine image : the foundations of Christian morality /,"Ward, Keith,",X000530852,STACKS,STACKS,BOOK,6/28/96,9/23/08,0,0,0,0,1
BJ 001251 .W24,BJ1251 .W24,1158092,ALDERMAN,1970,Ethics and Christianity.,"Ward, Keith,",X000530853,STACKS,STACKS,BOOK,6/29/96,6/18/01,0,0,1,12,1
BJ 001251 .W3  1835,BJ1251 .W3 1835,1158093,ALDERMAN,1835,The elements of moral science. /,"Wayland, Francis,",X000835358,STACKS,STACKS,BOOK,6/29/96,6/30/15,0,0,0,25,1
BJ 001251 .W3  1873,BJ1251 .W3 1873,1158095,ALDERMAN,1873,Elements of moral science;,"Wayland, Francis,",X001179803,STACKS,STACKS,BOOK,6/29/96,9/23/08,0,0,0,25,1
BJ 001251 .W3  1963,BJ1251 .W3 1963,1158096,ALDERMAN,1963,The elements of moral science.,"Wayland, Francis,",X000379180,STACKS,STACKS,BOOK,6/29/96,12/8/10,0,0,0,19,1
BJ 001251 .W43,BJ1251 .W43,166577,ALDERMAN,1981,The moral majority : right or wrong? /,"Webber, Robert E.,",X000351584,STACKS,STACKS,BOOK,6/28/96,1/18/15,2,0,1,7,1
BJ 001251 .W46  2002,BJ1251 .W46 2002,3898479,ALDERMAN,2002,American Protestant ethics and the legacy of H. Richard Niebuhr /,"Werpehowski, William.",X004633852,STACKS,STACKS,BOOK,11/26/02,8/18/12,1,0,0,7,1
BJ 001251 .W47  1939,BJ1251 .W47 1939,1158097,ALDERMAN,1939,"Christianity and morals,","Westermarck, Edward,",X000265451,STACKS,STACKS,BOOK,6/29/96,1/1/00,0,0,1,0,1
BJ 001251 .W56,BJ1251 .W56,169878,ALDERMAN,1981,Liberating creation : foundations of religious social ethics /,"Winter, Gibson.",X000358175,STACKS,STACKS,BOOK,6/28/96,1/25/05,0,0,0,4,2
BJ 001251 .Y6  1984,BJ1251 .Y6 1984,54969,ALDERMAN,1984,The priestly kingdom : social ethics as gospel /,"Yoder, John Howard.",X000910705,STACKS,STACKS,BOOK,6/28/96,11/19/15,3,1,7,35,1
BJ 001251 .Z34  2004,BJ1251 .Z34 2004,4071407,ALDERMAN,2004,Divine motivation theory / Linda Trinkaus Zagzebski.,"Zagzebski, Linda Trinkaus,",X004806857,STACKS,CHECKEDOUT,BOOK,9/28/04,9/27/17,1,0,1,4,1
BJ 001252 .B25  2000,BJ1252 .B25 2000,3547042,ALDERMAN,2000,Dirty hands : Christian ethics in a morally ambiguous world /,"Baker-Fletcher, Garth Kasimu,",X004415903,STACKS,STACKS,BOOK,7/4/00,4/25/16,1,0,1,6,1
BJ 001252 .M413,BJ1252 .M413,538743,ALDERMAN,1971,Catholic ethics and Protestant ethics.,"Mehl, Roger.",X000903432,STACKS,STACKS,BOOK,6/29/96,4/8/14,1,2,0,13,2
BJ 001252 .P5713  1987,BJ1252 .P5713 1987,687252,ALDERMAN,1987,Duty or pleasure? : a new appraisal of Christian ethics /,"Plé, Albert,",X001211432,STACKS,STACKS,BOOK,6/29/96,4/10/01,0,0,0,4,1
BJ 001253 .B34  1976,BJ1253 .B34 1976,395427,ALDERMAN,1976,"Das christliche Leben : die kirchliche Dogmatik IV/4, Fragmente aus dem Nachlass, Vorlesungen 1959-1961 /","Barth, Karl,",X000132027,STACKS,STACKS,BOOK,6/28/96,1/1/00,0,0,1,0,1
BJ 001253 .B3413,BJ1253 .B3413,149467,ALDERMAN,1981,"The Christian life : church dogmatics IV, 4 : lecture fragments /","Barth, Karl,",X000370405,STACKS,STACKS,BOOK,6/28/96,5/15/17,3,9,2,26,1
BJ 001253 .B343  L39  1994A,BJ1253 .B343 L39 1994a,2503505,ALDERMAN,1994,The practical voice of dogmatic theology : Karl Barth on the Christian life /,"Mangina, Joseph Layton.",X004117630,STACKS,STACKS,BOOK,7/1/96,12/5/13,1,0,0,22,1
BJ 001253 .B35  1973  BD.000001,BJ1253 .B35 1973 Bd.1,343144,ALDERMAN,1973,Ethik /,"Barth, Karl,",X000680848,STACKS,STACKS,BOOK,6/28/96,9/3/10,0,0,1,3,1
BJ 001253 .B35  1973  BD.000002,BJ1253 .B35 1973 Bd.2,343144,ALDERMAN,1973,Ethik /,"Barth, Karl,",X002650836,STACKS,STACKS,BOOK,6/28/96,1/1/00,0,0,1,1,1
BJ 001253 .B3513  1981,BJ1253 .B3513 1981,155320,ALDERMAN,1981,Ethics /,"Barth, Karl,",X000223382,STACKS,STACKS,BOOK,6/28/96,5/21/08,0,0,2,53,1
BJ 001253 .B3513  1981,BJ1253 .B3513 1981,155320,CLEMONS,1981,Ethics /,"Barth, Karl,",X000322997,BY-REQUEST,BY-REQUEST,BOOK,6/28/96,6/4/13,1,2,1,9,1
BJ 001253 .B5513,BJ1253 .B5513,151349,ALDERMAN,1980,Fundamental moral theology /,"Böckle, Franz.",X000747792,STACKS,STACKS,BOOK,6/28/96,9/3/10,0,0,0,0,1
BJ 001253 .B615  1960,BJ1253 .B615 1960,1158099,ALDERMAN,1955,Ethics.,"Bonhoeffer, Dietrich,",X000362077,STACKS,STACKS,BOOK,6/29/96,2/28/16,2,6,8,52,1
BJ 001253 .B615  1965,BJ1253 .B615 1965,559305,CLEMONS,1965,Ethics.,"Bonhoeffer, Dietrich,",X000026945,BY-REQUEST,CHECKEDOUT,BOOK,6/29/96,2/19/19,3,55,5,204,1
BJ 001253 .B6153  N49  1987,BJ1253 .B6153 N49 1987,5170174,ALDERMAN,1987,New studies in Bonhoeffer's ethics /,,X030691052,STACKS,STACKS,BOOK,6/24/10,4/5/12,0,3,0,7,1
BJ 001253 .B6155  1991,BJ1253 .B6155 1991,1969910,ALDERMAN,1991,Bonhoeffer's ethics : old Europe and new frontiers /,,X002118042,STACKS,CHECKEDOUT,BOOK,6/30/96,10/10/17,0,3,2,25,1
BJ 001253 .B73  1937,BJ1253 .B73 1937,1158100,ALDERMAN,1937,"The divine imperative,","Brunner, Emil,",X030143100,STACKS,STACKS,BOOK,9/25/06,7/5/10,0,0,0,4,1
BJ 001253 .E412,BJ1253 .E412,1158101,ALDERMAN,1957,The Christian ethos.,"Elert, Werner,",X002516856,STACKS,STACKS,BOOK,6/29/96,9/24/08,0,0,1,3,1
BJ 001253 .E85  1984,BJ1253 .E85 1984,99917,ALDERMAN,1984,Der Ethische Kompromiss /,,X001017542,STACKS,STACKS,BOOK,6/28/96,9/24/08,0,0,0,0,1
