BJ 001461 .H37  1926,BJ1461 .H37 1926,1159064,ALDERMAN,1926,Fatalism or freedom;,"Herrick, C. Judson (Charles Judson),",X001023972,STACKS,STACKS,BOOK,6/29/96,5/15/18,1,1,0,3,1
BJ 001461 .H53  2012,BJ1461 .H53 2012,5602685,ALDERMAN,2012,Rationality + consciousness = free will /,"Hodgson, David (David H.)",X030960436,STACKS,STACKS,BOOK,5/2/12,4/19/18,1,1,1,2,1
BJ 001461 .H563  2009,BJ1461 .H563 2009,4891102,ALDERMAN,2009,"Willing, wanting, waiting /","Holton, Richard,",X030566164,STACKS,STACKS,BOOK,7/15/09,11/28/12,0,5,0,6,1
BJ 001461 .H57  1993,BJ1461 .H57 1993,2316329,CLEMONS,1993,How free are you? : the determinism problem /,"Honderich, Ted.",X002533395,BY-REQUEST,BY-REQUEST,BOOK,7/1/96,4/1/10,0,0,2,28,1
BJ 001461 .H58  1973,BJ1461 .H58 1973,1159065,ALDERMAN,1973,Essays on freedom of action;,"Honderich, Ted.",X000415590,STACKS,STACKS,BOOK,6/29/96,2/27/18,2,0,10,86,1
BJ 001461 .H58  1978,BJ1461 .H58 1978,158789,CLEMONS,1978,Essays on freedom of action /,,X000303284,BY-REQUEST,BY-REQUEST,BOOK,6/28/96,3/17/08,0,0,1,32,1
BJ 001461 .H582  2005,BJ1461 .H582 2005,4226868,ALDERMAN,2005,On determinism and freedom /,"Honderich, Ted.",X004839678,STACKS,STACKS,BOOK,2/17/05,1/1/00,0,0,1,0,1
BJ 001461 .H86  2011,BJ1461 .H86 2011,5271174,ALDERMAN,2011,Freedom of the will : a conditional analysis /,"Huoranszki, Ferenc,",X030817005,STACKS,STACKS,BOOK,1/14/11,7/16/13,1,0,0,1,1
BJ 001461 .I74  2012,BJ1461 .I74 2012,5843141,ALDERMAN,2012,The problem of free will : a contemporary introduction /,"Iredale, Mathew.",X030844927,STACKS,STACKS,BOOK,12/5/12,12/15/12,1,0,0,1,1
BJ 001461 .I82  2011,BJ1461 .I82 2011,5501127,ALDERMAN,2011,Moral responsibility in collective contexts /,"Isaacs, Tracy Lynn.",X030976269,STACKS,STACKS,BOOK,11/28/11,12/2/18,3,2,1,6,1
BJ 001461 .K36,BJ1461 .K36,112356,ALDERMAN,1981,Anselm's doctrine of freedom and the will /,"Kane, G. Stanley.",X000483839,STACKS,STACKS,BOOK,6/28/96,3/5/08,0,0,0,6,1
BJ 001461 .K365  2005,BJ1461 .K365 2005,4242415,ALDERMAN,2005,A contemporary introduction to free will /,"Kane, Robert,",X004859984,STACKS,STACKS,BOOK,4/26/05,8/31/17,6,12,0,34,1
BJ 001461 .K365  2005,BJ1461 .K365 2005,4242415,CLEMONS,2005,A contemporary introduction to free will /,"Kane, Robert,",X004862083,CLEM-RESV,CLEM-RESV,BOOK-30DAY,5/16/05,10/4/18,3,11,0,18,1
BJ 001461 .K37  1985,BJ1461 .K37 1985,38130,ALDERMAN,1985,Free will and values /,"Kane, Robert, (Robert),",X001011333,STACKS,STACKS,BOOK,6/28/96,5/13/03,0,0,0,8,1
BJ 001461 .K38  1996,BJ1461 .K38 1996,2636418,ALDERMAN,1996,The significance of free will /,"Kane, Robert,",X004049159,STACKS,STACKS,BOOK,12/16/96,7/7/16,2,5,2,37,1
BJ 001461 .L33,BJ1461 .L33,815347,ALDERMAN,1947,On human freedom.,"Laird, John,",X000920611,STACKS,STACKS,BOOK,6/29/96,4/27/03,0,0,1,4,1
BJ 001461 .L4  1966,BJ1461 .L4 1966,1159066,ALDERMAN,1966,Freedom and determinism.,"Lehrer, Keith",X000428230,STACKS,STACKS,BOOK,6/29/96,6/16/14,1,3,0,12,1
BJ 001461 .L48  2011,BJ1461 .L48 2011,5501203,ALDERMAN,2011,Hard luck : how luck undermines free will and moral responsibility /,"Levy, Neil,",X030976341,STACKS,STACKS,BOOK,11/28/11,5/21/18,3,2,0,6,1
BJ 001461 .L53  2014,BJ1461 .L53 2014,6502458,ALDERMAN,2014,Libertarian free will : contemporary debates /,,X031708339,STACKS,STACKS,BOOK,2/11/15,12/2/18,1,0,0,1,1
BJ 001461 .L78,BJ1461 .L78,1159067,ALDERMAN,1970,"The freedom of the will,","Lucas, J. R. (John Randolph),",X000530862,STACKS,STACKS,BOOK,6/29/96,3/25/08,0,0,0,5,1
BJ 001461 .L8,BJ1461 .L8,527551,ALDERMAN,1969,Luther and Erasmus: Free will and salvation.,,X000027017,STACKS,STACKS,BOOK,6/29/96,4/16/14,2,4,4,48,1
BJ 001461 .L8,BJ1461 .L8,527551,CLEMONS,1969,Luther and Erasmus: Free will and salvation.,,X000111855,BY-REQUEST,BY-REQUEST,BOOK,6/29/96,5/22/08,0,0,1,48,1
BJ 001461 .M26  2000,BJ1461 .M26 2000,3732353,ALDERMAN,2000,Free will /,"McFee, Graham.",X004523921,STACKS,STACKS,BOOK,7/5/01,5/11/14,1,2,1,10,1
BJ 001461 .M3  1967,BJ1461 .M3 1967,1159068,ALDERMAN,1967,"Freedom of action in a mechanistic universe,","MacKay, Donald MacCrimmon,",X002196971,STACKS,STACKS,BOOK,6/29/96,1/1/00,0,0,1,4,1
BJ 001461 .M34  2005,BJ1461 .M34 2005,4233638,ALDERMAN,2005,"The magnitude of Ming : command, allotment, and fate in Chinese culture /",,X004861772,STACKS,STACKS,BOOK,3/29/05,2/13/12,1,0,1,1,1
BJ 001461 .M385  1983,BJ1461 .M385 1983,668872,ALDERMAN,1983,Love and understanding : the relation of will and intellect in Pierre Rousselot's christological vision /,"McDermott, John M.",X000935707,STACKS,STACKS,BOOK,6/29/96,4/18/01,0,0,1,16,1
BJ 001461 .M3885  2016,BJ1461 .M3885 2016,7210791,ALDERMAN,2016,Free will : a contemporary introduction /,"McKenna, Michael,",X031846339,STACKS,STACKS,BOOK,7/25/17,9/17/18,3,2,0,5,1
BJ 001461 .M39  1982,BJ1461 .M39 1982,114432,ALDERMAN,1982,Thoughts on freedom : two essays /,"McMackin, Lorin.",X000689357,STACKS,STACKS,BOOK,6/28/96,1/1/00,0,0,0,0,1
BJ 001461 .M45  2014,BJ1461 .M45 2014,6192285,ALDERMAN,2014,A dialogue on free will and science /,"Mele, Alfred R.,",X031625515,STACKS,STACKS,BOOK,2/12/14,9/17/18,1,0,1,1,1
BJ 001461 .M5  1959,BJ1461 .M5 1959,1159069,ALDERMAN,1959,Modern science and human freedom.,"Miller, David L.,",X000266520,STACKS,STACKS,BOOK,6/29/96,1/1/00,0,0,0,3,1
BJ 001461 .M59  1986,BJ1461 .M59 1986,103074,ALDERMAN,1986,Moral responsibility /,,X001109375,STACKS,STACKS,BOOK,6/28/96,4/17/15,0,5,4,40,1
BJ 001461 .N37  1992,BJ1461 .N37 1992,1940846,ALDERMAN,1992,Will and world : a study in metaphysics /,"Nathan, N. M. L.",X002110543,STACKS,STACKS,BOOK,6/30/96,1/1/00,0,0,0,0,1
BJ 001461 .N4  1957,BJ1461 .N4 1957,557148,ALDERMAN,1958,"Determinism and freedom in the age of modern science; a philosophical symposium,",New York University Institute of Philosophy,X000027018,STACKS,STACKS,BOOK,6/29/96,4/24/06,0,0,12,69,1
BJ 001461 .N4  1957,BJ1461 .N4 1957,557148,ALDERMAN,1958,"Determinism and freedom in the age of modern science; a philosophical symposium,",New York University Institute of Philosophy,X000225074,STACKS,STACKS,BOOK,6/29/96,11/7/14,1,0,6,77,1
BJ 001461 .N455  2011,BJ1461 .N455 2011,5501873,ALDERMAN,2011,Making sense of freedom and responsibility /,"Nelkin, Dana Kay,",X031188550,STACKS,STACKS,BOOK,11/30/11,11/13/13,2,1,0,3,1
BJ 001461 .N53  2015,BJ1461 .N53 2015,6513298,ALDERMAN,2015,Bound : essays on free will and responsibility /,"Nichols, Shaun.",X031705098,STACKS,STACKS,BOOK,3/4/15,9/13/18,1,0,1,1,1
BJ 001461 .O25  1972,BJ1461 .O25 1972,341186,CLEMONS,1972,Free will /,"O'Connor, D. J. (Daniel John),",X000818756,BY-REQUEST,BY-REQUEST,BOOK,6/28/96,6/23/08,0,0,21,121,1
BJ 001461 .O27  2000,BJ1461 .O27 2000,3518511,ALDERMAN,2000,Persons and causes : the metaphysics of free will /,"O'Connor, Timothy,",X004394510,STACKS,STACKS,BOOK,3/23/00,1/9/17,1,0,1,16,1
BJ 001461 .O35  1961,BJ1461 .O35 1961,1159071,ALDERMAN,1961,An inquiry into the freedom of decision.,"Ofstad, Harold,",X000685112,STACKS,STACKS,BOOK,6/29/96,9/25/08,0,0,0,3,1
BJ 001461 .O39  1988,BJ1461 .O39 1988,1285696,ALDERMAN,1988,Moral freedom /,"Olen, Jeffrey.",X001462685,STACKS,STACKS,BOOK,6/30/96,3/28/03,0,0,0,3,1
BJ 001461 .P3,BJ1461 .P3,1159070,ALDERMAN,1911,"The problem of freedom,","Palmer, George Herbert,",X000920674,STACKS,STACKS,BOOK,6/29/96,9/3/10,0,0,0,1,1
BJ 001461 .P4  1963,BJ1461 .P4 1963,247985,ALDERMAN,1963,Freedom and the will.,"Pears, David,",X000027019,STACKS,STACKS,BOOK,6/28/96,4/10/03,0,0,0,7,1
BJ 001461 .P468  2014,BJ1461 .P468 2014,6247804,ALDERMAN,2014,"Free will, agency, and meaning in life /","Pereboom, Derk,",X031626586,STACKS,CHECKEDOUT,BOOK,5/7/14,5/17/18,1,2,1,3,1
BJ 001461 .P47  2006,BJ1461 .P47 2006,4692218,CLEMONS,2006,Living without free will /,"Pereboom, Derk,",X030370502,BY-REQUEST,BY-REQUEST,BOOK,2/26/08,5/3/13,1,4,0,8,1
BJ 001461 .P54  2004,BJ1461 .P54 2004,4040491,ALDERMAN,2004,Free will : a very short introduction /,"Pink, Thomas.",X004771123,STACKS,STACKS,BOOK,6/28/04,5/5/14,2,3,2,28,1
BJ 001461 .P55  1996,BJ1461 .P55 1996,2650759,ALDERMAN,1996,The psychology of freedom /,"Pink, Thomas.",X004093247,STACKS,STACKS,BOOK,2/18/97,4/26/99,0,0,1,6,1
BJ 001461 .P66  1966,BJ1461 .P66 1966,812217,ALDERMAN,1966,Of clouds and clocks; an approach to the problem of rationality and the freedom of man.,"Popper, Karl R. (Karl Raimund),",X000458654,STACKS,STACKS,BOOK,6/29/96,1/1/00,0,0,0,3,1
BJ 001461 .P68  1983,BJ1461 .P68 1983,148557,ALDERMAN,1983,Freely chosen reality /,"Powell, Ralph Austin.",X000507112,STACKS,STACKS,BOOK,6/28/96,1/1/00,0,0,0,1,1
BJ 001461 .R45  2008,BJ1461 .R45 2008,4791118,ALDERMAN,2008,Free will : a philosophical reappraisal /,"Rescher, Nicholas.",X030505851,STACKS,CHECKEDOUT,BOOK,11/10/08,3/5/19,1,60,0,62,1
BJ 001461 .R45  2015,BJ1461 .R45 2015,6552920,ALDERMAN,2015,Free will : a philosophical reappraisal /,"Rescher, Nicholas,",X031706371,STACKS,STACKS,BOOK,5/13/15,9/15/18,1,0,0,1,1
BJ 001461 .R46,BJ1461 .R46,1159073,ALDERMAN,1972,Diderot's dilemma; his evaluation regarding the possibility of moral freedom in a deterministic universe,"Richards, Joyce A.,",X001542171,STACKS,STACKS,BOOK,6/29/96,1/15/03,0,0,0,3,1
BJ 001461 .S29  2000,BJ1461 .S29 2000,3706535,ALDERMAN,2000,Between freedom and necessity : an essay on the place of value,"Schroeder, Steven,",X004474558,STACKS,STACKS,BOOK,4/19/01,5/10/04,0,0,0,2,1
BJ 001461 .S36  1985,BJ1461 .S36 1985,82568,ALDERMAN,1985,Atoms of the living flame : an odyssey into ethics and the physical chemistry of free will /,"Scott, George P.",X001058330,STACKS,STACKS,BOOK,6/28/96,11/25/02,0,0,1,4,1
BJ 001461 .S62  1998,BJ1461 .S62 1998,2841479,ALDERMAN,1998,"Puzzles for the will : fatalism, Newcomb and Samarra, determinism and omniscience /","Sobel, Jordan Howard.",X004200828,STACKS,STACKS,BOOK,10/12/98,10/3/07,0,0,0,4,1
BJ 001461 .S67  2000,BJ1461 .S67 2000,3547015,ALDERMAN,2000,"Dialectics of the will : freedom, power, and understanding in modern French and German thought /","Smith, John H.,",X004415948,STACKS,STACKS,BOOK,7/4/00,4/17/03,0,0,1,2,1
BJ 001461 .S695  2012,BJ1461 .S695 2012,5722301,ALDERMAN,2012,A metaphysics for freedom /,"Steward, Helen.",X031216474,STACKS,STACKS,BOOK,7/25/12,4/19/18,2,1,1,3,1
BJ 001461 .S77  2010,BJ1461 .S77 2010,5253498,ALDERMAN,2010,Freedom and belief /,"Strawson, Galen.",X030744685,STACKS,STACKS,BOOK,11/17/10,9/18/17,1,0,0,3,1
BJ 001461 .S87  2015,BJ1461 .S87 2015,6512292,ALDERMAN,2015,"Surrounding free will : philosophy, psychology, neuroscience /",,X031705055,STACKS,STACKS,BOOK,2/25/15,5/4/15,1,1,0,2,1
BJ 001461 .T293  W35  2011,BJ1461 .T293 W35 2011,5270454,CLEMONS,2011,"Fate, time, and language : an essay on free will /","Wallace, David Foster.",X030810610,BY-REQUEST,BY-REQUEST,BOOK,1/11/11,4/23/13,5,3,0,12,1
BJ 001461 .T38  1989,BJ1461 .T38 1989,1759195,ALDERMAN,1989,Do we have free will? /,"Thornton, Mark.",X004791146,STACKS,STACKS,BOOK,6/9/04,1/1/00,0,0,0,0,1
BJ 001461 .T4,BJ1461 .T4,219295,ALDERMAN,1980,Free will : a defence against neurophysiological determinism /,"Thorp, John.",X030121134,STACKS,STACKS,BOOK,8/14/06,11/7/14,1,0,0,1,1
BJ 001461 .T5,BJ1461 .T5,165425,ALDERMAN,1981,Against fate : an essay on personal dignity /,"Tinder, Glenn E.",X000325959,STACKS,STACKS,BOOK,6/28/96,4/19/18,1,1,2,15,2
BJ 001461 .T78  1984,BJ1461 .T78 1984,672473,ALDERMAN,1984,Free will and responsibility /,"Trusted, Jennifer.",X000778460,STACKS,STACKS,BOOK,6/29/96,11/7/14,1,0,1,20,1
BJ 001461 .T78  1984,BJ1461 .T78 1984,672473,CLEMONS,1984,Free will and responsibility /,"Trusted, Jennifer.",X000904554,BY-REQUEST,BY-REQUEST,BOOK,6/29/96,3/18/08,0,0,1,52,1
BJ 001461 .V36  1983,BJ1461 .V36 1983,652747,ALDERMAN,1983,An essay on free will /,"Van Inwagen, Peter.",X000543097,STACKS,CHECKEDOUT,BOOK,6/29/96,10/13/18,1,1,1,39,1
BJ 001461 .V36  2017,BJ1461 .V36 2017,7049581,ALDERMAN,2017,Thinking about free will /,"Van Inwagen, Peter,",X031761668,STACKS,CHECKEDOUT,BOOK,4/19/17,5/17/18,2,3,0,5,1
BJ 001461 .V63  1964,BJ1461 .V63 1964,1159074,ALDERMAN,1964,Human freedom and responsibility.,"Vivian, Frederick.",X000918165,STACKS,STACKS,BOOK,6/29/96,12/6/01,0,0,0,6,1
BJ 001461 .W38  1999,BJ1461 .W38 1999,3493501,ALDERMAN,1999,Human freedom after Darwin : a critical rationalist view /,"Watkins, John W. N.",X004417489,STACKS,STACKS,BOOK,2/1/00,4/8/02,0,0,0,5,1
BJ 001461 .W55  1993,BJ1461 .W55 1993,2250522,ALDERMAN,1993,The question of free will : a holistic view /,"White, Morton,",X002310855,STACKS,STACKS,BOOK,7/1/96,11/19/01,0,0,0,12,1
BJ 001461 .W64  1990,BJ1461 .W64 1990,1792766,ALDERMAN,1990,Freedom within reason /,"Wolf, Susan R.",X001856314,STACKS,STACKS,BOOK,6/30/96,6/24/09,0,0,3,26,1
BJ 001461 .W66  1998,BJ1461 .W66 1998,2814790,ALDERMAN,1998,Freedom's embrace /,"Woody, J. Melvin,",X004214136,STACKS,STACKS,BOOK,7/23/98,1/1/00,0,0,0,0,1
BJ 001461 .W67  1996,BJ1461 .W67 1996,2509933,ALDERMAN,1996,Human freedom and the logic of evil : prolegomenon to a Christian theology of evil /,"Worsley, Richard,",X002712996,STACKS,STACKS,BOOK,7/1/96,4/19/18,1,1,1,13,1
BJ 001461 .W74,BJ1461 .W74,210282,ALDERMAN,1980,Freedom and determination /,"Wright, G. H. von (Georg Henrik),",X000446910,STACKS,STACKS,BOOK,6/28/96,11/7/14,1,0,0,9,1
BJ 001461 .Y68  1975,BJ1461 .Y68 1975,495606,ALDERMAN,1975,"Freedom, responsibility, and God /","Young, Robert,",X000013370,STACKS,STACKS,BOOK,6/29/96,9/25/08,0,0,1,9,1
BJ 001461 .Y685  1986B,BJ1461 .Y685 1986b,90549,ALDERMAN,1986,Personal autonomy : beyond negative and positive liberty /,"Young, Robert,",X000970776,STACKS,STACKS,BOOK,6/28/96,8/6/97,0,0,1,11,1
BJ 001462 .D3,BJ1462 .D3,805444,ALDERMAN,1950,La liberté de la volonté; signification des doctrines classiques.,"Daudin, Henri.",X001181122,STACKS,STACKS,BOOK,6/29/96,7/17/07,0,0,0,0,1
BJ 001462 .G4  1992,BJ1462 .G4 1992,2054296,ALDERMAN,1992,Prédétermination et liberté créée à Oxford au XIVe siècle : Buckingham contre Bradwardine /,"Genest, Jean François.",X002179137,STACKS,STACKS,BOOK,6/30/96,1/1/00,0,0,0,2,1
BJ 001462 .G659  1986,BJ1462 .G659 1986,705677,ALDERMAN,1986,Absolu et choix /,"Grenier, Jean,",X001223092,STACKS,STACKS,BOOK,6/29/96,9/25/08,0,0,0,0,1
BJ 001462 .G66  1982,BJ1462 .G66 1982,655220,ALDERMAN,1982,Entretiens sur le bon usage de la liberté /,"Grenier, Jean,",X000665285,STACKS,STACKS,BOOK,6/29/96,9/25/08,0,0,0,0,1
BJ 001462 .G6613  1967,BJ1462 .G6613 1967,817699,ALDERMAN,1967,Conversations on the good uses of freedom.,"Grenier, Jean,",X000501327,STACKS,STACKS,BOOK,6/29/96,1/1/00,0,0,0,0,1
BJ 001462 .L46  1993,BJ1462 .L46 1993,2155935,ALDERMAN,1993,La Recherche d'une première vérité et autres textes /,"Lequier, Jules,",X002314010,STACKS,STACKS,BOOK,7/1/96,7/17/07,0,0,0,2,1
BJ 001462 .S48  1944,BJ1462 .S48 1944,4595012,ALDERMAN,1944,Prévoir et savoir: études sur l'idée de la nécessité dans la pensée scientifique et en philosophie /,"Simon, Yves,",X030237708,STACKS,STACKS,BOOK,5/31/07,9/25/08,0,0,0,0,1
BJ 001462 .S4813  1996,BJ1462 .S4813 1996,2515726,ALDERMAN,1996,Foresight and knowledge /,"Simon, Yves R.,",X002741425,STACKS,STACKS,BOOK,7/1/96,1/1/00,0,0,0,1,1
BJ 001462 .S513,BJ1462 .S513,3482190,ALDERMAN,1969,Freedom of choice.,"Simon, Yves R;,",X000365379,STACKS,STACKS,BOOK,6/29/96,1/1/00,0,0,0,2,1
BJ 001463 .B6  1835,BJ1463 .B6 1835,1159077,ALDERMAN,1835,"Bockshammer, On the freedom of the human will.","Bockshammer, Gustav Ferdinand,",X000887625,STACKS,STACKS,BOOK,6/29/96,7/17/07,0,0,0,0,1
BJ 001463 .C63  H47  2001,BJ1463 .C63 H47 2001,4445377,ALDERMAN,2006,Hermann Cohen's Ethics /,,X030114339,STACKS,STACKS,BOOK,11/27/06,9/6/17,1,1,0,16,1
BJ 001463 .C73  1978,BJ1463 .C73 1978,194623,ALDERMAN,1978,Skeptische Betrachtungen über die Freiheit des Willens /,"Creuzer, Leonhard.",X030592777,STACKS,STACKS,BOOK,8/25/09,4/12/10,0,0,0,2,1
BJ 001463 .F7,BJ1463 .F7,1159078,ALDERMAN,1969,"Freiheit und Verantwortung, in Gesellschaft und Erziehung;",,X030756454,STACKS,STACKS,BOOK,6/29/96,1/1/00,0,0,0,0,1
BJ 001463 .H4,BJ1463 .H4,816538,ALDERMAN,1971,Schellings Abhandlung Über das Wesen der menschlichen Freiheit (1809),"Heidegger, Martin,",X000540567,STACKS,STACKS,BOOK,6/29/96,1/1/00,0,0,0,0,1
BJ 001463 .P27  1981,BJ1463 .P27 1981,5354,ALDERMAN,1981,Von der Freiheit des Willens und andere Schriften /,"Passavant, Johann Karl,",X000779906,STACKS,STACKS,BOOK,6/28/96,11/3/14,1,2,1,3,2
BJ 001463 .R654  2018,BJ1463 .R654 2018,7677129,ALDERMAN,2018,Freiheit zur Wahrheit : Grundlagen der Erkenntnis am Beispiel von Descartes und Locke /,"Rometsch, Jens.",X032211732,STACKS,STACKS,BOOK,8/29/18,1/1/00,0,0,0,0,1
BJ 001463 .S34  1925,BJ1463 .S34 1925,763866,ALDERMAN,1925,"Das Wesen der menschlichen Freiheit. Mit Einleitung, Namen- und Sachregister.","Schelling, Friedrich Wilhelm Joseph von,",X001048630,STACKS,STACKS,BOOK,6/29/96,9/13/13,1,0,1,10,1
BJ 001463 .S345  2006,BJ1463 .S345 2006,4445722,ALDERMAN,2006,Philosophical investigations into the essence of human freedom /,"Schelling, Friedrich Wilhelm Joseph von,",X030109495,STACKS,STACKS,BOOK,11/28/06,9/7/16,2,4,2,25,1
BJ 001463 .S35  1936,BJ1463 .S35 1936,451209,ALDERMAN,1936,"Schelling: Of human freedom; a translation of F. W. J. Schelling's Philosophische untersuchungen über das wesen der menschlichen freiheit und die damit zusammenhängenden gegenstände, with a critical introduction and notes,","Schelling, Friedrich Wilhelm Joseph von,",X000540545,STACKS,STACKS,BOOK,6/29/96,6/16/11,0,0,1,26,1
BJ 001463 .S354  1995,BJ1463 .S354 1995,2471772,ALDERMAN,1995,Über das Wesen der menschlichen Freiheit /,"Schelling, Friedrich Wilhelm Joseph von,",X006054806,STACKS,STACKS,BOOK,7/1/96,5/21/08,0,0,0,12,1
BJ 001463 .S356  F74  2008,BJ1463 .S356 F74 2008,4807666,ALDERMAN,2008,Schelling's dialogical Freedom essay : provocative philosophy then and now /,"Freydberg, Bernard,",X030473570,STACKS,STACKS,BOOK,12/19/08,5/2/11,0,0,0,3,1
BJ 001463 .S356  H4313  1985,BJ1463 .S356 H4313 1985,673084,ALDERMAN,1985,Schelling's treatise on the essence of human freedom /,"Heidegger, Martin,",X000910696,STACKS,STACKS,BOOK,6/29/96,5/2/11,0,0,2,11,1
BJ 001463 .S39,BJ1463 .S39,1159080,ALDERMAN,1970,Theologia crucis.,"Schwarzwäller, Klaus.",X000304269,STACKS,STACKS,BOOK,6/29/96,1/1/00,0,0,0,0,1
BJ 001463 .T494  2017,BJ1463 .T494 2017,7217961,ALDERMAN,2017,"Libertarismus, Willensfreiheit und Verursachung /","Tewes, Christian,",X031811506,STACKS,STACKS,BOOK,8/7/17,1/1/00,0,0,0,0,1
BJ 001463 .W3413  2001,BJ1463 .W3413 2001,3769387,ALDERMAN,2001,Neurophilosophy of free will : from libertarian illusions to a concept of natural autonomy /,"Walter, Henrik.",X004524075,STACKS,STACKS,BOOK,8/14/01,4/19/18,1,1,2,16,1
BJ 001464 .C45,BJ1464 .C45,118123,ALDERMAN,1980,Genesi e struttura dell'atto libero in s. Tommaso /,"Gigante, Mario.",X000318976,STACKS,STACKS,BOOK,6/28/96,9/25/08,0,0,0,0,1
BJ 001465 .S55  1989,BJ1465 .S55 1989,1742719,ALDERMAN,1989,En torno a la libertad y el determinismo : leyendo a Vaz Ferreira /,"Silva García, Mario A.",X001812713,STACKS,STACKS,BOOK,6/30/96,9/25/08,0,0,1,0,1
BJ 001466 .P59  1994,BJ1466 .P59 1994,2353908,ALDERMAN,1994,Poni?atie sud?by v kontektse raznykh kul?tur /,,X002539320,STACKS,STACKS,BOOK,7/1/96,9/25/08,0,0,0,0,1
BJ 001466 .S43  1983,BJ1466 .S43 1983,1296946,ALDERMAN,1983,Svoboda lichnosti i istoricheski? determinizm : kritika filosofsko? kont?sept?sii amerikanskogo protestantizma /,"Shla?fer, N. E. (Naum Efimovich)",X001337355,STACKS,STACKS,BOOK,6/30/96,9/25/08,0,0,0,0,1
BJ 001466 .S68  T.000001,BJ1466 .S68 t.1,807716,ALDERMAN,1975,Sovremenny? determinizm i nauka : [sbornik state? /,,X030756455,STACKS,STACKS,BOOK,6/29/96,1/1/00,0,0,0,0,1
BJ 001466 .S68  T.000002,BJ1466 .S68 t.2,807716,ALDERMAN,1975,Sovremenny? determinizm i nauka : [sbornik state? /,,X030756456,STACKS,STACKS,BOOK,7/29/10,1/1/00,0,0,0,0,1
BJ 001468.5 .B35  1995,BJ1468.5 .B35 1995,2523748,ALDERMAN,1995,The bounds of freedom : about the Eastern and Western approaches to freedom /,"Balaban, Oded.",X002758729,STACKS,STACKS,BOOK,7/1/96,10/27/97,0,0,0,1,1
BJ 001468.5 .B38  1999,BJ1468.5 .B38 1999,3486050,ALDERMAN,1999,Autonomie und Freiheit in der Medizin-Ethik : Immanuel Kant und Karl Barth /,"Baumann-Hölzle, Ruth.",X004405191,STACKS,STACKS,BOOK,1/11/00,7/17/07,0,0,0,0,6
BJ 001468.5 .C43  1988,BJ1468.5 .C43 1988,1227373,ALDERMAN,1988,Weakness of will /,"Charlton, William,",X001466740,STACKS,STACKS,BOOK,6/30/96,10/21/01,0,0,1,6,1
BJ 001468.5 .D68  1996,BJ1468.5 .D68 1996,2624318,ALDERMAN,1996,Metaphilosophy and free will /,"Double, Richard.",X004045199,STACKS,STACKS,BOOK,11/2/96,4/19/18,1,1,0,14,1
BJ 001468.5 .G64,BJ1468.5 .G64,380532,ALDERMAN,1976,"Learning to choose : stories and essays about science, technology, and human values /","Goldberg, Lazer.",X000631845,STACKS,STACKS,BOOK,6/28/96,1/1/00,0,0,0,1,1
BJ 001468.5 .H6,BJ1468.5 .H6,517182,ALDERMAN,1975,Strategien der Humanität : zur Ethik öffentl. Entscheidungsprozesse /,"Höffe, Otfried.",X000182497,STACKS,STACKS,BOOK,6/29/96,5/2/08,0,0,0,1,1
BJ 001468.5 .K37,BJ1468.5 .K37,618134,ALDERMAN,1973,Without guilt and justice: from decidophobia to autonomy,"Kaufmann, Walter,",X000205758,STACKS,STACKS,BOOK,6/29/96,1/1/00,0,0,0,0,1
BJ 001468.5 .K37,BJ1468.5 .K37,618134,ALDERMAN,1973,Without guilt and justice: from decidophobia to autonomy,"Kaufmann, Walter,",X000483326,STACKS,STACKS,BOOK,6/29/96,1/19/12,0,1,0,8,1
BJ 001468.5 .K54  1990,BJ1468.5 .K54 1990,1668552,ALDERMAN,1990,"Determinism, blameworthiness, and deprivation /","Klein, Martha.",X001779371,STACKS,STACKS,BOOK,6/30/96,7/23/09,0,0,1,7,1
BJ 001468.5 .K8  1965,BJ1468.5 .K8 1965,1159083,ALDERMAN,1965,Decision and the condition of man,"Kurtz, Paul,",X001171829,STACKS,STACKS,BOOK,6/29/96,1/1/00,0,0,0,1,1
BJ 001468.5 .L48  1986,BJ1468.5 .L48 1986,692907,ALDERMAN,1986,Hard choices : decision making under unresolved conflict /,"Levi, Isaac,",X001155116,STACKS,STACKS,BOOK,6/29/96,4/19/18,1,1,1,15,1
BJ 001468.5 .L74  1997,BJ1468.5 .L74 1997,2726782,ALDERMAN,1997,On freedom : a centenary anthology /,,X004114887,STACKS,STACKS,BOOK,10/21/97,1/1/00,0,0,0,0,1
BJ 001468.5 .M45  2012,BJ1468.5 .M45 2012,5714460,ALDERMAN,2012,Backsliding : understanding weakness of will /,"Mele, Alfred R.,",X031216130,STACKS,STACKS,BOOK,7/11/12,9/18/17,1,0,0,1,1
BJ 001468.5 .M53  1994,BJ1468.5 .M53 1994,2371908,ALDERMAN,1994,"The ethical primate : humans, freedom, and morality /","Midgley, Mary,",X002573845,STACKS,STACKS,BOOK,7/1/96,5/6/14,1,0,4,24,1
BJ 001468.5 .R83  2016,BJ1468.5 .R83 2016,6732061,ALDERMAN,2016,Abolishing freedom : a plea for a contemporary use of fatalism /,"Ruda, Frank,",X031795252,STACKS,STACKS,BOOK,5/25/16,6/10/16,1,0,0,1,1
BJ 001468.5 .T455  1993,BJ1468.5 .T455 1993,2332627,ALDERMAN,1993,Lonergan and Thomas on the will : an essay in interpretation /,"Tekippe, Terry J.",X002526284,STACKS,STACKS,BOOK,7/1/96,3/22/99,0,0,0,3,1
BJ 001469 .B47  1987B,BJ1469 .B47 1987b,1238939,ALDERMAN,1987,The rites of life : Christians and bio-medical decision making /,"Berry, Caroline.",X001338283,STACKS,STACKS,BOOK,6/30/96,4/27/98,0,0,2,2,1
BJ 001469 .B57  1992,BJ1469 .B57 1992,2140403,ALDERMAN,1992,"Birth, suffering, and death : Catholic perspectives at the edges of life /",,X002397063,STACKS,STACKS,BOOK,7/1/96,3/8/01,0,0,1,21,1
BJ 001469 .C66  1997,BJ1469 .C66 1997,2733696,ALDERMAN,1997,"Contingent future persons : on the ethics of deciding who will live, or not, in the future /",,X004114019,STACKS,STACKS,BOOK,11/11/97,5/10/04,0,0,1,5,1
BJ 001469 .G46  2002,BJ1469 .G46 2002,3862537,ALDERMAN,2002,A dialogue on ethical issues of life and death /,"Gennaro, Rocco J.",X004635105,STACKS,STACKS,BOOK,8/8/02,11/17/03,0,0,0,1,1
BJ 001469 .G58,BJ1469 .G58,729100,ALDERMAN,1977,Causing death and saving lives /,"Glover, Jonathan.",X000734846,STACKS,CHECKEDOUT,BOOK,6/29/96,2/7/19,2,27,4,55,1
BJ 001469 .K38  2001,BJ1469 .K38 2001,3727742,ALDERMAN,2001,Who counts as persons? : human identity and the ethics of killing /,"Kavanaugh, John F.",X004527472,STACKS,STACKS,BOOK,6/19/01,5/1/02,0,0,1,1,1
BJ 001469 .K54  1994,BJ1469 .K54 1994,2381286,ALDERMAN,1994,Killing and letting die /,,X002574711,STACKS,STACKS,BOOK,7/1/96,5/14/13,1,1,7,24,1
BJ 001469 .R43  1991,BJ1469 .R43 1991,1790375,ALDERMAN,1991,The thee generation : reflections on the coming revolution /,"Regan, Tom.",X001857185,STACKS,STACKS,BOOK,6/30/96,9/2/97,0,0,2,14,1
BJ 001469 .S45  2012,BJ1469 .S45 2012,5772671,ALDERMAN,2012,"Nihonjin no shiseikan o yomu : Meiji bushid? kara ""Okuribito"" e /","Shimazono, Susumu,",X031623336,STACKS,STACKS,BOOK,9/14/12,1/1/00,0,0,0,0,1
BJ 001469 .U54  1996,BJ1469 .U54 1996,2579976,ALDERMAN,1996,Living high and letting die : our illusion of innocence /,"Unger, Peter K.",X002783524,STACKS,STACKS,BOOK,7/1/96,1/27/19,4,2,0,29,1
BJ 001469 .U54  1996,BJ1469 .U54 1996,2579976,CLEMONS,1996,Living high and letting die : our illusion of innocence /,"Unger, Peter K.",X002783022,BY-REQUEST,BY-REQUEST,BOOK,7/1/96,4/28/13,1,8,0,22,1
BJ 001469 .W55  1999,BJ1469 .W55 1999,2948337,ALDERMAN,1999,Issues of life and death /,"Wilcockson, Michael.",X006120784,STACKS,STACKS,BOOK,9/27/99,7/17/07,0,0,0,1,1
BJ 001470 .A52,BJ1470 .A52,1159084,ALDERMAN,1975,Bh?van?yoga.,"?nanda,",X030756457,STACKS,STACKS,BOOK,6/29/96,1/1/00,0,0,0,0,1
BJ 001470 .B3  1956,BJ1470 .B3 1956,1159085,ALDERMAN,1956,Towards the center.,"Balokovi?, Joyce Borden.",X001171518,STACKS,STACKS,BOOK,6/29/96,9/25/08,0,0,0,2,1
BJ 001470 .B4,BJ1470 .B4,500457,ALDERMAN,1975,The Puritan origins of the American self /,"Bercovitch, Sacvan.",X000027020,STACKS,STACKS,BOOK,6/29/96,9/8/17,3,0,4,88,1
BJ 001470 .B4,BJ1470 .B4,500457,CLEMONS,1975,The Puritan origins of the American self /,"Bercovitch, Sacvan.",X006082819,BY-REQUEST,BY-REQUEST,BOOK,6/29/96,3/31/15,2,1,8,39,1
BJ 001470 .C3613,BJ1470 .C3613,347176,ALDERMAN,1976,Pathway to sahaja nistai : Avirodha unthiyar of Sri Santhalinga Swami /,"C?ntali?ka,",X000162000,STACKS,STACKS,BOOK,6/28/96,4/16/03,0,0,0,3,1
