2413682,2,ALDERMAN,STACKS,HJ8015 .V67 1994,1994,Debt and adjustment in the world economy : structural asymmetries in North-South interactions /,"Vos, Rob,",X002625990,BOOK,7/1/96,5/8/98,STACKS,0,0,0,7,1
62234,2,ALDERMAN,STACKS,HJ8019 .K45 1984,1984,Monet‰re Aspekte der Staatsverschuldung /,"Ketterer, Karl-Heinz.",X000904653,BOOK,6/28/96,1/1/00,STACKS,0,0,0,0,1
2964065,2,ALDERMAN,STACKS,HJ802 .H33 1998,1998,Hacienda y polÌtica : las finanzas p˙blicas y los grupos de poder en la primera Rep˙blica Federal Mexicana /,,X004073237,BOOK,11/9/99,1/1/00,STACKS,0,0,0,0,1
697875,2,ALDERMAN,STACKS,HJ802 .T46 1986,1986,"The politics of penury : debt and taxes in Mexico, 1821-1856 /","Tenenbaum, Barbara A.,",X001158164,BOOK,6/29/96,6/14/14,STACKS,1,0,2,4,1
2975983,2,ALDERMAN,STACKS,HJ803 .A78 1999,1999,El federalismo y la coordinaciÛn impositiva en MÈxico /,"Astudillo Moya, Marcela.",X004356510,BOOK,12/15/99,11/19/18,CHECKEDOUT,1,0,0,1,1
315944,2,ALDERMAN,STACKS,HJ803 .I85,1976,La revoluciÛn hacendaria : la hacienda p˙blica con el presidente Calles /,"Iturriaga de la Fuente, JosÈ N.,",X000709064,BOOK,6/28/96,1/1/00,STACKS,0,0,0,0,1
1931714,2,ALDERMAN,STACKS,HJ803 .L3 1991,1991,ProgramaciÛn financiera y polÌtica macroeconÛmica : un modelo financiero de la economÌa mexicana /,"Lago Gallego, Ricardo V.",X002087775,BOOK,6/30/96,9/21/97,STACKS,0,0,0,2,1
3778627,2,ALDERMAN,STACKS,HJ803 .M33 2001,2001,"Mexico, a comprehensive development agenda for the new era /",,X006137530,BOOK,9/25/01,11/19/07,STACKS,0,0,0,4,1
1134512,2,ALDERMAN,STACKS,HJ803 .O69,1969,Las finanzas p˙blicas en el desarrollo socioeconÛmico de MÈxico.,"Ortiz Mena, Antonio.",X000424999,BOOK,6/29/96,1/1/00,STACKS,0,0,0,0,1
133149,2,ALDERMAN,STACKS,HJ803 .S47,1981,PolÌticas fiscales en MÈxico : un enfoque de equilibrio general /,"Serra Puche, Jaime,",X000599004,BOOK,6/28/96,1/1/00,STACKS,0,0,0,0,1
135299,2,ALDERMAN,STACKS,HJ803 .S48 1982,1982,Pobre patria! /,"Serrano Illescas, Alfonso.",X000762654,BOOK,6/28/96,1/1/00,STACKS,0,0,0,0,1
1316804,2,ALDERMAN,STACKS,HJ8030 .M57 1988,1988,Government debt in international financial markets /,"Morris, Dirk.",X001492140,BOOK,6/30/96,10/18/97,STACKS,0,0,1,2,1
811592,2 10 14,ALDERMAN,STACKS,HJ8030 .M6 1943,1943,The new philosophy of public debt /,"Moulton, Harold Glenn,",X031961535,BOOK,6/29/96,1/1/00,STACKS,0,0,0,0,1
2148319,2,ALDERMAN,STACKS,HJ8030 .S28 1990,1990,Economic and ethical aspects of the international debt problem /,"Sautter, Hermann.",X002310394,BOOK,7/1/96,1/1/00,STACKS,0,0,0,1,1
2491518,2 10,ALDERMAN,STACKS,HJ8032 .A2 S55 1995,1995,Principle and interest : Thomas Jefferson and the problem of debt /,"Sloan, Herbert E.",X002697735,BOOK,7/1/96,10/29/14,STACKS,1,0,3,41,1
2491518,2 10,ALDERMAN,STACKS,HJ8032 .A2 S55 1995,1995,Principle and interest : Thomas Jefferson and the problem of debt /,"Sloan, Herbert E.",X004189537,BOOK,5/29/98,11/2/14,STACKS,2,0,2,44,1
3795465,2 10,ALDERMAN,STACKS,HJ8032 .A2 S55 2001,2001,Principle and interest : Thomas Jefferson and the problem of debt /,"Sloan, Herbert E.",X004562594,BOOK,11/28/01,8/19/15,STACKS,2,1,6,25,1
1825313,2,ALDERMAN,STACKS,HJ8032 .A2 S73 1991,1991,"The public debt of the United States : an historical perspective, 1775-1990 /","Stabile, Donald.",X001926128,BOOK,6/30/96,4/26/11,STACKS,0,0,3,6,1
1294147,2,ALDERMAN,STACKS,HJ8036 .B83 1986,1986,Borrowing to defend the exchange rate and the timing and magnitude of speculative attacks /,"Buiter, Willem H.,",X001461724,BOOK,6/30/96,1/1/00,STACKS,0,0,0,0,1
1819286,2,ALDERMAN,STACKS,HJ8039 .L29 D56 1990,1990,Dios en deuda con los hombres : reflexiÛn pastoral sobre la Deuda Externa /,,X002030938,BOOK,6/30/96,10/5/09,STACKS,0,0,0,2,1
1896977,2 14,ALDERMAN,STACKS,HJ8046 .L57 1991,1991,"Banks, borrowers, and the establishment : a revisionist account of the international debt crisis /","Lissakers, Karin.",X002050528,BOOK,6/30/96,1/1/00,STACKS,0,0,0,3,1
2275307,2,ALDERMAN,STACKS,HJ8046 .W67 1993,1993,World debt and the human condition : structural adjustment and the right to development /,,X002436568,BOOK,7/1/96,11/15/02,STACKS,0,0,0,8,1
2411826,2,ALDERMAN,STACKS,HJ8046 .Z35 1986,1986,?iw?r ?awla al-duy?n wa-al-istiql?l : ma?a dir?sah ?an al-wa?? al-r?hin li-mady?n?yat Mi?r /,"Zak?, Ramz?,",X002592339,BOOK,7/1/96,1/1/00,STACKS,0,0,0,0,1
7311422,2,ALDERMAN,STACKS,HJ805 .N84 C47 1983,1983,"EconomÌa de guerra y poder regional en el siglo XIX : gastos militares, aduanas y comerciantes en aÒos de Vidaurri (1855-1864) /","Cerutti, Mario.",X031961612,BOOK,12/6/17,1/1/00,STACKS,0,0,0,0,1
578845,2 17,ALDERMAN,STACKS,HJ8083 .C65 1968,1971,Foreign development lending - Legal aspects. The papers and proceedings of a conference of legal advisors of national and international development lending and assistance agencies.,Conference on Legal Problems of Foreign Public Lending and Assistance,X000550787,BOOK,6/29/96,1/1/00,STACKS,0,0,0,0,1
78133,2,ALDERMAN,STACKS,HJ8083 .P65 1986,1986,The Politics of international debt /,,X001059752,BOOK,6/28/96,5/17/11,STACKS,0,0,16,120,1
26505,2,ALDERMAN,STACKS,HJ8083 .P76 1984,1984,The Problem of international debt /,,X000769340,BOOK,6/28/96,1/1/00,STACKS,0,0,0,1,1
129719,2,ALDERMAN,STACKS,HJ8083 .S95 1977,1978,"Financing and risk in development countries : based on the proceedings of a Symposium on Developing Countries' Debt, sponsored by the Export-Import Bank of the United States in April, 1977 /",Symposium on Developing Countries' Debt,X000015654,BOOK,6/28/96,1/29/02,STACKS,0,0,0,23,1
506118,2,ALDERMAN,STACKS,HJ8085 .H3 1947,1947,Will dollars save the world?,"Hazlitt, Henry,",X000550788,BOOK,6/29/96,11/19/01,STACKS,0,0,0,2,1
2524186,2,ALDERMAN,STACKS,HJ8085 .H37,1975,Improving the access of developing countries to the U. S. capital market /,"Hawkins, Robert G.",X000709176,BOOK,7/1/96,1/1/00,STACKS,0,0,0,0,1
1299793,2,ALDERMAN,STACKS,HJ8086 .I4 I47 1981,1981,The IMF memorandum.,,X001490572,BOOK,6/30/96,1/1/00,STACKS,0,0,0,0,1
2478812,2,ALDERMAN,STACKS,HJ81.3 .K45 1956,1956,"Report of the commission of inquiry into alleged corruption or other malpractices in relation to the affairs of the Nairobi City Council, December, 1955-March, 1956.",Kenya. Commission of Inquiry into alleged corruption or other malpractices in relations to the Affairs of the Nairobi City Council.,X002699393,BOOK,7/1/96,5/6/99,STACKS,0,0,0,2,1
7537814,2,ALDERMAN,STACKS,HJ810 .P656 2015,2015,PolÌtica fiscal : expresiÛn del poder de las Èlites centroamericanas /,,X032404563,BOOK,5/15/18,1/1/00,STACKS,0,0,0,0,1
6708247,2,ALDERMAN,STACKS,HJ8101 .A4155 2016,2016,The $13 trillion question : how America manages its debt /,,X031735242,BOOK,3/16/16,4/30/17,STACKS,1,5,1,6,1
1855838,2,ALDERMAN,STACKS,HJ8101 .B74 1991,1991,"Congress, human nature, and the federal debt : essays on the political psychology of deficit spending /","Brembeck, Cole Speicher.",X002010001,BOOK,6/30/96,10/13/04,STACKS,0,0,0,4,1
2654192,2,ALDERMAN,STACKS,HJ8101 .G67 1997,1997,Hamilton's blessing : the extraordinary life and times of our national debt /,"Gordon, John Steele.",X004093536,BOOK,2/28/97,4/24/17,STACKS,4,0,2,35,1
6822101,2,ALDERMAN,STACKS,HJ8101 .H34 2016,2016,"Public debt, inequality, and power : the making of a modern debt state /","Hager, Sandy Brian,",X031792253,BOOK,8/10/16,8/21/18,CHECKEDOUT,1,0,1,1,1
2264872,2,ALDERMAN,STACKS,HJ8101 .S74 1993,1993,The national debt conclusion : establishing the debt repayment plan /,"Steadman, Charles W.",X002328139,BOOK,7/1/96,11/25/96,STACKS,0,0,0,1,1
5267769,2 3,ALDERMAN,STACKS,HJ8101 .W43 2011,2011,Inflated : how money and debt built the American dream /,"Whalen, R. Christopher,",X030818559,BOOK,2/9/11,9/25/18,CHECKEDOUT,1,16,0,21,1
5267769,2 3,CLEMONS,BY-REQUEST,HJ8101 .W43 2011,2011,Inflated : how money and debt built the American dream /,"Whalen, R. Christopher,",X030812538,BOOK,1/4/11,2/28/13,BY-REQUEST,3,0,0,8,1
4707975,2 10,ALDERMAN,STACKS,HJ8101 .W74 2008,2008,"One nation under debt : Hamilton, Jefferson, and the history of what we owe /","Wright, Robert E. (Robert Eric),",X030258059,BOOK,5/20/08,4/27/17,STACKS,4,7,1,18,1
1141127,2,ALDERMAN,STACKS,HJ8106 .A3 1964,1964,The reports of Alexander Hamilton.,United States. Department of the Treasury,X000337705,BOOK,6/29/96,1/27/06,STACKS,0,0,5,45,1
1141128,2,ALDERMAN,STACKS,HJ8106 .T3,1950,Hamilton and the national debt.,"Taylor, George Rogers,",X000858967,BOOK,6/29/96,7/9/07,STACKS,0,0,1,4,1
571246,2 17,ALDERMAN,STACKS,HJ8115 .A58 1946,1946,"Management of the federal debt,","Abbott, Charles Cortez,",X000550799,BOOK,6/29/96,3/21/14,STACKS,1,0,0,1,1
265360,2,ALDERMAN,STACKS,HJ8117 .H7 1919,1919,"War borrowing; a study of Treasury certificates of indebtedness of the United States,","Hollander, Jacob H. (Jacob Harry),",X000550800,BOOK,6/28/96,3/21/14,STACKS,1,0,0,1,1
492845,2,ALDERMAN,STACKS,HJ8117 .S3 1919,1919,"The story of the liberty loans; being a record of the volunteer liberty loan army, its personnel, mobilization and methods. How America at home backed her armies and allies in the world war,","St. Clair, Labert.",X000550802,BOOK,6/29/96,1/1/00,STACKS,0,0,0,0,1
701231,2 17,ALDERMAN,STACKS,HJ8119 .B67 1987,1987,The economics of federal credit programs /,"Bosworth, Barry,",X001210400,BOOK,6/29/96,1/1/00,STACKS,0,0,0,1,1
817804,2 3 17,ALDERMAN,STACKS,HJ8119 .B8 1967,1967,"Public debt in a democratic society,","Buchanan, James M.",X000944267,BOOK,6/29/96,3/14/01,STACKS,0,0,1,5,1
817804,2 3 17,CLEMONS,BY-REQUEST,HJ8119 .B8 1967,1967,"Public debt in a democratic society,","Buchanan, James M.",X000141467,BOOK,6/29/96,1/1/00,BY-REQUEST,0,0,0,0,1
2616700,2 14,ALDERMAN,STACKS,HJ8119 .C38 1996,1996,The truth about the national debt : five myths and one reality /,"Cavanaugh, Francis X.",X004047463,BOOK,10/10/96,4/3/00,STACKS,0,0,0,3,1
4330524,2,ALDERMAN,STACKS,HJ8119 .C55 2005,2005,The United States as a debtor nation /,"Cline, William R.",X004909514,BOOK,11/28/05,10/11/06,STACKS,0,0,1,7,1
554595,2 17,ALDERMAN,STACKS,HJ8119 .C6 1949,1949,Our national debt; its history and its meaning today.,"Committee on Public Debt Policy, New York.",X000550804,BOOK,6/29/96,1/1/00,STACKS,0,0,0,0,1
554593,2 3,ALDERMAN,STACKS,HJ8119 .F4 1964,1964,"Public debt and future generations,","Ferguson, James Milton",X000117631,BOOK,6/29/96,1/1/00,STACKS,0,0,1,0,1
282286,2,ALDERMAN,STACKS,HJ8119 .F57,1978,Fiscal responsibility in constitutional democracy /,,X000171586,BOOK,6/28/96,10/5/11,STACKS,0,0,0,3,1
544053,2 17,ALDERMAN,STACKS,HJ8119 .H3 1947,1947,The national debt and the new economics.,"Harris, Seymour Edwin,",X000550805,BOOK,6/29/96,1/1/00,STACKS,0,0,0,0,1
1894536,2,ALDERMAN,STACKS,HJ8119 .H35 1991,1991,Fundamentals of public credit analysis and financial reporting /,"Hausker, Arthur J.",X002000953,BOOK,6/30/96,1/30/07,STACKS,0,0,1,2,1
1374407,2 14,ALDERMAN,STACKS,HJ8119 .H43 1989,1989,The debt and the deficit : false alarms/real possibilities /,"Heilbroner, Robert L.",X001608867,BOOK,6/30/96,9/18/07,STACKS,0,0,0,12,1
1358781,2,ALDERMAN,STACKS,HJ8119 .H66 1988,1988,American albatross : the foreign debt dilemma /,"Hormats, Robert D.",X001597228,BOOK,6/30/96,9/18/07,STACKS,0,0,0,3,1
32868,2 3,ALDERMAN,STACKS,HJ8119 .I65 1984,1984,Hidden spending : the politics of federal credit programs /,"Ippolito, Dennis S.",X000822750,BOOK,6/28/96,10/14/98,STACKS,0,0,0,6,1
3520215,2,ALDERMAN,STACKS,HJ8119 .K45 2000,2000,The national debt : from FDR (1941) to Clinton (1996) /,"Kelly, Robert E.,",X004400092,BOOK,5/11/00,4/27/14,STACKS,1,1,0,2,1
8867,2,ALDERMAN,STACKS,HJ8119 .K55 1984,1984,"Deficits, borrowing and crowding out /","King, David T.",X000818130,BOOK,6/28/96,1/1/00,STACKS,0,0,1,2,1
700656,2 14,ALDERMAN,STACKS,HJ8119 .M34 1987,1987,The national debt /,"Malkin, Lawrence.",X001216401,BOOK,6/29/96,11/25/96,STACKS,0,0,1,6,1
1613600,2,ALDERMAN,STACKS,HJ8119 .P45 1989,1989,Dealing with the budget deficit /,"Penner, Rudolph Gerhard,",X001663612,BOOK,6/30/96,9/26/02,STACKS,0,0,2,5,1
68049,2,ALDERMAN,STACKS,HJ8119 .S45 1985,1985,The power of being debt free : how eliminating the national debt could radically improve your standard of living /,"Schuller, Robert H. (Robert Harold),",X000969958,BOOK,6/28/96,10/5/09,STACKS,0,0,0,2,1
4823153,2,ALDERMAN,STACKS,HJ8119 .S477 2008,2008,Sovereign wealth and sovereign power : the strategic consequences of American indebtedness /,"Setser, Brad.",X030469778,BOOK,2/24/09,4/27/09,STACKS,0,0,0,2,1
312942,2,ALDERMAN,STACKS,HJ8119 .V6 1943,1943,"Out of debt, out of danger; proposals for war finance and tomorrow's money,","Voorhis, Jerry,",X000378173,BOOK,6/28/96,1/1/00,STACKS,0,0,0,0,1
6243619,2 17,ALDERMAN,STACKS,HJ8119 .W45 2014,2014,America's fiscal constitution : its triumph and collapse /,"White, William H.,",X031626841,BOOK,5/14/14,6/24/14,STACKS,1,0,0,1,1
6243619,2 17,ALDERMAN,STACKS,HJ8119 .W45 2014,2014,America's fiscal constitution : its triumph and collapse /,"White, William H.,",X031635745,BOOK,4/15/14,9/29/14,STACKS,1,3,0,4,1
4720698,2,ALDERMAN,STACKS,HJ8119 .Y37 2008,2008,Forgive us our debts : the intergenerational dangers of fiscal irresponsibility /,"Yarrow, Andrew L.",X030258010,BOOK,5/20/08,5/22/08,STACKS,0,0,0,1,1
1134517,2,ALDERMAN,STACKS,HJ822 .A45 1952,1952,"Public finance and economic development in Guatemala,","Adler, John H. (John Hans),",X000980328,BOOK,6/29/96,9/21/17,STACKS,1,0,0,2,1
404251,2,ALDERMAN,STACKS,HJ8223 .R36 1941,1941,"American state debts,","Ratchford, Benjamin Ulysses,",X000425631,BOOK,6/28/96,10/7/04,STACKS,0,0,2,7,1
404251,2,ALDERMAN,STACKS,HJ8223 .R36 1941,1941,"American state debts,","Ratchford, Benjamin Ulysses,",X000550809,BOOK,6/28/96,11/16/15,STACKS,2,0,0,22,1
556177,2,ALDERMAN,STACKS,HJ8223 .S7,1930,"Public borrowing,","Studenski, Paul,",X000550810,BOOK,6/29/96,5/20/11,STACKS,0,0,1,14,1
620168,2,ALDERMAN,STACKS,HJ8224 .M3 1935,1935,"Foreign bondholders and American state debts,","McGrane, Reginald Charles,",X000550811,BOOK,6/29/96,10/7/04,STACKS,0,0,1,5,1
493503,2,ALDERMAN,STACKS,HJ8224 .S42,1893,"The repudiation of state debts; a study in the financial history of Mississippi, Florida, Alabama, North Carlina, South Carolina, Georgia,       Lousisiana, Arkansas, Tennesee, Minnesota, Michigan, and Virginia.","Scott, William Amasa,",X000550812,BOOK,6/29/96,8/24/15,STACKS,1,0,2,6,1
56238,2,ALDERMAN,STACKS,HJ832 .B6 1984,1984,GÈnesis de la intervenciÛn norteamericana en Nicaragua /,"BolaÒos, PÌo.",X000868735,BOOK,6/28/96,11/14/00,STACKS,0,0,0,3,1
1134518,2,ALDERMAN,STACKS,HJ832 .H5 1933,1933,"Fiscal intervention in Nicaragua,","Hill, Roscoe R.,",X000417795,BOOK,6/29/96,10/2/09,STACKS,0,0,0,0,1
1818420,2,ALDERMAN,STACKS,HJ842 .G38 1989,1989,Estudio de las finanzas p˙blicas de El Salvador /,"Gavidia Hidalgo, Amado.",X002126635,BOOK,6/30/96,1/1/00,STACKS,0,0,0,1,1
6261675,2,ALDERMAN,STACKS,HJ844.3 .C37 2014,2014,Caribbean renewal : tackling fiscal and debt challenges / editors Charles Amo-Yartey and Therese Turner-Jones.,International Monetary Fund.,X031637163,BOOK,5/27/14,1/1/00,STACKS,0,0,0,0,1
1238559,2,ALDERMAN,STACKS,HJ844.3 .J66 1985,1985,Public finance and monetary policy in open economies : a Caribbean perspective /,"Jones-Hendrickson, S. B. (Simon B.)",X001395918,BOOK,6/30/96,1/1/00,STACKS,0,0,0,0,1
654329,2,ALDERMAN,STACKS,HJ844.3 .R42 1981,1981,Readings in Caribbean public sector economics /,,X000775264,BOOK,6/29/96,10/2/09,STACKS,0,0,0,0,1
1910376,2,ALDERMAN,STACKS,HJ846 .R58 1990,1990,"La hacienda en Cuba durante la Guerra de los Diez AÒos, 1868-1880 /","Rold·n de Montaud, InÈs.",X002087624,BOOK,6/30/96,1/1/00,STACKS,0,0,0,1,1
389707,2,ALDERMAN,STACKS,HJ8463 .J65,1977,"Tennessee at the crossroads : the State debt controversy, 1870-1883 /","Jones, Robert B.,",X000709179,BOOK,6/28/96,10/4/06,STACKS,0,0,1,3,1
443850,2 10 14 17,ALDERMAN,STACKS,HJ8483 .M66,1974,"Two paths to the new South : the Virginia debt controversy, 1870-1883 /","Moore, James Tice.",X000128853,BOOK,6/29/96,9/2/16,STACKS,3,0,2,92,1
1141133,2,ALDERMAN,STACKS,HJ8483 .R6,1897,History of the Virginia debt controversy.,"Royall, William Lawrence,",X000445281,BOOK,6/29/96,12/1/14,STACKS,2,0,1,6,1
1141133,2,ALDERMAN,STACKS,HJ8483 .R6,1897,History of the Virginia debt controversy.,"Royall, William Lawrence,",X001609948,BOOK,6/29/96,9/12/11,STACKS,0,0,3,7,1
6781812,2 10 17,ALDERMAN,STACKS,HJ8483 .T37 2016,2016,"A saga of the New South : race, law, and public debt in Virginia /","Tarter, Brent,",X031741159,BOOK,6/23/16,10/20/18,STACKS,3,2,1,5,1
1989771,2,ALDERMAN,STACKS,HJ8512 .P48 1992,1992,"The borrowing process : public finance in the Province of Canada, 1840-1867 /","Piva, Michael J.",X002122361,BOOK,6/30/96,1/1/00,STACKS,0,0,0,1,1
2924391,2,ALDERMAN,STACKS,HJ8513 .A82 1998,1998,"Politics and public debt : the Dominion, the banks and Alberta's Social Credit /","Ascah, Robert L. (Robert Laurence),",X004267209,BOOK,6/28/99,1/1/00,STACKS,0,0,0,0,1
1958537,2,ALDERMAN,STACKS,HJ8513 .C56 1991,1991,Closing the books : dividing federal assets and debt if Canada breaks up /,,X002107598,BOOK,6/30/96,10/5/09,STACKS,0,0,1,1,1
2292405,2,ALDERMAN,STACKS,HJ8513 .D44 1993,1993,Deficits and debt in the Canadian economy /,,X002479648,BOOK,7/1/96,10/5/09,STACKS,0,0,1,3,1
3964214,2,ALDERMAN,STACKS,HJ8513 .L49 2003,2003,In the long run we're all dead : the Canadian turn to fiscal restraint /,"Lewis, Timothy,",X004659443,BOOK,8/26/03,5/4/06,STACKS,0,0,0,1,1
103393,2,ALDERMAN,STACKS,HJ8514.5 .A46 1984,1984,"La deuda externa de AmÈrica Latina : composiciÛn, orÌgenes y perspectivas /","Alatorre, Manuel R.,",X001049617,BOOK,6/28/96,1/1/00,STACKS,0,0,0,0,1
69128,2,ALDERMAN,STACKS,HJ8514.5 .A48 1984,1984,Endeudamiento externo en el Per˙ : bases para una posiciÛn conjunta en el contexto latinoamericano /,"Alva Castro, Luis.",X001005516,BOOK,6/28/96,1/1/00,STACKS,0,0,0,0,1
71276,2,ALDERMAN,STACKS,HJ8514.5 .A54 1984,1984,"AmÈrica Latina: deuda, crisis y perspectivas /",,X001025103,BOOK,6/28/96,1/1/00,STACKS,0,0,0,0,1
1830674,2,ALDERMAN,STACKS,HJ8514.5 .A57 1990,1990,AmÈrica Latina y el Caribe : opciones para reducir el peso de la deuda /,,X001941268,BOOK,6/30/96,1/1/00,STACKS,0,0,1,0,1
1753932,2,ALDERMAN,STACKS,HJ8514.5 .A6 1990,1990,"L'AmÈrique latine face ‡ la dette, 1982-1989 /",,X002001633,BOOK,6/30/96,1/1/00,STACKS,0,0,1,0,1
1619396,2,ALDERMAN,STACKS,HJ8514.5 .A78 1988,1988,Dependencia y deuda externa /,"Arancibia V., Sergio.",X001684671,BOOK,6/30/96,12/6/03,STACKS,0,0,3,8,1
1292490,2,ALDERMAN,STACKS,HJ8514.5 .B37 1987,1987,"Tercer mundo, monÛlogo norte-sur y deuda externa : derecho internacional econÛmico /","Barriga LÛpez, Leonardo.",X001398326,BOOK,6/30/96,10/5/09,STACKS,0,0,0,0,1
1300153,2,ALDERMAN,STACKS,HJ8514.5 .B66 1987,1987,El pacto de lo imposible : el papel del capital extranjero en la evoluciÛn de la deuda externa latinoamericana /,"Bonell, Fernando.",X001490401,BOOK,6/30/96,1/1/00,STACKS,0,0,0,0,1
1321675,2,ALDERMAN,STACKS,HJ8514.5 .B7313 1988,1988,"The debt squads : the US, the banks, and Latin America /","Branford, Sue.",X001503735,BOOK,6/30/96,4/2/04,STACKS,0,0,0,11,1
1799040,2,ALDERMAN,STACKS,HJ8514.5 .C3 1987,1987,Ajuste de cuentas en el Capitolio : una propuesta para solucionar la crisis interamericana de la deuda y fortalecer la paz social en el mundo /,"Caipo, Oscar.",X002046409,BOOK,6/30/96,10/5/09,STACKS,0,0,0,1,1
102765,2,ALDERMAN,STACKS,HJ8514.5 .C34 1985,1985,"La cancelaciÛn de la deuda externa y el nuevo orden econÛmico internacional como ˙nica alternativa verdadera, otros asuntos de interÈs polÌtico e histÛrico : texto completo de la entrevista concedida al periÛdico ExcÈlsior de MÈxico /","Castro, Fidel,",X001067474,BOOK,6/28/96,1/1/00,STACKS,0,0,0,0,1
107266,2,ALDERMAN,STACKS,HJ8514.5 .C35 1985,1985,"Endeudamiento y subversiÛn, AmÈrica Latina : entrevista a Fidel Castro /","Castro, Fidel,",X001055534,BOOK,6/28/96,1/1/00,STACKS,0,0,0,0,1
1236744,2,ALDERMAN,STACKS,HJ8514.5 .C36 1985,1985,"Fidel Castro habla a los trabajadores de AmÈrica Latina sobre la deuda externa : di·logo sostenido con los delegados a la Conferencia Sindical de los Trabajadores de AmÈrica Latina y el Caribe sobre la Deuda Externa, durante la sesiÛn de clausura del evento, el jueves 18 de julio de 1985.","Castro, Fidel,",X001396130,BOOK,6/30/96,1/1/00,STACKS,0,0,0,0,1
73845,2,ALDERMAN,STACKS,HJ8514.5 .C37 1985,1985,"Fidel Castro habla sobre la deuda externa y AmÈrica Latina : entrevista concedida por el comandante en jefe Fidel Castro Ruz, primer secretario del ComitÈ Central del Partido Comunista de Cuba y presidente de los Consejos de Estado y de Ministros, a Regino DÌaz, director del periÛdico Excelsior, de MÈxico, los dÌas 20 y 21","Castro, Fidel,",X001045535,BOOK,6/28/96,1/1/00,STACKS,0,0,0,0,1
107970,2,ALDERMAN,STACKS,HJ8514.5 .C373 1985,1985,La impagable deuda externa de AmÈrica Latina y del Tercer Mundo : como puede y debe ser cancelada y la urgente necesidad del nuevo orden econÛmico internacional : entrevista concedida al periÛdico ExcÈlsior de MÈxico /,"Castro, Fidel,",X001067369,BOOK,6/28/96,1/1/00,STACKS,0,0,0,0,1
72287,2,ALDERMAN,STACKS,HJ8514.5 .C374 1985,1985,"Sobre la deuda impagable de AmÈrica Latina, sus consecuencias imprevisibles y otros temas de interÈs polÌtico e histÛrico : entrevista concedida a la Agencia Efe /","Castro, Fidel,",X001055563,BOOK,6/28/96,1/1/00,STACKS,0,0,0,0,1
1243251,2,ALDERMAN,STACKS,HJ8514.5 .C65 1984,1984,"Endeudamiento externo de AmÈrica Latina : lineamientos generales de polÌticas de reestructuraciÛn y financiamiento : texto del Consenso de Cartagena, suscrito por cancilleres y ministros de hacienda de AmÈrica Latina, junio 21 de 1984.",,X001338777,BOOK,6/30/96,1/1/00,STACKS,0,0,1,0,1
1303739,2,ALDERMAN,STACKS,HJ8514.5 .C66 1988,1988,Coping with the Latin American debt /,,X001453267,BOOK,6/30/96,11/17/03,STACKS,0,0,2,16,1
786598,2,ALDERMAN,STACKS,HJ8514.5 .C74 1987 V.1,1987,La Crisis de la deuda externa en la AmÈrica Latina /,,X001312447,BOOK,6/29/96,1/1/00,STACKS,0,0,0,0,1
786598,2,ALDERMAN,STACKS,HJ8514.5 .C74 1987 V.2,1987,La Crisis de la deuda externa en la AmÈrica Latina /,,X001312412,BOOK,6/29/96,1/1/00,STACKS,0,0,0,0,1
1823796,2,ALDERMAN,STACKS,HJ8514.5 .C752 1990,1990,"La Crisis de la deuda externa : origenes, situaciÛn actual y perspectivas /",,X002044836,BOOK,6/30/96,1/1/00,STACKS,0,0,0,1,1
96935,2,ALDERMAN,STACKS,HJ8514.5 .D357 1985,1985,Deuda externa Latinoamericana y proceso de ajuste : experiencias y perspectivas /,,X031961620,BOOK,6/28/96,12/6/17,STACKS,0,0,0,0,1
1754773,2,ALDERMAN,STACKS,HJ8514.5 .D39 1990,1990,The first Latin American debt crisis : the city of London and the 1822-25 loan bubble /,"Dawson, Frank G. (Frank Griffith),",X001825387,BOOK,6/30/96,3/20/05,CHECKEDOUT,0,0,1,13,1
1381383,2,ALDERMAN,STACKS,HJ8514.5 .D437 1989,1989,"Debt, adjustment, and recovery : Latin America's prospects for growth and development /",,X001640411,BOOK,6/30/96,11/27/09,STACKS,0,0,6,32,1
681728,2,ALDERMAN,STACKS,HJ8514.5 .D44 1986,1986,"Debt, adjustment, and renegotiation in Latin America : orthodox and alternative approaches /",,X001109052,BOOK,6/29/96,4/22/07,STACKS,0,0,0,11,1
1310401,2 14,ALDERMAN,STACKS,HJ8514.5 .D445 1989,1989,Debt and democracy in Latin America /,,X001492690,BOOK,6/30/96,4/20/04,STACKS,0,0,7,37,1
1760914,2,ALDERMAN,STACKS,HJ8514.5 .D447 1990,1990,Debt and transfiguration : prospects for Latin America's economic revival /,,X001831218,BOOK,6/30/96,11/17/03,STACKS,0,0,0,15,1
789473,2,ALDERMAN,STACKS,HJ8514.5 .D47 1985,1985,La Deuda externa : informe de la situaciÛn chilena y latinoamericana.,,X001276703,BOOK,6/29/96,1/1/00,STACKS,0,0,0,0,1
1360488,2,ALDERMAN,STACKS,HJ8514.5 .D486 1988,1988,Deuda externa y crisis en AmÈrica Latina /,,X001595936,BOOK,6/30/96,1/1/00,STACKS,0,0,0,0,1
715045,2,ALDERMAN,STACKS,HJ8514.5 .D487 1986,1986,Deuda externa y reforma del sistema monetario internacional : resultados del II seminario internacional /,,X001229528,BOOK,6/29/96,1/1/00,STACKS,0,0,0,0,1
2498409,2,ALDERMAN,STACKS,HJ8514.5 .D488 1995,1995,La deuda p˙blica en AmÈrica Latina en perspectiva histÛrica = : The public debt in Latin America in historical perspective /,,X006040142,BOOK,7/1/96,8/22/02,STACKS,0,0,0,9,1
412019,2,ALDERMAN,STACKS,HJ8514.5 .D492,1976,"La Deuda p˙blica de EspaÒa y la economÌa novohispana, 1804-1809 /",,X000043954,BOOK,6/28/96,1/1/00,STACKS,0,0,0,1,1
1250709,2,ALDERMAN,STACKS,HJ8514.5 .D493 1988,1988,Development and external debt in Latin America : bases for a new consensus /,,X001365219,BOOK,6/30/96,11/21/16,STACKS,1,2,4,23,1
916,2 14,ALDERMAN,STACKS,HJ8514.5 .E53,1984,Latin America : the crisis of debt and growth /,"Enders, Thomas O.",X000846550,BOOK,6/28/96,4/20/99,STACKS,0,0,1,10,1
67993,2,ALDERMAN,STACKS,HJ8514.5 .E98 1985,1985,External debt and development strategy in Latin America /,,X000955610,BOOK,6/28/96,11/21/16,STACKS,1,2,4,16,1
44738,2,ALDERMAN,STACKS,HJ8514.5 .E983 1985,1985,External debt in Latin America : adjustment policies and renegotiation /,,X000969047,BOOK,6/28/96,2/24/17,STACKS,1,1,3,10,1
1661224,2,ALDERMAN,STACKS,HJ8514.5 .F56 1988,1988,La deuda externa y la revoluciÛn : ensayo crÌtico /,"Flores Quelopana, Gustavo.",X001924052,BOOK,6/30/96,10/5/09,STACKS,0,0,0,2,1
146251,2,ALDERMAN,STACKS,HJ8514.5 .F67 1983,1983,Foreign debt and Latin American economic development /,,X000543126,BOOK,6/28/96,3/19/01,STACKS,0,0,3,8,1
1613573,2,ALDERMAN,STACKS,HJ8514.5 .G36 1989,1989,El desarme financiero : pueblo y deuda en AmÈrica Latina /,"Garcia, Alan.",X001662460,BOOK,6/30/96,1/1/00,STACKS,0,0,0,0,1
773077,2,ALDERMAN,STACKS,HJ8514.5 .G37 1986,1986,La deuda externa de AmÈrica Latina : testimonio de la desigualdad mundial /,"Gavagnin Taffarel, Osvaldo.",X001278541,BOOK,6/29/96,1/1/00,STACKS,0,0,0,0,1
