Catalog Id,Bib Marc Subfield Data,Item Library Code,Item Collection,Item Call Number,Catalog Pub Year,Catalog Title,Catalog Author,Item Barcode,Item Type,Item Created Date,Item Last Checkout Date,Item Status,Item Lifetime Checkout,Item Lifetime Renewals,Item Lifetime Inhouse Uses,Item Legacy Total Charges,Number of Items
762031,2,ALDERMAN,STACKS,HJ10 .B3 D4,1840,"Remarks of Mr. Dellet, of Alabama, on the civil and diplomatic appropriation bill. Delivered in committee of the whole, in the House of representatives, April 25 and 27, 1840.","Dellet, James,",X031886925,BOOK,6/29/96,1/1/00,STACKS,0,0,0,0,1
272257,3,CLEMONS,BY-REQUEST,HJ10 .H2632,1937,"Board of Tax Appeals Index-digest, 1-30; organizing the official index-digests of all decisions promulgated by the U.S. Board of Tax Appeals from its beginning to July 31, 1934, as officially reported in volumes 1 to 30 United States Board of Tax Appeals Reports.",Commerce Clearing House.,272257-1001,BOOK,6/28/96,1/1/00,BY-REQUEST,0,0,0,0,1
7307093,2,ALDERMAN,STACKS,HJ10.3 .T39 2017,2017,Tax policy and the economy /,,X031810162,BOOK,11/29/17,12/1/17,STACKS,0,0,0,0,1
2798644,2,ALDERMAN,STACKS,HJ1000 .A98 1993 t.1,1993,Aux sources de la gestion publique /,,X004241041,BOOK,6/1/98,1/1/00,STACKS,0,0,1,0,1
2798644,2,ALDERMAN,STACKS,HJ1000 .A98 1993 t.2,1993,Aux sources de la gestion publique /,,X004241042,BOOK,6/1/98,1/1/00,STACKS,0,0,0,0,1
2798644,2,ALDERMAN,STACKS,HJ1000 .A98 1993 t.3,1993,Aux sources de la gestion publique /,,X004241043,BOOK,6/1/98,1/1/00,STACKS,0,0,0,0,1
5418893,2,ALDERMAN,STACKS,HJ1000 .D56 2011,2011,"Political transformations and public finances : Europe, 1650-1913 /","Dincecco, Mark,",X031188596,BOOK,10/7/11,10/3/18,CHECKEDOUT,2,4,0,6,1
2505326,2,ALDERMAN,STACKS,HJ1000 .E25 1995,1995,Economic systems and state finance /,,X002715498,BOOK,7/1/96,2/23/11,STACKS,0,0,2,10,1
2289694,2,ALDERMAN,STACKS,HJ1000 .F55 1994,1994,"Fiscal crises, liberty, and representative government, 1450-1789 /",,X002444797,BOOK,7/1/96,12/11/18,CHECKEDOUT,1,17,3,31,1
5205572,2,ALDERMAN,STACKS,HJ1000 .F5645 2009,2009,Fiscal policy making in the European Union : an assessment of current practice and challenges /,,X030780510,BOOK,8/18/10,8/24/10,STACKS,0,0,0,0,1
1988887,2 17,ALDERMAN,STACKS,HJ1000 .F57 1992,1992,"Fiscal policy, taxation, and the financial system in an increasingly integrated Europe /",,X002152539,BOOK,6/30/96,1/1/00,STACKS,0,0,0,0,1
2754916,2,ALDERMAN,STACKS,HJ1000 .G72 1997,1997,After Maastricht : a guide to European monetary union /,"Grahl, John.",X006057512,BOOK,1/7/98,11/19/03,STACKS,0,0,3,12,1
4075216,2,ALDERMAN,STACKS,HJ1000 .H35 2004,2004,Domestic budgets in a United Europe : fiscal governance from the end of Bretton Woods to EMU /,"Hallerberg, Mark.",X004802507,BOOK,10/12/04,11/29/12,STACKS,1,0,1,4,1
4869838,2,ALDERMAN,STACKS,HJ1000 .H352 2009,2009,Fiscal governance in Europe /,"Hallerberg, Mark.",X030466525,BOOK,4/28/09,12/9/12,STACKS,1,0,0,1,1
1791913,2,ALDERMAN,STACKS,HJ1000 .I6 1976,1988,"Prodotto lordo e finanza pubblica secoli XIII-XIX : atti della ""Ottava Settimana di Studi"", 3-9 maggio 1976 /",Istituto internazionale di storia economica F. Datini. Settimana di studio,X001862285,BOOK,6/30/96,2/10/03,STACKS,0,0,1,2,1
4008958,2,ALDERMAN,STACKS,HJ1000 .K39 2004,2004,The national element in the development of fiscal theory /,"Kayaalp, Orhan,",X004743307,BOOK,2/18/04,1/1/00,STACKS,0,0,0,0,1
105955,2,ALDERMAN,STACKS,HJ1000 .K63 1984,1984,Staatsausgaben in Westeuropa : Analysen zur langfristigen Entwicklung der ˆffentlichen Finanzen /,"Kohl, J¸rgen.",X001055681,BOOK,6/28/96,10/2/09,STACKS,0,0,0,1,1
2725608,2,ALDERMAN,STACKS,HJ1000 .L34 1997,1997,The finances of the European Union /,"Laffan, Brigid.",X004139640,BOOK,10/16/97,12/13/05,STACKS,0,0,1,3,1
2741942,2,ALDERMAN,STACKS,HJ1000 .L34 1997,1997,The finances of the European Union /,"Laffan, Brigid.",X006047160,BOOK,12/8/97,6/7/00,STACKS,0,0,0,20,1
5170824,2,ALDERMAN,STACKS,HJ1000 .P39 2010,2010,Paying for the liberal state : the rise of public finance in nineteenth-century Europe /,,X030620366,BOOK,6/30/10,5/14/16,STACKS,1,4,0,5,1
1760937,2,ALDERMAN,STACKS,HJ1000 .P76 1989,1989,Probleme der Finanzgeschichte des 19. und 20. Jahrhunderts /,,X001841324,BOOK,6/30/96,1/1/00,STACKS,0,0,1,0,1
6192064,2,ALDERMAN,STACKS,HJ1000 .Q47 2013,2013,Questioning credible commitment : perspectives on the rise of financial capitalism /,,X031607208,BOOK,2/11/14,11/12/18,CHECKEDOUT,2,0,1,2,1
5337726,2,ALDERMAN,STACKS,HJ1000 .R57 1999,1999,"The rise of the fiscal state in Europe, c. 1200-1815 /",,X030805213,BOOK,4/26/11,12/11/18,CHECKEDOUT,3,20,0,24,1
776230,2,ALDERMAN,STACKS,HJ1000 .W4 1987,1987,Wealth and taxation in Central Europe : the history and sociology of public finance /,,X001215931,BOOK,6/29/96,1/1/00,STACKS,0,0,0,2,1
90634,2,ALDERMAN,STACKS,HJ1000 .W55 1984,1984,Fiscal decentralisation /,"Wilson, Thomas,",X001018765,BOOK,6/28/96,4/24/97,STACKS,0,0,1,1,1
2055925,2,ALDERMAN,STACKS,HJ1000.5 .C65 1993,1993,Competitive disinflation : the mark and budgetary politics in Europe /,,X002227734,BOOK,6/30/96,2/14/00,STACKS,0,0,0,17,1
4884984,2,ALDERMAN,STACKS,HJ1000.5 .F57 2008,2000,Fiscal sustainability : analytical developments and emerging policy issues  /,,X030588688,BOOK,6/19/09,3/2/11,STACKS,0,0,0,0,1
5187561,2,ALDERMAN,STACKS,HJ1000.5 .H45 2010,2010,Ruling Europe : the politics of the Stability and Growth Pact /,"Heipertz, Martin.",X030620708,BOOK,7/28/10,11/13/12,STACKS,2,1,0,3,1
1656418,2,ALDERMAN,STACKS,HJ1000.5 .L43 1988,1988,Fiscal harmonisation : an analysis of the European Commission's proposals /,"Lee, C. M. (Catherine Macaulay)",X001729957,BOOK,6/30/96,1/1/00,STACKS,0,0,0,0,1
4605,2,ALDERMAN,STACKS,HJ1000.5 .P83 1984,1984,Fiscal harmonization in the European communities : national politics and international cooperation /,"Puchala, Donald James,",X000823651,BOOK,6/28/96,1/1/00,STACKS,0,0,0,0,1
3965508,2,ALDERMAN,STACKS,HJ1000.7 .N365 2002,2002,Municipal finance in selected European transition economies : institutional framework and recent development /,"Nam, Ch. W.",X004723414,BOOK,9/2/03,10/2/09,STACKS,0,0,0,0,1
1134539,2,ALDERMAN,STACKS,HJ1001 .H8,1934,"Studies in administration and finance, 1558-1825, with special reference to the history of salt taxation in England,","Hughes, Edward,",X000620361,BOOK,6/29/96,12/13/03,STACKS,0,0,0,10,1
1794415,2,ALDERMAN,STACKS,HJ1001 .M56,1945,"Principaux aspects de l'Èvolution financiËre de la France, 1936- 1944.","Mitzakis, Michel.",X001860066,BOOK,6/30/96,1/1/00,STACKS,0,0,1,0,1
778828,2,ALDERMAN,STACKS,HJ1001 .W34 1987b,1987,Planning public spending in the UK /,"Walshe, Grahame.",X001258490,BOOK,6/29/96,1/1/00,STACKS,0,0,0,0,1
763996,2,ALDERMAN,STACKS,HJ1003 .G7 B8 1964 V.1,1964,"The life and times of Sir Thomas Gresham, Knt.,","Burgon, John William,",X001122107,BOOK,6/29/96,10/2/09,STACKS,0,0,0,2,1
763996,2,ALDERMAN,STACKS,HJ1003 .G7 B8 1964 V.2,1964,"The life and times of Sir Thomas Gresham, Knt.,","Burgon, John William,",X001120657,BOOK,6/29/96,10/2/09,STACKS,0,0,1,2,1
2057305,2,ALDERMAN,STACKS,HJ1003 .L39 1992,1992,The view from no. 11 : memoirs of a tory radical /,"Lawson, Nigel.",X002244692,BOOK,6/30/96,4/22/14,STACKS,1,1,3,13,1
507368,2 3,ALDERMAN,STACKS,HJ1005 .H37,1975,"King, Parliament, and public finance in medieval England to 1369 /","Harriss, G. L.",X000270284,BOOK,6/29/96,11/21/16,STACKS,3,0,3,9,1
1134541,2,ALDERMAN,STACKS,HJ1005 .K33,1973,Bankers to the Crown; the Riccardi of Lucca and Edward I,"Kaeuper, Richard W.",X001044067,BOOK,6/29/96,1/1/00,STACKS,0,0,1,4,1
1134542,2,ALDERMAN,STACKS,HJ1005 .R3 1925 V.1,1925,"A history of the revenues of the kings of England, 1066-1399,","Ramsay, James H. (James Henry),",X000983367,BOOK,6/29/96,12/11/18,CHECKEDOUT,1,20,0,23,1
1134542,2,ALDERMAN,STACKS,HJ1005 .R3 1925 V.2,1925,"A history of the revenues of the kings of England, 1066-1399,","Ramsay, James H. (James Henry),",X001044055,BOOK,6/29/96,12/11/18,CHECKEDOUT,1,20,0,23,1
1134543,2,ALDERMAN,STACKS,HJ1007 .D452 1964 V.1,1964,"English public finance, 1485-1641","Dietz, Frederick C. (Frederick Charles),",X001122800,BOOK,6/29/96,12/11/18,CHECKEDOUT,1,20,0,24,1
1134543,2,ALDERMAN,STACKS,HJ1007 .D452 1964 V.2,1964,"English public finance, 1485-1641","Dietz, Frederick C. (Frederick Charles),",X000181792,BOOK,6/29/96,12/11/18,CHECKEDOUT,1,20,1,26,1
554709,3,CLEMONS,BY-REQUEST,HJ1007 .D452 1964b v.1,1964,"English public finance, 1485-1641","Dietz, Frederick C. (Frederick Charles),",X001288987,BOOK,6/29/96,10/15/10,BY-REQUEST,0,0,0,1,1
554709,3,CLEMONS,BY-REQUEST,HJ1007 .D452 1964b v.2,1964,"English public finance, 1485-1641","Dietz, Frederick C. (Frederick Charles),",X001288986,BOOK,6/29/96,10/15/10,BY-REQUEST,0,0,0,2,1
1134544,2,ALDERMAN,STACKS,HJ1007 .D453,1932,"English public finance, 1558-1641,","Dietz, Frederick C. (Frederick Charles),",X001848670,BOOK,6/29/96,5/29/12,STACKS,1,0,1,6,1
1193184,2,ALDERMAN,STACKS,HJ1007 .T4 1914,1914,"The financing of the hundred years' war, 1337-1360,","Terry, Schuyler Baldwin,",X002403788,BOOK,6/29/96,8/19/16,STACKS,1,0,0,3,1
5959935,2,ALDERMAN,STACKS,HJ101 .T35 2012,2012,Taking stock: a progress report on fiscal adjustment /,,X030860681,BOOK,3/18/13,1/1/00,STACKS,0,0,1,0,1
1134545,2,ALDERMAN,STACKS,HJ1011 .D6 1968,1968,"A financial, monetary, and statistical history of England, from the Revolution of 1688 to the present time; derived principally from official documents.","Doubleday, Thomas,",X000368532,BOOK,6/29/96,5/11/18,CHECKEDOUT,1,3,1,8,1
4288150,2,ALDERMAN,STACKS,HJ1011 .M355 2005,2005,The fiscal crisis of the United Kingdom /,"McLean, Iain.",X004833354,BOOK,6/21/05,6/24/05,STACKS,0,0,0,0,1
1134549,2,ALDERMAN,STACKS,HJ1012 .A85 1960,1960,"The Crown and the money market, 1603-1640.","Ashton, Robert.",X002526009,BOOK,6/29/96,10/29/02,STACKS,0,0,2,12,1
485244,2,ALDERMAN,STACKS,HJ1012 .C53,1975,"The English public revenue, 1660-1688 /","Chandaman, C. D.",X000283446,BOOK,6/29/96,12/13/03,STACKS,0,0,4,15,1
782430,2,ALDERMAN,STACKS,HJ1012 .C87 1987,1987,"The forced loan and English politics, 1626-1628 /","Cust, Richard.",X001282412,BOOK,6/29/96,5/11/17,STACKS,1,3,3,22,1
548525,2,ALDERMAN,STACKS,HJ1013 .B155,1971,"Government and contractors: the British Treasury and war supplies, 1775-1783.","Baker, Norman.",X000306483,BOOK,6/29/96,2/11/02,STACKS,0,0,1,4,1
121204,2,ALDERMAN,STACKS,HJ1013 .B84 1982,1982,"A great and necessary measure, George Grenville and the genesis of the Stamp Act, 1763-1765 /","Bullion, J. L.,",X000405018,BOOK,6/28/96,7/21/12,CHECKEDOUT,0,1,0,5,1
1134551,2,ALDERMAN,STACKS,HJ1015 .B8 1966 V.1,1966,"Finance and politics; an historical study,","Buxton, Sydney,",X000680267,BOOK,6/29/96,5/11/18,CHECKEDOUT,1,3,0,7,1
1134551,2,ALDERMAN,STACKS,HJ1015 .B8 1966 V.2,1966,"Finance and politics; an historical study,","Buxton, Sydney,",X002150108,BOOK,6/29/96,10/2/09,STACKS,0,0,0,2,1
3332625,2 17,ALDERMAN,STACKS,HJ1017 .B4 1993,1993,"Official aptitude maximized, expense minimized /","Bentham, Jeremy,",X002255931,BOOK,7/1/96,1/11/01,STACKS,0,0,0,16,1
1134554,2,ALDERMAN,STACKS,HJ1019 .N62 1867,1867,"Fiscal legislation, 1842-1865;","Noble, John,",X001639275,BOOK,6/29/96,1/1/00,STACKS,0,0,0,1,1
103241,2,ALDERMAN,STACKS,HJ1021 .K68 1984,1984,"Die Entwicklung kommunaler Finanzsysteme am Beispiel Grossbritanniens, Frankreichs und Deutschlands 1790-1980 /","Kˆster, Thomas,",X001042052,BOOK,6/28/96,1/1/00,STACKS,0,0,0,0,1
1134555,2,ALDERMAN,STACKS,HJ1021 .N6 1875,1875,"National finance: a review of the policy of the last two Parliaments,","Noble, John,",X002185168,BOOK,6/29/96,10/2/09,STACKS,0,0,0,1,1
2464244,2,ALDERMAN,STACKS,HJ1023 .B24 1995,1995,"Public sector economics : theory, policy and practice /","Bailey, S. J. (Stephen James),",X002668055,BOOK,7/1/96,6/6/00,STACKS,0,0,2,6,1
803254,2,ALDERMAN,STACKS,HJ1023 .B36 1945,1945,"Redistribution of incomes through public finance in 1937,","Barna, Tibor.",X000958944,BOOK,6/29/96,10/17/00,STACKS,0,0,0,1,1
125385,2,ALDERMAN,STACKS,HJ1023 .B45 1982,1982,Central grants to local governments : the political and economic impact of the rate support grant in England and Wales /,"Bennett, R. J. (Robert John)",X000480316,BOOK,6/28/96,10/17/00,STACKS,0,0,0,1,1
812,2,ALDERMAN,STACKS,HJ1023 .C364 1979,1979,Case studies in the economics of social issues /,,X000778937,BOOK,6/28/96,10/2/09,STACKS,0,0,0,0,1
4446268,2,ALDERMAN,STACKS,HJ1023 .C43 2006,2006,The chancellors' tales : managing the British economy /,,X004834502,BOOK,11/30/06,1/1/00,STACKS,0,0,0,0,1
809241,2,ALDERMAN,STACKS,HJ1023 .H456 1963,1963,"British public finances, their structure and development, 1880-1952.","Hicks, Ursula K. (Ursula Kathleen),",X002150110,BOOK,6/29/96,10/2/09,STACKS,0,0,1,2,1
1135902,2,ALDERMAN,STACKS,HJ1023 .H46,1938,"The finance of British government, 1920-1936,","Hicks, Ursula K. (Ursula Kathleen),",X002150099,BOOK,6/29/96,1/1/00,STACKS,0,0,0,1,1
3861743,2,ALDERMAN,STACKS,HJ1023 .H687 2002,2002,"Britain, France, and the financing of the First World War /","Horn, Martin,",X004470472,BOOK,7/9/02,8/8/16,STACKS,2,0,0,2,1
1135906,2,ALDERMAN,STACKS,HJ1023 .I4 1955,1955,Government finance and fiscal policy in post-war Britain.,"Ilersic, A. R. (Alfred Roman),",X001141418,BOOK,6/29/96,1/1/00,STACKS,0,0,0,0,1
1135907,2,ALDERMAN,STACKS,HJ1023 .K45 1940,1940,"How to pay for the war; a radical plan for the chancellor of the exchequer,","Keynes, John Maynard,",X000919336,BOOK,6/29/96,1/1/00,STACKS,0,0,0,1,1
1135907,2,ALDERMAN,STACKS,HJ1023 .K45 1940,1940,"How to pay for the war; a radical plan for the chancellor of the exchequer,","Keynes, John Maynard,",X002417216,BOOK,6/29/96,3/19/14,STACKS,1,0,0,12,1
1135908,2,ALDERMAN,STACKS,HJ1023 .K55 1921,1921,"British finance during and after the war, 1914-21,","Kirkaldy, Adam Willis,",X000420830,BOOK,6/29/96,4/5/98,STACKS,0,0,1,1,1
809873,2,ALDERMAN,STACKS,HJ1023 .M23,1939,"Public aspects of finance,","MacGregor, D. H. (David Hutchison),",X000496333,BOOK,6/29/96,4/5/98,STACKS,0,0,0,1,1
1135909,2,ALDERMAN,STACKS,HJ1023 .M3 1913 1st ser.,1913,"British budgets 1887-88 to 1912-13,","Mallet, Bernard,",X002150106,BOOK,6/29/96,2/1/05,STACKS,0,0,1,2,1
1135910,2,ALDERMAN,STACKS,HJ1023 .M3 1929 2nd ser.,1929,British budgets.,"Mallet, Bernard,",X000420815,BOOK,6/29/96,10/2/09,STACKS,0,0,0,0,1
1135911,2,ALDERMAN,STACKS,HJ1023 .M3 1933 3rd ser.,1933,British budgets.,"Mallet, Bernard,",X002185299,BOOK,6/29/96,2/8/16,STACKS,1,21,0,23,1
1135912,2,ALDERMAN,STACKS,HJ1023 .N5 1918,1918,"War finance,","Nicholson, J. Shield (Joseph Shield),",X000420813,BOOK,6/29/96,1/1/00,STACKS,0,0,2,0,1
134565,2,ALDERMAN,STACKS,HJ1023 .P59 1982,1982,"Getting and spending : public expenditure, employment, and inflation /","Pliatzky, Leo.",X000353400,BOOK,6/28/96,1/1/00,STACKS,0,0,0,0,1
666674,2,ALDERMAN,STACKS,HJ1023 .S15 1984,1984,Economics of public finance : an economic analysis of government expenditure and revenue in the United Kingdom /,"Sandford, Cedric,",X000859598,BOOK,6/29/96,1/1/00,STACKS,0,0,0,0,1
1135913,2,ALDERMAN,STACKS,HJ1023 .S2 1956,1956,"Financial policy,","Sayers, R. S. (Richard Sidney),",X031940738,BOOK,6/29/96,1/1/00,STACKS,0,0,0,0,1
4780662,2,ALDERMAN,STACKS,HJ1023 .W36 2006,2006,Were 364 economists all wrong? /,,X030475957,BOOK,10/8/08,3/19/14,STACKS,1,0,0,1,1
658653,2,ALDERMAN,STACKS,HJ1028 .F413 1983,1983,Dialogus de Scaccario = The course of the Exchequer /,"Fitzneale, Richard,",X000628572,BOOK,6/29/96,3/2/17,STACKS,2,0,2,14,1
4673109,2,ALDERMAN,STACKS,HJ1028 .F414 2007,2007,Dialogus de Scaccario : the dialogue of the Exchequer /,"Fitzneale, Richard,",X030276372,BOOK,12/13/07,10/25/18,CHECKEDOUT,1,0,1,3,1
818701,2,ALDERMAN,STACKS,HJ1028 .F42 1950,1950,"The course of the exchequer,","Fitzneale, Richard,",X001136273,BOOK,6/29/96,2/13/17,STACKS,1,0,1,3,1
1135937,2,ALDERMAN,STACKS,HJ1028 .H2 1891,1891,The antiquities and curiosities of the Exchequer.,"Hall, Hubert,",X001136126,BOOK,6/29/96,1/1/00,STACKS,0,0,0,1,1
2383132,2,ALDERMAN,STACKS,HJ1028 .H2 1968,1968,The antiquities and curiosities of the Exchequer.,"Hall, Hubert,",X002588191,BOOK,7/1/96,2/13/17,STACKS,2,2,0,4,1
529689,2,ALDERMAN,STACKS,HJ1028 .M25 1969 V.1,1969,The history and antiquities of the Exchequer of the Kings of England.,"Madox, Thomas,",X000357155,BOOK,6/29/96,10/2/09,STACKS,0,0,0,8,1
529689,2,ALDERMAN,STACKS,HJ1028 .M25 1969 V.2,1969,The history and antiquities of the Exchequer of the Kings of England.,"Madox, Thomas,",X000357154,BOOK,6/29/96,10/2/09,STACKS,0,0,0,7,1
1135915,2,ALDERMAN,STACKS,HJ1028 .P7,1912,The Exchequer in the twelfth century;,"Poole, Reginald Lane,",X000686778,BOOK,6/29/96,2/13/17,STACKS,1,0,0,5,1
119784,2,ALDERMAN,STACKS,HJ1030 .B27 1982,1982,Inside the Treasury /,"Barnett, Joel,",X000688975,BOOK,6/28/96,4/19/16,STACKS,0,12,0,14,1
1135917,2,ALDERMAN,STACKS,HJ1030 .B3 1957,1957,"The development of the Treasury, 1660-1702.","Baxter, Stephen Bartow,",X001200617,BOOK,6/29/96,4/21/14,STACKS,1,3,0,39,1
1135919,2,ALDERMAN,STACKS,HJ1030 .B75 1971,1971,Steering the economy.,"Brittan, Samuel.",X001005101,BOOK,6/29/96,1/1/00,STACKS,0,0,2,3,1
309916,2,ALDERMAN,STACKS,HJ1030 .B76,1964,The treasury under the Tories : 1951-1964 /,"Brittan, Samuel.",X000743129,BOOK,6/28/96,1/1/00,STACKS,0,0,0,0,1
2750206,2,ALDERMAN,STACKS,HJ1030 .D45 1997,1997,"The Chancellors : a history of the Chancellors of the Exchequer, 1945-90 /","Dell, Edmund.",X006044397,BOOK,12/17/97,10/2/09,STACKS,0,0,0,32,1
222008,2 17,ALDERMAN,STACKS,HJ1030 .K9,1980,The Chancellor of the Exchequer /,"Kynaston, David.",X000175536,BOOK,6/28/96,5/14/13,STACKS,1,2,0,4,1
237159,2,ALDERMAN,STACKS,HJ1030 .P4,1979,"British rearmament and the Treasury, 1932-1939 /","Peden, G. C.",X000014946,BOOK,6/28/96,11/27/18,STACKS,1,0,1,40,1
3523839,2,ALDERMAN,STACKS,HJ1030 .P414 2000,2000,"The Treasury and British public policy, 1906-1959 /","Peden, G. C.",X004435244,BOOK,4/11/00,11/13/18,STACKS,2,2,1,8,1
530605,2 3,ALDERMAN,STACKS,HJ1030 .R65 1969,1969,The Treasury; the evolution of a British institution.,"Roseveare, Henry.",X001848672,BOOK,6/29/96,8/8/18,CHECKEDOUT,3,4,0,54,1
1135938,2,ALDERMAN,STACKS,HJ1030 .R65 1973,1973,"The Treasury, 1660-1870: the foundations of control.","Roseveare, Henry.",X001533093,BOOK,6/29/96,11/17/16,CHECKEDOUT,1,2,0,44,1
87742,2,ALDERMAN,STACKS,HJ1036 .F5 1983b,1983,Financial management in government departments.,,X000944298,BOOK,6/28/96,10/2/09,STACKS,0,0,0,0,1
1135923,2,ALDERMAN,STACKS,HJ1037 .S25,1972,"Treasury officials, 1660-1870;","Sainty, John Christopher.",X030752814,BOOK,6/29/96,11/17/16,CHECKEDOUT,1,1,0,2,1
1648695,2,ALDERMAN,STACKS,HJ1039.6 .J63 1989,1989,Introduction of the community charge in Scotland /,"John, Peter.",X001734961,BOOK,6/30/96,1/1/00,STACKS,0,0,1,1,1
291387,2,ALDERMAN,STACKS,HJ1043 .F36,1978,"The Irish Department of Finance, 1922-58 /","Fanning, Ronan,",X000036051,BOOK,6/28/96,1/1/00,STACKS,0,0,0,0,1
1135925,2,ALDERMAN,STACKS,HJ1043 .L36 1965,1965,"The government of Northern Ireland; public finance and public services, 1921-1964","Lawrence, R. J. (Reginald James)",X000500296,BOOK,6/29/96,1/1/00,STACKS,0,0,0,0,1
420630,2,ALDERMAN,STACKS,HJ1059 .B47 1975,1975,Finances et absolutisme autrichien dans la seconde moitiÈ du XVIIË siËcle /,"BÈrenger, Jean,",X000046000,BOOK,6/29/96,1/1/00,STACKS,0,0,0,1,1
774774,2,ALDERMAN,STACKS,HJ1059 .D52 1987 V.1,1987,"Finance and government under Maria Theresia, 1740-1780 /","Dickson, P. G. M. (Peter George Muir)",X001261233,BOOK,6/29/96,5/8/08,STACKS,0,0,0,4,1
774774,2,ALDERMAN,STACKS,HJ1059 .D52 1987 V.2,1987,"Finance and government under Maria Theresia, 1740-1780 /","Dickson, P. G. M. (Peter George Muir)",X001261234,BOOK,6/29/96,5/8/08,STACKS,0,0,0,4,1
1636093,2,ALDERMAN,STACKS,HJ1059 .M4,1890,Die Finanzen Oesterreichs von 1701 bis 1740; nach archivalischen Quellen dargestellt.,"Mensi, Franz,",X001597666,BOOK,6/30/96,1/1/00,STACKS,0,0,1,1,1
789060,2,ALDERMAN,STACKS,HJ1059 .O87 1986,1986,Beitr‰ge zur Finanzgeschichte ÷sterreichs : Staatshaushalt und Steuern 1740-1840 /,"Otruba, Gustav.",X001312355,BOOK,6/29/96,5/8/08,STACKS,0,0,0,2,1
451199,2,ALDERMAN,STACKS,HJ1060 .B4 1973,1973,Die finanzen Oesterreichs im XIX. Jahrhundert.,"Beer, Adolf,",X000283448,BOOK,6/29/96,1/1/00,STACKS,0,0,0,0,1
1819997,2,ALDERMAN,STACKS,HJ1060 .P3,1883,Die chronische Finanznoth in Oesterreich /,"Pacher, Gustav von.",X031961578,BOOK,6/30/96,1/1/00,STACKS,0,0,0,0,1
293573,2,ALDERMAN,STACKS,HJ1061 .B7 1978 V.1,1978,Der ˆsterreichische Neoabsolutismus : Staatsfinanzen und Politik 1848-1860 /,"Brandt, Harm-Hinrich.",X000763236,BOOK,6/28/96,8/25/15,STACKS,0,0,0,1,1
293573,2,ALDERMAN,STACKS,HJ1061 .B7 1978 V.2,1978,Der ˆsterreichische Neoabsolutismus : Staatsfinanzen und Politik 1848-1860 /,"Brandt, Harm-Hinrich.",X000763238,BOOK,6/28/96,8/25/15,STACKS,0,0,0,1,1
2701780,2,ALDERMAN,STACKS,HJ1061 .K7,1927,Die Finanzreform des Grafen Wallis und der Staatsbankerott von 1811 /,"Kraft, Johanna.",X006041816,BOOK,7/14/97,8/7/97,STACKS,0,0,0,1,1
2261687,2,ALDERMAN,STACKS,HJ1061 .L54 1993,1993,"Staatskredit und Defizitfinanzierung in der ersten konstitutionellen Periode der Habsburger Monarchie, 1860-1867 /","Liese, Joachim,",X002327694,BOOK,7/1/96,1/1/00,STACKS,0,0,0,1,1
1256386,2,ALDERMAN,STACKS,HJ1063 .H36 1986,1986,Handbuch der ˆsterreichischen Finanzpolitik : Festgabe f¸r Wilhelm Weber zum 70. Geburtstag /,,X001259120,BOOK,6/30/96,10/2/09,STACKS,0,0,0,0,1
96369,2,ALDERMAN,STACKS,HJ1063 .P47 1984,1984,"÷sterreichische Finanzverfassung : Theorie, Praxis, Reform /","Pernthaler, Peter.",X001076058,BOOK,6/28/96,10/2/09,STACKS,0,0,0,0,1
698217,2,ALDERMAN,STACKS,HJ1063 .S64 1985,1985,Die l‰ngerfristige Entwicklung der ˆffentlichen Finanzwirtschaft in ÷sterreich im Zeitraum 1950-1983 /,"Smekal, Christian.",X001154200,BOOK,6/29/96,10/2/09,STACKS,0,0,0,0,1
779909,2,ALDERMAN,STACKS,HJ1065 .W34 1984,1984,Die Ordnung des ˆsterreichischen Staatshaushaltes--1863 /,"Wagner, Adolph,",X001156921,BOOK,6/29/96,1/1/00,STACKS,0,0,0,0,1
648376,2,ALDERMAN,STACKS,HJ1066 .J37 1981,1981,÷sterreichs ˆffentliche Finanzen : Versuch einer L‰ngs- und Querschnittsanalyse des ˆffentlichen Sektors unter besonderer Ber¸cksichtigung der Stabilit‰tspolitik /,"Jaros, Karl F.",X000887909,BOOK,6/29/96,10/2/09,STACKS,0,0,0,0,1
297954,2,ALDERMAN,STACKS,HJ1066 .O37,1977,"÷ffentliche Aufgaben und Finanzausgleich : eine Untersuchung d. Probleme des ˆsterr. Finanzausgleichs, durchgef¸hrt im Auftrag des Bundesmin. f. Finanzen /",,X000924310,BOOK,6/28/96,10/2/09,STACKS,0,0,0,0,1
5238599,2,ALDERMAN,STACKS,HJ1070 .B79 2010,2010,The economics of centralism and local autonomy : fiscal decentralization in the Czech and Slovak Republics /,"Bryson, Phillip J.",X030745966,BOOK,10/27/10,11/1/10,STACKS,0,0,0,0,1
176116,2,ALDERMAN,STACKS,HJ1070 .K89,1980,Finan?nÌ teorie a politika v oblasti st·tnÌho rozpo?tu /,"Kyzlink, VladimÌr.",X000395742,BOOK,6/28/96,10/2/09,STACKS,0,0,0,0,1
344308,2,ALDERMAN,STACKS,HJ1071 .M3 1965 V.1,1965,Histoire financiËre de la France depuis 1715.,"Marion, Marcel,",X000506535,BOOK,6/28/96,10/2/09,STACKS,0,0,0,0,1
344308,2,ALDERMAN,STACKS,HJ1071 .M3 1965 V.2,1965,Histoire financiËre de la France depuis 1715.,"Marion, Marcel,",X000506534,BOOK,6/28/96,10/2/09,STACKS,0,0,0,0,1
344308,2,ALDERMAN,STACKS,HJ1071 .M3 1965 V.3,1965,Histoire financiËre de la France depuis 1715.,"Marion, Marcel,",X000506533,BOOK,6/28/96,10/2/09,STACKS,0,0,0,0,1
344308,2,ALDERMAN,STACKS,HJ1071 .M3 1965 V.4,1965,Histoire financiËre de la France depuis 1715.,"Marion, Marcel,",X000506538,BOOK,6/28/96,10/2/09,STACKS,0,0,0,0,1
344308,2,ALDERMAN,STACKS,HJ1071 .M3 1965 V.5,1965,Histoire financiËre de la France depuis 1715.,"Marion, Marcel,",X000506537,BOOK,6/28/96,10/2/09,STACKS,0,0,0,1,1
344308,2,ALDERMAN,STACKS,HJ1071 .M3 1965 V.6,1965,Histoire financiËre de la France depuis 1715.,"Marion, Marcel,",X000506536,BOOK,6/28/96,10/2/09,STACKS,0,0,0,0,1
2498826,2,ALDERMAN,STACKS,HJ1071 .S58 1995,1995,Les CapÈtiens et l'argent au siËcle de Saint Louis : essai sur l'administration et les finances royales au XIIIe siËcle /,"SivÈry, GÈrard.",X006072014,BOOK,7/1/96,3/21/11,STACKS,0,0,2,1,1
391468,2,ALDERMAN,STACKS,HJ1072 .G73,1976,Besoins populaires et financement public /,"Grevet, Patrice.",X000709079,BOOK,6/28/96,1/1/00,STACKS,0,0,0,0,1
165511,2,ALDERMAN,STACKS,HJ1073 .B63 1978 V.1,1978,DÈclaration des biens des communautÈs : 1665-1670 /,"Bouchu,",X000221735,BOOK,6/28/96,1/1/00,STACKS,0,0,0,0,1
165511,2,ALDERMAN,STACKS,HJ1073 .B63 1978 V.2,1978,DÈclaration des biens des communautÈs : 1665-1670 /,"Bouchu,",X000221725,BOOK,6/28/96,1/1/00,STACKS,0,0,0,0,1
1135926,2,ALDERMAN,STACKS,HJ1073 .C45,1964,Les trÈsoriers de France ‡ l'Èpoque de la Fronde;,"Charmeil, Jean Paul.",X000824817,BOOK,6/29/96,1/1/00,STACKS,0,0,0,0,1
2729467,2,ALDERMAN,STACKS,HJ1073 .C66 1997,1997,L'administration des finances sous l'Ancien RÈgime : colloque tenu ‡ Bercy les 22 et 23 fÈvrier 1996 /,ComitÈ pour l'histoire Èconomique et financiËre de la France.,X006044256,BOOK,10/28/97,7/11/07,STACKS,0,0,0,3,1
1135927,2,ALDERMAN,STACKS,HJ1073 .E8,1966,"Etudes sur l'histoire des assemblÈes d'Ètats,",,X031961576,BOOK,6/29/96,1/1/00,STACKS,0,0,0,0,1
3695086,2,ALDERMAN,STACKS,HJ1073 .F44 1999,1999,"Finances et politique au siËcle des LumiËres : le ministËre L'Averdy, 1763-1768 /","FÈlix, JoÎl,",X004516900,BOOK,2/28/01,12/13/06,STACKS,0,0,0,1,1
3696237,2,ALDERMAN,STACKS,HJ1073 .F56 2000,2000,Les finances en province sous l'Ancien RÈgime : JournÈe d'Ètudes tenue ‡ Bercy le 3 dÈcembre 1998 /,,X004568246,BOOK,3/5/01,1/1/00,STACKS,0,0,0,0,1
426072,2,ALDERMAN,STACKS,HJ1073 .V84 1977 SER.1 V.2,1977,…tudes sur le rÈgime financier de la France avant la rÈvolution de 1789 /,"Vuitry, Adolphe,",X000709081,BOOK,6/29/96,10/2/09,STACKS,0,0,0,0,1
