237640,2,ALDERMAN,STACKS,HJ275 .V35,1979,Policy implementation in the Federal system : national goals and local implementors /,"Van Horn, Carl E.",X000172987,BOOK,6/28/96,8/10/11,STACKS,0,0,0,7,1
113207,2,ALDERMAN,STACKS,HJ275 .V37,1981,Reagan and the States /,"Vash, Edgar.",X000442378,BOOK,6/28/96,1/1/00,STACKS,0,0,0,0,1
2883346,2,ALDERMAN,STACKS,HJ275 .W25 1998,1998,From revenue sharing to deficit sharing : general revenue sharing and cities /,"Wallin, Bruce.",X004265106,BOOK,2/22/99,5/16/17,CHECKEDOUT,1,4,0,10,1
606921,2,ALDERMAN,STACKS,HJ275 .W289,1973,The financial outlook for State and local government to 1980,"Watters, Elsie M. (Elsie Marie),",X000126197,BOOK,7/1/96,1/1/00,STACKS,0,0,0,0,1
818433,2,ALDERMAN,STACKS,HJ275 .W55,1972,Grants administration,"Willner, William.",X000539611,BOOK,6/29/96,1/1/00,STACKS,0,0,0,0,1
1134457,2,ALDERMAN,STACKS,HJ275 .W58,1973,Revenue sharing,"Willner, William.",X000419994,BOOK,6/29/96,1/1/00,STACKS,0,0,0,0,1
545178,2 3 17,ALDERMAN,STACKS,HJ275 .W7 1968,1968,"Federal grants-in-aid: perspectives and alternatives,","Wright, Deil S.,",X000198695,BOOK,6/29/96,1/1/00,STACKS,0,0,0,0,1
545178,2 3 17,ALDERMAN,STACKS,HJ275 .W7 1968,1968,"Federal grants-in-aid: perspectives and alternatives,","Wright, Deil S.,",X001648117,BOOK,6/29/96,1/1/00,STACKS,0,0,1,1,1
339972,2 14,ALDERMAN,STACKS,HJ275 .W72,1978,"Understanding intergovernmental relations : public policy and participants' perspectives in local, state, and national governments /","Wright, Deil S.,",X000067972,BOOK,6/28/96,3/4/14,STACKS,2,0,4,9,1
4640627,2 17,ALDERMAN,STACKS,HJ275 .Z56 2007,2007,The silence of Congress : state taxation of interstate commerce /,"Zimmerman, Joseph Francis,",X030261551,BOOK,10/16/07,10/16/07,STACKS,0,0,0,0,1
3932433,1 2,ALDERMAN,STACKS,HJ275.2 .S73 2003,2003,Statistical issues in allocating funds by formula /,,X004632702,BOOK,5/1/03,1/1/00,STACKS,0,0,0,0,1
2883296,2,ALDERMAN,STACKS,HJ275.5 .P67 1998,1998,The politics of unfunded mandates : whither federalism? /,"Posner, Paul L.",X004265167,BOOK,2/22/99,2/9/09,STACKS,0,0,0,8,1
329190,2,ALDERMAN,STACKS,HJ2751 .K55,1977,Tax reform in eighteenth century Lombardy /,"Klang, Daniel M.",X000049639,BOOK,6/28/96,5/12/11,STACKS,0,0,0,2,1
42048,2,ALDERMAN,STACKS,HJ2755 .C66,1984,L'imposta diretta a Firenze nel Quattrocentro : 1427-1494 /,"Conti, Elio.",X000982394,BOOK,6/28/96,2/16/09,STACKS,0,0,0,3,1
1292401,2,ALDERMAN,STACKS,HJ2765 .B68 1986,1986,I tributi nell'economia italiana /,"Bosi, Paolo,",X001433303,BOOK,6/30/96,10/2/09,STACKS,0,0,0,0,1
332405,2 17,ALDERMAN,STACKS,HJ277 .P37,1977,Shared power : a study of four Federal funding systems in Appalachia /,"Pascale, Richard T.",X000038566,BOOK,6/28/96,10/14/04,STACKS,0,0,1,4,1
1664409,2,ALDERMAN,STACKS,HJ2773 .B37 S43 1987,1987,Tassazioni e tributi nella storia della Basilicata /,"Bastiani, Giuseppe,",X002455002,BOOK,6/30/96,10/2/09,STACKS,0,0,0,1,1
1317168,2,ALDERMAN,STACKS,HJ278 .M54 1988,1988,The Midwest response to the New Federalism /,,X001452026,BOOK,6/30/96,5/12/12,STACKS,0,1,1,5,1
1353027,2 17,ALDERMAN,STACKS,HJ2786 .W53 1989,1989,Tax reform in disequilibrium economies /,"Wibaut, Serge.",X001590861,BOOK,6/30/96,1/1/00,STACKS,0,0,0,0,1
2358802,2,ALDERMAN,STACKS,HJ2789 .F45 Z64 1994,1994,De beden in het graafschap Vlaanderen onder de hertogen Jan zonder Vrees en Filips de Goede (1405-1467) /,"Zoete, A.",X002539957,BOOK,7/1/96,1/1/00,STACKS,0,0,0,1,1
1759995,2,ALDERMAN,STACKS,HJ2789 .L54 D46 1986,1986,"Les finances d'un pays d'Ètats aux marches de l'Empire : la principautÈ de LiËge, 1688-1728 /","Demoulin, Bruno.",X001812529,BOOK,6/30/96,10/2/09,STACKS,0,0,1,1,1
177868,2,ALDERMAN,STACKS,HJ2796 .G47,1981,Enige problemen in het Nederlands belastingrecht /,"Geppaart, Ch. P. A.",X000493982,BOOK,6/28/96,10/2/09,STACKS,0,0,0,0,1
1835944,2,ALDERMAN,STACKS,HJ2799 .N4 K36 1986,1986,De belastingheffing in de Meierij van Den Bosch gedurende de Generaliteitsperiode (1648-1730) /,"Kappelhof, A. C. M.",X001219667,BOOK,6/30/96,1/1/00,STACKS,0,0,0,0,1
656094,2,ALDERMAN,STACKS,HJ2800 .A6 1982,1982,"Podatnai?a reforma Petra I : vvedenie podushno? podati v Rossii, 1719-1728 gg. /","Anisimov, E. V. (Evgeni? Viktorovich)",X000916415,BOOK,6/29/96,1/1/00,STACKS,0,0,0,1,1
64465,2,ALDERMAN,STACKS,HJ2800 .D97 1984,1984,Spravochnik po nalogam s naselenii?a /,"Dyrdov, S. N. (Stepan Nikolaevich)",X000974920,BOOK,6/28/96,1/1/00,STACKS,0,0,0,0,1
6425341,2,ALDERMAN,STACKS,HJ2801 .K68 2014,2014,States of obligation : taxes and citizenship in the Russian Empire and early Soviet Republic /,"Kotsonis, Yanni,",X031655400,BOOK,11/5/14,11/6/16,STACKS,1,4,1,5,1
3183791,2,ALDERMAN,STACKS,HJ2802 .H6,1955,Soviet taxation : the fiscal and monetary problems of a planned economy /,"Holzman, Franklyn D.",X000674413,BOOK,6/29/96,1/1/00,STACKS,0,0,0,0,1
226986,2,ALDERMAN,STACKS,HJ2802 .M5 1978,1978,Gosudarstvennye dokhody /,"Miroshchenko, S. M. (Stepan Makarovich)",X000222234,BOOK,6/28/96,1/1/00,STACKS,0,0,0,0,1
7365715,2,ALDERMAN,STACKS,HJ2802 .S83 1958,1958,Gosudarstvennye dokhody SSSR. /,"Suchkov, A. K.",X031940827,BOOK,2/22/18,1/1/00,STACKS,0,0,0,0,1
2527157,2,ALDERMAN,STACKS,HJ2808 .I53 1995,1995,"Indykcja dominiÛw, poddanych i miast ?l?ska wed?ug ""pierwszej rewizji"" z 1726 roku : materia?y do statystyczno-geograficznego opisu ?l?ska z pierwszej po?owy XVIII wieku /",,X006041604,BOOK,7/1/96,7/7/97,STACKS,0,0,0,1,1
1259805,2,ALDERMAN,STACKS,HJ2835 .G3,1987,Industrialisering och beskattning i Sverige 1861-1914 /,"GÂrestad, Peter.",X001336656,BOOK,6/30/96,10/2/09,STACKS,0,0,0,0,1
1790257,2,ALDERMAN,STACKS,HJ2835 .G76 1985,1985,The Swedish tax system /,"Grosskopf, Gˆran,",X001842812,BOOK,6/30/96,10/2/09,STACKS,0,0,1,1,1
177860,2,ALDERMAN,STACKS,HJ2837 .R63,1980,Offentlig inkomstexpansion : en analys av drivkrafterna bakom de offentliga inkomsternas utveckling i Sverige under 1900-talet = [The expansion of public income : an analysis of the major forces underlying the development of public income in Sweden in the twentieth century] /,"Rodriguez, Enrique,",X000528472,BOOK,6/28/96,1/1/00,STACKS,0,0,0,0,1
33888,2,ALDERMAN,STACKS,HJ2842 .L43 1982,1982,"Morabedi de Teruel y sus aldeas, 1384-1387 /","Ledesma Rubio, MarÌa Luisa.",X031940826,BOOK,6/28/96,1/1/00,STACKS,0,0,0,0,1
289155,2,ALDERMAN,STACKS,HJ2846 .M37,1978,El sistema tributario espaÒol en relaciÛn con el Mercado Com˙n /,"Matamala Palacio, Angel.",X000038706,BOOK,6/28/96,10/2/09,STACKS,0,0,0,0,1
272626,2,ALDERMAN,STACKS,HJ2846 .S6 1977,1977,"Los impuestos en EspaÒa, 1977.",Spain. Ministerio de Hacienda. SecretarÌa General TÈcnica.,X000061185,BOOK,6/28/96,10/2/09,STACKS,0,0,0,0,1
4633832,2,ALDERMAN,STACKS,HJ2849 .C33 A56 2007,2007,"El erario del reino : fiscalidad en Castilla a principios de la Edad Moderna, 1504-1525 /","Alonso GarcÌa, David.",X030357861,BOOK,9/27/07,1/1/00,STACKS,0,0,0,0,1
188349,2,ALDERMAN,STACKS,HJ2849 .E84 O86,1978,La reforma fiscal en la EspaÒa moderna : el caso de Extremadura /,"Otazu, Alfonso.",X031940832,BOOK,6/28/96,1/1/00,STACKS,0,0,0,0,1
7315585,2,ALDERMAN,STACKS,HJ2866 .S8 1938/47-,1948,Le revenu national suisse 1938-1947.,Switzerland. Statistisches Amt.,X031940830,BOOK,12/12/17,1/1/00,STACKS,0,0,0,0,1
640460,2,ALDERMAN,STACKS,HJ2906 .A84 1982,1982,Taxation and tax policies in the Middle East /,"Askari, Hossein.",X000402000,BOOK,6/29/96,11/6/17,STACKS,2,0,0,2,1
3572084,2,ALDERMAN,STACKS,HJ2906.5 .K43 2000,2000,al-?ar??ib al-?Uthm?n?yah f? al-qarn al-s?dis ?ashr /,"Khal?fah, ?I??m Kam?l.",X004529165,BOOK,10/11/00,10/2/09,STACKS,0,0,0,0,1
4244851,2,ALDERMAN,STACKS,HJ2920.8 .B835 2003,2003,"Budget highlights--2003 : tax legislative changes, 2002.",,X004887480,BOOK,5/9/05,1/1/00,STACKS,0,0,0,0,1
1345385,2,ALDERMAN,STACKS,HJ2920.9 .B47 1981,1981,Revenue administration in Nepal /,"Bhatta, Bhim Dev,",X001105450,BOOK,6/30/96,1/1/00,STACKS,0,0,0,0,1
1356007,2,ALDERMAN,STACKS,HJ2920.9 .D48,1976,An analysis of tax structure of Nepal /,"Dhungana, Bhawani.",X001545095,BOOK,6/30/96,1/1/00,STACKS,0,0,0,0,1
74743,2,ALDERMAN,STACKS,HJ2931 .B47 1985,1985,Fiscal policy for planned economic growth /,"Bhaduri, Sunil Chandra.",X001106245,BOOK,6/28/96,1/1/00,STACKS,0,0,0,0,1
1355009,2,ALDERMAN,STACKS,HJ2931 .T39 1984,1984,"Taxation : report of seminar held on July 22 and 23, 1983 at Vigyan Bhavan, New Delhi /",,X001545044,BOOK,6/30/96,1/1/00,STACKS,0,0,0,0,1
1631268,2,ALDERMAN,STACKS,HJ2931 .T48,1979,Revenue potential and revenue efforts of southern states /,"Thimmaiah, G.",X001669947,BOOK,6/30/96,1/1/00,STACKS,0,0,0,0,1
1618993,2,ALDERMAN,STACKS,HJ2932 .P73 1987,1987,Taxation in ancient India : from the earliest times up to the Guptas /,"Prasad, Kunwar Deo,",X001683476,BOOK,6/30/96,1/1/00,STACKS,0,0,0,0,1
97534,2,ALDERMAN,STACKS,HJ2932 .S85 1984,1984,"Uttara Bh?rata k? r?jasva vyavasth?, 1000-1200 I. /","?ukla, Devendra N?tha.",X001106223,BOOK,6/28/96,1/1/00,STACKS,0,0,0,0,1
76335,2,ALDERMAN,STACKS,HJ2932 .T75 1985,1985,Taxation and fiscal administration in ancient India : from the Vedic times to the end of the Mauryan period /,"Trip??h?, O?k?ran?tha,",X001076098,BOOK,6/28/96,1/1/00,STACKS,0,0,0,0,1
1132900,2,ALDERMAN,STACKS,HJ2934 .M9 N38,1972,Incidence of taxation in Mysore State.,National Council of Applied Economic Research.,X031940829,BOOK,6/29/96,1/1/00,STACKS,0,0,0,0,1
332858,2,ALDERMAN,STACKS,HJ2934.5 .P34 1976,1976,Taxation structure of Pakistan /,Pakistan. Finance Division.,X031940837,BOOK,6/28/96,1/1/00,STACKS,0,0,0,0,1
122166,2,ALDERMAN,STACKS,HJ2936 .B57 1980,1980,Union taxes in India /,"Bishnoi, Usha.",X031940836,BOOK,6/28/96,1/1/00,STACKS,0,0,0,0,1
248965,2,ALDERMAN,STACKS,HJ2936 .R36,1979,"The responsiveness of the Indian tax system, 1960-61 to 1973-74 /","Rao, Vemuri Ganapathi,",X031940835,BOOK,6/28/96,1/1/00,STACKS,0,0,0,0,1
6162785,2,ALDERMAN,STACKS,HJ2939 .B43 A83 2012,2012,"Early revenue history of Bengal and the fifth report, 1812 /","Ascoli, F. D. (Frank David),",X031592650,BOOK,12/6/13,1/1/00,STACKS,0,0,0,0,1
2421250,2,ALDERMAN,STACKS,HJ2939 .D43 S53 1994,1994,"British revenue and judicial policies in India : a case study of Deccan, 1818-1826 /","Singh, Meera.",X002620906,BOOK,7/1/96,11/25/14,STACKS,0,0,0,0,1
1623745,2,ALDERMAN,STACKS,HJ2939 .K85 S7 1979,1979,"Source material in U.P. State Archives on revenue, judicial, police, and jail administration on Kumaun, 1815 A.D.-1856 A.D. /",State Archives of Uttar Pradesh.,X001669368,BOOK,6/30/96,1/1/00,STACKS,0,0,0,0,1
1223644,2,ALDERMAN,STACKS,HJ2940 .S5 1987,1987,"The revenue system of the Cholas, 850-1279 /","Shanmugam, P. (Palani),",X001464629,BOOK,6/30/96,1/1/00,STACKS,0,0,0,0,1
2392197,2,ALDERMAN,STACKS,HJ2940.5 .C66 1991,1991,Comparative study of international taxation structures : with special reference to Pakistan.,,X002582162,BOOK,7/1/96,1/1/00,STACKS,0,0,0,0,1
120888,2,ALDERMAN,STACKS,HJ2940.5 .Z7 S23,1979,A study of zakat and ushr : with special reference to Pakistan /,"Sabzv?r?, Mu?ammad A?mad,",X000917140,BOOK,6/28/96,1/1/00,STACKS,0,0,0,0,1
2650478,2,ALDERMAN,STACKS,HJ2970 .W8 1984 v.1,1984,Zhongguo shui zhi shi /,"Wu, Zhaoxin.",X031940833,BOOK,2/17/97,1/1/00,STACKS,0,0,0,0,1
2650478,2,ALDERMAN,STACKS,HJ2970 .W8 1984 v.2,1984,Zhongguo shui zhi shi /,"Wu, Zhaoxin.",X031940834,BOOK,12/12/17,1/1/00,STACKS,0,0,0,0,1
1641795,2,ALDERMAN,STACKS,HJ2971 .K83 1989,1989,Business practices and taxation in Japan /,"Kuboi, Takashi.",X001702932,BOOK,6/30/96,1/1/00,STACKS,0,0,0,4,1
1378193,2,ALDERMAN,STACKS,HJ2971 .W33 1988,1988,Nihon no zeisei : s?tenken to shinjidai e no sentaku /,"Wada, Yatsuka,",X001595198,BOOK,6/30/96,1/1/00,STACKS,0,0,0,0,1
1604059,2,ALDERMAN,STACKS,HJ2976 .I84 1989,1989,The Japanese tax system /,"Ishi, Hiromitsu,",X001649443,BOOK,6/30/96,12/1/14,STACKS,1,0,0,4,1
5286524,2,ALDERMAN,STACKS,HJ2980.5 .A5 2002,2002,Kory? ch?n?gi ?i chaej?ng kujo /,"An, Py?ng-u.",X030943242,BOOK,2/11/11,1/1/00,STACKS,0,0,0,0,1
6161860,2,ALDERMAN,STACKS,HJ2980.5 .O259 2012,2012,Chos?n sidae ?i chosep?p /,"O, Ki-su.",X031632888,BOOK,12/2/13,1/1/00,STACKS,0,0,0,0,1
3933147,2,ALDERMAN,STACKS,HJ2981 .B47 2003,2003,Taxation without representation in contemporary rural China /,"Bernstein, Thomas P.",X004690354,BOOK,4/7/03,4/8/15,STACKS,1,0,0,5,1
1822909,2,ALDERMAN,STACKS,HJ2981 .C553 1988,1988,"Zhongguo jin dai shui zhi gai shu, 1840-1949 /",,X001638291,BOOK,6/30/96,1/1/00,STACKS,0,0,0,0,1
6138362,2,ALDERMAN,STACKS,HJ2981 .F88 2013,2013,Minguo shi qi ke juan za fei piao ju tu shi /,"Fu, Xingya,",X031615326,BOOK,10/9/13,1/1/00,STACKS,0,0,0,0,1
2869763,2,ALDERMAN,STACKS,HJ2981 .T35 1998,1998,Taxation in modern China /,,X004220697,BOOK,1/15/99,9/22/02,STACKS,0,0,0,4,1
3731598,2,ALDERMAN,STACKS,HJ2981 .W357 2001,2001,The Chinese economy in crisis : state capacity and tax reform /,"Wang, Shaoguang,",X004522236,BOOK,7/3/01,3/2/11,STACKS,0,0,0,7,1
4677911,2,ALDERMAN,STACKS,HJ2981 .W455 2006,2006,Huang liang guo shui : jie du shui shi si qian nian /,"Weng, Lihua.",X030407942,BOOK,1/8/08,1/1/00,STACKS,0,0,0,0,1
5698045,2,ALDERMAN,STACKS,HJ2981 .Y364 2012,2012,Wan Qing zhong yang yu di fang cai zheng guan xi yan jiu : yi li jin wei zhong xin = Wanqing zhongyang yu difang caizheng guanxi yanjiu : yi lijin wei zhongxin /,"Yang, Mei,",X030853732,BOOK,6/6/12,1/1/00,STACKS,0,0,0,0,1
2911311,2 17,ALDERMAN,STACKS,HJ2982 .B3 1999,1999,Fiscal policy in China : taxation and intergovernmental fiscal relations /,"Bahl, Roy W.",X004296209,BOOK,5/10/99,4/8/15,STACKS,1,0,0,6,1
6148684,2,ALDERMAN,STACKS,HJ2982 .C44 2013,2013,Zhongguo gu dai de na shui yu ying yi /,"Chen, Mingguang,",X031632600,BOOK,10/25/13,3/25/14,STACKS,0,0,0,0,1
2259580,2,ALDERMAN,STACKS,HJ2982 .C46 1984,1984,Ch?in Han fu i chih tu k?ao l¸eh /,"Qian, Jianfu.",X031940838,BOOK,7/1/96,1/1/00,STACKS,0,0,0,0,1
1968612,2,ALDERMAN,STACKS,HJ2982 .T3543 1991,1991,Ming dai fu yi zhi du shi /,"Tang, Wenji.",X002171124,BOOK,6/30/96,1/1/00,STACKS,0,0,0,0,1
1370772,2,ALDERMAN,STACKS,HJ2984 .C458 1985,1985,Qing Shizong yu fu yi zhi du di gai ge /,"Zhuang, Jifa.",X000992320,BOOK,6/30/96,7/17/08,STACKS,0,0,0,3,1
2926629,2,ALDERMAN,STACKS,HJ2984 .H5 1998,1998,"Qing dai fu shui zheng ce yan jiu, 1644-1840 nian /","He, Ping,",X004561134,BOOK,7/9/99,12/10/07,STACKS,0,0,0,2,1
2333908,2,ALDERMAN,STACKS,HJ2986 .A45 1994,1994,1994 : Zhongguo shui zhi gai ge /,,X002559982,BOOK,7/1/96,9/22/02,STACKS,0,0,0,1,1
1850276,2,ALDERMAN,STACKS,HJ2986 .C485 1988,1988,Zhongguo shui zhi gai ge shi nian /,,X001904476,BOOK,6/30/96,1/1/00,STACKS,0,0,0,0,1
2455456,2,ALDERMAN,STACKS,HJ2986 .C522 1995,1995,"Zhongguo shui shou zhi du, 1995 nian ban /",,X004055447,BOOK,7/1/96,1/1/00,STACKS,0,0,0,0,1
1822919,2,ALDERMAN,STACKS,HJ2986 .H285 1989,1989,Zhongguo xian xing shui shou zhi du /,"Han, Yingjie.",X001826568,BOOK,6/30/96,1/1/00,STACKS,0,0,0,0,1
1371220,2,ALDERMAN,STACKS,HJ2986 .K834 1988,1988,Zhongguo kang zhan shi ji shui zhi gai yao /,"Kuang, Qiu.",X001509671,BOOK,6/30/96,1/1/00,STACKS,0,0,0,0,1
5159753,2,ALDERMAN,STACKS,HJ2989 .D35 D54 1999,1999,Di guo zhu yi qin l¸e Dalian shi cong shu : shui wu juan /,,X030692211,BOOK,5/28/10,1/1/00,STACKS,0,0,0,0,1
4357423,2,ALDERMAN,STACKS,HJ2989 .K7 G83 1997,1928,Guangdong cai zheng shuo ming shu /,,X030088880,BOOK,3/28/06,10/2/09,STACKS,0,0,0,0,1
7019256,2,ALDERMAN,STACKS,HJ2989 .K85 1961,1961,Han'guk chose y?n'gu /,"Kwak, Sang-su.",X031595499,BOOK,3/29/17,4/17/17,STACKS,0,0,1,0,1
3943646,2,ALDERMAN,STACKS,HJ2996 .J46 2003,2003,Taxation and economic development in Taiwan /,"Jenkins, Glenn P.",X004663898,BOOK,5/27/03,11/22/17,STACKS,2,1,0,11,1
4594012,2,ALDERMAN,STACKS,HJ3018 .C53 1992,1992,Taxation in Islam and modern taxes /,"Chaudhry, Muhammad Sharif.",X030237856,BOOK,5/25/07,12/6/17,STACKS,0,0,0,0,1
5157325,2,ALDERMAN,STACKS,HJ3018 .P44 2009,2009,On Islamic taxation /,"Peerzade, Sayed Afzal.",X030711500,BOOK,5/11/10,1/1/00,STACKS,0,0,0,0,1
6147293,2,ALDERMAN,STACKS,HJ3021 .G37 2012,2012,Taxing colonial Africa : the political economy of British Imperialism /,"Gardner, Leigh.",X031579909,BOOK,10/16/13,9/5/18,CHECKEDOUT,2,0,0,2,1
6640382,2,ALDERMAN,STACKS,HJ3026 .P75 2015,2015,"Taxation, responsiveness, and accountability in sub-Saharan Africa : the dynamics of tax bargaining /","Prichard, Wilson,",X031731598,BOOK,11/11/15,4/17/17,STACKS,1,0,0,1,1
1664213,2,ALDERMAN,STACKS,HJ3027 .A55 1987,1987,"…tude comparÈe de la fiscalitÈ locale de villes africaines : Antananarivo, Bamako, Bujumbura, Conakry, Ouagadougou /","Anizon, Alain.",X002286526,BOOK,6/30/96,10/2/09,STACKS,0,0,0,3,1
714552,2,ALDERMAN,STACKS,HJ3036 .F72 1986,1986,The agrarian administration of Egypt from the Arabs to the Ottomans /,"Frantz-Murphy, Gladys.",X001226410,BOOK,6/29/96,11/16/05,STACKS,0,0,0,2,1
2366941,2,ALDERMAN,STACKS,HJ3036 .L37 1990,1990,al-F?r?q ?Umar wa-al-khar?j : li-m?dh? a?allat al-amw?l al-am?r?yah ma?all al-khar?j : dir?sah lil-aw??? al-m?l?yah f? Mi?r athn?? al-say?arah al-?Uthm?n?yah /,"L?sh?n, Ma?m?d al-Murs?.",X002527474,BOOK,7/1/96,1/1/00,STACKS,0,0,0,0,1
2443345,2,ALDERMAN,STACKS,HJ3036 .S35 1990,1990,al-?ar??ib wa-al-tanmiyah : dir?sah li-dawr al-?ar??ib ?al· al-dakhl f? tamw?l al-inf?q al-??mm bi-Mi?r /,"?a??d?, ?Abd All?h.",X002622121,BOOK,7/1/96,1/1/00,STACKS,0,0,0,0,1
2437277,2,ALDERMAN,STACKS,HJ3044 .K34 1990,1990,"The challenge [sic] of tax policy, 1971/72-1985/86 : a reflection /","Kafumbe-Mukasa, A.",X006007675,BOOK,7/1/96,9/3/97,STACKS,0,0,0,1,1
1762635,2,ALDERMAN,STACKS,HJ3049 .R33 1990,1990,RÈforme fiscale et rÈvolution socialiste ‡ Madagascar /,"Rabetafika, Roger,",X002006098,BOOK,6/30/96,1/1/00,STACKS,0,0,1,1,1
2137554,2,ALDERMAN,STACKS,HJ3051 .D38 1991,1991,"Taxation in a post apartheid South Africa : its limitation as a fiscal tool, a preliminary overview /","Davis, Dennis.",X002301892,BOOK,7/1/96,1/1/00,STACKS,0,0,0,1,1
1767834,2,ALDERMAN,STACKS,HJ3051 .S68 1988,1988,White paper on the report of the Commission of Inquiry into the Tax Structure of the Republic of South Africa : the Margo report.,South Africa.,X002127359,BOOK,6/30/96,1/1/00,STACKS,0,0,0,1,1
2146232,2,ALDERMAN,STACKS,HJ3058 .L56 1992,1992,Namibia's tax system /,"Linden, Eline van der.",X031940693,BOOK,7/1/96,1/1/00,STACKS,0,0,0,0,1
104574,2,ALDERMAN,STACKS,HJ3059 .U35 V2,1965,"Tax enquiry report 1964/65, with special reference to income tax and personal graduated tax,","Vallibhoy, F. H.",X000993751,BOOK,6/28/96,1/1/00,STACKS,0,0,1,1,1
4135205,2,ALDERMAN,STACKS,HJ3069 .R64 2005,2005,Fiscal disobedience : an anthropology of economic regulation in Central Africa /,"Roitman, Janet L. (Janet Lee)",X004808828,BOOK,11/9/04,5/2/15,CHECKEDOUT,0,10,3,20,1
2415821,2,ALDERMAN,STACKS,HJ3070 .N3 1993,1993,La nouvelle fiscalitÈ sÈnÈgalaise /,"Ndir, Papa Alassane.",X031940762,BOOK,7/1/96,1/1/00,STACKS,0,0,1,1,1
2755213,2,ALDERMAN,STACKS,HJ3096 .R47 1997,1997,Reshaping fiscal federalism in Australia /,,X006048105,BOOK,1/8/98,6/17/98,STACKS,0,0,1,2,1
1295914,2,ALDERMAN,STACKS,HJ3096 .S63 1987,1987,Spending and taxing : Australian reform options /,,X001399326,BOOK,6/30/96,1/1/00,STACKS,0,0,0,1,1
7347319,2,ALDERMAN,STACKS,HJ3238 .H36 B43 1984,1984,"Die Hansest‰dte und Mexiko : Handelspolitik, Vertr‰ge und Handel, 1821-1867 /","Becker, Felix.",X001023422,BOOK,6/29/96,12/4/17,STACKS,0,0,0,0,1
1132921,2,ALDERMAN,STACKS,HJ3241 .I53 1937,1937,Assessment principles and terminology.,International Association of Assessing Officers.,X000501699,BOOK,6/29/96,9/26/06,STACKS,0,0,0,1,1
1132922,2,ALDERMAN,STACKS,HJ3241 .I54 no.1 1937,1937,Construction and use of tax maps ...,International Association of Assessing Officers.,X030131852,BOOK,9/27/06,12/6/17,STACKS,0,0,0,0,1
767717,2,ALDERMAN,STACKS,HJ3241 .I55 1938 no.12,1938,Exemption of household furnishings from property taxation.,National Association of Assessing Officers (U.S.),X030131800,BOOK,6/29/96,10/2/09,STACKS,0,0,0,0,1
1132923,2,ALDERMAN,STACKS,HJ3241 .I55 1938 no.18,1938,The Costigan amendment using federal income tax returns in the administration of local property taxes ...,International Association of Assessing Officers.,1132923-1001,BOOK,6/29/96,1/1/00,STACKS,0,0,0,0,1
1132924,2,ALDERMAN,STACKS,HJ3241 .I55 1939 no.20,1939,Exemption and preferential taxation of homesteads ...,International Association of Assessing Officers.,X030131801,BOOK,6/29/96,10/2/09,STACKS,0,0,0,0,1
800775,2,ALDERMAN,STACKS,HJ3241 .I55 1939 no.21,1939,Property taxation of intangibles.,International Association of Assessing Officers.,800775-1001,BOOK,6/29/96,1/1/00,STACKS,0,0,0,0,1
1193118,2,ALDERMAN,STACKS,HJ3241 .I55 1939 no.23,1939,Exemption and institutional real property from taxation ...,International Association of Assessing Officers.,1193118-1001,BOOK,6/29/96,1/1/00,STACKS,0,0,0,0,1
1132925,2,ALDERMAN,STACKS,HJ3241 .I55 1939 no.24,1939,Exemption and preferential taxation of factories ...,International Association of Assessing Officers.,1132925-1001,BOOK,6/29/96,1/1/00,STACKS,0,0,0,0,1
797381,2,ALDERMAN,STACKS,HJ3241 .I56 10th 1940,1940,Personnel administration in local assessment offices;,International Association of Assessing Officers.,797381-1001,BOOK,6/29/96,1/1/00,STACKS,0,0,0,0,1
797382,2,ALDERMAN,STACKS,HJ3241 .I56 1st 1938,1938,Primary local assessment districts;,International Association of Assessing Officers.,X030131803,BOOK,6/29/96,1/1/00,STACKS,0,0,0,0,1
797383,2,ALDERMAN,STACKS,HJ3241 .I56 9th 1940,1940,"Selection, tenure, and compensation of assessors;",International Association of Assessing Officers.,797383-1001,BOOK,6/29/96,1/1/00,STACKS,0,0,0,0,1
1338540,2 17,ALDERMAN,STACKS,HJ3252 .B45 1989,1989,Taxpayers in revolt : tax resistance during the Great Depression /,"Beito, David T.,",X001519535,BOOK,6/30/96,5/6/06,STACKS,0,0,5,16,1
818360,2 17,ALDERMAN,STACKS,HJ3252 .C76 1955,1955,The Federal tax system of the United States; a survey of law and administration.,"Crockett, Joseph P.",X002197508,BOOK,6/29/96,1/1/00,STACKS,0,0,0,2,1
1132929,2,ALDERMAN,STACKS,HJ3252 .P33 1940,1940,Studies in federal taxation.,"Paul, Randolph E. (Randolph Evernghim),",X002551423,BOOK,6/29/96,1/12/17,CHECKEDOUT,2,0,0,3,1
305388,2 3 17,ALDERMAN,STACKS,HJ3252 .S7,1979,All you need to know about the IRS : a taxpayer's guide /,"Strassels, Paul N.",X000142296,BOOK,6/28/96,1/1/00,STACKS,0,0,0,0,1
1987244,2 14 17,ALDERMAN,STACKS,HJ3258 .A2 R57 1992,1992,"Reviving the American dream : the economy, the states, & the    federal government /","Rivlin, Alice M.",X002119066,BOOK,6/30/96,4/28/13,STACKS,1,2,2,21,1
257795,2,ALDERMAN,STACKS,HJ3392 .J3 M25 1977,1977,"The incidence of Jamaican taxes, 1971-72 /","McLure, Charles E.",X000977251,BOOK,6/28/96,1/1/00,STACKS,0,0,1,0,1
7323482,2,ALDERMAN,STACKS,HJ34 .Z9 A658,1970,"EstadÌsticas fiscales del Departamento de Antioquia y de sus municipios, 1968.",Antioquia (Colombia : Department). Departamento Administrativo de PlaneaciÛn.,X031964631,BOOK,12/19/17,1/1/00,STACKS,0,0,0,0,1
548515,2 17,ALDERMAN,STACKS,HJ3434 .A4 C6 1971,1971,"Fiscal reform for Colombia; final report and staff papers of the Colombian Commission on Tax Reform, Richard A. Musgrave, president.",Colombia. ComisiÛn de Reforma Tributaria.,X001086211,BOOK,7/1/96,1/1/00,STACKS,0,0,0,0,1
259349,2,ALDERMAN,STACKS,HJ3458 .H37,1979,"Das Steuersystem der europ‰ischen Staaten am Ende des Ancien RÈgime : eine offizielle franzˆsische Enquete (1763-1768) Dokumente, Analyse und Auswertung, England und die Staaten Nord- und Mitteleuropas /","Hartmann, Peter Claus,",X000396860,BOOK,6/28/96,1/1/00,STACKS,0,0,0,0,1
2272383,2,ALDERMAN,STACKS,HJ3464 .Z8 L5 1993,1993,Two Tudor subsidy assessment rolls for the city of London : 1541 and 1582 /,,X002412106,BOOK,7/1/96,1/1/00,STACKS,0,0,0,0,1
336166,2,ALDERMAN,STACKS,HJ3479 .A6 C68,1976,Face au fisc : contribuables et contrÙleurs /,"Courtois, Pierre.",X000709134,BOOK,6/28/96,1/1/00,STACKS,0,0,0,0,1
1935017,2,ALDERMAN,STACKS,HJ3479 .A6 M53 1991,1991,L'Eglise et l'argent sous l'Ancien RÈgime : les receveurs gÈnÈraux du clergÈ de France aux XVIe et XVIIe siËcles /,"Michaud, Claude,",X002075034,BOOK,6/30/96,9/10/01,STACKS,0,0,0,2,1
1661030,2,ALDERMAN,STACKS,HJ3479 .A6 P56 1990,1990,"Les Receveurs gÈnÈraux des finances, 1790-1865 : Ètude historique, rÈpertoires nominatif et territorial /","Pinaud, Pierre-FranÁois,",X001936767,BOOK,6/30/96,1/1/00,STACKS,0,0,1,0,1
1950463,2,ALDERMAN,STACKS,HJ3484 .B33 K84 1991,1991,Chronik des Finanzamts Konstanz : mit Ausz¸gen aus der Steuergeschichte /,"Kuhn, Hans-Dieter.",X002117082,BOOK,6/30/96,10/2/09,STACKS,0,0,1,1,1
117069,2,ALDERMAN,STACKS,HJ3534 .Z8 P87 1980 V.1,1980,"Rekeningen van de domeinen van Putten 1379-1429, met bijbehorende stukken /","Gouw, Jacobus Leonardus van der,",X000396108,BOOK,6/28/96,3/2/11,STACKS,0,0,0,0,1
117069,2,ALDERMAN,STACKS,HJ3534 .Z8 P87 1980 V.2,1980,"Rekeningen van de domeinen van Putten 1379-1429, met bijbehorende stukken /","Gouw, Jacobus Leonardus van der,",X000396110,BOOK,6/28/96,10/2/09,STACKS,0,0,0,0,1
276658,2,ALDERMAN,STACKS,HJ3544.2 .M3 1978,1978,Det danske skattevÊsen : kategorier og klasser : skatter pÂ landbefolkningen 1530-1660 /,"Madsen, Haakon Bennike.",X000010997,BOOK,6/28/96,1/1/00,STACKS,0,0,0,0,1
1755567,2,ALDERMAN,STACKS,HJ3564 .V38 M66 1989,1989,Le cadastre vaudois au XIXe siËcle /,"Monition, Thierry.",X001828340,BOOK,6/30/96,10/2/09,STACKS,0,0,1,0,1
1621118,2,ALDERMAN,STACKS,HJ3602 1964 .D3,1964,"Direct tax laws, 1964-1965 /","Dastur, S. E.",X031940789,BOOK,6/30/96,1/1/00,STACKS,0,0,0,0,1
1132950,2,ALDERMAN,STACKS,HJ3608 1958 .M3 1966,1966,"District office manual,",Madras (India : State). Revenue Department,X031940778,BOOK,12/12/17,12/14/17,STACKS,0,0,0,0,1
2442006,2,ALDERMAN,STACKS,HJ3610 .R36 1994,1994,The collector today : challenges of district administration /,"Ranjan, Alok,",X002622211,BOOK,7/1/96,11/25/97,STACKS,0,0,0,1,1
1865103,2,ALDERMAN,STACKS,HJ3611 .R35 C65 1987,1987,The Collectors recollect /,,X002001384,BOOK,6/30/96,1/1/00,STACKS,0,0,0,0,1
