213384,2,ALDERMAN,STACKS,HJ2051 .A78,1980,Moving money : an empirical analysis of Federal expenditure patterns /,"Anton, Thomas Julius.",X000325678,BOOK,6/28/96,1/1/00,STACKS,0,0,0,0,1
2577592,2,ALDERMAN,STACKS,HJ2051 .B26 1996,1996,Balancing the federal budget /,,X002711596,BOOK,7/1/96,11/15/03,STACKS,0,0,0,3,1
159046,2,ALDERMAN,STACKS,HJ2051 .B4,1981,Government spending : trends and issues /,"Beck, Morris,",X000224905,BOOK,6/28/96,1/1/00,STACKS,0,0,1,0,1
81004,2 14,ALDERMAN,STACKS,HJ2051 .B45 1985,1985,The deficits : how big? how long? how dangerous? /,"Bell, Daniel.",X001065308,BOOK,6/28/96,3/15/06,STACKS,0,0,0,3,1
2856505,2,ALDERMAN,STACKS,HJ2051 .B46 1998,1998,Deficit hysteria : a common sense look at America's rush to balance the budget /,"Benavie, Arthur.",X004153783,BOOK,11/23/98,11/21/04,STACKS,0,0,0,7,1
1136112,2,ALDERMAN,STACKS,HJ2051 .B73 1949,1949,The control of the public budget.,"Browne, Vincent J.",X000424938,BOOK,6/29/96,5/10/15,STACKS,2,2,0,6,1
1136113,2,ALDERMAN,STACKS,HJ2051 .B74,1964,U. S. budget and fiscal problems.,"Brundage, Percival Flack,",X031940810,BOOK,6/29/96,1/1/00,STACKS,0,0,0,0,1
1136114,2,ALDERMAN,STACKS,HJ2051 .B75 1929,1929,"Public budgeting; a discussion of budgetary practice in the national, state and local governments of the United States,","Buck, A. E. (Arthur Eugene),",X000455708,BOOK,6/29/96,2/21/97,STACKS,0,0,1,3,1
554533,2 3,ALDERMAN,STACKS,HJ2051 .B77 1968,1968,Budget concepts for economic analysis.,,X000117611,BOOK,6/29/96,1/1/00,STACKS,0,0,0,0,1
2688949,2 3 10,ALDERMAN,STACKS,HJ2051 .B7713 1997,1997,The budget deficit and the national debt.,,X006026813,BOOK,5/16/97,3/28/11,STACKS,0,0,1,9,1
2688949,2 3 10,CLEMONS,BY-REQUEST,HJ2051 .B7713 1997,1997,The budget deficit and the national debt.,,X006027017,BOOK,5/20/97,11/22/10,BY-REQUEST,0,0,0,4,1
184408,2 14,ALDERMAN,STACKS,HJ2051 .B775 1982,1982,Budgeting for America : the politics and process of federal spending.,,X000492597,BOOK,6/28/96,10/4/11,STACKS,0,0,0,2,1
4029478,2,ALDERMAN,STACKS,HJ2051 .B78 2004,2004,Restoring fiscal sanity : how to balance the budget /,,X004768803,BOOK,5/11/04,1/8/14,STACKS,1,1,0,4,1
1136115,2,ALDERMAN,STACKS,HJ2051 .B83 1956,1956,Government budgeting.,"Burkhead, Jesse.",X000769433,BOOK,6/29/96,1/1/00,STACKS,0,0,0,2,1
814099,2,ALDERMAN,STACKS,HJ2051 .B83 1962,1956,Government budgeting.,"Burkhead, Jesse.",X000386588,BOOK,6/29/96,1/1/00,STACKS,0,0,0,0,1
5365655,2,ALDERMAN,STACKS,HJ2051 .C26 2011,2011,Call for a new era in the U.S. budget /,,X030944729,BOOK,6/22/11,1/1/00,STACKS,0,0,0,0,1
1136116,2,ALDERMAN,STACKS,HJ2051 .C55,1920,The budget and responsible government;,"Cleveland, Frederick A. (Frederick Albert),",X000237982,BOOK,6/29/96,3/26/99,STACKS,0,0,1,9,1
2311414,2 14 17,ALDERMAN,STACKS,HJ2051 .C556 1994,1994,The budget puzzle : understanding federal spending /,"Cogan, John F.",X002480797,BOOK,7/1/96,1/19/07,STACKS,0,0,4,42,1
1136117,2,ALDERMAN,STACKS,HJ2051 .C6 1917,1917,"The national budget system,","Collins, Charles Wallace,",X000496193,BOOK,6/29/96,1/1/00,STACKS,0,0,0,1,1
666147,2,ALDERMAN,STACKS,HJ2051 .C64 1983,1983,Strengthening the federal budget process : a requirement for effective fiscal control /,Committee for Economic Development. Research and Policy Committee.,X000604887,BOOK,6/29/96,1/1/00,STACKS,0,0,0,0,1
170728,2 3 17,ALDERMAN,STACKS,HJ2051 .C66,1981,The Congressional budget process after five years /,,X000216305,BOOK,6/28/96,10/2/09,STACKS,0,0,0,4,1
684254,2,ALDERMAN,STACKS,HJ2051 .C7 1986,1986,Federal budget deficits : America's great consumption binge /,"Courant, Paul N.",X001209530,BOOK,6/29/96,1/1/00,STACKS,0,0,0,0,1
2409021,2,ALDERMAN,STACKS,HJ2051 .C73 1995,1995,"Public budgeting : politics, institutions, and processes /","Cozzetto, Don.",X002601934,BOOK,7/1/96,10/4/11,STACKS,0,0,0,5,1
2434404,2,ALDERMAN,STACKS,HJ2051 .D33 1995,1995,"Public expenditures in the United States, 1952-1993 /","Dawson, John E.,",X002610119,BOOK,7/1/96,1/1/00,STACKS,0,0,0,2,1
2623995,2 14,ALDERMAN,STACKS,HJ2051 .D63 1996,1996,"Trusting the people : the Dole-Kemp plan to free the economy and create a better America : balance the budget, cut taxes 15%, raise wages /","Dole, Robert J.,",X004044558,BOOK,11/1/96,12/5/99,STACKS,0,0,1,1,1
2291016,2,ALDERMAN,STACKS,HJ2051 .E25 1994,1994,Facing tough choices : balancing fiscal and social deficits /,"Eastaugh, Steven R.,",X002452449,BOOK,7/1/96,12/7/99,STACKS,0,0,0,1,1
78680,2 3,ALDERMAN,STACKS,HJ2051 .E37 1986,1986,How real is the federal deficit? /,"Eisner, Robert.",X001109747,BOOK,6/28/96,10/18/15,STACKS,2,5,0,12,1
78680,2 3,CLEMONS,BY-REQUEST,HJ2051 .E37 1986,1986,How real is the federal deficit? /,"Eisner, Robert.",X001109746,BOOK,6/28/96,1/1/00,BY-REQUEST,0,0,1,1,1
2763922,2,ALDERMAN,STACKS,HJ2051 .E93 1997,1997,"Red ink : the budget, deficit, and debt of the U.S. government /","Evans, Gary R.,",X004174605,BOOK,2/2/98,11/15/03,STACKS,0,0,0,1,1
1248585,2,ALDERMAN,STACKS,HJ2051 .F38 1987,1987,"The Federal budget : the economic, political, and moral implications for a free society /",,X001320044,BOOK,6/30/96,10/2/09,STACKS,0,0,0,1,1
130989,2 14,ALDERMAN,STACKS,HJ2051 .F39 1982,1982,The Federal budget : economics and politics /,,X004302469,BOOK,2/17/99,3/15/06,STACKS,0,0,0,1,1
2048,3,CLEMONS,BY-REQUEST,HJ2051 .F395 1984,1984,Federal budget policy in the 1980s /,,X000996433,BOOK,6/28/96,12/6/16,BY-REQUEST,0,0,0,9,1
4229582,2,ALDERMAN,STACKS,HJ2051 .F475 2005,2005,Congressional budgeting : a representational perspective /,"Fisher, Patrick (Patrick Ivan)",X004810779,BOOK,3/3/05,9/26/13,STACKS,2,0,0,6,1
4694512,2 17,ALDERMAN,STACKS,HJ2051 .F483 2008,2008,Fiscal challenges : an interdisciplinary approach to budget policy /,,X030250211,BOOK,3/4/08,12/5/12,STACKS,1,0,0,6,1
1136119,2,ALDERMAN,STACKS,HJ2051 .F5 1918,1918,"Budget making in a democracy,","Fitzpatrick, Edward A. (Edward Augustus),",X000237979,BOOK,6/29/96,1/19/07,STACKS,0,0,1,8,1
1997906,2 3,ALDERMAN,STACKS,HJ2051 .F73 1993,1993,Making ends meet : congressional budgeting in the age of deficits /,"Franklin, Daniel P.",X002189454,BOOK,6/30/96,11/15/03,STACKS,0,0,2,14,1
1997906,2 3,CLEMONS,BY-REQUEST,HJ2051 .F73 1993,1993,Making ends meet : congressional budgeting in the age of deficits /,"Franklin, Daniel P.",X002309777,BOOK,6/30/96,8/1/97,BY-REQUEST,0,0,0,7,1
2922562,2,ALDERMAN,STACKS,HJ2051 .G36 1999,1999,The generational equity debate /,,X004267720,BOOK,6/21/99,6/13/10,STACKS,0,0,1,2,1
6712524,2,ALDERMAN,STACKS,HJ2051 .G49 2016,2016,Democracy reinvented : participatory budgeting and civic innovation in America /,"Gilman, Hollie Russon,",X031730868,BOOK,4/6/16,4/10/16,STACKS,0,0,0,0,1
1682433,2 14,ALDERMAN,STACKS,HJ2051 .G53 1990,1990,"Reconcilable differences? : congress, the budget process, and the deficit /","Gilmour, John B.",X001784246,BOOK,6/30/96,7/12/11,STACKS,0,0,1,17,1
1785240,2,ALDERMAN,STACKS,HJ2051 .G74 1991,1991,The great fiscal experiment /,,X001926967,BOOK,6/30/96,12/5/17,STACKS,0,0,0,7,1
2576045,2,ALDERMAN,STACKS,HJ2051 .G84 1996,1996,The guide to the federal budget : fiscal 1997 /,"Collender, Stanley E.",X004049567,BOOK,7/1/96,3/4/14,STACKS,2,1,0,11,1
2682040,2 14,ALDERMAN,STACKS,HJ2051 .H325 1997,1997,"Mirage : why neither Democrats nor Republicans can balance the budget, end the deficit, and satisfy the public /","Hager, George.",X004103827,BOOK,4/17/97,1/19/07,STACKS,0,0,0,3,1
4214140,2,ALDERMAN,STACKS,HJ2051 .H335 2004,2004,Authorizing policy /,"Hall, Thad E. (Thad Edward),",X004809264,BOOK,1/3/05,1/4/05,STACKS,0,0,0,0,1
1775160,2 3,ALDERMAN,STACKS,HJ2051 .I66 1990,1990,Uncertain legacies : federal budget policy from Roosevelt through Reagan /,"Ippolito, Dennis S.",X001845605,BOOK,6/30/96,5/11/14,STACKS,1,5,0,15,1
216198,2,ALDERMAN,STACKS,HJ2051 .J63,1980,The geography of federal spending in the United States of America /,"Johnston, R. J. (Ronald John)",X000460587,BOOK,6/28/96,4/30/99,STACKS,0,0,0,2,1
5337438,2,ALDERMAN,STACKS,HJ2051 .J63 1980a,1980,The geography of federal spending in the United States of America /,"Johnston, R. J. (Ronald John)",X004320044,BOOK,2/17/99,4/28/13,STACKS,1,2,0,3,1
2714774,2,ALDERMAN,STACKS,HJ2051 .K34 1997,1997,"Budgeting democracy : state building and citizenship in America, 1890-1928 /","Kahn, Jonathan,",X004106930,BOOK,9/4/97,5/9/15,STACKS,3,3,1,33,1
4038096,2,ALDERMAN,STACKS,HJ2051 .K48 2003,2003,Deficit politics : the search for balance in American politics /,"Kettl, Donald F.",X004769471,BOOK,6/15/04,12/19/13,STACKS,1,0,0,4,1
185619,2,ALDERMAN,STACKS,HJ2051 .K54,1982,The political economy of fiscal limits /,"Kirlin, John J.",X000351049,BOOK,6/28/96,4/25/98,STACKS,0,0,0,2,1
1987702,2,ALDERMAN,STACKS,HJ2051 .K66 1992,1992,"Generational accounting : knowing who pays, and when, for what we spend /","Kotlikoff, Laurence J.",X002135594,BOOK,6/30/96,6/13/10,STACKS,0,0,0,5,1
1285884,2,ALDERMAN,STACKS,HJ2051 .K68 1988,1988,Ideological budgeting : the influence of political philosophy on public policy /,"Koven, Steven G.",X001460985,BOOK,6/30/96,5/11/14,STACKS,0,5,0,9,1
124007,3,CLEMONS,BY-REQUEST,HJ2051 .L4 1983,1983,Public budgeting systems /,"Lee, Robert D.",X001033103,BOOK,6/28/96,8/31/16,BY-REQUEST,1,0,0,7,1
4321554,2,ALDERMAN,STACKS,HJ2051 .L45 2005,2005,"Parties, rules, and the evolution of congressional budgeting /","LeLoup, Lance T.",X004907297,BOOK,10/18/05,5/12/15,STACKS,3,6,0,14,1
75203,2 14,ALDERMAN,STACKS,HJ2051 .L46 1986,1986,Checks unbalanced : the quiet side of public spending /,"Leonard, Herman B.",X000993060,BOOK,6/28/96,1/1/00,STACKS,0,0,0,1,1
287272,2,ALDERMAN,STACKS,HJ2051 .L93,1979,Public budgeting in America /,"Lynch, Thomas Dexter,",X000003004,BOOK,6/28/96,10/4/11,STACKS,0,0,2,2,1
389050,2 17,ALDERMAN,STACKS,HJ2051 .L94,1976,The Federal budget : what are the Nation's priorities? /,"Lynn, James T.,",X000896292,BOOK,7/1/96,3/26/99,STACKS,0,0,0,4,1
1275620,2 3,ALDERMAN,STACKS,HJ2051 .M33 1968,1968,Public spending,"McKean, Roland N.",X000171564,BOOK,6/30/96,1/1/00,STACKS,0,0,0,0,1
1275620,2 3,ALDERMAN,STACKS,HJ2051 .M33 1968,1968,Public spending,"McKean, Roland N.",X000303389,BOOK,6/30/96,1/1/00,STACKS,0,0,0,0,1
7244040,2,ALDERMAN,STACKS,HJ2051 .M46 2017,2017,The basics of public budgeting and financial management : a handbook for academics and practitioners /,"Menifield, Charles,",X031838586,BOOK,9/22/17,8/17/18,CHECKEDOUT,1,2,0,3,1
1363587,2,ALDERMAN,STACKS,HJ2051 .M49 1989,1989,Evolution of United States budgeting : changing fiscal and financial concepts /,"Meyer, Annette E.",X001610134,BOOK,6/30/96,7/7/14,STACKS,1,2,0,15,1
3866665,2,ALDERMAN,STACKS,HJ2051 .M49 2002,2002,Evolution of United States budgeting /,"Meyer, Annette E.",X004553039,BOOK,7/23/02,5/11/14,STACKS,0,5,1,11,1
2359463,2,ALDERMAN,STACKS,HJ2051 .M496 1994,1994,Strategic budgeting /,"Meyers, Roy T.",X002522902,BOOK,7/1/96,3/30/05,STACKS,0,0,1,12,1
2307134,2 3,ALDERMAN,STACKS,HJ2051 .M52 1994,1994,"Fix the U.S. budget! : urgings of an ""abominable no-man"" /","Miller, James Clifford.",X002446976,BOOK,7/1/96,11/15/03,STACKS,0,0,0,10,1
1645746,2,ALDERMAN,STACKS,HJ2051 .M56 1990,1990,Making America's budget policy from the 1980s to the 1990s /,"Minarik, Joseph J.,",X001703220,BOOK,6/30/96,2/28/11,STACKS,0,0,1,10,1
81595,2,ALDERMAN,STACKS,HJ2051 .M65 1986,1986,The federal budget and financial system : a management perspective /,"Moraglio, Joseph F.",X001034291,BOOK,6/28/96,4/21/99,STACKS,0,0,0,9,1
1640779,2,ALDERMAN,STACKS,HJ2051 .M655 1990,1990,"Eisenhower versus 'the spenders' : the Eisenhower administration, the Democrats, and the budget, 1953-60 /","Morgan, Iwan W.",X001703630,BOOK,6/30/96,2/2/16,STACKS,1,1,1,17,1
4778734,2,ALDERMAN,STACKS,HJ2051 .M87 2009,2009,Understanding government budgets : a practical guide /,"Musell, R. Mark.",X030457074,BOOK,9/30/08,1/7/11,STACKS,0,0,1,13,1
655725,2 3 4,ALDERMAN,STACKS,HJ2051 .N165 1983,1983,The consequences of cuts /,"Nathan, Richard P.",X000743015,BOOK,6/29/96,11/30/08,STACKS,0,0,0,5,1
785317,2 3,ALDERMAN,STACKS,HJ2051 .N167 1987,1987,Reagan and the States /,"Nathan, Richard P.",X002120074,BOOK,6/29/96,5/14/18,STACKS,1,2,1,12,1
2334638,2,ALDERMAN,STACKS,HJ2051 .N38 1994,1994,Tragedies of our own making : how private choices have created public bankruptcy /,"Neely, Richard,",X002531931,BOOK,7/1/96,11/21/02,STACKS,0,0,1,2,1
3797653,2,ALDERMAN,STACKS,HJ2051 .N46 2002,2002,Public budgeting /,"Nice, David C.,",X004592106,BOOK,2/7/02,4/23/13,STACKS,1,4,1,21,1
3522460,3,CLEMONS,BY-REQUEST,HJ2051 .P34 1999,1999,Done deal? : the politics of the 1997 budget agreement /,"Palazzolo, Daniel J.,",X004412783,BOOK,4/4/00,3/12/12,BY-REQUEST,1,0,0,10,1
63650,2 3,ALDERMAN,STACKS,HJ2051 .P36 1985,1985,The trillion dollar budget : how to stop the bankrupting of America /,"Pascall, Glenn R.",X000932872,BOOK,6/28/96,1/1/00,STACKS,0,0,0,2,1
328759,2 17,ALDERMAN,STACKS,HJ2051 .P46,1976,The 1978 budget in transition : from Ford to Carter to Congress /,"Penner, Rudolph Gerhard,",X000110422,BOOK,6/28/96,5/20/04,STACKS,0,0,0,1,1
1334880,2 14 17,ALDERMAN,STACKS,HJ2051 .P464 1988,1988,Broken purse strings : Congressional budgeting 1974 to 1988 /,"Penner, Rudolph Gerhard,",X001520842,BOOK,6/30/96,5/20/04,STACKS,0,0,1,13,1
4045252,2 3,ALDERMAN,STACKS,HJ2051 .P48 2004,2004,Running on empty : how the Democratic and Republican parties are bankrupting our future and what Americans can do about it /,"Peterson, Peter G.",X004803233,BOOK,7/23/04,10/2/13,STACKS,2,0,0,9,1
4045252,2 3,CLEMONS,BY-REQUEST,HJ2051 .P48 2004,2004,Running on empty : how the Democratic and Republican parties are bankrupting our future and what Americans can do about it /,"Peterson, Peter G.",X004689798,BOOK,7/19/04,12/28/05,BY-REQUEST,0,0,0,6,1
25080,2,ALDERMAN,STACKS,HJ2051 .R417 1984,1984,Reconstructing the federal budget : a trillion dollar quandary /,,X000909142,BOOK,6/28/96,1/1/00,STACKS,0,0,0,1,1
136143,2 3,ALDERMAN,STACKS,HJ2051 .R43 1982,1982,Reductions in U.S. domestic spending : how they affect state and local governments /,,X000467265,BOOK,6/28/96,11/30/08,STACKS,0,0,0,1,1
1302963,2,ALDERMAN,STACKS,HJ2051 .S24 1988,1988,"The budget deficit : the causes, the costs, the outlook /","Santow, Leonard Jay.",X001451908,BOOK,6/30/96,12/7/99,STACKS,0,0,2,11,1
1785322,2 14,ALDERMAN,STACKS,HJ2051 .S33 1990,1990,The capacity to budget /,"Schick, Allen.",X002039924,BOOK,6/30/96,1/19/07,STACKS,0,0,11,33,1
220215,2 14 17,ALDERMAN,STACKS,HJ2051 .S34,1980,"Congress and money : budgeting, spending, and taxing /","Schick, Allen.",X000217871,BOOK,6/28/96,10/12/15,CHECKEDOUT,1,0,0,16,1
73718,2,ALDERMAN,STACKS,HJ2051 .S342 1986,1986,Crisis in the budget process : exercising political choice /,"Schick, Allen.",X001024214,BOOK,6/28/96,1/19/07,STACKS,0,0,5,20,1
2412374,2 17,ALDERMAN,STACKS,HJ2051 .S3424 1995,1995,"The federal budget : politics, policy, process /","Schick, Allen.",X002604248,BOOK,7/1/96,1/5/15,STACKS,1,3,1,20,1
3555928,2,ALDERMAN,STACKS,HJ2051 .S3424 2000,2000,"The federal budget : politics, policy, process /","Schick, Allen.",X004415079,BOOK,8/8/00,10/7/15,CHECKEDOUT,2,0,4,20,1
4642992,2 17,ALDERMAN,STACKS,HJ2051 .S3424 2007,2007,"The federal budget : politics, policy, process /","Schick, Allen.",X030261874,BOOK,10/23/07,6/24/14,STACKS,6,0,2,7,1
184494,2 17,ALDERMAN,STACKS,HJ2051 .S343,1981,Reconciliation and the congressional budget process /,"Schick, Allen.",X000398014,BOOK,6/28/96,5/15/13,STACKS,1,0,2,11,1
1136125,2,ALDERMAN,STACKS,HJ2051 .S35,1963,Economic analysis of the budget.,"Schmidt, Emerson Peter,",X000896184,BOOK,6/29/96,2/12/97,STACKS,0,0,0,2,1
2663595,2 14 17,ALDERMAN,STACKS,HJ2051 .S472 1997,1997,Setting national priorities : budget choices for the next century /,,X004091433,BOOK,3/21/97,4/23/10,STACKS,0,0,0,12,1
2683847,2 3,ALDERMAN,STACKS,HJ2051 .S475 1997,1997,Do deficits matter? /,"Shaviro, Daniel N.",X004092780,BOOK,4/25/97,1/9/17,STACKS,1,2,1,11,1
2683847,2 3,CLEMONS,BY-REQUEST,HJ2051 .S475 1997,1997,Do deficits matter? /,"Shaviro, Daniel N.",X004092995,BOOK,4/24/97,7/12/11,BY-REQUEST,0,0,1,3,1
17600,2,ALDERMAN,STACKS,HJ2051 .S49 1984,1984,Politics and the budget : the struggle between the President and the Congress /,"Shuman, Howard E.",X000775374,BOOK,6/28/96,7/7/14,STACKS,1,0,1,16,1
3489489,2,ALDERMAN,STACKS,HJ2051 .S494 2000,2000,Citizen participation in resource allocation /,"Simonsen, William,",X004345397,BOOK,1/20/00,3/2/11,STACKS,0,0,2,4,1
604711,2 3,ALDERMAN,STACKS,HJ2051 .S58 1955,1955,The budgetary process in the United States.,"Smithies, Arthur.",X000199698,BOOK,6/29/96,3/26/99,STACKS,0,0,0,9,1
1317757,2 14,ALDERMAN,STACKS,HJ2051 .S74 1989,1989,Governing the $5 trillion economy /,"Stein, Herbert,",X001500308,BOOK,6/30/96,1/1/00,STACKS,0,0,0,8,1
6355818,2,ALDERMAN,STACKS,HJ2051 .S748 2014,2014,Dead men ruling : how to restore fiscal freedom and rescue our future /,"Steuerle, C. Eugene,",X031646142,BOOK,7/15/14,1/14/15,STACKS,1,4,2,5,1
465578,2,ALDERMAN,STACKS,HJ2051 .U76,1973,US budget and economic policy /,"Usoskin, V. M. (Valentin Markovich)",X000167863,BOOK,6/29/96,3/26/99,STACKS,0,0,0,8,1
3535530,2,ALDERMAN,STACKS,HJ2051 .U77 2000,2000,The U.S. federal budget process : an overview and glossary of terms /,,X004410047,BOOK,5/19/00,3/28/11,STACKS,0,0,1,7,1
603217,2 3 17,ALDERMAN,STACKS,HJ2051 .W415,1973,Matching needs and resources; reforming the Federal Budget,"Weidenbaum, Murray L.",X000447529,BOOK,6/29/96,11/26/13,STACKS,1,0,0,1,1
5803102,2 17,ALDERMAN,STACKS,HJ2051 .W427 2012,2012,Red ink : inside the high-stakes politics of the federal budget /,"Wessel, David.",X030848023,BOOK,10/2/12,9/26/13,STACKS,3,0,0,3,1
2765046,2 17,ALDERMAN,STACKS,HJ2051 .W43 1998,1998,Congressional Quarterly's desk reference on the federal budget /,"Wetterau, Bruce.",X004107592,BOOK,2/5/98,1/1/00,STACKS,0,0,2,0,1
1635806,2 3,ALDERMAN,STACKS,HJ2051 .W45 1989,1989,The deficit and the public interest : the search for responsible budgeting in the 1980s /,"White, Joseph,",X001706134,BOOK,6/30/96,6/23/14,STACKS,1,3,0,16,1
1635806,2 3,ALDERMAN,STACKS,HJ2051 .W45 1989,1989,The deficit and the public interest : the search for responsible budgeting in the 1980s /,"White, Joseph,",X001730505,BOOK,6/30/96,5/12/15,STACKS,2,4,1,18,1
1635806,2 3,CLEMONS,BY-REQUEST,HJ2051 .W45 1989,1989,The deficit and the public interest : the search for responsible budgeting in the 1980s /,"White, Joseph,",X001824956,BOOK,6/30/96,3/17/11,BY-REQUEST,0,0,10,55,1
722646,2 3 17,ALDERMAN,STACKS,HJ2051 .W48,1980,"How to limit government spending : or, How a constitutional amendment tying public spending to economic growth will decrease taxes and lessen inflation ... /","Wildavsky, Aaron B.",X000140974,BOOK,6/29/96,3/15/06,STACKS,0,0,0,18,1
790026,3,CLEMONS,BY-REQUEST,HJ2051 .W483 1988,1988,The new politics of the budgetary process /,"Wildavsky, Aaron B.",X001278511,BOOK,6/29/96,8/18/11,BY-REQUEST,0,0,7,36,1
2381833,2,ALDERMAN,STACKS,HJ2051 .W483 1992,1992,The new politics of the budgetary process /,"Wildavsky, Aaron B.",X002587799,BOOK,7/1/96,10/26/09,STACKS,0,0,2,20,1
2639062,2,ALDERMAN,STACKS,HJ2051 .W483 1997,1997,The new politics of the budgetary process /,"Wildavsky, Aaron B.",X004067500,BOOK,1/7/97,5/11/14,STACKS,1,5,3,35,1
2639062,2,ALDERMAN,STACKS,HJ2051 .W483 1997,1997,The new politics of the budgetary process /,"Wildavsky, Aaron B.",X004190596,BOOK,8/27/98,11/2/18,STACKS,2,0,4,28,1
554475,2 3,ALDERMAN,STACKS,HJ2051 .W485 1964,1964,The politics of the budgetary process.,"Wildavsky, Aaron B.",X000274045,BOOK,6/29/96,1/1/00,STACKS,0,0,3,2,1
441484,2 3,ALDERMAN,STACKS,HJ2051 .W485 1974,1974,The politics of the budgetary process.,"Wildavsky, Aaron B.",X000211033,BOOK,6/29/96,11/2/18,STACKS,1,0,0,1,1
293589,2,ALDERMAN,STACKS,HJ2051 .W485 1979,1979,The politics of the budgetary process /,"Wildavsky, Aaron B.",X000236105,BOOK,6/28/96,2/26/97,STACKS,0,0,1,6,1
663697,2 14,ALDERMAN,STACKS,HJ2051 .W485 1984,1984,The politics of the budgetary process /,"Wildavsky, Aaron B.",X000763185,BOOK,6/29/96,5/11/01,STACKS,0,0,5,8,1
398140,2,ALDERMAN,STACKS,HJ2051 .W49,1976,"Congress, budgetmaking, and policy analysis : a critique after the fiscal year 1976 budget trial run /","Williams, Walter,",X000206020,BOOK,6/28/96,1/1/00,STACKS,0,0,0,0,1
812955,2,ALDERMAN,STACKS,HJ2052 .A63 1969,1970,University training in PPB for state and local officials: a synopsis.,Airlie House Institute on University Training,X000500502,BOOK,6/29/96,1/1/00,STACKS,0,0,0,0,1
1841952,2 17,ALDERMAN,STACKS,HJ2052 .B35 1990,1990,"Balancing act : debt, deficits, and taxes /",,X002106181,BOOK,6/30/96,5/3/13,STACKS,1,0,0,14,1
1335218,2,ALDERMAN,STACKS,HJ2052 .B37 1987,1988,The Ricardian approach to budget deficits /,"Barro, Robert J.",X001559464,BOOK,6/30/96,1/1/00,STACKS,0,0,0,1,1
648512,2 17,ALDERMAN,STACKS,HJ2052 .B46 1983,1983,Underground government : the off-budget public sector /,"Bennett, James T.",X000599317,BOOK,6/29/96,8/9/05,STACKS,0,0,0,2,1
680603,2,ALDERMAN,STACKS,HJ2052 .B82 1985,1985,"Budget reform proposals : 1985, 99th Congress, 1st session.",,X001055808,BOOK,6/29/96,11/15/03,STACKS,0,0,0,1,1
11394,2,ALDERMAN,STACKS,HJ2052 .B87 1985,1985,Privatizing federal spending : a strategy to eliminate the deficit /,"Butler, Stuart M.",X000904445,BOOK,6/28/96,8/25/05,STACKS,0,0,0,6,1
1954173,2 14,ALDERMAN,STACKS,HJ2052 .C35 1992,1992,Bankrupting of America : how the federal budget is improverishing the nation /,"Calleo, David P.,",X002119568,BOOK,6/30/96,1/1/00,STACKS,0,0,0,6,1
1239407,2,ALDERMAN,STACKS,HJ2052 .C42 1987,1987,The deficit problem in perspective /,"Cebula, Richard J.",X001290374,BOOK,6/30/96,1/1/00,STACKS,0,0,0,0,1
768838,2,ALDERMAN,STACKS,HJ2052 .C43 1987,1987,Federal budget deficits : an economic analysis /,"Cebula, Richard J.",X001215471,BOOK,6/29/96,3/26/99,STACKS,0,0,2,13,1
1277986,2,ALDERMAN,STACKS,HJ2052 .C6,1966,Budgeting for national objectives; executive and congressional roles in program planning and performance; a statement on national policy,Committee for Economic Development.,X000492410,BOOK,6/30/96,1/1/00,STACKS,0,0,0,0,1
722560,2 3 17,ALDERMAN,STACKS,HJ2052 .C646,1980,"The Constitution and the budget : are constitutional limits on tax, spending, and budget powers desirable at the Federal level? /",,X000166790,BOOK,6/29/96,1/1/00,STACKS,0,0,1,0,1
722560,2 3 17,CLEMONS,BY-REQUEST,HJ2052 .C646,1980,"The Constitution and the budget : are constitutional limits on tax, spending, and budget powers desirable at the Federal level? /",,X000334550,BOOK,6/29/96,1/1/00,BY-REQUEST,0,0,0,0,1
722560,2 3 17,CLEMONS,BY-REQUEST,HJ2052 .C646,1980,"The Constitution and the budget : are constitutional limits on tax, spending, and budget powers desirable at the Federal level? /",,X001107781,BOOK,6/29/96,5/12/99,BY-REQUEST,0,0,1,11,1
292126,2,ALDERMAN,STACKS,HJ2052 .C65,1979,Contemporary approaches to public budgeting /,,X000318946,BOOK,6/28/96,1/1/00,STACKS,0,0,0,1,1
2091233,2,ALDERMAN,STACKS,HJ2052 .D42 1993,1993,Dealing with the deficit now : a policy statement /,,X002176644,BOOK,6/30/96,1/1/00,STACKS,0,0,0,1,1
3263301,17,ALDERMAN,STACKS,HJ2052 .D64,1971,The planning-programming-budgeting system in three Federal agencies.,"Doh, Joon Chien.",X001053252,BOOK,6/29/96,5/12/12,STACKS,0,1,0,3,1
89105,2 17,ALDERMAN,STACKS,HJ2052 .E57 1985,1985,Entitlement issues in the domestic budget : the long-term agenda /,,X000988971,BOOK,6/28/96,1/1/00,STACKS,0,0,0,1,1
1855844,2,ALDERMAN,STACKS,HJ2052 .F4 1991,1991,Federal budget and financial management reform /,,X002010220,BOOK,6/30/96,8/31/98,STACKS,0,0,0,10,1
95765,2,ALDERMAN,STACKS,HJ2052 .F43 1985,1985,The Federal deficit /,,X000999920,BOOK,6/28/96,5/16/97,STACKS,0,0,0,6,1
51433,2 3,ALDERMAN,STACKS,HJ2052 .G68 1984,1984,Burning money : the waste of your tax dollars /,"Grace, J. Peter (Joseph Peter)",X000865810,BOOK,6/28/96,1/1/00,STACKS,0,0,0,5,1
247752,2,ALDERMAN,STACKS,HJ2052 .H36 1979,1979,Programme and performance budgeting : developments in the United States and feasibilities for India /,"Handa, K. L.",X001566034,BOOK,6/28/96,1/1/00,STACKS,0,0,0,0,1
347024,2 14 17,ALDERMAN,STACKS,HJ2052 .H38,1978,Congress and the budget /,"Havemann, Joel.",X000066057,BOOK,6/28/96,10/12/15,CHECKEDOUT,1,0,1,3,1
752329,2 3 14,ALDERMAN,STACKS,HJ2052 .H5 1969,1969,"Program budgeting and benefit-cost analysis; cases, text, and readings","Hinrichs, Harley H.,",X000225818,BOOK,6/29/96,4/30/99,STACKS,0,0,4,6,1
339692,2,ALDERMAN,STACKS,HJ2052 .I7 1978,1978,The Federal budget and social reconstruction : the people and the State /,Institute for Policy Studies. Study Group on the Federal Budget.,X000062152,BOOK,6/28/96,1/1/00,STACKS,0,0,1,0,1
720268,2 3 17,ALDERMAN,STACKS,HJ2052 .I77,1981,Congressional spending /,"Ippolito, Dennis S.",X000484565,BOOK,6/29/96,10/12/15,CHECKEDOUT,2,5,1,10,1
1615979,2,ALDERMAN,STACKS,HJ2052 .L36 1990,1990,Sustaining budget deficits in open economies /,"Langdana, Farrokh K.",X001666524,BOOK,6/30/96,3/26/98,STACKS,0,0,0,4,1
258527,2 3 17,ALDERMAN,STACKS,HJ2052 .L443,1980,The fiscal Congress : legislative control of the budget /,"LeLoup, Lance T.",X000156804,BOOK,6/28/96,5/20/04,STACKS,0,0,1,3,1
4880982,2,ALDERMAN,STACKS,HJ2052 .L66 2009,2009,The long-term international economic position of the United States /,,X030565983,BOOK,8/3/09,1/1/00,STACKS,0,0,0,0,1
779350,2,ALDERMAN,STACKS,HJ2052 .L9,1970,"Planning, programming, budgeting: a systems approach to management,","Lyden, Fremont J.",X000206819,BOOK,6/29/96,10/2/09,STACKS,0,0,1,0,1
1986221,2,ALDERMAN,STACKS,HJ2052 .M3 1992,1992,The unbalanced economy : The impacts of sustained deficits on the United States /,"McMullen, Neil.",X002152857,BOOK,6/30/96,1/1/00,STACKS,0,0,0,1,1
1955503,2,ALDERMAN,STACKS,HJ2052 .M368 1992,1992,"The politics of budget control : Congress, the presidency, and the growth of the administrative state /","Marini, John A.",X002047998,BOOK,6/30/96,5/11/14,STACKS,0,5,1,30,1
