1678,5049155,X030562916,HQ1641 .R68 2009,ALDERMAN,The birth of feminism : woman as intellect in Renaissance Italy and England /,"Ross, Sarah Gwyneth,",2009,10/14/09,5/12/18,0,14,6,1,2,FALSE,1744,1,0
1706,5065498,X030563172,HQ613 .P65 2009,ALDERMAN,The politics of domestic authority in Britain since 1800 /,,2009,11/19/09,11/27/17,0,15,5,1,2,FALSE,1772,1,0
1751,5281051,X030793238,HQ1812 .Z9 D663 2009,CLEMONS,Women and Islamic revival in a West African town /,"Masquelier, Adeline Marie,",2009,2/4/11,4/25/18,0,10,6,1,3,TRUE,1816,1,0
1766,5232042,X030721250,HQ784 .S45 S76 2009,ALDERMAN,"The queer child, or growing sideways in the twentieth century /","Stockton, Kathryn Bond,",2009,10/18/10,10/15/18,2,9,22,1,2,FALSE,1831,1,0
1774,4884876,X030565578,HQ76 .D42 2009,ALDERMAN,Unlimited intimacy : reflections on the subculture of barebacking /,"Dean, Tim,",2009,6/25/09,5/1/18,4,21,4,2,2 3,FALSE,1840,1,0
1835,4826441,X030470395,HQ792 .G7 F76 2009,ALDERMAN,Victorian childhoods /,"Frost, Ginger Suzanne,",2009,3/3/09,5/12/18,1,14,23,1,2,TRUE,1900,1,0
1912,6731726,X031783201,HQ784 .Q4 P35 2009,ALDERMAN,"Maju iyagi, ai n?n t?r? chun?n mank'?m charanda /","Pak, Mun-h?i,",2009,5/23/16,6/14/16,0,1,0,1,2,FALSE,1976,1,0
1986,4801867,X030473153,HQ1236.5 .U6 F532 2009,ALDERMAN,"the policing of women's reproduction in America / Our bodies, our crimes :","Flavin, Jeanne,",2009,12/9/08,11/27/17,1,15,5,1,2,TRUE,2047,1,0
1998,4813853,X030473944,HQ76.2 .U5 S87 2009,ALDERMAN,"From ""perverts"" to ""fab five"" : the media's changing depiction of gay men and lesbians /","Streitmatter, Rodger.",2009,1/20/09,5/13/18,1,13,4,1,2,FALSE,2059,1,0
2029,5088637,X004087594,HQ1236.5 .U6 K67 2009,CLEMONS,"Notes from the cracked ceiling : Hillary Clinton, Sarah Palin, and what it will take for a woman to win /","Kornblut, Anne E.",2009,2/4/10,8/10/16,2,16,12,1,3,FALSE,2091,1,0
2053,5257748,X030721376,HQ74 .G48 2009,ALDERMAN,voices of bisexuals around the world / Getting bi :,,2009,12/13/10,6/28/18,2,7,0,1,2,FALSE,2115,1,0
2079,4821405,X030471411,HQ792 .U5 C424 2009,ALDERMAN,Children and youth in a new nation /,,2009,2/17/09,8/27/18,2,11,6,1,2,TRUE,2144,1,0
2107,4977452,X030558726,HQ76.27 .Y68 G73 2009,ALDERMAN,"Out in the country : youth, media, and queer visibility in rural America /","Gray, Mary L.",2009,8/26/09,10/12/18,2,9,25,1,2,TRUE,2173,1,0
2121,5065499,X030596090,HQ615 .V53 2009,CLEMONS,at home in Georgian England / Behind closed doors :,"Vickery, Amanda.",2009,12/17/09,1/31/17,1,17,134,2,2 3,FALSE,2187,1,0
2196,5091470,X030596282,HQ784 .S56 P65 2009,ALDERMAN,Third culture kids : growing up among worlds /,"Pollock, David C.",2009,2/10/10,8/9/17,1,11,1,1,2,FALSE,2266,1,0
2198,4885359,X030276958,HQ1101 .D65 2009,ALDERMAN,"Doing gender in media, art and culture /",,2009,6/24/09,5/14/18,2,10,13,1,2,FALSE,2269,1,0
2255,4865517,X030467160,HQ1438 .S63 T87 2009,ALDERMAN,1865-1945 / Women and gender in the new South :,"Turner, Elizabeth Hayes.",2009,4/17/09,5/13/18,1,10,14,1,2,TRUE,2326,1,0
2318,4821363,X030471386,HQ767.15 .A277 2009,ALDERMAN,Abortion : three perspectives /,,2009,2/17/09,1/7/18,0,11,1,1,2,FALSE,2394,1,0
2332,5010208,X030562571,HQ1161 .B43 2009,ALDERMAN,voice and the embodiment of a costly performance / Behind the mask of the strong black woman :,"Beauboeuf-Lafontant, Tamara.",2009,9/30/09,5/21/18,0,8,7,1,2,FALSE,2408,1,0
2348,5126914,X030695097,HQ1726.5 .L53 2009,ALDERMAN,inspiring voices against oppression / Muslim women reformers :,"Lichter, Ida,",2009,4/14/10,6/28/16,2,13,0,1,2,FALSE,2424,1,0
2363,4857028,X030278207,HQ769 .H63 2009,ALDERMAN,[why less means more when raising kids] / The idle parent :,"Hodgkinson, Tom.",2009,4/1/09,9/6/18,1,8,4,1,2,FALSE,2440,1,0
2411,4878806,X030566683,HQ1236 .M66 2009,ALDERMAN,reconfiguring gender and diversity in political philosophy / Women's rights as multicultural claims :,"Mookherjee, Monica.",2009,5/26/09,9/23/18,1,7,15,1,2,FALSE,2490,1,0
2421,4893952,X030277072,HQ784 .I58 L58 2009,ALDERMAN,"great expectations, challenging realities / Children and the Internet :","Livingstone, Sonia M.",2009,7/20/09,8/1/18,0,7,2,1,2,TRUE,2500,1,0
2428,4815295,X030474180,HQ1788 .A5765 2009,ALDERMAN,transforming political landscapes / African women's movements :,,2009,1/27/09,6/21/13,1,26,1,1,2,FALSE,2507,1,0
2436,5074289,X030563434,HQ1147 .E85 G37 2009,ALDERMAN,Women and aristocratic culture in the Carolingian world /,"Garver, Valerie L. (Valerie Louise),",2009,12/12/09,10/30/18,2,5,0,1,2,TRUE,2516,1,0
2452,5015877,X030562709,HQ799.2 .M352 U6 2009,ALDERMAN,"what the migration to social-network sites, games, and anytime, anywhere media means for our future / The young and the digital :","(Samuel Craig) Watkins, S. Craig",2009,10/7/09,5/13/18,1,15,5,2,2 3,FALSE,2532,1,0
2470,4881327,X030566849,HQ1075 .C658 2009,ALDERMAN,Gender : in world perspective /,"Connell, Raewyn,",2009,6/2/09,4/14/16,5,15,8,1,2,FALSE,2552,1,0
2489,5170622,X030610240,HQ781.5 .K47 2009,CLEMONS,"One world, one day /","Kerley, Barbara.",2009,6/30/10,4/15/18,0,5,3,1,3,FALSE,2573,1,0
2516,4818147,X030278087,HQ471 .L24 2009,ALDERMAN,philosophical essays on pornography and objectification / Sexual solipsism :,"Langton, Rae,",2009,2/4/09,6/6/18,0,8,6,1,2,FALSE,2602,1,0
2522,4858887,X030467751,HQ1090.5 .S68 M395 2009,ALDERMAN,Counterfeit gentlemen : manhood and humor in the old South /,"Mayfield, John,",2009,4/7/09,4/17/18,0,8,9,1,2,FALSE,2608,1,0
2529,4886478,X030565819,HQ76.8 .U6 M67 2009,ALDERMAN,"Moral panics, sex panics : fear and the fight over sexual rights /",,2009,7/1/09,3/27/17,1,11,0,1,2,FALSE,2616,1,0
2546,4886023,X030277063,HQ1073.5 .R66 H68 2009,ALDERMAN,Roman death : dying and the dead in ancient Rome /,"Hope, Valerie M.,",2009,6/26/09,5/11/18,1,7,5,1,2,FALSE,2633,1,0
2572,5085635,X030609639,HQ1593 .G57 2009,ALDERMAN,"Borderline citizens : women, gender and political culture in Britain, 1815-1867 /","Gleadle, Kathryn.",2009,1/29/10,9/20/18,0,4,9,1,2,FALSE,2661,1,0
2599,4869877,X030466561,HQ76.25 .K35 2009,ALDERMAN,the state of sexual bigotry today / Homophobia :,"Kantor, Martin.",2009,4/28/09,3/18/15,2,18,1,1,2,FALSE,2692,1,0
2602,5010239,X030562592,HQ1090.3 .S76 2009,ALDERMAN,male milieus in nineteenth-century America / Jolly fellows :,"Stott, Richard Briggs.",2009,9/30/09,5/2/18,0,6,82,1,2,FALSE,2696,1,0
2635,5073889,X030563317,HQ1438 .S63 V37 2009,ALDERMAN,portraits of Southern women in the post-Civil War century / The Varieties of women's experiences :,,2009,12/10/09,10/26/17,0,7,1,2,2 3,TRUE,2731,1,0
2647,4808280,X030474245,HQ792 .U56 J37 2009,ALDERMAN,The Japanification of children's popular culture : from godzilla to miyazaki /,,2009,12/31/08,10/18/18,0,6,1,1,2,FALSE,2743,1,0
2656,5580033,X030924024,HQ449 .D43 2009,ALDERMAN,Third sex : the society hesitates : a sociological report /,"Barma?a, Rañjita Deba,",2009,3/19/12,10/12/17,0,1,0,1,2,FALSE,2752,1,0
2665,4821462,X031649692,HQ117 .J45 2009,ALDERMAN,The industrial vagina : the political economy of the global sex trade /,"Jeffreys, Sheila.",2009,8/18/14,12/3/15,3,9,0,2,2,FALSE,2761,1,0
2710,4885668,X030565608,HQ766.5 .U5 K55 2009,ALDERMAN,"Fit to be tied : sterilization and reproductive rights in America, 1950-1980 /","(Rebecca Marie) Kluchin, Rebecca M.",2009,6/25/09,4/23/18,0,6,3,1,2,FALSE,2807,1,0
2712,4815503,X030470765,HQ1600.3 .G458 2009,ALDERMAN,Gender and power in Irish history /,,2009,2/5/09,4/23/18,1,7,0,1,2,FALSE,2809,1,0
2721,5081762,X030607980,HQ1547 .M67 2009,ALDERMAN,maternity and women's rights in twentieth-century Chile / The politics of motherhood :,"Mooney, Jadwiga E. Pieper.",2009,1/15/10,1/1/17,2,9,20,1,2,FALSE,2819,1,0
2749,4884286,X030567225,HQ18 .A35 L68 2009,ALDERMAN,Love in Africa /,,2009,6/16/09,5/18/17,1,9,11,1,2,TRUE,2849,1,0
2752,5082322,X030607766,HQ71 .R6813 2009,ALDERMAN,a history of perversion / Our dark side :,"Roudinesco, Elisabeth,",2009,2/1/10,5/1/18,1,4,2,1,2,FALSE,2852,1,0
2755,4977422,X030558698,HQ77.9 .Y68 2009,ALDERMAN,You've changed : sex reassignment and personal identity /,,2009,8/26/09,12/6/16,1,10,0,1,2,FALSE,2855,1,0
2760,4884253,X030567220,HQ73.3 .N62 K364 2009,ALDERMAN,sexual outlaws in an Islamic African city / Allah made us :,"Gaudio, Rudolf Pell.",2009,6/16/09,5/11/17,2,9,10,1,2,FALSE,2860,1,0
2774,4878548,X030523369,HQ1421 .Y588 2009,CLEMONS,"women, politics, and popular culture / You've come a long way, baby :",,2009,5/26/09,3/30/18,0,14,21,2,2 3,FALSE,2874,1,0
2796,4818145,X030278089,HQ76.2 .S6 T83 2009,ALDERMAN,"space, identity and interaction in Cape Town / Queer visibilities :","Tucker, Andrew,",2009,2/4/09,9/25/18,1,5,2,1,2,TRUE,2895,1,0
2807,4886691,X030517108,HQ75.8 .R677 A3 2009,ALDERMAN,(misadventures in search of the simple life) / At least in the city someone would hear me scream :,"Rouse, Wade.",2009,7/2/09,2/12/18,0,6,0,1,2,FALSE,2907,1,0
2823,4884993,X030561866,HQ1815.5 .M35 2009,ALDERMAN,the case of northern Nigeria / Muslim and Christian women in dialogue :,"McGarvey, Kathleen,",2009,6/19/09,2/13/18,0,6,1,1,2,FALSE,2923,1,0
2824,5008011,X030559249,HQ515 .P37 2009,ALDERMAN,managing relationships outside of home / Parents and children communicating with society :,,2009,9/16/09,5/11/17,0,8,12,1,2,FALSE,2924,1,0
2836,4884820,X030570920,HQ76.3 .G8 D38 2009,CLEMONS,a bold new exploration of the ancient world / The Greeks and Greek love :,"Davidson, James N.",2009,6/19/09,5/14/18,0,5,0,1,3,TRUE,2937,1,0
2852,4855782,X030469273,HQ1090.3 .G63 2009,ALDERMAN,The overflowing of friendship : love between men and the creation of the American republic /,"Godbeer, Richard.",2009,3/24/09,12/8/17,1,7,0,1,2,FALSE,2953,1,0
2862,5015879,X030562720,HQ1240.5 .L29 B43 2009,ALDERMAN,"Developing partnerships : gender, sexuality, and the reformed World Bank /","Bedford, Kate.",2009,10/7/09,5/16/18,0,4,68,1,2,FALSE,2963,1,0
2865,4895830,X030595529,HQ21 .M67 2009,CLEMONS,"How sex works : why we look, smell, taste, feel, and act the way we do /","Moalem, Sharon.",2009,7/22/09,2/1/17,0,9,5,1,3,FALSE,2966,1,0
2872,5008404,X030559377,HQ767.84 .C55 2009,ALDERMAN,The child : an encyclopedic companion /,,2009,9/18/09,3/29/17,1,8,8,1,2,FALSE,2973,1,0
2880,4775598,X030620088,HQ1206 .T65 2009,ALDERMAN,a more comprehensive introduction / Feminist thought :,"Tong, Rosemarie.",2009,4/12/10,10/19/18,5,27,8,3,2 3,FALSE,2982,1,0
2882,4897643,X030561796,HQ1596 .W6 2009,ALDERMAN,an authoritative text backgrounds and contexts criticism / A vindication of the rights of woman :,"Wollstonecraft, Mary,",2009,8/5/09,4/20/17,0,8,6,1,2,FALSE,2984,1,0
2912,5009180,X030559421,HQ1075.5 .U6 K58 2009,ALDERMAN,gendered foundations of racial formation in the United States / The specter of sex :,"Kitch, Sally.",2009,9/23/09,6/5/17,2,7,21,1,2,FALSE,3015,1,0
2917,5189328,X030777822,HQ1172 .M63 2009,ALDERMAN,The dynamics of becoming orthodox : Dutch Jewish women returning to Judaism and how their mothers felt about it /,"(Minny Evaline), Mock-Degen, Minny E.",2009,8/4/10,6/29/18,0,1,0,1,2,FALSE,3020,1,0
2966,4779337,X030557821,HQ1236 .K76 2009,ALDERMAN,Quotas for women in politics : gender and candidate selection reform worldwide /,"Krook, Mona Lena.",2009,10/2/08,4/30/16,0,13,3,1,2,FALSE,3070,1,0
2981,4883286,X030565851,HQ1236.5 .S7 O36 2009,ALDERMAN,Señoritas in blue : the making of a female political elite in Franco's Spain /,"Ofer, Inbal.",2009,6/12/09,5/13/18,1,4,12,1,2,FALSE,3086,1,0
2998,5226798,X030745239,HQ1170 .W594 2009,ALDERMAN,"Women, Islam and globalization in the twenty-first century /",,2009,10/8/10,11/29/17,1,2,0,1,2,FALSE,3103,1,0
3006,4977447,X030558730,HQ1172 .H36 2009,ALDERMAN,"Gender and American Jews patterns in work, education, and family in contemporary life /","Hartman, Harriet.",2009,8/26/09,9/29/18,0,2,0,1,2,FALSE,3111,1,0
3021,4874704,X030466826,HQ800.3 .M38 2009,ALDERMAN,Citizen bachelors : manhood and the creation of the United States /,"McCurdy, John Gilbert,",2009,5/5/09,5/15/18,0,4,6,1,2,FALSE,3127,1,0
3022,5009194,X030559431,HQ1090 .M669 2009,ALDERMAN,a study of the male body / The naked man :,"Morris, Desmond.",2009,9/23/09,5/12/18,0,3,5,1,2,FALSE,3128,1,0
3046,4885754,X030565642,HQ778.63 .Z54 2009,ALDERMAN,The tragedy of child care in America /,"Zigler, Edward,",2009,6/25/09,8/17/15,0,13,1,1,2,FALSE,3154,1,0
3061,5161949,X030769848,HQ769.3 .M5713 2009,ALDERMAN,"The ideal father : a comprehensive book outlining the principles of being an ""Idial father"" /",,2009,6/9/10,1/15/18,2,2,0,1,2,FALSE,3173,1,0
3073,5010235,X030562587,HQ1413 .S67 G43 2009,ALDERMAN,an American life / Elizabeth Cady Stanton :,"Ginzberg, Lori D.",2009,9/30/09,3/30/16,2,10,1,1,2,TRUE,3186,1,0
3076,5075516,X030607647,HQ76.3 .F8 J33 2009,ALDERMAN,"homosexuality, politics, and morality in France from the liberation to AIDS / Living in Arcadia :","Jackson, Julian,",2009,12/23/09,5/14/18,1,3,4,2,2 3,FALSE,3189,1,0
3096,4826434,X030470385,HQ76.3 .U5 J66 2009,ALDERMAN,the disco era and gay America's coming out / Macho man :,"Jones, Randy,",2009,3/3/09,5/12/18,0,4,2,1,2,FALSE,3209,1,0
3114,5211746,X030241254,HQ470 .S3 V313 2003,CLEMONS,"Kamasutra : a new, complete English translation of the Sanskrit text : with excerpts from the Sanskrit Jayamangala commentary of Yashodhara Indrapada, the Hindi Jaya commentary of Devadatta Shastri, and explanatory notes by the translators /",V?tsy?yana.,2009,9/7/10,4/21/16,0,7,8,1,3,TRUE,3227,1,0
3120,5004463,X030277238,HQ1073.5 .U6 F66 2009,ALDERMAN,Death and dying in America /,"Fontana, Andrea.",2009,8/31/09,12/3/17,0,4,3,1,2,TRUE,3233,1,0
3125,4825608,X030506191,HQ250 .A5 Z44 2009,ALDERMAN,Red lights : the lives of sex workers in postsocialist China /,"Zheng, Tiantian.",2009,3/3/09,4/18/18,0,4,3,1,2,FALSE,3237,1,0
3126,4826449,X030470420,HQ1090.5 .S68 S68 2009,ALDERMAN,perspectives on manhood in the South since Reconstruction / Southern masculinity :,,2009,3/3/09,4/17/18,0,4,12,1,2,FALSE,3238,1,0
3156,4876077,X030467092,HQ21 .M4617513 2009,ALDERMAN,Gender and culture /,"Mayreder, Rosa,",2009,5/12/09,5/14/18,0,3,1,1,2,FALSE,3269,1,0
3163,4865918,X030468312,HQ1059.5 .G7 H43 2009,ALDERMAN,the emergence of midlife in Victorian Britain / Aging by the book :,"Heath, Kay,",2009,4/21/09,9/7/18,1,2,0,1,2,FALSE,3276,1,0
3200,4789541,X030277756,HQ767.87 .M66 2009,ALDERMAN,An introduction to childhood : an anthropological perspective on children's lives /,"Montgomery, Heather (Heather Kate)",2009,11/3/08,8/22/14,1,17,0,1,2,FALSE,3314,1,0
3224,5015871,X030562703,HQ75.5 .W56 2009,ALDERMAN,Queer women and religious individualism /,"Wilcox, Melissa M.,",2009,10/7/09,3/11/18,0,2,8,1,2,FALSE,3341,1,0
3235,4896285,X030517138,HQ801 .B365 2009,CLEMONS,"Behind the bedroom door : getting it, giving it, loving it, missing it /",,2009,7/27/09,6/20/17,1,5,0,1,3,FALSE,3351,1,0
3239,4876107,X030467133,HQ799.7 .L45 2009,ALDERMAN,Daughters of Aquarius : women of the sixties counterculture /,"Lemke-Santangelo, Gretchen.",2009,5/12/09,4/27/17,0,6,0,1,2,FALSE,3355,1,0
3255,5050311,X030377224,HQ76.2 .U5 I834 2009,ALDERMAN,Being homosexual : gay men and their development /,"Isay, Richard A.",2009,10/16/09,10/31/17,2,3,0,1,2,FALSE,3372,1,0
3273,5009160,X030559406,HQ1220 .V63 O45 2009,ALDERMAN,Queen of the Virgins : pageantry and black womanhood in the Caribbean /,"Oliver, M. Cynthia.",2009,9/23/09,7/21/17,0,4,2,1,2,FALSE,3392,1,0
3278,5444758,X031230804,HQ1765.5 .H635 2009,ALDERMAN,K?ndae kyemonggi y?s?ng tamnon /,"Hong, In-suk,",2009,10/27/11,7/12/16,1,2,0,1,2,FALSE,3400,1,0
3283,4851320,X030468886,HQ76.2 .U5 C37 2009,ALDERMAN,The sexuality of migration : border crossings and Mexican immigrant men /,"Cantú, Lionel,",2009,3/17/09,5/4/17,0,6,6,1,2,TRUE,3405,1,0
3292,4885097,X030566015,HQ756 .B665 2009,ALDERMAN,"The book of dads : essays on the joys, perils and humiliations of fatherhood /",,2009,7/10/09,7/13/18,0,6,1,2,2 3,FALSE,3414,1,0
3296,5069788,X030525340,HQ759 .M595 2009,CLEMONS,Mommy angst : motherhood in American popular culture /,,2009,12/4/09,3/17/16,0,8,6,1,3,FALSE,3419,1,0
3316,4820412,X030276718,HQ1190 .P64 2009,ALDERMAN,redoing theory and research with a feminist face / The political interests of gender revisited :,,2009,2/12/09,5/1/17,3,6,4,1,2,FALSE,3444,1,0
3319,4858763,X030516846,HQ670.15 .B46 M35 2009,ALDERMAN,family values in colonial Bengal / Marriage and modernity :,"Majumdar, Rochona.",2009,4/6/09,12/3/16,1,7,0,1,2,FALSE,3447,1,0
3329,5066156,X030596071,HQ2044 .U6 G56 2009,CLEMONS,The birth (and death) of the cool /,"Gioia, Ted.",2009,12/16/09,7/14/17,0,4,0,2,3,TRUE,3458,1,0
3341,4896568,X030561586,HQ1236.5 .L37 F46 2009,ALDERMAN,Feminist agendas and democracy in Latin America /,,2009,7/29/09,8/22/16,0,7,5,1,2,TRUE,3471,1,0
3346,5052796,X030595871,HQ1190 .F4513 2009,ALDERMAN,theorizing the non-ideal / Feminist ethics and social and political philosophy :,,2009,10/23/09,4/26/17,1,4,0,1,2,FALSE,3476,1,0
3360,4886489,X030565848,HQ792 .U5 O77 2009,ALDERMAN,"immigrant youth, language, and culture / Translating childhoods :","Orellana, Marjorie Faulstich.",2009,7/1/09,3/28/17,0,5,0,1,2,FALSE,3490,1,0
3367,4890999,X030277104,HQ1240.5 .R8 U553 2009,ALDERMAN,Female entrepeneurs in nineteenth-century Russia /,"Ulianova, Galina.",2009,7/14/09,5/8/18,0,1,2,1,2,FALSE,3497,1,0
3370,5005859,X030558892,HQ1742 .R263 2009 v.2,ALDERMAN,Women in India : a social and cultural history /,"Raman, Sita Anantha.",2009,9/2/09,12/9/15,5,13,6,2,2,TRUE,3500,1,0
3375,4858933,X030467800,HQ772 .H353 2009,ALDERMAN,The nurture assumption : why children turn out the way they do /,"Harris, Judith Rich.",2009,4/7/09,12/15/15,0,10,87,1,2,FALSE,3505,1,0
3379,4859265,X030278234,HQ12 .S698 2009,ALDERMAN,Sexuality in world history /,"Stearns, Peter N.",2009,4/8/09,8/30/17,0,4,3,1,2,FALSE,3509,1,0
3388,5082460,X030694679,HQ194 .W55 2009,ALDERMAN,histoire et archives de la police des m?urs / La mondaine :,"Willemin, Véronique.",2009,1/21/10,11/27/17,0,1,1,1,2,FALSE,3519,1,0
3395,4793321,X030472185,HQ1190 .N44 2009,ALDERMAN,What a girl wants? : fantasizing the reclamation of self in postfeminism /,"Negra, Diane,",2009,11/18/08,11/30/15,1,11,7,1,2,FALSE,3526,1,0
3415,4884826,X030570925,HQ756 .L479 2009,CLEMONS,Home game : an accidental guide to fatherhood /,"Lewis, Michael (Michael M.)",2009,6/19/09,4/18/16,0,8,1,1,3,FALSE,3549,1,0
3419,5077448,X030690801,HQ1237.5 .C5 Q24 2009,ALDERMAN,The cultural interpretation of Chinese women's destiny / Zhongguo nü xing xing wei de wen hua shi yi =,"Qian, Minhui.",2009,1/7/10,4/21/17,0,3,0,1,2,FALSE,3555,1,0
3445,4878475,X030278497,HQ77.9 .S64 2009,ALDERMAN,Social work practice with transgender and gender variant youth /,,2009,5/26/09,1/5/18,0,2,10,1,2,FALSE,3581,1,0
3490,5064916,X004087149,HQ684 .A227 2009,ALDERMAN,Chinese kinship : contemporary anthropological perspectives /,,2009,11/17/09,4/14/17,0,3,1,1,2,FALSE,3629,1,0
3509,4823014,X030469740,HQ1064 .U5 L39 2009,ALDERMAN,"passion, risk, and adventure in the 25 years after 50 / The third chapter :","Lawrence-Lightfoot, Sara,",2009,2/24/09,1/29/18,0,2,0,1,2,TRUE,3649,1,0
3569,4823024,X030469785,HQ1061 .C79 2009,ALDERMAN,worldwide perspectives / The cultural context of aging :,,2009,2/24/09,1/25/17,1,5,3,1,2,FALSE,3712,1,0
3575,4823016,X030469766,HQ77.9 .S26 2009,ALDERMAN,sexual orientation in male-to-female transgender people / When the opposite sex isn't :,"Samons, Sandra L.",2009,2/24/09,3/15/18,0,1,5,1,2,FALSE,3718,1,0
3581,4891148,X030566230,HQ281 .C64 2009,ALDERMAN,Slave hunter : one man's global quest to free victims of human trafficking /,"Cohen, Aaron,",2009,7/15/09,11/23/15,0,8,10,1,2,FALSE,3724,1,0
3582,5077654,X030618597,HQ799.2 .P6 C38 2009,CLEMONS,"Jon Stewart, branding, and the youth vote in America / Consuming politics :","Cassino, Dan,",2009,1/21/10,5/11/16,0,5,12,1,3,TRUE,3725,1,0
3614,5318730,X030925855,HQ1765.5 .C445 2009,ALDERMAN,"Gender and mission encounters in Korea : new women, old ways /","Choi, Hyaeweol.",2009,4/6/11,12/18/15,1,3,37,1,2,FALSE,3759,1,0
3616,4859713,X030468314,HQ1236.5 .I7 O83 2009,ALDERMAN,The politics of women's rights in Iran /,"Osanloo, Arzoo,",2009,5/6/09,10/31/16,1,5,5,1,2 17,FALSE,3762,1,0
3639,4877769,X030276850,HQ1190 .G4768 2009,ALDERMAN,Postfeminism : cultural texts and theories /,"Genz, Stéphanie,",2009,5/18/09,3/13/16,0,7,0,1,2,FALSE,3786,1,0
3667,5006752,X030501492,HQ1726.7 .K85 2009,ALDERMAN,Kültür ve siyasette feminist yakla?imlar 2009.,,2009,9/9/09,6/23/14,0,12,0,1,2,FALSE,3816,1,0
3678,5065509,X030563328,HQ1236.5 .A3 A25 2009,ALDERMAN,the politics and effects of intervention / Gender and international aid in Afghanistan :,"Abirafeh, Lina,",2009,11/19/09,4/20/14,0,12,7,1,2,FALSE,3827,1,0
3709,5006783,X030559034,HQ1236.5 .C2 B37 2009,ALDERMAN,"the hidden story of Canada's unfinished democracy / Women, power, politics :","Bashevkin, Sylvia B.",2009,9/9/09,7/16/17,0,1,0,1,2,FALSE,3860,1,0
3712,4881294,X030566850,HQ1413 .K45 K454 2009,ALDERMAN,"The selected letters of Florence Kelley, 1869-1931 /","Kelley, Florence,",2009,6/2/09,9/26/17,1,1,0,1,2,FALSE,3863,1,0
3720,4851017,X030278180,HQ1090 .M3797 2009,ALDERMAN,historical perspectives / Masculinity and the other :,,2009,3/13/09,4/24/17,5,3,0,1,2,FALSE,3871,1,0
3728,5007989,X030559244,HQ535 .W47 2009,ALDERMAN,"Barack Obama's America : how new conceptions of race, family, and religion ended the Reagan era /","White, John Kenneth.",2009,9/16/09,4/30/16,1,5,3,1,2,FALSE,3881,1,0
3749,4881281,X030566838,HQ759 .T96 2009,ALDERMAN,a temporary madness / Understanding postpartum psychosis :,"Twomey, Teresa M.,",2009,6/2/09,12/9/15,0,7,2,1,2,FALSE,3902,1,0
3811,4773319,X030464477,HQ1381 .S63 2009,ALDERMAN,rethinking development strategies and macroeconomic policies / Social justice and gender equality :,,2009,9/16/08,12/11/16,1,5,0,1,2,FALSE,3967,1,0
3812,4793317,X030472179,HQ759.913 .L364 2009,ALDERMAN,"Reconstructing motherhood and disability in the age of ""perfect"" babies /","Landsman, Gail H.,",2009,11/18/08,5/22/17,1,3,1,1,2,FALSE,3968,1,0
3863,4885669,X030565610,HQ1236.5 .M6 S65 2009,ALDERMAN,Gender and the Mexican Revolution : Yucatán women & the realities of patriarchy /,"Smith, Stephanie J.",2009,6/25/09,10/28/16,2,3,0,1,2,FALSE,4024,1,0
3883,5082226,X030277485,HQ1800.5 .L44 2009,ALDERMAN,African women and apartheid : migration and settlement in urban South Africa /,"Lee, Rebekah,",2009,1/19/10,8/15/14,0,9,0,1,2,FALSE,4045,1,0
3890,4896603,X030561615,HQ1136 .C367 2009,ALDERMAN,constructing virtue and creating identity in the Roman world / Pliny's women :,"Carlon, Jacqueline M.,",2009,7/29/09,4/6/15,1,8,0,1,2,FALSE,4052,1,0
3896,4851298,X030468871,HQ759.48 .D48 2009,ALDERMAN,images and realities of work and family / Media and middle class moms :,"Descartes, Lara,",2009,3/17/09,10/27/15,1,7,11,1,2,FALSE,4059,1,0
3901,4881268,X030566828,HQ536 .A27 2009,ALDERMAN,Across generations : immigrant families in America /,,2009,6/2/09,1/31/17,1,2,5,1,2,FALSE,4065,1,0
3948,4858883,X030467739,HQ1532 .G86 2009,ALDERMAN,"performing charity and creating rights in Argentina, 1880-1955 / Women build the welfare state :","Guy, Donna J.",2009,4/7/09,10/27/14,0,10,0,1,2,FALSE,4115,1,0
3950,4891142,X030566239,HQ806 .R66 2009,ALDERMAN,infidelity and feminism / Cheating on the sisterhood :,"Rosewarne, Lauren.",2009,7/15/09,5/3/16,0,4,0,1,2,FALSE,4117,1,0
3951,4823670,X030276786,HQ777.4 .G76 2009,ALDERMAN,Growing up fatherless in antiquity /,,2009,2/26/09,3/14/17,0,2,0,1,2,FALSE,4118,1,0
4036,5223186,X030770477,HQ799 .I5 L85 2009,ALDERMAN,"gender, youth, and consumer citizenship in globalizing India / Liberalization's children :","Lukose, Ritty A.,",2009,9/23/10,7/21/15,0,3,59,1,2,TRUE,4211,1,0
4037,4785264,X030466064,HQ1111 .F458 2009,ALDERMAN,"Feminism, domesticity and popular culture /",,2009,10/21/08,2/23/16,1,6,4,1,2,FALSE,4212,1,0
4065,4884883,X030523796,HQ756.6 .S65 2009,CLEMONS,"The daddy shift : how stay-at-home dads, breadwinning moms, and shared parenting are transforming the American family /","Smith, Jeremy Adam,",2009,6/19/09,11/16/15,1,10,0,2,2 3,FALSE,4241,1,0
4076,4857348,X030568594,HQ1693 .E84 2009,ALDERMAN,"women's experience in Spain and Spanish America, 1726-1839 / Eve's Enlightenment :",,2009,4/3/09,9/22/15,0,6,4,1,2,FALSE,4253,1,0
4162,5070669,X030277440,HQ71 .S4126 2009,ALDERMAN,"Sexual perversions, 1670-1890 /",,2009,12/8/09,5/2/15,3,5,2,1,2,FALSE,4345,1,0
4168,5065500,X030623739,HQ1026 .K87 2009,ALDERMAN,Incest & influence : the private life of bourgeois England /,"Kuper, Adam.",2009,11/19/09,1/26/15,0,6,0,1,2,FALSE,4351,1,0
4190,5123921,X030608317,HQ1726.5 .W65 2009,ALDERMAN,Women and war in the Middle East : transnational perspectives /,,2009,4/6/10,4/28/15,1,4,3,1,2,FALSE,4373,1,0
4198,4878559,X030566633,HQ799.8 .T34 W45 2009,ALDERMAN,global fantasy in urban Tanzania / Street dreams and hip hop barbershops :,"Weiss, Brad.",2009,5/26/09,9/4/15,1,5,1,2,2 3,FALSE,4383,1,0
4237,4819951,X030521941,HQ1236 .G62 2009,ALDERMAN,Governing women : women's political effectiveness in contexts of democratization and governance reform /,,2009,2/11/09,7/20/15,2,6,4,1,2,FALSE,4422,1,0
4254,4876110,X030467127,HQ18.3 .M35 2009,ALDERMAN,"the life and times of William Masters and Virginia Johnson, the couple who taught America how to love / Masters of sex :","Maier, Thomas,",2009,5/12/09,11/23/15,0,7,0,2,2 3,FALSE,4439,1,0
4257,6015976,X031603005,HQ1233 .K535 2009,ALDERMAN,"journeys of hope / Women, television and everyday life in Korea :","Kim, Youna.",2009,5/21/13,5/31/13,0,2,0,1,2,FALSE,4443,1,0
4269,5010232,X030562562,HQ1170 .S48 2009,ALDERMAN,Muslim women's quiet resistance to Islamic fundamentalism / Velvet jihad :,"Shirazi, Faegheh,",2009,9/30/09,4/14/15,2,5,0,1,2,FALSE,4455,1,0
4300,4977433,X030558719,HQ799.2 .M352 U655 2009,ALDERMAN,Living and learning with new media : summary of findings from the digital youth project /,,2009,8/26/09,3/1/16,0,2,0,1,2,FALSE,4487,1,0
