1311,6515408,X031708795,HQ1190 .T85 2015,ALDERMAN,Generational feminism : new materialist introduction to a generative approach /,"Tuin, Iris van der,",2015,3/11/15,5/8/18,0,2,4,1,2,FALSE,1355,1,0
1319,6550084,X031706124,HQ76.2 .U5 H337 2015,ALDERMAN,race and sexuality in gaysian America / Geisha of a different kind :,"Han, C. Winter,",2015,4/29/15,12/9/17,1,3,3,1,2,FALSE,1363,1,0
1321,6562509,X031706438,HQ18 .I8 B33 2015,ALDERMAN,"Italian sexualities uncovered, 1789-1914 /","Babini, Valeria Paola",2015,5/20/15,6/19/18,0,1,2,1,2,FALSE,1365,1,0
1323,6576170,X031732643,HQ1090 .Z56 2015,ALDERMAN,Man (dis)connected : how technology has sabotaged what it means to be male /,"Zimbardo, Philip G.,",2015,7/6/15,5/12/18,0,1,6,1,2,FALSE,1367,1,0
1344,6533815,X031709362,HQ1593 .S923 2015,ALDERMAN,"middle-class women and work in Britain, 1870-1914 / In search of the new woman :","Sutherland, Gillian,",2015,4/8/15,3/12/18,0,2,0,1,2,FALSE,1390,1,0
1345,6892386,X031798625,HQ1064 .I4 V36 2015,ALDERMAN,tradition and transition / Elderly women in Indian village :,"Vandana Kumari,",2015,10/5/16,5/4/17,0,1,0,1,2,TRUE,1391,1,0
1354,6552897,X031706291,HQ30.5 .K85 2015,ALDERMAN,"sex, disability, and the ethics of engagement / Loneliness and its opposite :","Kulick, Don,",2015,5/13/15,8/29/18,0,0,0,1,2,FALSE,1401,1,0
1359,6642219,X031733769,HQ759 .M8734165 2015,ALDERMAN,"consumption, communication, and privilege / The motherhood business :",,2015,11/30/15,12/12/17,0,1,1,1,2,FALSE,1407,1,0
1360,6642245,X031733713,HQ789 .L53 2015,ALDERMAN,The right to be loved /,"Liao, S. Matthew",2015,11/30/15,8/29/17,0,2,1,1,2,FALSE,1408,1,0
1362,6999966,X031856062,HQ799 .I52 N485 2015,ALDERMAN,emerging Muslim identity in globalized India / Beyond hybridity and fundamentalism :,"Khan, Tabassum Ruhi,",2015,3/17/17,4/2/17,0,0,0,1,2,FALSE,1410,1,0
1368,6655142,X031810034,HQ777 .H384 2015,ALDERMAN,"HBO's Girls and the awkward politics of gender, race, and privilege /",,2015,12/9/15,11/29/17,0,1,1,1,2,FALSE,1416,1,0
1379,6502434,X031704787,HQ756 .M558 2015,ALDERMAN,confronting the crisis of economically vulnerable nonresident fathers / Failing our fathers :,"Mincy, Ronald B.,",2015,2/11/15,3/22/18,0,2,2,1,2,FALSE,1427,1,0
1386,6651403,X031796000,HQ784 .V53 V56 2015,ALDERMAN,Violent video games /,,2015,12/9/15,7/27/17,0,2,3,1,2,TRUE,1434,1,0
1394,6563371,X031706752,HQ1237.5 .M628 E47 2015,ALDERMAN,Headscarves and hymens : why the Middle East needs a sexual revolution /,"Eltahawy, Mona,",2015,5/27/15,12/12/17,0,2,1,1,2,FALSE,1444,1,0
1395,6530013,X031709140,HQ1154 .F44345 2015,ALDERMAN,Feminisms and ruralities /,,2015,3/25/15,5/13/18,0,1,3,1,2,FALSE,1445,1,0
1397,6641282,X031731998,HQ18 .U5 L528 2015,ALDERMAN,"young women, sex, and rebellion before the sixties / Bad girls :","Littauer, Amanda H.,",2015,11/18/15,2/23/18,0,0,0,1,2,TRUE,1447,1,0
1413,6502357,X031704801,HQ767.9 .W457 2015,ALDERMAN,Childhood in a global perspective /,"Wells, Karen C.,",2015,2/11/15,5/21/18,0,1,3,1,2,FALSE,1464,1,0
1421,6604915,X031732811,HQ1767 .G457 2015,ALDERMAN,transformative encounters / Gender & Chinese history :,,2015,7/22/15,1/9/18,0,1,0,1,2,FALSE,1473,1,0
1422,6563404,X031706809,HQ1787 .T73 2015,ALDERMAN,Transatlantic feminisms : women and gender studies in Africa and the diaspora /,,2015,5/27/15,11/6/17,0,2,1,1,2,FALSE,1474,1,0
1434,6640971,X031733659,HQ281 .S85 2015,ALDERMAN,"transnational feminism, postsocialism, and the politics of sex trafficking / Economies of violence :","Suchland, Jennifer,",2015,11/18/15,9/29/17,0,1,0,1,2,FALSE,1487,1,0
1440,6548900,X031705796,HQ1155 .O86 2015,ALDERMAN,"Girls will be girls : dressing up, playing parts and daring to act differently /","O'Toole, Emer,",2015,4/22/15,11/17/17,0,2,0,1,2,FALSE,1493,1,0
1445,6513323,X031708674,HQ767.15 .K33 2015,ALDERMAN,"women's rights, human life, and the question of justice / The ethics of abortion :","Kaczor, Christopher Robert,",2015,3/4/15,4/4/18,0,1,4,1,2,FALSE,1498,1,0
1453,6528336,X031709017,HQ60 .J44 2015,ALDERMAN,Sex in China /,"Jeffreys, Elaine,",2015,3/18/15,12/4/17,1,2,0,1,2,FALSE,1506,1,0
1457,6783883,X031595488,HQ1735.2 .P57 2015,ALDERMAN,"Dukhtar?n-i ?r?n, s?l?r-i zan?n-i Jah?n : ?b sarguz?asht-i zan-i ?r?n? az ?gh?z t? bih imr?z = Daughters of Persia : pioneering women of the world / ?c ta?l?f-i Man??rah P?rn?y?.","Pirnia, Mansore,",2015,7/1/16,3/23/17,0,1,0,1,2,FALSE,1510,1,0
1463,6515427,X031708900,HQ29 .B557 2015,ALDERMAN,Black female sexualities /,,2015,3/11/15,3/15/18,1,1,1,1,2,FALSE,1516,1,0
1466,6512301,X031704954,HQ1233 .A686 2015,ALDERMAN,anti-feminism in a post-feminist era / Modern misogyny :,"Anderson, Kristin J.,",2015,2/25/15,5/12/17,0,4,3,1,2,FALSE,1519,1,0
1470,6501006,X031708181,HQ767.87 .A73 2015,ALDERMAN,rights and childhood / Children :,"Archard, David,",2015,2/4/15,4/3/18,0,1,0,1,2,FALSE,1525,1,0
1487,6576210,X031732586,HQ76.3 .G7 J36 2015,ALDERMAN,Visions of queer martyrdom from John Henry Newman to Derek Jarman /,"Janes, Dominic",2015,7/6/15,11/27/17,0,1,0,1,2,FALSE,1540,1,0
1508,6625512,X031733117,HQ1161 .T38 2015,ALDERMAN,"Black women's bodies and the nation : race, gender and culture /","Tate, Shirley Anne",2015,10/7/15,5/5/17,0,2,0,1,2,FALSE,1562,1,0
1510,6532404,X031709306,HQ472 .U6 N485 2015,ALDERMAN,"New views on pornography : sexuality, politics, and the law /",,2015,4/1/15,1/5/18,0,1,0,1,2,FALSE,1564,1,0
1512,6708667,X031761621,HQ799 .C5 F57 2015,ALDERMAN,China's millennials : the want generation /,"Fish, Eric,",2015,3/18/16,4/12/17,0,1,0,1,2,TRUE,1566,1,0
1513,6548797,X031705893,HQ1787 .G457 2015,ALDERMAN,Gendering ethnicity in African women's lives /,,2015,4/22/15,5/18/17,0,3,3,1,2,FALSE,1568,1,0
1515,6634066,X031733126,HQ1426 .S615 2015,ALDERMAN,a gender diary / The feminism of uncertainty :,"Snitow, Ann Barr,",2015,10/14/15,4/18/17,0,2,10,1,2,FALSE,1570,1,0
1521,6458160,X031716453,HQ834 .F85 2015,ALDERMAN,Leaving before the rains come /,"Fuller, Alexandra,",2015,1/22/15,7/19/17,0,3,1,1,2,FALSE,1577,1,0
1523,6574874,X031729951,HQ1426 .F4735 2015,ALDERMAN,Feminist surveillance studies /,,2015,6/30/15,10/12/17,0,1,30,1,2,FALSE,1579,1,0
1530,6623719,X031738882,HQ1075.5 .U6 S575 2015,ALDERMAN,Unfinished business : women men work family /,"Slaughter, Anne-Marie,",2015,9/30/15,4/17/17,0,2,8,1,2,FALSE,1586,1,0
1532,6533822,X031709407,HQ1190 .M3835 2015,ALDERMAN,"Pursuing intersectionality, unsettling dominant imaginaries /","May, Vivian M.,",2015,4/8/15,8/25/17,1,2,0,1,2,FALSE,1589,1,0
1537,6642270,X031733747,HQ29 .H39 2015,ALDERMAN,"women, physiology, and the solitary vice in nineteenth-century America / Riotous flesh :","Haynes, April R.,",2015,11/30/15,2/22/17,0,2,1,1,2,FALSE,1594,1,0
1538,6502408,X031704785,HQ767.5 .U5 R64 2015,ALDERMAN,"Abortion politics, mass media, and social movements in America /","Rohlinger, Deana A.",2015,2/11/15,1/14/18,0,1,1,1,2,TRUE,1595,1,0
1547,6638051,X031738207,HQ684 .S66 2015,ALDERMAN,survival strategies and judicial interventions / Polyandry and wife-selling in Qing dynasty China :,"Sommer, Matthew Harvey,",2015,11/9/15,11/17/16,0,3,0,1,2,FALSE,1604,1,0
1551,6641321,X031731977,HQ1220 .F8 G76 2015,ALDERMAN,transforming French ideas of femininity in the Third Republic / The force of beauty :,"Grout, Holly,",2015,11/18/15,6/3/17,0,1,5,1,2,TRUE,1608,1,0
1563,6528400,X031705329,HQ1460.5 .S64 2015,ALDERMAN,The women of colonial Latin America /,"Socolow, Susan Migden,",2015,3/18/15,4/30/17,0,3,2,1,2,FALSE,1622,1,0
1573,6425317,X031651498,HQ75.28 .U6 M49 2015,ALDERMAN,LGBT families /,"Mezey, Nancy J.,",2015,11/5/14,11/15/17,0,2,0,1,2,FALSE,1633,1,0
1587,6651179,X031734008,HQ767.5 .S6 K55 2015,ALDERMAN,"nationalism, sexuality, and women's reproductive rights in South Africa / Abortion under apartheid :","Klausen, Susanne Maria,",2015,12/9/15,4/14/17,0,1,4,1,2,FALSE,1649,1,0
1600,6671860,X031735456,HQ1161 .W656 2015,ALDERMAN,"blogs, timelines, feeds, and community / Women of color and social media multitasking :",,2015,1/8/16,11/23/16,0,2,2,1,2,FALSE,1664,1,0
1602,6623332,X031744579,HQ1190 .F76 2015,ALDERMAN,the limits of liberal feminism / Freedom fallacy :,,2015,9/25/15,2/8/17,1,2,7,1,2,FALSE,1666,1,0
1604,6576084,X031732604,HQ1180 .F677 2015,ALDERMAN,"Magazine movements : women's culture, feminisms and media form /","Forster, Laurel,",2015,7/6/15,4/10/17,0,2,3,1,2,FALSE,1668,1,0
1617,6640430,X031731632,HQ1031 .M3946 2015,ALDERMAN,interracial sex and marriage in the United States and Australia / Illicit love :,"(Ann Margaret), McGrath, Ann",2015,11/11/15,4/4/17,0,1,0,1,2,FALSE,1681,1,0
1621,6635063,X031733252,HQ792 .E8 T73 2015,ALDERMAN,the development of children of immigrants / Transitions :,,2015,10/28/15,4/11/17,0,1,1,1,2,TRUE,1685,1,0
1623,6447803,X031707724,HQ1410 .O75 2015,ALDERMAN,Rethinking American women's activism /,"Orleck, Annelise",2015,1/21/15,7/26/17,0,2,0,1,2,FALSE,1687,1,0
1639,6511332,X031708380,HQ1236.5 .K6 S55 2015,ALDERMAN,Protest politics and the democratization of South Korea : strategies and roles of women /,"Shin, Youngtae,",2015,2/18/15,1/16/18,0,0,0,1,2,FALSE,1702,1,0
1645,6513373,X031705265,HQ1155 .P625 2015,ALDERMAN,"feminism, media and 21st century popular culture / The politics of being a woman :",,2015,3/4/15,11/6/16,0,4,4,1,2,FALSE,1709,1,0
1653,6641183,X031731776,HQ1236 .C4735 2015,ALDERMAN,"Myths about women's rights : how, where, and why rights advance /","Cherif, Feryal M.,",2015,11/18/15,2/17/17,1,1,3,1,2,FALSE,1718,1,0
1654,6644495,X031733773,HQ1170 .C746 2015,ALDERMAN,Contesting feminisms : gender and Islam in Asia /,,2015,12/4/15,2/4/17,0,1,2,1,2,FALSE,1719,1,0
1661,6533794,X031709388,HQ27 .S74 2015,ALDERMAN,sex and youth in modern China / Little emperors and material girls :,"Steinfeld, Jemimah.",2015,4/8/15,4/18/17,0,2,1,1,2,FALSE,1726,1,0
1666,6512906,X031672379,HQ1031 .B345 2015,ALDERMAN,"Conquerors, brides, and concubines : interfaith relations and social power in medieval Iberia /","Barton, Simon,",2015,3/3/15,5/11/17,0,2,1,1,2,FALSE,1731,1,0
1675,6634105,X031733157,HQ76.8 .U5 E44 2015,ALDERMAN,Don't tell me to wait : how the fight for gay rights changed America and transformed Obama's presidency /,"Eleveld, Kerry,",2015,10/14/15,11/15/16,0,2,0,1,2,FALSE,1740,1,0
1680,6426885,X031731507,HQ792 .E35 M67 2015,ALDERMAN,Childhood and colonial modernity in Egypt /,"Morrison, Heidi,",2015,10/29/15,2/10/17,0,1,0,1,2,FALSE,1746,1,0
1685,6641534,X031731791,HQ281 .P47 2015,ALDERMAN,"sex, gender, and culture in the law / Responding to human trafficking :","Peters, Alicia W.,",2015,11/18/15,1/18/17,0,1,0,1,2,FALSE,1751,1,0
1689,6567423,X031707072,HQ1090 .G63 2015,ALDERMAN,"reflections on war, sex, and church / Borderline :","Goff, Stan,",2015,6/10/15,5/13/17,0,1,4,1,2,FALSE,1755,1,0
1705,6641366,X031731766,HQ1190 .W548 2015,ALDERMAN,Gut feminism /,"(Elizabeth Ann), Wilson, Elizabeth A.",2015,11/18/15,12/27/16,1,1,0,1,2,FALSE,1771,1,0
1708,6573643,X031707286,HQ1236.5 .B28 G46 2015,ALDERMAN,Gender (in)equality and gender politics in Southeastern Europe : a question of justice /,,2015,6/17/15,8/4/17,0,0,0,1,2,TRUE,1774,1,0
1719,6677920,X031734131,HQ1034 .U5 B38 2015,ALDERMAN,how the law shapes parenthood / Legalizing LGBT families :,"Baumle, Amanda K.",2015,1/15/16,10/31/16,2,1,0,1,2 17,FALSE,1785,1,0
1724,6532489,X031725218,HQ1063.6 .H63 2015,ALDERMAN,a memoir / Bettyville :,"Hodgman, George,",2015,4/1/15,11/5/16,0,3,2,1,2,FALSE,1790,1,0
1739,6574647,X031729929,HQ755.8 .L97 2015,ALDERMAN,How to raise an adult : break free of the overparenting trap and prepare your kid for success /,"Lythcott-Haims, Julie,",2015,6/26/15,8/18/16,1,3,6,1,2,FALSE,1805,1,0
1740,6549993,X031706074,HQ980 .D47 2015,ALDERMAN,jealousy and compersion in queer women's polyamorous relationships / Love's refraction :,"Deri, Jillian,",2015,4/29/15,4/28/17,0,1,0,1,2,FALSE,1806,1,0
1742,6533874,X031709434,HQ1438 .K4 K43 2015,ALDERMAN,Kentucky women : their lives and times /,,2015,4/8/15,5/11/17,0,1,2,1,2,FALSE,1808,1,0
1749,6643160,X031733852,HQ1801 .S52 2015,ALDERMAN,promises of feminism / Women and power in Zimbabwe :,"Shaw, Carolyn Martin,",2015,12/2/15,11/8/16,0,1,3,1,2,FALSE,1814,1,0
1755,6643136,X031733989,HQ76.13 .G66 2015,ALDERMAN,"Gay fathers, their children, and the making of kinship /","Goodfellow, Aaron,",2015,12/2/15,10/31/16,0,1,0,1,2,FALSE,1820,1,0
1756,6563395,X031706686,HQ1735.6 .B55 2015,ALDERMAN,Kabul carnival : gender politics in postwar Afghanistan /,"Billaud, Julie,",2015,5/27/15,3/23/17,0,1,2,1,2,FALSE,1821,1,0
1758,6622913,X031738822,HQ21 .H4565 2015,ALDERMAN,The sex myth : the gap between our fantasies and reality /,"Hills, Rachel,",2015,9/21/15,9/9/16,0,2,0,1,2,FALSE,1823,1,0
1760,6567467,X031707048,HQ782 .H386 2015,ALDERMAN,Play and the human condition /,"Henricks, Thomas S.,",2015,6/10/15,11/23/16,0,2,10,1,2,FALSE,1825,1,0
1761,6532355,X031709220,HQ759.913 .B58 2015,ALDERMAN,Raising generation Rx : mothering kids with invisible disabilities in an age of inequality /,"Blum, Linda M.,",2015,4/1/15,4/30/17,0,1,0,1,2,FALSE,1826,1,0
1771,6634045,X031733119,HQ773.5 .K538 2015,ALDERMAN,empowering parents to maximize their child's potential / The challenges of gifted children :,"Klein, Barbara Schave,",2015,10/14/15,11/26/16,2,1,0,1,2,FALSE,1836,1,0
1772,6625124,X031755944,HQ1770 .B36 M3 2015,ALDERMAN,"Runaway wives, urban crimes, and survival tactics in wartime Beijing, 1937-1949 /","Ma, Zhao,",2015,10/6/15,3/16/17,0,0,0,1,2,FALSE,1837,1,0
1780,6550059,X031705926,HQ767 .C253 2015,ALDERMAN,Beyond the abortion wars : a way forward for a new generation /,"Camosy, Charles Christopher,",2015,4/29/15,12/8/16,0,2,15,1,2,FALSE,1846,1,0
1783,6642267,X031733760,HQ1800.5 .G64 2015,ALDERMAN,"women, urbanization, and the right to the city in South Africa / On their own :","Goebel, Allison",2015,11/30/15,1/20/17,0,0,0,1,2,FALSE,1849,1,0
1784,6654620,X031791226,HQ1147 .E6 S28 2015,ALDERMAN,Gender in medieval culture /,"Sauer, Michelle M.,",2015,12/9/15,9/26/16,1,1,0,1,2,FALSE,1850,1,0
1796,6530039,X031705450,HQ1075 .I475 2015,ALDERMAN,contemporary representations of new sexualities and gender identities / Identities on the move :,,2015,3/25/15,3/30/17,0,1,0,1,2,FALSE,1862,1,0
1805,6511372,X031708387,HQ767.9 .C66 2015,ALDERMAN,contemporary issues in the sociological study of childhood / Constructing and reconstructing childhood :,,2015,2/18/15,9/18/16,1,3,0,1,2,FALSE,1871,1,0
1817,6550116,X031706067,HQ1593 .N53 2015,ALDERMAN,Perfect wives in ideal homes : the story of women in the 1950s /,"Nicholson, Virginia",2015,4/29/15,2/7/17,0,1,0,1,2,FALSE,1884,1,0
1839,6567420,X031707171,HQ1155 .T46 2015,ALDERMAN,This is what a feminist slut looks like : perspectives on the slutwalk movement /,,2015,6/10/15,5/14/16,0,3,2,1,2,FALSE,1904,1,0
1840,6534104,X031725291,HQ755.7 .S4428 2015,ALDERMAN,"Selfish, shallow, and self-absorbed : sixteen writers on the decision not to have kids /",,2015,4/10/15,3/15/16,0,4,1,1,2,FALSE,1905,1,0
1846,6640489,X031731662,HQ76.3 .C6 L58 2015,ALDERMAN,Queer Marxism in two Chinas /,"Liu, Petrus,",2015,11/11/15,4/26/16,1,2,3,1,2,TRUE,1911,1,0
1853,6641358,X031732077,HQ799.7 .R66 2015,ALDERMAN,American hippies /,"Rorabaugh, W. J.",2015,11/18/15,4/13/16,0,2,0,1,2,FALSE,1917,1,0
1854,6709542,X031730567,HQ76.8 .G7 B83 2015,ALDERMAN,The way out : a history of homosexuality in modern Britain /,"Buckle, Sebastian,",2015,3/23/16,4/22/16,0,1,1,1,2,FALSE,1918,1,0
1863,6562510,X031706593,HQ1237.5 .G7 T88 2015,ALDERMAN,Man-made : why so few women are in positions of power /,"Tutchell, Eva,",2015,5/20/15,12/4/16,0,1,0,1,2,TRUE,1927,1,0
1871,6623475,X031738873,HQ1397 .P65 2015,ALDERMAN,why science is still a boys' club / The only woman in the room :,"Pollack, Eileen,",2015,9/28/15,5/4/16,0,2,2,1,2,FALSE,1935,1,0
1872,6732116,X031795186,HQ799.5 .L87 2015,ALDERMAN,The millennial mindset : unraveling fact from fiction /,"Luttrell, Regina,",2015,5/25/16,6/1/16,0,0,0,1,2,FALSE,1936,1,0
1879,6687156,X031734436,HQ1155 .W58 2015,ALDERMAN,"Feminism, digital culture and the politics of transmission : theory, practice and cultural heritage /","Withers, Deborah M.,",2015,2/10/16,4/28/16,0,1,2,1,2,FALSE,1943,1,0
1910,6651141,X031732182,HQ1181 .U5 J86 2015,ALDERMAN,"Lactivism : how feminists and fundamentalists, hippies and yuppies, and physicians and politicians made breastfeeding big business and bad policy /","Jung, Courtney,",2015,12/9/15,5/26/16,0,1,1,1,2,FALSE,1974,1,0
1932,6563417,X031706817,HQ767.5 .U5 C64 2015,ALDERMAN,Living in the crosshairs : the untold stories of anti-abortion terrorism /,"Cohen, David S.,",2015,5/27/15,10/4/16,0,1,0,1,2,TRUE,1997,1,0
1933,6549970,X031706064,HQ691.7 .A14 2015,ALDERMAN,"family, ideology, and law in nineteenth and early twentieth century Egypt / Modernizing marriage :","Cuno, Kenneth M.,",2015,4/29/15,2/7/17,0,0,0,1,2,FALSE,1998,1,0
1938,6722884,X031794735,HQ1033 .R53 2015,ALDERMAN,a philosophical investigation / Justifying same-sex marriage :,"Richardson-Self, Louise,",2015,4/27/16,5/2/16,0,0,0,1,2,FALSE,2003,1,0
1973,6576200,X031732590,HQ1075 .G3739 2015,ALDERMAN,"Gender, imperialism and global exchanges /",,2015,7/6/15,8/2/16,1,1,3,1,2,FALSE,2034,1,0
1982,6651135,X031732157,HQ217.7 .A5 S73 2015,ALDERMAN,prostitution and social control in partitioned Poland / The devil's chain :,"Stauter-Halsted, Keely,",2015,12/9/15,3/28/16,0,1,3,1,2,FALSE,2043,1,0
1996,6635154,X031733423,HQ118 .B37 2015,ALDERMAN,sex workers and the law / Getting screwed :,"Bass, Alison.",2015,10/28/15,4/15/16,0,1,1,1,2 17,FALSE,2057,1,0
2006,6678826,X031740934,HQ31 .B595 2015,ALDERMAN,Orgasm matters /,"Bodansky, Steve,",2015,1/21/16,1/29/16,0,1,0,1,2,FALSE,2067,1,0
2007,6709405,X031730672,HQ1236.5 .B93 S46 2015,ALDERMAN,Khin Myo Chit to Aung San Suu Kyi / The female voice of Myanmar :,"Sengupta, Nilanjana,",2015,3/23/16,3/27/16,0,0,0,1,2,FALSE,2068,1,0
2008,6709330,X031735380,HQ796 .H57 2015,ALDERMAN,new program directions / Job skills and minority youth :,"Hirsch, Barton Jay,",2015,3/23/16,3/27/16,0,0,0,1,2,FALSE,2068,1,0
2014,6437129,X031653123,HQ76.8 .U5 R58 2014,ALDERMAN,The lesbian and gay movements : assimilation or liberation? /,"Rimmerman, Craig A.,",2015,12/3/14,11/30/16,0,1,0,1,2,TRUE,2074,1,0
2020,6574358,X031707417,HQ1233 .P73 2015,ALDERMAN,Practising feminist political ecologies : moving beyond the 'green economy' /,,2015,6/24/15,10/6/16,0,0,0,1,2,FALSE,2080,1,0
2023,6447840,X031707841,HQ76.8 .U5 G3776 2015,ALDERMAN,"Gay, lesbian, bisexual and transgender civil rights : a public policy agenda for uniting a divided America /",,2015,1/21/15,10/16/16,0,1,0,1,2,TRUE,2083,1,0
2028,6653869,X031734187,HQ1088 .B65 2015,ALDERMAN,"Men, masculinity, music and emotions /","Boise, Sam de,",2015,12/9/15,2/7/16,1,1,0,1,2,FALSE,2089,1,0
2032,6640405,X031731693,HQ1236.5 .U6 B47 2015,ALDERMAN,"right-wing women, grassroots activism, and the baby boom generation / Challenge and change :","Benowitz, June Melby",2015,11/11/15,2/23/16,0,1,0,1,2,FALSE,2094,1,0
2040,6641017,X031733670,HQ759 .H1866 2015,ALDERMAN,"Bikini-ready moms : celebrity profiles, motherhood, and the body /","Hallstein, D. Lynn O'Brien,",2015,11/18/15,2/12/16,0,1,2,1,2,FALSE,2102,1,0
2057,6511358,X031708415,HQ76.2 .U5 F473 2014,ALDERMAN,Interpreting LGBT history at museums and historic sites /,"Ferentinos, Susan,",2015,2/18/15,12/1/16,0,0,0,1,2,TRUE,2119,1,0
2063,6513447,X031708908,HQ1727.5 .Z33 2015,ALDERMAN,intellectuals and ideology in the late Ottoman period / Gendering culture in greater Syria :,"Zachs, Fruma,",2015,3/23/15,4/5/16,0,2,2,1,2,FALSE,2126,1,0
2068,6661441,X031732279,HQ1170 .E45 2015,ALDERMAN,"Women, Islam, and Abbasid identity /","El-Cheikh, Nadia Maria,",2015,12/16/15,12/22/15,0,1,0,1,2,FALSE,2132,1,0
2069,6502355,X031704910,HQ1219 .J44 2015,ALDERMAN,harmful cultural practices in the West / Beauty and misogyny :,"Jeffreys, Sheila,",2015,2/11/15,4/28/16,0,2,2,1,2,FALSE,2134,1,0
2070,6445299,X031704537,HQ18 .G7 L69 2015,ALDERMAN,"Love and romance in Britain, 1918-1970 /",,2015,1/14/15,9/1/16,0,1,6,1,2,TRUE,2135,1,0
2078,6562540,X031706428,HQ281 .S65 2015,ALDERMAN,Preventing human trafficking : education and NGOs in Thailand /,"Spires, Robert Weber,",2015,5/20/15,9/6/16,0,0,0,1,2,FALSE,2143,1,0
2080,6573606,X031707306,HQ1793 .M4 2015,ALDERMAN,women in Egypt's Islamic awakening / Soft force :,"McLarney, Ellen Anne,",2015,6/17/15,4/28/16,0,1,3,1,2,FALSE,2145,1,0
2117,6563446,X031706808,HQ759.5 .T95 2015,ALDERMAN,"Outsourcing the womb : race, class and gestational surrogacy in a global market /","Twine, France Winddance,",2015,5/27/15,4/24/16,0,1,1,1,2,FALSE,2183,1,0
2122,6640969,X031733646,HQ1206 .T4676 2015,ALDERMAN,"Covered in ink : tattoos, women, and the politics of the body /","Thompson, Beverly Yuen,",2015,11/18/15,12/9/15,0,1,0,1,2,FALSE,2188,1,0
2131,6641047,X031733542,HQ471 .Z58 2015,ALDERMAN,rewriting the sexual in women's pornography / Explicit utopias :,"Ziv, Amalia,",2015,11/18/15,11/29/15,0,1,0,1,2,FALSE,2197,1,0
2132,6678694,X031732395,HQ76.3 .U5 W35 2015,ALDERMAN,The straight line : how the fringe science of ex-gay therapy reoriented sexuality /,"Waidzunas, Tom,",2015,1/20/16,1/25/16,0,0,0,1,2,FALSE,2198,1,0
2136,6677982,X031734114,HQ1170 .A798 2015,ALDERMAN,Asian Muslim women : globalization and local realities /,,2015,1/15/16,1/25/16,0,0,0,1,2,FALSE,2202,1,0
2137,6677894,X031732380,HQ525 .J4 L68 2015,ALDERMAN,"Love, marriage, and Jewish families : paradoxes of a social revolution /",,2015,1/15/16,1/25/16,0,0,0,1,2,TRUE,2202,1,0
2140,6552883,X031706184,HQ1090 .G684 2015,ALDERMAN,why men fight and why we like to watch / The professor in the cage :,"Gottschall, Jonathan,",2015,5/13/15,4/13/16,0,1,0,1,2,FALSE,2205,1,0
2152,6502425,X031704782,HQ1236 .R53 2015,ALDERMAN,from daughters of destiny to iron ladies / Transnational feminist rhetorics and gendered leadership in global politics :,"Richards, Rebecca S.,",2015,2/11/15,6/8/16,0,1,2,1,2,FALSE,2218,1,0
2154,6428232,X031647182,HQ682 .C66 2015,ALDERMAN,Configurations of family in contemporary Japan /,,2015,11/18/14,4/28/16,0,2,1,1,2,FALSE,2220,1,0
2159,6663756,X031732326,HQ756 .F3824 2015,ALDERMAN,promoting positive father involvement / Fathering :,,2015,1/4/16,1/7/16,0,0,0,1,2,FALSE,2226,1,0
2164,6644383,X031714067,HQ1742 .T75 2013,ALDERMAN,"Tribal women : yesterday, today and tomorrow /","""Tribal Women: Status, Challenges, and Possibilities"" (Seminar)",2015,12/3/15,1/26/16,0,0,0,1,2,FALSE,2231,1,0
2168,6576232,X031732589,HQ1728.5 .Z75 K37 2015,ALDERMAN,Return : a Palestinian memoir /,"Karmi, Ghada,",2015,7/6/15,2/1/16,0,1,0,1,2,FALSE,2235,1,0
2194,6530154,X031705479,HQ77.9 .F4313 2015,ALDERMAN,The making of a man : notes on transsexuality /,"Februari, M.,",2015,3/25/15,12/7/15,0,2,2,1,2,FALSE,2264,1,0
2200,6552815,X031706376,HQ756 .G6194 2015,ALDERMAN,fathers and fatherly roles in late medieval Basel / Affectionate authorities :,"Grace, Philip David,",2015,5/13/15,5/18/16,0,0,0,1,2,FALSE,2271,1,0
2208,6643259,X031733947,HQ1090 .N378 2015,ALDERMAN,Replacing misandry : a revolutionary history of men /,"Nathanson, Paul,",2015,12/2/15,12/10/15,0,0,0,1,2,FALSE,2279,1,0
2213,6643226,X031733904,HQ1438 .A19 A76 2015,ALDERMAN,women making history in the Pacific Northwest / Shaping the public good :,"(Susan Hodge), Armitage, Susan H.",2015,12/2/15,12/3/15,0,0,0,1,2,FALSE,2286,1,0
2215,6642182,X031733823,HQ73.3 .C2 G73 2015,ALDERMAN,sexual and gender minority youth in Canada / Growing into resilience :,"Grace, André P.,",2015,11/30/15,12/3/15,0,0,0,1,2,TRUE,2288,1,0
2237,6640991,X031733619,HQ1236.5 .I74 K36 2015,ALDERMAN,Bargaining for women's rights : activism in an aspiring Muslim democracy /,"Kang, Alice J.,",2015,11/18/15,11/19/15,0,0,0,1,2,FALSE,2311,1,0
2238,6640980,X031733640,HQ76.3 .U52 O456 2015,ALDERMAN,Oklahomo : lessons in unqueering America /,"Mason, Carol,",2015,11/18/15,11/19/15,0,0,0,1,2,FALSE,2311,1,0
2239,6530060,X031705455,HQ759.4 .E74 2015,ALDERMAN,life before pregnancy / On becoming a teen mom :,"Erdmans, Mary Patrice,",2015,3/25/15,2/2/16,1,1,0,1,2,FALSE,2312,1,0
2252,6640417,X031731692,HQ1236.5 .P7 M57 2015,ALDERMAN,"the church, the state, and reproductive rights in postsocialist Poland / The politics of morality :","Mishtal, Joanna,",2015,11/11/15,11/12/15,0,0,0,1,2,FALSE,2325,1,0
2253,6640404,X031731714,HQ536 .B49 2015,ALDERMAN,new perspectives on the archaeology of historical households / Beyond the walls :,,2015,11/11/15,11/12/15,0,0,0,1,2,FALSE,2325,1,0
2254,6640478,X031731658,HQ799.7 .R59 2015,ALDERMAN,young men and the rise of lifestyle / Class acts :,"Rizzo, Mary,",2015,11/11/15,11/12/15,0,0,0,1,2,FALSE,2325,1,0
2260,6636673,X031731528,HQ16 .S465 2015,ALDERMAN,cultural and scientific encounters across the modern world / Sexology and translation :,,2015,11/4/15,11/12/15,0,0,0,1,2,FALSE,2331,1,0
2270,6617581,X031738751,HQ1137 .E3 B34 2015,ALDERMAN,"Women's letters from ancient Egypt, 300 BC-AD 800 /","Bagnall, Roger S.",2015,8/31/15,9/8/15,0,1,0,1,2,FALSE,2341,1,0
2279,6635143,X031733424,HQ1381 .P74 2015,ALDERMAN,Precarious worlds : contested geographies of social reproduction /,,2015,10/28/15,10/29/15,0,0,0,1,2,FALSE,2351,1,0
2280,6635057,X031733246,HQ766.15 .P47 2015,ALDERMAN,the morality of procreation and parenting / Permissible progeny? :,,2015,10/28/15,10/29/15,0,0,0,1,2,FALSE,2351,1,0
2327,6623750,X031733090,HQ472 .C6 J33 2015,ALDERMAN,The afterglow of women's pornography in post-digital China /,"Jacobs, Katrien,",2015,10/1/15,10/1/15,0,0,0,1,2,FALSE,2403,1,0
2338,6532444,X031709240,HQ1154 .F44555 2015,ALDERMAN,challenging backlash culture / Feminist erasures :,,2015,4/1/15,10/26/15,0,1,0,1,2,FALSE,2413,1,0
2339,6562563,X031706551,HQ21 .S65 2015,ALDERMAN,the statistics of sexual behaviour / Sex by numbers :,"Spiegelhalter, D. J.,",2015,5/20/15,9/18/15,0,1,6,1,2,FALSE,2414,1,0
