13826,5422464,X031231148,HQ1767 .T54 2011,ALDERMAN,Song dai shi ren jie ceng nü xing yan jiu /,"Tie, Aihua,",2011,10/13/11,1/1/00,0,0,0,1,2,FALSE,14853,0,0
13845,5417206,X031230677,HQ686 .C446 2011,ALDERMAN,"Taibei ba ba, Niuyue ma ma /","Chen, Junzhi.",2011,10/3/11,1/1/00,0,0,0,1,2,FALSE,14873,0,0
13855,5416533,X031192626,HQ118 .Z43 2011,ALDERMAN,nü xing gong zuo zhe bei hai wen ti jing yan yan jiu / Bian yuan de quan li :,"Zhao, Jun.",2011,9/27/11,1/1/00,0,0,0,1,2,FALSE,14883,0,0
13904,5405958,X031197156,HQ1742 .M36 2011,ALDERMAN,Empowering rural women through self help groups : an empirical study /,"Manga, B. V. L. A.",2011,8/31/11,1/1/00,0,0,0,1,2,FALSE,14938,0,0
13944,5395129,X031608905,HQ1767 .Z466 2011,ALDERMAN,Zhongguo fu nü yun dong bai nian / A hundred years of women's movement in China / All China women's federation.,,2011,8/4/11,1/1/00,0,0,0,1,2,FALSE,14984,0,0
13946,5394936,X031195969,HQ1762 .N276 2011,ALDERMAN,Rekishi ky?iku to jend? : ky?kasho kara sabukaruch? made /,"Nagano, Hiroko,",2011,8/3/11,1/1/00,0,0,0,1,2,FALSE,14986,0,0
13948,5393413,X030853687,HQ18 .C6 C36 2011,ALDERMAN,Cang zai xiang di de mi mi xing shi /,"Cao, Kou,",2011,7/30/11,1/1/00,0,0,0,1,2,TRUE,14989,0,0
14030,5356235,X030818234,HQ242.5 .H36 V8 2011,ALDERMAN,prostitution and venereal disease in colonial Hanoi / L?c xì :,"V?, Tr?ng Ph?ng,",2011,6/8/11,1/1/00,0,0,0,1,2,TRUE,15077,0,0
14243,5273504,X030818286,HQ1031 .B795 2011,ALDERMAN,Jews and intermarriage in Nazi Austria /,"Bukey, Evan Burr,",2011,1/15/11,1/1/00,0,0,0,1,2,FALSE,15300,0,0
14279,5265873,X030744096,HQ799.2 .V56 V55 2011,ALDERMAN,"Violence in context : current evidence on risk, protection, and prevention /",,2011,12/21/10,1/1/00,0,0,0,1,2,TRUE,15339,0,0
512,7745969,X032221013,HQ1190 .M356 2012,CLEMONS,Doing feminist theory : from modernity to postmodernity /,"Mann, Susan Archer.",2012,10/3/18,10/12/18,0,0,0,1,3,FALSE,549,1,0
789,7267944,X031847350,HQ1190 .N484 2012,ALDERMAN,Neurofeminism : issues at the intersection of feminist theory and cognitive science /,,2012,10/24/17,5/14/18,0,1,1,1,2,FALSE,824,1,0
836,6245222,X031706669,HQ536 .H63 2012,ALDERMAN,The second shift : working families and the revolution at home /,"Hochschild, Arlie Russell,",2012,5/21/15,8/20/18,1,6,0,1,2,FALSE,872,1,0
906,7072121,X031845793,HQ1599 .E5 W623 2012,ALDERMAN,"Women, popular culture, and the eighteenth century /",,2012,5/23/17,5/7/18,0,1,3,1,2,FALSE,943,1,0
942,7326550,X031852936,HQ1421 .L68 2012,CLEMONS,Hip hop's li'l sistas speak : negotiating hip hop identities and politics in the new South /,"Love, Bettina L.,",2012,1/3/18,1/19/18,0,0,0,1,3,FALSE,981,1,0
944,7326270,X031852937,HQ1111 .W57 2012,CLEMONS,Wish to Live : the Hip-hop Feminism Pedagogy Reader /,,2012,1/2/18,1/19/18,0,0,0,1,3,FALSE,983,1,0
992,6833368,X031758949,HQ767.5 .U5 M35 2012,ALDERMAN,Abortion in 21st century America : a matter of life/lives and/or death /,"Malbon, Craig C.",2012,8/29/16,5/8/18,0,2,4,1,2,FALSE,1032,1,0
1027,6821726,X031758688,HQ18 .U5 K365 2012,ALDERMAN,policing sex in the early republic / Taming passion for the public good :,"Kann, Mark E.",2012,8/5/16,4/25/18,0,2,6,1,2,FALSE,1066,1,0
1056,5824352,X030844697,HQ1233 .H323 2012,ALDERMAN,"sex, gender, and the end of normal / Gaga feminism :","Halberstam, Judith,",2012,10/31/12,10/12/18,7,10,4,1,2,FALSE,1096,1,0
1097,5557270,X031650061,HQ18 .C83 H36 2012,ALDERMAN,"Sexual revolutions in Cuba : passion, politics, and memory /","Hamilton, Carrie,",2012,1/16/15,6/11/18,0,5,1,1,2,FALSE,1139,1,0
1151,5563334,X031191171,HQ800.4 .U6 K56 2012,ALDERMAN,Going solo : the extraordinary rise and surprising appeal of living alone /,"Klinenberg, Eric.",2012,2/29/12,10/4/18,3,11,8,1,2,FALSE,1192,1,0
1182,5772842,X031215185,HQ76 .H2795 2012,ALDERMAN,How to be gay /,"Halperin, David M.,",2012,9/19/12,10/16/18,2,15,63,2,2 10,FALSE,1224,1,0
1190,6550170,X031725445,HQ799.8 .C8 N48 2012,ALDERMAN,"The modernity bluff : crime, consumption, and citizenship in Côte d'Ivoire /","Newell, Sasha,",2012,4/29/15,3/27/18,1,4,1,1,2,FALSE,1232,1,0
1260,5597531,X030974667,HQ1236 .I465 2012,ALDERMAN,The impact of gender quotas /,,2012,4/25/12,7/28/18,0,10,12,1,2,FALSE,1304,1,0
1283,6563761,X031649321,HQ1692 .G74 2012,ALDERMAN,feminismos en el 15-M / R-evolucionando :,"Grenzner, Joana G.",2012,5/29/15,10/1/18,0,1,20,1,2,FALSE,1328,1,0
1306,5915627,X030845090,HQ18 .U5 D45 2012,ALDERMAN,Intimate matters : a history of sexuality in America /,"D'Emilio, John.",2012,1/16/13,10/2/18,1,7,32,1,2,TRUE,1350,1,0
1312,5700995,X030395242,HQ1154 .G55 2012,ALDERMAN,The global and the intimate : feminism in our time /,,2012,3/27/17,4/14/17,1,1,0,1,2,FALSE,1356,1,0
1317,6998728,X031804205,HQ1233 .F427 2012,ALDERMAN,"Witch-hunting, Past and Present, and the Fear of the Power of Women = Hexenjagd, Vergangenheit und Gegenwart und die Angst vor der Macht der Frauen /","Federici, Silvia,",2012,3/13/17,4/20/17,0,1,0,1,2,FALSE,1361,1,0
1380,5865168,X030847060,HQ75.15 .C86 2012,ALDERMAN,Depression : a public feeling /,"Cvetkovich, Ann,",2012,12/26/12,8/3/18,0,7,4,1,2,FALSE,1428,1,0
1383,5814430,X030843971,HQ76.25 .W49 2012,ALDERMAN,"Why are faggots so afraid of faggots? : flaming challenges to masculinity, objectification, and the desire to conform /",,2012,10/10/12,9/24/18,0,7,8,1,2,FALSE,1431,1,0
1441,6876959,X031659306,HQ76.25 .P85 2012,ALDERMAN,"Gay identity, new storytelling and the media /","Pullen, Christopher,",2012,9/22/16,4/15/17,1,1,7,1,2,FALSE,1494,1,0
1519,6549478,X031657162,HQ1233 .P48 2012,ALDERMAN,Contre les publicités sexistes /,"Pietrucci, Sophie,",2012,4/24/15,2/18/18,0,1,6,1,2,FALSE,1574,1,0
1528,5842756,X030880074,HQ1127 .C637 2012,ALDERMAN,A companion to women in the ancient world /,,2012,12/4/12,10/10/18,4,5,2,1,2,FALSE,1584,1,0
1541,5915719,X031602513,HQ767.87 .R68 2012,ALDERMAN,The Routledge history of childhood in the western world /,,2012,1/16/13,8/26/18,0,5,7,1,2,FALSE,1598,1,0
1571,6424614,X031592936,HQ1742 .G476 2012,ALDERMAN,"reforms, print, caste and communalism / Gendering colonial India :",,2012,10/29/14,5/19/18,0,1,7,1,2,FALSE,1631,1,0
1582,5948819,X031602774,HQ1075.5 .E85 H55 2012,ALDERMAN,Gender : antiquity and its legacy /,"Holmes, Brooke,",2012,3/1/13,9/28/18,1,4,3,1,2,FALSE,1643,1,0
1585,5721318,X031614430,HQ12 .B47 2012,ALDERMAN,Sex and punishment : four thousand years of judging desire /,"Berkowitz, Eric.",2012,11/1/13,10/18/18,0,2,6,1,2 17,FALSE,1647,1,0
1636,6162973,X031581932,HQ1742.M463 2012,ALDERMAN,Seeing like a feminist /,"Menon, Nivedita,",2012,12/11/13,4/16/18,0,3,2,1,2,FALSE,1699,1,0
1640,5767199,X031199473,HQ1075 .F387 2012,ALDERMAN,Sex/gender : biology in a social world /,"Fausto-Sterling, Anne,",2012,9/12/12,5/12/18,0,6,31,1,2,FALSE,1703,1,0
1676,5772918,X031615043,HQ1155 .R67 2012,ALDERMAN,and the rise of women / The end of men :,"Rosin, Hanna.",2012,1/7/14,2/14/18,0,3,10,1,2,FALSE,1741,1,0
1691,5670476,X030975345,HQ76.25 .L64 2012,ALDERMAN,Masked voices : gay men and lesbians in Cold War America /,"Loftin, Craig M.",2012,5/22/12,2/21/18,1,7,17,1,2,FALSE,1757,1,0
1752,5764417,X031214880,HQ1180 .T72 2012,ALDERMAN,Transfeminist perspectives in and beyond transgender and gender studies /,,2012,9/5/12,8/20/18,3,4,4,1,2,FALSE,1817,1,0
1809,5540980,X031187185,HQ76.25 .B35 2012,ALDERMAN,The biology of homosexuality /,"(Jacques), Balthazart, J.",2012,1/25/12,5/14/18,3,6,5,1,2,FALSE,1875,1,0
1813,5580745,X030975458,HQ800.2 .T39 2012,CLEMONS,the limits of postfeminism / Single women in popular culture :,"Taylor, Anthea,",2012,3/22/12,10/25/18,0,4,7,1,3,FALSE,1879,1,0
1816,5948318,X031617776,HQ792 .U5 Y685 2012,ALDERMAN,"changing flows, changing faces / Young children of Black immigrants in America :",,2012,2/27/13,8/30/18,0,2,0,1,2,FALSE,1883,1,0
1837,5824331,X030845686,HQ76.8 .U5 S75 2012,ALDERMAN,Rethinking the gay and lesbian movement /,"Stein, Marc.",2012,10/31/12,12/21/17,0,5,1,1,2,FALSE,1902,1,0
1856,5670322,X031213783,HQ31 .D133 2012,ALDERMAN,The origins of sex : a history of the first sexual revolution /,"Dabhoiwala, Faramerz.",2012,6/27/12,10/4/18,0,5,5,2,2,FALSE,1920,1,0
1859,5841789,X030846087,HQ79 .L554 2012,ALDERMAN,"Dominatrix : gender, eroticism, and control in the dungeon /","Lindemann, Danielle J.",2012,11/26/12,9/22/18,0,2,10,1,2,FALSE,1923,1,0
1864,5822760,X030844320,HQ77.9 .T45 2012,ALDERMAN,Transgender 101 : a simple guide to a complex issue /,"Teich, Nicholas M.",2012,10/17/12,5/11/17,2,7,4,1,2,FALSE,1928,1,0
1869,6548541,X031717446,HQ1692 .B88 2012,ALDERMAN,"Las damas del liberalismo respetable : los imaginarios sociales del feminismo liberal en España, 1834-1850 /","Burguera, Mónica.",2012,4/20/15,6/13/17,1,0,0,1,2,FALSE,1933,1,0
1876,5931999,X030845178,HQ79 .O78 2012,ALDERMAN,Sexual outsiders : understanding BDSM sexualities and communities /,"Ortmann, David M.,",2012,1/23/13,12/21/17,0,4,17,1,2,FALSE,1940,1,0
1877,5711224,X031216306,HQ76.8 .U5 H57 2012,ALDERMAN,Victory : the triumphant gay revolution /,"Hirshman, Linda R.",2012,7/18/12,5/13/18,0,12,7,2,2,FALSE,1941,1,0
1891,5949255,X031618066,HQ1236 .K58 2012,ALDERMAN,The gendered effects of electoral institutions : political engagement and participation /,"Kittilson, Miki Caul.",2012,3/6/13,9/23/18,0,1,16,1,2,FALSE,1954,1,0
1894,5597213,X030945688,HQ759 .M8786 2012,ALDERMAN,Mothering and motherhood in ancient Greece and Rome /,,2012,4/21/12,10/23/18,0,3,1,1,2,FALSE,1957,1,0
1895,5841806,X030844793,HQ1190 .Z556 2012,ALDERMAN,Feminist aesthetics and the politics of modernism /,"Ziarek, Ewa P?onowska,",2012,11/26/12,5/10/18,0,3,4,1,2,FALSE,1958,1,0
1922,5822756,X030844312,HQ988 .K48 2012,ALDERMAN,a reinvented option? / Plural marriage for our times :,"Kilbride, Philip Leroy.",2012,10/17/12,9/1/18,0,2,0,1,2,FALSE,1987,1,0
1923,5823633,X030844499,HQ76.45 .U52 S683 2012,ALDERMAN,the extraordinary lives of Bible belt gays / Pray the gay away :,"Barton, Bernadette.",2012,10/24/12,5/13/18,2,3,4,1,2,FALSE,1988,1,0
1927,5764901,X031199440,HQ799 .M628 A73 2012,CLEMONS,Arab spring dreams : the next generation speaks out for freedom and justice from North Africa to Iran /,,2012,9/6/12,11/16/17,0,5,5,1,3,FALSE,1992,1,0
1934,5842062,X030846335,HQ1090.3 .V35 2012,ALDERMAN,the men of the Harvard Grant Study / Triumphs of experience :,"Vaillant, George E.,",2012,11/28/12,2/13/17,0,7,3,1,2,FALSE,1999,1,0
1948,5972970,X030608676,HQ471 .L985 2012,ALDERMAN,Porn chic : exploring the contours of raunch eroticism /,"(Annette Ferne) Lynch, Annette",2012,4/10/13,4/1/18,1,2,1,1,2,FALSE,2011,1,0
1969,5723188,X031213948,HQ1236.5 .U6 K36 2012,ALDERMAN,"The diversity paradox : political parties, legislatures, and the organizational foundations of representation in America /","Kanthak, Kristin.",2012,8/1/12,9/23/18,0,2,13,1,2,FALSE,2030,1,0
1975,5602157,X030946239,HQ1735.3 .S657 2012,ALDERMAN,South Asian feminisms /,,2012,4/28/12,1/18/18,0,5,9,1,2,FALSE,2036,1,0
1994,5604522,X030974971,HQ784 .P5 B56 2012,ALDERMAN,American child rearing and the forging of liberal society / The crucible of consent :,"Block, James E.",2012,5/9/12,10/31/18,0,2,8,1,2,FALSE,2055,1,0
1999,5626820,X031199013,HQ784 .I58 S77 2012,ALDERMAN,a common sense guide to raising kids in the digital age / Talking back to Facebook :,"Steyer, James P.",2012,5/15/12,12/7/17,0,5,5,1,2,FALSE,2060,1,0
2001,5864853,X030842384,HQ18 .C6 B8 2012,ALDERMAN,sex in China / Behind the red door :,"Burger, Richard.",2012,12/19/12,5/3/18,0,2,0,1,2,FALSE,2062,1,0
2003,5581734,X031196453,HQ146 .L7 B69 2012,ALDERMAN,Full service : my adventures in Hollywood and the secret sex lives of the stars /,"Bowers, Scotty.",2012,3/27/12,8/7/18,0,3,4,1,2 10,FALSE,2064,1,0
2013,5823664,X030844527,HQ755.8 .K346 2012,ALDERMAN,parents and the pitfalls of raising boys and girls / The gender trap :,"Kane, Emily W.",2012,10/24/12,6/6/18,0,2,0,1,2,FALSE,2073,1,0
2024,5549675,X031187635,HQ772 .M68 2012,ALDERMAN,Motives in children's development : cultural-historical approaches /,,2012,2/8/12,8/23/18,1,3,7,1,2,FALSE,2084,1,0
2026,5523343,X030947638,HQ792 .U5 I47 2012,ALDERMAN,The immigrant paradox in children and adolescents : is becoming American a developmental risk? /,,2012,1/9/12,9/13/18,2,3,2,1,2,FALSE,2086,1,0
2052,5841765,X030846148,HQ1236.5 .U6 B67 2012,ALDERMAN,"women, virtue, and vice in backlash politics / Suspect citizens :","Boryczka, Jocelyn M.",2012,11/26/12,5/22/17,3,5,3,1,2,FALSE,2114,1,0
2056,6635409,X031740556,HQ75.8 .L68 L69 2012,ALDERMAN,Lance out loud /,"Loud, Pat,",2012,10/29/15,4/21/16,0,1,3,1,2,TRUE,2118,1,0
2059,5948294,X031617830,HQ471 .W67 2012,ALDERMAN,"Internet child pornography : causes, investigation, and prevention /","Wortley, Richard.",2012,2/27/13,1/12/18,0,2,7,1,2,FALSE,2121,1,0
2072,5764430,X030843677,HQ76.34 .S74 2012,ALDERMAN,"intimate racework in lesbian, gay, and straight interracial relationships / Beyond loving :","Steinbugler, Amy C.",2012,9/5/12,5/13/18,2,2,2,1,2,FALSE,2137,1,0
2092,5580461,X030959660,HQ1180 .R48 2012,ALDERMAN,Rethinking women's and gender studies /,,2012,3/21/12,5/19/18,0,3,13,1,2,FALSE,2157,1,0
2093,5670473,X030945664,HQ1236.5 .U6 O73 2012,ALDERMAN,"political parties, gender, and representation in the state legislatures / How women represent women :","Osborn, Tracy L.,",2012,5/22/12,4/2/18,0,3,4,1,2,FALSE,2158,1,0
2097,5709990,X030946330,HQ1190 .D66 2012,ALDERMAN,Feminist theory : the intellectual traditions /,"Donovan, Josephine,",2012,6/20/12,6/22/18,0,2,0,1,2,FALSE,2162,1,0
2112,5843102,X030846410,HQ1381 .I42 2012,ALDERMAN,from labor to activism / Indigenous women and work :,,2012,12/5/12,5/24/18,0,1,3,1,2,FALSE,2178,1,0
2119,5765286,X031215205,HQ755.8 .E367 2012,ALDERMAN,causes and consequences of the politicization and polarization of the American family / The politics of parenthood :,"Elder, Laurel.",2012,9/19/12,4/2/18,0,2,3,1,2 17,FALSE,2185,1,0
2142,5714562,X031215984,HQ796 .L384 2012,ALDERMAN,Act your age! : a cultural construction of adolescence /,"Lesko, Nancy.",2012,7/11/12,5/2/18,0,2,8,1,2,FALSE,2207,1,0
2155,5629501,X030975110,HQ1421 .R44 2012,ALDERMAN,contemporary feminism in the United States / Everywhere and nowhere :,"Reger, Jo,",2012,5/16/12,5/30/18,0,2,0,1,2,FALSE,2222,1,0
2166,5824334,X030844768,HQ21 .B754 2012,ALDERMAN,Understanding asexuality /,"Bogaert, Anthony F.,",2012,10/31/12,3/3/17,0,5,1,1,2,FALSE,2233,1,0
2174,5744728,X031214923,HQ76.3 .G4 A38 2012,ALDERMAN,After the history of sexuality : German genealogies with and beyond Foucault /,,2012,9/26/12,5/14/18,0,1,5,1,2,FALSE,2243,1,0
2197,5587311,X031231733,HQ980.5 .F8 M33 2012,ALDERMAN,Bigamy and Christian identity in late medieval Champagne /,"McDougall, Sara.",2012,4/13/12,5/7/18,1,2,0,1,2,FALSE,2268,1,0
2202,6188404,X031582335,HQ1236.5 .K4 Y68 2012,ALDERMAN,Challenges at the intersection of gender and ethnic identity in Kenya /,"Young, Laura A.",2012,1/23/14,4/10/17,0,1,7,1,2,FALSE,2273,1,0
2216,5722156,X031214928,HQ76.2 .G4 W46 2012,ALDERMAN,"between persecution and freedom, 1945-69 / Male homosexuality in West Germany :","Whisnant, Clayton John,",2012,7/25/12,5/14/18,0,1,4,1,2,FALSE,2289,1,0
2225,5602673,X030960248,HQ281 .T618 2012,ALDERMAN,"Trafficking and prostitution reconsidered : new perspectives on migration, sex work, and human rights /",,2012,5/2/12,5/11/17,0,5,8,1,2,FALSE,2298,1,0
2242,5560072,X030947909,HQ766.35 .C37 2012,ALDERMAN,"Godly seed : American evangelicals confront birth control, 1873-1973 /","Carlson, Allan C.",2012,2/22/12,1/17/18,1,3,9,1,2,FALSE,2315,1,0
2261,5567891,X031218073,HQ663.9 .S53 2012,ALDERMAN,"House of stone : a memoir of home, family, and a lost Middle East /","Shadid, Anthony.",2012,3/6/12,9/8/17,0,4,1,1,2,FALSE,2332,1,0
2265,5670551,X030945671,HQ1190 .W54 2012,ALDERMAN,making feminist sense of American nationalism in U.S.-Russian relations / Imagining Russia :,"Williams, Kimberly A. (Kimberly Ann),",2012,5/22/12,5/21/18,0,1,1,1,2,FALSE,2336,1,0
2276,5811161,X031215486,HQ1426 .F885 2012,ALDERMAN,Women's figures : an illustrated guide to the economic progress of women in America /,"Furchtgott-Roth, Diana.",2012,10/3/12,10/12/17,0,2,2,1,2,FALSE,2347,1,0
2278,5709941,X031213808,HQ1236 .U49 2012,ALDERMAN,The unfinished revolution : voices from the global fight for women's rights /,,2012,6/20/12,2/17/17,2,5,11,1,2,FALSE,2350,1,0
2297,6148396,X031633042,HQ1762 .K3924 2012,ALDERMAN,Nihon ch?sei no bosei to kegarekan /,"Kat?, Mieko,",2012,10/23/13,7/5/17,0,0,0,1,2,FALSE,2371,1,0
2301,5714611,X031215956,HQ801.82 .B75 2012,ALDERMAN,The illusion of intimacy : problems in the world of online dating /,"Bridges, John C.",2012,7/11/12,4/25/17,0,4,16,1,2,FALSE,2375,1,0
2325,5710047,X031213751,HQ1090 .B463 2012,ALDERMAN,The second sexism : discrimination against men and boys /,"Benatar, David.",2012,6/20/12,11/12/17,1,2,4,1,2,FALSE,2401,1,0
2326,6289032,X031637123,HQ1236.5 .I4 O67 2012,ALDERMAN,Opportunities and challenges of women's political participation in India : a synthesis of research findings from select Districts in India.,,2012,6/18/14,8/22/16,0,1,0,1,2,FALSE,2402,1,0
2330,6268957,X031637125,HQ1236.5 .I4 V56 2012,ALDERMAN,"Violence, economics, and power decoding the impact of violence and economic insecurity on women's political participation in India.",,2012,6/12/14,8/22/16,1,1,0,1,2,TRUE,2406,1,0
2356,5709973,X030946335,HQ76.8 .U5 S76 2012,ALDERMAN,Gay rights at the ballot box /,"Stone, Amy L.",2012,6/20/12,10/13/17,0,2,2,1,2,FALSE,2432,1,0
2376,5742353,X031214482,HQ994 .B46 2012,ALDERMAN,"media, gender, and politics in Mormon fundamentalism / Polygamy in primetime :","Bennion, Janet,",2012,8/15/12,11/28/17,0,1,0,1,2,FALSE,2453,1,0
2384,5764359,X031214974,HQ515 .F474 2012,ALDERMAN,All in the family : on community and incommensurability /,"Ferguson, Kennan,",2012,9/5/12,11/3/17,2,1,0,1,2,FALSE,2461,1,0
2398,5713073,X031215793,HQ800 .C73 2012,ALDERMAN,arguments for the uncoupled / Single :,"Cobb, Michael L.",2012,7/9/12,5/9/17,0,3,4,1,2,FALSE,2475,1,0
2429,5743331,X030843587,HQ31 .E25 2012,ALDERMAN,paradoxes of the sexual revolution / Adam and Eve after the pill :,"Eberstadt, Mary.",2012,8/22/12,3/6/17,0,3,2,1,2,FALSE,2508,1,0
2439,5549732,X031187632,HQ728 .N83 2012,ALDERMAN,growing diversity and complexity / Normal family processes :,,2012,2/8/12,11/8/17,2,2,0,1,2,FALSE,2519,1,0
2465,5670557,X030975386,HQ1236 .W63855 2012,ALDERMAN,comparisons and interplay across borders / Women of the right :,,2012,5/22/12,11/15/17,0,1,0,1,2,FALSE,2547,1,0
2491,5865478,X030847117,HQ1426 .C2837 2012,ALDERMAN,Cold war progressives : women's interracial organizing for peace and freedom /,"Castledine, Jacqueline L.",2012,1/2/13,5/2/17,0,1,1,1,2,FALSE,2575,1,0
2515,5767034,X031215145,HQ1155 .M346 2012,ALDERMAN,Make your own history : documenting feminist and queer activism in the 21st century /,,2012,9/12/12,8/25/16,1,4,1,1,2,FALSE,2601,1,0
2535,5289876,X030975037,HQ458 .Z83 2012,ALDERMAN,"Cultures of the erotic in Spain, 1898-1939 /","Zubiaurre, Maite.",2012,2/24/11,5/12/18,0,2,4,1,2,FALSE,2622,1,0
2540,5541427,X031214039,HQ1784 .M367 2012,ALDERMAN,a century of transformations from within / Mapping Arab women's movements :,,2012,1/26/12,5/11/17,0,3,14,1,2,FALSE,2627,1,0
2543,5596953,X030959872,HQ76.3 .U5 B63 2012,ALDERMAN,Bodies of evidence : the practice of queer oral history /,,2012,4/20/12,3/6/17,1,3,9,1,2,FALSE,2630,1,0
2560,6548536,X031230353,HQ1236.5 .S7 M85 2012,ALDERMAN,Mujer y política en la España contemporánea (1868-1936) /,,2012,4/20/15,9/30/15,1,0,0,1,2,FALSE,2648,1,0
2569,5700918,X030945929,HQ1236.5 .U6 N53 2012,ALDERMAN,women and the postwar right / Mothers of conservatism :,"Nickerson, Michelle M.",2012,6/13/12,4/20/17,1,2,3,1,2,FALSE,2658,1,0
2613,5843061,X030850595,HQ1818.85 .W6596 2012,ALDERMAN,"gendering communities, economies, and social networks in Atlantic port cities, 1500-1800 / Women in port :",,2012,12/5/12,7/20/16,2,3,15,1,2,FALSE,2709,1,0
2624,5742333,X031214476,HQ834 .C62 2012,ALDERMAN,"Divorce with decency : the complete how-to handbook and survivor's guide to the legal, emotional, economic, and social issues /","Coates, Bradley A.",2012,8/15/12,5/1/17,0,1,0,1,2,FALSE,2720,1,0
2644,5696164,X030841713,HQ536 .H628 2012,ALDERMAN,The outsourced self : intimate life in market times /,"Hochschild, Arlie Russell,",2012,6/1/12,4/21/16,1,5,0,1,2,FALSE,2740,1,0
2654,5670450,X031215554,HQ811.5 .C87 C87 2012,ALDERMAN,Aftermath : on marriage and separation /,"Cusk, Rachel,",2012,5/22/12,6/14/17,0,1,1,1,2,TRUE,2750,1,0
2695,6075440,X031606180,HQ1240.5 .I4 W66112 2012,ALDERMAN,the road to change / Women and society :,,2012,5/30/13,4/22/16,0,2,3,1,2,FALSE,2791,1,0
2698,5557266,X030960034,HQ734 .D259 2012,ALDERMAN,the metaphysics of marriage in German idealism and romanticism / Uncivil unions :,"Daub, Adrian.",2012,2/15/12,4/11/17,0,2,0,1,2,FALSE,2795,1,0
2699,6137576,X031591384,HQ1170 .A49 2012,ALDERMAN,seeking change through a Quranic textual approach and the prophetic model / Muslim women and global challenges :,"Alwani, Zainab.",2012,10/4/13,4/28/16,0,1,2,1,2,FALSE,2796,1,0
2711,5845326,X030846585,HQ799.7 .H46 2012,ALDERMAN,why do young adults seem stuck? / Twentysomething :,"Henig, Robin Marantz.",2012,12/12/12,8/18/16,0,2,14,1,2,FALSE,2808,1,0
2767,5773437,X030842069,HQ1421 .W651 2012,ALDERMAN,Vagina : a new biography /,"Wolf, Naomi.",2012,9/20/12,5/26/16,0,3,36,1,2,FALSE,2867,1,0
2777,5710172,X030959363,HQ76.25 .L495 2012,ALDERMAN,The letter Q : queer writers' notes to their younger selves /,,2012,6/21/12,4/15/16,0,4,1,1,2,FALSE,2877,1,0
2813,5540105,X031196133,HQ798 .F58 2012,ALDERMAN,Girl land /,"Flanagan, Caitlin.",2012,1/19/12,11/2/16,0,3,4,1,2,FALSE,2913,1,0
2816,5580774,X030974812,HQ1075 .M554 2012,CLEMONS,Gender and popular culture /,"Milestone, Katie.",2012,3/22/12,4/13/17,0,1,2,1,3,FALSE,2916,1,0
2817,5604642,X031199076,HQ1593 .M36 2012,ALDERMAN,The Fifties mystique /,"Mann, Jessica.",2012,5/9/12,11/22/16,0,2,0,1,2,FALSE,2917,1,0
2818,5580488,X030959576,HQ18 .U5 K45 2012,ALDERMAN,"America's sexual transformation : how the sexual revolution's legacy is shaping our society, our youth, and our future /","Kelly, Gary F.",2012,3/21/12,6/2/16,0,4,13,1,2,FALSE,2918,1,0
2833,5865671,X031619594,HQ536 .M3243 2012,ALDERMAN,"Marriage at the crossroads : law, policy, and the brave new world of twenty-first-century families /",,2012,2/13/13,4/6/16,1,2,4,1,2 17,FALSE,2934,1,0
2861,5814405,X030844113,HQ76.3 .U5 L485 2012,ALDERMAN,gay and lesbian voices from the 1950s and 1960s / Letters to One :,,2012,10/10/12,10/3/16,1,1,0,1,2,TRUE,2962,1,0
2892,5557804,X031187862,HQ1154 .J44 2012,ALDERMAN,religion and the eclipse of women's rights in world politics / Man's dominion :,"Jeffreys, Sheila.",2012,2/15/12,11/21/16,0,2,2,1,2,FALSE,2994,1,0
2916,5597795,X030842789,HQ1075.5 .F8 G88 2012,ALDERMAN,Les équivoques du genre : devenir homme et femme à l'age romantique /,"Gutermann-Jacquet, Deborah.",2012,4/25/12,4/10/17,0,0,0,1,2,TRUE,3019,1,0
2918,5713037,X031215833,HQ1033 .C675 2012,ALDERMAN,Debating same-sex marriage /,"Corvino, John,",2012,7/9/12,9/6/15,0,5,2,1,2,FALSE,3021,1,0
2923,5722440,X031214049,HQ1662 .C575 2012,ALDERMAN,A history of women in Russia : from earliest times to the present /,"Clements, Barbara Evans,",2012,8/6/12,10/5/16,1,1,0,1,2,FALSE,3026,1,0
2937,5823401,X030846559,HQ76.2 .J3 S84 2012,ALDERMAN,Contact moments : the politics of intercultural desire in Japanese male-queer cultures /,"Suganuma, Katsuhiko.",2012,10/24/12,4/16/16,0,2,2,1,2,FALSE,3040,1,0
2986,5743368,X031214567,HQ796 .C5943 2012,ALDERMAN,"The hip-hop generation fights back : youth, activism, and post-civil rights politics /","Clay, Andreana.",2012,8/22/12,4/24/16,1,2,8,1,2,FALSE,3091,1,0
3008,5764486,X031214901,HQ1190 .F463125 2012,ALDERMAN,Feminist rhetorical resilience /,,2012,9/5/12,10/25/16,0,0,0,1,2,FALSE,3113,1,0
3043,5557273,X030960025,HQ1793 .Z75 S5387 2012,ALDERMAN,"Casting off the veil : the life of Huda Shaarawi, Egypt's first feminist /","Lanfranchi, Sania Sharawi.",2012,2/15/12,4/22/16,2,3,6,1,2,FALSE,3150,1,0
3060,6417838,X031649865,HQ232.56 .T44 F37 2012,ALDERMAN,P?r?m?n-i r?sp?gar? dar shahr-i Tihr?n /,"Farman-Farmaian, Sattareh,",2012,10/10/14,11/4/14,0,1,0,1,2,TRUE,3172,1,0
3071,6386462,X031648189,HQ1236.5 .P7 K67 2012,ALDERMAN,Kobiety w?adzy PRL /,"Koper, S?awomir,",2012,9/9/14,11/21/14,0,1,0,1,2,FALSE,3184,1,0
3084,5559897,X031196291,HQ23 .B56 2012,ALDERMAN,the surprisingly short history of heterosexuality / Straight :,"Blank, Hanne.",2012,2/21/12,8/29/15,1,5,3,1,2,FALSE,3196,1,0
3085,5742337,X031214481,HQ35.2 .S39 2012,ALDERMAN,Sex in college : the things they don't write home about /,,2012,8/15/12,2/26/16,0,2,20,1,2,FALSE,3197,1,0
3087,5722692,X030877284,HQ513 .K37 2012,ALDERMAN,"Unmarriages : women, men, and sexual unions in the Middle Ages /","Karras, Ruth Mazo,",2012,7/27/12,6/22/16,0,1,0,1,2,FALSE,3199,1,0
3090,6426866,X031719694,HQ1692 .G67 2012,ALDERMAN,el franquismo contra la mujer / Las rapadas :,"González Duro, Enrique.",2012,11/10/14,1/6/15,0,0,0,1,2,FALSE,3203,1,0
3124,5698165,X030945890,HQ1090 .S88 2012,ALDERMAN,Masculine identities : the history and meanings of manliness /,"Sussman, Herbert L.",2012,6/6/12,3/14/16,0,2,1,1,2,FALSE,3236,1,0
3176,5822742,X030844324,HQ796 .S897 2012,ALDERMAN,"Super girls, gangstas, freeters, and xenomaniacs : gender and modernity in global youth cultures /",,2012,10/17/12,2/6/16,0,1,0,1,2,FALSE,3290,1,0
3186,5697836,X031215873,HQ18 .J3 M39 2012,ALDERMAN,"Love, sex, and democracy in Japan during the American Occupation /","McLelland, Mark J.,",2012,6/6/12,1/24/16,0,2,2,1,2,FALSE,3300,1,0
3188,5670490,X030945605,HQ76.3 .B35 M87 2012,ALDERMAN,"Flaming souls : homosexuality, homophobia, and social change in Barbados /","Murray, David A. B.,",2012,5/22/12,5/16/16,1,1,3,1,2,FALSE,3302,1,0
3208,5725304,X030844147,HQ21 .A513 2012,ALDERMAN,The erotic /,"Andreas-Salomé, Lou,",2012,8/10/12,11/20/15,0,2,3,1,2,FALSE,3323,1,0
